start	end	text
3102200	3105200	Goldwaite's in a scene now?
3105200	3106200	All right.
3106200	3110200	So for real, Curtis, that whole scene, that monologue is all at risk.
3110200	3113200	Improvised entirely by him in a garage.
3113200	3115200	Because that's one of the memorable...
3115200	3116200	I know.
3116200	3117200	That's why I'm bringing it up.
3117200	3118200	It's one of the big scenes in the movie.
3118200	3119200	I do remember it.
3119200	3122200	And I have the best memory in the world.
3123200	3126200	Because I forgot that they were in that movie together.
3126200	3131200	I mean, I get to travel around a lot with Joel Murray and whom I love and adore,
3131200	3134200	who's one of the most delightful people there is.
3134200	3137200	And he's told stories about working on One Crazy Summer
3137200	3139200	about how much fun you guys had.
3139200	3140200	Yeah, it really was fun.
3140200	3143200	Like all the partying, because it was the 80s and it was groove-tastic.
3143200	3144200	It was insane.
3144200	3146200	And it was like really sexy and fun.
3146200	3147200	I remember the...
3147200	3152200	Q's like, I got this friend and he's going to put him in the movie and it was Piven.
3152200	3157200	And Piven shows up, gets hammered, jumps in the pool, cracks his face open on the bottom of the pool.
3157200	3159200	It hasn't been on camera yet.
3159200	3162200	And they had a putty in his face with mortician's wax.
3162200	3163200	That's right.
3163200	3165200	He had a big cut in his head.
3165200	3166200	Aw, Pivvy.
3166200	3167200	Aw, the Piv.
3167200	3168200	A little Pivvy.
3168200	3169200	Poor Pivvy.
3169200	3171200	Mr. Sulfridge.
3174200	3176200	Okay, enough One Crazy Summer.
3176200	3180200	But that must have been an awesome time to be young comics in...
3180200	3181200	Yeah.
3181200	3184200	When they were making big comedy films like...
3184200	3185200	Well, I remember that...
3185200	3187200	The name of it was called...
3187200	3189200	What was it? My Summer Vacation or Greedy?
3189200	3190200	My Summer Vacation.
3190200	3191200	Yeah, yeah.
3191200	3192200	They were saying...
3192200	3195200	Warner Brothers said, you can't call that because they had vacation.
3195200	3199200	And so they said, we're going to call it One Crazy Summer.
3199200	3203200	And he goes, if they put out Woody Allen movies, it'd be One Neurotic Jewish Guy.
3206200	3207200	Yeah, that's what...
3207200	3213200	I mean, well, to counter what Jeff said, I think the further back you go,
3213200	3217200	and we think in this desolate landscape of where it's catch-as-catch-can
3217200	3222200	and we just get a little giggled here and my podcast got 600 hits and I'm so happy.
3222200	3227200	And I think you talk to the Fairly Brothers about Kingpin, for example,
3227200	3232200	and you hear this story about how they almost killed themselves.
3232200	3236200	I thought Kingpin was the best Fairly Brothers movie that has ever been made,
3236200	3239200	but because the world was older than...
3239200	3241200	Like, the rules are different about...
3241200	3245200	Who's telling you what about whether or not you're being successful?
3245200	3247200	Whether or not your movie succeeded.
3247200	3252200	And the disparity between when you're supposed to celebrate...
3252200	3256200	Remember when the Sony leaks came out and it was just like...
3256200	3260200	One of the most delightful parts of the Sony leaks was Channing Tatum's email
3260200	3264200	to everybody at Sony going, yeah, bitches, we did it!
3266200	3270200	Because they just made like $740 billion in an hour for...
3270200	3271200	I don't even know which movie it was.
3271200	3274200	Godzilla vs. Men in Black or whatever, I don't know.
3274200	3276200	It doesn't matter.
3276200	3280200	But Channing Tatum was involved and he was like, yeah, bitches!
3280200	3282200	He was using Zs and exclamation points.
3282200	3285200	There's got to be a high-five emoticon.
3285200	3288200	But it really has nothing to do with whether or not...
3288200	3291200	I'm not saying whatever he was talking about was a bad movie.
3291200	3295200	I'm saying it was completely disconnected from whether it was a good or bad movie.
3295200	3300200	Because Jeff is saying, oh, that must have been a great time to be alive,
3300200	3301200	all these comedy movies.
3301200	3303200	I'm going to assume, God, no.
3303200	3310200	I'm assuming that just meant that more hilarious people were being told more times per minute.
3310200	3311200	You really fucked up.
3311200	3313200	I can't believe you were in that piece of shit.
3313200	3315200	But you told me to be in it!
3315200	3317200	That was a piece of shit, I never said that.
3317200	3319200	Why would I do that?
3319200	3321200	I worked for Mike Ovitz, God damn it.
3321200	3322200	I was recently...
3322200	3326200	I just did coke off of the small world ride.
3332200	3337200	I was in a Talking Horse movie that put me in comedy jail.
3337200	3339200	And in my career.
3339200	3340200	Comedy jail.
3340200	3341200	And I look at the...
3341200	3344200	I was just recently moving and I found the script.
3344200	3347200	And I scribbled on it and sent it back to my manager.
3347200	3349200	I go, why would I do this?
3349200	3352200	And then he had written a dollar sign on it.
3355200	3357200	I'm shameful telling this.
3357200	3359200	Well, they're the opposite of therapists.
3359200	3364200	The agents tell you that you should worry about everything and money matters.
3364200	3369200	And then you go to therapy and it's like, no.
3369200	3371200	It's true.
3371200	3376200	I just make my movies so far out of the system.
3376200	3379200	And I love working on community.
3379200	3383200	I love working on people's shows that I respect and have fun.
3383200	3384200	And that's great.
3384200	3386200	And then I go make these movies.
3386200	3389200	And I don't mean to throw my agent under the bus.
3389200	3391200	I'm not going to be specific.
3391200	3392200	One of my agents.
3392200	3394200	That way I can get him off the hook.
3396200	3399200	He called me up and he said...
3399200	3400200	Because it was in the trades.
3400200	3403200	And he goes, hey, Sundance.
3403200	3405200	And I go, yeah, yeah, yeah.
3405200	3407200	You made another movie.
3409200	3411200	It's an actual quote.
3411200	3413200	I was like...
3414200	3417200	He wasn't along to the right...
3417200	3421200	I just go do them and let them catch up, you know?
3421200	3422200	Wow.
3422200	3423200	I don't know.
3423200	3425200	What's your agency?
3425200	3427200	Is that a personal question?
3427200	3431200	At this point, I was just wondering if you're UTA or not.
3431200	3433200	But I was a...
3433200	3434200	I didn't...
3434200	3436200	This is an age thing.
3436200	3438200	And I think I regard it as like...
3438200	3440200	Oh, I guess I made it.
3440200	3443200	I'm a character in a movie about people that make things because...
3443200	3447200	I had a meeting at my agency and I went to the wrong building.
3447200	3450200	They had moved four years ago.
3450200	3452200	Because I don't...
3452200	3453200	I'm an autopilot.
3453200	3457200	Somebody goes, what's that dumb fuck doing?
3457200	3459200	If they want to be in business with a dumb fuck, they...
3459200	3463200	Do they ever send you things for you to...
3463200	3464200	You know what I mean?
3464200	3465200	That you didn't create?
3465200	3466200	Yeah.
3466200	3468200	Especially now that I'm trying to do this studio thing.
3468200	3472200	I'm trying to become a suit because I'm a fucking horrible self-destructive person.
3472200	3474200	And really insecure.
3474200	3476200	But I'm trying to...
3476200	3479200	Because I get scripts, which is new for me.
3479200	3480200	And then...
3480200	3482200	I should just read my emails.
3482200	3484200	This is a very well-written script.
3484200	3488200	And I hate everyone who wrote it.
3488200	3494200	If I ever see them, I'm going to punch them all in the throat.
3494200	3495200	It's a pass.
3495200	3497200	And then I wrote, P.S.
3497200	3499200	If this email does get hacked by the North Koreans,
3499200	3503200	I'm a really big fan of their irreverent brand of humor.
3503200	3506200	And I wish them more continued success.
3506200	3507200	Yeah.
3507200	3509200	I mean, I think at a certain point, don't you...
3509200	3511200	Because I think...
3511200	3516200	It's that movie archetype of your agent should just have the pork pie hat.
3516200	3519200	He's just like a really old guy that's just like...
3519200	3521200	You can't leave him now.
3521200	3523200	And he's just like, I'll tell him what they call you.
3523200	3524200	You know the Bobcat deal.
3524200	3527200	The Bobcat deal is a million prescriptions.
3527200	3528200	You're just kind of like...
3528200	3533200	Well, at a certain point, you're just out there,
3533200	3536200	like a log floating on a lake.
3536200	3541200	The importance of representation becomes slightly diminished.
3541200	3547200	Well, it certainly doesn't help in the types of movies I'm trying to make.
3547200	3550200	So I just don't waste their time with that stuff.
3550200	3551200	Right.
3551200	3552200	I don't resent them.
3552200	3554200	And they'll probably try to talk you out of it.
3554200	3556200	Hey Bob, are you still doing the kinks thing or can we talk about that?
3556200	3557200	Yeah.
3557200	3560200	I mean, that's my dream project is that I wrote a screenplay
3560200	3562200	based on Schoolboys in Disgrace.
3562200	3566200	And Ray Davis has been very involved and encouraging.
3566200	3568200	That's one I hope you make.
3568200	3569200	I hope so too.
3569200	3574200	Well, you know, it's frustrating because it's, you know...
3574200	3576200	Dudes in a high school basically singing.
3576200	3579200	It seems like that formula has worked before.
3579200	3582200	I don't know why people are really so skittish around it,
3582200	3583200	but I don't know.
3583200	3586200	It's not like I'm coming to them with, you know...
3586200	3587200	What's your relationship?
3587200	3589200	It's like, hey, did he do a musical?
3589200	3594200	No, but he did that baby rape doc and he did a Bigfoot movie.
3594200	3595200	He's your man.
3595200	3596200	He's your man.
3596200	3599200	Of course he should do a musical.
3599200	3600200	I don't know what's going to go next.
3600200	3603200	I also wrote this gay Billy Jack movie, which is...
3603200	3604200	Gay Billy Jack?
3604200	3605200	Well, he's not like...
3605200	3608200	I just watched Billy Jack again a couple of days ago, like two days ago.
3608200	3610200	Cried at the end because when...
3610200	3612200	Tinsel just starts playing at the end of that.
3612200	3613200	You return to Billy Jack.
3613200	3615200	Well, the first one.
3615200	3617200	Well, there's born losers.
3617200	3619200	I'm a big Billy Jack fan.
3619200	3622200	If you guys have not seen Billy Jack, it's a great...
3622200	3625200	It's all that's great about the 70s.
3625200	3627200	But he kicks ass.
3627200	3630200	It's left to be politics, but really violent.
3630200	3635200	It's about civil rights and it's about anti-establishmentism,
3635200	3639200	Arianism, and not Arianism.
3639200	3640200	It's not about Arianism.
3640200	3641200	Yeah, you lost me.
3641200	3647200	Anti-establishmentism, Arianism, and a little bit of Nazis.
3647200	3652200	In the 70s, there had to be Kung Fu and Karate at all times.
3652200	3654200	It's so fucking good.
3654200	3657200	It's progressive politics with violence.
3657200	3659200	It's such a beautiful mixture.
3659200	3662200	I'm really proud of Jeff for resisting the urge
3662200	3664200	because what he really wants to do, because I know he knows it by heart,
3664200	3666200	he wants to do the Billy Jack.
3666200	3667200	The speech?
3667200	3668200	The Billy Jack of my life.
3668200	3669200	You know, Bernard.
3669200	3672200	You know, Bernard.
3672200	3676200	When Jill and the kids up at the school tell me not to be violent
3676200	3679200	and to be non-violent, I try.
3679200	3681200	I really try.
3681200	3682200	I'll do the whole thing.
3682200	3683200	No, keep going.
3683200	3684200	Come on, just do it.
3684200	3685200	Oh, no, no, come on.
3685200	3687200	That's just the truth.
3687200	3689200	Do it.
3689200	3690200	You can't stop now.
3690200	3691200	Bobcat, you know what I'm talking about?
3691200	3692200	The ice cream shop scene.
3692200	3693200	Of course.
3693200	3694200	But when I see...
3694200	3696200	When I see what you did with this flower...
3696200	3697200	When I see this girl...
3697200	3698200	You know what we call her back at the...
3698200	3701200	We call her God's little gift of sunshine.
3701200	3704200	And when I see this boy so degraded,
3704200	3707200	and when I think of a number of years,
3707200	3711200	he's going to have to live in his memory
3711200	3718200	this idiotic moment of yours.
3718200	3721200	I just go berserk.
3722200	3724200	Now, I'm not Jeff's agent,
3724200	3727200	and he's not auditioning for gay Billy Jack, but...
3727200	3729200	Yeah, so...
3729200	3734200	Please, everybody, YouTube, that fucking scene is so good.
3734200	3739200	So, my ex-wife, I said to her, I was like,
3739200	3742200	dude, I can't do this anymore.
3742200	3745200	I'm so tired of being broke.
3745200	3748200	I'm going to write a genre picture.
3748200	3750200	And I go, I love Billy Jack.
3750200	3751200	I'm going to write a genre picture.
3751200	3752200	I'm going to write a Billy Jack movie.
3752200	3755200	So, I'm down there writing and...
3755200	3756200	She goes, how's it going?
3756200	3758200	I go, I'm good, I'm good, I'm good.
3758200	3759200	She goes, how long are you?
3759200	3761200	And I go, about 50 pages.
3761200	3765200	He's gay now.
3765200	3771200	And she goes, so we're just going to keep renting, huh?
3771200	3774200	Go ahead and hate your neighbor.
3774200	3775200	Go ahead and cheat.
3775200	3777200	That's the whole thing.
3777200	3779200	He goes into this town, he's trying to drink his whiskey,
3779200	3781200	and someone calls him fag, and he says,
3781200	3784200	I'm going to have to ask you to stop using that word.
3784200	3786200	Yes.
3786200	3787200	Bobcat?
3787200	3788200	And he's like, what are you going to do about it?
3788200	3789200	Fag.
3789200	3791200	He goes, well, I'm going to dislocate his shoulder.
3791200	3793200	I'm going to fracture his kneecap.
3793200	3794200	I'm going to shatter...
3794200	3796200	I fucked up.
3796200	3798200	And he goes, I'm going to shatter your windpipe.
3798200	3799200	And you want to know something?
3799200	3800200	That's not a goddamn thing you do.
3800200	3804200	That's not a goddamn thing you do about it.
3804200	3807200	And then in the script it says,
3807200	3809200	it's the simplest direction I've ever written.
3809200	3813200	It just says, and he does.
3813200	3818200	So then he walks back over to the bartender,
3818200	3821200	and he finally finishes his whiskey, and he throws it down.
3821200	3824200	He says, is there a decent place for a man to stay in this town?
3824200	3832200	And then it smash cuts to him waking up in bed with the bartender.
3833200	3835200	But I've got to say, this scene sounds funny.
3835200	3837200	Make this movie.
3837200	3839200	Jeff!
3839200	3841200	If I'm not a fucking Billy Jack...
3841200	3845200	I know this sounds like it's a joke,
3845200	3851200	but I really do kind of explore all this stuff about what's it like being a gay man
3851200	3855200	and what defines sexuality.
3855200	3856200	What the fuck is wrong with me?
3856200	3857200	I'm so uncommercial.
3857200	3859200	I have no idea.
3859200	3861200	Well, yeah, I don't think you have to tell you.
3861200	3865200	Yeah, I would assume when you told me that you weren't like,
3865200	3868200	this is hilarious, these faggots are going to hate this.
3868200	3870200	Right, right. Exactly.
3870200	3873200	I'm finally letting them have it, see?
3873200	3876200	In a studio picture it would have been like, hello!
3876200	3878200	Oh God, Boat Trip?
3878200	3879200	Boat Trip.
3879200	3882200	Boat Trip is like a goddamn fucking psychedelic,
3882200	3886200	ayahuasca spirit vision.
3886200	3888200	Boat Trip is one of the most amazing...
3888200	3889200	I don't know.
3889200	3891200	If you've not seen Boat Trip,
3891200	3897200	Cuba Gooding Jr. and a series of other culprits make a movie.
3897200	3900200	It's two guys...
3900200	3906200	I think what happened is somebody was getting fired
3906200	3909200	at one of the oldest agencies in the world
3909200	3912200	and their fingers locked on their filing cabinet,
3912200	3916200	which tipped over so there was finally the script visible underneath it
3916200	3920200	and the cleaning lady at the...
3920200	3923200	or cleaning man at the agency.
3923200	3925200	Or, you know, cleaning person.
3925200	3927200	Nice save, nice save.
3927200	3931200	They put it on top of the pile so the bottom was like this Brazil thing
3931200	3933200	and the movie got green lit.
3933200	3936200	Are you sure this is the movie that was supposed to be green lit?
3936200	3939200	Two guys, it was on the top of the deck.
3939200	3943200	They go on a boat and then they find out that it's a gay boat.
3943200	3945200	We're on a gay boat.
3945200	3948200	And then they have to pretend to be gay or they got kicked off the boat
3948200	3951200	and the gay guys get to look at six tits if they want
3951200	3953200	because six don't care if gay guys look at their tits.
3953200	3956200	Those aren't some real high stakes.
3956200	3958200	The movie is like...
3958200	3963200	The movie includes Cuba Gooding Jr. coming out of a porthole
3963200	3965200	into the open air...
3965200	3966200	It's his Oscar.
3966200	3969200	And his cum splatters on someone's face.
3969200	3974200	He had won an Oscar like 30 seconds before this movie was made.
3974200	3976200	And then there were like nine movies.
3976200	3979200	Cuba Gooding Jr. won an Oscar and then had nine movies
3979200	3982200	with talking dogs and gay jokes in them.
3982200	3984200	What does the cum land on?
3984200	3985200	The cum goes out the porthole.
3985200	3987200	The cum just lands on a person.
3987200	3989200	And then you go like, oh, what about something about me?
3989200	3991200	See, in one crazy summer, that was a chili dog.
3991200	3992200	That's right.
3992200	3994200	And it landed on my friend Tony V.
3994200	3996200	And his famous line was, you kids?
3996200	3998200	Yeah, that's right.
3998200	4000200	Tony V?
4000200	4003200	Here's one of the weirdest things to look for in Boat Trip
4003200	4006200	when you rent it tonight, kids.
4006200	4009200	I'd like to mention that all my movies are available
4009200	4012200	on digital platforms.
4012200	4014200	You don't necessarily have to watch Boat Trip.
4014200	4015200	But you'll only be encouraging him.
4015200	4017200	He's a documentary filmmaker now.
4017200	4020200	Watch him after Boat Trip.
4020200	4021200	Watch Boat Trip first.
4021200	4025200	Don't encourage his faze of like, I hate America.
4025200	4026200	I'm going to tour.
4026200	4028200	I hate America.
4028200	4031200	I'm going to go to France.
4032200	4036200	There's a scene in Boat Trip where Kuma Gooding Jr.,
4036200	4039200	who is in love with the woman who thinks that he's gay,
4039200	4042200	because that's what he has had to do to survive on the boat,
4042200	4045200	the gay man, which affords him the ironic chance
4045200	4047200	to be in close quarters with her.
4047200	4050200	She's confiding with him about her single life
4050200	4052200	and how she wishes she could find a man.
4052200	4055200	And if he just keeps lisping enough,
4055200	4057200	then he gets to be with her.
4057200	4059200	And so it's very uncomfortable for him.
4059200	4065200	And at one point, the topic of conversation somehow comes to,
4065200	4069200	it either comes to how are you supposed to eat a banana
4069200	4070200	or how are you supposed to suck a dick.
4070200	4072200	But in any case, she picks up a banana,
4072200	4076200	peels the banana to show him how she sucks dick.
4076200	4079200	And so the joke is that he's going like,
4079200	4081200	ha, ha, I can't believe it.
4081200	4086200	Oh, she's sucking a banana dick in front of me.
4087200	4091200	The crazy thing, the crazy thing about it,
4091200	4094200	if you watch the movie in high def,
4097200	4101200	you can see his credibility leave the back of his head
4101200	4104200	of her licking the tip of the banana.
4104200	4106200	It's unmistakable.
4106200	4109200	The prop master, for some reason,
4109200	4112200	has like, well, not for some reason,
4112200	4116200	but for some disconnect between industry and government
4116200	4118200	and society.
4118200	4121200	The prop master has taken like a tool
4121200	4126200	and shaped like a visible penis head
4126200	4129200	into the tip of the banana.
4129200	4133200	And I love all prop masters that have ever worked with me.
4133200	4134200	You're the fucking best.
4134200	4135200	You're wizards.
4135200	4136200	You collaborate well.
4136200	4138200	I have respect for your craft.
4138200	4140200	But this is exactly the kind of thing that, you know,
4140200	4144200	if you were to take a late lunch,
4144200	4146200	you might find out that someone was like, yeah,
4146200	4149200	well, then it says in the script, it's like a dick.
4149200	4151200	So what do I do?
4151200	4153200	I fucking I'm going to get a raise today.
4153200	4155200	I'm going to make it like a dick.
4155200	4157200	And then you go, why are you making a banana like a dick?
4157200	4158200	That makes no sense.
4158200	4161200	That's so sense.
4161200	4163200	But it's like everyone on the set must have been like,
4163200	4165200	it looks like a dick.
4165200	4168200	Johnny, Johnny, get back to the set.
4168200	4171200	We're making a hit.
4171200	4174200	The banana.
4174200	4176200	The banana looks like a dick.
4176200	4177200	Get back here.
4177200	4181200	And Universal and Fox and Rupert Murdoch.
4181200	4183200	And she's like, oh, it looks like a dick.
4183200	4184200	And she's like licking it.
4184200	4185200	It looks like a dick.
4185200	4188200	They carved a dick out of a banana.
4188200	4190200	But it's so insane.
4190200	4195200	Do you think somebody just looked at the banana and was like,
4195200	4197200	I don't know if this reads like a dick.
4197200	4200200	It doesn't.
4200200	4201200	It could have just been one voice.
4201200	4202200	Do you think it was a studio note?
4202200	4203200	I don't know.
4203200	4205200	It's like, I hate bananas like that.
4205200	4206200	And I'm kind of horny.
4206200	4207200	Can we make it?
4207200	4208200	Can she be?
4208200	4211200	I feel like the banana doesn't read as a cock.
4211200	4214200	Can she be holding some kiwis?
4214200	4215200	Yeah.
4215200	4217200	It's the same guy who kept saying, I'm telling you,
4217200	4220200	this should be called gay boat trip.
4220200	4224200	I don't know why you're PC-ing the title.
4224200	4226200	It should be called gay boat trip.
4226200	4228200	We did tests on the title.
4228200	4230200	People don't care about boats.
4230200	4231200	We said gay boat trip.
4231200	4233200	They know the movie we're talking about.
4233200	4236200	It's Kuba Gooding Jr. and Carlos.
4236200	4237200	Carlos?
4237200	4238200	Who is it?
4238200	4239200	Carlos?
4239200	4240200	No, no, no, no.
4240200	4242200	It was Horatio Sands.
4242200	4244200	Horatio Sands.
4244200	4245200	Whom we loving it for.
4245200	4250200	I don't think everybody has to go home and watch it.
4250200	4251200	They already did.
4251200	4254200	Have you gone off on a boat trip rant before?
4254200	4255200	No.
4255200	4256200	I don't think so.
4256200	4257200	It's possible.
4257200	4258200	It's possible.
4258200	4259200	I mean, it's not busting your chops.
4259200	4262200	I didn't know if that was like what frosted your cake.
4262200	4263200	You know what I mean?
4263200	4267200	Like it's like, if I see that boat trip one more time.
4267200	4268200	No, I mean, I just.
4268200	4270200	I'm going to come so hard.
4270200	4273200	What frosted my cake is inscrutability.
4273200	4279200	Like when you look into it, you can't find even the most coarse,
4279200	4282200	crass, cynical explanation for it.
4282200	4283200	Yeah.
4283200	4286200	But I think movies like that make it like, you know, like I did
4286200	4287200	Sleeping Dogs Lie.
4287200	4288200	It was called Stay, originally.
4288200	4291200	But it's a rom-com.
4291200	4292200	Not a rom-com.
4292200	4295200	It's kind of a little bit more my stab at trying to do a Woody Allen movie.
4295200	4298200	But with a tiny bit of bestiality in it.
4298200	4300200	Just a little bit of bestiality.
4300200	4301200	Just a hint?
4301200	4302200	Yeah.
4302200	4303200	Just a whisper of bestiality.
4303200	4304200	That's a backstory.
4304200	4305200	That's just so.
4305200	4306200	But I think when people.
4306200	4307200	That's just so.
4307200	4308200	That's just so.
4308200	4312200	But I think when people hear about it, they think that's what they're
4312200	4313200	going to see.
4313200	4316200	You know, an actual shot of her spitting dog semen out and all this stuff.
4316200	4320200	You know, and the joke isn't like making fun of her character.
4320200	4325200	It's actually about, you know, how there's things in our past that other
4325200	4326200	people can't get past.
4326200	4328200	And she learns in that movie at the end.
4328200	4331200	She says, you know, I learned it's the living up to the lies that we tell
4331200	4333200	about ourselves that make us better people.
4333200	4334200	Yeah.
4334200	4337200	By the way, they made the same movie with an avalanche.
4337200	4340200	And everyone's like, now I accept it.
4340200	4341200	Yeah.
4341200	4345200	And they're like, in your movie, she fucks a dog.
4345200	4346200	Yeah.
4346200	4347200	But yeah.
4347200	4348200	But it's all off camera.
