start	end	text
0	17200	From Hollywood, California, the nexus of entertainment and sexiness, to the Meltdown Theater at Meltdown Comics and Nerdmelt and Melty Melts,
17700	20200	Hermitown is now in session.
26200	27200	Wow.
30200	33200	Tonight's attendance, 72,000 people.
38200	42200	Let's bring out the Game Master, Spencer Crittenden.
48200	54200	And just for old time's sake, let's bring out the mayor of Hermitown, Mr. Dan Harmon.
58200	59200	Thank you.
60200	61200	Thank you very much.
63200	66200	It's a bigger crowd. We're always sold out, but it's a...
67200	68200	Is it big? It sounds big.
69200	70200	We're always sold out.
72200	74200	But this is extra sold out.
75200	80200	I don't think we're more sold out. I think these people are just more vigorous, more exciting.
81200	87200	Let's not kid ourselves, Jeff. The reason they're packed to the rafters tonight is not because of you or me or Spencer.
88200	92200	It's because last week we pointed out there was no ice scooper.
93200	96200	Oh, shit!
96200	103200	And they wanted to be here for the big unveiling.
104200	108200	Dan, kick it off and scoop me some motherfucking ice out of that thing.
111200	113200	Spencer, talk to Jeff while I make Jeff a drink.
114200	115200	All right. Hey, how's it been going, Jeff?
116200	120200	It's been good. I've been traveling. I'm a little travel-weary, but I'm very good.
121200	122200	When did you get back in, Jeff?
122200	125200	I just got back in a couple of days ago, but it was a...
128200	130200	They love a couple of days.
142200	147200	That was a parody of when they do that, right?
148200	151200	It's like the movie Cocktail. You're Tom Cruise in here right now.
152200	153200	It was a parody.
156200	157200	Thank you, Mr. Harmon.
160200	162200	Okay, so Spencer...
163200	164200	Yeah, man.
165200	170200	What did you think about... I have to get a car, right? Spencer's been driving me around. I love it. You love it, kind of.
171200	172200	I love it. No, I love it.
173200	182200	But when you drove me... Did you register the anxiety level at UTA when we went there last week?
183200	190200	This happens... Spencer and I walk into a place together, because he drives me, and then I go, and then I'll have a meeting.
191200	194200	It's not a natural thing to have a chauffeur.
195200	200200	Well, I think it's the way of the land.
201200	206200	It's not, though. It's not the way of the waiting rooms where we go into.
207200	210200	So the person at the desk is always like, hello?
211200	218200	Spencer... Because he's like a squire. He's like an erstwhile squire. He drove me. He opened the doors.
219200	223200	He knew exactly where to go. I was just babbling about not wanting to tie my shoes the whole time.
224200	227200	Spencer gets to the desk, and then the person goes, can I help you?
227200	234200	And Spencer goes, Dan Harmon, to see whoever. Like, he announces me, which is amazing.
235200	237200	Well, I do that anywhere we go, though.
238200	244200	But then the receptionist goes, like, you're a dancer, and who's he? And he goes, no, this is Dan Harmon.
245200	247200	And then she goes, well, who are you? And he goes, I'm Spencer.
250200	253200	And then she's like, okay, do you guys want to water or Diet Coke or anything?
253200	259200	We'll take waters. And we go sit down. And then she's like, Dan and Spencer are here for the three o'clock meeting.
260200	268200	And then you just have to let it go. You're like, it would be weird at any point to, like, stop the momentum and go, like, let me explain something here.
269200	271200	That's weird and takes really long to explain.
272200	277200	Well, I think that I generally try to say, oh, don't worry about me when they ask what my deal is.
278200	286200	Well, don't you worry. I'll just be over here six feet tall with a two foot long beard.
287200	290200	I'll just be hiding over here the most interesting looking guy in the universe.
291200	294200	Don't worry about me, like, needs more context than that.
295200	302200	It shouldn't. I mean, those people, they're all about hospitality, so they just want to make sure we're adequately respected,
302200	306200	which is, you know, it comes to odds because I don't need that in those situations.
307200	311200	That's the last thing I need is validation from, you know, secretarial staff.
314200	321200	Is there a validation Spencer that you do, like, want or crave? Is there something you would like to hear from staff or anything?
322200	323200	From staff?
323200	324200	From strangers?
325200	330200	Well, I just want to just don't walk slowly, I think.
331200	332200	That'd be good enough.
333200	340200	What do you like to hear from people secretly, even if it's a little selfish and juvenile and not mentally healthy to want it?
341200	343200	What's something that really puts a wind in your face?
344200	348200	A secret thing you wish strangers said or thought about you as you walked into a building?
348200	361200	I like things that are useful or being useful to people. So that my manifest is I'll be all like, hey, man, did you know if you're gagging, you can put your thumb through your hand like that Buzzfeed article said, not gag.
362200	365200	And then that people will be like, that helps me. And then I'll be like, that's good.
366200	369200	But yeah, I want to. Yeah, I want to. You want to be useful.
370200	374200	I want to increase the the satisfaction of people's lives.
374200	383200	Wait. Oh, I'm sorry. You you wish people would say, give you life saving tips or you wish you wish people would say, oh, you're used.
384200	387200	I wish they'd appreciate the utility that I offer.
388200	392200	Well, you're in a good position because you have a lot of utility.
393200	400200	You're a healthy example of somebody who knows what they knows their needs and gets their needs met. That's what my therapist would say.
401200	414200	Yeah, Dan, if you walked into an office building and like in a like in a busy office corporate setting, what would you wish like the gatekeeper is like the security person or like the people that you have to walk past?
415200	417200	What do you wish they thought about you on site?
418200	419200	Whoa.
426200	427200	It is he.
428200	429200	The chosen one.
431200	440200	We better get our shit together. Like, I mean, for real, like, no, I am being for real. I mean, we're we're living in a fantasy world where let's let's let's make a fantasy.
441200	452200	You go into a corporate building like Century City Plaza, like to go like a business meeting, you get into an elevator, everybody in the elevator.
453200	468200	There's men, there's women, they're well dressed. You don't know what they do for a living. They could be high, low status, comparatively. What do you wish in your fantasy, selfish, egotistical brain? What do you wish everybody in that elevator was thinking?
469200	473200	Well, I had something teed up, but then you asked the wrong question.
474200	485200	Because I like my fantasy was that one of the one of the people in the whole elevator would go, oh, Mr. Harmon, no, I'm sorry. And then press a secret button on the elevator.
486200	497200	And then the side of the elevator would open. And it would be like there would be like fog and lights and I would just be like in my hoodie, like Mark Zuckerberg and I'd go to the other people.
498200	512200	So I guess the answer to your question is I wish everyone on the elevator thought, what is he doing on this elevator?
513200	520200	Pick the person on that on the elevator that you hate the most. What do you wish that person was thinking when that happened, when you went out the side door?
521200	522200	Wait, sorry, I didn't miss the time of that.
523200	531200	So you get secret side elevator door status and you have your Zuckerberg hoodie on and you leave and you're like, sorry.
532200	542200	The person that you hated the most on site when you went in the elevator, what do you wish he or she were thinking as that happened, like to make you the most happy?
543200	547200	Oh, I was wrong about football.
553200	561200	Or all the crunches in the world couldn't lift my spirit right now.
561200	576200	I had pizza for breakfast. I've eaten nothing but almonds for six weeks and he gets to go through the side of an elevator.
577200	585200	What happens? I mean, like, let's fantasize. What happens at the side of the elevator? Does it get you to the floor that you're going to faster?
585200	590200	Or does it take you to another realm?
591200	595200	Well, I mean, people go into a building and they go up and down. That's like, that's like people's shit.
596200	599200	And you'll be in a world of pure imagination.
600200	607200	The truth is that way. This is a fucking lie. This is a rat race. Oh, I hope I get to the 35th floor.
608200	614200	Psych. The real people go this way. Me and D.L. Hughley.
615200	619200	Isn't he the one with the special purple door at the airport?
620200	622200	Harman Town Deep Cut.
625200	630200	Well, I think that's, I mean, you know, we have special friends here tonight. That's probably why it's really packed.
631200	637200	I just wanted to tell you guys that I have a lot of paralysis when I when I talk to people in person.
638200	639200	But I could get into that later.
641200	643200	Like, I don't really know how to talk to people. And that's and that's that's the.
644200	648200	But I think in the last few shows you've gone through leaps and bounds where you have done very good interviews.
649200	656200	No, but you but you're talking about this is a lie up here. I'm talking about like actual like riding in the Uber when the Uber driver goes,
656200	658200	I'm going to go to Fountain.
660200	666200	He's shorter. He's shorter. You could go. You could go down Holly. We can keep going down Hollywood.
669200	673200	No, no, no. Fountain. Fountain. And then I just go.
676200	681200	I don't want because I don't want to I don't want to talk. I don't want to talk to you. And it's not even about the conflict.
681200	687200	It's like, I don't know how it hurts to talk to people. It makes it's like showering. It's like hurts my skin.
688200	698200	And like when we were in New York and I like like like when I was I was walking outside that restaurant and the waitress because it was Dino's favorite restaurant.
699200	706200	Everyone knows Dino's. Everyone knows us. And and the waitress runs into me out there and she goes, hey, how are you?
706200	713200	Hey, have you met Wes Anderson and Spike Jones? And I'm like, and she points to the window of the restaurant and there they are.
714200	719200	And I'm like, no. She's like, you should meet him. And I'm like, no, I shouldn't.
722200	732200	That's like royalty, first of all. And like I'm like, you're royalty. And I'm like, that's the problem right there is that you saying that and that whole thing being there.
732200	743200	Like I there's tears and I know what nothing to do with this. Like I if I was dragged me in and she said, Wes, Spike, do you know Dan Harmon?
744200	756200	OK, that's a nightmare. And they're like, no. And I'm like, hi. Nice to meet you. Also, I'm going to go in the back. And I could have done that anyway.
756200	761200	I don't think I would know if I sat down next to them, which one was which. I don't know. I didn't know which one was which either.
763200	770200	And I'm happy about this. We Wikipedia it later and my guess would have been wrong because they look very different.
770200	780200	But I thought I thought, you know what? These guys are masters of the lateral. I bet the guy you think is Spike Jones looks like Wes Anderson.
781200	787200	And I was right, except I was wrong. So I would have made an ass of myself.
787200	792200	So how did that cover? Did you sit with him or just walk by like like like meeting the queen?
792200	798200	I just I just I just I'm forty two. So it wasn't like I didn't I didn't like fuck. My whole goal is just leave only footprints.
798200	806200	I just I just said, I just said, hello. Nice to meet you. I made eye contact. I breathed regularly and I just I just shook their hands and I made eye contact.
806200	813200	I didn't I didn't go in for the double cup weird like sexy handshake. I just I just shook their hands. I said, hi. Nice to meet you.
813200	821200	Hi. Nice to meet you. It's very, very, very exciting and weird to meet you guys. And I and I walked away and I feel like I won by doing that.
821200	831200	Do you think that they knew who you were? No, no. I hate the question. I mean, I wonder is that you're not not a celebrity, but I wonder if you are on their radar or not.
831200	839200	But I but I well, I could have I could have like like through work, you know, having a studio and stuff like there was if I had known which one was Spike for sure by looking at him.
839200	845200	I could have there was like an in road there. I could have said, oh, we have mutual friends boobity boobity booboo.
845200	852200	But I just boned out and I think I'm a better person for it. But it wasn't but it wasn't about it wasn't about politics.
852200	858200	It wasn't about it wasn't about it wasn't about star fucking versus like nervousness or anything like that. I'm talking about like that could happen with anybody.
858200	878200	I don't like talking to anybody like like I like I've just gotten able to like do the thing like like, you know, when people with somebody says like, like, it's like I forged this world like I'm like Sauron like I like I like I created this dumb, like weird world for myself where I could be comfortable.
878200	895200	And it's like, like, every little every little aspect of it is engineered, including the fact that like, the only physical social interactions that I can handle are people like, like, like on a sidewalk going like getting excited when they see me and pointing at me.
895200	900200	So so that I know, like, it's done where there is no, we don't have to worry about anything.
900200	907200	If you meet somebody like at a restaurant or anywhere, Uber driver that doesn't know who you are, that's, that's never fun for you.
907200	911200	No, God, no, no. It's physical pain.
911200	922200	But I've been around you when I've like, when you stumble on to common ground with a stranger, and you can go Oh, you get really excited about that. But that's always when I'm being introduced to them through a friend or something like that.
922200	931200	Like when you're hanging out, you know, having drinks and some of this. Oh, this is Molly and she's a friend of someone's house. It's like, Oh, what do you do? I'm an astronaut. Oh, Jesus Christ.
931200	940200	I have like 90 astronaut questions. And then, yeah, it's it's I mean, those that that yeah, that's that's good. That's fine.
940200	949200	So that's not 90% of like how you have to talk to people like you have to talk to people who are scooping ice cream. If you like ice cream, you have to talk to the ice cream person.
949200	957200	They're like, well, how many scoops do you want? And you're just like, I can just fucking like my brain just explodes.
957200	968200	That's so funny. Because like, that's my favorite thing is what are you doing? Is that your phone? What's back here?
968200	978200	I'm like infatuated with strangers like and the the the person sitting next to you is the most interesting thing in the world to me.
978200	986200	Because of the the freefall, the chaos of that moment, when you're talking to somebody and you go, I don't know if we have anything in common at all.
986200	995200	Sometimes you find out, okay, this person is kind of a bummer or you go, Oh, this person worked on the fucking Saturn five rocket like that. That's fucking amazing.
995200	1007200	But that moment for you is more torture for. Yeah, I think we both agree that it's like falling off something and and you're just like, I love that.
1008200	1018200	I hate that. But I feel like I'm I'm honest. And you're like a Patrick Swayze thrill seeker or something.
1018200	1029200	I mean, I like it because you can find out. I can be very misanthropic and very philanthropic from moment to moment, depending on the quality of the person sitting next to you.
1029200	1039200	But it's time when like I get really endlessly fascinated by a stranger. You do, too. But you're you come at it from a very like, Holy shit.
1039200	1049200	I just got fit, fill and thropic versus misanthropic fill as like file like like pedophile like children. Yeah. Yeah.
1049200	1055200	Like like like like that's not the file word that you like are the most familiar with.
1055200	1062200	God damn it. How about you guys are always catching me. You could have started Philadelphia.
1062200	1067200	Well, I know. Well, I've done. Yeah. Philadelphia. Yeah. I'm just getting that now, though. That's what I'm saying.
1067200	1075200	Like Miss Miss, Miss, Miss, Miss, Miss, Miss, Miss Anthropy versus philanthropy. I didn't get the fill misogyny.
1075200	1088200	Well, philogeny. I love Chinese. I love those Chinese up and down Fifth Street, Fourth Avenue.
1088200	1100200	How you do, young lady? See, you got a hole where your wiener should be. Got a tiny. I love your Chinese because I'm a feminist and I'm a town.
1100200	1115200	All right. Thank you. Thanks, kids. Our next guest is no stranger to Chinese. Andrew Lloyd Webber.
1115200	1124200	I do want to bring him out because we're it's hot up here. And I want you to see that I'm not the only one that sweats this much.
1124200	1131200	And I guess I always feel like I think you guys know it's hot in this room, but it's six degrees cooler where you're sitting.
1131200	1142200	I'm telling you. And then you look at me and you go, he's so disgusting. I'm hotter than you. Just a little hotter.
1143200	1158200	There's people sitting out there fanning themselves right now. It's like the like to kill a mockingbird, you know, it's I just come to bust up a ship a rope.
1158200	1166200	It's so hot in here that that civil rights are being like are back on the table.
1166200	1172200	It's automatically when it gets hot enough, every play, every room becomes a southern courtroom.
1172200	1179200	Tech textbooks may not be allowed in science class tomorrow, depending on what happens tonight, because it's so hot.
1179200	1184200	It's the next guest is Gregory Peck, everybody.
1184200	1193200	Old friend of the show. We miss him very much, but we're so glad he spent some time away because he's been busy and has done something really incredible.
1193200	1199200	Not that he had not done all kinds of incredible things. We were we were happy with him quite the way he was.
1199200	1207200	But he kind of if you're talking about the person I think you're talking about, he just deals in incredible humanity all the time.
1207200	1212200	That's what he does. He does it. And he does it for no reason. He does it because it's what he does.
1212200	1218200	It's he he's a magical like magic person. He's a magical magic person.
1218200	1223200	He's our friend. And let's talk about his new project, which everybody is going to be really excited to see.
1223200	1239200	Please welcome back Bobcat Goldthwaite.
1239200	1243200	Thank you.
1243200	1251200	That's really nice. You're what you the idea that people would be excited and happy to see that.
1251200	1258200	That's the worst thing that could happen to me. Oh, when people when people go, oh, well, people are happy and excited to see me.
1258200	1268200	I just don't want them to to I just want them to be normal. Well, you you're you're you're you're an actor turned director probably for the same reason.
1268200	1279200	And like your circumstances are so different. Like the idea that anybody would ever see me and point is is like kind of like it's for me.
1279200	1286200	That's the same as saying you should be prom king. But for what you're probably perceiving, that moment is like, oh, that's the guy from Police Academy.
1286200	1291200	This comes. Yeah. Yeah. I was in Detroit at a film festival and this guy's like, I'm your biggest fan.
1291200	1301200	And I took a picture with him and he's like, what do you do now?
1301200	1307200	You can. My biggest fan does not have access to IMDB. That's what I learned there.
1307200	1313200	And then but it was a good question. What would you want people to say, though, because they still have a big ego.
1313200	1320200	Like if they had I want them after I left that was him. I blew it. You know, so I do have a big ego.
1320200	1337200	I just kind of sad. But you're I mean, one of the things that's amazing about you now is that you're you you you you accomplish things psychologically that other people think are just kind of theories from from from from therapy and stuff.
1337200	1346200	Well, fuck you, Harmon, just talk. You had you've had to have a breach birth career wise in terms of because I had the game out first. Yeah.
1346200	1354200	I had the career most people have at the beginning at the end. Like I sold out at the beginning. Well, maybe I mean, it's just like you can use those words.
1354200	1363200	But but just more more to more to the objective point, like like you're you were first to famous for your hair and your voice and your face.
1363200	1368200	Yes. And I mean, you're not that you were not that that is not to say that your stand up wasn't awesome.
1368200	1375200	The but but people were like, my mom was like, that's the guy. That's the screechy screechy guy with the hair.
1375200	1382200	And then and then you. Yeah. And then you. But now I'm the mumbling bald guy who's making these amazing things.
1382200	1386200	And yeah, I would imagine that. Yeah. You're in disguise when you're at the mall. You're like, God damn it.
1386200	1395200	Nobody know when somebody wins. I got I got hit by TMZ, which I was shocked. It was in New York because in L.A. no one cares.
1395200	1403200	And and they were trying to agitate me. And the guy goes, they're making another police can be the rebooting.
1403200	1410200	Don't you think they should use the original cast? And I was like, no. And they go, why not?
1410200	1419200	I go, because a lot of us are dead. And then I said, if they're going to reboot it, they should do it.
1419200	1426200	They did the 21 Jones Street. They should make it a comedy this time. And that made the broadcast.
1426200	1434200	But then I said, this is what didn't make the broadcast. I said, it's not really the right time to be doing wacky police comedies.
1435200	1445200	I was like, the police are killing civilians. You know that. Police Academy Five, Ferguson.
1449200	1454200	Oh, Mahoney. That first movie in the 80s, it was like the central point of the irony, that crawl in the beginning.
1454200	1461200	It was like, oh, this crazy government. Now they're going to let it just anybody be a police and the you know, the and then it happened.
1462200	1467200	I'm scratching my head with my gun and I'm I don't know what to do with my gun. Bang, bang, bang, bang.
1467200	1477200	And it was like a joke that and now it's like a horrible reality. I get sometimes I'll be doing shows and I'll get someone will give me the police Academy DVD.
1477200	1488200	The first one. And I wasn't in that. And I just I just I'm not in this movie. Both the way you're not you're not in the first one.
1488200	1491200	You're in this. No, I didn't think the quality of the script was there. Yeah.
1493200	1502200	We're holding out for more of a story structure. Yeah. I said, this is shit. Come back to me when there's back to me when Winslow has more of an arc.
1502200	1510200	Yeah. When when when his when his when his entire squiggle doesn't sound exactly like his Nintendo squiggle.
1510200	1518200	Well, you know, he he he's he's that is a talent. I'm not going to just diminish what he does.
1518200	1523200	But, you know, he does that all day long. Those noises like he really does.
1523200	1533200	Like if we're talking, that's his, you know, you know, and one day it was really cold and miserable and reshooting a scene for the third time.
1533200	1541200	And we're in the basement of this building, avoiding the weather. And he found the you know, the doll, the inside of a paper towel, the tube.
1541200	1553200	And so that was, you know, it was like backlit when he found it because he could just, you know, you know, and it's like Perlman with a fucking shot.
1553200	1564200	Yeah. So he, you know, he's making his helicopter farts and just we're all trying to eat.
1564200	1574200	And I and I really feel bad. So this is a public apology to him. And I just finally go, Michael, no, no, no.
1574200	1587200	Swear to God. Slow clap in the cafeteria. Slow clap. I feel really bad in my mind when I think of that story and then a marching band came out.
1587200	1594200	Riptile it from confetti around. But but they're all playing toilet paper tubes.
1594200	1601200	All right. So since the last time we saw you, I think you were talking about this early on.
1601200	1609200	You were you were shooting footage back when we first made friends. I even think you've been working on this for a little while, calling it together.
1609200	1617200	You have this. Should we call him a mentor? Very definitely a mentor. The movies is a documentary I made. It's out now called Call Me Lucky.
1617200	1628200	And I started doing comedy when I was 16. Tom Kenny was 15 in Syracuse in this town. Next door, there is an ad that said they were looking for comedians.
1628200	1635200	And so because Tommy's always been amazing with voices, he called up as like a dude, you know, like he was an adult, not a teenager.
1635200	1643200	It's like, yeah, we're a couple of comedians. I swear to God. I think Wilford Brimley is coming in to do a set tonight.
1643200	1652200	And we showed up and there's Barry, you know, he's just such a character even back then, you know, he just looked up and he said,
