start	end	text
1653200	1663200	is your parents driving? So so he, you know, if folks aren't aware of him, he's a political sadder still is.
1663200	1668200	And like my favorite Barry Cremins joke is, people say if you don't love this country, why don't you leave it?
1668200	1674200	He says, because I don't want to be victim by victimized by its foreign policies.
1675200	1685200	So a real sharp guy. And he started a club in Boston that that a lot of folks like Stephen Wright and Paula Poundstone, myself, a lot of people got their start in this room.
1685200	1690200	And he was he was definitely a mentor and the gatekeeper. Like if he thought you were derivative of anyone else, you didn't get on stage.
1690200	1696200	And so is Kevin Meaney and Steve Sweeney and Lenny Clark. All these comics came out of that scene and he he drove it.
1697200	1703200	I don't feel like the movie isn't it's about him. I think it's important people need him and stuff.
1703200	1710200	But what it's really about is is he during a performance disclosed on stage about his rapes when he was four.
1711200	1721200	And and he went, you know, then he he tried to process this. So so in the course of him processing it, he went online.
1721200	1730200	This is in the early 90s, mid 90s and AOL just started. So there was people exchanging child pornography in chat rooms and he complained to AOL and they didn't do anything.
1730200	1735200	And then he then he went to the cops and the cops in the movie say, you know, we didn't even have computers then.
1735200	1742200	So he poses kids, got all this evidence against AOL and then took AOL to the floor of the Senate during a judiciary hearing.
1742200	1748200	And it's it was like a camper story. This like, you know, nightclub comedian embarrassing this giant corporation.
1748200	1754200	And then afterwards there was a shift in him. What was the process for him? Like, like, how did he go? By the way, the movie's funny.
1754200	1765200	I know it sounds the movie's amazing. I mean, which is a story in and of itself is the fact that this is like you've made these movies that people adore because they're so punk rock.
1765200	1771200	They're so you there. And they're so there's some sort of just like if they're nothing else, they are.
1771200	1777200	They are you just trying to steer off of any conceivable road in front of you. Shakes a clown.
1777200	1784200	And like there's people there's people who like like and there's an there's an anger to that stuff, too.
1784200	1790200	So the irony is I don't see it. But yeah, I mean, you're laughing the whole time. But you're like, God bless America.
1790200	1801200	God bless America. When we shot a baby, I really thought I really it was like I wrote it, you know, she was don't you have a baby and he pumps a shotgun.
1801200	1810200	She throws it near and we shoot the baby. That was the only thing I've ever written that I thought some point someone is going to say, hey, man, you can't do this.
1810200	1817200	It never happened. I guess we're shooting a baby today. And I said, I will give me a baby that looks really ugly.
1817200	1825200	Like I wanted to look like someone shaved a pug, you know, and the baby came and it was really cute and it didn't cry.
1825200	1834200	And it would just sit there like, you know, and I feel bad about this, too. This is my men's stories.
1834200	1838200	This is a good place to do it. It's 25 years old. They love apologies and punishment.
1838200	1849200	So so so the baby didn't cry. The parents go. They come in. They go, what are we shooting today? I'm like your baby.
1849200	1858200	And then I realize nobody told him what this thing was about. So so we gave him some more money. And then that's true.
1858200	1866200	There's a stunt bump, I guess. So the baby just sat there just like this. So I have the parents with the dad.
1866200	1876200	I haven't walked off the set and the kid didn't give a shit. And then nothing took its biscuit out of its mouth.
1876200	1882200	Nothing just sat there. So then I'd love to tell you I'm a better man than this. But I got down on all fours and I put keys over the lens.
1882200	1890200	So it'd be looking in the right direction. And then I got right in the baby's face and I was like, oh, oh, oh, oh, oh, oh, oh, oh.
1890200	1901200	And the baby go. And whenever I would duck out of the way, the baby shut up immediately.
1901200	1906200	The keys were to get the attention. And then you were there to horrify the baby. Correct.
1906200	1913200	But as soon as my face wasn't there, it would just shut down. It was like that Michigan J frog, you know, like, hello, my baby.
1914200	1923200	You're running and getting the DP. You're like, I swear to God. He was crying. Sure he was, Bobcat. Free beer.
1923200	1931200	So I imagine like someday that it will be 10 and a police academy will come on and be like, ha!
1931200	1937200	And then you'll have your shot. I finally got it.
1937200	1947200	But anyways, so to whack schmaltzy about it or just at least kind of mythical, I mean, well, all of that, all of that awesome punk rock, anger, energy, whatever you call it.
1947200	1961200	You don't call it anger, but like cynical, whatever, like a non-establishment. And you had this father figure early on in your comedy career who had this scar in his life.
1962200	1971200	And then one of your, you know, you made all these different kinds of movies, like your most recent one before that is this, you know, is another weird turn for you that found footage like a Bigfoot movie.
1971200	1978200	Yeah. Yeah. Like that does not resemble Shakes the Clown that much. It's not like you're Rob Zombie trying to like, you're like, no, you don't get it yet.
1978200	1985200	No, I just like Bigfoot. The cheerleaders are dumb and they should be tortured. One more movie and I swear you're going to get it.
1986200	1995200	No, I just wanted to make a Bigfoot movie because I like Bigfoot and you cradle this guy with your, with your first documentary.
1995200	2006200	So yeah, so Barry, it's funny you say anti-establishment because I met him as a teenager and here's this guy who was totally anti-establishment and he didn't, he wasn't condescending to us. He actually encouraged it.
2006200	2015200	So, you know, that was that really, uh, how did he come out of it? Like, like, what's his, like, is he happy with what's what happened? Is that satisfying for him?
2015200	2016200	I don't think he is happy.
2016200	2021200	I mean, that's not happy, but he's the first one to make those jokes.
2021200	2037200	There's a scene in the movie where, uh, he actually goes into the basement that this happened in and I was just filming the basement because I thought that was way more powerful just to show these spaces, but I did not want him to go in there.
2037200	2047200	And he goes, you go through a problem, you know, you don't go around it. This isn't, there's no demons. I'm demystifying this space. I'm going down there. You can film it or not.
2047200	2048200	Had he been back there since?
2048200	2051200	No, no. He says it's not a place I like to hang out.
2051200	2052200	This is the first time when you read.
2052200	2064200	Yeah. So he, he was like, um, so we had a huge argument and, and, and, and I said, well, we just give me five minutes so I can roll and it's in the movie and it's very powerful.
2064200	2070200	And there was a reason I was trying to remember it, but, but one of the things happened is he's very eloquent in the basement.
2070200	2076200	And then afterwards, cause I knew it would happen. He went into shock, you know, he does this weird thing when he's going into shock and I knew that it was in shock.
2077200	2082200	And he goes, I can't remember what I said. Is any of it usable? And I said, oh, it doesn't matter. I'm going to play yakety sacks.
2088200	2096200	He said, um, and we were doing a Q and a and I said, you know, and I wanted to film the spaces and I didn't, I didn't want to do reenactments.
2096200	2098200	And he goes, you didn't want to do reenactments.
2098200	2110200	It works every time. But, but, but Bob, this, this, uh, this very emerge from this, like, is that more healing for him?
2110200	2121200	Yeah. Yeah. And at the, you know, the, the point of the movie for me was to show he comes out through the other side and not only he's not a person, a victim of this, as he says, I'm not a victim anymore.
2121200	2134200	It is about coming all the way through the other side. And, and, um, you know, he starts off the movies just full of rage and he's still angry, but you know, his targets are now, you know, more directed at people.
2134200	2139200	That's what that's, that's the thing that I want people listening to this for, as far as plugging the movie is concerned.
2139200	2146200	If you're, you know, because like the tough thing about good movies, especially ones that are profound that have to do with like insights into human darkness.
2146200	2154200	Like they're not always at the top of your list, like no matter how good you know, they'll be in the act of killing and everyone says it's a great movie.
2154200	2160200	I mean, it's the most important movie you'll ever see because, but, but, but, but the thing about that is that I keep saying to people like, yeah, but don't, don't worry about it.
2160200	2167200	It will not challenge you that way at the beginning. It's, it's, it's colorful and whimsical and ironic.
2167200	2172200	It's, it's, it's that's, and your movie is similar in that sense.
2172200	2179200	It's why I texted you halfway through it and was like, this is, this is really genius because there is, and it's something about Barry too.
2179200	2190200	And I think there's, I don't think I have the IQ or the vocabulary to articulate what, what the, what the real important thing about, about what's on the microscope slide there.
2190200	2207200	It has something to do with the fact that he's really smart and really funny and really autonomous and really unafraid of the entire United States government and all of mainstream society and anyone that could ever tell him that he's gross or fat or dirty or stupid.
2207200	2225200	He, he's, but, and, and, and that he's doesn't cut the silhouette therefore of somebody who is capable of having something so just, just so that's, this is where my vocabulary breaks down.
2225200	2242200	It's just the dichotomy is very interesting to me because he's not, it's like, we're used to breaking up the world into guys like that, that are like, he, he didn't, he didn't, he didn't say, oh my God, I was molested on stage and then, and then curl up in a ball and start sucking his thumb and then become really unfunny.
2242200	2254200	He became even funnier and even smarter and even stronger, but in a process though, he had to ask himself questions about like everything that he had ever thought are done and every formation of all.
2254200	2269200	And how do you know, even those of us who don't, can't point to a big red trauma on a map, we have to go to therapy and wonder how much of what, how much of what makes people chuckle when I talk has, is unhealthy and how much of it is like, I don't know.
2269200	2281200	It's, it's, it's a really, it's an important movie for that reason. It's just a, I, this is the, here, put this on the poster. I'm gonna give you a great quote. Even if he hadn't been molested, this would be a great documentary.
2281200	2293200	Well, because he's a really, really incredible, like, like, like people go, well, you know, did you pitch this movie? It's like, where?
2293200	2299200	Bob, hey, here's a comedian that you're not familiar with. No, wait, he gets raped as a kid.
2299200	2302200	Hear me out. Hear me out.
2303200	2306200	$10 million, Mr. Goldfarb.
2306200	2323200	What was it like? Like, did you get like, what was it like the journey for you on that movie? Like, did you think that you were going to get through that without it being hard? Did you know how hard it would be for you? Like, like, what was your journey through all that darkness and all that sadness?
2323200	2339200	Yeah, there was a, it was, you know, to, you know, I was very concerned for my friend and Barry says that whenever the movie would have come first, his, his wellbeing was always more important than making a movie, even if it was a movie about it.
2339200	2343200	But it was, it's been very hard, you know, and it's weird.
2343200	2346200	What did you, what did you go through? Like, what was your journey on that?
2346200	2359200	Well, it's now, you know, we've had a lot of success with the movie and we show screenings and people, you know, really like it. So I have to deal with that. I don't like success. And then there's no,
2359200	2368200	but there's, there's often after the movie, you know, adult survivors come out when they disclose and often they're telling me this is the first time they ever did this.
2368200	2372200	So you get a full portion of that every time you show the movie.
2372200	2390200	Yeah, yeah. It's been, it's, I'm glad the movie's helping people. I'm glad it's been doing so well and people are receiving it, but you know, it's, it's, you know, the birth of the movie, and I'll talk about it here because the last time we worked together was, was here.
2390200	2403200	You know, you know, Robin Williams is my best friend and he, he knew, I wanted to do Barry's story all the way in the mid nineties. I thought, you know, we took a swipe at scripts and everything because I thought I'd want to have someone play him.
2403200	2417200	And it was Robin that's kind of suggested that I jettison that idea. I'm smiling because he was like, he's like, I'm too old to play that role anymore. He's like, he said, why don't you do it as a documentary? So, so.
2417200	2427200	Last time we talked about this was Tasha's, your daughter's birthday. And you sat down and said, how are you doing? He said, well, I had a breakup. My best friend died and I'm making a movie about child rape.
2427200	2443200	Child rape. Yeah, it was, it was even better than that. It was divorce, broke up, decorating the Christmas tree with another woman. My best friend passed away. And then yeah, for about eight to 12 hours a day, I would edit a child rape documentary.
2443200	2462200	So it was, I'm really ready to do like a talking duck movie. Just something really acid. Well, that's, I mean, here comes crackers. They were letting you shoot babies before, but now you're like, do you feel like there's like, you get the karma holsters off the leg full and you could like, you could shoot 11 babies.
2462200	2479200	Well, yeah. And everyone was like, at least there wasn't like that doc. So, but Barry wants to do a sequel. He called it, call me greedy. But so Robin was the one he said, you know, shoot as a doc. And he said, I don't have any money. And he actually gave me some money to start filming.
2479200	2491200	And that's how the whole movie got made was that you wanted him to do a live action version of him as Barry. Yeah. Yeah. That was really what I was thinking. And then, and then, and then we still were thinking about making it with someone else playing.
2491200	2507200	And Barry wrote a script that was about 350 pages long. And, and then I took a stab at a script, which actually helped the doc because I kind of had the structure in my head. And I didn't do that as a bait and switch how, how, how his disclosures reveal.
2507200	2520200	I just wanted the audience to feel exactly how I felt, knowing this guy, knowing this guy really well. And, and then learning. Oh, now it makes sense. You know, I think the 48 hours version would have been.
2521200	2538200	Raped at four comedian. And then nothing would have been funny for 45 minutes. Well, it's also like, like, like, like, I want to, I want to bring our other friend up. But I like that. That's the other powerful thing about it. Maybe this is what I was trying to articulate is the, is the fact that you do it that way.
2539200	2567200	It's an, because I feel like sickness, abuse, death, like the things that we fear, the things that we know that are the worst things that can happen to us, we tend to relate to them emotionally as diseases. And when our friends are afflicted with them, like we, we have this temptation to, like, we, it's, it's this, it's this terrible syndrome of shame and guilt and, and, and stuff that we, we go like,
2567200	2585200	Oh God, that well, this person, if this terrible thing happened to them, then, then that makes them a different kind of action figure. They need, they need special tools and backpacks and things. And they're not, it's like, but the, the, nobody is more human and more dimensionalized than Barry Clements.
2586200	2591200	Nobody has more tools to deal with any Manticore that would cross his path.
2594200	2607200	And then, and then this, this, this thing is placed in his path and we watch him eat it and watch him digest it. And we do it with him and that's, it humanizes it and it makes it a real thing, which is really,
2608200	2627200	I often wonder because if Barry, if, because he, he almost, in my mind may have been that kid at four because, because his friends were talking about some preschool revolt that he led, you know, he, they handed out books and then he threw them out the window.
2628200	2643200	They're like, we're not going to need books. So, you know, he said that when I, when he disclosed to me that my reaction wasn't, you know, someone says this to you, now it's on your lap, you know, you're re seeing this person.
2643200	2658200	And when it found, and when he told me, I was just, he said that it was almost if, you know, I, he talks very affectionately about how I reacted. I was just like, oh, you know, I was kind of not happy, but I was just like, oh, well, that makes sense.
2659200	2668200	Where did you first see him or hear him? Like, do you have any favorite jokes? Like the first jokes that like you, like, you remember like when you, when you first thought he was funny?
2668200	2682200	Oh yeah. I mean, the first time I saw him, you know, he was just the first thing I remember was just the first time I saw him walk on stage. He's, he's swilling a beer that he pulled out of his jacket and he's smoking and he's like, I'm on a health kick lately.
2682200	2697200	We've kept one of our other dear friends, a pent up in there who's like you has been, has been out in the world and we want to hear what he's been up to. Let's bring Curtis Armstrong out.
2709200	2710200	What a pleasure.
2712200	2715200	Thank you. Thank you.
2716200	2717200	Hey, buddy.
2718200	2733200	I have these, I have these friendships that I only, that literally only exist on stage and it's very unhealthy. Like, it's a very, like, like, like, but yeah, I'm just, I'm just, I'm just, I'm just explaining that I'm not a healthy person and that, that, like, that's what I was talking about earlier.
2733200	2749200	Well, that, that, that goes without saying, but what was interesting for me is that I, you know, was, I'm here because I've been away for a while and I, I asked if I could come by and he said, yeah, but of course he doesn't tell me.
2750200	2751200	Oh, that I'm here?
2751200	2758200	That you're here. So I show up just as you come out and it's the first time I think I've been in a room with him in about 30 years.
2758200	2760200	Oh, I didn't know you guys crossed paths.
2760200	2762200	We did a little, we did a movie called One Crazy Summer.
2762200	2763200	Oh, yeah.
2764200	2765200	She's just fucking crying.
2766200	2767200	She's my brain.
2767200	2769200	That was rotting away.
2769200	2770200	We keep missing each other.
2770200	2771200	That was Joel Murray, too, right?
2771200	2772200	Joel Murray, yeah, who was the guy.
2772200	2773200	Joel Murray, right.
2773200	2775200	God bless America, whom we love and adore.
2775200	2776200	John Cusack.
2777200	2779200	Why did they not make that fucking connection?
2779200	2781200	Well, that's how we met.
2781200	2794200	We were, we were in our 20s and we made that movie and it was, I, I'm a big indoor BB gun enthusiast, but at the time, at the time we made that movie, I was a big indoor model rocketry enthusiast.
2794200	2795200	Yes.
2795200	2801200	So every night I'd go back into my room and build a big rocket and then shoot it down the hallway at the hotel.
2801200	2805200	Because there was this security guard who was like, you guys are making too much noise.
2805200	2807200	And I was like, oh, I'll give you noise.
2807200	2816200	So we would sit there at lawn chairs for this poor guy to come around the corner and go, shoot, shoot, shoot, shoot, shoot.
2816200	2818200	Just rocket at him.
2818200	2820200	Yeah, that was a lot of stuff like that when we made that movie.
2820200	2821200	It was great.
2821200	2826200	And what was really great about that movie is if you see it now, there's Bill Murray, there's Joel.
2826200	2827200	Joel Murray, Joel.
2827200	2828200	Joel Murray.
2828200	2829200	Now I feel better.
2829200	2834200	Joel Murray and, and Bill and John Cusack and Demi Moore.
2834200	2835200	Demi Moore.
2835200	2843200	And what's really funny about it is he so completely took over this movie.
2843200	2844200	Wow.
2844200	2845200	No, wait, finish.
2845200	2846200	Let me finish what I'm saying.
2846200	2857200	So what happens is we all show up and we all think that we have our thing going and we know what we're doing and we have our bit.
2857200	2861200	And, you know, Cusack's got a name already and Demi's got a name already.
2861200	2869200	But after about a week on the set, they're all talking like him on camera.
2869200	2875200	Not just off camera where we're off going, you know, but on camera.
2875200	2879200	And it started like with Cusack doing it.
2879200	2881200	Remember this?
2881200	2882200	Yeah, he did a little bit.
2882200	2885200	And Joel and then Demi started doing it.
2885200	2889200	So they would be on camera doing scenes that had nothing to do with him.
2889200	2893200	And Savage Steve is like, you know, this wasn't supposed to be about Grover's family.
2893200	2898200	That's right.
2898200	2901200	So Demi was on General Hospital.
2901200	2905200	Cusack had done that Rob Reiner movie, A Sure Thing.
2905200	2908200	Everybody was coming up.
2908200	2910200	Everybody had a Haikyuu.
2910200	2915200	But Curtis, so we'd all got the dinner and nobody would recognize anybody.
2915200	2919200	And they'd always be, Booger! It's fucking Booger!
2919200	2923200	Booger! Booger, come over here!
2923200	2928200	Occasionally they'd be, Jackie Templeton, which was Demi's character on that movie.
2928200	2931200	No, it was great. It was such a great scene.
2931200	2932200	I can't believe you.
2932200	2938200	There's a scene where Steve told me later, that scene where it's with you and I.
2938200	2941200	And I say, talk about a little fat kid who was growing up.
2941200	2942200	Yes, oh God, yes.
2942200	2947200	And he goes, were you that fat kid? And I was like, no, I used to punch the shit out of him.
2947200	2949200	And I'm almost in tears telling that story.
2949200	2953200	But I didn't remember. Steve said that that was something I pitched.
2953200	2956200	You didn't pitch it. I'll tell you exactly what happened.
2956200	2962200	I'm gonna fucking die over here. I'm so happy.
2962200	2967200	I have never forgotten this because I honestly didn't know Bobcat at that point.
2967200	2973200	He was just this godlike thing that showed up on the set one day.
2973200	2976200	And you couldn't stop, you couldn't speak.
2976200	2979200	You weren't familiar with anything that you hadn't seen him.
2979200	2982200	I don't know if I'd seen him. I'd never seen him live.
2982200	2984200	So I don't think, I saw him live a lot after.
2984200	2986200	But at that time I hadn't seen him.
2986200	2990200	So, but he shows up and there's just nobody like this man in the world.
2990200	2995200	And it wasn't like he was on in that sort of Bobcat character all the time.
2995200	3001200	He wasn't doing that. But he was so interesting and so funny and so smart.
3001200	3003200	And everything, all this great stuff was coming out of him.
3003200	3006200	And you just wanted to sit and listen to him.
3006200	3011200	And so we're at lunch one day. He comes over to me and says, come here.
3011200	3014200	And he takes me into a garage.
3019200	3021200	I'm not falling for that again.
3022200	3028200	And he says, I have this idea for a scene.
3028200	3031200	And I want to run through it with you before I show Savage.
3031200	3033200	This is what happened.
3033200	3037200	So we sit down and I'm just looking at you waiting for you to start.
3037200	3043200	And you start in on that speech where you say, you know, there was this little fat kid once.
3043200	3048200	And you go through the whole thing and it's very funny if you know the movie and if you see the movie.
3048200	3050200	He's really funny.
3050200	3056200	And he tells this whole sad story about the little fat boy like he's confessing.
3056200	3063200	And I say, and I just said to him as a person, were you that little fat boy?
3065200	3069200	And he said, nobody used to beat the shit out of him.
3069200	3072200	And I thought it was the best thing I'd ever seen.
3072200	3077200	So we got Savage from lunch and we ran through it again for Savage.
3077200	3080200	And it's the big scene that he has in the movie.
3080200	3082200	And he just came up with it.
3082200	3086200	But I didn't. Yeah, I was naive about how things work.
3087200	3088200	Apparently not.
3088200	3089200	Yeah.
3089200	3090200	Apparently you could just put a scene in a movie.
3090200	3091200	Well, I wouldn't.
3091200	3092200	Yeah, I know.
3092200	3093200	You were right.
3093200	3098200	When you had me during community, I didn't do any of that shit.
3098200	3102200	You didn't come down and go, what the fuck is going on?
