start	end	text
6092980	6097180	You know what you're saying is it's wrong if you're in Spain
6097540	6102700	So keep a note of that next time you're in Spain. That's just like that's what their thought process is
6102700	6109540	It's not your thought process, but it's it's theirs. It's bad probably but and then a healthy person
6110180	6113260	Aside from going nowhere near Twitter
6113780	6115780	Which is like okay?
6116300	6120780	Conversation over because what the fuck do I have left because I already go nowhere near reddit
6120780	6125380	I don't know where near tumblr go nowhere near anything so aside from just this thing of like
6126020	6130660	Don't just don't don't get online go fly a kite go climb a rock okay great
6130660	6136140	That was it. Yeah, then the good guys win like like like like when I'm like throwing a football in the yard and
6137180	6140580	dying of old age with my dogs are not online because
6141340	6148660	Like lately yeah, that's great. That's healthy the the and then it's like so then second to that is like well
6148660	6155180	Don't feed the trolls so that means okay. I know what that looks like that looks like me going every three hours
6155300	6156740	Hey
6156740	6158540	Sisos coming up
6158540	6164620	Project hey, here's an interview with me why not and then and then I just hire a publicist to just do that for me
6165220	6171380	Then they just go like so then I'm just another account that just goes like hey. Where are my tweeples at?
6173900	6175900	I'm about to eat a chocolate bar
6176260	6178260	Hashtag me if you love chocolate
6178380	6184020	And then everyone is just like meanwhile. I did they're just going like fuck you fat fucking fucking shit face
6184300	6190580	But but I'm not on Twitter, so then the publicist is just ignoring. They don't care and everybody everybody doesn't care. That's a great society
6190580	6191500	That's great
6191500	6193460	Lately like I shouldn't be angry
6193460	6199100	I shouldn't get mad about the idea that I was like born on the internet and watching it turn into this sewer
6199100	6205700	I shouldn't like I should never have like a fit of rage about this. That's not healthy that you should always be
6205980	6210660	Unaffected by everything you should just lie to people you should never tell anyone your feelings
6210660	6215180	You should never express your feelings. You shouldn't feel your feelings. You should hate the internet
6215180	6218980	You should all use the internet, but you should all hate it. We should all therefore
6219860	6224860	Simultaneously hate everything that we constantly do let's all live a fucking lie
6224940	6232460	Let's all twist ourselves into a balloon animal where we constantly think one thing and say another and we'll enforce it amongst ourselves
6232580	6237440	By judging everyone who accidentally says like this is fucking retarded
6237680	6244120	This is insane. You're being rude. You're a rude person. I don't like you. I'm having a bad day
6244120	6247940	I fucking hate you. You're stupid. You're a stupid person
6247940	6255120	You shouldn't value television this much and you shouldn't think that I'm an elected official to the point where you could like tweet me and let
6255120	6259360	Me know that I'm a bad person and then like I'd think that something's going to happen
6259800	6267280	Like like nothing's going to happen ever nothing's ever going to happen. It's never that's sad. That's a sad thing get angry
6267400	6270900	Get mad about that like that. Nothing will ever happen
6270900	6277160	You're just typing fuck you at Tom Hanks because you saw a TV guide that offended you did you that's what they want
6277360	6279840	Stop it get mad kill yourself
6281560	6284400	Okay, kill kill kill kill kill yourself just kill yourself
6285480	6288480	Not if anyone is listening is suicidal depressed. I'm not talking to you
6289880	6293280	Don't talk to somebody but I'm talking about the people that are never going to kill themselves
6295280	6297280	Telling them kill yourself
6298280	6299280	Start by start
6299280	6301840	You know what before you even get there dip a tippy toe in it
6301840	6308200	Just tweet like fucking like at yourself all this shit like scrutinize yourself say like I'm a shitty person
6309520	6316360	Like go you just go that's what there's no fucking door twitters for like fucking like type instead of like look scanning and going like
6316360	6320040	Oh, that's racist. I'm gonna you're racist
6321040	6327440	Just like how about like an easier source of like outrage and go like I'm racist I'm racist
6329040	6335520	Look what you just did you contributed. I once tweeted something pretty biting at Ted Cruz
6336880	6344200	Nice, I hate that guy me too. It's a bad person. Yeah, it looks like he does stuff to kids
6346320	6349440	Have any of you seen him are you fucking kidding me?
6350200	6356600	I mean, I'm not saying he does but that's what he looks like. Well, and I look like I do stuff to kids a
6359200	6364400	Lot a lot I look like I love it I do look at me
6367440	6373800	If I step onto a playground shoot me based on what I look like I mean that that happens
6375640	6376680	I
6376680	6383040	Just want to swing I just want to swing so we're gonna play shadow. Yeah, and we need three helpers. Oh, yeah
6383520	6385520	Who's it you're waving Levy?
6385640	6387640	Hey, Levy, come on down
6392640	6394640	Hey you wave man
6397520	6402000	Hey, Levy, how's your mouth? Oh, that's okay. I can't really move it much. I
6402680	6404200	I
6404200	6409200	Had oral surgery. He doesn't sound funny like he used to know I sound pretty funny at first
6409200	6414600	But I still don't have full muscle. Are you how's the Viking in? Oh, it's great
6416600	6419680	Steve sound Viking him. I don't do drugs
6419680	6425400	But today I was in pain and I didn't eat anything. I wasn't thinking cuz I don't do drugs. I don't know these things
6426320	6428320	Took a viking in
6429320	6431040	He's fit for like two weeks
6431040	6436320	He's doing like like everything he says I laugh cuz he's like he he's been on the show before but you don't know
6436320	6438400	Like every you hear him every day. He's always like, okay
6438400	6442160	So here's the thing we gotta do this like I do that and I go like oh, do we have time for that?
6442160	6446160	I think we absolutely do and I go I think I'm a terrible piece of shit and I should kill myself
6446160	6448840	I don't think you should do that Dan. I think the world's counting on you
6449840	6451840	That's
6454840	6460320	That's that's that's been that's Steve's that's Steve's rule of roll in my life
6460320	6466520	I've the last year but then he has receding gums and he had gum surgery where they like like but like did kinds of
6466600	6473120	Mengele things to his mouth and and he's like this like healing and he's like, but so he's like he talks like this
6474320	6477960	I think I should kill myself and he's like don't don't do that
6479840	6486440	The world the world's counting on you that's like it's like getting a pep talk from Aubrey Plaza
6488520	6491960	It's like like I felt a bullet going faster out of the bullet I
6493240	6497920	Thought you said I had a cute voice. Well, I'd say it's adorable that your suits your soul
6498560	6502400	That I didn't realize how much of based on your voice. It was
6503400	6504840	All right
6504840	6508900	But then but then I make jokes about it. Then you start and he does don't kill yourself. Yeah
6510080	6514840	I love you. Then he's there. He's then he starts laughing and then he can't laugh because it hurts, too
6514840	6517280	Yeah, I always like that too. Is it bad? I mean like that
6517280	6520520	That's like you guys ever have a friend who like like because of some
6521280	6526240	Surgery or something like they can't laugh and they're like do you never like this is really selfish of us
6526240	6530960	Like like we don't we don't like we don't like actively become unfunny when that happens, right?
6531000	6535760	Like like it's fun. It's like amazing when somebody is like it like they can't laugh
6535760	6537760	But they're like they're like, oh
6538000	6542760	Don't make me laugh and you're like god damn it. I'm killing man. Like I'm literally killing
6543560	6547160	Like I said, is it just me or is it like there's no instinct in your head that goes like, okay
6547160	6552360	All right. I'll show because really hard Spencer. It's a nice to Spencer makes me laugh all day
6552360	6556540	Yeah, and then you came out with like grand slams all week and I tell me about some
6557960	6559960	It's all it's all fuck but
6560960	6565600	It's really hard. I tried so hard not to I think I broke a couple stitches
6566280	6568360	Definitely tasted blood a couple times. I
6569480	6571480	Just when you got it, you got it
6572600	6575800	I'm sorry. I'm sorry. You're a man. No, no, that's what it's like working for
6578920	6582840	Yeah, well, I mean, yeah, no, I needed that after this
6582840	6586960	I mean the world's our history's first guest just left like in the middle of the show
6587680	6594720	She said she had to leave during whatever no, no, no, I'm being I'm self-deprecating. I'm just saying it was a joke
6594720	6598320	You're so good Dan. She's gonna email later and be like I had a great time
6599000	6602440	No, I know. She had a good time. I was doing I was doing a bit. Come on you guys
6602440	6605800	You making me feel bad for fishing for something. I wasn't kill yourself, Dan
6609640	6611640	It didn't the bit didn't land
6611640	6615680	The audience felt the same obviously is what we learned in that moment. It was a bit
6616680	6623080	All right, so we got Levy. Let's get let's get two more people. Let's base it on what should we base it on?
6623080	6627800	Oh, let's base it on distance who made a didn't even make a pilgrimage your hand, New York
6627800	6631880	All right. We got a guy from New York. What's up? Oh shit, Canada, Canada
6636160	6638600	Let's take New York in Canada and get this over with
6640400	6643640	There's sometimes there's a guy in the back that's like
6646480	6651640	We're gonna be in New York this week. I got my ticket for Friday. Oh
6652680	6655800	Sweet. All right. So when you're not writing
6656520	6658520	40 years of classic horror novels
6663120	6665120	Actually actually
6669560	6671560	Wait, I don't
6671920	6678080	Okay, okay, well obviously that's a compensation for the fact that without any props you look identical to a lesser author
6680120	6682000	The lesser author
6682000	6688200	I'm down here promoting my ground. Okay. I hope Stephen King wouldn't be mad at me for saying he was all right fine
6688200	6690840	Sorry, Stephen King. These guys are bummed out over here
6693560	6697160	That's what I do I burn bridges oh now I'll never work with Stephen King
6697960	6699960	It has pictures
6700000	6705920	So is this just like the way it's possible with pictures. Is that I'm sorry. Are you the artist or writer?
6705920	6710560	Yes, I adapted the graphic novel for fear and loathing. Oh, okay. Well, let's yeah, let's plug that done
6711440	6717560	Are you Troy a little? Yeah, okay. It's Troy little look fear and loathing in Las Vegas and we're in a comic book story
6717560	6722000	So I'm assuming that's out there somewhere. Maybe yeah, just out there if you walk out there, you may find it
6722000	6727960	Okay, I don't think they let him leave that way but you'll come back next week. And yeah, cool. Wow. That's interesting
6727960	6729760	What a tough job?
6729840	6733080	That must have been hard. What you drew it and wrote it
6735760	6736760	All right
6736760	6740560	Yeah, you're right. I did. Yes. I guess I'm like, yeah, you know the coattails
6740560	6746800	You did the the adaptation job on the writer side like like that's pretty that's pretty amazing. This looks like impressive
6746800	6748960	What do I know? But this looks great
6749640	6755200	Did you like the movie movie is good? Yeah. Yeah books books. Excellent movie is good. Yeah. Yeah
6755200	6757200	We're actually doing a little mini tour here
6757640	6762500	We've got the red convertible out front and we're driving to Vegas on Wednesday kind of doing a recreation of the whole
6762920	6764920	Gonzo to her cool
6765640	6767640	Recreation. I really want to play Shadowrun
6768840	6771640	You know you were waving your hand in the in the booth
6773360	6778160	But you got that pained look on your face like I can't talk to a guy who adapted you can
6780760	6785440	You're selfish Steve you're selfish, okay, what have you ever done for me?
6787920	6789920	Oh
6789920	6791920	everything for the last year
6792280	6794280	Yeah
6794280	6796200	But lately
6796200	6798200	Who's this fella down here?
6801440	6807320	What's your name? My name is Aaron Aaron. Yeah. All right. Well kind of a bummer but but I
6808240	6811600	Get that but that's not what am I supposed to do walk around in a bubble?
6812360	6818520	What you're the one from New York, New York, okay, we know we I won't ask what it's like there
6818520	6820520	I know if there's a lot of buildings and they're tall
6822520	6824440	Okay, great. Well, thanks for joining us guys
6824440	6828360	Let's hand out these character sheets and let's really let's let's really knock this one out of the park
6828360	6831080	Let's really knock this one out of the park. You know, it's been
6832080	6834080	It's been a bad show. I am
6835420	6840360	You guys can you guys just fight it out just figure out what you're doing there pile of yeah
6840880	6843840	Take one. It doesn't really matter. Yeah, nothing matters
6845920	6849000	But I'll tell you what man then Harmon quest thing is turning out sweet
6849000	6855200	Oh, man, you guys got to see it Aubrey Plaza was on it. She was great. You got to see it. It'll be great
6855720	6859480	It was great. It is great. It'll great
6860040	6862040	Great. All right
6862840	6867880	And Spencer's really risen to the role of executive producer. Oh, that's very kind of you to say. Yeah
6867880	6875320	Yeah, yeah, I'm gonna go without music just in case Dustin is looking for music. He should stop
6876160	6877760	All right
6877760	6884460	Last time oh wait. No, this one's from Peter Peter Smith Peter Smith. Thanks Peter Smith last time on
6885920	6893840	After finding the stash of mp3s the team found themselves on the run from the law for the murder of an innocent security guard
6894280	6897400	But dr. Friend had a plan to shake their tail
6897880	6901640	Turn left there was the talk of a trip to Tacoma
6901640	6906480	But instead the car screeched its way back to Hank's last stand back at the bar
6906480	6909640	Eve haggled with Hank over the price of digital music
6910080	6915000	He what he said six but due to the possibility of seafood she heard eight
6915520	6921320	Wanting to get asses in all seats Hank agreed and the team was rewarded with the job done
6921320	6926340	Where will the runners head next will the budding love between friend and nightblade blossom?
6926340	6933900	Will they find the man who tried to pay them with a ghoul magnet find out now on a Harman thing I?
6934900	6939100	Got to say I listened to the last week's episode on the way here
6940620	6945100	And that kind of that seems like kind of an old night blade went to the bathroom
6946580	6948260	Hordegard lathered
6948260	6953060	Now we're caught up and then he said and then he said he found a map on the back of the soap
6953100	6958180	I mean allegedly he might have heard that well. Yeah, he's not allowed to do that stuff. That's what I said
6958180	6960180	And then Jeff said cliffhanger
6960940	6965580	Are you saying as the game master that there's no map well? I don't know let's ask hordegard
6965580	6967580	He's the one looking at the soap
6967700	6969700	Which one of you is hordegard hello?
6970460	6972020	Hello
6972020	6978340	What are you looking at that soap dispenser so intently? I have a sense about it. It feels
6980020	6982020	important
6983540	6991300	You were so chatty a minute ago, and yeah, it's a very engaging soap dispenser. I'm all about it
6993820	6999940	Can I attempt to mind link with the soap dispenser it does not have a mind okay?
7001420	7003420	Well now we know
7004100	7008640	Yeah, you found that out. I really I really want to start our next shower on
7009360	7011360	I
7011360	7013360	This guy
7018000	7024680	Someone fucking give me a mission. Who are you? I'm Eve Libertine
7028080	7031400	All right, I leave the bathroom, and I go find Eve Libertine
7031520	7037520	He's stand or she's standing saying someone give me a mission someone give me a mission hey
7038680	7041800	You want to talk about something for a while. Yeah, go ahead
7043440	7046920	We need to we know I want to make money
7047920	7055680	And and oh Steve. I accidentally killed a person. I think in the last mission and yeah a real taste for for blood
7059200	7060880	All right
7060880	7064480	Well, you know typically we don't like make our own missions
7064480	7067560	You know we we get called called with one
7067560	7073680	I know all these kooky characters come out of the woodwork and just throw us in the mix can we solicit adventures?
7074400	7081080	We go around the bar and ask anybody if they need an adventure a task or anything I know that's that's that seems professional
7081800	7086960	You guys you guys are currently the only people at the bar other than Teddy and Hank I
7087520	7089440	leave the bathroom and
7089440	7094080	Suggest we maybe call hack I and see if he knows of any one in need
7095600	7101460	All right, who's gonna call him? I think I think I think Eve Libertine should go
7102760	7104560	All right
7104560	7112640	Spencer yeah, how do I call you you have a calm link? It's like a phone all right. Let's do it calm link
7115400	7117400	Who am I talking to Ted?
7119600	7123120	Guy I think I had guy. What do you what do you want?
7124440	7128360	I'm saying man. I'm sitting at the bar five feet away
7131840	7133840	It's this Viking
7135360	7140400	Do you know anyone that wants to take us out to kill a bunch of people and make some money
7142040	7144040	No, no, I don't know about that
7146880	7148880	Shit
7149520	7152880	Outside you hear a car you hear a car pull up a
7153440	7161760	Car pulls up and into the bar walks a middle-aged blonde woman in a drab uniform the uniform of a corporate wage slave
7162400	7168120	She appears tired from the daily glonk grind and she seems to have gone a few days without sleep
7168120	7172000	She pulls up a chair and just holds up a hand and Hank gives her a drink
7172600	7173760	see
7173760	7175760	That's how you get a shadow run
7176760	7179920	All right, I gymnastics over to her
7184960	7186960	You
7187960	7192160	Use somersault that's that's that's the title. I think that's the title
7194720	7200600	Neatly over to her to rise to your feet at her side is she impressed
7200600	7206560	I'm impressed. She's startled I'd say more startled
7208400	7212040	What's your name? You don't know. Oh, don't you try talking to her?
7213840	7221400	Hey, hey, I'm real nervous. Why what's your name? My name is Peggy
7222800	7224640	All right
7224640	7226640	Sounds good to me. Yeah
7227440	7229960	Okay, I've not seen you around this bar before
7230840	7235760	This is our local watering hole and we get we get pretty drunk here all the time
7237000	7241400	Yeah, well, I come here a lot. So I don't I don't know. Let me touch the chase. I
7246040	7250760	Really want to fucking help you with something do you have any like secret missions?
7253520	7255520	Well, that's
7256640	7260720	That's just that's just uncanny
7264760	7270880	You know, I've been I've been busy lately I've been staying late at work and also my daughter's missing
7270880	7274240	It's just rough all over. Oh shit. Very the lead. Yeah
7275000	7276920	How old's your daughter?
7276920	7279000	34
7279000	7284080	14 you don't know your daughter's age. That's a little suspicious. You know, it's been it's been a couple months
7284960	7290320	Not since I've seen her since her birthday. It's hard to keep track. I can't I'm not following that
7290320	7296160	I cast analyze truth on her to see if she's telling the truth because that's a little weird
7298160	7299440	She's
7299440	7305280	Yeah, she's telling the truth. She's clearly she's clearly gone without sleep. She's a bit loopy or something
7305720	7307720	Something's off about her aura
7309040	7311360	Mind probe. Oh man
7314400	7316400	You
7317880	7324240	See all sorts of visions you see ghouls and support groups and therapy sessions and and
7324680	7329400	Daughters and child's toys all in a flash. It seems this lady
7329400	7335920	She's lost her daughter who is a victim of HM HVV. That means she's a ghoul and has to eat flesh
7336640	7342480	But she up and disappeared and it's extra scary because she might be shot to death cuz you know zombie
7344080	7346560	Well, I got a lot from that
7347960	7353200	But we don't know none of us this is horrifying. I feel like my mind was just violated randomly
7353600	7358000	It's not why I come to the bar your life's like an episode of Ninja Turtles
7358640	7360640	All right. I'll take your word for you
7363640	7367680	Sorry, that was probably me is that you feel that way
7371440	7373440	Next rounds on me
7374400	7376880	Well, yeah, we'll happily
7377800	7385040	Help you out with this situation. Listen, uh, what that's my friend Hordegarn. He's a psychic and hello
7386240	7389840	He was a pro probably probe in your mind. I don't know what he saw but he's right
7390560	7394160	us and like you do seem like a troubled person and
7395240	7399880	We are a crack troop of I guess what you'd call shadow runners. I
7400480	7404920	I give Jim that laid the thumbs up and I wink
7408640	7410120	Those
7410120	7414360	Yep, those things happen. So you have a missing daughter and
7415000	7421240	Again, forgive me for praying, but she is a ghoul. Oh, yeah. We have some experience with that and
7422040	7424040	ghoul magnets
7424600	7427800	So this one seems pretty cut and dry
7430280	7432280	Yeah
7437560	7439560	Yeah, yeah
7443560	7445560	I mean
7446760	7450960	Where did you last see her and let's get the magnet
7452880	7456520	You guys you left the magnet back at the thing I threw that through the man
7457400	7462840	I was angry at the time because it was a ghoul magnet. I I wasn't thinking maybe we need it
7463800	7466360	From mission hindsight 2020. Uh-huh
7467880	7472440	Regardless we're good enough to do it without the ghoul magnet. Oh shit
7473800	7475800	Do what?
7476600	7478600	Save your daughter lady
7479480	7484440	Sorry, this is very disorienting to have your mind read without saying anything. Hey, uh, dr
7484520	7487080	Friend, can you fucking like help this woman out from her?
7487720	7489720	Whatever just happened to her brain
7489960	7495480	Do you have a healing ability? What what does she need like some what do you need aspirin or something?
7497800	7499800	Just you know some space
7500280	7506200	Not to have my mind read and then just to have tons of people offering me all sorts of things
7506600	7508680	Well, let's uh, why don't we all like spread out?
7509480	7512280	Just gotta pretend that we're all at a bar alone together
7512920	7517240	And uh, give the lady some space. All right. I'll do that. But did I say sorry yet?
7518120	7524360	Probably. All right. Okay. Well, I give her space. Thank you. Did you did you say we're gonna save your daughter?
7525400	7528200	End of story. Let's fucking save this woman's daughter. Yeah
7528760	7530040	Oh, no
7530040	7532360	Okay, i'm just sorry. It's a little tantrum I throw
7533080	7535080	um, yeah, I mean
7535320	7537960	Look, uh, do you play uh darts anybody?
7538360	7539720	Oh
7539720	7541720	what's that and I just walk away because I
7542680	7547320	I'm not i'm not good at this and I just go and I get a drink and I go over to dr
7547320	7550040	Friend and I go jesus christ. We fucking suck at
7551240	7556920	Shadow running like we we're terrible at it. Like I know when mary odonnell walks in would it be creepy if I
7557720	7559720	sidled up next to her and
7560920	7562920	Bought her a drink
7563320	7566120	Try it been working long hours. Are you asking me?
7568280	7571720	I guess i'm asking the audience a classic ridley if I ever heard one
7572760	7575640	She seems put off by the fact that everyone's been sidling up to her
7577160	7583960	Like uh, but then again, I don't have any alternative suggestions. I mean i'm i'm i'm literally like fucking mannequins. What what?
7584840	7588760	What if we just ask her where was the last place you saw your daughter?
7589800	7591640	Oh, man
7591640	7598840	She used to be going to these these these support groups for zombies. I'm sorry. They're called hmh vv survivors
7599320	7601320	It's cool teaches them how to cope
7602120	7604920	She used to be going, you know, she went every week
7605080	7610600	She had a lot of good progress, but she didn't come back. Are they like in the basement of churches and stuff like that?
7610760	7612760	No, they they have their own storefronts
7613160	7617240	Like uh, like in like uh, you know like a real business like weight watchers
7617880	7620360	Do you know who has the sponsor of us?
7621000	7624360	No, no, none of that. All right, let's just what if we go there
7626120	7628120	Sorry, i'm a bad listener and I
7629560	7632680	Shit god damn it. You got this. Just just you got it
7637880	7639880	Excuse me for one second, ma'am
7641000	7643400	She said uh, she's her daughter went to a like a
7644120	7646120	Support group
7647640	7649400	She doesn't know which one
7649400	7653960	She was going to many she was going to all kinds of but she's a zombie. What was your favorite one?
7655560	7657720	She used to go to flesh to fresh but
7658440	7660440	Flesh to fresh up and left
