start	end	text
1520920	1525760	You know like I don't I don't you know, I don't know what's going on just in general
1525760	1530840	I don't know if I know it. I don't know what's going on. Yeah, like I I think I'm crazy
1530840	1537000	Somebody tweeted at me today like oh you do this this this and that you might have borderline personality disorder and I'm like
1537000	1541360	Okay, I'll add that to the to the list. No one has ever said that to me
1541360	1544720	I was looking it up and I was actually thinking Oh Aubrey's the guest tonight
1544720	1547760	I wonder like like like this is actually kind of interesting because there's
1548080	1551720	Now that nowadays online you can just look it up and you can just diagnose yourself
1552840	1554840	Is it let me type it in?
1555400	1557040	Talk about
1557040	1560420	Talk about what what it parks and rec was like for a second
1562040	1564960	Man Amy Poehler is a dream
1570560	1576520	Not to make it to what are you doing you're diagnosing me? No, I'm like, well, I was gonna ask you a couple questions. Yeah
1577760	1583320	I did have a stroke when I was 20. Whoa. Oh, wow. Really? Yeah, wait talk about that
1586040	1592600	Well, it just related to meant that brain that's something I think about a lot too
1594840	1598000	But like just like is it gonna happen again, yeah
1600400	1603600	Where were you where were you when when it happened I was
1604400	1611720	In Queens and I was going to I've like told this story before so well, welcome to Harman town
1614720	1620480	And I went into my friend's apartment I was gonna have lunch with them I was 20 and
1621280	1625520	Nothing weird was happening at all and I just in mid-sentence
1625520	1630080	I was talking about a Hillary Duff concert that I had taken my little sister to the
1630840	1632840	Previous that'll do it
1634240	1640160	You're drawing the wrong conclusion from this right after I said the words Hillary Duff I had a stroke
1641280	1643280	Not kidding
1643320	1648240	Goddamn it. I did a real I was like, I should have saved this thing. Wait, but what happened do you blacked out?
1648240	1651600	Oh, no, what happened was the stroke was in my left
1652800	1659140	Temporal lobe, which means that it affects the right side of my body. So my right arm was like completely
1659880	1661160	numb
1661160	1666720	Not numb, but it was just like it wasn't connected to my body and I liked didn't I was confused
1666720	1671640	I didn't know what was going on and then I had expressive aphasia for a couple days
1671640	1676480	Which is where you forget language completely and if you were talking to me
1676480	1682440	I would like understand what you're saying inside, but I wouldn't be able to respond. Oh my god, we're right. Oh
1683160	1687520	Cuz the blood clot was in my language center. And so all right Wow
1688320	1690960	Like I'm so like we've had people on the show
1690960	1695040	Well, we have a we have a friend who comes back who's like survived multiple aneurysms
1695040	1699120	And he's like he's sort of like waiting for the day because they haven't figured out any
1699800	1702600	Solution to it. So he's just like waiting for the you know
1702600	1705920	Yeah, I mean you don't really know like why that stuff happens
1706120	1708000	It's so terrifying to me
1708000	1714160	But it's also like if you were smart emotionally which I'm not and I'm sure the people that that like you that have had gone through
1714920	1719440	Are like like you would just accept the invitation that okay, you can't control anything
1719440	1723600	So why not just like be yourself and just fuck it. Yeah
1724760	1726760	Just eat that cookie
1727360	1730520	Just yeah, that's what I'm talking about in that cookie
1731280	1734600	Yeah, that's what I do eat that cookie. That's right
1735440	1737440	Give me that cookie
1737560	1742900	I'm thinking about getting a cookie like a fake cookie from a website that just sits in on a plate
1743020	1745020	It's just like cookie dot-com
1745900	1751980	Silicon and I can just like nibble on it, but it's like isn't that the responsible thing for me to do
1753020	1755340	That's a person who's been on a lot of diets
1756660	1760160	Like you guys can judge me, but the truth is you're the bullies
1761020	1764960	What do you do? Like like like like like like when people tweet you?
1765980	1769620	Like like like I'm sure people just tweet you and go like you're a piece of shit. Fuck you
1769620	1772380	I just want you to like like like they
1773900	1778620	And that that's I'm positive I'm positive about this
1779740	1781820	You know, I'm sure they tweet that they treat that at everybody
1781820	1787420	I'm saying like but it's like you know because what I get I get like tweets because it's actually based on like my
1787780	1789260	Behavior like for you
1789260	1790860	You could like write it off and go like well
1790860	1796820	I'm famous and I'm an actor and it's like why would I ever respond to this and also this person is just being mean and just
1796820	1802860	Wants to do the opposite of what they perceive the camera doing to me, which is making me powerful and interesting
1802900	1805740	And they just want to like drag me down and it's like pretty easy to write off
1805740	1808200	I would think but I for me
1808200	1815240	It's based on me being an asshole lately and doing wrong things and but what I don't understand is when people tweet at you and go
1816420	1821900	They have 140 characters so that like 30% of the tweets I get they like take you through the journey of them
1821900	1825820	Not liking you like they lead with like I was if I was a big fan
1825820	1831420	I like your shows and I like this and that or whatever but
1832100	1838460	After that thing you did like now you I hate you and I hope you're happy
1840260	1844500	And then I just like I do it to be back I go what you respond to that yeah
1847180	1849380	And how yeah, I
1850740	1854580	Responded to a girl today. She did that and I said I said you kind of like it a little bit
1855020	1862540	Well, I kind of like I feel like I feel like I like I like the people that like try to hurt me because I
1862980	1864340	feel like
1864340	1866560	There must be something that they could like
1867100	1868220	Reach, you know
1868220	1874260	That's like not like I'm that I need to reach because I don't like to feel like I don't like feel like a sociopath
1874260	1879300	Sometimes so I feel like like when somebody's like hey fat fuck you're untalented or whatever
1879300	1881420	I'm like well that feels like nothing
1881420	1885940	But I'd like to talk to you for a second. Like don't you think like if you could like my interest
1885940	1889420	Yeah, do you notice like where the seam of the armor like is right there?
1889420	1893220	Like you're aiming for the bat logo, but like think about think about here
1894180	1897100	Like like and I'm kind of like but I don't really know where it is
1897100	1897940	Cuz if I knew where it is
1897940	1902740	I would like dig in there and like reach around but like I'm like come on like like come on just look look
1902740	1909140	Come on find it like like like why are you saying that? You know, it's like so it's like half couch to like defensiveness
1909140	1913460	And then half in like has it ever turned into a deep friendship
1915620	1920740	Have you ever gone down that path so long that you realize we're just the same
1921660	1925720	You and me I don't I don't think we all the same
1927220	1933100	That would be that would be the world's greatest defense for when people ask me why I do it
1933100	1938740	Why I bother to engage but but here's a here's a here's a good reason why I did it because it sometimes it reveals like
1938780	1944820	Amazing like Jacques Cousteau life under the Twitter see because this this young lady tweeted me today. She did that
1944820	1948780	She took me through her little journey of liking me and then not liking me and I said, thank you
1949260	1955660	That was that's really interesting like how you went through that and like I'm sure if you were living my life
1955660	1962460	Like you would do you so like like like much more gracefully and tactfully or whatever and I didn't ask her anything
1962460	1967640	I didn't I just responded and then she wrote back. She's like, I don't know
1968520	1971400	To to maybe be a good person to
1972480	1978040	Maybe apologize and I was like wait, she's not even it doesn't even make any sense and then I realized holy shit
1978040	1980600	She hallucinated me asking her what I should do
1981480	1983840	She hallucinated me saying what should I do?
1984360	1990440	And I was like, whoa, this is amazing. Like you should look at this like you hallucinated someone saying what should I do lady?
1990560	1995080	Like like that like like that means that no one ever idea what you're talking about
1995920	1997920	Well
1999080	2004480	Understanding I'm sorry. What was it? What was she hallucinating? She so she said
2005360	2008840	You're a piece of shit, whatever and then I said, thank you very much
2009400	2017080	Like that's very interesting. Goodbye. And then she said, I don't know to maybe apologize or something
2017640	2020560	So that's like and I was like, why is she I was like, holy shit
2021080	2026160	Made up in your brain. You made up that I asked you anything
2026720	2029120	Because no one ever asks you
2030920	2036840	Yeah, and so she she was just like oh I thought this was going to be not only a conversation or an argument
2036840	2040660	But specifically one in which someone defensively says what do you want me to do?
2041200	2047400	Because she like no one ever says to her. Hey Daphne. What do you want me to do? Yeah, wait
2047600	2051520	Quentin Tarantino in dust till dawn when he's talking to Juliette, Louis
2065600	2067600	I really wanted to find this
2069040	2071520	Borderline personality disorder BPD
2072280	2077180	Also known as emotionally unstable personality disorder, I mean give me a break
2079080	2081880	Is a cluster B personality disorder
2081880	2088800	I mean is there a disorder called being a doctor like like that where the symptoms are being full of shit and trying to act
2088800	2095520	Like you're not the essential features include a pattern of impulsivity and instability of behaviors
2096880	2100040	Interpersonal relationships and self-image check. Yeah
2101520	2108800	Everyone in Los Angeles. The pattern is present by early adulthood blah blah blah other symptoms usually include intense fears of abandonment
2109760	2111760	Do you have fears of abandonment?
2113800	2116200	Yeah raised by or I don't know
2116960	2119800	Like I had to be handed down to you a little bit. Maybe
2120520	2123320	Yeah, I got a little bit of that. All right, can I get in on this?
2124040	2126040	You want some of that? Yeah
2127480	2129560	No, yeah, all right. All right
2129560	2134960	No fear of abandonment. Trying to abandon me. See if I fucking care
2142280	2146360	All right, welcome to the Ryan Ridley show that's what I'm talking about
2149800	2155760	Spencer let's just do the grandma's virginity podcast. Oh, we got a fan. All right. I
2155760	2163360	Don't I've never heard it. What happens in that? Well, you know me and Justin Reiland of the
2166560	2172920	All right, congratulations, I guess I guess we found out I have a fear of I'm a control freak
2176160	2178640	Yeah, I don't talk fear of abandonment I'm trying to search myself
2178640	2181520	I'm like, I don't know cuz I I get I do get very lonely
2182280	2187660	Kind of but I like I also like kind of I have I like I kind of wish I was like
2188240	2190240	Could someone please abandon me?
2190360	2192880	like like like I remember like
2193760	2195760	with one of my earliest memories is a
2196760	2199440	Nursery school, whatever you call it was day care
2200080	2204480	It was day care. I was like and it was like a part of a bowling league that my mom was in in Milwaukee and
2204920	2206920	the women would bowl and
2207400	2210600	In this women's bowling league, so I'm not being sexist. They were all women
2211600	2213600	It's not a stereotype that women bowl
2214360	2217720	It was a league you had they checked back then
2218520	2220600	There wasn't there wasn't the transgender
2221640	2223640	awareness that
2223640	2225560	the
2225560	2232480	And then to put their kids in like this just room at the bowling alley and that's where that girl stuck that crayon in my mouth
2234480	2236000	Yeah
2236000	2238600	Yeah, deep cuts of memory from the show
2239280	2245640	So what there was one day when everybody was like cuz I would just hide cuz it's just like the girls would stick crayons in
2245640	2249720	Your mouth or I don't know that happened more than once. Well, okay. All right. Yeah, I
2250440	2253840	Pluralized it to make it more effective. No, it happened once a girl stuck a crayon on my mouth
2254040	2257680	But but what happened all the time was color wasn't red
2258160	2263640	Like like purple like like deep dark purple like like like like dirty
2264000	2267520	like like dark like if you showed me if you open up a
2268160	2270160	64 color crayola magenta
2271040	2275800	Is that dark though? I don't like a burgundy like deep dark purple II read
2276840	2281640	and it's just like the I'll never forget the taste and the smell and I was like, man and
2282680	2287880	And then like but also then there was like six big wheels and there was like 50 kids and
2288520	2289860	And then we go like okay
2289860	2294000	You can play with toys and everyone run over the big wheels and and and I was just like I just can't take it anymore
2294000	2296380	I can't take it. It was just like go
2296860	2303180	sit in a cupboard, you know, like like like like find a like corner like like or a hole or something and just sit and
2304180	2309380	Is it something like being asked questions and like like like like in gym class if you like want to be left alone
2309380	2313580	Like then they but you have to like hide otherwise, they'll go like what are you doing? What's going on over here?
2313580	2315580	I thought this is Jim can help
2316140	2320520	And he's like you want to avoid the whole conversation. So if you could just disappear you would just disappear
2320720	2327400	So that I did that successfully once and I remember it was such a pleasurable memory that all of a sudden
2327960	2329880	daycare was over and
2329880	2332040	Everybody packed up. Everybody's like, okay
2332040	2336840	we gotta go and all the moms would come like at the end of the love boat or whatever the end of meatballs and like
2336840	2340960	Like everyone's like paired up with their parents and I just I just kept sitting there
2340960	2343800	I was like, I don't think my mom's here like like like and
2344800	2350640	And and and I just and I just stayed there and then they like turned out the lights and shut the whole thing down
2350640	2352640	and then I was alone in the
2353000	2358960	Daycare room and it was dark and I was just like walked around and touched the tables like all melancholy
2358960	2360800	Like I was I always thought I was in a movie
2360800	2366480	So it's like like la la la like like I was like like hearing like a soundtrack of my head like nobody loves me
2366480	2372960	Like but I was into it, you know, I liked I liked the feeling it made me special that I was abandoned
2373080	2376840	I liked it and then then then the doors open like after five minutes of that
2376840	2379240	My mom was like, where were you and I was like fuck this
2381960	2388400	So, no, I don't think yeah, no fear of abandonment I think I like it extreme anger and irritability
2391360	2395760	I mean everybody gets angry but the reason for which others have difficulty understanding
2395760	2398840	So I like yeah, I do I feel like every time I get angry
2399840	2405200	It's it's for a perfectly good reason but then it's for based on other people's reactions. I feel like I
2407200	2409200	Get I get a little irritable
2410000	2416120	Time to time. All right alternating between high positive regard and great disappointment self-harm
2417000	2422720	Suicidal behavior and substance abuse are common. I don't self-harm or suicidally behave
2424360	2428820	Disorder is recognized. Okay. All right. Yeah, I think we write off borderline personality
2429400	2431400	like yay
2436040	2438040	We saved him
2443080	2449440	But but nobody has anything right like this is like what do you what are they trying those are just like packages
2449440	2455520	Those are just for dumb doctors. Like like if somebody comes in and goes like well, I ate a fire hydrant yesterday
2456400	2459760	And I I love I want to have sex with a graham cracker and
2460360	2465840	I hate my mom, but I hate her cuz she won't kill me
2466720	2470120	and the dogs talking to me and I stutter and
2471160	2474040	my left armpit smells like an onion and my right smells like
2475040	2477540	Licorice and then the doctor goes Jesus Christ
2477540	2481760	He goes fucked up and then he like and then he just like takes the book and it goes like well
2482480	2485320	Disease does one of his armpits smell like licorice. He's like, yeah
2485320	2488920	And he's like give them give them this pill and he's like here take this pill
2488920	2493660	And like it's all bullshit all these packets like the the diagnoses are just packets
2494480	2496480	Yeah, I didn't
2496640	2502520	Grow up taking a bunch of pills. No one gave me a bunch of pills. Oh, no, I didn't yeah
2502520	2506200	I didn't I didn't imagine so well, I was just offering that
2508520	2510520	Do your relationships last a
2511120	2514920	Long time. Yeah, like what is a long time?
2516040	2523040	Like five six years that is a long time. Yeah to me. I've never made one last longer than two years. Oh, is that right? Yeah
2523640	2525160	How old are you?
2525160	2526960	42 I
2526960	2528960	Should have a sex doll
2529720	2533800	It would I would be a hero whatever you want. I would be a hero for having one. Yeah
2535120	2537120	Yeah, get one. Yeah
2537200	2538960	Thank you. I
2538960	2540960	Can tell my accountant you said
2541920	2543520	right
2543520	2546600	It's not gonna hurt you. I'll just say Aubrey Plaza told me
2548840	2553800	I don't even have a car like like by the time I get a Tesla like like, you know
2553800	2555800	I could have sorted out all my problems
2555840	2561000	Tesla already. Well, I might not be talking about it forever if I first was a symbol for
2561680	2565960	For a fraction of the price. I might become the healthy enough person to drive a
2566920	2572560	Hatchback of some kind if the sex doll might itch a scratch. That's uh, all right
2576280	2578280	Well, I told you it'd be a bad show
2578960	2584120	Do you want to talk about the thing in the sky? Everybody saw last night on the aliens. Wait, what?
2586640	2590160	No rocket test. Yeah. Oh really? Yeah
2590160	2592160	They
2595920	2600200	Just they shot a missile from a submarine that doesn't even make sense
2601200	2603200	That's how they sure underwater
2604440	2609600	That's that's that's what we want our enemies to to say I can't believe you don't know about this Dan
2609600	2611600	No, I don't know talk of the town
2612080	2615840	So there was stuff for this guy, but it was just a rocket test. I got caught up see a
2616840	2618840	Lot of you wasted a lot of time
2620280	2624040	I could just get my news here. How's how's Bernie Sanders doing?
2626400	2632840	Listen to a great piece on him on NPR. It was pretty great. They interviewed him to talk when he's talking quietly
2632840	2634840	He doesn't even sound ridiculous at all
2638600	2643040	You think he sounds ridiculous otherwise, oh, yeah, absolutely. Who are you voting for?
2643200	2648680	I'm not voting for people based on the ridiculousness of their vote or voice. I'll tell you that right now
2650160	2657480	Like as if you want this someone to be have a more ridiculous voice or it's not the axis on which I'm basing my judgment
2657480	2663880	Here, that's what I'm saying. So whose policies do you like so far? I like Bernie Sanders. I like Donald Trump. What can I say?
2665320	2667580	Either one of those I'm sure it'd be great
2667580	2669580	I
2675460	2681940	Will I will say one one thing that could be it's not a statement of admiration at all
2681940	2687060	It's just a statement of wonderment at which we often express about people we admire
2687060	2691940	But it's this is just wonderment like if I were running for president
2692500	2693580	the
2693580	2695580	day that I
2695740	2699340	Dentally or on purpose said all Mexicans are rapists
2699340	2704900	Like I would just I would go home and I would be like well. All right, so no no no president then but like so
2705420	2707340	lately like
2707340	2712620	It is amazing to me that that the guy that did that is like is is like, okay. Anyways
2712620	2718580	Yeah in a world anyways, he said all Mexicans were eight years ago. The guy went Michigan, Minnesota, Florida
2718820	2720500	Yeah, oh
2720500	2727480	Boy the gap all the gap Oh Dukakis in the tank. Oh, he looks so silly in the tank. What about the tank of
2728740	2734820	Genocidal horrible xenophobia like like the actual that's not a picture. That's not a perception
2734940	2736540	He was just like yeah
2736540	2740100	They're rapists and then and then and then everyone was like like well
2740100	2742460	I think they were cheering because they were there for Donald Trump the
2742980	2748340	Press conference, but he was like then some thing in his head was like you should probably qualify that and he's like
2748340	2750940	I'm sure I'm sure some of them aren't rapists
2752380	2754420	Like there's got to be a couple I'm sure
2755300	2760180	There's an exception every rule and then he and then the next day he was like, okay. What should I do brush teeth?
2763100	2765500	Put on shoes keep running for president
2765940	2771980	Which is amazing to me that really is amazing because I I threw out my back rearranging my office and the next day
2771980	2773980	I I did not go to work
2774740	2776100	And I was like, sorry
2776100	2781420	I had a hard time yesterday and I and I and it turned out I'm not as capable as I thought I was
2781420	2783420	So I'm going to lay in bed and play minecraft
2783420	2788460	And if I called all Mexicans rapists, I would I would twist that into a way to play minecraft. I
2790020	2792020	Would stop running for president
2793620	2797980	And I would think while I was playing minecraft I'd be like the reason I'm doing this is because I don't want to confront
2798340	2803660	What I said, like I want to wait until it's old and you know, and I could sweep it up
2804980	2809260	He's got a lot of self-confidence. Mm-hmm. I'd say learn from that
2810340	2812340	It's true. I do kind of admire him. Oh
2813100	2815100	That doesn't surprise me at all
2816620	2823980	He has too much he has a problematic amount of self-confidence. Yeah, someone say if he had less he'd be a lot better off
2824980	2829620	Just a few. Also, we need new words for confidence and how can he be better off?
2829620	2832260	He's a billionaire who's running for president just for fun
2832660	2838160	It is if he's like, I don't really give a shit. I'm just gonna spend my own money do this for a little bit
2838460	2840460	Yeah much more be
2840540	2845700	He's like now just imagine it could be right just imagine how he could be better. How far he can take it
2845700	2848820	Yeah, yeah, he's he's been running for a long time
2850380	2852980	That's true. What's it running from?
2853980	2855980	Laughter
2859380	2861740	We've already talked about this the fact that we've you know
2861740	2866460	It's been looked at like based on what he was born with at the starting line and based on what he has now
2866460	2871380	He's not a successful person. Like if you were a dishwasher, what was he born with? I don't know
2871380	2876100	I don't he was born with lots and lots and lots of money. Oh, he's a rich little baby
2876100	2876620	Yeah
2876620	2882700	And then he only lost some of it and then lost a bunch of it and then he made a bunch back and then he but
2882700	2884100	He's like if you were a dishwasher
2884100	2886980	He wouldn't even have been loud back in the kitchen at a certain point
2887340	2892740	But you can't get fired from being a billionaire like so you just they're just like oh you're back and it's like come back
2892740	2894740	Cuz I'm awesome and they're like me too
2896980	2900240	Is though I mean I haven't researched it but that's basically it
2901460	2903460	Do you think voting matters?
2904980	2907140	Yeah, you get excited about it, uh
2907940	2912100	Yeah a little bit. Yeah, I don't know. Do you keep your voting to yourself?
2912260	2913500	Yeah
2913500	2918460	You like to go in there and do a discreet like yeah, I wear a cloak
2922100	2924100	No one can see my eyes
2925300	2931260	So you don't talk about like you don't share your process with anybody no, I know only myself
2931940	2935180	How do you pick like the circuit court judges and all that bullshit?
2936180	2941980	Eenie meenie miney mouth. Uh-huh. I go with names cool cool names. Yeah
2943420	2948420	They give a little bio next summer, you know, like a little little little fortune cookie
2948420	2952420	Hey, I was like he wants feet to be illegal and
2953660	2957480	Like wigs to like like like be hats. They're like, yeah
2958380	2963660	I'll look that up later. But yeah, it's got my vote. I think in like 20 years
2963660	2970700	I'm gonna really start caring about those guys and being ready November 3rd with everything all the information
2971420	2974900	Really? The only government that matters is local government. Mm-hmm
2975220	2981420	Because like where you put a stop sign or whether or not your community is functioning is like actually the important thing
