start	end	text
0	3500	All you want to be is a shavily bubbly gobbly coop
7000	8000	Alright
11000	14000	Barman Count is now in session
16500	19500	I am your guest, Tom Solar, Ryan Ridley
22500	29000	Coming to the stage, your Game Master, Spencer Crichton-Diggerton
30000	40000	And now, the mayor of Harman Town, Dan Harman
45000	46000	Thank you
50000	52000	It's like some haunted mansion music
52000	53000	What's that?
53000	54000	Haunted mansion music
54000	55000	Oh, that's what it sounded like to me
55000	56000	Scary
56000	60000	So it's like the Halloween equivalent of turkey sandwiches
60000	65000	We're just using up a couple extra scary things
69000	72000	Like, you know, ghosts, they have unfinished business
76000	79000	Alright, well, I'm not going to lie to you guys, it's going to be a bad show tonight
79000	82000	We already discussed it beforehand
82000	87000	I'll just run through, okay, like the things that I wrote in Microsoft OneNote
87000	88000	Because fuck you, Evernote
88000	91000	Yay, it's a good app
93000	95000	That's the guy that introduced me to it
96000	100000	Alright, so my therapist thinks that my book, she keeps mentioning my bug bites
102000	105000	I trusted her before that
105000	108000	Because I thought she was like a scientist of the mind
108000	113000	But then she was like, she's like, what's going on with your arms?
113000	118000	And I was like, I have these, if a flea bites me or a mosquito or anything like that
118000	120000	Like, the bite is there forever
120000	124000	That's one of the many reasons why I'm better off in LA
124000	128000	You know, like in Milwaukee where there's mosquitoes like for a month of the year
128000	133000	Like, I would just be covered in, I don't know, I'd probably have some allergy or something
133000	136000	Like, I don't think it's psychosomatic
136000	137000	I don't think it's like a
137000	139000	Oh, she was suggesting that you manifested these?
139000	144000	She was kind of implying that it was like, that it was a symptom of my unresolved wounds
144000	145000	Whoa, really?
145000	147000	Like, you and my chiropractor?
149000	150000	But I trusted her
150000	153000	Like, the chiropractor I get, because he's like not a real doctor
153000	159000	So he's just like, oh, and then the first time I ever took off my shirt in front of my chiropractor so he could scan me
159000	163000	He's like, oh, you have these open wounds on your back
163000	165000	I'm like, it's acne
165000	171000	Have you ever seen a person that ever ate anything besides kale?
173000	176000	It made me feel like I was like, oh, he must like, ew
176000	182000	And he's always pointing out, if I have lint when I pull out my stuff before I lay on the table
182000	185000	He'll be like, you should get a money clip or something if the money's loose
185000	187000	I'm like, Jesus Christ, this guy doesn't hate me
187000	192000	Like, he just looks at me like a big giant mess
192000	197000	Yeah, just a pile of fucking matchsticks he has to count and sort
197000	202000	You've opened wounds, open what, don't say that, open sores or something
202000	205000	It's zits, just stop bullying me
205000	210000	But you're saying your therapist really thought you've just psychologically made spider bites appear?
210000	214000	I don't even know, like in that Cronenberg movie from the 80s?
214000	215000	The brood?
215000	217000	No, not night breed
217000	218000	Night breed
218000	221000	That was Clive Barker for God's sakes, Cronenberg was in it
221000	225000	That guy loves Cronenberg so much he considers night breeding a Cronenberg movie
225000	229000	Because Cronenberg was in it as button face
229000	233000	No, I have like, if you can see with the camera
233000	240000	I probably got bit by, I think my dogs didn't take their flea meds during the divorce for a week
240000	245000	So then there was probably a flea in the bed, they love me, and then I got a couple of these bites
245000	251000	Like, this is like a, no, no, I mean, anyways, I'm just saying like, I don't trust my therapist anymore
251000	253000	Because she was like, oh, what are those things in your arms?
253000	256000	I'm like, we already talked about this, you focus on these things
256000	258000	It's like, what is this, like a cold read technique?
258000	263000	Or you just like pick up on whatever's weird, you know, if the person runs their hands through their hair
263000	265000	And you go like, what are you touching your hair?
265000	267000	And then like, and then they try to bring it back around
267000	269000	Like, you just kill time for 15 minutes and then you go
269000	272000	So it's like touching hair
272000	275000	And then the person's supposed to go, wow, and leave
275000	281000	My therapist told me today that there's a California law that you have to ask women if it's okay to have sex beforehand
281000	286000	Apropos of nothing, she just brought it up, so that made me a little, a little nervous
291000	294000	And you don't believe her, or?
294000	296000	I just wanted more information
297000	299000	You want more information?
300000	302000	Your therapist, can we talk about your therapist?
302000	303000	Sure
303000	304000	Is it okay?
304000	305000	I guess so
305000	309000	Because you said, because Ryan started going to his current therapist, same situation as me
309000	313000	You started going to a therapist that you met as a couples therapist
313000	316000	And now the relationship is over, but you're still seeing this person
316000	322000	With one notable catch, which is that you were going to, can I talk about that?
322000	324000	I don't know, but I'm not gonna stop you
325000	335000	Okay, alright, well you said that she's like, you went to her because she is open to the concept of polyamorousness
335000	340000	I mean, I don't know if that's why we went, but you know, it happened to be her specialty, yeah
340000	344000	Alright, so, but now, but then the couple broke up
344000	349000	And then now he's just seeing a lady about his own brain working
349000	353000	But every once in a while she brings up the, she's like, well, you know, as a polyamorous person
353000	359000	You know, as a polyamorous therapist, I think you should work out your strategy
359000	361000	And you're like, wait, oh, yeah, that's right
361000	363000	I came to you because you've
363000	365000	She's definitely never gonna judge me
365000	367000	I mean, you know what I mean? There's no boundaries there
367000	370000	Right, if she was like, I think you played too many video games
370000	372000	She'd be like, why don't you fuck everybody?
373000	375000	Regardless of whatever the situation is
376000	377000	Crazy lady
378000	382000	But yeah, I don't know that but it's like like what I don't I mean, come on, you know
382000	390000	What is she saying that my immune system is weakened because of my wounds from childhood or something like that?
390000	393000	Like you're doing her work for her, it sounds like
393000	399000	Well, no, she's trying to I mean, she went down this road and I was like, I just wanted to I was just like, man, come on
399000	403000	I had a friend who he when he would be really stressed
403000	405000	He would have a weird reaction to his detergent
406000	412000	And when he wasn't stressed, he wouldn't so he would switch detergents depending on how how rough of a time in his life
414000	416000	All right, so there's a
416000	419000	Because it because he really loved that guy loved that detergent
419000	420000	Yeah
420000	422000	Well, no, he hated the other one
423000	425000	Because apparently the stuff he was alert
425000	427000	But he didn't hate it enough to stress him out
427000	434000	Because otherwise that would well see the Mobius strip there. I I don't I'm sure it's there
434000	438000	Okay, I don't see it. Well, trust me. It's there or I'm drunk
439000	444000	I just I don't know. I guess I'm saying like I really like my therapist and I just don't want her to believe in this
444000	446000	It's okay. So
446000	452000	You know, I don't know like like like there was that time when she kind of implied that she kind of a little bit believed in ghosts
454000	456000	Because we were talking about our friend that passed away
457000	459000	And
459000	466000	I felt like I could see him on like I could sense him on set on the community set and like like crack and wise and
466000	473000	Stuff and that and she and she like she was like and I was like, I guess that's the denial part of coping with
473000	478000	The grief, you know, whatever and she's like, well, you know, there's that but there's also just the fact ectoplasm
478000	482200	She proceeded to just like launch into this thing. It was just like oh or maybe his spirit like
483200	488640	Floated down from parts and wreck to watch me shoot community because even because he came back
488640	492260	I was like, well, there's no floor or I'm a ghost and like landed down at community
494600	499440	That makes much more sense than just I was fucked up a little bit about the concept of death
500040	503480	All right. So anyways bug bites, whatever I guess I have gross bug bites
503480	506520	I guess I guess that's the guess that's what she was that's what I really got from it
506520	509960	It's like even my therapist who's supposed to like kind of accept me and want me to be happy
509960	513640	She's like, yeah, but I wish this fucking gross bites weren't on your arm
513640	518200	I'm just gonna start wearing turtlenecks and like like like like like like really tight like cuffs
518200	523480	like I just like like like a mom and shots performer and just why not her flaws, bro, yeah, exactly like
524160	529880	Like like like like you don't see me just like like like like talking talk looking at you and recognizing your face
532080	535840	All right, just would just really briefly the 3d touch on the phone I just don't get it
535840	538400	It's like now you can touch your phone too hard. I don't get it. I don't get it
538400	542400	I don't understand you keep you keep pressing things and now it's like it's like you can't you if you press too hard
542400	545800	It doesn't do anything and then you have to like press it. I'm sorry. I didn't mean to press you too hard
545800	550660	It's fucking stupid and I there's a setting for the you just pick a setting and there shouldn't have to be a setting
551840	553840	Shut up
553920	557960	So, oh is Apple now in the business of like oh the settings
557960	563320	No, that's called something other than Apple the whole appeal of this thing is that it comes out of the box and it works
563720	567760	Fuck you. Don't even tell who loses you if you would you you're complaining for nothing
567760	570480	All you got to do is what read the instructions?
571000	573480	Or or or or go into the menus
573480	579520	How about put two buttons instead of one then if we're gonna get all into the hands-on customization thing?
579520	581600	Let's go this guy watch two buttons on his phone
582800	584400	me too
584400	586440	Just may call it an iPhone Pro
587320	589320	Two buttons maybe
589320	593760	Imagine twice as much you could do instead of it's like you didn't touch it too hard a chiropractor
593760	595760	I talked I made up with my chiropractor
596040	601400	But the jury's still out now. I now I'm worried about my therapist. I'm alone in the world. I start it's I start
601960	604840	Cut to the chase. I bought two mannequins. Yeah
608080	614940	Two I'm gonna I'm gonna I'm gonna be different and I'm probably gonna I'm probably gonna get a real doll. Yeah again
615740	620780	Don't don't groan because here's the thing. Here's the thing about you groaning. It makes you bad people and
621940	624340	Here's why because think about it
624860	631100	if you're 42 years old and you've never had a relationship that lasted longer than two years and
631380	637420	You just finished your first and last marriage that didn't even make it as long as you usually dated
638460	643380	That like are you a good person if you keep dating at that point like a
643980	648420	442 no, you're you ladies that are saying they're just hot for me. You just want
650820	654320	Or you oh, that's Justin's assistant
656580	661360	She just wants me to be busy so she doesn't have to bring me drinks at comic-con
663180	668420	No, I'm sorry. No, I'm really Sarah like like like like like that's it's the it's the search commercial in you
668420	675620	That's like. Yes. It's like healthy to it's healthy to do what to subject yourself and other people to your emotional incompatibility
675980	680580	Isn't that the story of frozen? Isn't the one sister like I haven't seen it, but isn't that?
681420	684860	Yeah, and except for the part where she's not supposed to be frozen
684860	688300	You know because they had to tell a story so it's like oh she gets unfrozen in the end, right?
688300	690620	like she's not was frozen as much but it's like
691700	695900	what if I'm just at the part like if if if this were frozen then my
696580	698260	sequined split
698540	700540	mid-sized gown
700580	702580	that I made out of ice power
703060	705820	When I sing the song, what's the song? I gotta be
710020	715780	Frozen inside I'm so in love with everything except for other people
716340	718340	I gotta be me
718620	724660	Every snowflake has a different shape and every human evolved from an ape
728500	730500	Frozen Stephanie
732740	734840	Yeah, you guys are right you're right to applaud
736780	738780	You did it
739700	746980	But if so, so why is it so hard to imagine me after a divorce going I'm gonna order a
747700	749700	$6,000 sex doll
750700	752700	Cuz I got a
752860	754860	nylon fetish and
755060	762260	And I when I see people all I see is their hair and their clothes and I don't want to subject anyone ever to that
762260	763140	again
763140	765140	so I
765140	768540	Spent six grand on a fuck doll. I just
771180	777580	One episode of Knight Rider just I just have it sitting around approving of me playing minecraft
779300	783460	Wouldn't that be if it's what's missing from that Jonah Hill like like
783580	784940	you
784940	791180	Want my cat to talk in order to make that adorable because believe me it is empowering it is important
791180	797740	like I think what I'm doing is heroic is saying like I don't want to I just want to I'm just gonna tenderly kiss the
797740	800420	Ankle of of a dead thing and
801500	807380	Then and then jerk off it takes five minutes out of like a day and then I'm off the market
807380	810740	I'm off the I'm then I'm back out here and I'm helping you
811500	816660	I'm not hurting you works for me. Yeah, I mean that you're doing it
816660	820420	I would never want to do that. That sounds like a horrible Twilight Zone nightmare
820820	826180	So never at 42 to hang up your hat from love
826180	829900	Oh, you don't mean the doll part. Well that doll parts horrible, too
831420	835580	But I think the funniest part is you have to ask for approval from your accountant, right? Yeah
836220	842140	That's true cuz yeah, yeah, I have like all his financial people so I have to like they're gonna notice a charge
844220	850420	No, it's okay guys. Yeah, I get to sell them on why you want to spend the money, right? Like he's gonna ask
851420	859380	Money, but I have to explain to them. It's not fraud. Yeah, not financial fraud. It's it's it's emotional and spiritual fraud
859380	865540	Certainly, there's definitely a heist going on of the soul
866340	868340	but but but but and
868700	873260	definitely a crime being committed for whichever guys have to haul the call the crate up the
874260	882460	Up the mountain to my palatial estate where it where Beth boots and now with unobstructed by eucalyptus trees can watch my
883740	888500	My sweaty head bob up and down is Beth boots in your neighbor. Thanks for the muffins
890380	896820	Yeah, Beth is the this guy doesn't like the podcast. I don't I mean Beth boots and is like a regular
898260	900940	Reference well lately. I
902140	905620	Mean whatever. Oh, let's all think Ryan Ridley. I guess for a comptroller
908300	910300	You guess
910860	917100	It was just my joke. My joke is that I mean to people that's my joke. It's not just me. No, no, it's everybody
917100	920940	I'm always I'm always cranky and mean that's my bit. All right, which makes me a great person
921940	924980	It doesn't well, it's good to be here. You're a great guy
925620	931580	Thankful to have you in my life. Good job Spencer. Thank you. Thanks driving me to work every day. It's important. Thank you for
932780	935280	They love how I drive you to work every day
935940	937860	But you're more than that too
937860	941300	You're a friend. Thanks, man. As you've noticed I have six
942020	947320	Like so that's a big Spencer look them in the eye when he says this to you. I look them right in the stomach
949100	955140	That's why that's why we're that's why we made faster friends cuz we go yeah, I need too much eye contact
955140	957140	Oh, you need a lot. Yeah
958460	960460	God forbid
960620	962980	All right. Well, you know
964060	968540	Our our next guest is is a real doll
972220	974220	Oh
978980	980980	Her lifelessness
981940	986740	Is also a part of her charm and as best worth a lot more than six thousand. Oh, yeah
987060	991900	No, I've I've we got to work with her when we did our Harman quest
991900	998260	Which is a fantasy come true that the show itself and also getting a chance to to to to work with her
998340	1002180	I'm sure you guys are big fans and she was great on the show and
1002500	1009180	When we took the opportunity to cajole her into appearing on the podcast. Why don't we bring out our new friend Aubrey Plaza?
1009180	1028380	Yeah, and if you want to drink later I can make you when there's tongs, thank you
1030100	1033460	All right, so I know your stick isn't exuberance
1034260	1040060	And I and mine is bad interviewing my stick. Well, I mean, I don't mean to imply you have a stick
1040740	1042380	but
1042380	1045500	And I didn't I said your stick isn't exuberance
1046540	1048540	And I'm a bad interviewer
1049860	1052100	So I'm gonna push through and
1052980	1059100	It's all on me if it's a terrible show because it's I'm bad at what I do. Yeah. Yeah
1060100	1064100	Uh, what do you feel about sex dolls?
1066780	1068780	Um, I
1070380	1072380	Don't know I
1075340	1080980	Just did a movie about a sex robot that's like a sex doll. Yeah
1082620	1084620	And
1084860	1092460	You know, I think they're fucking weird and I think they're creepy and
1093540	1095540	They make me sad
1096020	1099020	The the men that use them make you sad too
1099020	1105060	No, it's just like the idea of it not the not the not anyone specifically just like I don't know
1105060	1108460	Like don't you think if a person was like, okay
1108900	1110140	like
1110220	1113740	20 strikes and like like every time you go out there
1113740	1119060	don't you think it's a little selfish of us to continually thrust ourselves out there out of loneliness and couple up and
1119140	1122420	then like if we keep on learning over and over again that like
1122660	1130020	Like the same result keeps happening like like statistically, isn't it? Isn't it to me? There's something like
1131260	1137780	Everyone should should just go fuck a doll. Yeah. Well, well, like what about recycling like like like
1138180	1142500	We we used to just throw everything in the garbage and we'd be like
1142500	1146980	Oh, then it all goes in the garbage and then someone was like, hey all that garbage didn't go anywhere
1146980	1152300	It's like a big island in the middle of the ocean and it's like there's seagulls like like like that are that are that are
1152460	1158920	Affected by it or whatever the fuck they said and and now we have two cans in all of our homes and it just become
1159540	1164060	Custom like somebody has an aluminum can and they come up to you and they find you at your party and they go
1164060	1166860	I can't find your recycling bin and you're like, okay
1166860	1168860	I wrote it asshole. I'll deal with it
1169300	1174500	Like like like culture changed, you know, like and sexually like aren't we throwing away?
1175140	1176420	our
1176420	1179700	Sex when we when we have it with someone else
1184060	1187860	I don't know. I know
1191340	1196300	Sometimes yes, sometimes no. Okay. All right. Well, that's a brave answer. Yeah
1197020	1199020	From both of you. All right
1200540	1204260	Do you do you think that you're crazy? Yes
1204340	1210620	What do you think that you do you think that you're diagnosably crazy as anything in particular? Uh, I don't know
1210620	1215300	I have no idea probably something but I don't think I've ever been tested
1216180	1221080	Really? Is there like a clinical apathy? I mean, I don't know
1222080	1228200	My grandmother was crazy. Oh, yeah. She went to a mental institution. What did she do?
1233320	1238320	She you know, she just like had a breakdown she was crazy
1238320	1242820	she would like knock on the walls and saying crazy shit and
1243240	1247440	They just had to lock her up. Do you ever yeah, do you ever think like?
1247560	1251960	Oh that I mean I can feel that like like I don't know like you
1252800	1254800	well, first of all, did you have a
1258920	1260920	The
1260920	1263720	Unignorable idea that the walls are more hollow than they should be
1264200	1266820	No, did you have a relationship with this grandma?
1267800	1273480	Not really because she was pretty sedated when I was growing up
1273800	1279440	So you heard the legends a family legend about her break. Yeah, cuz my mom is one out of
1280320	1282480	nine brothers and sisters and
1284040	1286480	It all kind of went down when my mom was like eight
1286840	1292840	so five of them had to go to an orphanage that were under 18 and then the four of them were just like on their
1292840	1297560	Own and so there were just like crazy stories about their whole thing
1297560	1303600	Wait, I got back up to that cuz there is it like a certain amount of your mom's siblings had to go to
1304440	1310520	Because there was no parent there was no no no cuz my grandfather was sick
1310840	1316280	Okay, but then why did what happened to the other ones? That's because I was trying to parse all they were older than 18
1318440	1320440	Wow, yeah
1320480	1325720	Okay, and then the five of them got adopted by my foster grandmother who then had four of her own
1325720	1327720	So then there were nine again
1329080	1333080	But they are the ones in the orphanage there was like that fuck them that would be like 15 and they were like
1333520	1335520	No, all of them in the orphanage one
1336120	1338240	The the what which was your mom?
1339960	1341960	Bernadette
1345400	1347200	Second from the left
1347200	1352320	No, was she an orphanage sibling or was she an orphanage sibling? Yeah, okay
1352320	1357000	So what could you mind taking it is if I'm prying don't you know tell me at any time, but but I don't know
1358240	1360440	Is this gonna be online or something? No
1363040	1367760	But did you so what it's your mom what's to take us through your mom's story from there this is fast
1367760	1371500	I've never known anybody that was in an orphanage. She was in an orphanage in Delaware
1372280	1380280	Catholic orphanage and it was really fucked up. They were like being tortured and they were like, you know, it was not a good situation and
1381280	1386280	And so, you know her third grade teacher my foster grandmother
1386880	1391400	Like basically was like I want to adopt you and she was like I'm not going up without my brothers and sisters
1391400	1393960	Cuz they were all trying to like run away and all this stuff
1393960	1400520	And so then my foster grandmother the third grade teacher just adopted all of them Wow and then had four of her
1400520	1407520	So that means that reading between the lines here that you're that that teacher who became your who you knew as your grandmother
1407520	1408920	Yeah
1408960	1416320	She was teaching some kid who she was very fond of and who's clearly like suffering abuse at home
1416320	1421960	I am orphanage. Yeah, like her your foster grandmother didn't work at the orphanage. She worked at just like
1421960	1426960	No, she worked at the school where all the orphans went and she was like you're great. What the fuck is going on
1426960	1427520	Yeah
1427520	1432440	She just kind of fell in love with her and then she's like I gotta get you out of here and your mom did the
1432600	1434920	the old sitcom cast sound
1436080	1438160	Contract it's not without my sign
1439560	1440880	Yeah
1440880	1445620	She was my third grade teacher to the the grandma was Wow. Yeah
1446040	1451000	Geez, then that must have you when you were like, oh, I didn't do my homework. She's like, okay
1451000	1453280	Well, it's not like I care about my job. Yeah
1453920	1459880	Yeah, so I guess it's okay that you you fucked off this weekend. Yeah, I mean laziness pays
1459880	1461880	That's you know, that's why you exist
1462280	1468680	Were the older kids in your guys lives did they come back? Yeah. Yeah, they're around. All right. Yeah, that's cool
1469000	1472120	Yeah, all nine all nine all nine
1473000	1476240	No, no one of them died. Oh, well
1477480	1483440	You got yeah, I got no quip for that man. It's not your job to have quips
1484440	1486440	It's not that kind of show
1487160	1489160	All right
1491880	1494360	He's a substitute there's usually
1495840	1497840	But to answer your question, I
1500480	1503040	Think about it every day the sex outfit
1504720	1507480	Yeah, I knew if I did a little digging yeah
1508440	1513560	But are there no you think about it every day that you might that chemically, you know
1513560	1518680	I didn't want to give that short trip. Like you think about it every day that like there may be like a little I mean
1518680	1520680	Yeah, this far
