start	end	text
0	15520	Alright. That was chosen at random. Ladies and gentlemen, buckle your holy shit belts.
15520	20880	From the Nerd Belt Theater in Hollywood, California, Hermonetown is now in session!
20880	37040	From the deepest, darkest mists of my imagination, and all the concentration I can conjure,
37040	53200	is there a Spencer Crittenden among us. Spencer Crittenden to the stage.
53200	55360	You got your shorts back on. Oh yeah.
55360	57960	I heard about your pants last week and I was alarmed.
57960	62080	Oh, everyone was, everyone was. How you doing Spencer?
62080	67360	I'm so good. That means he's high!
67360	71920	Ladies and gentlemen, the Mayor of Hermonetown, Mr. Dan Hermon.
79600	80100	Yo.
82800	91360	Beat. Beat to the street. Street. Everyone two feet. Two feet. Walk two feet. Walk on the street.
92080	94000	Beat to the beat. Whoa. Hey.
98880	108480	Sorry. Beat to the street. Two feet. What the fuck? What the fuck? Two feet? Beat to the street.
108480	112880	Street. Beat. The king of the street. You can see him walking two feet from across the street.
113760	118480	Street feet is a lesson too because you can't let the two feet beat you.
118480	125040	Street. Beat. Beat. Meat. You have the beat with your feet. That's not, don't listen to him.
127120	135040	Okay, all right. Sorry about that. I didn't know that. I didn't know we had beef.
136640	140640	Oh Dan, our fucking street beef has gone on for too long.
140640	143440	Street beef. The beef. You see him rocking that?
143680	147200	Beat black on the street to the beef. I mean, don't let the beef street you.
149040	154160	Dan Hermon, you as the Mayor, you walked out and you said, keep that beat going. Keep that beat
154160	159680	going. The problem was there was only 30 seconds left of that beat. So you, your solution was to
159680	164320	to hit the pedal to the middle. Do you want to, do you want to go back to that beat?
165360	170000	No, no. Give me a different beat. You sure? Yeah.
170000	178080	Yeah. Give me a good one. A slow one. Yeah. Same beat. Yeah. Same beat. Same beat.
178880	186240	Yeah. Same beat. Yeah. Yeah. Same beat. Culture. Christmas. Street. Rhythm.
190160	193600	You have a, you have one, that's not part of the rap. That's me. You have one,
193600	198880	one minute 40 left. You want to start from the top? Ignoring that. No, ignoring that.
200720	211520	Two minutes. Street beef. Streets. Street. Street. Street beef. Every street has a beat to its
211520	218480	street. Every street has one or two feet. Every street walks along its own street. It seems like
218480	224480	a, a, a, a, a, a, a, a, a contradiction. How can you walk on yourself? The answer is, oh.
224480	230960	Street beef. Yeah. You gotta ask yourself, how can you walk on yourself? Street beef. Street
230960	235760	beats on the street. Street beef. My name is Street Beats. I'm on the street beats. Professor
235760	242320	Street Beats going to the beats. I got one, two, one, left, right. I went down to the street today
242320	248640	and I saw your mama and I said, hey. And she said, oh, do you want a newspaper? And I said, no,
248640	254880	because of the internet. Okay. All right. That's good. You have a minute and five left.
254880	259360	You have a minute and five left. Yeah. Okay. Okay. Okay. Okay. What, what else is going on? Dick Cheney?
259360	264000	I heard Dick Cheney. I heard Dick Cheney. One minute. Yo. Yo. Dick Cheney. I heard Iraq war,
264000	270320	Dick Cheney. Dick Cheney. All right. Plumber and, uh, reggae. Okay. Uh, 54 seconds. Yeah. Yeah.
270320	276080	I saw Dick Cheney just the other day. He was fighting an Iraq war in his usual way. And,
276560	282960	uh, trying to flam the toilet and ISIS came in. Whoa. 40 seconds. All right. 4chan. Did you say
282960	291840	4chan? 40 seconds. Oh, I thought he said 4chan. All right. All right. Yo, yo, yo, yo, yo. All right.
291840	296960	Okay. Two, two minutes. You have two minutes. Two minutes. Two minutes. He's like an aerobics.
298880	303520	You and the hat, the lady in the front row, I was at the yellow hat on. That's Heather. That's
303520	308560	our friend. Heather. Hello, Heather. Heather. Good to see you. Heather, uh, name or say a word
308560	321360	that starts with, uh, the first letter of Dan's name. Duck. Okay. Yo. Okay. Okay. Two minutes. Two
321360	329360	minutes. Okay. Yo. Yo. Duck. Okay. Make it all about ducks. No tangents. Just ducks. Yo. Yo. Yo.
329360	338000	One, two, rap, go. Webfeet on the pond swimming around. A woman, a pond dove is over on the
338000	344160	other shore. I'm going to go over to her and say, hey, you want more of my duck penis?
345840	348320	She's like no. And, and, and, and, and, and, and, and, and, and, and, and, and, and, and,
348320	350160	and, and, and, and, and, and, and, and, and, and, and, and, and, and, and then we're into a whole
350160	360960	thing and, but migrating, migrating. Duck leader flies to the sky. It's time to fly south and we
360960	366240	don't know why because our brains are the size of peas, but where they're developed over six
366240	371520	million years and we've got magnets in our ears and that's it. Like it makes us fly and they're
371520	382480	like truly intricate, like patterns that even humans marvel at. Yo. Yeah. I think rhyming is
382480	396640	overrated. Yeah. All right. Thank you everybody. Jeff Davis. I was here to help the fucking set
396640	404240	you up below people's mind. You see Dan, people only pay $5 to watch you make that face. Most
404240	407600	people listen for free and they don't know that you're making a face. No, you did a great job.
407600	413280	You're a really good friend. So you're listening. He's giving two thumbs up.
416880	421520	Wait, he just gave three thumbs up. One's his dick.
421520	429120	Uh, obviously tonight's one of those nights when we're all a little, probably a little drunk.
429120	434720	I'm fucking sober as a judge. All right. All right. I'll, I'll, I'll, I'll be the noble one and admit
434720	441600	that I got a little drunk today. Yeah. Thank you kid. Thank you. You really think it's so glamorous
441600	447520	and then I'll see you in fucking hell. All right. Here's what I got. Everything's about,
447520	452960	everything's about fucking and porn and stuff on my notes. Uh, when you say it's about fucking
452960	456720	and porn, is it just porn on your notes or? I don't know. It's just all about dicks and balls and
456720	462000	stuff or those things relating to it. So, so, so, but like, like last week we had the young lady come
462000	466880	up and she tried to explain Tinder to me and Rob and uh, I thought, but I was, and I was talking
466880	471360	about cause I was like still, oh, she didn't feel like she tried to explain Tinder and she did say
471440	477280	that. I think the most like interesting thing that she said, um, was like, because I'll never
477280	482320	understand Tinder. I've, I've, I haven't installed it and like used it, but I thought I was thinking
482320	488160	and I wrote it down and did like the most important thing was that Tinder was an offshoot of grinder,
488160	495520	which grinder was like gay dudes going like, who wants to fuck a butt or suck a nut or it doesn't
495520	502320	have to rhyme when you're gay. It doesn't, I said, okay, we're going to play it. Okay. Yo, yo, yo,
503360	510960	grinder, MC grinder. I'm equal to everyone and you've chased me to the shadows. You get what you
510960	520800	deserve. Yo, yo, my IQ is 200. I have disposable income. I'm a good person. I deserve to have the
520800	528560	right to be married and you underestimate me. Fuck you. MC grinder. Fucking butts. MC grinder.
528560	539040	Licking nuts. MC grinder. What is butts? MC grinder. Okay. All right. That doesn't,
539840	543760	I'm a big fan of the game. I'll tell the, I'll tell you, uh, meltdown audience. Uh,
543760	551360	we haven't heard the last of MC grinder tonight. He will certainly be repressed at some point.
552960	561120	There will be gay MCs emailing in going like, that's not fair. You're making me say being gay
561120	566720	makes you a bad rapper. I say to all, I say to all of our gay MC listeners out there,
566720	572000	I challenge you to come down to meltdown comics. That would be amazing. And just have a gay MC
572000	579040	grinder rap. If you're a gay MC, well, obviously you should just come down no matter what. I don't,
579040	584960	I don't want to pit them against each other. No, no. Them against you. It's you. Yeah.
584960	589040	Is there a way I could just be a bad guy? Could I just be like sis, sis rapper?
590480	596640	Like, like straight, straight heteronormative rapper. MC heteronormative. Yo, everyone should
596640	604080	fit in a dichotomy. Oh, your pleasure needs a lobotomy. Oh, I'm, I'm the mainstream Jim
604080	610720	Belushi. I'm fat 45 year old piece of shit. Do we have another guy comes up. Whoa. Yo,
610720	616640	state the name. My name's MC grinder and I'm here to say, and he's like, he rocks the world or she.
619760	624000	Is grinder only men? You close my name. Is grinder only gay males? Is it gay? Is it gay
624000	628560	women too? Of course it's gay women. I don't fucking know. Are you trying to rub?
629680	638400	Of course it's gay women too. I do. It's what? Oh, you're all racist.
641280	645440	No, I meant the gay rap battles for women too. I don't know what grinder is for. I don't know.
645440	652320	Is there a woman, a homosexual grinder? Scissors? Are you joking?
652320	658240	It's scissor without an O. It's a scissor. Scissor. Scissor. And the slogan is it doesn't exist.
660160	668960	It's not real. It's a myth. There are several, uh, gay women, uh, apps. Datch. What does Datch
668960	673600	mean? It's a lesbian dating app, but it, I don't know, it wasn't successful for me. It wasn't
673600	678000	successful for you. Datch didn't work for you? Why? You met the wrong kind of people or what?
678960	685920	You didn't meet anybody. It's easier to swipe on Tinder and figure out who's queer.
686880	695360	All right. All right. You guys go away. I have a conversation with Heather, who you remember,
695360	700400	is in the front row. She's like, it's easier to use Tinder and try to figure out who's gay.
700400	704560	Heather, was he either made the awesome comic strip? Who's that? Who was the person that made
704560	719120	the awesome comic? Okay. All right. Okay. Rob Schwab to the stage. Bring him out. No,
719120	730960	get him out here. Rob, the phantom of the opera is here. Bring him out. Ladies and gentlemen, Rob Schwab.
734560	747920	What's up, Rob?
747920	761280	Let's make it a drink. Make it fak-
761280	772240	This guy likes ice. It's a lot of ice.
776320	777680	All right. I'm sorry.
781120	783520	Rob, what was your comic, what was your comic book called?
784240	784880	Fuck you.
788960	798800	All right. Who in the crowd sit there for the cameras?
798800	801440	Right there. Is that good, Chris? All right.
804160	807280	We went a nice two shot of you guys. Give me a good two shot.
807280	818800	You guys are familiar with a male porn performer named Nick Manning. His catchphrase is dropping
818800	827680	loads. It's a man who, when he comes, he says dropping loads. He says it out loud. He goes,
827680	833360	dropping loads, dropping loads. He says, I'm not the first person to this party. He's been
833360	838880	on stern and stuff. He was in a Batman parody where he said dropping bat load.
841120	851360	It's obviously like, because I was like, who's the dropping loads guy? I was looking for his
851360	857120	videos. He's in a million videos, but- You were looking for his videos in particular?
857120	861200	Yeah. I type his name in to- Because you like watching the guys say dropping loads while
861200	863840	they're coming? I wanted to check up on him and see if he was-
866000	873840	I didn't see a problem. His most recent videos, he maintains this caveman persona. He goes like,
875440	879200	he no longer says dropping loads. This is the fascinating thing to me.
879200	884400	Now you got to pay him. I think he signed a contract. I haven't dug deep, but I clicked
884400	888720	on the first three videos and it's just him going like, he grabs a woman and goes like,
889520	898880	sex. And then she starts thinking, he goes, dick and mouth. He's basically a cookie monster.
901120	904720	But you're into this guy? Am I into this guy?
905520	910400	You're searching his videos in particular. Is America into FDR? I don't know. I mean,
911120	917680	he dropped the loads of socialism on a country that needed it when it needed it.
918560	924560	You enjoy that porn? The Golden Gate Bridge exists because of loads dropped at the right time.
924560	930320	I don't know. Am I into it? I don't know. Are you into Jellinger? Are you into Ben Franklin?
930320	936080	Are you into Kitty Hawk? Are you into fucking Skittles? Are you into apple pie?
937200	943520	This is the weirdest parade I've ever seen. Are you watching these? Are you clicking on
943520	947280	this guy's porn because it's sexy to you or because you like him as a personality?
947360	952080	I want to check in on him and I want to know. I want to watch him say dropping loads.
952080	958000	Okay. I bet you somebody's got a super cut. Of course, on YouTube, it's all audio. But the
958000	963840	thing is, so I want to see, why did he drop them? I don't want to just see the audio. I want to see
963840	971360	him say dropping loads and his dick. Instead of going to YouTube, but trivia and Rick and
971360	978560	Morty fans, like season two, there's a season two. The Zardoz, the thing that's floating in
978560	985840	the planet, it's going dropping loads. That's a Nick Manning reference. The Zardoz face is Nick
985840	994640	Manning. He doesn't say it anywhere, but he says these crazy things. He goes, oh, your pussy juice
994720	999760	is on my balls. Are you jerking off to this? You're watching him and he's going like,
1001840	1006400	he's like Lenny Bruce. It's like, you don't like porn. He doesn't like it. He's like,
1006400	1011920	porn is bullshit. I feel like he's screaming out. He's going, yeah, pussy juice is great.
1011920	1019920	And you're kind of like, so you are jerking off to this guy's porn. Whoa, why wouldn't I?
1019920	1030640	I'm there. It's porn. But you're clicking in. Grow up. You're typing in the name of a guy that
1030640	1034640	says dropping loads and I'm going to eat that pussy juice. You're already making him sound
1034640	1041120	dumber than he is. You're not going to take this seriously. You can just, you can just stand down
1041120	1045760	for a second. I'm just dropping loads. And you're jerking off. You go, okay, you weren't too far on
1045760	1050080	that one. Like you don't like it. I don't feel like you're receptive to this. I'm listening.
1051120	1054960	Let's start. I'm receptive to finding out what the fuck is going on. My whole list is about
1054960	1060160	just fucking like, it's just weird. Yeah, it's about, it's tonight's a blue show. We're working
1060160	1067520	blue. Cause I was, we were talking to Dino tonight. Dino was telling this story. Get ready to go
1067520	1073680	chartreuse. Dino has this, Dino has this classic story. That's green. And he's told a million
1073680	1079040	times. I know it's beyond blue. I'm pretty sure Dino's told this story on the podcast where
1079040	1087760	Dino's like, like he was in a hotel somewhere out of town and he ran into a trans. He knew
1088640	1096080	he or she and put a pin in your offense that because that's the point of the story is that
1096560	1107120	he saw a kind of prostitute kind of figure hanging outside a hotel that upon first sight of him said
1107120	1114480	like, hi, room 315. And he was like, okay. And then later on that night he went up to the room
1114480	1122160	and then this person who was presenting as a very attractive woman, but who had a wiener
1122160	1127760	and that Dino knew had a wiener when he, when he saw her. But like, what was like, I'm into
1127760	1132160	this. I'm going to go to this room. And he went to the room and then, and then like, he has this
1132160	1137440	sexual encounter with this person and he was, he was retelling the story tonight and I just thought
1137440	1141760	it was so funny because, because while he was saying, it was like, I don't know if it's like,
1141760	1148080	like a man or a woman and that triggered my like millennial, like, I was like, well, come on. You
1148080	1152880	have to like, what was, what were they presenting as? But it's so funny because Dino's the new Archie
1152880	1162240	bunker because all he, we're like riffing on if all in the family was made today. Meathead would
1162240	1167200	be the one going, Archie, come on. Are you telling me you spent the night with this person? You don't
1167200	1171440	know what they were presenting as, what pronoun they preferred? And Archie bunker would be going,
1172080	1178800	geez, Meathead, look, I sucked on the dick. I fucked the button. What does it matter? Jesus Christ.
1181600	1186240	It was just like the Gen X mentality because I was like, I don't know. I was a fucking dude.
1186240	1192400	It's a girl. It's like he was in the, I'm cheese. I fucking got the poop and the dick and I'm licking
1192400	1198960	the balls and I don't care what that's a clitoral pussy. What is this person? Yeah, geez, Meathead.
1198960	1206400	It's pretty funny to me that, that truly, cause I was like, we were riffing on that,
1206400	1211600	but it was like, that's, it actually is the case that today's Meathead watch the show all in the
1211600	1217520	family. I'm going to have this guy on the show, Norman Lear, who's like 903. You're going to
1217520	1223200	bring Norman Lear on the show? Well, I got an in. We could have him. We could have them tomorrow.
1223840	1229680	I could have him on a paper plate. Norman Lear, we've got a new pitch for you.
1231040	1239280	But all in the family, but all in the right now. All right. All right. Knock it off. Okay. Knocking
1239280	1243520	it off. All right. One more thing. And then I'm done with my, and then we're freewheeling.
1244480	1252320	The, the fly that wasn't freewheeling. That was not free. I'm trying to move forward post-divorce
1252320	1257440	into a new era where I'm going to dress. I'm going to, I want to wear all the same outfit
1257440	1262720	all the time. I learned this from a character called Seth Brundle in the Cronenberg's remake
1262720	1269520	of the fly. You tried this a long time ago. You, you for a while, and I did it and I, and I, and I
1269520	1276320	fucking, I ruled the, the, you wrote monster house in that outfit, I think. No, the first 25 pages.
1276320	1284000	The character of Seth Brundle in Cronenberg's remake of the fly, Gina Davis opens up a closet
1284000	1288000	and she says, and she, and she goes, what, when are you going to change your clothes? And he goes,
1288000	1292560	I change them every day. And then she opens the closet and there's like five of the same outfit.
1292560	1297520	And she's like, what the hell? And he goes, I learned it from Einstein. You don't have to
1297520	1301840	waste your time thinking about outfits or whatever. And that's the moment when she like jumps on him
1301840	1306400	and starts making out with him. So I was like 13 and I was like, okay, so here we go. So
1307920	1311600	what's your outfit going to be? What are you going to wear for us? I'm glad you asked.
1312640	1317280	So I like always, I was, I went through these phases. I should do that. So here's the thing.
1317280	1321520	In the meantime, I've learned Einstein, he didn't learn that from Einstein. That's a myth. Einstein
1321520	1326400	wore whatever the fuck he wanted. Einstein wore pajamas on Monday. He always wore like black or
1326400	1332960	white or like grayish stuff. I mean, like check it out. Look online. Like it's, it's either,
1334560	1340960	but yet, yeah, I agree with you. I agree with you. Like he, uh, I totally agree with you. Like he
1340960	1346160	wore different types of shirts and jackets, but then we're either like black or white or grayish.
1346160	1351200	They were certainly shades of a gray scale. I think it was a thing because everybody around
1351280	1357200	him was at the time they were wearing that color and stuff. And that, not a lot. So Einstein
1357200	1364960	didn't do it. So the originator of that concept is Seth Brundle in the fly. So in keeping with
1364960	1370240	his principle, which he states in the movie, he credits Einstein with it, but Einstein never did
1370240	1375120	it. He's saying in the movie, he says, that way you don't have to expend any mental energy on
1375120	1380400	what you're going to wear. So what are you going to wear? What's the outfit going to be? Guess what?
1380480	1387200	Seth Brundle's outfit, which is well, those telepod leather jacket and jeans, the gray,
1387200	1395040	black and white herringbone, uh, suit jacket with a white collared shirt, a dark red tie and pants.
1396080	1398400	My assistant's in charge of tracking this stuff down.
1400560	1406480	That's a good look. But he said pants because the thing is when you Google Seth Brundle,
1406480	1413680	you don't get a clear look at any of his pants. A lot of the imagery is of a fly man climbing
1413680	1421200	on walls. Right. And he's wearing a tweed kind of jacket, like a herringbone. It's like a, yeah,
1421200	1426560	a tweed. No, he nailed everything for the waist up. You can see that. So you're going to freestyle
1426560	1430320	on the, on the waist down? The pants. No, freestyling necessary. We're going to watch the
1430320	1435120	movie together and we're going to get this right. Because you fucked up a little bit.
1435120	1441680	Do you remember like as they're like, do you go, go ahead. I'm sorry. Well,
1441680	1446720	now he's saying he disagreed. The thing is, if you go on the Google, despite Seth Brundle's
1446720	1451760	protests, he, he seems to be wearing three separate pairs of pants throughout the movie.
1451760	1458480	Whoa. It's the antithesis of his, uh, his claim is that he wears the same outfit. So the solution
1458480	1463680	to that problem is to make me try on and off the same pair of pants that are the wrong color over
1464160	1470240	three. Yeah. That was completely related to this. No. Yeah. We got to figure out. We had to pant.
1470240	1476720	See, we can't get his sizes. So I had to, I had to eyeball the eyeball the pants and then take
1476720	1480560	them to the tailor. And then they'd say, go, I can't hem this. You have to have them come in.
1480560	1485360	And I'd say, fuck you. And then they'd hem the pants and I'd bring them back and they'd be hemmed
1485360	1490320	wrong. And so I'd had to go back and get them to fix it again. So when you, when you, when you guys
1490320	1494320	figured this out, you were actually going to commit to wearing that outfit across the board.
1494320	1498960	Yeah. Very close. We've been burned before with the eye Harman. Uh, that, that, that,
1498960	1504160	that was a flash in the pan. Are you going to commit to this one or are you going to bail on it?
1504160	1510480	I feel like it. That's not, that's not, I don't do it for you. Well, no, I'm saying like you, you,
1510480	1514480	you wanted the, I need to have the eye Harman around your neck. I know what you're saying.
1514480	1520640	You want to, look, I, I want you to commit to this. I'm all for this. I want you to be consistent,
1520640	1524400	but you want to make it interesting. Sometimes you're my friend and then sometimes you're
1524400	1529280	attacking me. Hey, hey, hey, hey, I got a solution. What? Let's make it interesting.
1532480	1538320	All right. All right. A little side money. Yeah. Yeah. Okay. One year.
1538320	1546320	Too much, too much. We'll go down. We'll get out. How about this? When, when Stan,
1546320	1551280	once you find the outfit and I'm all for this, but I'm not antagonistic to this idea. Okay.
1552000	1557040	When you find the comfort zone, you go, okay, this, this is the color of the trouser. This is,
1557040	1562160	this is the jacket. This is the thing we're going to get. How many do you think Spencer
1562160	1566880	Dan will need? Five. Five? Yeah. Maybe less than that jacket. And then we'll put a calendar
1567680	1572800	right here, right here, right here. And then we'll check it out. I don't want to wear his shoes. I
1572800	1576960	don't like the fucking dress shoes. Okay. What do you want to do? I'm really, I like my.
1576960	1583040	Normal shoes. Okay. Those are, those are going to stay the same for a couple of years anyway. So
1584240	1590240	what do you mean? You strike, you strike me as somebody who doesn't wear a lot of different
1590240	1600560	shoes. I don't. See, Rob, Rob, Dan is hearing, Dan is hearing. You strike me as somebody who
1600560	1606480	don't change them shoes a lot. Dan, you're, you're hearing, you're hearing attack where there is
1606480	1615600	nothing. You need me to change those shoes, bro. Wearing the same old nasty ass shoes all the time.
1615600	1624880	You need to change them shoes. Dan, we're on your site. I'm totally. You're saying I'm not
1624880	1628880	attacking this at all. Are you guys perceiving me as being in a grumpy mood, like a defensive mood?
1628880	1633200	Well, I think right now, like there are times when you hear attack when there is none. You,
1633200	1638960	you hear combat when there is no combat. Really? I'm saying absolutely do that. I would love that.
1638960	1643520	Because like Steve Jobs, he wore the turtleneck. Right. And Zuckerberg. Look where he is now.
1643520	1644560	Where's the gray t-shirt?
1647520	1648880	Two biopics. Yeah.
1651440	1656240	Beat that. Follow that. Yeah. Look, look where Steve Brundle is. Or Brundle Fly.
