start	end	text
3293760	3298720	mean of course she's in it right yeah good good when do you when do you leave uh you go to vancouver
3298720	3306240	right to make it yep when do you leave town uh at the end of 2016 oh it's way off are you
3306240	3313600	gonna miss me yes why won't you look at me because i'll start crying what are you gonna
3313600	3319840	miss most about dan rob most most about uh what am i gonna miss most about dan oh yeah or name
3319840	3324400	your one or two or three top things that you're gonna miss about about not being in the same city
3324400	3328240	with dan uh watching dumb movies with him
3332640	3336960	dan what are you gonna miss about rob when he goes away for a year and a half his pain
3342480	3345280	you like his pain yeah it makes me feel effective
3347280	3354160	in his defense it is pretty funny it's delicious it's very tasty well i mean i
3354160	3360080	have this i miss i mean we i mean here's the thing me and rob what we were kids we're like
3360080	3367840	remember you know an l.a story when uh steve martin and what's your name they're like they're like
3367840	3377920	and they go out in the garden and i hope that's not fucking well they fucked they fucked that's
3377920	3382960	the scene where they fuck but it's like like there's an enya song playing like we came to
3382960	3390560	l.a because we wanted uh you know we wanted to be who we are now yeah but like
3393200	3398400	that's not it's not like being who we are now required us like holding hands and like running
3398400	3405360	through a field like we barely talk to each other but look and we like like you know it's nice i'm
3405360	3415680	very thankful like our our friendship yeah that's foundational to it and it's good no i'm i'm all for
3415680	3424320	it i mean i i wish i don't understand why you have to go to vancouver to make legos move it
3424320	3430640	doesn't make any sense i i could do that here on the floor for one tenth the budget and i don't
3430720	3436560	understand i don't get it well i'm you're welcome to come visit well i don't i don't obviously the
3436560	3442320	most important thing for me to make it make clear is that no one can ever hurt me ever
3443840	3450320	it's not possible no i don't have no feelings no that are available like from the outside that's
3450320	3455360	not that's not something that you can do like nobody can hurt remember remember that one new
3455360	3462160	years where it was like you know i think i think we both of us like we're in our third like you
3462160	3469600	just turned 30 and we were it was a new year's and we were like well party's over new year's
3469600	3476000	we're 30 now let's uh then we're not gonna go out and have fun and rave it up with all those
3476000	3481600	youngins and stuff let's let's stay home and watch some tv and just we'll call it a night you know
3481680	3486400	around 11 30 or something like that and your girlfriend at the time i came over and she was
3486400	3495680	like yeah i guess i'll do that too um i got a bag of mushrooms that uh i found in the freezer
3496880	3503920	and it was like a like a trash bag they're in the freezer they've been there for like about a year
3503920	3509440	or something they're not let me tell you something they're not gonna work we're not gonna get high
3510000	3514960	so if anybody wants them without it and we all went oh sure was that there too was there i don't
3514960	3518560	think you were there i think we were trying to get you there i think we were on the phone with you
3518560	3522480	and you're like i'm not coming over you kept saying who's there how late are you gonna be there
3522480	3528720	i'll be like it's an inside joke it's what jeff always does okay so i remember i remember
3529760	3534400	no no no we'll get back to this pain we'll get back to it so anyway so wanna find out
3534560	3539360	this is one of my favorite memories of of hanging out with dan it's like it was like you me chris
3539360	3544800	talman it was like robin roth and we had and she she puts him down there and we're like oh okay
3544800	3551120	oh there's all these mushrooms all right well i guess i'll take a handful too i remember looking
3551120	3559520	at my hand and a like a pile of mushrooms and i'm like going okay you said this is just it's not
3559520	3564880	gonna work it's not gonna work it's not gonna work famous last words and we all went fuck it
3567040	3573280	oh man i'm so fucking old jeez that's 30 years old holy shit no it's all over with oh i think i
3573280	3577840	think we're both broke at the time and whatever and then robin like i brought my dance dance
3577840	3584000	revolution machine around here all right i love hooks it up to the tv and chris talman and i are
3584000	3589520	sitting just kind of crashed out on the couch watching it kind of sleepily watching it and dan's
3589520	3599200	in front of us on the dance dance revolution and it starts off the music's like and then clears the
3599200	3607840	level you did it and then the beat keeps going every level goes lights and stuff like that and
3607840	3617920	all of a sudden lights are coming out of the tv and and and dan is like dancing dan is dancing
3620640	3630560	level 12 wow level 13 perfect perfect level 15 20 67 100 and not who are you
3630720	3634400	dan's like going i can't stop losing i can't stop losing
3639600	3644400	i looked over at rob we all did it's like i was playing any other game i'd be like well
3645280	3647920	i looked over at rob and rob was going
3652720	3659360	the whole room is watching seth rogan just magically good at dancing it was just like
3659360	3663600	the music is like going through the roof and our ears are shattering and i looked at chris
3663600	3673520	talman and i went oh no and he said yeah we took way too much and and we were just like
3676320	3683680	we were like a hyper speed like dan's dancing all over the place robin took off and ran down the
3683760	3690000	street and like it was just like it was the i think the most high i've ever been in my life
3690000	3696240	like the walls were growing hair and everything was like black light but there was nothing on and
3696240	3703280	we were and and then like steve aji gave me like a uh like a what it gave me a hand job
3704480	3710400	no he gave he gave me like a couple days earlier like a videotape of of like like unaired famous
3710960	3714240	unaired pilots that you've never seen or something like that just clips of it
3714240	3721280	and they had like the pilot the original pilot for the munsters oh god oh god oh god
3722640	3727360	what you don't know is that they shot two pilots that night that was that night that was a night
3727360	3734400	that's when the oh boy it took i took it became a bad trip yeah it became a bad yeah yeah yeah
3734400	3739280	because i was like i'm fucking i could dance i really so happy and then we watched your legs
3739520	3744000	i couldn't see them anymore they were moving so fast i was like there's a god god god made the
3744000	3749520	game god made my feet i was like i get nothing to do with this perfect perfect perfect the game was
3749520	3757280	like who are you like call konami you you have a you have a vacation awaiting you and i was like
3757280	3763600	man i can't so you lose and i put in this but then yeah but then we yeah we watched original
3763600	3768800	munsters there was like is that the original munsters so you guys don't even know the munsters
3768800	3774560	but there was like a herman munster and there was a mrs munster and there was other munsters um who
3774560	3781920	knows the munsters okay okay there was a there was a son there was a son eddie eddie thanks kids
3781920	3790720	thanks he was uh he had a widow's peak and blah blah blah that's the recast like that's
3790720	3798800	the michael j fox there was an eric stoltz of uh the monsters so then they showed it and it was
3798800	3805040	like and the kid's name was like happy something happy smith happy smith or whatever same cast the
3805040	3811440	original idea with eddie munster is that he was part werewolf yeah and so and they show the munsters
3811440	3816640	it's a fred gwyn and he's the every everything's the normal munsters and then this fucking kid
3816640	3824080	comes down the stairs and goes ah and he was like a werewolf boy and like we were on mushrooms
3824080	3830400	and shit got dark we we because i don't remember putting in the tape but i put it in tape and then
3830400	3833840	we were like watching and then we just said oh whatever we started talking about yeah man you
3833840	3838240	know like it's just so great that we know each other after all this time and just your comedy
3838240	3841760	is just speaks to me i remember when dan was doing such a good job dancing that was so great
3841760	3847360	how come we all became morris all of a sudden and we were like
3848960	3856160	and it became a bummer because once when you're doing psychedelic drugs like oh yeah have a great
3856160	3860480	time but then there's that always that moment when there's one thing that oh my you're like
3860480	3866720	wait if that's true if a kid if there's a kid who thought he was going to be eddie munster who never
3866720	3871920	got to be eddie munster just because he was ugly and terrifying which is what monsters are supposed
3871920	3877840	to be like like like like well then what are we and what are we doing with our lives and why am i
3877840	3884560	32 and on drugs like i have shit to do i like like my accountant is wondering where i am tonight
3884560	3889760	and he just fucking tailspin i wanted to kill myself it's pretty it's pretty weird like just
3889760	3895360	imagine like any sitcom where everything's the same except the one thing that was like a side
3895360	3904240	character comes in and it's just like yeah yeah yeah i mean that that was the original version
3904240	3908960	of eddie munster pretty funny but it didn't really reply but it was just laying with them
3908960	3913760	but there's a there's a different party as long as they're fucked they fucked the show there
3913760	3919600	there's a different party what was the party where we're like what were you what was it halloween
3919600	3926640	where all the you're not going to tell them why are you doing costumes and then like like
3926640	3930400	everyone came over and we're like ah this party is not working and there was i guess there was
3930400	3934240	some ecstasy or something and yeah maybe we were tripping and maybe we weren't but i think it was
3934240	3938320	dressed no one knew if they were tripping or not you weren't then like one person said well you
3938320	3946640	know what i'm gonna go who yeah shrub was dressed as tron i was i was dressed as i was 99 cents to
3946640	3950880	our cowboy i made a cowboy outfit out of all things from the 99 cent store so i had a giant
3950880	3956560	cowboy hat made of kitten calendars and uh uh so we were all we were super high and the party ended
3956560	3961680	up in your office which is like the smallest room in the apartment and we're on bean bags
3963200	3969360	and then someone said well i'm gonna go and then shrub had this disney land they give kids these
3969440	3974800	swingy things what do they a little little spinny things like i don't know you spin around and then
3974800	3984080	shrub was in his tron costume and and so he's a little knot in a little turgid penis okay
3984080	3989440	visible and there's like like like head to toe spandex tron circuitry and then he's
3990880	3998080	and then you're waving these disney things and then you go why are you leaving why are you leaving
3998160	4004800	why are you leaving and then other people started going why are you leaving gay party gay party
4007040	4010880	gay party gay party why are you leaving and everyone's going
4010880	4016640	gay party gay party and then i said why are you leaving why are you leaving gay party it was
4016640	4025200	politically incorrect then too but the idea was um the uh well there was no idea it was just a
4025200	4029760	funny experience this is how and it went on forever to the point the point is kids stop to
4029760	4036720	do more drugs just get together in your apartments in your homes and do them in my bedroom you guys
4036720	4042640	uh like in my bedroom i have a picture from my i think it's my 27th birthday and it's rob
4042640	4051360	dan chris tallman and i uh are we had just done ecstasy and we were at the beauty bar
4052320	4058720	on coenga and there's a picture of us there i think uh heather my ex-girlfriend took
4059440	4064960	and it's us at like whatever year that would have been like like 90 something like late late nine
4064960	4072480	or maybe 99 2000 and it's my favorite picture it's it's really really good what how do we are
4072480	4080160	pupils like just asked our foreheads our pupils are like saucers yeah we're quite high all right
4080160	4090240	drugs don't work on me anymore oh poor baby i've done so many drugs i can't i can't feel them
4090240	4096320	anymore you took a weed breath strip and you lost your mind all right come on oh my god that
4096320	4102800	was the worst come on open it holy shit it says the doug benson show come on oh my god it was the
4102800	4112080	worst if it was we'd have so way way higher numbers who is in pain here who has that's a
4112080	4119200	bad sign you you you're raising your hand like in and silence do you want to come up here and
4119200	4123440	share your pain i don't want to talk here but i'm not sure i'm in pain that's the problem oh well
4123440	4129280	well then don't then then i'm drunk i can't help you stay there then it's called being in the
4129280	4135280	audience yeah it's fine no i'm saying like is anybody like i want to be on stage right well
4135280	4141360	okay we got our friend here i'm almost finished with humanities season four and i have nothing
4141360	4147680	else to watch well that's better about season five it's adorable but so much pain there was a guy
4147680	4155440	who had a heart transplant last week abandoning my graduate school program oh yeah he's got a
4155920	4159360	voice and he's from canada what
4161760	4166240	get card jacked but it's not don't think about it so much as like what do i have to do to get up on
4166240	4174560	stage think about it more like oh my god i'm in so much fucking pain like okay what's it yeah
4176640	4180400	you're in a lot of fucking pain all right is it cool if you share it
4180400	4191920	podcast dynamite but maybe not for you you can yeah we'll we'll chippy-toe through
4195600	4202400	yo yeah sometimes human pain could be rung like a rag into a bottle and
4203520	4207440	you can drink it and you can sell it for a subscription fee
4207440	4214080	what's your name young lady tara tara sorry to call you young lady i'm sure that's
4214080	4220320	in some some view that's gotta be that's gotta be somehow uh shut up buddy
4222000	4224320	don't don't don't don't don't old man spleen
4226560	4232320	how to talk to a young lady tara where are you from um from new york long island oh yeah
4232960	4237120	are you a la resident now are you visiting uh yeah i just moved here like a month ago
4238000	4244960	welcome thanks you enjoying it yeah yeah settling in yeah what part of long island you from i'm from
4245680	4251200	south shore sepha county oh yeah yeah you miss it your family all there yeah everyone's there
4251200	4257200	yeah i don't miss long island i miss my family what brought you out here i'm sorry i'm sorry
4258320	4261760	i'm not making fun of you i just don't know what to do i don't know why i'm here what brought you
4261840	4268880	to la tara a bunch of reasons i kind of came for the sun actually the sun yeah and but a bunch
4268880	4279680	of things yeah job maybe try stand-up comedy oh yeah yeah so now you said that you're going
4279680	4286560	through some some tough pain right now uh yeah i'm just like very severely depressed and can't
4286560	4293040	really seem to get past it is it sort of just as a general thing because you've come out to la
4293040	4297040	you're living here is it what we could predict which is you don't know what you're doing you
4297040	4302320	don't know where you're going yeah i mean depressed my whole life for sure but like putting myself
4302320	4309520	alone in a new city severe like has triggered it to a point where do you have friends or any kind
4309520	4313840	of like uh connections when you came out or you came out totally alone no i came out totally alone
4314080	4318880	which is a really good sign because a lot of people don't do that i didn't do that yeah
4318880	4324000	shrub had to come out to la for me to come out i i never would have gone out that's you i have
4324000	4330560	to commend you that is a very ballsy thing to do because like dan and i in milwaukee said for years
4330560	4335120	we gotta get out of here we gotta go to los angeles i never would have done it if it wasn't
4335120	4339680	if dan would have gone if he was that i'm not gonna go i would have stayed there so to do it
4339680	4346240	by yourself is really commendable thank you yeah it's it's it doesn't necessarily
4347200	4351760	foretell anything which i think that's the big crucial issue how old are you see me i'm gonna
4351760	4357680	if we can ask how old right 27 27 uh like that's how old i was when i came out so the importance
4357680	4364160	of uh i was way younger than that um to me i was like why is he even bothering to come out
4364160	4371680	27 yeah uh but the the the when we talk about age when we think about it the big crucial issue
4371680	4376480	is outcome it's like it's like oh i'm gonna i need to accomplish this by this stage and all
4376480	4381280	this stuff like like like that's the big thing and so it's i think you come to a big city like
4381280	4385440	l.a or new york and it's like oh the reason i'm coming here is because this is the place where
4385440	4390400	you plug into this mainframe and then i'm going to become this like heightened version of myself
4390400	4395760	and it's going to be at the mercy of this bartender or this agent or this like flyer or
4395760	4404400	this workshop and you don't you're fucking dizzy and like like wondering because i'm sure back
4404400	4412320	home you've got probably a tribe of people that bless their hearts maybe aren't totally going
4412320	4418320	totally i get it go audition for everything they're not like auditioning for and don't have
4418320	4426560	expectation of joining the entertainment world but so you're right now at 27 you're going i got
4426560	4434480	out here i'm just gonna okay so i'm exiting a four-year like relationship i was gonna say
4434480	4442240	emotionally abusive relationship so i kind of fleed a state to come to this state to get away
4442240	4450240	from that guy yeah yeah good for you good for you he's not he's not a bad guy i'm not an angel
4450240	4460320	either so whatever i kind of i had it coming just so you guys know yeah but but but sometimes like
4460320	4466800	like like negative negative things like that's that's rocket fuel like the way the way rockets
4466800	4472000	get off the ground is by firing things in the opposite direction like that negative stuff is
4472000	4477120	something that can get you into you know into orbit and like to go to places you want to go so
4477760	4484960	but like that's that's well i'm very happy that you uh that you chose to land here on a sunday
4484960	4489360	night with us that's very cool well do you have big fears about tomorrow like i'm sure you have
4489360	4494880	like what what's the what's the financial issue like la's an expensive place what's your situation
4494880	4501120	i do have a job i got a job before i came here i work as a behavioral therapist with autistic kids
4501120	4506080	oh yeah well that sounds like it pulls down a lot of year
4508480	4513600	that's you that's here i guess i just have like christmas blues i just like cried for two days
4513600	4521040	i watched uh the faults in our stars last night oh god oh my god oh god that's the best movie
4521040	4527040	ever it's like it's like human drain oh i've been crying the fault in our stars is there
4527040	4533760	is there is there more than one star in the movie because if i haven't seen it yet
4536320	4542240	if i go seeing it and they're just like oh well there's just one star i'm i'm gonna my brain will
4542240	4549600	blow up it'll blow up it'll blow up my brain will blow up it'll blow up it'll blow up my brain's
4549680	4560640	gonna blow i happen to have seen that movie i was 42 years old in a luxury hotel in venice
4561600	4568400	at christmas time with a woman i loved very much there was absolutely nothing wrong with my life
4568400	4575120	and that movie fucked me made me wobbly like i was like what is a gondola what does it matter
4576080	4582400	so if if if you're if you're 27 and you're like like you don't you don't necessarily have a
4582400	4587600	mortgage and a health plan and like you watch that movie that's good that's like fucking what
4587600	4595920	do they call it a neti pot that shit clears you out that movie will fuck you up watch it
4595920	4602320	watch it you piece of shit you need to watch jeff damas you need to watch the fault in our stars
4603040	4611200	i'm writing it down it's on hpo go it'll fuck you up i have hpo go watch the fault in our stars
4611200	4618560	it'll fuck you up but there's definitely a positive message from it i thought the i thought
4618560	4624880	the and frank set piece was a little weird spoilers weird spoilers but i don't want to
4624880	4631520	fuck it yeah yeah yes yes do you play yeah sorry give us a second
4634640	4639040	so it was insane i've yeah i've actually never seen a movie that had something that insane in
4639040	4643760	it that i also still at the end i was like i was fucking weeping i was like that's a good movie
4643760	4650960	i'm like i hate children i was like like i i was just like weeping uh yeah no good movie
4651040	4657200	nice movie well written nicely shot whatever so honestly there's a good chance that movie's your
4657200	4663760	problem there's a really because i'm telling you that's some potent shit like like you may need
4663760	4670880	just need three days off of that movie you you may be fine you may just need to watch cannonball run
4670880	4678240	too uh the sure thing and hudson hock what's the last movie that you watched that made you go
4683200	4686400	what was the last movie that was last time a movie made you
4689600	4693760	terrible what was the last time i put it in this movie and you sit there and watch this
4693760	4702400	whoa i'll do tv show the last belly left show i watch was nathan for you
4705680	4712160	it's the vault and our stars of comedy which my god it cleans you out which which which episode
4712160	4717280	which episode i just watched the season finale of the second season oh my god i haven't watched
4717280	4722800	the third season yet he's on three right it's so he's awesome we should have him on the show you
4722880	4730240	know what all right i could totally i i got his i got his number do you do you remember
4730240	4735280	do you remember like last season where he the weight loss uh hey hey excuse me for a second
4735280	4742080	leavy book nathan we could book nathan fielder yeah do it done hey and you know what steve
4742080	4748720	leavy is taking out his eye diamond and uh lina dunham you know steve uh let's find out if dan's
4749440	4752560	full of shit and just call him right now call him up
4755440	4761920	you have his number call nathan right now you don't have dan is a number dan has his number
4761920	4764640	no but i can get dan's gonna chevy chase this shit right now
4766400	4772000	it's gonna leave my drunk voicemail it's gonna fucking go viral okay it looks it's looking like
4772080	4773440	i don't actually have his number
4776080	4780960	i probably wait a lot of times what i'll do is if somebody's following me on twitter i'll
4780960	4789440	consider that having my number because oh but yeah that's his wikipedia okay all right
4789440	4795840	oh that's nathan filian okay all right call nathan filian just just well okay call nathan
4796320	4805280	why don't you suck my integrity this guy was like you had to play chevy chase's voicemails
4805280	4813280	was him there was you we we we used my phone to play it anyways can we please get grounded and
4813280	4820800	be sensitive what's the last movie that made you go oh what was this movie that turned you into a
4820800	4832960	japanese stereotype oh i saw that movie entertainment it was sad but it made me laugh too
4833600	4840800	maybe not belly laugh let's talk about these autistic kids yeah are you uh uh you're in la
4840800	4847760	your job is uh what do you do when you punch in the clock you you nine o'clock and then you go
4847760	4853280	who's autistic and they're like i won't tell you i'm not gonna look at you and you're like i think
4853280	4858400	i think you are and then you grab them and you're like come on and they're like no and you're like
4858400	4864880	perfect and then you're like five o'clock i don't know i don't know why i sidled into that i that
4864880	4869440	that wasn't my that was wasn't i was trying to do that's not what i was trying to do
4870640	4876560	i try to try to try you you correct you correct me for the moment you plan
4876640	4884080	eleven o'clock oh nice must be nice because no i too i have because of depression i can't
4885280	4890640	i don't get up for work i just won't get up for work if it's early so i've had to find jobs that
4890640	4895760	start past is that like a thing that you put on this sounds like a joke but do you tell the
4895760	4900240	into the interview you're like no no i just find jobs that like i i've worked in schools i can't do
