start	end	text
1656240	1662320	Steve Brundle. Look where Steve Brundle is. The famous Steve Brundle that you've been talking
1662320	1667440	about for a while. All right. Well, we're off-roading now. So I hope you guys brought your show.
1669200	1672320	Because those are the. Do you remember? Do you remember the fly?
1672960	1676800	Why are you upset? We're saying yes at the end of this idea. No, no, I'm not. Don't tell me I'm
1676800	1682880	upset. You piece of shit. You seem bummed out. I want you to start wearing an outfit. I'm going to.
1682880	1687680	Yeah, but you're so. I want the pants to be right. Okay. I want to help you get the right pants.
1687680	1694000	I'm trying to get them right. We're going to get the right pants. All right. Of that we can be sure.
1694000	1698080	But I, my prediction is that you're going to go, this is going to. Stop miming eating.
1698080	1707360	I didn't know what else to do. Trying to. I think this is going to go the way of the eye
1707360	1712480	Harman or the last time you wore Einstein outfit where you wore your your powder blue
1712480	1716560	short sleeve tucked in button down shirt. Well, I want every kid out there listening
1716560	1723040	right now to listen to what Jeff's trying to do. What he's doing is called identity bullying.
1723440	1732160	Like if you decide one week that you want to be like captain EO, I'm trying to modernize the
1732160	1743120	reference. You want to shoot lasers and make people dance. If you go through a phase there
1743120	1747360	and you're like, Oh, I'm going to do this every day and then on Thursday, you're like, this is
1747360	1752720	boring. Go ahead. It's better to do it and get bored. I support all the way. Guys like this are
1752720	1759600	always going to be like, no, you got to hear your manufacturing confrontation. Don't listen
1759600	1767360	to him right now. He's he's going to tell you that you're manufacturing conflict. But what he,
1767360	1772880	what he, what he's trying to do by saying that is, is kill you and murder you. What Dan is doing
1772880	1778800	right now is apologizing for him wearing this, the, the Brundle fly out for two Harman towns
1778800	1791600	and then giving it up. Oh, I don't think we went to the outfit. Oh no. Oh no. The enemy. He's the
1791600	1798560	enemy. Like, like, like just follow your bliss. Follow your heart kids. You fall in love, fall in
1798560	1806720	love, love, love that person for two days. If you, if you don't love them for, for three days,
1806720	1814880	that's not on you or them. That's on God. I think, I think he brought me out too early is
1818080	1826800	let's send Rob off for a bit. We'll bring him out later on.
1831920	1834480	It was too early. It was too early.
1836800	1841680	Too, too early to bring our reps up. All right. I'm glad this happened because
1841680	1844560	to obviously tonight's about retooling the format of the show.
1846240	1848080	I'd like to bring Rob Shropp back out.
1852320	1858000	Because now it feels right. Now the timing is right. I want him to understand who's in charge.
1858000	1872000	I think it feels right. Rob, get up. Can you do a dance on this? Can you get up on top of the podium
1872000	1879200	here and do a little podium, man? I'm not going to get up on that. All right. Rob Shropp, everybody.
1879200	1889360	Thank you so much, Rob. Rob, you are welcome. You got any, you got any Lego spoilers for us?
1890160	1892720	Nope. All right. Rob Shropp, everybody.
1896480	1901920	There he goes. He's gone. Oh, he's leaving. No, he's staying. All right. See, I'm out of control
1901920	1907600	then. Yep. So the next time something goes wrong. What was the first moment you guys remember meeting
1907680	1911040	each other? Do you guys both have the same memory of the first time you guys locked eyes?
1912560	1919760	It was like it in the back of cults in Milwaukee. It's comedy sports probably. Or was it LA freeway
1919760	1930080	stand up? Yeah, it was a cult. Cult? He's probably there. I've been there. Oh yeah, you have been
1930080	1934160	there. I was there before. Yeah. After it was not comedy sports anymore, but I went there one time
1934160	1938960	with you guys. So what was the first time you guys met? What was the circumstance? Um, I don't
1938960	1944960	know. Just we were improv workshop. I don't, I don't know. Dan, you were like probably 18.
1945760	1956240	Seven, seven, 17, 17. I was 39. But I, yeah, I remember, yeah, I remember Rob being funny.
1958160	1963600	I remember when he was funny. The good old days. Yes, he was funny back then. Well,
1963600	1968880	I remember we, we, we, we, we did some improv exercises and then I remember you were
1969600	1974560	off. We were done with the workshop and you were sitting and then you had a bag of chips
1975200	1982400	and you had a soda and you were talking about how you had read that the chips had riboflavin in
1982400	1988160	them and that the riboflavin was a tenderizer and that it was designed the same companies
1988800	1993840	created the soft drinks and the chips and because the riboflavin tenderizes you.
1995920	2001760	And I don't think that's right. I think I don't think that's right. I don't think riboflavin does
2001760	2007200	that. Does anybody know what riboflavin does? Riboflavin, riboflavin does anybody? All right.
2008080	2011040	Well, that's not why I brought it up. That's what, that's my memory of you.
2012080	2016720	I didn't, I didn't think you were right. It's my memory of you. What was it? What was the first
2016800	2020960	moment when you guys connected and thought you guys could be like maybe friends? I remembered
2020960	2026720	like the first time I was about to do. That was a chair. That was a chair. What? That was a chair.
2029680	2035840	Dan farted from out there. It was a chair. Dan's blaming his fart on a chair. Sorry. It's a
2035840	2040240	terrible show tonight. It doesn't need to be a good one. It's pretty bad. It's $10. I'll give
2040240	2046480	you all your money back. It doesn't matter. Life doesn't matter. No. Just find someone you're
2046480	2058320	happy with. Just find someone you're happy with. Just find someone. Just feel around in the dark
2058320	2067040	and that's what I do too. I don't do the Seth Brundle thing. I get dressed. I get, I get up
2067040	2073280	before Kate does. So I get dressed in the dark. So that, that removes everything, you know. So I just
2073280	2079120	like oh okay this and that and then I walk out looking, looking a little, looking a little weird
2079120	2084320	sometimes. Do you ever wear like different the color socks and shoes? Oh god yes. For real. Oh
2084320	2091040	my gosh and it's crazy. Everybody goes wow who's this guy? Different colored socks because you
2091040	2096960	know how everybody looks at other people's socks. This is the shit that I would go through every
2096960	2102720	fucking Sunday morning with my mother you know and I would put on like white socks. You can't wear
2102720	2109440	white socks with dress shoes. I'm like who's looking at my socks in church? We're all sitting
2109440	2115600	down. I'm behind a pew. If they're looking at my socks maybe what we're listening to is fucking
2115600	2125760	boring. Hey that's a new commandment. Of the 11th commandment. Yeah. Try to be more interesting
2125760	2135920	than socks. Yeah right. Fix the air conditioning. At the premiere for Monster House,
2138480	2144640	because it's a Halloween movie, the invitation said where are your favorite Halloween costume?
2145200	2154800	And the only people that paid attention to that part of the invitation were Rob and his wife.
2156720	2159360	And some kid who dressed up as Jack Sparrow.
2162160	2166800	In order to get people to watch his Nickelodeon show. Right right. Like some kid that was like
2166800	2173360	oh I'm Jack Sparrow. Yeah so so Kate and I get up. So everybody is fucking Monster House world
2173360	2180080	premiere and everyone's like oh the house is a monster. Hello Mr. Zemeckis. Yes we did it.
2180160	2186160	Oh we did it. Next step Oscars and then Rob gets out of a limo. This is Tron. Tron.
2189440	2197920	It was a good Tron. Skin tight. Fucking wait. Hard on. Circuitry. Puffy paint circuitry.
2198960	2206400	Fucking Tron. Rob full on Tron. Was it Ram or Tron? It was Ram wasn't it? It was Tron. No I dressed
2206480	2212480	up as Ram. You guys don't know who I am? No it's. You weren't there. I think didn't you do Ram
2212480	2217920	one time with the red something? I think you're thinking of a different Rob. That was back when
2217920	2222240	you were triple Jim in it. You used to go to the gym three times a day and this motherfucker was in
2222240	2229200	shape. I was crazy. Yeah he wore tights for a living. All you wore was like was a body suit
2229200	2234400	at all times. Not at all times but I could pull it off. You did? Yeah. Your ass was like a space
2234480	2245040	helmet. It was fucking. It was a good it was a good ass. It's a great ass. Not that you noticed.
2248480	2255520	Now I did I went I went like we're in the limo. We're in the limo. I'm dressed as is Tron. Kate's
2255520	2261120	dressed as the tooth fairy and just before we get out I go you know something I bet you we're
2261120	2267600	gonna be the only ones dressed in costume. You're. Oh I'm right and we're getting our picture taken
2267600	2276720	and everybody's going excuse me excuse me this is the camera. Why are you dressed up? It says in
2276720	2289520	the invitation. And then we'd all go yeah we know. I didn't realize it's it's it's it's Hollywood so
2289520	2297280	you don't do stuff. No you don't. No it's a test. When someone says have fun it's a test. If you
2297280	2304240	have fun you're a fucking nerd. Yeah so we we want the red carpet and we get our picture taken and
2304240	2309280	then the next day we go oh gosh that's a first premiere. Let's go see it. We look online and go
2309280	2316000	oh oh shit shit. Oh Dan Harmon writer. Oh Gil Kennan director. Oh I guess it's Robertson mechanism.
2316800	2321200	And then Kate and I background.
2325520	2329840	Like background like you know when you go to a premiere and you have like hired people dressed
2329840	2334640	up as like idiots in the background. You're saying the image the image. The image of us
2334640	2339920	is a picture of us as a background. Oh no. It didn't say you said under yours it said writer.
2340880	2347600	Me background did not even Tron not even Tooth Fairy just background. Don't know why they're on
2347600	2356160	the red carpet. Don't know why they're Tron and the Tooth Fairy. They sure are smiling like I'm
2356160	2365360	supposed to know why they did that. Background for lack of a better word background. Spencer.
2366000	2371440	What what what what what what what what have you been doing. How about have you heard about
2371440	2381040	these Chinese murder vans. No OK. I have not told me. I've filled everybody in. They murder. Spencer
2381040	2389280	and I know what what is it. What is their angle. The murder is their angle. Is it vengeance. Are
2389280	2395280	they just going out randomly killing strangers. Yeah it's vengeance. OK. People who killed their
2395280	2404960	van parents. I read one article. Stock the streets. I'm picturing I'm picturing a Ford
2404960	2411280	O'Connell line bubble window van from the 70s. Like what kind of van are they. It's like one of
2411280	2417680	those. A lot more screaming. And do they do they kill you inside the van or do they jump out of
2417680	2423680	the van and kill you. They get back in the van. No. They kill you in the van. No. OK. Sorry. This is
2423680	2428240	a joke. I've talked about this before. No. The real the real the real thing that's been happening
2428240	2438800	in my life is Lord of the Rings. That's the real thing is happening. No no. OK. So I was I was on
2438800	2445120	the computer. I built a computer. No. Yeah. No. I know it's hard to believe Rob. That was on the
2445200	2451280	computer. I recognize that. I'm sorry. I'm sorry. I know where this is going. And I get a phone call
2451280	2458800	from Rob Schwab. Yeah. What did you say. I work my computer. No no no. No I'm driving in because
2458800	2462400	I worked at Legos. Oh you were driving. I'm driving driving and I'm going huh.
2464320	2471760	Like yo. Yo Spence what's up. So so I'm masturbating and I'm like I'm just you know
2472560	2478240	I'm just on I'm just on that internet. I'm on that Kotaku dot com. No no no go that we don't
2478240	2482640	we don't have the VR this just go ahead go ahead and explain. I'm just telling the people what
2482640	2489360	happened. Oh no you explained what's called me up. What's Kotaku dot com. It's just a website
2489360	2496080	that's not porn. But he's your guy. Yeah no. OK. That's what I tell Rob when he calls me when I'm
2496080	2500880	drinking. I got you. What site were you on. Oh no I was playing Minecraft. Oh Joe.
2503120	2510880	All right. Come on. OK OK OK. Let's get serious. So I go. I'm driving and I have a question. So I
2510880	2519920	called our dungeon master and I went hey why is it called Lord of the Rings when there's only one
2519920	2528800	ring. What I like. I don't and I don't understand that because as far as what I'm seeing and I've
2528800	2535360	read these four books in the books and stuff like that I go there seems to be only one ring one ring
2535360	2541760	and it's the ring of invisibility and Bilbo got it and then and then did the other rings do what.
2541760	2549600	Well well first of all where are they. And the first 15 seconds of the movie. Oh well the name
2549600	2557760	the fucking whole thing after it. Oh my God. Oh oh my God. I'm sorry. I must be mistaken. The first
2557760	2566640	15 seconds of the whole thing. No. OK. Name the whole thing after it then. If that's what the
2566640	2574080	story is about. If that's what the story is about. Oh it isn't. It's not what the story is about.
2574080	2585680	Right. OK. Hey. Let's call it. Let's call it King Kong. But there's only one King Kong. Yes but he had
2585680	2599920	a mother and a father. Doesn't make sense. So King Kong would be called like the Kong family.
2600720	2606800	I mean like he could say like I mean like think about the pitch like he walks into whatever bar
2606800	2613360	with C.S. Lewis and and and and there's there's fucking H.P. Lovecraft hanging out in the corner
2613360	2619200	and got who just got done with my my whole books. Oh man. What's it what's it about. It's called
2619200	2624640	Lord of the Rings. Wow. Oh wow. Is it about like a guy a lord who like finds all these rings and
2624800	2629360	then and then and then and then there's like it's like fighting over all these rings. No.
2631600	2637600	It's nothing to do with rings. It's just one ring. Well off to my my my why not just
2637600	2642240	after my series of 17 books that are all about lions witches and wardrobes.
2644720	2651120	Yeah. Hey it's more accurate than. But there's not even a Lord of the Rings like like I mean
2651120	2656960	presumably whoever made all those rings was a Lord of the Rings. But the story about him.
2656960	2662640	There's no but that person is like well he's the Lord of one ring. He he's talking about
2662640	2669280	he made all the right. I don't think so. I don't think movies were you guys watch. I'm pretty sure
2670080	2675760	all the ring. I'm pretty sure elves made all the rings gave them to dwarves. No three of them to
2675760	2682960	humans. No Sauron had a guy make all the rings they gave him to gifted them. Whoa whoa whoa whoa
2682960	2688000	Levy what does it say you're looking up on Wikipedia right. Steve Levy get out of Steve
2688000	2694960	Levy everybody Steve get out. I'm sure someone knows. This isn't this isn't a debate. No no no
2694960	2700240	it is. It is. It is. It is a debate. I'm taking it down and I'm going to win. It's not a debate.
2700480	2706400	No it is. What do the other rings do. They turn. Whoa here's the thing that pisses me off. Okay
2707600	2712320	my name is Sauron. I have this ring and now I'm really powerful. I'm going to do this thing with
2712320	2715920	the sword and everybody's going to fly all over the place because I did this thing with the sword
2715920	2720880	and I'm so powerful because I'm wearing this ring and then somebody cuts off my finger and it falls
2720880	2726560	down and blah blah blah blah blah and okay the Bilbo gets it he puts it on and turns invisible.
2727440	2733680	Why why why come on. That's always been fucked up. Sauron isn't invisible. He isn't invisible.
2733680	2738160	He's wearing this ring and he doesn't turn invisible. I would if I were to if I were a
2738160	2744880	little clunky. If I were to defend the mythology I would say that that the cowardice of of mortal
2744880	2751680	beings means that the most the biggest power that you would have if a ring of that power
2752320	2758080	uh imbued itself and you that the very first and foremost thing you would do before you could fly
2758080	2762800	or do anything that you would just be a creepy creepy invisible person that that but that's me
2762800	2768400	apologizing for a mythology that I agree is flawed however it's not the he made he had a bunch of
2768400	2772800	rings made the whole point was that he had all these rings made the ring of power is the ring
2772800	2777440	that like he controls all the rings all right he had a bunch of rings had a bunch of rings before
2777440	2785360	the story started okay good let's do three books about not that what does Steve have to say
2785360	2790240	uh well Spencer's right it was an elf right or something yeah here's what they did they killed
2790240	2795280	they killed Sauron and they went well fuck that guy had that one ring we need to have rings to
2795280	2800320	battle evil when if that ever comes back yeah but let's let's never let's never talk about him or
2800320	2804080	use him ever well let's just here's the first thing that comes up when you write who made the
2804080	2809760	rings in lord of the rings well i i know because i played the video game right yeah i met that guy
2809760	2818000	i worked for him spoilers met him i had lunch with him he gave me superpowers that were seriously
2819440	2825360	compatible with the warner brothers interactive game i'm sorry i'm so sorry hobbit is the only
2825360	2835440	good book do you hear that that's the sound of just failure yeah i don't care who cares about
2835440	2842160	books like no one says that you're like like like like right people hate books the back of a we're
2842160	2846240	in the back we're in the back of a comic book store not in the comic book store the idea that
2846240	2851120	the thing that threw you is that that that's all explained in the beginning they made a bunch of
2851120	2855120	rings and there was one ring to rule them all and in the darkness behind them the thing that
2855200	2861200	should throw you is that after three movies that span nine years it turns out all you got to do
2861200	2866720	to set things right is talk to green ghosts well that's not true that didn't insult go to a story
2866720	2872640	at all everything the green ghosts go
2873680	2878240	lord of the green ghosts yeah king of the that i would that i would agree that's a better title
2878240	2883680	lord of the rings there's there's only one green ghosts all right call it the ring movie can we
2883760	2889360	talk about vaccinations talk about aids hey do you guys like oh shit aids i don't like
2889360	2895200	aids prevention oh omaze omaze.com slash rick and morty go there yeah fight aids
2896080	2899520	enough with that that was a good plug oh wait we got one more plug uh uh
2899520	2908400	siso beta yeah go to harmen no okay go to siso beta enough of that everyone fight aids and watch
2908400	2914720	siso we'll do both can we get the beta code if you want to get on siso right now is harmen fan
2916240	2920480	harmen fan so i won't remember that what's available all the siso content parks and
2920480	2926240	rec a bunch of content yeah it's a good eventually harmen quest only one ring in the
2927120	2932240	yeah but there is no lord of the rings like the the elven king jesus christ it's obviously
2932240	2938080	fucking sauron will he only have saurons then call it sauron then call the call all three books
2938080	2951760	sauron dear jrr token you misnamed your book that in 2015 there's 90 movies about what what
2951760	2956800	did he do wrong hey yeah he named it wrong i mean if something's popular then it's right hitler
2956800	2968000	kaboom sauron kaboom yeah called it there you go lord of the rings there's so many things to
2968000	2972880	complain about okay i'm i'm reading the second one there's going to be hopefully at least another
2972880	2980000	ring coming up here there's no other ring there's still one ring he loves the rings he loves rings
2980000	2984240	that's why you watched the movie you love rings you knew you knew there were gonna be a million
2984240	2988080	rings i like i like the ring in the hobbit i thought it was oh yeah so you wanted a million
2988080	2992480	rings because it would be court of the rings you watch a million rings what are the other
2992480	2998320	rings you love rings you love rings you love movies about jewelry i like accurate i like i
2998320	3003840	like it be consistently yeah yeah yo you love logic that's why you want die hard to be called
3003840	3012560	uh guy in a tower but that's an accurate yeah no that'd be great meep my move no no no no no
3012960	3016960	i'm on your side i enjoy my movies die hard is a good title die hard is better than a guy
3018000	3020480	yeah but it's not die hard a lot
3023280	3026720	well here's the thing he doesn't die hard in the movie
3027760	3033200	he fucking lives he stays alive yeah forever yeah well that all of the series are called
3033200	3039280	die hard he hasn't died yet it's hard for him to die it's a he's a hard dire it's a hard die
3039280	3046400	hard dire would actually hard dire see i love die hard as a title but die harder is a better
3047600	3056880	hard die hard dire yeah what's that he's like a die hard like something like people yeah he's
3056880	3063520	a die hard i'm a die hard liver yeah he's the badass no he's the die hard yeah yeah
3063520	3067760	oh yeah there was a there was a battery a car battery they probably still have them called
3067760	3072720	die hard yeah that kind of excited that you were so passionate that you would cry that out
3073680	3079840	are you that big a die hard fan oh okay and now no no i don't know where to go with you
3082000	3087520	my mom are you a fan of yelling things out or bruce willis or john mctearnan or
3088160	3093760	i'm a fan of making people believe what i want them to okay so you're so you're a witch you're
3095120	3100320	or a hypnotist all right well do you have powers of persuasion
3103840	3111760	no you don't i found out at the same time though i was you know how old were dan you're you know
3111760	3118800	about the same age how old were we when die hard came out was uh i was 24 all right i was 15
3119760	3124640	so then i was 14 or 15 and i my mom and i were really in the die hard together because i'm just
3124640	3131680	slightly out of you uh my mom was really in the die hard and every time i came on tv we'd watch
3131680	3136880	it together and i loved die hard but i found out like the third time he watched it that she just
3136960	3145840	had a giant boner for alexander good enough the blonde bad guy you know i want blood yeah
3146720	3151360	not dissimilar from nick manning pussy juice on dick
3154240	3158000	do you watch that guy's porn because you enjoy him as a character or because what's happening
3158000	3164800	is sexy wait okay it has to be both like like like why why why i think in a world where there
3164800	3172960	do you enjoy him as every second that we're sitting here another five thousand pieces of
3172960	3180000	porn are made right um we clearly if you took one step back from our species and looked at the media
3180000	3185120	we create as as you would with the honeybees making whatever they make and don't say honey
3185120	3191120	don't say honey they make wax they make wax if you took a step back and looked at what we create
3191120	3200560	media wise you would go these people love porn they make a lot of it per second so the question
3200560	3206080	the answer to the question was i watching nick manning to like hear them make fun or to get
3206080	3212720	turned on it's like i bathed in it i fucking open up i'm like give me what you got and he's like
3212720	3217840	he he didn't say drop and loads and i'm like i yeah i eventually came
3217840	3226320	but you like him as a like he i don't like him you don't like him i don't know him but
3226320	3231360	i this he might be conservative i don't know him he might be like dropping loads we should
3232240	3238000	tag muslims i want to drop a load on each muslim that you can read at an airport
3239680	3245360	what is rob doing here rob is getting complicated i'm getting comfortable because he's sitting
3245360	3250160	like he's doing this he's about to tell us something about our high school experience
3252960	3257840	hey yeah i've done some drinking i've done some drugging
3260080	3266560	it wasn't that cool i'm telling you kids you got to read what's going on on the lego lego too
3266560	3270800	what what do you need what do you ask me any question i'll tell you the absolute truth uh
3270800	3277200	have uh uh uh uh uh phil and chris uh stepped foot in the building sent in the last year
3277840	3281840	absolutely yeah okay every day all right is fire style in the next movie
3284480	3293760	yep you sound like my mom yeah is that fire style gonna be in the movie no wild style i think you
