start	end	text
4812660	4816820	angle and i'm just joking but um i've always wanted to do the greek play the greek because
4816820	4820340	there's no bad seeds the thing i know but the thing is it's like that just capacity wise it's
4820340	4824100	only like six thousand it's it's pretty small but i heard as meal diamond said it's where
4824100	4829140	it's where great musicians get to go to when they die like it's that that's the place to play okay
4829140	4833300	supposedly it's a very satisfying like place i feel like it would be a lot of fun but i heard
4833300	4840020	that it's kind of quiet is that true no i mean i mean i've i've seen a lot of shows there and i've
4840100	4843860	been in the in the front and i've been way in the back and it's it's it's pretty tasty audio there
4843860	4849300	fucking noted yeah although but then again i don't know like for rap because it's in a
4849300	4854180	residential neighborhood up there it's on black is not gonna work yeah i'm scared yeah the property
4854180	4860740	values are going to go down the the the next show's tickets will be lower price it'll be like two
4860740	4869060	dollars a pop no john tesh two dollars what happened oh a black show delhi parton looked
4869060	4874340	out you know the song jolene you know jolene jolene jolene jolene it's a great song all right
4874340	4878980	she doesn't know that much she looked out of the crowd and she goes you know i i i don't mean any
4878980	4883060	offense but i'm looking out at my audience and i know my audience when i come to hollywood
4883860	4890100	but i really i would like to sing the first verse of this as drag queen drag queen at four thousand
4890100	4895700	of the six thousand people stood up they were all drag queens really oh yeah it was it was draggy
4895700	4901300	as fuck it was real good it was really draggy delhi plays every instrument in the fucking building
4901300	4905460	she plays the horn the piano like the violin really oh yeah guitar she plays everything
4905460	4910180	i didn't know that delhi puts on a program that's how i saw delhi parton it was on hannah montana
4910180	4914580	because my wife was making me watch it that's what i was telling you in the green room is my
4914580	4921540	my lee syrus i heard yeah like like she because billy ray was billy ray uh i don't know contemporary
4922180	4928900	she hung out a lot uh and so my lee syrus cites dolly parton as like a early like kind of
4928900	4934340	mentor inspiration she tells the most inspirational sad beautiful heartwarming story about when i
4934340	4938100	forget the name of the small town that she grew up in but it's quite small and i don't even remember
4938100	4944020	the state tennessee where's she from tennessee and uh and her father was real down to earth real
4944020	4951060	like just good you know well-meaning like moralistic father and when she got really famous they
4951060	4955780	erected a big statue in the center of town of dolly and he kept saying to her like don't let this
4955780	4959540	go to your head you're still dolly you're still the girl from a small town like don't ever let this
4959540	4964260	become who you are like like this that statue doesn't mean anything and she's like yeah but
4964260	4968820	it's like it's my statue like like i made it dad and she's like yeah but like don't get a big head
4968820	4973140	about this she found out many years later that in the middle of the night he would go out and
4973140	4978820	clean the bird poop off her statue damn that's awesome what a good story i wanted to hate him so
4978820	4985460	bad no i wasn't bored i was fucking lost in fucking family rage i was like that fucking asshole
4985460	4991860	i hope this ends with him dying i was like no you what you were seeing was when you go at my
4991860	4995620	therapy exercises i was like he loved that statue more than anybody else because it was this little
4995620	4999140	girl and he wouldn't let any bird shit on her it was fucking great all right well let your little
4999140	5005220	girl think she's bigger than your so what were you gonna ask me before i pissed i took a piece
5005220	5009380	oh well yeah tell me about when you you say you're gonna make an album now which is a dying art
5009380	5013780	because like when we grew up albums were a thing that they were the story got told or even if they
5013780	5017860	didn't mean to tell a story they would arrange the songs in a way that if you could play a record
5017860	5022900	from front to back on on the first side and flip the tape or flip the record or whatever like you
5022900	5027700	were going through this journey so like you're if if you're one of those people you bring in your
5027700	5034020	weed uh on the if it was a like total concept album would fold it open and you could clean your
5034020	5039140	weed because you pinch it up here and the seeds rolled down into the middle so logic so when
5039140	5048980	you're making an album like how do you approach that and also is there like do is that's that's
5048980	5053300	where you think the market is right now that you think that people know the market's 100 million
5053300	5058660	percent not into the album the market is into singles and eps and fucking get you know make
5058660	5063220	as much money as you can as quick as you can and and once again that's where i had to defy the odds
5063220	5072260	i mean even with my last album it was a rap album about space but i mean like think like imagine me
5072260	5079220	walking into deaf jam okay like deaf jam and being like yeah so i got this cool idea about like space
5079220	5087780	and rap how's that and they're like what and i'm like yeah are there any are there any there's a
5087780	5094100	lot of amazing stories throughout music history of one person one of the few great artists loving
5094100	5099060	a record uh producers like label people that would stick their necks out and say no we need
5099060	5103220	to we need to make this record because this is going to be important and the top of you know the
5103220	5107460	head of capital records said no nobody wants to buy that shit but it ends up being Dave Brubeck's
5107460	5112260	take time out you know the biggest jazz record of all time that nobody ever wanted to make are
5112260	5117380	there still people that you think do they even exist in the record industry that would stick
5117380	5122180	their necks out and support an artist doing that no just because there's no money in it no it's not
5122180	5126420	that it's like you know who supported me was my manager but he's also my best friend so i'm signed
5126420	5130900	to an independent visionary music group and through that we we did uh we did a partnership
5130900	5135460	with idj which is then which is deaf jam which is then universal is this whole fucking matrix
5136100	5141300	um and and yeah i mean we we had to defy a lot a lot of the odds you know there was a lot of things
5141300	5144580	that they were like yeah we don't want to do this so we don't want to do that and we were like
5144660	5149300	fuck you gonna do it anyway right and we did it and the reason but the reason we had that leverage
5149300	5153620	is because of the things like the mixtapes my man's checking twitter because i'm just kidding
5153620	5159380	i'm joking the moment the moment the guest turned the store to me dan checks right the fuck out
5159380	5165380	nice but no that's obviously that's my luxury i'm sorry i'm visible that i i was checking on
5165380	5169460	our sponsor to see if uh what the fuck we're supposed to say about their product nice
5169460	5176100	i wanted you guys to be doing what you're doing it was good it was a good opportunity for me to
5176100	5180500	look at this i'm sorry i just yes i don't even know what we were talking about we're talking about
5180500	5185620	the album making process yeah um so is your next one can you say is it is it going to be another
5185620	5191060	like thematic it is it is it's boe-esque if you start this journey into there is a huge theme
5191700	5196100	i'm really excited about it i wish i could give you the title now but i can't is it called crumb
5196100	5201540	rumblers because that would be fun now you know what i will give you the title to my next um
5203140	5207860	well well looks like there's a harmontown exclusive here there's a real thing because
5207860	5211300	you know what because everything that we've been talking about i think i think it'd be great and
5211300	5216580	and you know it's not too crazy it's just the title um before i give you the title i want you
5216580	5221540	to know that it is a uh a word uh that i created i formed i formed no it's not that word
5221540	5228900	naz did that um but it's it's it's a it's two words that i put together and basically
5228900	5234740	the definition of it is the cultural evolution of man uh from scientifically proven the first man
5234740	5241620	and woman from africa and then how over time uh culturally evolving into a you know lighter and
5241620	5247540	lighter and much more fairer skin so the album uh is going to be called africarian and it's no
5247540	5252020	real shit and it's about it's about me being black and white and seeing life from from two
5252020	5256500	sides and once again about that cultural evolution and how you can go from the darkest of skin to
5256500	5260260	the lightest of skin or the aryan brotherhood if you will who believe that they're pure of blood
5260260	5265700	when at the end of the fucking day we all have you know that that in our blood and we all have so so
5265700	5270580	many different uh ethnicities in in our blood no matter how pure we think that we are and that at
5270580	5276260	the end of the day life should all be should be about uh peace love and positivity and equality
5276260	5280820	for all every man woman and child that walks the earth and and that's what i'm saying on this
5280820	5288340	entire album i'm gonna buy that record i'm gonna buy that record here here exclusive yeah
5290820	5296420	i definitely i i think what you're saying is that humanity could use a good shave
5300260	5305060	and uh and and and they need to understand that they need to stop thinking that they need to
5305060	5310980	choose between price and quality to get an amazing and affordable shave um that's like
5310980	5317060	legit like that's what the fucking album is yeah exactly that is like exactly what it's
5317060	5320980	damn i'm sorry to interrupt but you you're not talking about dollar shave club are you
5320980	5327460	wait well oh oh no i but are you speaking are you talking about dollar shave you're you're
5327460	5332340	certainly talking to their language yeah i mean it sounds like you're talking about maybe
5332340	5337140	my favorite place i just read in my texts about well if you call dollar shave club
5339060	5345380	which part which line well dollar shave club.com delivers amazing razors right to my door where's
5345380	5352980	the camera hey for a third of the price of what the greedy razor they really wrote that wait wait
5352980	5359860	wait guys logic damn bad pitch let's just let's just kill timbers once don't let logic keep the
5359940	5363940	text there okay can we put a beat on and maybe try to wrap this shit well can i have your phone
5365940	5371140	so that we have our talking points and we can like dollar shave club and and if you're listening
5371140	5375860	and you're and you gave us money from dollar shave club we'll we'll we'll back clean up at
5375860	5379700	the end of this experiment and we'll we'll just we'll just tell everybody about i mean
5379700	5382820	hit the points but let's let's put a beat on before you get peed on okay
5382820	5396100	uh yo yo yo yo yo yo yo when you shave you want to save you don't want to spend you want to mend
5396100	5402980	dollar shave clubs bringing quality i'm talking about equality between the bearded and the clean
5403860	5405940	i saw your mama i'm gonna be saving
5421940	5425140	here's your chance to see why over three million members
5425140	5428980	love dollar shave club okay that's okay go dollar shave club dot com
5429620	5437140	dollar shave club dot com dollar shave club all day long dollar shave club dot com yeah
5438180	5444660	we're shooting like a movie matter of fact we're shooting like a oozy the executive blade that
5444660	5451540	sounds like another blade prequel yo gradually give yourself a tassel don't deal with the drug
5451540	5458180	store hassle just go to past the checkout lines go home and wait for the shave to be delivered to you
5462660	5471460	word yeah yeah yeah yeah whoa yo yeah just try the executive blade it's a it's a product they
5471460	5476820	have it's gonna make your face made like the mafia made joe peshy when you shave with this
5476900	5483380	you're gonna look heshy it's a new word that means clean shaving
5488980	5495780	dollar shave club is confident in the quality of their product thing you can get your first
5495780	5501620	month for free yo you don't even have to give them pee just pay shipping just pay shipping
5508420	5514660	after that after that few bucks a month no hassle no just just a few bucks a month
5514660	5519380	no long-term commitment no hidden fees except the shipping fees
5526500	5534500	yo yo yo yo go to dollarshaveclub.com slash harmontown you're gonna turn the thing that's
5534500	5540180	hiding your frown upside down and then off your face put it in the basket take it to a race
5540980	5547380	black white need to get together tickle your skin like a feather oh you're so soft i don't know
5547380	5554340	you're ethnic what i thought you'd take it i thought you'd take it from there you know
5554340	5559940	what i'm talking about you're actually you actually offended logic then you offended like
5559940	5565140	both of my face my phone went my phone went dead time i thought you'd take it from there
5567700	5575940	okay all right the dollar shave 100 pennies it's not a lot you got beard on your face and collect
5575940	5582180	snot clean that shit off with the knife that comes on a handle all your life you're gonna
5583060	5589940	feel younger and more executive i don't reckon you give yo yo
5591860	5596980	dollar shave club dot coms where it's at where it's dollar shave club dot com wear a hat where
5596980	5604100	it's dollar shave club dot com make a swat make a swag club what's bats doing in here
5604900	5615300	batman motherfucker oh i'm batman batman and robin yo i'm batman batman yo yo
5615300	5622500	like to switch it up yeah bat rap it's the full house shaving bat rap yo check it i'm
5622500	5627700	about to fucking rap it's bad i gotta get it like that this is how we do it gotta shave my face for
5627700	5633460	saving grace this is how we do it man part done i'm about to chill with my homegirl dolly parton
5634180	5638660	yeah bring it back again this is how we gotta do it when we're knocking them
5638660	5643860	i don't even know what the hell i'm saying so i'm gonna pass it to my man don't be playing yo
5643860	5652340	with your life i'm saving i my face i'm shaving i can't turn my head so you know when i shave i
5652340	5658180	don't like to spend bread it's a dollar shave club is where it's at it gets sent to the bat cave and
5658180	5664660	that's where it's at so i use it on my face and i go out and i save people i prefer to think of all
5664660	5674580	race but i have had some criticisms but i would blame that on crime i'm not going to do quota vigil
5674580	5685620	answers and that doesn't get us anywhere i had white parents they got killed got killed yo
5686500	5693220	they got killed got killed when that parents got killed that was ill it was ill to kill my parents
5693220	5699940	before i had my parenthood filled when i'm just like a bat you think you know that it's all about
5699940	5705220	that but i just want to put fear in the hearts of enemies i fucked your mama so hard she's now a
5705220	5713060	friend of me yo i made her pussy go wide and batman's inside a little robin pulled it out
5713620	5719940	gave him a costume and said run about be my sidekick help me fight crime we're not gonna stay in the
5719940	5742180	cave and bust some rhymes with logic logic fat man logic so i think it's always good showbiz
5742180	5745460	advice when you have a professional rapper on stage to do most of the rapping yourself
5750740	5754420	the uh look let's let's clean up some details i think we covered most of it
5757460	5761540	there's still more bills to pay but it was it was the idea the general idea of that rap which i
5761540	5768340	think came through is that like price and quality they don't need to compete it's like if if if you
5768340	5774100	know you're a biracial rapper how much are they paying us for this wait no no no how much are
5774180	5781300	they paying me because we're gonna kick start your fourth this next album you've got that
5781300	5784980	the one after that your next album has to be all about shaving i get that dali part and feature
5784980	5792500	though pricing quality you know don't don't let them compete you can get quality for a low price
5793380	5797460	and get an amazing and affordable shave and you know take my word for it
5797460	5810340	and the c shaves a lot i shave i shave constantly um show me your glistening balls
5812020	5815140	right yeah yeah that's that's no that's dirty you need to be shaved
5818180	5822900	you did not just go to their girlfriend oh my goodness balls so much with dollar shave club
5822900	5829540	that i need me undies to cradle them right or i'd get like cotton burns no those two companies
5829540	5833060	are total rivals it's like pepsi and coke they're their own but they work so well together that's
5833060	5839060	like telling me doritos and and and and and and taco bell don't get along come on have you met
5839060	5846340	them that was witty uh that was great i mean come on they got the doritos locos that was a great
5846980	5855060	that was a great joke dollar shave club.com is the answer swag yeah and to prove it they're
5855060	5859300	gonna give you your first month free to join the club seriously we're gonna hear about that shipping
5859300	5868100	fee later dollar shave club.com offers amazing razors right to your door for a third of the
5868100	5873300	price of what the greedy razor corporations charge big razor you've heard a big razor
5873300	5879140	uh you don't have to deal with the drug store i mean who wants to go to the drug store just
5879140	5882900	because you have hair on your face i mean i let you go down to the drug store to hear some uh
5882900	5888900	some tunes in the jukebox and get a phosphate don't stay away from the pool hall and the yeah
5888900	5893860	don't go don't go down there anymore to get your razors like uh don't don't do that but old man
5893860	5899460	johnson he he's run that drug store on my corner for 50 years he's a he's a piece of racist shit
5899860	5905140	he he built he that that that drugstore was built by slaves
5907380	5912020	what you know you're groaning your own country no it's true my yeah i heard that just go to
5912020	5916820	dollar shave club.com and pick a razor that works for you from their lineup of amazing blades
5917780	5918820	that's all there is to it
5920740	5928340	amazing blades how sweet
5931700	5932340	the shades
5932820	5939860	that shaved a beard like these
5942260	5953380	nice i once had a beard but now i shaved
5953380	5962420	a twice dollar shave club that shaved my face
5970100	5976660	left a good job in the city so so you get your first month for free you sign up for
5977540	5981540	you just pay shipping after that it's a few bucks a month the long longest ad
5983380	5989060	you can shave faster than this ad get yours dollar shave club.com slash harmontown there is
5989060	5993300	no promo code you guys were texting me to do the promo code the promo that you go to slash
5993940	5998100	dollar shave club.com slash harmontown you got to do it like the guys in the commercial that are
5998100	6006500	like super fast yeah okay did you hear it now on radio ads they actually speed it up with the
6006500	6009060	fuck so it's like it's actually you're just listening to this ridiculous like
6010020	6014580	like no yeah it's crazy they used to have to get that micro machine guy you don't know what i'm
6014580	6021940	talking about dan dan is a really good impression of the uh was it the chef chef motor mouth chef
6021940	6027620	lightning lip what what is that what is that lightning lips is a entertainer who's now gonna
6027620	6032580	double his youtube hits wait wait wait what does he wait what does he do what doesn't he do
6032580	6040820	he he he he he says food fast so do you know i have the lightning lips yeah did you know this
6041620	6046180	i well i mean that's kind of sounds weird but well maybe you need to demonstrate it okay
6046180	6050500	i'm gonna demonstrate how many foods can you say as fast as it's not about foods but it's
6050500	6054660	about description so i have a song called gang related where i'm rapping about my brother
6054660	6058500	and and the things that he went through and a part of it so it goes where he's basically
6058500	6063540	talking about being in the streets but it goes get down or lay down hit you with the beretta you
6063540	6068500	better stay down straight sides at the playground living how i'm living with the life that i'm given
6068500	6072660	anybody that's riding with me i'm riding with them show me the enemy and i'ma hit them the second i
6072660	6076260	bid them i get them and hit them with the venom and don't need to pretend i'ma never do it i
6076260	6080180	knew it already been through it i do it for the street for the fam for the life anybody that's
6080180	6084580	gang related and when i do it on stage i say in one breath get down and lay down hit you with the
6084580	6086980	beretta get better stay down straight shots in the playground living how i'm living with the
6086980	6089300	life that i'm giving anybody that's right i'm with me i'm riding with the show me the enemy and
6089300	6091940	i'ma hit them the second i bid them i get them and hit them with the venom i never do it i knew
6091940	6094500	what i've already been through it i do it for the street for the fam for the life anybody that's
6104500	6111060	shave but logic you logic you uh you brought a knife to a gunfight because you haven't heard
6111060	6120180	dan do chef i'll tell you like i when i talk about oh when i talk about uh life in the streets
6121460	6128900	like one thing that i'll say is i know i know you're a brother but i know another and i have
6128900	6136500	a brother that's another um that doesn't get his druthers because because society is trying to
6136580	6142180	smother the brother that's another with with with that doesn't that doesn't that doesn't get get
6142180	6147620	what he wants but when i'm when i'm on stage sometimes i go a brother with another guy comes
6147620	6154660	you go but then i'll but then i'll stop and go starting over yeah a brother with another
6154660	6159700	second some other yeah i i mean i'm sure when you do it's not it's like so fast yeah that you can't
6159700	6172820	even register a brother but she's so quick micro machines uh i gotta but uh well here's my
6172820	6181140	serious question so when you when you do something like that is that so in that instance are you
6181940	6185700	when you do you think phonetically when you're writing you obviously you must go when you're
6185700	6189620	writing lyrics you go i think this is something a lot of people don't understand
6189620	6196420	that only you and i get is that it's not about like it's that it's not you don't just go like
6196420	6200740	oh i'm gonna rhyme the word milk so then i'm gonna say silk at the end of this actually it's
6200740	6205860	like no so that's like the entire time so i yes i studied uh i studied obviously like
6206420	6212580	the dictionary and the thesaurus as a kid so you know it's just like um like living given you know
6212580	6217540	just like these words that that's jeremy piven jeremy piven you know what i mean but there's but
6217540	6221540	there's a difference between just saying some shit so i used to i i have this thing where i i
6221540	6225460	kind of have fun with it so basically that's a real thing you guys heard me say it and it's
6225460	6230020	kind of depicting this you know street lifestyle that this that this guy is living and i'm
6230020	6234660	preaching to not live that way and and not have to deal with that but then there's fun ones so
6234660	6239460	like i could do little freestyles and be like yo what's l-o-g-i-c chilling in l-a from m-d the
6239460	6243540	second i get it you know who we be right and then there at the end i'll end it and be like
6243540	6247780	because i'm ripping and living like like almost like some jack the river i said i'm ripping and
6247780	6251460	living and striving the killer the ripper he's calling what goes when he flow and this is where
6251460	6255140	it's all just kind of syllable and just fun calling what go when he flow and you know he's pursuing
6255140	6259380	it doing it moving it grooving it stopping it right like oh like just kind of flexing and having fun
6259380	6262900	but when i say it back really fast it's just ripping it a little bit it's dropping a little
6262900	6265060	rippy calling what going flowing you know he pursuing it doing it moving it grooving it
6265060	6267060	stopping the rocket it's talking to walk it up flipping it ripping the motherfucker screwing
6267060	6269940	it i'm ready to go and i buy it then break it roll it then lick it and smoke it choke on it later
6270420	6274580	but what this is it's like a roulette wheel yeah totally it's like price is right
