start	end	text
1222640	1226080	It was like this, this dude who like hacks into people's Snapchats and it's
1226080	1227800	just like, yeah, Pussy Springs or something.
1227800	1230840	Like he just does this, just he'll just like tweet the most random shit or
1230840	1234360	whatever, but I always wonder like, how does like somebody go, I'm going to
1234360	1237840	hack this person shit and like Jack into the fucking matrix, man.
1237840	1238960	That's like so weird.
1239240	1241120	I just see that codes, like those green codes.
1241120	1243760	Like when I think of some guy like, yes, I'm going to destroy your soul.
1243800	1244120	Yeah.
1244240	1244560	Yeah.
1244560	1245680	So yeah, I know.
1245800	1249360	Well, that's what's terrifying about like, uh, well, that there's so much
1249360	1253560	crossover with the guys that can do that and the, and the alt right and stuff.
1254040	1258960	You can, cause you can just like, just by being a human being that has feelings,
1258960	1263600	like you and your politics, if you stay on publicly, you could end up like, you
1263600	1268160	know, being an example that gets made, like people will find some serious shit
1268160	1273200	on my, if you hack my stuff, like I make an easy fun target, like, like
1273760	1276960	everyone, even my fans want to see me go down.
1276960	1280280	Like that's, that's part, that's part of what they enjoy.
1280280	1282520	Like they show up here to watch me fail.
1282520	1285960	Like it's about the shape of my head or something.
1285960	1287720	Like, I love watching you go down.
1289680	1290520	Nice.
1290600	1294640	Uh, but you, you, you, uh, you were born, you're from Maryland.
1294920	1295160	Yeah.
1295160	1298200	Originally I'm from Maryland, which is near DC for those of you guys who don't
1298200	1301920	know, because usually I'm like, Maryland people are like, what, where?
1301960	1303320	So yeah, East coast.
1303320	1303920	It's a state.
1304400	1305080	It is a state.
1305080	1305560	It is a state.
1305560	1306360	It's a very small state.
1306360	1308080	We're known for crabs, but not the sexual kind.
1309480	1310840	Uh, that's Baltimore.
1315360	1316200	Fuck Baltimore.
1316200	1316560	I'm sorry.
1316560	1318880	The fucking Baltimore is a piece of shit.
1318880	1319440	So that's good.
1319480	1319920	That's good.
1319920	1320640	Maryland humor.
1320640	1323560	And if it wasn't for the Baltimore, for Baltimore, we wouldn't have the wire.
1323880	1324400	That's true.
1324400	1325040	Really awesome.
1325040	1325240	Sure.
1325240	1328000	Or, or a Poe, a Grelin Poe.
1328000	1328400	Indeed.
1328440	1330960	I did not know that now I can claim that shit, son.
1331040	1331360	Yeah.
1331400	1332040	I didn't know that.
1332640	1334240	But what, what, what part of Maryland are you from?
1334600	1336040	I'm from Gaithersburg, Maryland.
1336080	1337360	Um, in Montgomery County.
1337400	1341320	And, uh, I was born at Shady Grove hospital at 7 36 AM.
1342000	1344840	By the way, that was the first time someone's in a city and nobody clapped.
1345120	1345440	Oh yeah.
1345440	1346920	I'm from Gaithersburg motherfucker.
1346920	1347480	Come on.
1349000	1352120	Um, no, but yeah, it sounds nicer than what Wikipedia in your
1352120	1354520	childhood section, uh, says it is.
1354560	1355400	You know, it's crazy.
1355400	1358700	So I grew up, so I grew up, uh, section eight household welfare, food
1358700	1361620	stamps, all that stuff, uh, to a black father and a white mother.
1361660	1364260	And I'm biracial, but look very white, obviously.
1364860	1370140	Uh, which can be really, yes, which can be, uh, very, very confusing.
1371580	1373420	But, uh, Dan's half jealous right now.
1373700	1374500	Half jealous.
1378420	1380020	Um, yeah, man.
1380020	1381860	So I grew up there and, uh, it's weird.
1381860	1385420	It's one of those places where it's like on the outside, it kind of like looks
1385420	1388620	really beautiful, but then you like take a left and you're like in the hood.
1388700	1391460	Like you're in like a really fucked up, fucked up area, which is kind of anywhere.
1391460	1394140	I mean, anywhere in the world, there's good places and there's bad places.
1394420	1398460	And me, I, um, I'd never really tried to glorify any of the negative shit.
1398620	1399380	Would you like a drink?
1399620	1400300	Uh, I'm okay.
1400340	1400580	Thanks.
1400580	1405580	I drink scotch swag, but I just, I only just started drinking.
1405580	1406940	I only drink a little bit here and there.
1407580	1409700	Well, someone just got fired because we brought this out for you.
1409700	1410300	I never drink.
1413660	1417940	This water, but yeah, so, so I grew up, I grew up there and, um, and it was, it
1418020	1419740	was not that great.
1420380	1422780	It was like, was it, was it like bad neighborhood?
1422780	1425820	Like, like, did you feel, did you feel it?
1425820	1428100	Well, it says, it says that your mom and dad were,
1428140	1429660	they were both drug addicts and alcoholics.
1429660	1433900	So my, my, my father was addicted to crack cocaine and my mother, she was, she
1433900	1435220	was addicted to pills and alcohol.
1435580	1439260	So I never actually had a father in my life, which is really hard.
1439260	1443260	And then also all my brothers and sisters are not to get all fucking deep.
1443260	1444700	This is supposed to be like really fun.
1445020	1447540	You think they come here for my fucking cookie game.
1449020	1452740	This is why they're, you saw, you saw how high the bar was when you came out.
1453340	1455220	And it's not for my hilarious standup either.
1455220	1458300	And so it's, no, no, no, go deeper, go home.
1458620	1459060	Mr.
1459060	1459580	Logic.
1459620	1464900	It was, uh, it was, it was really, it wasn't necessarily, um, about where
1464900	1466420	I live, but my actual household.
1466420	1469980	So, uh, all my brothers and sisters, they're all black and they all look
1469980	1471300	black and have black features.
1471540	1473300	And once again, I'm the only one who looks white.
1473460	1476460	It was very hard to identify when you're raised in a black household
1476460	1477140	with a white mother.
1477140	1480300	And the crazy thing is that my mother was also extremely racist, which
1480300	1483220	sounds weird cause it's like, how's this racist shit gonna like fuck all
1483220	1485820	these black dudes, but like, that's what happened.
1485860	1489180	I don't know how it happened, but that's what happened.
1489180	1493100	I mean, all, all men hate women and look how many people we have together.
1493140	1494900	Like we managed to work it out.
1494940	1496580	Yeah, it definitely works.
1496580	1496740	Ms.
1496740	1500740	Logic, was she racist across the board or just?
1500780	1501460	No, you know what?
1501460	1505220	It was, it was one of those things where I think obviously like, I mean, it was,
1505260	1507660	it's a, it's a, it's a very confusing thing cause some people will be like,
1507660	1508820	well, that doesn't fucking make sense.
1508820	1510460	And I'm like, yeah, I know.
1510460	1513460	Like I had to live that way, you know, and grow up and like, I'm really, and
1513460	1516220	she was super like Bible thumping, like Jesus freak.
1516380	1518660	And I'm, I'm, I'm a very like open guy.
1518660	1519620	I'm an open-minded guy.
1519660	1522900	I'm the type of dude that's like, I believe in equality for all race,
1522900	1525540	religions, color, creeds, and sexual orientations, like period.
1525700	1527860	And if you want to argue and fucking kill each other, you do it over there.
1527860	1530980	I'm just going to like chill and watch Rick and Morty and fucking like
1530980	1531460	be real shit.
1531460	1532460	Like I'm just going to have fun.
1532820	1535860	Um, so, but she was like total opposite.
1535860	1538860	And I always think like, I don't know how I didn't become a Satanist,
1539060	1541260	like just to spider, you know what I mean?
1541260	1543180	But, um, but I, it's never too late.
1543580	1544180	That's true.
1544780	1545420	That's very true.
1545700	1550380	Um, but yeah, no, so I think it stemmed down with her family because I know that
1550380	1552260	her side of the family was very racist.
1552260	1555900	So like my, my grandparents would never let me like come over and I'd always
1555900	1556620	be like, Oh, please.
1556620	1557820	And they'd be like, no, the guest room.
1557820	1559180	Cause they were balling and we were poor shit.
1559180	1560660	They're like, the guest room is not available.
1560660	1562060	And I'm like, Oh, I'll sleep on the couch.
1562300	1563420	And they're like, Oh no, the couch.
1563420	1563700	No.
1563700	1564900	And I'm like, Oh, I'll sleep on the floor.
1565140	1566220	And they're like, no, I'll get out of here.
1566220	1566860	You fucking neighbor.
1566860	1569380	So finally you found it.
1569380	1570500	You feel all right.
1570500	1571780	Well, let's just, we buried the lead.
1571820	1575020	Yes, but anyway, so that was like confusing.
1575060	1575220	No.
1575220	1575660	What were you going to say?
1575700	1582100	Well, was that like, like, if you're, if you're, your siblings look more black
1582100	1588060	than you and you're in a biracial household, you're getting it from both angles.
1588060	1590500	You're not, you're not black enough to be black.
1590500	1592340	And you're not white enough, like, you're not.
1592860	1593540	It's really weird.
1593540	1596060	It's, it's, that's what I had to deal with my whole life.
1596060	1600060	And then leading also into my career because I, you know, like literally being
1600060	1602740	a, being called a nigger by your own mother and then going to school.
1602740	1604580	And then people are like, you fucking cracker white boy.
1605460	1606420	And it's like, what?
1606740	1607500	Oh, shit.
1608420	1609660	The fuck's going on.
1609660	1610100	You know what I mean?
1610100	1612420	Like, I better become a successful recording artist.
1612420	1616780	Yeah, like some shit better go down with a built in audience of zero.
1616780	1623380	People just keep accusing you of co-opting your own culture.
1623420	1623900	Yeah, I know.
1624420	1625220	Going back and forth.
1626180	1627180	But, but that's what I did.
1627180	1629580	I just focused on music and it was very difficult.
1629580	1633180	And so, um, and you had to focus on logic, not to be corny about it.
1633180	1636420	But I was, you said you really, you, you like Dirk Diggler.
1636420	1640260	You thought long and hard about your, your name, how you arrived at like
1640260	1642660	psychological and then, and then shortened it to logic.
1642660	1645340	But I think the, you know, well, you know, I'm babbling.
1645340	1645900	You're doing fine.
1645900	1646380	Keep talking.
1647100	1650020	But, but it's, it's like, like, like, yeah, I mean, that would, what,
1650020	1651340	what other recourse do you have?
1651340	1655180	I think that's where, I think by the way, that's where, that's where good hip hop
1655180	1657260	and like nerd culture totally overlap.
1657260	1661340	It's just nerds are like, wait, how am I, it's not, it's not equitable.
1661660	1665580	I don't want to make that, that, that, that crime, but like nerds
1665580	1667140	always draw that analogy.
1667140	1671300	It's very, it's like, like, wow, you're getting it from all angles.
1671300	1674780	Like you don't know, like that's, and that's why we get into like
1674780	1677860	Spock and like, like Star Trek and sci-fi.
1677860	1680060	It's something to escape in and that's what I used to do.
1680060	1681060	So I love video games.
1681060	1682620	I'm a huge video game guy.
1682620	1685340	So I love like Last of Us and Uncharted and like those real games you can like
1685340	1687700	jump in and just engulf yourself in.
1687700	1691260	And I used to play those, those games to escape and to like run away from my life
1691260	1692260	and not deal with it.
1692260	1695300	And then through that, as I got older through my teenage years,
1695300	1697780	I realized that I could do that with music and like truly write.
1697780	1701420	And now here's the real crazy thing is like, so my mom is like this super Jesus
1701420	1703540	freak crazy racist white bitch, right?
1703540	1709260	But then on top of that, on top of that, I'd like be writing raps, you know,
1709260	1711580	to try to vent and talk about these things.
1711580	1714700	And she'd be like, don't you curse, God damn it, motherfucker.
1714700	1715780	So she was also that.
1715780	1719420	So it was very, it was very suppressive and like it was very difficult.
1719420	1721660	But I worked through it and I worked on music.
1721660	1726580	And then when I was when I was 16 or 17, I left I left the house because it was
1726580	1728180	just so it was just so horrific.
1728180	1728860	It was so bad.
1728860	1730820	She was just like on so many pills.
1730820	1733580	And I got two jobs to support myself.
1733580	1735700	And I worked those jobs for a long time.
1735700	1738420	And it was one in one in the morning and one at night.
1738420	1742620	Unfortunately, I didn't graduate high school because back then I just I just
1742620	1743660	there was so much going.
1743660	1745140	I mean, I've seen my father smoke crack.
1745140	1745860	I've been kidnapped.
1745860	1749380	I've seen my mother, you know, get beat by men and my sisters were raped
1749380	1752980	and my brothers were in the street selling crack, even sometimes to our own father.
1752980	1755260	So it was a lot of crazy shit that I was seeing.
1755260	1759300	But every time I was like, this isn't right, I knew that it wasn't right.
1759300	1762500	You know, and that's where I think everybody else and I'm not going to say
1762500	1766820	necessarily failed and I'm not going to try to highlight my family and say the right
1766820	1768620	or wrong that they did or who they went to become.
1768620	1772220	But I think that's what what it is, especially within the inner city, you know,
1772220	1777980	in different places where, oh, OK, if I go work at McDonald's and I make five
1777980	1781940	fifty an hour or I can go sell crack and make five thousand dollars in a day.
1781940	1785460	And it's really fucked up and it's really terrible and it's really horrible.
1785460	1789100	And when I saw this, I was like, OK, well, don't beat women, don't sell crack,
1789100	1790340	don't do this, don't do that.
1790340	1793020	What you need to do is you need to write about it and you need to tell the world,
1793020	1795700	you need to tell the youth that are coming from where you're coming from,
1795940	1796900	you know, to get out of that.
1796900	1799980	And so that's that's what I did and are what I tried to do.
1800180	1802860	And pretty much you were good at it.
1802980	1807460	I was I was sure a lot of people are like, I'm going to I'm going to rap about this.
1807700	1814060	Yeah. And then they're like, yo, yo, yo, yo, fuck your mama.
1814060	1816900	Crack more like more like bad rock.
1817700	1819500	Don't smoke it. You've got to poke it.
1821540	1823180	Yeah, so that was my best friend.
1823180	1826780	I was I was I was doing a voice like I was imitating a bad rapper.
1826780	1829860	But my secret was I was rapping as good as I could.
1831740	1834900	Nice. I'm actually going to go home to the logic.
1834940	1838780	I was pretty good. Are you a free style or two or are you mostly a writer?
1839540	1841740	Honestly, I write and I love to write.
1841740	1844940	But I think that any person who raps should have fun and freestyle.
1845940	1847220	Yeah. How does it how does it free?
1847220	1850660	I always I'm so I'm always so confused about freestyling because I when I listen.
1850660	1853660	Oh, you've made that very clear.
1858420	1861420	When we when we
1862500	1867420	when people are freestyling, like whether it's in a it's in a biopic movie
1867420	1871660	like Eight Mile or this feels fucking eight mile like be rabbit right now.
1872460	1875180	I can't even see like people pass like the second row.
1875180	1877940	This is crazy. Oh, fuck you, Doug.
1877940	1882940	But are the people I assume it's like like if you freestyle a lot,
1882940	1886300	then the more you freestyle, the more arrows you have in your quiver.
1886300	1890500	I like you're also like a one thing you're like phonetically
1890500	1892820	engineering your mind from an early age.
1892820	1896300	Like for you or a child, you were like you were drawn to hip hop.
1896300	1899220	I feel like Eminem was like like he was like a savant.
1899220	1904060	Like when when his first album came out or what it was like, like it's
1904060	1905100	it's all about studying.
1905100	1908220	So like if you really want to do so like a lot of rappers go,
1908340	1910100	yeah, I'm going to get these bitches hoes.
1910100	1912220	You know, I'm saying these chains and shit, dog.
1912220	1914620	And then it never works out.
1914620	1918020	And it's the people that actually say I'm going to turn this into,
1918020	1919500	you know, I'm going to make this a business.
1919500	1920660	I'm going to be a walking company.
1920660	1922820	And I'm going to first and foremost do it because I love it.
1922820	1924500	But I'm going to fucking make something out of it.
1924500	1927020	And that's that's what great the greats did.
1927020	1928900	That's what I'm doing my best to do.
1928900	1932340	Well, now it's even harder for you, harder slash easier in a sense.
1932340	1934340	I mean, like I guess everything just changed.
1934340	1939900	But like you're the I you're the second Wikipedia article I've read.
1941180	1947860	It's that it sounds it sounds so similar to The Weeknd, who I love that guy.
1947860	1948900	That's my homie.
1948900	1952380	And was like, it's like, oh, you look at it's like the parallels are it's like
1952380	1955980	it's this is the new career path is you have to be a ninja and like make yourself
1955980	1957780	out of nothing like you don't get to.
1957780	1961780	You have a mentor in your in your development, but and you have a record
1961780	1965460	label that comes along, but not before you build yourself out of dirt without
1965460	1969220	permission completely like you and the weekend just came out of nowhere.
1969220	1972660	And you have to release these mixtapes and but they're not tapes anymore.
1972660	1975780	They're digital and these kids are with their pants are so low.
1979460	1981100	But and it's and it's got to be lonely.
1981100	1985940	And it's got to be like, how do you that's the age old question.
1985940	1987460	Everybody in Los Angeles is always asking.
1987460	1988980	How do you know when you're supposed to quit?
1988980	1989740	How do you know?
1989740	1992500	And I always say, but it's a very convenient answer.
1992500	1994220	It's easy for the people that they're asking.
1994220	1999820	They're not asking the people that say, oh, damn.
1999820	2002060	Well, yeah, I thought about it that way.
2002060	2002940	Holy shit.
2002940	2005740	Thank you for asking me that question.
2005740	2009660	There's there's never a writer's panel for failed writers.
2009660	2016500	You know, like people come and they go, how do you know when you should quit?
2016500	2020260	And I always say it's easy for me to say, but it's like, I do believe this.
2020260	2025700	Like, well, you have to you have to really believe that you wouldn't let that
2025700	2030060	you would do it for free and that and that if you did it for 20 years and then
2030060	2034100	got hit by a bus without ever having an amount to paying your rent, that you
2034100	2038460	wouldn't go, oh, man, I wasted 20 years that you'd go, that's pretty cool.
2038460	2039100	I got to write.
2039100	2039940	You loved it.
2039940	2040900	That's a big part.
2040900	2045460	You know, and I think I think for me, I'd probably be like dead in jail or
2045460	2046300	addicted to drugs.
2046300	2047140	And that's what I saw.
2047140	2049140	And that's a fucking Debbie Downer.
2049140	2050460	Wah, wah.
2050460	2054180	But like legit seeing that, I was like, oh, shit, son, got to write these
2054180	2058580	raps, dog, like, I can't not after having written about all that childhood stuff
2058580	2059900	and how you grew up.
2059900	2062780	I mean, are you, are you, have you gotten all that out of your system?
2062780	2065260	Or is there still is there an endless trove of stuff to write about?
2065260	2066180	Question.
2066180	2066500	Okay.
2066500	2068980	So you have to soon start rapping about your gardener.
2068980	2074260	No, this is, this is the thing is your second album ends with like, and that's
2074260	2077180	what I had to say, mom about Coke.
2077180	2080740	And then your third album starts and it's like, stop interrupting me at dinner.
2080740	2083860	I'm trying to eat with my wife.
2083860	2085500	It's just a message to fans.
2085500	2086660	Yeah.
2086660	2089060	Yo, my wife is like totally with that.
2089060	2093340	Every time we go out, cause I'm like, I'm like so nice because I just can't, I just
2093340	2096700	like, but sometimes I'll be eating like, yo, okay, today.
2096700	2097460	No, it's real shit.
2097460	2098660	I love my fans straight up.
2098660	2099660	Love my fans.
2099660	2102900	I'll do anything for my fans except like sexual stuff.
2102900	2106620	But like, so I was at, uh, Hey, you said you're an open guy early.
2106620	2107620	I know.
2107620	2108620	Yeah.
2108620	2109620	Turns out you're a fan of phobe.
2109620	2111180	Uh, no, so I, no, no, no.
2111180	2116780	So I was at Fry's electronics today and so I get there and there's a lot of like young
2116780	2118260	Hispanic males working.
2118260	2119260	And those are a lot of my fans.
2119260	2122340	I have a lot of Hispanic males in Los Angeles, California.
2122340	2126660	And uh, any you'd like to give a shout out to shout out my boy Jose and Juan.
2126660	2127660	Those are real people.
2127660	2128660	I'll three.
2128660	2129660	Yes.
2129660	2130660	Um, no.
2130780	2135140	No, but so, so just being there and like, Oh, it's like, you know, some people notice
2135140	2137020	and you know, some people would be like, Oh, Hey logic.
2137020	2138020	I really like your music, man.
2138020	2139020	And they fucking keep it pushing.
2139020	2140380	I'm like, Whoa, that's so cool.
2140380	2147780	Cause typically how it goes is, Hey, demo suck dog, yo, you're on my fucking Snapchat.
2147780	2148780	Say what's up.
2148780	2149780	And it's not even like, Hey, how are you?
2149780	2150780	Or like shaking your hand?
2150780	2151780	Like legit.
2151780	2152780	It's like, yo, can I take a picture?
2152780	2153780	Like, fuck dude.
2153780	2155780	You're gonna like buy me dinner first shit.
2155780	2156780	You're just gonna fuck me.
2156780	2157780	You know what I mean?
2157780	2158780	Like I'm serious.
2158780	2162060	I'm so down to have a conversation and hang out and whatever the case may be.
2162060	2164260	But it's usually like, what can you do for me?
2164260	2169540	There's been times where I've like, I've done a show, had 103 degree fever, uh, was out
2169540	2170540	back.
2170540	2172980	Like, I know this sounds gross, but like throwing up and puking my brains out after the show
2172980	2176740	because I was just so sick from doing 45 cities in a row.
2176740	2182140	And fans are like, Hey, and they throw it while I'm throwing up or like taking selfies
2182140	2183180	with me.
2183180	2186100	So there is a negative side to it as well.
2186100	2189380	Um, but like today I got followed in the bathroom while I'm taking a piss and some
2189380	2191540	dude's like, Hey man, uh, need me to shake your dick.
2191540	2192540	No, I'm just kidding.
2192540	2199500	But he was like, but he's just, I apologize.
2199500	2203060	It's like, you gotta let some shit go, man.
2203060	2205120	The weird thing is that he didn't say anything.
2205120	2207700	So it's a guy who works there and he just walks in.
2207700	2212780	He's just like staring at me and like, you know how sometimes, uh, guys, uh, in the urinal,
2212780	2217860	you can like see on the, like the, with the metal fleshy thing handle, uh, the reflection.
2217860	2221980	And I just see this dude just kind of like staring at me and I'm like, this is so fucking
2221980	2222980	wrong.
2222980	2226620	And then I turn around and wash my hands and I'm like, so is this guy going to say anything
2226620	2227620	to me?
2227620	2228620	And he like, does it say anything?
2228620	2231980	And I, and I fucking leave and it was really awkward.
2231980	2233380	He might've just been a murderer.
2233380	2234380	Yeah, maybe.
2234380	2235380	Yeah.
2235380	2236380	You never verify it.
2236380	2237380	Yeah.
2237380	2242660	You might've been like, I have no idea, uh, do you find, okay, I'm going to, I'm going
2243180	2254420	to, like, I hit there was a, there was a point when I had enough people, uh, um, in like
2254420	2259260	to my surprise go, uh, I know who you are.
2259260	2260580	I like what you do.
2260580	2263100	I'm so happy you're alive, et cetera.
2263100	2269820	The validation that, that I hit, there was a tipping point where I feel like I internalized
2269820	2274020	it to a point where I can live off of it.
2274020	2275020	It hasn't been cut off.
2275020	2279060	So I don't know how big that tank is, but then I kind of like, I have this self-awareness
2279060	2286180	that that doesn't like, it didn't make me taller or more handsome or, or a better person
2286180	2287700	even that I did this stuff.
2287700	2293780	But because those people say the things that I always wished the people would say, which
2293780	2297380	is why I wished I would be, I don't want to never wish to be taller, more handsome, but
2297380	2301140	I understand exactly what you're saying that I, that it's like, I hit like this wizard
2301140	2302140	of Oz.
2302140	2304980	You, you could have gone home anytime you wanted like tipping point where it wasn't
