start	end	text
2304980	2305980	a bad thing.
2305980	2307060	Like it was all a lie.
2307060	2312980	It was a good thing that it was all a lie that it was like, Oh, I now know how my body
2312980	2321540	feels and my brain feels when I assume someone in the room is, is, is amazed that I'm going
2321540	2323020	through this TSA checkpoint.
2323020	2327340	See that's why I always, and it makes me less cranky and like, like it's, it's like this
2327340	2331260	weird, like I hate admitting that because it's like kind of a douchey thing, but at
2331260	2334860	the same time it's like, I wish I could give that bill to everybody.
2334860	2335860	That's fucking awesome.
2335860	2338380	And I know what that, I know what that feels like.
2338380	2343380	But I always do my best because here's the thing, like, especially with hip hop and like
2343380	2347420	the younger generation, everybody thinks other people think they're the shit.
2347420	2348620	That's gotta be really extreme too.
2348620	2349620	So that's what I mean.
2349620	2353580	So I always do my best, like once again, treat everybody equally and with respect and kind
2353580	2354580	and introduce myself.
2354580	2357620	Not even like, yo, I'm logic unless it's like a professional setting like this and
2357620	2358620	I'm backstage meeting people.
2358620	2359620	I'll be like, Hey, I'm logic.
2359620	2361020	Or if there's fans, I'm like, Hey, I'm logic.
2361020	2364780	But like when I meet you, so just, you know, anybody, I'm like, my name is Bobby.
2364780	2365780	That's my fucking name.
2365780	2366780	I'm not gonna be like, yo, something logic.
2366780	2367780	And they're like, what?
2367780	2368780	What?
2368780	2369780	Yeah.
2369780	2370780	You know what I mean?
2370780	2374340	So, but what I'm saying is, is, is, can I, can I talk you right there?
2374340	2375340	Yeah.
2375340	2378820	Because I, I was, I was checking into a hotel with my girlfriend and it was like, like in
2378820	2379820	Beverly Hills.
2379820	2381460	My hotel name is Mike Hawk.
2382460	2383460	It's a real thing.
2385460	2386460	Yes.
2386460	2390660	We were going from the lobby to the elevator and it was like, there was, there was this
2390660	2394660	like giant dude and I guess it's important that he's black, but I don't see the world
2394660	2395660	through that lens.
2395660	2401260	But, but it was like, he had a, he had a baseball cap on, like he, he definitely looked like
2401260	2405580	he belonged in a Beverly Hills hotel, but at the same time he got, cause like his clothes
2405580	2410060	were all new and like he, but he was full of all this weird energy and he was like dragging
2410060	2414340	a bunch of bags on a, on a cart, but there were, it was like, and it was like, he just,
2414340	2418380	he was a really big dude and I was like, I was like, and then he like, he came out of
2418380	2424580	the elevator and he just called out to someone that I couldn't, and he was like, yo, sneaks,
2424580	2425580	sneaks.
2425580	2427260	Like he was just yelling for sneaks.
2427260	2428260	Sneaks?
2428260	2430020	And I, and I, I was just like, just, just play it cool.
2430020	2432100	And I got in the elevator and then I was just like, to my girlfriend, I was like, do you
2432100	2435860	think sneaks is famous or do you think that guy is like way out of line?
2435860	2440020	Like, like, it's just like, like sneaks, like what if sneaks is just a friend and
2440020	2445900	like is the, is the, is the hotelier, uh, go, going like, God, geez, these guys, they,
2445900	2451380	they just come by and one of them's named sneaks and they, they're just so loud or,
2451380	2455380	or is sneaks like a Grammy winner and which, and why is that okay?
2455380	2458740	You know what I love about you, Dan?
2458740	2461300	Is that I always interrupt you with a perfect story.
2461300	2462300	I love that.
2462300	2469100	Like, dude, you're like fucking crazy, man, and you make me feel good, bro, cause I love
2469100	2474460	the way you think, man, because I think about the craziest shit all the time, bro.
2474460	2475460	Like you know what?
2475460	2476460	Let's talk about last night.
2476460	2477900	No, two nights ago.
2477900	2480380	And I was at my house hanging, playing pool with my buds, right?
2480380	2483420	We promised that you wouldn't talk about this.
2483420	2486860	I'm a bit of a pool shark.
2486860	2490580	And so I'm walking and I take my, I take my dogs outside and I have a new, a new little
2490580	2491580	puppy.
2491580	2492780	His name's Panda.
2492780	2493780	What's the breed?
2493780	2494780	He's a little corgi.
2494780	2495780	He's a corgi.
2496780	2498780	I got a puppy named Panda.
2498780	2499780	Oh, what breed?
2499780	2500780	It's a Panda.
2500780	2501780	Boo.
2501780	2502780	I just wanted to repeat that joke.
2502780	2503780	It's funny.
2503780	2504780	Piggy has a Panda.
2504780	2505780	Nice.
2505780	2506780	I have a Panda.
2506780	2507780	Wicked.
2507780	2512780	And, and the, the, because he didn't even give it a real name.
2512780	2513780	All right.
2513780	2514780	All right.
2514780	2520140	Well, the other dog, his name is Philip, Philip J. Frye.
2520140	2521420	We call him Frye for short.
2521420	2522420	Yes.
2522420	2523420	Kuchirama.
2523420	2524420	Let's go.
2524420	2525420	Fuck yeah.
2526060	2527060	Sure.
2527060	2528060	Johnson.
2528060	2529060	Jojo.
2529060	2530060	I have no idea.
2530060	2531060	Yeah.
2531060	2534100	So anyway, so we're walking and it's nighttime and I see this, this, this snail with a fucking
2534100	2539740	big ass shell and I'm walking past this snail in my backyard and I'm like, whoa, snail.
2539740	2540740	That's crazy.
2540740	2543800	I hope like one of my dogs don't eat this snail.
2543800	2546660	And so the first dog comes out and sniffs it and I'm like, no.
2546660	2547660	And he's like, oh shit.
2547660	2548660	All right.
2548660	2549660	Cool.
2549660	2552420	So he walks on by and then the little puppy who like doesn't really know, know yet.
2552420	2554420	So I'm just like, rah.
2554420	2555820	And he's like, oh shit.
2555820	2556820	Okay.
2556820	2557820	Cool.
2557820	2558820	He keeps walking.
2558820	2559820	I'm like, man, I wonder what the fuck that snail's thinking.
2559820	2560820	You know what I mean?
2560820	2561820	Like, like real talk.
2561820	2562820	I'm like legit.
2562820	2563820	I'm thinking like, man, like, does he even understand?
2563820	2564820	Does he know how close he came?
2564820	2566420	And I'm like, wow, this is so crazy.
2566420	2568020	And I'm like, I gotta, I'm serious.
2568020	2569020	Okay.
2569020	2572940	And I'm like, I gotta make sure this fucking snail is okay because he's in the middle of
2572940	2576460	the sidewalk in my backyard and I got to make sure that like he makes it to the grass.
2576460	2580300	So I'm like posted and I'm watching my dogs and then everything's cool.
2580300	2581300	My wife's walking by.
2581300	2582300	I'm like, Hey, watch out.
2582300	2587300	You know, people coming by and then my buddy six comes out and I'm like, yo, there's a
2587300	2588300	snail.
2588300	2589300	Watch out.
2589300	2591300	And then crunch.
2591300	2593140	Yeah.
2593140	2596020	So anyway, I'm like, yo, does this snail have any kids?
2596020	2597020	Like what the fuck?
2597020	2598020	You know what I mean?
2598020	2600300	But this is like real shit that I think.
2600300	2605020	So when you go off on such a just sales market, snails marry for life.
2605020	2606020	Are you serious?
2606020	2607020	Are you?
2607020	2608020	No, I know.
2608020	2612260	You know what I always worry about with snails is that they're, they're dead.
2612260	2619220	And that's must be horrible because they're like, they're like, what was this shell for?
2619220	2623540	Because it's like, what is that for?
2623540	2626540	To protect them from warrior snails.
2626540	2628120	I guess it's effective that way.
2628120	2633260	Like if a snail tries to kill you, having a shell is like fucking whoa, he's like Batman
2633260	2635500	because it's like, it's thin as a, like a fingernail.
2635500	2636500	It's like so thin.
2636500	2640540	I mean, when you, when you do, if you've ever had the displeasure of realizing you've stepped
2640540	2644540	on a snail, it's like, I mean, those, it's like, it's like, Jesus Christ, the, the thing
2644540	2651940	that it bought to protect itself, it turns into a thousand knives.
2651940	2653980	I guess that's, I guess that's us in cars.
2653980	2658300	I mean, like, like, like, we're just driving around in fucking pieces of glass that are
2658300	2662540	temporarily in one piece, like whizzing them at each other.
2662540	2663940	I never thought about that.
2663940	2666820	And now you've given me like 80 million more things to think about.
2666820	2667820	Thanks a lot.
2667820	2668820	Yeah.
2668820	2669820	I appreciate it.
2669820	2672580	I mean, there's a lot of snail stuff out to keep snails out because I guess there's,
2672580	2673580	isn't it like salt?
2673580	2674580	Yeah.
2674580	2679660	Well, the snail stuff is it's, well, there's no, that's for slugs, like hardcore, okay.
2679660	2680660	Slug stuff.
2680660	2683500	It's like, but somebody told me, it's like, you know, they're not eating that and it's
2683500	2684500	poisoning them.
2684500	2686460	It's like, it's like little to, it cuts them.
2686460	2687740	Oh, that's fucked up.
2687740	2688740	Yeah.
2688740	2693460	See, this is like the microscopic, like fucked up world of like earth and all the shit that
2693460	2695020	happens behind the scenes.
2695060	2701140	But then our producer, Dustin Marshall told me that acetaminophen, the reason why it's
2701140	2706380	a fast acting ingredient in drugs or something is it has little molecules that are, that
2706380	2707860	cut up your stomach.
2707860	2709460	So it gets in your bloodstream faster.
2709460	2710460	Well, that's fucking gross.
2710460	2717180	And I was like, man, this fucking kid, Dustin, you don't know yet.
2717180	2718180	He's fucked up.
2718180	2721620	Like that's the only reason I want to live to a healthy old age because I want to see
2721620	2723260	how fucked up he is at 40.
2723260	2724260	Wow.
2724260	2725260	Nice.
2725260	2728300	Because he's like, he dresses like Beetlejuice.
2728300	2733940	Like he's, he's got a, he's got a whole podcast network that used to, that used to be like,
2733940	2734940	okay, he's got a podcast network.
2734940	2736340	Wait, is this the guy I met?
2736340	2737340	Yeah.
2737340	2738340	Total Beetlejuice.
2738340	2739340	Yeah.
2739340	2741340	Look, don't say it one more time.
2741340	2743340	Don't say it one more time.
2743340	2744340	You got it.
2744340	2745340	You got it.
2745340	2747340	Fucking be right out here.
2748340	2751060	It's like Marilyn Manson, Beetlejuice.
2751060	2752060	Oh shit.
2752060	2753060	It was great.
2753060	2756740	No, I don't mean that in a bad way.
2756740	2757740	He comes in.
2757740	2758740	He's really nice.
2758740	2760540	He looks like he's about to kill a rock album.
2760540	2761940	You said Beetlejuice a third time.
2761940	2762940	Oh shit.
2762940	2768860	You thought, you thought like Marilyn Manson was my uncle or something.
2768860	2772860	Uncle Manson.
2772860	2774540	I got to watch you work recently.
2775540	2780500	I was so impressed just like, like, not like I have a bunch of hip hop artists to compare
2780500	2786180	it to, but I was impressed as a creative because you're so young and you're, you've had your
2786180	2787180	own success.
2787180	2792620	So, and I'm sure the lesson you've learned is that you know best and that you're, that
2792620	2797540	you'd have that Steve Jobs like Loeb would be inflamed, which is not a bad thing in my
2797540	2798540	opinion.
2798540	2808740	It's like, oh, I got to, sometimes the curse of genius, my friend, is non-collaborative.
2808740	2813660	You're like, you have a healthy like fear of other people.
2813660	2818140	See, that's what I've learned from my predecessors, both in comedy, because I love comedy and
2818140	2822340	I think, I think like the parallels between comedy and like rap is like, it's the same
2822340	2823340	shit.
2823340	2825100	It's all about punchline and timing.
2825100	2829700	And for me, I've always been very open because I know what I know and I know how to rap and
2829700	2833340	I know how to do this and I know how to perform and I know, I know that and nobody can tell
2833340	2835200	me how to do that the way I do it.
2835200	2838860	But the things that I don't know, I go to the people that do and I just, I just shut
2838860	2839860	the fuck up.
2839860	2843540	I was like 39 when I figured that out.
2843540	2845300	So I guess you're more talented than me.
2845300	2846300	No, no.
2846300	2850220	It's not a competition, you piece of shit.
2850220	2851940	But no, I was, I was very impressed.
2851940	2855700	Like you can tell, yeah, you're an old soul and or there's no such thing as old souls
2855700	2861660	and you were the son of the drug addicts in a horrible political racial situation.
2861660	2862660	Nice, wicked.
2862660	2865540	You were forced to become Vulcan and wise.
2865540	2866540	Logic.
2866540	2871740	But that, I'm assuming that could easily make you more combative and isolated and autonomous
2871740	2872740	and all this stuff.
2872740	2877380	But I was like, like you, the reason we met is because he's working, he did a little thing
2877380	2884860	for season three of Rick and Morty, which it's not even a spoiler because like you'll
2884860	2890700	know you won't remember this conversation in 2019 when it comes.
2890700	2897460	We're a little behind schedule, but there's an I won't spoil the specifics of the episode,
2897460	2901780	but it was like great that Justin knew you and like you came in and it was like, I didn't
2901780	2905660	I figured you were a cool guy or like you wouldn't be coming in in the first place,
2905660	2911180	but I didn't expect what you came in and you you worked in front of us, which is like
2911180	2917500	it took me so long before I could I could I used to like I wouldn't be able to write
2917500	2921900	on airplanes because if someone might next to me might be watching my process.
2921900	2925900	I could let a little and then when I started doing community as a hit show, I did for NBC
2925900	2928420	in 2009.
2928420	2934980	I went through a period where it took me it took me time to learn that it was okay to
2934980	2939860	sit at a keyboard with a screen and have other people looking at the screen while I
2939860	2945540	was like deciding what someone should say like that was like the equivalent of watching
2945540	2948340	me masturbated poop like like like I get it.
2948340	2949340	I totally understand.
2949340	2953900	I don't know how you say Dan that you're watching him work was he came in and like I had written
2953900	2960020	a shit like a like a rap for a thing and like like it was like placeholder lyrics is like
2960020	2964140	let's get it but you just came in and from top to bottom kind of looked at it welcomed
2964140	2969660	it found a tempo for it found a beat for it started going through the lyrics and then
2969660	2975420	changing them adapting them to give it basically a better you know like it was like it was
2975420	2980860	like the scene when Mozart is meet soliari and like and it's like oh that thing and it's
2980860	2984780	like he starts adding that's what you're doing which is what we wanted but it's like to do
2984780	2985780	it in front of us.
2985780	2990300	I thought it was and you weren't showboating you were you were lifting us up and like there
2990300	2996340	was no there was no brain of you being like you know what maybe just let me like are you
2996340	3000100	saying that like you looked at it that you you generate your own beat right on the spot
3000100	3003980	there but no what happened was and I'm not gonna get to I won't give anything away but
3003980	3008940	basically yet like like Dan said and it was really cool to think like damn I wrote some
3008940	3012420	shit with Dan Herman like that was like so cool like first of all just walk in the room
3012420	3015980	and it Justin's there and Dan's there and everybody's just being super fucking cool
3015980	3018620	and this is the first time I meet this guy he's like yeah motherfucker blah blah blah
3018620	3025020	he's like we're doing all these raps and I'm like whoa all right this is my kind of
3025020	3030420	party so you know so there's this like template and it's you know it's all this like really
3030420	3034620	fun stuff and things that have to do with the episode that wouldn't make sense without
3034620	3039940	him kind of writing it first because how would I know you know so he does these things and
3039940	3044460	then what I did was as I go okay well let me see what would be a good BPM for this beats
3044460	3048780	per minute how fast the song is okay and then I went on YouTube and got like a template
3048780	3052620	beat if you will just something fun I was some tribe called quest and so I got that
3052620	3058780	and I threw it on say what what song God lives through yeah which is one of my one of my
3058780	3063540	favorite beats by them so I did that and I kind of caught a vibe and I caught it and
3063540	3067220	then I basically took what he did and then and then rearranged it and then added things
3067220	3071820	and took things away and and you know we came to came to a good place but here's the thing
3071820	3080500	the reason why I think I could do that is because unlike I don't want to put this people
3080500	3084640	who didn't necessarily grow up in like the Twitter era you know what I mean I had to
3084640	3090140	do everything in my career in front of the world right which was hard you know because
3090140	3093540	once again there's people like I mean even in fucking rap I mean think about going my
3093540	3097300	whole life being like you fucking you're white or black or this or that or you're not this
3097300	3100820	or you're not that then you go to hip hop which is predominantly black and you're I'm
3100820	3106980	like hey my brothers and they're like no and then I got you a whole album about my
3106980	3112500	life and they're like okay kinda and I do a second album and really bring it home for
3112500	3116340	the brothers and they're like all right you're cool you know I mean so it's like it's like
3116340	3125940	don't go in that house oh I thought you were a movie I don't know I I don't know what I'm
3125940	3135340	doing so that was just fine I was grandpa sleepy logic I was just imagining all black
3135340	3144460	people saying things and hey I was I was adding to that what's up child grits it's cool I'm
3144460	3153060	black yeah yeah yeah it was great so I was impressed by that and and yeah and you're
3153580	3159340	so so but you were impressed with my rap writing obviously this is a real thing like like I don't
3159340	3163540	know if you're doing like a bit I was actually impressed with the wraps like it was so cool
3163540	3166340	I thought something was interesting it was a make a good segue because this is something
3166340	3169940	that I would ask you regardless of this had come up in that conversation but it's one of the first
3169940	3177340	things that came up is because I was I was going for authenticity with my with my template rap it
3177340	3186900	was festooned with the n-word I didn't know I hadn't I didn't know I didn't I I guess I kind of
3186900	3193260	so basically what happened was by the way it was a word nigga all over this shit right and I come
3193260	3197620	in and I basically I tell him this I was raised in this household this is a word that I use them
3197620	3203140	or it's just it's it's a part of the culture it's hard to explain but within my music I never
3203140	3213900	used this word unless it is what's unless it's hilarious unless it's commentary yeah exactly
3213900	3219540	unless it is it is a fool it is a true representation do you understand so it's being used to discuss
3219540	3226660	the issue that's a real thing or if it's part of the conversation that's happening maybe or
3226660	3231100	kind of something like that but it's like it all right just just understand like I've always had
3231100	3235620	a rule that until people know and understand because it's just it's just a word that's in my
3235620	3239380	vocabulary growing up in a black household having all black family and friends and it's just it is
3239380	3245580	what it is vocabulary and I didn't see there's a difference though it's like you're not a racist
3245580	3250940	man you're you're you're a writer you're a comedian like you use this to write so I try to live it up
3250940	3261980	monopoly games yeah but yeah so I basically was just like and showers are boring and and you
3261980	3267260	always you're always looking for a new thing to call your your your your friends and like all
3267260	3276500	right anyway it's just okay all right leave it leave don't take it there because what I like
3276500	3281900	about it is like there's this the dichotomy of bad word good word use the word don't use the word
3281900	3285340	it's all preference it's all preference and there's like and this is where we gotta get
3285340	3291780	racy no I'm just kidding okay terrible joke anyway so no but like it's all it's all like
3291780	3297020	you know there's things that my mentor said that you never argue about you know like race religion
3297020	3302260	politics you know just there's there's certain it's it's at sports it's like a thing that there's
3302260	3307060	no right there's a resolution yeah you exactly so it's like almost with that like here's how I feel
3307060	3313220	about the word and if you know when I go to concerts and I see the majority of the demographic
3313220	3317340	who are attending concerts they're all white so it's like if it's like Wu-Tang Clan ain't
3317340	3321460	nothing to fuck with nigga blah blah like whatever it's like don't get mad at the kid like you put
3321460	3326700	it in you know you put it in the song and they're they're reciting the song and they love you and
3326700	3330620	they're paying to see you it isn't a racist thing you know I mean there it's not from that place
3330620	3335980	anyway so me I just don't like to fuck with that in general so I was just like yeah I'm not gonna
3335980	3344740	say that and he was like cool right long story short I expected for I I context that's what I was
3344740	3349620	gonna say it's all about context like when I when I explained like my mother being racist or like
3349620	3353100	on the on the on the album that I'm working on I won't super get into that but like I'm wrapping
3353100	3359140	from the perspective of you know a black man who told me that I wasn't shit but a white boy and he
3359140	3364780	was like you're just a white boy nigga which is like so but no it's really funny cuz it's so like
3364780	3371340	that doesn't make any fucking sense what you just said and and so in that context is when I use the
3371340	3376700	word I love that idea that that language can be thought and that it doesn't have to have these
3376700	3381780	electric fences about it but at the same time it's not as simple as this libertarian linguistic
3381780	3386820	policy of like let's let it all slosh together because the most racist shit will be will be
3386820	3392460	cloaked in false equivalence people will go well I can say this but so-and-so can't say that it's
3392460	3398660	like yeah context and history and all these things so in one hand you you definitely want all of that
3398660	3403900	in place because that's part of language in history it's like that to me the enemies are people who
3403900	3409500	are certain about things and who have rules for other people about things and the and the people
3409500	3415700	that will quote-unquote solve any problems we have with with anything really are the people
3415700	3421220	that are so uncertain that all they have is to focus on is their is their own gut in their own
3421220	3426300	instinct and they have like this code and I thought that was I'm sure you're not the only one and I
3426300	3431660	took kind of like that that made me that they give me like a whole it just I don't know it just made
3431660	3436740	me happy it was just like I was just like oh that's so cool that that word can be like any other
3436740	3442340	chemical in a chemistry set it can be like yep there's sulfuric acid and like you can use that
3442340	3447540	to like different people have different rules for how much of it they use in what circumstances
3447540	3452420	they use and it's like their own relationship with it I was like that's that's what it is that's
3452420	3458460	where it is like you're snail I mean my guy's thinking about the craziest shit my role is very
3458460	3469940	simple I never I use it constantly when I am alone making sandwiches like like like like like I'm
3469940	3476100	just like it's all over all of my songs about how I need mustard and because it because I have
3476100	3484580	extra niggas it's just me it's like I I refer to myself in the third person as as as as that and
3484580	3491260	and then and then and then I need more mustard and Jeff Jeff does the same thing I know it's it's
3491260	3498060	it's like Worcestershire sauce in my house like it goes here and there yeah I I literally I
3498060	3502620	literally will use it as a pet name with my girlfriend like I'm gonna like like like like
3502620	3510300	we like these real thing we have to trust each other is this a bit is this a real you know what
3510300	3513820	here's one thing I just want to fucking say cuz there's a lot of people who like try to twist and
3513820	3518140	turn and all types of stuff and like Dan like you're such a like a nice guy and like and and
