start	end	text
2534120	2538120	So the movie, like, this is the thing.
2538120	2541120	It's okay to say he's not a vegetarian, right?
2541120	2542120	No.
2542120	2549120	He helped write, he conceived of this movie and then shot the entire thing.
2549120	2557120	Everyone that watches this movie for at least 48 hours is not, you know, you're going to just not have sausage.
2557120	2558120	Yeah.
2558120	2566120	I remember being in a meeting earlier on after we were doing some scouting and we were watching some research footage of,
2566120	2572120	there's a scene where they're, I don't want to, like, give it away, but they're dealing with animals in a certain way.
2572120	2581120	And so it's based, that scene is based off of a real, how they actually treat cattle.
2581120	2583120	Well, of course, yeah, we figured, yeah.
2583120	2588120	And I was sitting in this meeting and he was like, oh, I want to show you this research clip.
2588120	2590120	And we were like, I was like, oh, God.
2590120	2598120	And I was sitting there trying to hide that I was crying, like, in a room full of, like, producers and other execs.
2598120	2600120	Was it actual, like, actual footage of that?
2600120	2604120	Yeah, it was actual footage of cattle being led to their slaughter, essentially.
2604120	2609120	And they, like, were coiling kind of knowing, like, they were headed into something dangerous.
2609120	2611120	And it was, like, the worst thing I'd ever seen.
2611120	2613120	And I was like, I don't want to eat anything after this.
2613120	2621120	I had a couple of friends, and I can't say their names because they might still be, like, the ALF, the Animal Liberation Front, was on FBI's most wanted list.
2621120	2623120	And they might still be.
2623120	2631120	And they would go into meat processing plants and animal testing labs and take the footage.
2631120	2634120	And I would tell people, like, I'm vegetarian.
2634120	2635120	I don't preach it.
2635120	2636120	People should eat what they want to eat.
2636120	2637120	But there's a couple of things.
2637120	2640120	If you don't want to eat meat, don't watch this tape.
2640120	2644120	There's footage that's so absolutely compelling and so horrifying.
2644120	2653120	And that's the thing that I want to make clear only because, creatively, this movie deserves so much recognition for what it's somehow pulling off.
2653120	2655120	And I have no idea how it's doing it.
2655120	2662120	How is it that part of the movie, everything that I've said, you know, you're imagining, like, oh, I understand.
2662120	2666120	The idea is, like, like, Lisa Simpson, she sees the movie, and it's, like, gross.
2666120	2668120	And it's, like, you don't want to eat meat anymore.
2668120	2673120	It's, like, it's not somehow it doesn't gross you out.
2673120	2681120	It doesn't make you it doesn't spank you as a meat eater for 40 years.
2681120	2684120	But it just somehow invites you up.
2684120	2685120	I think that's the point.
2685120	2687120	We didn't want to.
2687120	2693120	For us, at least, our intention is to never be, like, preachy about anything.
2693120	2700120	We just want to show you a different view of something and be, like, kind of like, hey, this is how it is.
2700120	2701120	Make your own decisions.
2701120	2707120	But we would like to show you a different side of the truth that maybe you don't you aren't familiar with.
2707120	2711120	And that's kind of like it's a really extraordinary mind at work on his part.
2711120	2714120	It's like, would he be a better person if he didn't eat meat?
2714120	2715120	Sure. So would I.
2715120	2722120	But since he does enjoy bacon at breakfast, him making that decision, artistically, what I'm going to do is I'm going to.
2723120	2731120	Put my camera on this side of this of that story, that issue that that and I'm going to do that faithfully.
2731120	2734120	He just wanted to do that creatively and it no.
2734120	2737120	And then he just finished the movie and he ordered some sausage.
2737120	2743120	And that to me, it may not make any of us good people, but it certainly makes him a genius.
2743120	2749120	You know, actually, I think when he went on his research trips to he actually like visited some slaughterhouses.
2750120	2759120	I think he couldn't. I think the whole crew that went on that trip couldn't touch meat for a while because it was like there's something about the smell.
2759120	2766120	And there's also different levels of we're talking about, like, you know, I imagine there's people that have different levels of issue with different.
2766120	2778120	It's like there there's probably people in the audience that personally eat meat, but also recognize that there's perhaps like an industrial problem where we we were doing it wrong.
2778120	2781120	The system is built wrong. We're over addicted to me.
2781120	2794120	We we we should make it more expensive and it should be always processed in a in a way that comes as close as possible with a bow and arrow and praying over its carcass in the forest.
2794120	2796120	Yes, that's exactly what.
2798120	2802120	But what about you, by the way, I never asked you, like, are you a vegetarian?
2803120	2813120	I have made a kind of decision to try and do the pescatarian thing for a while, because after actually after having worked on this, I didn't eat pork for the entire thing.
2813120	2821120	I just there's something about piggies and what about crustaceans actually don't like shellfish or Christy.
2821120	2826120	That's not. Yeah, I'm off of them since New Orleans just ate too much.
2826120	2836120	I just brought a brown bowl of it looked like H.R. Giger, like made it was just like everything is just like the eyes of the face.
2836120	2838120	And it had an expression on its face.
2838120	2846120	I don't know. I wasn't a human. And it wasn't. I wasn't like, oh, this poor this poor this poor jumbo shrimp, like that's the exact face they make right before they die.
2846120	2852120	It just freezes when they know they're like, you know, I'm going to be served to the guy that's not even going to appreciate me.
2853120	2858120	What a terrible death. You killed me and the guy didn't fucking dig it. Yeah, didn't even.
2858120	2868120	But but it was more like because they put a bib on you and but it's like I look over at Cody and she's like, yeah, you know, I don't know.
2868120	2874120	But I'm like, what did you do? I lifted out of the bowl just and I just it's curled up.
2875120	2882120	And then you uncur as you uncurl it, the legs go like that and then juice goes everywhere.
2882120	2887120	And then you just like, well, do I eat the face off and then squeeze?
2887120	2893120	I think you're supposed to like rip the head off and then suck the head. Suck the head, she says.
2893120	2901120	Sorry. Yeah. But at the end of the day, I just peeled it like a hard boiled egg down to a big jumbo shrimp and then ate it.
2901120	2906120	It was like, yeah, it's fucking shrimp, bro. Don't make it shake like an insect.
2906120	2911120	But you were talking about you don't like when you get meat on the bone. You don't like to have to do the work.
2911120	2919120	Yeah, you want it to be done for you. And I would definitely if we were living in a proper kind of caveman tribe, you die.
2919120	2925120	I would. No, I would be a vegetarian. I would be like, OK, I'll you know, I wrote a play for you guys.
2925120	2934120	Can I have a piece of brisket? And and if the alpha was like, no, you got to you got to kill what you eat, what you kill, then I'll have a salad.
2934120	2943120	Like, I don't like your attitude and good, good luck with the obvious analogy for your character in my play.
2943120	2949120	What do you think would be what do you think would be in your in your caveman salad? What would that consist of?
2949120	2955120	Arugula and Parmesan. Just because I like that a little Dom.
2955120	2963120	That's one thing about the caveman that people don't really appreciate is how good they were at making aged cheese.
2963120	2968120	But Christina, like, how did you get that you your producer? You work for Plan B.
2968120	2974120	How long have you been there? A little over six years. I'm an executive producer, executive producer.
2974120	2979120	It's a step below. No, it's a step below. Yeah. Settle down. I fell for the same thing.
2979120	2983120	I'm an executive producer and a novel. Lisa, it's like, you know, I didn't do anything.
2983120	2989120	But you did lots of stuff on this movie. So when awards are handed out, you're not going to be up on the stage for that necessarily?
2989120	2996120	No, no, I'm OK with that. But what stage did you get involved in the film? How early?
2996120	3005120	So I got involved in the towards the end of twenty fifteen, I think October or November of twenty fifteen.
3005120	3014120	I was like shipped away on a scout location scout for like days. I forgot the connection was Plan B, which is Brad Pitt's company, which is hilarious.
3014120	3025120	He's the CEO of me like. Yeah. Is he is he always eating when he comes into meetings or is that only as an acting choice?
3025120	3036120	Like it's like, you know, he likes to eat because he started like as soon as it appears as soon as he got a say in what he gets to do on camera, he was obviously starting as an actor.
3036120	3042120	Could I be eating something? Watch any Brad Pitt movie with the sound off. He moves his head a lot and he points a lot.
3042120	3052120	A lot of pointing, a lot of.
3052120	3057120	George Clooney has like a weird like George Clooney's head always like I got a swivel. It's like he's bobbing.
3057120	3063120	Like it's funny to watch like actors without the sound on it. All right.
3064120	3073120	I know what I'm going to go. Give us some dirt and Brad Pitt. Talk some Brad Pitt shit. I really he's a lovely human being. It's just the best.
3073120	3082120	What is it? How often I mean, just like what is he like in person? I mean, I'm just honestly just asking like I'm a high schooler.
3082120	3092120	I don't I mean, it's I feel like I'm just going to let it. He's literally just like he's normal. He comes in and he doesn't go.
3093120	3097120	But it's cool. I mean, he's got his company is doing cool shit like World War Z.
3097120	3104120	You know what? I understand why it wasn't what it didn't break records and whatever.
3104120	3110120	But it was a great idea to try to make that book into a movie and geopolitical zombie.
3110120	3115120	Yeah. I like I like I like I like his usage of what he's been dealt.
3115120	3121120	Like he you know, he's Brad Pitt and like he's like lots and lots of actors are like, OK, then I'll have a production company.
3121120	3125120	And but he's like clearly some some somewhere in that pipeline.
3125120	3130120	There's somebody going and it might be CEO Brad Pitt going like I want to make good choices.
3130120	3139120	Yes, of course. He's he's great. But D.D. Gardner and Jeremy Kleiner, my colleagues are like really just crushing it.
3140120	3145120	I remember D.D. Gardner worked at Paramount right a long time ago before Plan B.
3145120	3150120	Is it OK? Brad Pitt. We got it. We got it. Yeah, that's great.
3152120	3157120	Twelve monkeys. What is Brad Pitt? Does Brad Pitt. That was my that's where I'm getting my impression.
3157120	3164120	Does he have like a like I wear two outfits. I wear either a suit or I wear like a V next like sweater and jeans.
3164120	3170120	Like does he have an outfit? Does he have like this rapid have a uniform that he wears or does he wear a different shit every day?
3170120	3181120	Like give me some quotidian Brad Pitt shit. You know, I am I'm like the most unfun person to ask questions to you.
3181120	3186120	So you don't want to be part of our regular weekly segment, the pit stop.
3187120	3191120	Well, we just check in. Check in. Well, five seconds.
3192120	3196120	But talk about OK. Welcome to the pit stop, everybody.
3208120	3214120	He doesn't have a uniform. It's the update. It's a whole different thing. Where were you born and raised?
3215120	3220120	Massachusetts. And so you moved you moved out to L.A. first or no.
3220120	3227120	You know, OK, so if you a brief I was born and raised in Massachusetts until I was 13 and they moved to Arizona.
3229120	3235120	Four people cheered for Massachusetts. One guy boo. I bet that guy's from Arizona, right?
3236120	3241120	Are you from Arizona? You're from Boston. You just don't like leaving Massachusetts. OK.
3242120	3248120	Where in Massachusetts? Boston. Boston. OK. I grew up in Peabody. Super, super tiny.
3249120	3253120	Is that a town that's spelled differently than its name would suggest?
3255120	3265120	I suppose. It's spelled P-E-E-B-U-D-D-Y. Yes. Peabody. That's the one. Peabody.
3266120	3272120	Gotta love Massachusetts. Yeah. And then I moved to L.A. Spencer. Will you be my team buddy later on?
3274120	3283120	Is production your ambition or are you transitioning? Is this is helping out in a production capacity?
3284120	3291120	Is it the end all be all or is it a means to know, of course, like I would be a producer without the executive in front of it.
3292120	3297120	But that's where it's not, you know, it's not like and then I'll be a director or then I'll leave that to people that are far more talented than I am.
3298120	3302120	I'm glad you said that because we have directors and writers appear all the time. Then we go, like, what's your advice?
3303120	3309120	But it's like we have so few, like Steve Levy, my assistant, he he wants to be a producer. And ten years ago I'd be like, turn away.
3310120	3316120	That's not an ambition. Fuck you. Suits are evil. Whatever. And I would have and then I would have gone on to get fired by everybody.
3316120	3323120	And no one likes me. And they're like, why do you keep calling us suits? I think people I think people don't really know what a producer does.
3324120	3332120	Producers are fucking important as A.F. to put it in your language. You're my language.
3334120	3342120	They are. They're important. A.F. Yeah. Yeah. Well, I switched over. I switched. It was like Gen X to millennial.
3342120	3353120	Like it's like Spanglish. I was like as A.F. All right. But now it's like saying like like like pin number. You can you can choose how much gender mustard you want to put on this.
3354120	3364120	You can either answer this for the young ladies in the audience as a woman interested in production or you can just answer it as a human being that also you can do both at the same time.
3364120	3389120	You guys are going to go home tonight and realize that meant nothing. I am not a villain. And that was not a hero. You'll figure it out later.
3390120	3406120	Whatever. I forgive you for you know not what you do. But yeah I mean if it's like like people out there that are going I want to work in production like what are they how and what are the obstacles any pieces of advice whatever take it.
3407120	3427120	Why thank you. There is no like do this and then do this and then do this and then you're a producer. If anyone ever tells you that they're lying to you. I did an internship worked my ass off and very serendipitously landed at this company.
3427120	3456120	People hear that maybe some people are going to go. How do you what do you open the yellow pages. Do you Google yellow pages and find out what yellow pages mean. Like what can you like really get granular about like what do you do from Massachusetts like what the first step where you go like I'm going to like start you have to have kind of slightly oppressive Asian parents that want you to be a doctor or a teacher.
3457120	3482120	And then but you secretly have to want to do something a little bit. I mean I. Oh happy Father's Day. Dad I love you. I love you so much. Actually my dad wanted to be a film director but then gave everything up and. Don't you have to call him father dad in your. Yes father. Father wanted to be a film director and he actually went to film school in Korea in I don't know 70s.
3482120	3510120	And then he immigrated to America to give us a better opportunity. So to speak. But then how do you get to be an intern on. Yeah. So then. So then I like moved Arizona went to school and Scott Stuber was an alumni at Stuber. I know. Do anything. He's like he just he's at Netflix now. He sounds like an Archie comic character. He's great. He's he's he's super lovely. And I interned at his company out of college in my last semester.
3510120	3538120	Is there a bulletin board. University of Phoenix is there. What was the University of Arizona. Yeah. Go Wildcats. No he was an alum there. So he had this like premier internship program that you had to apply for. And then I got it. And I went and you worked for free for four months. And then it opens doors for you I suppose.
3538120	3567120	But if anybody OK if anybody actually is interested or wants to know I guess come find me afterwards because I don't do that to yourself. OK then don't. But I feel like it'll be like. What do I do. What do I do. Can I be an intern on your show. Can I be a P.A. and all this stuff. And I'm like I don't. I'm not. I never did that. Yeah. And so I would say interning interning is a great thing. Be a P.A. but it's just like kind of like my thing is be nice to everyone and introduce yourself and like.
3567120	3596120	Be a cool person and things will happen if you're an asshole like I immediately I'm like I don't want to talk to this. How did you sustain yourself like when you were like people like that have internships like you're not being paid for your work. Like were you broke back then or did you have a. Yeah I lived. My parents helped me. Of course thank you. But I like lived with this old Korean couple. They were super nice. I like had a I stayed in a bedroom at their place that they like kind of randomly knew my parents.
3597120	3605120	And I just stayed in a lot and I didn't eat a lot of rice and Kim you're so racist right now.
3608120	3618120	That's the thing like like you hear about like like a lot of people that get to become like you know like you turn on the news and everyone's a journalist that they're all rich people because they could afford to be. Yeah.
3619120	3630120	I think they could afford to spend three years unpaid labor as interns and doing this stuff. But you like you actually just like lived you squatted with an old couple and didn't eat much except you know like basic food.
3631120	3646120	Well I did. I did. I mean like I did eat because otherwise I'd be a lot skinnier but no I do think like I I knew when I needed help and I was like listen like I want to do this like how do I do this in my school was really cool and helpful and I did.
3647120	3657120	I did thankfully find this couple which was kind of odd like it was in a weird bedroom in Korea town and there was a fridge in my room. I didn't really understand like a full size fridge.
3658120	3668120	Did you ever look inside of it. It was empty. Yeah. I lived in Korea town when I first moved to L.A. There was a murderer in the alley by my house.
3668120	3679120	And I wasn't that bad. But yeah we should talk later. It doesn't sound like I mean I guess it helped that I am Korean so it was it made a little bit of sense.
3680120	3692120	I'm sure the guy that got murdered was Korean. I don't know. I'm just assuming. But but but you know it is it is it is difficult. And I think like the difference now I think is a lot of internships actually do pay you.
3693120	3701120	Yeah. Yeah. That's good. What's next for producer. Oh what's next for plan B. If they're the same thing you can answer as a woman or a Korean.
3704120	3705120	But not both.
3706120	3721120	Actually I actually became a. Actually through this whole experience I became friends with Stephen Young. This is an awesome awesome dude. And so I think we are going to try and cook something up.
3721120	3733120	And then we're working on a film James Gray's next film right now. We just wrapped a film called Beautiful Boy directed by Felix von Groningen which is going to be a.
3736120	3743120	It's kind of it's going to be like a little sad but. Well it's 9 11 everybody. Let's hear it for Christina.
3745120	3746120	But those things aren't related.
3747120	3749120	Thank you Christina for talking about.
3763120	3772120	So right now you're saying Dean. There's been a shift in the show. You're wearing a foam super pig on your head. It seems like a harbinger of some sort of new aspect to our to our program.
3773120	3778120	And also you dismissed your guests like some kind of weird handmade patriarch.
3779120	3790120	You sent her off. Why would that be. Well because as promised like this is finally it after much fucking to do. We're going to we're going to play our new Pathfinder campaign.
3791120	3811120	I think you might have jumped the gun on the music. I just want to give it a sting. Oh OK. Because I think well let's let's let's let's see if this experiment can work or we take a break for the for the midroll ad that the people that pay five dollars a month don't have to listen to.
3812120	3819120	And instead the people listening to the ad on the free version of the podcast don't get to hear the following.
3827120	3837120	You know we don't actually have to do anything because no one will know. I think they'll know they'll get on Reddit and they're not going to say nothing. These guys are too cool to be on Reddit.
3842120	3848120	Let's just talk shit about Reddit during the night. Yeah they hate Reddit. Reddit is like the Arizona of sites.
3855120	3863120	Arizona. Wow. It's a great. It's a great Arizona is a great state to go to if you hate women Mexicans and gay people and front lawns.
3864120	3881120	But you love gravel. Their front lawns are gravel. Look your your statements bear no fucking gravitas right now. You got a phone. I know what I know what to do during our. This is still during our. This is still our special break. Let me show because this will just be for people that are.
3882120	3883120	We're going work factor seven.
3893120	3908120	The actor his eyes. Do you guys think LaVar Burton like to listen to that episode. Did something happen during that show that would explain LaVar Burton not only not showing up to my wedding but also just generally I don't know. I feel like
3911120	3930120	I think he's on ear wolf now. Maybe it's an ear wolf beef. Oh don't we have our brains on here. No. OK. I think he is. Can you pull up the. I got my iPhone plugged into the feed because I just wanted to show these. You might have seen these retweeted this picture. These are those meat torture videos.
3931120	3953120	This is the this is the photo of the protesters that were outside Shakespeare in the park. This guy's got a little sign that says boo the cast and this guy. And don't be don't be fooled in the thing. This is a crowd. It's just two pictures were just this guy is behind this lady in the first.
3954120	3970120	So it's just Spielberg here with his pro Trump far left. It's America. So the weird thing is I retweeted that and then somebody like that had tweeted they're like hey respect my investigative journalism because what I found out is that this person was saying this.
3970120	3996120	I followed this like kind of sub thread and they were like this guy was outside the fucking Hamilton show in New York. It's the same guy with the same sign. Same font. Do you think that he like Cody Cody said oh man if his son breaks his arm he can stand up at the hospital and get triple.
3996120	4015120	But I don't know why you wouldn't want to cheer that cast because it's an Obamacare cast or if he becomes a ghost. But this guy said now it's like a question of is he so he definitely went from a boring villain to an interesting villain.
4015120	4036120	But if he goes to it what can he do with the sign to make him the world's shittiest hero. But what's his angle. He hates the cast because they're being lefties or what. Well you know Shakespeare in the park thing you know they did Julius Caesar and they it's like look when you do Julius Caesar you you you pick a fucking wardrobe you pick an angle.
4036120	4049120	They go oh let's make up 1920s gangsters other thing and they did an Obama thing where they Julius Caesar was an African American man and they they and this this time they gave him a big long red tie in like blonde hair.
4049120	4066120	And so then it was like we all know that these people aren't actually offended and don't they're just playing this fucking weird game of hungry hungry hippos with us like where it's like they just like they're just like I don't know that was a game from 1849.
4066120	4078120	It's just so fucking weird but I don't want to get sidetracked by that because we are we all spend our days. Where was this taken. This is also in New York. No. Wait. Where's Shakespeare in the park. Where is that central park.
4078120	4089120	Yeah. Somebody here. This guy has that much free time when he just goes from theater to theater. I like the idea that he made the sign for Hamilton and then he brought it home and he's a hoarder and he just put it on the side of the he didn't.
4089120	4105120	He didn't. He's like he's like I don't know. I'm going to hang on to that because the the arts typically you know I wouldn't be surprised if this isn't the last time that a play gets intertwined with my politics and then he went to sleep and he ate some spam and he.
4105120	4113120	But if he likes the play he has another sign that says don't boo the cast boo the player.
4114120	4125120	All right. We're back from the secret segments. Oh Jesus. If you're working at Feral audio you shouldn't have left any of that in the show. No one's working there. Okay.
4125120	4135120	And he's leaving and she can't even walk. It's bad when any walks out. It's like yeah.
4135120	4140120	Please stay. We just got into our ableist jokes.
