start	end	text
4140120	4151120	She's just going to the bar. There's 45 people online. That is where you will always find Annie. All right. So Spencer. Hey guys. Are you ready to rock and roll some D&D right now some path finder rather.
4151120	4164120	I got to say though I think it'll be bad. So I'll just put that out there. Why are dwell my my student. Yeah. It's a great way to make it good. Why are you so pessimistic. Are you just lowering expectations.
4164120	4177120	No. Well I mean technically yeah I am lowering your back. But I'll give you an honest leave. He's not here and we just last show we agreed. Oh it's going to work. You know we're going to make it consistent.
4177120	4191120	It's going to be the three characters. Now Levy is you know. Right. Visiting his family for Father's Day like he does every year because his dad died. What a fucking asshole.
4191120	4212120	Me me me more like Steve. Me me. Yeah. Steve me me more like Steve. Leave us. He did. He did. Yeah. But that could be your excuse because you could that caught you off guard. Now you got to confine the adventure to the two of us.
4212120	4240120	I'm just I'm excited about it. I'm barely drunk. Like I'm like not as drunk. Yeah me too. And and I just we're going to do real. I know my spells. I. Yeah. It'll be bad. It's fine. I know my character. Yeah. Like I know who I am kind of. You said earlier you might change your name from Carlos. Oh yeah. I thought about it for a second because I was like oh Carlos.
4240120	4269120	People are going to. Oh that's like a freaks and geeks reference. Like wasn't that James Franco's character. Was it Carlos the dwarf. But then I thought well he's Carlos the unimaginative. So I don't know. I say leave it. I say leave it because if it's all of a sudden I'm named Duracell the fuck like you know like. Wait Duracell the fuck like Duracell the fuck bucket. Oh fuck bucket. I heard fuck like. I want. Look if you don't become Duracell the fuck bucket. I hope we meet that character somewhere along the road.
4270120	4272120	Duracell the fuck.
4275120	4277120	That just made me happy.
4278120	4292120	I also feel like once you once you once you riff the name Carlos if you change it to anything else I do feel like the Latino community feels we're going to have a very valid complaint because I'm like famous for the lack of fucking Latino presence in my.
4293120	4306120	Yeah. And remember that that what's going to have the soccer joke. Remember the Latino community joke. Oh man. You are not coming back after that. You are way behind with that population.
4307120	4314120	I don't take another risk by changing a name away from Carlos or you'll be just out of the game.
4315120	4329120	All right. Well I'll stay out. There's that the thing it is like there is a press conference at community college and then there's like Mr. Estudiante press. How would this affect soccer. Oh that. Yeah. Well you think people were so.
4330120	4336120	There's protests. All right. OK. All right. So Spencer how do you how do you want to kick this out. It was a great joke.
4337120	4354120	Great. Do you. You let me know when you want theme music you can you can cast us off into a mystical realm of madness and man. All right. We're going to do real combat turn based. No more. I build a boat and row it to the weapons store.
4355120	4367120	And you can say that but he's like oh you say OK you start building a boat. Spencer you're going to keep us honest on our on our if we do things that are not proper you're going to you're going to give us notes. Right. Yeah.
4368120	4378120	As far as I feel like doing that right. Especially your enthusiasm your enthusiasm is exhilarating. Yeah I'm really just trying to set the table.
4379120	4392120	Should we start. Yeah yeah. Are you ready. All right. The town of Rowan has been in peril a letter from the local priory details of village under siege by evil.
4393120	4419120	The prior says heresy and evil have taken root in the town and demons and evil spirits have been inflicting the towns folk. They've begged for aid in the past and they've lost contact with both of the clergymen who are sent to investigate the prior fears for the lives of his congregation and seeks the aid of the church militants and rooting out the source of the evil and saving the village from its sin.
4420120	4437120	All right. I didn't get a lot of that because I couldn't I realized oh shit there's going to be notes. It's a classic trend of yours. It's good. So let's start by asking questions. Do you have any questions maybe generating from the fact that you didn't hear some of this.
4438120	4461120	I got a I got a letter. Yes from my superior or some you know some bureaucrat within my church said go to this town. Right. This town is languishing from evil. Right. There's evil taken root in this town and its effect in our towns folk. What's the town's name. Rowan or Roan.
4461120	4472120	I think that's just Roan right. Sure. I mean I invented the I mean that's a word. Yeah. Let's move past. I wrote it down with a W. So let's just call it Rowan. I mean whatever.
4473120	4480120	I actually. No I don't think you writing it down wrong should change the name. Yeah you can't do that. I don't think.
4481120	4505120	You are you are waffling on your own decision. Will the pronunciation to be sure. Yes that doesn't open you up. This is what I'm talking about when I said that. Dungeon topping from the bottom of the dungeon. No it's great. Everyone's great. All right. So you guys you're in like a horse drawn wagon together because you've been you're you've been dispatched on this mission. Yeah.
4506120	4532120	Hey Carlos Chad. Good to see you back. You were away for a while. It's nice to be back on a case with you. Yeah. I'm really proud of you. Really. I remember I taught you things as my in my role as a cleric at the church of the silver flame flame. Sure.
4533120	4553120	And you were a great acolyte. You were a great initiate. Yeah you know but I'm I'm I'm I think I'm pretty grown up now. I feel weird that we're equals like we're basically the same kind of status like in the church. I think of you as kind of a hero. You were my mentor but now we're working side by side as a team.
4554120	4580120	All right. Don't don't. I mean it's good to just say that stuff. Don't don't carry shame around with you. You know just keep yourself pure. I admit to my jealousy like I teach young kids how to be adept at the arts of the silver flame and I you know when I see them rise in stature faster than I've ever been able to.
4581120	4605120	I get I get jealous. You kind of get in your own way a lot like you know you could have been top dog. You just you you you kind of self-sabotage yourself a lot. Yeah I mean and now you're being a dick and I think but if I know the key is which of us is more self inspecting and which of us is saying stuff like that.
4605120	4634120	And the answer that person. Let's look. Let's let's let's let's just drop it. I clearly clearly is a lot of baggage there. I know this church is fucked up. You know what it's fucked up church is the reason why we're here. We're trying to purify ourselves and purify the world of evil. The religion is the reason we're here. The church is fucked from the head down by people that believe more in politics than religion. Okay. Well I think that's a good question.
4635120	4664120	Well let's not talk. Can we have one wagon ride where we're not doing this. I'm just concerned for the people of Rome. It's pronounced Rowan but that's cool. How far out do you think we are. Driver. You're the driver. Hello. What. Oh I'm driving. Yeah. It's just like a horse. Jesus.
4665120	4690120	Carlos. Are you drunk. I have a voice in my head. I thought maybe was the silver flame said you're the driver and I thought it meant I if you've been drinking you just you're supposed to put the reins to the wagon in the bowl by the door like somebody else drives the wagon. It's okay. It looks like Rowan's. I look ahead on the road. What do I see. All right.
4690120	4713120	The road is rough and bumpy out in the countryside and the rolling hills look endless and foreboding in the dreary gray of the darkening clouded sky following an even smaller winding road to your left takes you off off the main path and into the vert and into the gentler yellow planes that give way to fenced plots of fallowed farmlands.
4713120	4742120	That's like farmlands without crops in them. The edge of town. This must be the edge of town aside from a single small house and barn near one of these farm plots and two darkened ruined kind of burnt looking structures. No real buildings or civilization are found this far out. It seems like way down the way there's there's a bit more of a town but you really only see in these kind of three buildings on this on this path and it's kind of getting towards evening.
4742120	4764120	Maybe we should stop here and flip the horses rest and maybe give them some something to eat some water. Let's see if there's any people around that can give us information. The kind we won't get once we're in the confines of the city. The three buildings are a barn a farmhouse. What else will you see a farm in a barn house or barn in a farmhouse. There we go.
4764120	4782120	That are right next to each other and then across like you're on a road and then that's on say the left side of the road and then on the right side of the road you just see two kind of burnt out husks of buildings. Whoa. Easy.
4783120	4804120	We leave the wagon into the barn. OK. So all right. Yeah. No you go you roll up towards the barn and you can see there's light coming from inside the farmhouse and the barns closed for the night. Oh it's nighttime already at sundown. Well it's it's like getting dark but the barns magic hour.
4805120	4832120	That if that's established then sure. It might be magic. I kind of quietly walk up and to a window at the farmhouse. OK. Wait. Sorry. So we should establish what you guys look like. I mean we can establish that later. But I don't know. I'm a gnome druid. Yeah. I'm a short little fellow. I carry a walking magical quarterstaff.
4833120	4848120	That has secret powers and my name is Chad the firelacker. I'm a gnome druid. Right. And I you know I'm dressed druidic. I've kind of brightly colored hair and a brightly colored outfit. I'm a little eccentric. Your colorful gnome man. Sure.
4849120	4873120	I'm a human size medium. I am. I'm wearing a dirty robe. Right. So that's like church clothes kind of. But your clothes are probably not like church clothes. They're like colorful. I mean I I I accent my church garb with you know like I got like a. Oh OK.
4873120	4899120	I got like my pouch. I carry my stuff and it's kind of like a fanny pack. It's very brightly colored. I think I kind of look like an older Antonio Banderas. Great. This is perfect. Maybe with a little paunch. Like I'm not athletic. But that might be part of. I don't know what Antonio Banderas looks like these days. But I think I think I kind of look like a like a like a more ragged Seth Green.
4903120	4932120	Well this will be perfect. Thank you. Sorry for the diversion. So we are parking our carriage. This is one that we owned. Did we rent this. It's it's I mean it's the church's maybe. But yeah it's like a company car. It's a church wagon. It's a church wagon. So we park it. You know what. I'm assuming my character knows more than I do about how to park a horse drawn cart. You kind of just stop it really.
4933120	4961120	And how far is this light from this farmhouse. The farmhouse is like maybe there's a six like a five foot gap between the farmhouse or the farmhouse in the barn. So it's really close. They're right next to each other. So that the glow is really close from the window and you said you're going to the window right. Yes. OK. So you look in the window and you see you see a woman who's tending to tend it to a cauldron over a fire. But it looks like a cooking cauldron not like a witch cauldron.
4964120	4988120	Yeah. Well you're a goblin. You shouldn't be hanging out. Dude dude I'm a gnome. So it's fucking this. I'm going to the front door. A goblin. I'm sorry. I'm sorry. I didn't. I'm sorry. I actually misheard that. I wouldn't say that. My character wouldn't say that. You know what. Because I actually. If I if I didn't have.
4989120	5002120	I didn't have so much respect for you. I would tell you that I see why the church doesn't keep you in their good graces while you're at the same level. Like you should be like like 10 times higher ranking than you are. We're the same. I'm like the third your age.
5005120	5010120	You can't you walk around calling people goblins. It's like it's fucking fuck. Fuck you.
5011120	5021120	So why don't we just finish this. Let's read Rowan of Evil and get the fuck out of here and then you can go hang out with other racist people.
5023120	5036120	I go to the front door. I don't need you to be a perfect person.
5037120	5042120	I look at you as an opportunity to learn.
5045120	5050120	I channel the silver flame and purifies the earth of evil. Knock knock knock.
5057120	5065120	You hear that coming from inside someone. I only speak common. Yeah. So is that really what they're saying. Yeah. It's like an old person.
5066120	5083120	I'm sorry. He's just grumbling. He's grumbling. He's coming to you. You hear a guy come into the door and then from the other side of the door you say who's who's out there.
5084120	5104120	Inquisitors from the Church of the Silver Flames sir. You hear him lock in or not lock in unlock in multiple locks and he swings open the door. He's holding he's holding like a kitchen knife but he's not like menacing. It's just kind of like he was holding a kitchen knife before this.
5105120	5130120	Put put the knife down Siri might if we come inside. Sure. Yeah. Well who are you. We're from the Church of the Silver Flame. We hear that your town and ravaged by evil. You said that. Who are you. My name is Chad. Okay. The Fire Liker. My name is Carlos the knife suspector. My name is Tom the farmer.
5131120	5151120	He puts down the knife. Thanks. He he kind of turns away from you and just motions you to follow him in. He's gone. More church. God damn it. More church half this damn chat town is church whole place is fucking church ain't done any good. My name's Tom Tom.
5152120	5175120	I walk in do that thing where I just kind of drag my finger around along the surface and like check and see how dusty it is. It doesn't mean anything but it looks like I know what I'm doing. Oh yeah. It looks like you know you're doing the church folk that you're used to dealing with maybe from the ministry. We're militants. We get the job done or your lack of money back.
5176120	5197120	Sir Tom I'm sorry to come at you at this late hour but did you or anyone you know come in contact with the evil that just went through the town. He he wait. Do a sense motive check. It'll be great. Do you have a sense motive score on your skills. I do. All right. You can do one too. Okay.
5198120	5210120	And mine should be high because I have a wisdom of 16. I think both of you guys have reasonable wisdom. But yeah no I don't have any like extra score on some motive. All right. Well what's your wisdom then. And what's your sense.
5211120	5224120	My sense motive is checked but blank but my wisdom is 16 and my ability modifier is therefore plus three. My wisdom is 16 plus three. What are the odds. Both of you have the same score.
5224120	5241120	Okay. It's great. You he hears your question. What was the question. Did you or anyone that you know come in contact with the evil that ravaged your town. I don't know what you're talking about man. There's the only evil here is just church corruption.
5242120	5253120	But Dan you can tell he's he's he's hiding something. You have any family sir. Yeah yeah I got family.
5254120	5272120	Where are they. They're here. My wife Bonnie. Bring her out. She's in this area is like it's like an entry area that's attached to a kitchen area. So she's visible in this room. Yeah. Let me describe it's just like a house. There's a staircase that goes up into presumably like maybe bedrooms or stuff.
5273120	5287120	The main area is just kind of a one room. It's like a family room dining room kitchen. Sir I've been in houses. Yeah. I've lived in cooler places. No I'm kidding. That guy was saying that my house is.
5287120	5308120	Bonnie. Yeah. Yeah. Hey I'm inquisitor Carlos the unimaginative. Hence the name Chad the firelacker. Great. Don't mind me. I'll be just cooking. I'll have something out in just a sec. You probably need food.
5308120	5326120	Hey listen Bonnie I couldn't help but notice across the way there's a couple burned out buildings over there. Do you want to tell me what you saw. What went down over there. That was that was just James. James and his wife they moved out like burn their whole place down and just moved out one day and never spoke to nobody.
5326120	5337120	Can he sense motive on her. Yeah. She's she seems to be telling the truth. James is just your neighbor. Well yeah they were. Yeah.
5338120	5365120	How big is your family. Well three including you two. Yeah. Who's missing here. What's his name. Cliff. He's sick. Well is he sick with various disorders that come from being raised by people that forget your name. I'm kidding. Sorry.
5365120	5393120	It's okay. He called me a goblin earlier. It's all right. Can I see Cliff. Why. I'd like to take Cliff notes. That's been our show. Thanks for coming everybody. Is that a reference to something. It will be. I'd like to see Cliff. You see we just come into town. This is what we do. It's part of procedure.
5393120	5422120	You guys. You guys seem angry about the church. But we're here to help. If your church if your town has been under attack by evil. We're here to help. You've had complaints about the church. I'm assuming those complaints aren't that they were thorough attentive empathic. Concerned. Concerned. No. Not concerned. So I'm here to change that type. I don't like my colleagues. I'd like to talk to Cliff. Are you guys healers. You guys healers. I'm a healer. Really. Yeah.
5423120	5452120	I pull. I pull Carlos aside and go hey why don't we get these guys good graces and go up there and heal their sick child. Maybe I will. I have to see him first. Well he's sick. He shouldn't be seeing anybody except a cleric you dingbat. I mean it's your funeral. Threatening me. It's just a figure of speech. Oh well can you tell me. I mean you just said what does he have playing. No no. We don't really know what he's saying.
5452120	5481120	We don't really know what he's got. We just start walking up the stairs or wherever Cliff is. We just go to find him. We just push past the parents towards wherever Cliff is. Wait wait wait. But you successfully pushed past him. As I pushed past I also run my finger along another surface. Do the dust check. It tells you different information the last time.
5481120	5496120	You hear a crashing and banging coming from up the stairs as well as a yelling and Tom starts cursing. God damn it. God damn it. Not now. God damn it. Come on man. Cliff. Come on man. God damn it. I said.
5496120	5514120	Did you keep an eye on Bonnie and what's his name. Tom Tom Tom. Tom fell. And let me let me check out Cliff. I just don't want them coming up. I got eyeballs on the on the on the Tom cats and you go check the Eagles nest. Scenario three.
5514120	5540120	I go to I go to the door from which the sound is coming. All right. You do that. At the top of the stairs you see a shifting blue light flashing wildly under a crack in a bedroom door. You feel a sense of dread creep through your entire body as you hear an unearthly voice bellowing. Get out of my home. Get out of it. Cliff. No.
5540120	5569120	Well not your home then. Checkmate. He doesn't respond so maybe. I am here bearing the power of the silver flame. I am a purifying vessel. I sense that you are evil. You have five seconds to vacate this premises and this domain.
5570120	5600120	Yeah. Time's up. Bitch. Now I'm going to. Yeah. I'm just going to I'm just going to open the door. I'm not going to do anything fancy. I'm just going to open the door. You see a large bed shaking and bouncing around and there's a kid belted down to the bed and there's a strange light. There's a strange light kind of flashing around the room and you see darkness
5600120	5619120	kind of emanating and leaking from the kids eyes and his mouth is like you have no power over me. Oh I do. I do. I hear that and I come and join them in the room together and I say Carlos you know what to do. Channel energy.
5619120	5648120	I send out a burst of healing light to heal the living. No to damage actually to damage the undead. Yeah. OK. You do that. You see the wave wash over him and he goes. But he doesn't seem damaged or hurt in any way.
5648120	5677120	As if he's not a member of the undead. And that's called elimination. I'm always one step ahead. He's not undead. I'd call this a case of possession and that really gets my giblets. Finish your statement. Holy water. Do you have holy water.
5677120	5705120	Yeah I do. Oh all right. We'll cross it out then. Wait. You're taking it away. Oh no. OK. I'm using it. OK. Yeah. Holy water. Yeah. Can I get a pencil later. Yeah. I'll get you one later. Or maybe someone else can get you one later. OK. For now just remember if I try to use holy water later that I don't have it. I'll get. Yeah. It'll be great. OK. Oh no. You miss. You miss the bedridden child.
5708120	5735120	Holy water splatters to the floor in a broken file. I got it. I got it. I'm just going to try to like mop some of it up on my hands. All right. Well it's not your turn now. Right. OK. Yeah. Turns. Sorry. Initiative. It's Jeff. Well I don't have any skills to it like to get rid of evil necessarily. I call on the.
5735120	5755120	I summon the the advice of the the keeper of the flame. You you you meditate on the voice of the silver flame and it doesn't tell you any any specific things but you recall your training which is like to kill evil. OK.
5756120	5779120	I have some I have some cloth with me. This is this love a turn. I kind of wasted that one. Well what do you do. Well I take my cloth and I go over to where the holy water missed and I try to mop up the holy water and absorb the mist holy water and then try to use the absorbed holy water on Cliff. All right. Yeah. OK.
5780120	5803120	Don't coddle me if that's stupid. No I mean it is stupid but that doesn't mean it doesn't work. It could work very well. All right. Well you do that. You start mopping his brow with with a mop. No not a mop a handkerchief made of holy water inundated with holy water. Yeah. It deals two damage.
5803120	5822120	And as that happens you can see you can see the kitty raises his his arm and a tendril of shadow lashes out of his armpit at you dealing for damage. Jesus Christ. So he goes. We got armpit boogins. Yeah. All right.
5822120	5847120	All right. Shit got real. Is it my turn. No it's the ghost's turn. He doesn't do anything though. He's just laughing. Is it my turn now. Well you hear you hear people coming up the stairs and it's it's Tom and Bonnie. They're like what's going on. What are you doing. I heard some stuff breaking. We're doing more than you did. Close the door.
5848120	5869120	All right. Bad parents may close the door. All right. I didn't I didn't waste a turn doing that. No no. Because I want I want to cast that thing where I win. No I it's the it's the it's the I think it's solar flare. No it's.
5870120	5890120	No that's just a blinding thing. It's the thing that kind of just like I'm looking for it now and I don't see it. It's the it's a spell where I shitballs. I'm sorry. I thought it was like a thing where I create like an aura of deflection. Is that what it is. Well what are you trying to do.
5890120	5913120	What are you trying to do kind of deflect things with an aura. No I I'm looking for it now. I don't see it now. Yeah. Well what are you looking for. Oh I wanted to make like a bubble. You know I just like oh shit's going down. So I just want to buff us. You know like if it's like a video game I'm just like I'm just looking to buff. Yeah I think that's the order of deflection. Yeah. Yeah.
5913120	5942120	Okay. So I'm like. Silver flame. And I make like I just it makes you better at what you do. Makes us all better at what we do. Thanks man. All right. Great. Now it's just shit. I don't know how to attack.
5942120	5970120	I like a ghost inside a kid's body. I. Shit. I I cast flair and try to dazzle the ghost while like the by time for Carlos to finish the job. Oh man. You see the ghost. No not that ghost. There's no ghost. You see the kid get dazzled.
5970120	5991120	He's like like that. Carlos I got him dazzled. Go in for the fucking kill. It's his turn though. Oh shit. He goes. He starts thrashing about and you can see kind of these shadow tendrils lashing out some more. What's your what are each of your armor class.
5992120	6002120	Seventeen. All right. Well you pass. All right. The shadows lash at your body but they hit your armor and it's it feels good against your armor.
6005120	6015120	Leave this child or we will kill him. There's there's pounding on the door. What do you think you're doing. You know what you're doing because we could have just killed him.
6016120	6036120	We thought you'd like do something. I don't pound. I say I love the damn church. Oh yeah. Well we'll show you the power of the church. I dare. I tell the ghost of the ghost inside Cliff. Come out and fight like a ghost and not be a shit.
6036120	6059120	Well it's Dan's turn but you do say that. I check for more dust. I didn't hear that. We're really out of our league here like we know. What. That would be nice if they had that.
