start	end	text
1308120	1310120	So my mind was fucking blown by this movie,
1310120	1312120	so I was like, come talk about it,
1312120	1314120	even though you guys haven't had a chance to see it yet.
1314120	1316120	It's coming to Netflix next week.
1316120	1319120	But let's welcome our new friend, Christina Oh.
1319120	1331120	Oh, thank you.
1331120	1335120	Christina brought a foam Okja.
1335120	1337120	Hi.
1337120	1340120	Oh, she fell.
1340120	1342120	A foam what? What is that?
1342120	1344120	It's a super pig.
1344120	1346120	Oh, it's a super pig.
1346120	1349120	Okja, and the movie is a super pig
1349120	1352120	created by a corporation to genetically modify it
1352120	1355120	in order to solve world hunger.
1355120	1356120	These aren't spoilers, right?
1356120	1357120	This is the first five minutes of the movie.
1357120	1359120	They explained it all.
1359120	1364120	And so there's giant pigs that are being tested,
1364120	1369120	and the story follows the ownership
1369120	1373120	of one giant pig, Okja, and her owner.
1373120	1374120	What's her name?
1374120	1375120	Mija.
1375120	1376120	Mija.
1376120	1379120	Anyways, and I saw you after the movie,
1379120	1382120	and I was like, I think that was a perfect movie.
1382120	1384120	I think it was a 10% Gyllenhaal reduction.
1384120	1386120	People are going to say he's over the top,
1386120	1388120	but I didn't care.
1388120	1391120	But I don't know why I qualified it with that,
1391120	1393120	but it's because truly I wanted to,
1393120	1396120	I really thought it was a perfect movie.
1397120	1399120	And then you were shocked to hear that,
1399120	1401120	and it seemed like so was Bong.
1401120	1403120	Can I call him Bong?
1403120	1404120	You have to call him Director Bong.
1404120	1406120	Director Bong.
1406120	1408120	Right, so the last name comes first,
1408120	1410120	is the formality, right?
1410120	1412120	Yeah, it's a very honorific culture.
1412120	1413120	Yeah.
1413120	1414120	I'm going to eat that mic.
1414120	1417120	Dan's setting a bad example because this mic's way hot.
1417120	1418120	Oh, sorry.
1418120	1419120	Oh, because my mic's hot.
1419120	1421120	No, it's just picking you up from really far away.
1421120	1423120	Yeah, your mic's not as hot,
1423120	1425120	because we're in an honorific culture too.
1425120	1427120	So the male gets the better mic.
1427120	1429120	There's a glass ceiling on your mic decibels.
1429120	1431120	Okay, I will put it.
1431120	1434120	I got to get up on mine too.
1434120	1435120	See, I'm like right here.
1435120	1436120	But don't cover it with your hand.
1436120	1437120	Yeah, there you go.
1437120	1438120	Okay.
1438120	1439120	Unless you're going to beatbox.
1439120	1440120	Then I find that that helps,
1440120	1441120	because it helps the P's not popping.
1441120	1443120	It looks cool too.
1443120	1444120	Oh, jaw.
1444120	1446120	Oh, oh, oh, jaw.
1449120	1452120	So this movie was co-written by Director Bong and...
1452120	1453120	John Ronson.
1453120	1454120	No, tell us about him.
1454120	1455120	John?
1455120	1456120	Yeah.
1456120	1457120	Was he there at the screening?
1457120	1459120	He was not.
1459120	1460120	He was not.
1460120	1461120	He's cool though.
1461120	1462120	He's an author.
1462120	1465120	Well, he's a well-reviewed author,
1465120	1469120	and he's known Bong forever, Director Bong forever.
1469120	1471120	And then he came up with this,
1471120	1473120	or Director Bong came up with this crazy idea.
1473120	1476120	I think driving down a countryside,
1476120	1478120	and he saw this billboard,
1478120	1480120	or he saw this animal and was just like,
1480120	1484120	oh, you know, what's it doing out in the middle of nowhere?
1484120	1485120	What was that animal?
1485120	1486120	He mentioned that,
1486120	1488120	but he didn't mention the species of animal.
1488120	1489120	I don't know.
1489120	1490120	It's so weird that he doesn't...
1490120	1492120	I just think some sort of cute animal thing in Korea.
1492120	1493120	Yeah.
1495120	1500120	So the movie, it's not going to be theatrically released.
1500120	1501120	Well, we're going to...
1501120	1505120	So Netflix will do a day and date on June 28th,
1505120	1507120	and it will play in IPIC theaters in L.A.
1507120	1510120	for like a week or so, but no.
1510120	1513120	We want you to go watch it on Netflix.
1513120	1516120	And he talked about that a little bit,
1516120	1519120	and he was answering questions through a translator.
1519120	1523120	He speaks fine enough English to do conversative stuff,
1523120	1528120	but what I was gleaning was that every director probably wants their movie
1528120	1531120	to be on every theater screen in the world on Friday night,
1531120	1533120	and everyone would go out and eat popcorn and watch it.
1533120	1536120	It'll be a while before people get used to that
1536120	1539120	not being the case, but it was worth it,
1539120	1542120	the lack of that, to work with Netflix.
1542120	1546120	This is an unpaid plug, because they're really...
1546120	1550120	I don't want to make them sound irresponsible,
1550120	1554120	but they give you money, and they kind of let you do your thing.
1554120	1555120	Well, that's kind of the reason why.
1555120	1559120	Okay, so once you see this film, you'll realize, like, holy shit,
1559120	1563120	who would have given these people this amount of money to go make this movie?
1563120	1564120	It was a crazy thing.
1565120	1566120	Imagine going to a pitch and being like,
1566120	1570120	all right, so there's this girl and her best friend,
1570120	1573120	this genetically modified pig, and gets taken from her,
1573120	1578120	and she's a visual effect.
1578120	1581120	Give us several million dollars to make this.
1581120	1583120	But also it's rated R.
1583120	1584120	And it's rated R.
1584120	1586120	That's the big thing.
1586120	1591120	It's a big, giant CG pig that you fall in love with the first moment you see it.
1592120	1594120	It's a horrible rated R movie.
1594120	1595120	It is.
1595120	1598120	I mean, I can't even imagine any other studio being like,
1598120	1601120	yes, Director Bong, here's a check.
1601120	1603120	But that's why I really think it's a masterpiece.
1603120	1604120	And also something...
1604120	1607120	When I was watching it, I was like, oh, so this is a Snowpiercer guy.
1607120	1610120	I started watching Snowpiercer, and then I was like,
1610120	1614120	ah, there's tonal incompatibilities with me here.
1614120	1617120	It's hard enough to write a comedy or an action movie.
1617120	1619120	I don't want this goofiness happening in my action movies.
1619120	1621120	And I kind of drifted away from it, and I was like,
1621120	1624120	I bet that's just a thing when East meets West, like filmically.
1624120	1627120	And then when I watched this movie, I was like, wait, no,
1627120	1631120	is this guy like the Coen brothers or anybody else that we put in that category
1631120	1633120	where he's fucking with us?
1633120	1635120	He deliberately...
1635120	1639120	He's evolving now, or maybe this movie just makes it clearer
1639120	1642120	that he really deliberately plays with tone
1642120	1647120	in order to take you from laughter to horrible facing the abyss.
1647120	1648120	He's master at that.
1648120	1650120	If you've watched any of his other films,
1650120	1653120	he did this film called Mother, and earlier did Memories of Murder,
1653120	1657120	and then he did this Korean film called The Host,
1657120	1660120	which the first time I saw it, I was like, what is this?
1660120	1663120	And it's like this horror movie wrapped up in comedic bits.
1663120	1665120	And one scene that I feel like wraps...
1665120	1668120	For me, that wrapped him up was in that particular movie.
1668120	1673120	There's a scene where the father figure is explaining to his kids
1673120	1678120	why the third particular youngest son is kind of seemingly messed up
1678120	1679120	and doesn't have his life together.
1679120	1683120	And he's like, you know, we were so poor when he was little
1683120	1685120	and I couldn't feed him proper protein,
1685120	1688120	so that's why your brother's a little slower than you guys.
1688120	1691120	And he's really burying his soul,
1691120	1694120	and then the camera pans to the other brother and sister and they're sleeping.
1694120	1696120	It's just like those tonal shifts
1696120	1699120	where he's trying to open up and be emotional about something,
1699120	1702120	but the world is not hearing it.
1702120	1706120	And it kind of reminds me of Almadovar in that sense.
1706120	1711120	And I don't know how much of that is the effect of watching a foreign film
1711120	1716120	that blends a little comedy with thought-provoking weird shaky shit.
1716120	1720120	That's what I'm trying to figure out as a Western viewer
1720120	1723120	is how much of this is one person's genius
1723120	1728120	and how much of it is just the weird effect of a movie
1728120	1731120	translating across international borders.
1731120	1734120	I need a little bit of both, and if you know anything about Director Bong,
1734120	1738120	he is like, I think growing up in Korea,
1738120	1743120	which had a very military kind of regime for a long time when he was growing up,
1743120	1745120	I don't know if he wants me to say this,
1745120	1749120	but he was arrested for protesting in the 90s and stuff like that.
1749120	1753120	He is intrinsically, I think, a person who has something to say
1753120	1756120	about the way the system works and kind of fighting against him.
1756120	1758120	This is kind of his way of doing it.
1758120	1760120	I don't want to put words in his mouth,
1760120	1762120	but that's kind of how I read it.
1762120	1765120	This film, I think the underlying message,
1765120	1771120	of course it's about friendship and this little girl and bringing her family back
1771120	1775120	and having to come to terms with adults and grow up really quickly
1775120	1778120	in the span of a week or however long this film takes place,
1778120	1784120	but it also has this kind of nod to the greed
1784120	1788120	and horrible nature of capitalism.
1788120	1790120	But you're never preached to.
1790120	1792120	That's what I'm trying to figure out how to tell people
1792120	1795120	because the truth is if I read the description of this on paper,
1795120	1797120	I don't think I would.
1797120	1799120	I'd be like, well, when am I going to be in the mood
1799120	1804120	to be told that every time I eat bacon that something horrible is happening?
1804120	1807120	I'll put that on my list.
1807120	1811120	But because I just wandered into this movie and saw it,
1811120	1815120	I was just like, I want to tell people you don't have to worry about that.
1815120	1822120	It is heart-wrenching, but only in the same way that kind of E.T. is.
1822120	1829120	And I guess it's sort of like, what if E.T. was delicious?
1829120	1834120	It would just make E.T. kind of extra, you'd be rooting for Elliot to fly a little more.
1834120	1836120	Spoilers, Elliot flies.
1836120	1840120	E.T.'s kind of a piece of shit. This movie's really good.
1840120	1844120	I mean, there's definitely a lot of, you can sense the,
1844120	1849120	there's like a half dozen movies that you could feel a real genuine influence from
1849120	1850120	without being derivative.
1850120	1855120	You feel this whole E.T. thing, but you also feel this King Kong.
1855120	1859120	King Kong, like Pete's dragon if you go down there.
1859120	1864120	I would say that a big props, though, goes to our visual effects supervisor,
1864120	1867120	Eric DeBoer, just putting it out there.
1867120	1870120	He helped create this magnificent creature.
1870120	1875120	I've never worked on a film where we've had this amount of CG.
1875120	1877120	I mean, World War Z was a different thing,
1877120	1883120	but this was like the main character, the star of the film, is a visual effect.
1883120	1884120	Yeah.
1884120	1890120	So how do you create that bond between this little girl and this made-up creature
1890120	1893120	and make it believable and touching?
1893120	1895120	I've seen the movie probably like 20 times now,
1895120	1898120	and every single time at the end I'm like crying.
1898120	1901120	And it's kind of remarkable in terms of like...
1901120	1904120	I found myself crying because the movie was so good.
1904120	1907120	Sometimes I was like, not because it was sad narratively.
1907120	1911120	There were those times then, too, where I could hear Cody sniffling,
1911120	1914120	and I was like, if I look at her, then she'll see that I'm crying.
1914120	1921120	But I don't want to oversell it, but, you know, hey, everybody watch this
1921120	1926120	and tell me I'm insane if it's not actually this big a deal, this movie.
1926120	1932120	But I found myself near tears because of the action sometimes,
1932120	1936120	because I was like, yes, this is how you do it.
1936120	1940120	It's a little girl, and she's trying to save her pig.
1940120	1947120	But it's not cloyingly like, oh, she's a little girl, but she's a powerpuff girl.
1947120	1950120	She's got big, strong powers.
1950120	1954120	She's a little girl, and she's really at odds with the physical world,
1954120	1958120	but she just is flinging herself literally and figuratively
1958120	1962120	at this giant machine called humanity.
1962120	1968120	And what I was most impressed by was there's these action scenes
1968120	1971120	where if she's chasing a...
1971120	1976120	You can see her making decisions about physically what she should try to do next.
1976120	1979120	So you feel like you're playing like an 80s laser just video game or something,
1979120	1982120	because you actually are with her in that she's like,
1982120	1984120	you know, am I going to try to jump on this truck?
1984120	1986120	Yeah, I think I should, but I didn't.
1986120	1990120	Typically in action movies, there's a little bit of suspension of like,
1990120	1993120	oh, how did you know that you were going to...
1993120	1996120	You're just improvising, and so you decided to jump,
1996120	1998120	and now you're going to land on that truck.
1998120	2000120	But it's like there's a slight difference between that,
2000120	2002120	and I do this all the time, by the way.
2002120	2004120	It's called dance planning.
2004120	2006120	I'm a terrible interviewer.
2006120	2008120	I just bring people up, and I just talk.
2008120	2010120	I coined that.
2010120	2012120	But do you know, from working with him,
2012120	2014120	is that a conscious thing when he's doing action
2014120	2017120	that he wants people to track the choices?
2017120	2020120	Okay, well, another thing about Director Bong
2020120	2023120	is he's like a director who never worked with him before.
2023120	2027120	This guy's like remarkably meticulous in the way he shoots.
2027120	2031120	So every sequence or every whatever,
2031120	2033120	the entire script is basically storyboarded.
2033120	2036120	So I land in Korea, and you're basically handed this book
2036120	2039120	of the entire movie that's storyboarded shot for shot.
2039120	2040120	It was insane.
2040120	2042120	And then the night before, we get our call sheets,
2042120	2045120	and with them are the boards for the next day
2045120	2047120	with exactly what's going to happen.
2047120	2050120	So it was kind of crazy, because you already knew,
2050120	2052120	and you already knew what it would look like,
2052120	2054120	and then you would direct a scene,
2054120	2058120	and it was exactly like those boards, what was drawn.
2058120	2060120	And a lot of people were like,
2060120	2062120	oh, that does that give you creative freedom or whatever?
2062120	2063120	But it does, I think.
2063120	2065120	If you hear some of the actors talk about it,
2065120	2068120	they're like, we knew exactly what we needed to do,
2068120	2072120	so then we could kind of have freedom within those parameters.
2072120	2075120	And then the little girl, Mija, who's played by An Seo Hyun,
2075120	2077120	was just remarkable.
2077120	2080120	She's like this incredible kid,
2080120	2083120	and did everything so beautifully,
2083120	2085120	and then would just go and do it,
2085120	2086120	and she'd be playing in the corner,
2086120	2087120	and then he'd be like, action,
2087120	2090120	and then she'd go run down the street,
2090120	2091120	and then he'd be like, cut,
2091120	2094120	and then she'd be like, where's the snack truck?
2094120	2097120	I think people are going to freak out most about her,
2097120	2100120	because people are freaking out about the little girl in Logan
2100120	2102120	who's so amazing and so striking,
2102120	2105120	and she's doing so much with so little dialogue and stuff.
2105120	2108120	She's just glaring at Hugh Jackman and holding her own.
2108120	2112120	But this little girl is doing these scenes with Paul Dano,
2112120	2116120	who I was never like, hey, sign me up for the Paul Dano fan club,
2116120	2118120	nor was I a hater.
2118120	2120120	I would see him and I'd go, who's that guy?
2120120	2122120	His face is kind of weird.
2123120	2125120	But he is fucking amazing.
2125120	2127120	I wanted to marry him.
2127120	2130120	His character, that's the other thing.
2130120	2131120	Again, I'm doing it again.
2131120	2132120	I'm not asking you anything.
2132120	2133120	Keep going.
2133120	2135120	That character is deeply flawed,
2135120	2137120	but he's so righteous,
2137120	2140120	and it's in his relationship with the girl.
2140120	2146120	I loved the internationality of the story.
2146120	2148120	I love that it's part of the story
2148120	2151120	that some people speak Korean and English,
2151120	2153120	some people only speak Korean,
2153120	2155120	some people only speak English.
2155120	2157120	That was kind of another aspect of the film
2157120	2159120	that we wanted to touch upon.
2159120	2161120	I think Director Bond likes to have these characters
2161120	2163120	that are conflicting.
2163120	2165120	There's this animal liberation front,
2165120	2169120	and they're a group with well-intentioned meanings,
2169120	2173120	wanting to save this pig and expose this evil corporation
2173120	2176120	and how they had created all these things,
2176120	2178120	like super pigs that are just fucked up
2178120	2181120	and they're having a terrible time.
2181120	2183120	They're terrorists.
2183120	2185120	There's a group of terrorists in the movie,
2185120	2187120	and they're the good guys.
2187120	2190120	There really is an ALS, that's an actual thing.
2190120	2192120	Is it based on the actual thing?
2192120	2194120	I think it's not like a direct,
2194120	2196120	it just happened to be,
2196120	2198120	I think it came from his cousin,
2198120	2200120	an activist or something.
2200120	2205120	But anyway, they themselves are very conflicting characters,
2205120	2207120	especially Stephen Young's character,
2207120	2209120	who is Korean-American,
2209120	2211120	and he speaks Korean in the film,
2211120	2213120	but he's terrible at translating.
2213120	2214120	His character is.
2214120	2215120	His character is.
2215120	2217120	I mean, in real life.
2217120	2218120	I'm just kidding.
2218120	2219120	He's Korean's really good.
2219120	2220120	His Korean's really good.
2220120	2222120	So they have these conflicting characters
2222120	2227120	where they really mean well,
2227120	2228120	but they're kind of like a group
2228120	2231120	of just like bumbling idiots at times.
2231120	2232120	Yeah.
2232120	2233120	I mean, they're pure of heart.
2233120	2234120	It's hard to say.
2234120	2236120	It's that archetype where the people show up
2236120	2237120	and they're kind of like, they're goofy,
2237120	2238120	but they're heroes.
2238120	2241120	Even Jake's character is like a deeply, deeply,
2241120	2243120	I don't know if you got that,
2243120	2246120	but he's like a deeply flawed person
2246120	2248120	who started out as like this,
2248120	2252120	you know, Steve Irwin-esque kind of like animal lover
2252120	2254120	and then has just been beaten down
2254120	2256120	by this woman for the past like,
2256120	2259120	Tilda's character for the past like 10 years.
2259120	2260120	He's like the shell of a man who he was
2260120	2262120	and he's just kind of taking it out on.
2262120	2263120	Yeah.
2263120	2265120	Let's talk about Gyllenhaal for a second.
2265120	2270120	In this movie, just because I want to protect him
2270120	2272120	because I feel like he's making choices in this movie
2272120	2274120	that are so fucking over the top that everyone,
2274120	2276120	that I'm afraid, maybe I'm wrong about this,
2276120	2278120	but I'm afraid people are going to go,
2278120	2280120	why is he acting like the Riddler
2280120	2283120	when other people aren't doing that?
2283120	2286120	But like, what kind of conversations
2286120	2289120	does Director Bong have with actors?
2289120	2290120	Do they show up to set and go like,
2290120	2292120	I thought I'd try something like this?
2292120	2293120	And he's like, whatever.
2294120	2297120	Or is he like, how hands on is he?
2297120	2299120	So, Jake came in like, I think we were halfway
2299120	2302120	through our shoot in Korea or so.
2302120	2307120	And we were literally on this mountainside at her house
2307120	2309120	when he comes up.
2309120	2312120	The mountain is like, that was like the first day.
2312120	2314120	And it's this beautiful set.
2314120	2315120	It's in the middle of nowhere.
2315120	2318120	You have to like hike down for like 10 minutes.
2318120	2320120	It's super secluded.
2320120	2323120	And Director Bong was just like, yeah,
2323120	2325120	so, you know, he's coming up the thing
2325120	2327120	and maybe he's just really out of breath.
2327120	2329120	So he's like, hey, hey.
2329120	2331120	And you know, so he kind of ran with it.
2331120	2333120	And then that happened.
2333120	2335120	And it kind of just stuck.
2335120	2338120	And we, you know, of course, like us being on the other end,
2338120	2342120	you know, we see those dailies and we're just like,
2342120	2345120	does anybody want to say anything?
2345120	2348120	And what does Bong say?
2348120	2350120	Well, we were like, hey, so, and he was like, no,
2350120	2351120	I kind of like it.
2351120	2352120	So then we're like, all right.
2352120	2355120	And we had like this weird trust that it would work out.
2355120	2356120	And it did.
2356120	2360120	But he stuck with being out of breath as a character choice.
2360120	2366120	So when you see the film, I think he is very high pitched.
2366120	2368120	It's kind of like, did you see Snowpiercer?
2368120	2369120	Did you?
2369120	2371120	I hated Snowpiercer.
2371120	2372120	There's like.
2372120	2373120	It's a bad movie.
2373120	2374120	Meet me after the show.
2374120	2377120	I'll explain it to you.
2377120	2381120	There's like everybody's.
2381120	2384120	Tilda Swinton, what she's doing in this movie,
2384120	2387120	along with Giancarlo Esposito, who was on Community.
2387120	2388120	That's not important.
2388120	2394120	But it was also kind of exciting.
2394120	2400120	Just the two of them, along with what Director Bong does with Foley,
2400120	2404120	like in scenes that have no score where they're talking.
2404120	2410120	And like Tilda Swinton is like doing just the character is like.
2410120	2415120	A total cartoon and absolutely like rich somehow,
2415120	2417120	like captivating.
2417120	2420120	Maybe that's just, oh, you're pulling out the Ferrari of actors
2420120	2422120	and you're just like, like, so just cruising around the block
2422120	2425120	feels like an Olympic sport.
2425120	2429120	Or maybe there's like, but it feels like this incredibly amazing character,
2429120	2430120	this performance.
2430120	2433120	And then Giancarlo being like her like attendee.
2433120	2435120	And then he like goes and makes a cup of coffee.
2435120	2439120	And you're just like the choice of the camera to be everywhere it is
2439120	2442120	at every moment where you watch Giancarlo Esposito
2442120	2446120	make a cup of coffee for a second before doing his next line of dialogue.
2446120	2448120	And everything is just Foley.
2448120	2453120	Step, step, step, click, pour, steams.
2453120	2455120	You're thinking you're bringing her to New York.
2455120	2456120	And then that's my favorite.
2456120	2457120	That's one of my favorite parts.
2457120	2460120	She goes, I was just about to say that.
2460120	2463120	And I think it's in that scene because like then Gyllenhaal's also in that scene.
2463120	2466120	He comes into it and goes like, here's what I think.
2466120	2471120	And I'm kind of like, oh, man, I don't want anybody to be punished for enthusiasm.
2471120	2478120	No, I think the way that I like reconciled that in my head was that his character,
2478120	2482120	basically he like 10 years ago was this normal guy.
2482120	2486120	And then for 10 years, he's been playing the role of this spokesperson
2486120	2490120	and having to do all this stuff, and he's become a puppet for this corporation,
2490120	2493120	that he's almost become the role that he was just playing.
2493120	2495120	And he does say that stuff.
2495120	2498120	Yeah, and then she even says, like, quit your whining.
2498120	2499120	Right.
2499120	2503120	If I was in the edit bay, no one needs my help on this movie.
2503120	2504120	It's a masterpiece.
2504120	2508120	But I was like, well, put your money where your mouth is, Harmon.
2508120	2512120	If I was in the edit bay and I had all that footage and I had one pickup shot,
2512120	2519120	I would just have one shot where Gyllenhaal's character does a little anal nitrate.
2519120	2523120	Like, he just does one popper.
2523120	2525120	Or something weird, some weird thing.
2525120	2527120	Like, huff something.
2527120	2532120	Well, you know, that would have been helpful like three months ago.
2532120	2533120	But it's not, yeah.
2533120	2534120	I mean, yeah.
