start	end	text
0	16040	From beautiful Uptown Burbank, Hermitown is now in session.
16040	25120	Spencer Clifton.
25120	26120	What's in that bag?
27120	29120	Special stuff in that bag.
29120	30120	I don't know, man.
30120	33120	Let's bring out the mayor of Hermitown, Dan Harmon.
38120	40120	Thank you, thank you.
40120	42120	Wow, I think it's a new lighting setup, right?
42120	43120	Say what?
43120	46120	I assume the microphone's further back because it's part of a new lighting setup.
46120	47120	I don't know.
47120	50120	Why do I always start to show in the worst fucking way?
50120	58120	Not just the worst way, but just specifically in like really wondering about whether the microphone's position is important in some way.
58120	65120	Like whether it's intentional or haphazard is like, that's been a topic of discussion at the top of the show many times.
65120	69120	Yeah, I guess it's the first thing that I see.
69120	71120	Yeah, no, I'm sure that's why.
71120	73120	It's not a scripted show.
73120	75120	I don't have a plan to talk about anything.
75120	77120	I mean, I have a couple notes.
78120	87120	I passed a very important romantic threshold on my trip to New Orleans to celebrate Cody's mom's 70th birthday.
87120	89120	We went to this city.
90120	92120	New Orleans is great.
96120	97120	So you like music and food.
97120	98120	Who doesn't?
98120	100120	I don't understand that part of it.
100120	101120	I'm not yelling at them.
101120	104120	They've been through enough, but I just don't understand.
105120	107120	Who doesn't like music and food?
107120	117120	And if I go to your city that's famous for its food, say you got your Portland, let's say your Asheville, North Carolina we've been to, Austin, New Orleans.
117120	118120	The big food cities.
118120	121120	The food cities, where it's like, oh, all the food's good.
121120	122120	And it is.
122120	123120	We always go there.
123120	130120	If you go to these cities and open a bad restaurant, is it just the momentum of the capitalistic biosphere there?
130120	132120	Just people wouldn't go.
132120	133120	They go, this food's terrible.
133120	134120	I'm a Portlander.
134120	135120	I know the difference.
135120	136120	I'm not going to.
136120	137120	And then you would.
137120	141120	So like these are just cities that have created an ecosystem of foodism.
143120	147120	So you're mad at New Orleans for liking food and for liking music.
147120	148120	I'm just wondering if it's all a scam.
148120	154120	You know, you just say your city is at the home of good food and then people will just go, this is delicious.
154120	159120	Like I'm kind of suspicious of it because I ate a lot of things called like Creole omelets and they really tasted like omelets.
160120	162120	You're not supposed to get a Creole omelet.
162120	166120	You're supposed to get a bag of crawdads or some fucking, you know, a beignet and shit.
166120	169120	And what is this obsession with the saints marching in?
169120	172120	That's a really horrible song.
172120	174120	It's about the apocalypse.
174120	177120	It's an apocalyptic biblical song.
177120	178120	Right.
178120	179120	It's zealotry.
179120	181120	It's about picking the right team.
181120	183120	Anyways, that's not what I wanted to talk about.
183120	188120	I was in a hotel room and we were going to go out to breakfast.
188120	191120	And I didn't at any time.
191120	197120	And I suddenly noticed I never, as we were leaving the hotel room, I never asked.
197120	202120	I never made sure that both Cody and I had a key.
202120	205120	And I always did that.
205120	212120	I was married and I always I've never stayed in a hotel room with somebody and didn't make sure that we both had keys.
212120	213120	When we left the room.
213120	214120	Right.
214120	220120	So this symbolically, this means that something is I've let go of something in the back of my head as I leave a hotel room with Cody.
220120	223120	Like I'm like, I imagine we'll be coming back together.
223120	226120	Oh.
226120	231120	Or that's assuming we're coming back together no matter what.
231120	241120	Well, I mean, you could look at it as clingy, but I think it's I think it's more unhealthy than I was always like prepared for the event of coming home separately.
241120	242120	Right.
242120	251120	Like well into my marriage, I was still like, well, you know, stitch in time.
251120	255120	It's a weird thing to be prepared for, you know, like, well, you never know.
255120	258120	We could now you feel healthy because you like.
258120	261120	Yeah, it never even occurred to me like it was like the third time we went out.
261120	264120	I was like, oh, shit, I haven't I haven't had a hotel key this whole time.
264120	269120	I'm like totally comfortable being completely dependent on this woman.
270120	273120	See, it sounds pretty codependent.
273120	275120	Yeah, I mean, I think that's a good.
275120	280120	I think it's a good move in the right direction for me.
280120	282120	Yesterday was a good day.
282120	284120	You all know.
284120	286120	Did you have to use your AK?
286120	287120	Yes.
287120	289120	No, no, I didn't.
289120	292120	That was a good day.
292120	295120	But, you know, well, I did this.
295120	298120	I picked up my gun.
299120	300120	I now.
300120	302120	Did you use your AK or did you not use your AK?
302120	307120	I learned to field strip my Glock 19 in my bed and oil it.
307120	309120	So you finally got your gun.
309120	310120	Yeah.
310120	311120	Danny got his gun.
311120	312120	Yeah.
312120	318120	And it's amazing like guns are guns are amazing.
318120	322120	It's one of the greatest ways to shoot bullets.
322120	323120	That's the thing.
323120	327120	So that's the thing that was great because part of the safety manual or the owner's manual period is
328120	338120	first of all, let me explain how a gun works and what's happening when you pull the trigger so that you don't blow yourself up or someone else that you're not meaning to because it's a lethal weapon that you bought to put holes in people.
338120	341120	But let's make sure you don't put in the wrong person.
341120	342120	And so they explain how everything works.
342120	348120	And it kind of really sinks home because you the ammunition you buy by the bucket.
348120	352120	Like I said, oh, I guess I need some bullets for this.
352120	355120	And the lady said, how many buckets of ammunition?
355120	356120	Yeah.
356120	360120	And she's like, yeah, behind you, there's the target range bullets.
360120	363120	And then there's the home defense bullets.
363120	364120	Those are more expensive.
364120	365120	Why?
365120	369120	Because they because the target range bullets will just go through walls and stuff.
369120	374120	So even though they're kind of more dangerous, they're cheaper.
374120	381120	The more expensive bullets are the ones that are just for shooting a someone just explode inside of human body.
381120	382120	Yeah.
382120	383120	That's what I was thinking.
383120	386120	I was like, do they like lob out and like land on the burglar?
386120	392120	But no, it's probably is that they're just like made of different stuff and they're not like going through the shooting.
392120	396120	The gun range bullets are more deadly than than cheaper.
396120	399120	And you buy I bought a paint bucket full of bullets.
399120	404120	That's it. And that's just an interesting sideline in this world of mass shootings and stuff.
404120	410120	When they say the they go and they look in the trunk of the person and they say, look how much ammunition they had.
410120	412120	But you know, you buy this stuff in bulk.
412120	420120	And the odd thing to me is that these guns, they're basically staplers that that have a little you put a little rocket in them.
420120	426120	And and it's got it's got a bunch of explosive in it like a stapler.
426120	433120	Well, the gun part is like a stapler up until the point where instead of a stapler, there's a fucking tiny rocket.
433120	437120	So that's my point is like Chris Rock has that joke about we don't need gun control.
437120	438120	We need bullet control.
438120	440120	That would be the solutions to make bullets really expensive.
440120	443120	But I'm not making that same joke.
443120	447120	But I am saying, like, isn't it fucking weird that we don't regulate bullet?
447120	449120	Like you could walk into that store.
449120	451120	I don't need a license to just buy these things.
451120	454120	Like ostensibly, I can go home and make a gun.
454120	457120	People make guns in prisons out of like bunk bed legs.
457120	459120	Like I saw Hill Street Blues once.
459120	462120	There was a guy he was like, I got to get like a zip gun or something.
462120	469120	He's holding like a little toothbrush thing he made as long as it hits the firing pin.
469120	471120	Pin receiver thing on the back.
471120	473120	The primer cap.
473120	475120	Dan, you can talk the talk.
475120	478120	That's the thing that kills you.
478120	481120	There's a bucket of little rockets in my bedroom.
481120	485120	And it was like eight bucks for a thousand of them or something.
485120	488120	And it's like those things kill babies.
488120	491120	This gun is just like you take it apart like John Wick.
491120	493120	You learn how to do that to clean it.
493120	496120	And that's when you realize all those movies, you know,
496120	500120	you see the movies where the guy grabs the gun and field strips it with one hand.
500120	502120	Like the slider fly.
502120	504120	You can't. Come on.
504120	510120	If a guy did that, if I was a thug and I was like patrolling a drug lair
510120	515120	and a guy in a trench coat that was like the hero came around the corner
515120	518120	and he grabbed the gun, I'd be like, oh, fuck.
518120	520120	God, you're good.
520120	524120	But then if he like stripped it, like took it apart really fast,
524120	527120	he'd be like, okay, what are you, a magician?
527120	531120	What are you spending your time on learning how to do that?
531120	534120	Then maybe I should try to grab the gun back.
534120	540120	That's like if you grabbed your gun and then did a card trick or something.
540120	544120	The best time to take a gun away from somebody is when it's taken apart.
544120	546120	It's the safest time.
546120	548120	Well, it'd be easier.
548120	550120	Anyways, I'm just saying.
550120	553120	Also, I like that you think that bullets are rockets.
553120	555120	They have a little combustible thing.
555120	557120	They have a little cartridge of gunpowder.
557120	559120	I mean, it's like that's the part that kills you.
559120	562120	What size gun do you have? What's the ammunition you have?
562120	564120	It's a 9-millimeter.
564120	567120	And I'm sorry, I know I stimulated the market.
567120	568120	I'm part of the problem.
568120	574120	We've had gun violence just this last week and here I am like stimulating that market.
574120	577120	It's like, for instance, if I was going to have someone up to talk about this
577120	580120	amazing movie that has a very pro-vegetarian kind of vibe
580120	584120	and I've been eating fucking sausage like crazy after.
584120	586120	Yeah, we're part of the problem.
586120	588120	When we vote with our dollars, I bought a gun.
588120	591120	But I have no excuse.
591120	593120	I'm just scared.
593120	595120	I'm like, I'm doomsday prepping.
595120	598120	We got ham radio instruction manuals.
598120	602120	Man, yeah, I'm learning how to do ham radios.
602120	604120	This shit's hard, man.
604120	605120	There's a ham radio store.
605120	608120	It was so much easier for you to just get the gun.
609120	611120	It was so easy to get the gun.
611120	613120	And then we went to the ham radio store and the guy's like,
613120	615120	all right, what's going on here?
615120	619120	Tell me what you want and I'll tell you how you can get it a month from now.
619120	621120	And it was like crazy.
621120	623120	We bought for $30.
623120	626120	Yeah, his position was like trying to,
626120	629120	it was like a secret club where he was trying to not tip his hand
629120	633120	but gauge where we were on the totem pole of ham radio.
633120	634120	Right.
634120	636120	Because there is a totem pole of ham radio.
636120	638120	And it has like three or four tiers.
638120	640120	But you can be mentally ill and buy a gun.
640120	641120	Oh, yeah.
641120	644120	Yeah, and they're lifting those regulations like crazy.
644120	647120	Those people have lost their minds.
647120	650120	You don't even need to pass background checks half the time
650120	652120	because like background checks can get expedited.
652120	655120	And if they go, I mean, this is certain states.
655120	658120	But if they, like if at a certain time period lapse,
658120	660120	they'll just go, oh, it's been too long.
660120	662120	Let's not do a background check anymore.
662120	665120	And then so people just get guns without background checks.
666120	667120	It's great.
667120	671120	So yesterday was a good day because I was like,
671120	675120	I'm just on this crazy roller coaster where I swear,
675120	677120	I have to be totally honest and just say,
677120	681120	if President Trump is upset, I am happy.
681120	684120	And if he's happy, I'm just depressed.
684120	686120	I can't do anything.
686120	690120	So if he's tweeting like, hey, I don't know.
690120	693120	If he's just like spiking his little toddler football,
693120	695120	I'll just have a bad day all day.
695120	699120	But then, yeah, two days ago, it was like this great morning
699120	702120	because he had that tweet about how he was under investigation
702120	705120	and he's like throwing his fire truck around the room.
705120	706120	And it just felt good.
706120	710120	And all of the articles were about like it's closing in on him
710120	711120	and he's under investigation.
711120	712120	I can't believe he admitted it.
712120	713120	What a dummy.
713120	716120	And all this stuff and just all the refreshed
716120	718120	on all the threads of how we're going to prove
718120	719120	that he colluded with the Russians.
719120	721120	This isn't conspiracy theory.
721120	722120	This is a real thing.
722120	725120	And now we're going to get his financials and blah, blah, blah,
725120	726120	and all this stuff.
726120	727120	It just felt really good.
727120	729120	And then this morning, it was like his lawyer says
729120	730120	he's not under investigation.
730120	732120	And I was just like, what the fuck?
732120	733120	That's why I got the gun.
733120	737120	I got the gun because the only thing I understand
737120	738120	is that I'm out of control.
738120	741120	And I don't know if you know how hard it
741120	745120	is to be white and male and fragile.
745120	748120	And you said before that, if you had to kill yourself,
748120	749120	you'd do it with a gun, right?
749120	751120	Yeah, I did say.
752120	753120	Yeah.
753120	755120	I don't know how I feel about it.
755120	760120	People don't realize how much the real heroes of Handmaid's Tale
760120	763120	are the commanders.
763120	765120	I have a question about Handmaid's Tale.
768120	772120	Why is it part of the point of that dystopia
772120	774120	that even the men are miserable?
774120	777120	Because isn't it a dystopic thing,
777120	779120	where it's like the patriarchy is out of control
779120	782120	and the women are just objects of fertility
782120	784120	and servants and things.
784120	787120	And they don't have rights anymore.
787120	793120	But there's no men lighting cigars with women's hair
793120	796120	and going like, I love having balls.
796120	799120	They're all bummed out because they have to fuck their babysitter
799120	802120	when they're looking at their wife.
802120	804120	And everyone's sad.
804120	806120	I'm like, what kind of patriarchy is this?
807120	812120	Shouldn't it look at least like a little bit like 60s Playboy club
812120	814120	to their Lorraine little tales
814120	820120	and the conception sessions are private and involve music?
822120	826120	I wish we could just find a dystopia where we could have fun.
827120	830120	But that makes me wonder, is that part of the commentary,
830120	834120	that it's not just about, oh, if men had their way,
834120	835120	it would be awful.
835120	837120	It's more about, look what we do to ourselves.
837120	840120	The patriarchy is the patriarchy
840120	843120	because it's not self-aware enough to understand what it wants
843120	844120	and doesn't want.
844120	847120	We'll all land ourselves if we continue to follow this path.
847120	851120	If we use the excuses of religion and things like that
851120	854120	and gender identity to construct a society
854120	855120	where everyone gets to do what they want,
855120	857120	nobody's going to get to do what they want.
857120	860120	Everyone's going to be all bummed out and under pressure.
860120	862120	And it would be better if we just relaxed,
862120	865120	even if we were a little infertile.
873120	874120	I agree.
875120	877120	My other question is, in the book,
877120	880120	after she plays Scrabble with him,
880120	882120	does it have like the 80s needle drop
882120	885120	while she walks in slow-mo like in Mean Girls?
885120	887120	I felt like it was mixed messaging,
887120	890120	but I'm not a guy, but I'm enjoying the show.
891120	892120	I am a guy.
894120	897120	I am a guy and am enjoying the show.
898120	900120	Damn, it's okay to not be a guy.
903120	904120	But we are kind of behind.
904120	907120	We haven't watched Handmaid's Tale for a while.
907120	908120	So maybe we didn't enjoy it.
908120	911120	Maybe we got turned off by the Mean Girls slow-mo walks.
911120	913120	Maybe we bailed on it.
913120	914120	Maybe we were like, what is this?
914120	915120	What's going on?
915120	916120	Let's watch Wizard of Lies.
916120	917120	Why is it called Wizard of Lies?
917120	919120	Is it supposed to sound like Wizard of Lies?
919120	920120	What are they going for?
922120	923120	Why is this a non-linear story
923120	925120	if the whole thing takes place in an apartment?
930120	931120	How's your book coming along?
933120	935120	I'm working very hard on it.
936120	937120	It's almost done.
937120	938120	It's almost done.
938120	939120	Just shut up.
939120	940120	They're going to sue the fuck out of me.
945120	946120	And when I'm working hard on it,
946120	949120	I had to go back and rewrite part of the introduction
949120	951120	where I was like, I'm introducing a book.
951120	952120	Okay, hold on.
952120	953120	The election's on.
953120	954120	What the fuck?
954120	956120	There's no such thing as a book that you started
956120	958120	before the fucking election.
959120	961120	A lot of creatives are going through this.
961120	963120	There's also positive effects of the election
963120	965120	where I'm finding as I work with writers
965120	967120	and different stuff where we're breaking stories
967120	969120	about a snowman that comes alive
969120	971120	or a robot that fucks a shoe.
971120	975120	Whatever it is, even if it has nothing to do with politics,
975120	978120	there's been a 10% decrease
978120	980120	in the need for suspension of disbelief.
980120	981120	Does that make sense?
982120	984120	It's just across the board, like all writers.
984120	985120	I'm not kidding.
985120	986120	It sounds like a joke,
986120	987120	but it's like on every single project
987120	989120	that I started before the election
989120	991120	and now I'm working on after the election
991120	993120	and we're having trouble with stories and stuff,
993120	996120	we just go like, wait, so can't he just be a time traveler?
996120	998120	And then they go, yeah, why did we rule that out?
998120	1002120	Oh, because, yeah, that was before the singularity
1002120	1003120	started glitching out.
1004120	1008120	And like, wait, why don't we just have her say,
1008120	1011120	snowman, snowman, come alive, man,
1011120	1013120	and she could just walk up the walls
1013120	1015120	like Lionel Richie and...
1018120	1019120	Put the ceiling fan on her head
1019120	1022120	and fly out the skylight like Inspector Gadget.
1022120	1024120	Why didn't we think of that before?
1024120	1025120	I don't know.
1025120	1028120	What was blocking us before?
1030120	1031120	Anything can happen.
1031120	1032120	I got a gun.
1032120	1035120	Yeah, I'm gonna fucking kill myself with it.
1035120	1036120	Don't do that.
1036120	1037120	Eventually.
1037120	1038120	No, don't.
1038120	1040120	You want me to die of a stomach ulcer?
1040120	1041120	Yeah.
1042120	1045120	Oh, man, I hope you die of a stomach ulcer.
1047120	1049120	Can they kill you?
1049120	1050120	A stomach ulcer?
1050120	1051120	Can you die of an ulcer?
1051120	1052120	No.
1052120	1054120	Well, you get stomach.
1054120	1055120	An unintended stomach ulcer
1055120	1057120	could create stomach cancer, I guess.
1057120	1058120	No.
1058120	1059120	Do you have ulcers?
1059120	1060120	I assume I have ulcers.
1061120	1063120	No, I don't feel anything in my tum-tum.
1063120	1066120	I have horrible heartburn.
1066120	1068120	Chronic, horrible heartburn.
1068120	1072120	It's got to be just 40 years of just soaking my esophageal flap
1072120	1074120	in vodka has made it kind of...
1074120	1076120	I can tell because if I eat popcorn,
1076120	1080120	I now have to consciously breathe
1080120	1083120	then eat the popcorn and then not breathe while I'm eating the popcorn.
1083120	1087120	If I'm watching a movie where a voorhees
1087120	1089120	or something comes around the corner and I go...
1089120	1095120	The popcorn's going straight into every, like, alveoli balloon.
1095120	1100120	Like, I just have lungs full of popcorn that are just disintegrating.
1100120	1105120	There's, like, dormant tuberculosis in there, like, eating the popcorn.
1105120	1107120	I didn't know. What did I do right?
1112120	1113120	So you got to be careful.
1113120	1115120	You seem a little down.
1115120	1117120	You said yesterday was a good day or today was a good day.
1117120	1119120	Yeah, today's a bad day because it's just like,
1119120	1122120	oh, I'm not under investigation. You can't control this guy.
1122120	1125120	He said he's just a big...
1125120	1128120	There's a baby. There's a baby on a motorcycle,
1128120	1135120	like driving in a bullet store
1135120	1139120	with these swinging firing pins around in the bag.
1139120	1141120	Throwing them everywhere.
1141120	1144120	I mean, a baby in a motorcycle in a bullet store,
1144120	1146120	it's not going to set the bullets off.
1146120	1148120	And maybe that's why the bullets aren't dangerous
1148120	1149120	because nothing can.
1149120	1152120	It just seems to me, like, if you look at the mechanism of a gun,
1152120	1154120	the firing pin goes...
1154120	1155120	It's just like a thing.
1155120	1157120	It just seems like you could fire a bullet
1157120	1159120	by hitting it real hard with a hairpin.
1159120	1160120	Yeah, yeah.
1160120	1163120	Like, wait, if you had pliers and a small hammer,
1163120	1165120	you'd give a gun a go bang.
1165120	1166120	Yeah.
1166120	1167120	Shoot so much.
1167120	1169120	Yeah.
1169120	1172120	You never hear about those shootings.
1172120	1174120	Have you shot your gun yet? Have you taken it to the range?
1174120	1176120	No, no, because I don't have...
1176120	1178120	I want to, like, learn to use it.
1178120	1179120	Yeah.
1179120	1181120	There's a firing range nearby here,
1181120	1184120	and they have, like, a weekend gun safety class,
1184120	1186120	but I don't know, man.
1186120	1187120	I don't...
1187120	1189120	The last place I want to be is, like,
1189120	1196120	a group of weekend intro gun safety class humans.
1196120	1198120	Also, people keep going into gun ranges
1198120	1200120	and killing themselves because you get a gun,
1200120	1201120	and it's free.
1201120	1202120	And it's free. It's cheap.
1202120	1204120	People just keep blowing their heads off.
1204120	1205120	Well, that's fine, though.
1205120	1207120	That's just part of the territory.
1207120	1208120	That's just the price of admission.
1208120	1210120	Yeah, yeah.
1210120	1213120	Sometimes you get, like, a chicken and your egg McMuffin.
1213120	1215120	Yeah.
1217120	1220120	That probably doesn't happen.
1220120	1224120	All right. Anyways, yeah.
1224120	1225120	I want...
1225120	1227120	I mean, I'll bring up our friend now,
1227120	1230120	our new friend that I met at a Netflix screening
1230120	1234120	for this movie that's coming out, Okja.
1234120	1235120	It's...
1235120	1236120	God damn it.
1236120	1241120	It's Bongjoonho.
1241120	1243120	Did I get that name right?
1243120	1246120	Okay. Bong is the first name.
1246120	1249120	There's, like, a thing where the people that refer
1249120	1252120	to working with him on set is, like, a part of Korean culture.
1252120	1254120	You call him Director Bong.
1254120	1256120	That is, like, kind of fun.
1256120	1257120	I don't know.
1257120	1258120	That is fun.
1258120	1260120	I wish we had that.
1260120	1262120	If you're a director or a...
1262120	1265120	You should be called, like, Writer Harmon, like, or Writer Dan.
1265120	1269120	Yeah, I don't know. I'd like it.
1269120	1272120	And then all the fertile women, we can round them up,
1272120	1275120	dress them like nuns.
1275120	1279120	Put in a sizzling red color.
1279120	1282120	Sizzling.
1282120	1286120	Red nuns is hot.
1286120	1287120	They're the handmaids.
1287120	1289120	They're, like, red nuns.
1289120	1291120	But only when they're going to buy oranges.
1291120	1293120	Like, they also have to buy oranges for everybody?
1293120	1294120	Okay, all right.
1294120	1296120	I'll work up my dystopia.
1296120	1298120	It's got third act problems.
1298120	1302120	But anyways, this is a friend of Cody's who was there.
1302120	1304120	That's why we were at the screening.
1304120	1305120	And because I was at the screening,
1305120	1306120	I didn't know anything about the movie.
1306120	1308120	I never saw a trailer.
