start	end	text
3400620	3401180	What do I know.
3401180	3403860	I'm an uneducated 21 year old.
3403860	3405660	I just have a university degree.
3405660	3408420	So I went out into the real world and then I encountered human
3408420	3409780	beings.
3409780	3414220	And I encountered human beings in positions of pretty dramatic
3414220	3416380	levels of decision making.
3416380	3419020	And they were intelligent high IQ.
3419020	3420340	They were well meaning.
3420340	3421380	They wanted to do good things.
3421380	3425940	And they were making awful awful decisions that impacted a
3425940	3427540	lot of people's lives.
3427540	3427820	Right.
3427820	3430700	I saw it in the working world corporate world.
3430700	3432900	People were like making decisions and companies were
3432900	3436220	going out of business and making bone headed moves.
3436220	3437580	Saw it obviously in politics.
3437580	3439580	I saw it everywhere.
3439580	3443060	And it just got worse and worse and worse.
3443060	3449820	And by the way it wasn't even a partisan thing.
3449820	3456380	I can even track when era has gone by when you look fondly
3456380	3460700	back at any government that we had over the past 20 some
3460700	3464780	years and you say well look you had Congress controlled on
3464780	3466540	the right, on the left, et cetera.
3466540	3469540	You never look back and say oh my god boy wasn't that like a
3469540	3471780	look at what the House of Representatives
3471780	3474860	was able to do in 1996 or what did the Senate be able to do
3474860	3476820	in 2002 or 2007.
3476820	3480780	These were generally not well functioning organizations.
3480780	3482380	Right.
3482380	3486260	And they've just gotten progressively worse over time.
3486260	3488540	You are an educational activist.
3488540	3489900	Yeah, absolutely.
3489900	3491540	You're a disruptor.
3491540	3493140	No, we don't.
3493140	3494340	You're an obstructionist.
3494340	3495500	We don't believe in disruption.
3495500	3496740	We want to reform.
3496740	3497700	We want to reform.
3497700	3501340	Yeah, that's super interesting because nobody is standing up
3501340	3504940	for the rest of us in terms of getting educated.
3504940	3507100	And it does seem as though universities have gotten more
3507100	3511980	about can we do business in terms of agriculture?
3511980	3514740	Can we do medicine?
3514740	3517260	Can we do law?
3517260	3518660	Can we do business?
3518660	3519940	They don't do architecture.
3519940	3521140	They don't do dance.
3521140	3522500	They don't do art anymore.
3522500	3525580	They don't do any of the things that really fuel those three
3525580	3527340	things that I listed initially.
3527340	3529940	And again from our perspective, totally right.
3529940	3534540	And the most tragic, they no longer do general education.
3534540	3537860	General education is the most important role
3537860	3540220	of an undergraduate degree.
3540220	3543540	That's why it's called an undergraduate degree.
3543540	3546860	It's supposed to train the mind so that when you then figure out
3546860	3549180	what you want to do, you go to get a graduate degree,
3549180	3551260	or you go into the workforce, or what have you,
3551260	3554380	and then use the general systemic thinking,
3554380	3556340	those general ideas in the world.
3556340	3560060	It goes back to capitalism.
3560060	3562260	Well, that's an easy thing to say.
3562260	3568300	Because it goes back to when I'm 15 years old in 1989
3568300	3572260	in Brown Deer, Wisconsin, it's happening around me.
3572260	3573180	I'm not aware of it yet.
3573180	3575780	But looking back on it, I'm aware that programs
3575780	3577340	are being lifted and pulled.
3577340	3580780	Now, some of them are, well, actually, at that time,
3580780	3582620	all the programs that were being lifted and pulled
3582620	3584460	were like trade programs.
3584460	3587180	My best friend Dave Friedl, who's
3587180	3588700	been on the podcast and stuff, he
3588700	3595020	was a huge beneficiary of the just the program
3595020	3597300	at my high school, where if you were really
3597300	3600940	interested in food service, you could take classes
3600940	3602940	at our high school, and then there was an internship,
3602940	3603620	and there was all these things.
3603620	3606340	And he was like one of the last people through that shoot,
3606340	3610540	and was able to, he's not now Wolfgang Puck.
3610540	3614220	He's now a fucking coder and an assistant, whatever.
3614700	3618100	He's got a digital job.
3618100	3620900	But he was able to not slip through the cracks
3620900	3628340	and fall into fucking hell, because he had a different kind
3628340	3632420	of, he didn't excel on tests or in geometry or whatever,
3632420	3635700	but he was fucking nailing it in these food service classes.
3635700	3638580	And there was programs in every public high school,
3638580	3642860	there would be tendrils going into, oh, you're a dirtball?
3642860	3645940	That's what I affectionately call them.
3645940	3648340	We have a fucking auto shop at our high school,
3648340	3650780	and then also we have paths for you.
3650780	3653900	They are not like in the old world European class system,
3653900	3656260	like, oh, you were born in this tax bracket,
3656260	3657820	so you're going to be a mechanic.
3657820	3660860	It's more like, hey, you can't stop
3660860	3663340	making horrible jokes to the teacher after class,
3663340	3667300	and you don't also care about isosceles triangles.
3667300	3671060	But there are opportunities.
3671660	3674820	There's fingers everywhere for all of our kids
3674820	3677620	that you could end up being a genius,
3677620	3680180	proving that you were a genius in something that wasn't
3680180	3683260	necessarily testing well in this or that area.
3683260	3686900	That's what was happening when I was 15,
3686900	3687980	going on all around me.
3687980	3690140	Then the follow up to that is really
3690140	3692980	that they started caving in on the other side.
3692980	3695380	The school papers started shutting down.
3695380	3699380	The first time after I went to visit my school paper editor,
3699380	3700740	he's like, no, no more school paper.
3701060	3705060	One of the last ones, we don't train kids
3705060	3706420	to be creative anymore.
3706420	3708300	We train them to pass English tests.
3708300	3710060	Now, the obvious answer to all of this,
3710060	3711820	and we've all watched everyone in my audience
3711820	3713180	probably seen these documentaries,
3713180	3717140	it's because of the government agencies,
3717140	3721660	who are, I guess, accountable to their voters,
3721660	3723780	then they'd say to the school districts,
3723780	3727540	oh, you have to make your kids smarter.
3727540	3729580	They're terrible people now.
3729620	3731620	They're rapists and murderers and carjackers.
3731620	3732740	Make them smarter.
3732740	3734980	And then the schools go, OK, we're going to,
3734980	3736900	and then this weird thing happens
3736900	3739300	where the tests become, everyone's just
3739300	3740700	being trained to pass tests.
3740700	3743780	Otherwise, the schools lose their funding and all this stuff.
3743780	3748100	Then meanwhile, on the 1% side, all of these campuses,
3748100	3751700	who used to be the places where fuck society,
3751700	3754420	fuck your parents even, yeah, they paid for tuition,
3754420	3756740	but they paid tuition because, you know what,
3756740	3759180	this is a burgeoning industry, this idea of shaping
3759180	3761460	your young adult mind.
3761460	3763420	Your parents are going to pay $50,000,
3763420	3766140	and they're going to get a hippie spit out of this shoot,
3766140	3768460	and they're going to be like, what the fuck did I pay for?
3768460	3770460	And we're going to be like, a genius.
3770460	3772260	And there was leeway there.
3772260	3776740	But then from all sides, you've been telling me about this.
3776740	3779860	There was this shift in the 80s, 90s,
3779860	3783220	where it was basically, in general,
3783220	3787180	financial institutions started hanging out
3787180	3790780	at the bars where government hung out at,
3790780	3793620	and started going, hey, you want a pack of cigarettes?
3793620	3794900	Follow me to my van.
3794900	3799380	And then all government became slowly metastasized
3799380	3801620	this entire thing.
3801620	3807460	The separation of government and business just disappeared.
3807460	3809660	And now government has just taken it up the butt
3809660	3813820	not using that derogatorily because they're enjoying it.
3813820	3816540	And they have a right to do it.
3817500	3818780	We need new colloquialism.
3818780	3819860	Right, it turns out we need it.
3819860	3820660	Yeah, it's fine.
3820660	3823340	We need new ways of stating.
3823340	3825740	We need a new word for pussy, and we need to do it.
3825740	3826580	I've been thinking that.
3826580	3827900	You can't be David Mamet anymore.
3827900	3828940	You can't just say, you know what?
3828940	3832540	You're going to swallow my cum, you fucking faggot pussy.
3832540	3834020	You need all curse words.
3834020	3837980	You might have an important point about dynamics.
3837980	3840140	But yeah, so obviously.
3840140	3841860	I don't know if this was a nefarious plan,
3841860	3844260	but it certainly evolved this way.
3844260	3845700	And again, I think it's a lot because
3845700	3847460	of unintended consequences.
3847460	3852340	So give me an example of why, at least from my perspective,
3852340	3853740	a lot of these things changed.
3853740	3856220	In the early 1980s, US News and World Report
3856220	3859420	came out with a ranking of colleges.
3859420	3862980	And I would argue that that event actually
3862980	3866700	accelerated all of these previous inclinations
3866700	3868740	that the institutions had, but never really acted upon
3868740	3871260	because it was never really in their interest.
3871260	3873740	All of a sudden, they had their in their interest
3873780	3876820	to do stupid things like restrict the number of students
3876820	3879420	and come to the university because they wanted to have
3879420	3882020	low acceptance rates and then have a lot of professors
3882020	3883020	for every student.
3883020	3884260	But you didn't actually want the professor
3884260	3885380	to teach the students.
3885380	3886980	You want them to be in the lab doing research.
3886980	3889540	And then you want to spend as much money as possible
3889540	3892500	on that professor to do research so that you would go up
3892500	3893340	in the rankings.
3893340	3895220	And if you did that, guess what?
3895220	3897420	You need a lot of rich kids to support
3897420	3900260	this constricted number of seats.
3900260	3901860	And the reverse would be a party school.
3901980	3904180	You would show pictures of the football team.
3904180	3905780	You'd show pictures of great fans
3905780	3907740	and people spring breaking it up.
3907740	3909100	Exactly.
3909100	3910660	And what both of those have in common
3910660	3912580	and what all of that has in common with meanwhile
3912580	3915580	in the inner cities, kids being pushed through
3915580	3918900	that can pass tests, all of that goes back
3918900	3923900	to the hydra of capitalism, which isn't a bad thing unless,
3923980	3926140	but well, maybe it is a bad thing.
3926140	3930380	Well, it's bad because what happens in the outcome
3930380	3933460	is that if the school is kind of where it comes back,
3933460	3935260	the banks and everybody else,
3935260	3938340	those institutions want to hire ultimately
3938340	3942140	and wind up hiring the sons and daughters of rich people.
3942140	3947140	If you trusted the US dollar to measure everything,
3948180	3952220	if you trust it to give equivalence,
3952220	3953500	everything is going to have a price.
3953500	3954820	Human life is going to have a price.
3954820	3957540	Like we know this, it's right under our nose.
3957540	3961140	We know that medicine doesn't work privately.
3961140	3963540	We know that education is not working privately.
3963540	3964540	We know that like-
3964540	3968860	Well, but it can if you had people think systemically, right?
3968860	3970780	So if the government rather than saying,
3970780	3972740	we're just going to subsidize universities
3972740	3975060	and keep a blind eye.
3975060	3978900	If in 1965, when federal financial aid got implemented
3978900	3982300	and all they said would be any university
3982300	3984260	is also referred to financial aid,
3984260	3986700	if and only if the cost to attend that university
3986700	3989140	rise at the rate of inflation or lower.
3989140	3990180	If they just did that,
3990180	3992860	you know how much every university would cost now?
3992860	3995540	What we cost, what we cost intuition and fees.
3995540	3996460	I wasn't listening to that
3996460	3997620	because I was thinking about,
3997620	3999820	because I've been trying to bring up our second guest
3999820	4003500	because I want to plug this key master into this gatekeeper.
4003500	4004660	I don't know if you guys are going to fight
4004660	4007820	or blow up New York,
4007820	4010900	but let's bring up our old friend, Josh Androsky.
4010900	4022260	Oh, yeah, looking fresh.
4022260	4023500	Hi, hello.
4023500	4026060	So socialists are dressing differently now
4026060	4026900	since the last time we talked.
4026900	4030340	Yeah, I figured I wouldn't wear a flannel.
4030340	4033140	And I'm instead wearing a Shannon and the clam shirt
4033140	4034660	with two barks kissing.
4034660	4036540	That white jacket though is dope.
4036540	4037660	Thank you.
4037660	4038900	It's luxury socialist.
4038900	4041060	Have you been taking any of this stuff in, Josh?
4041060	4041900	Yes.
4043220	4048220	So I'm a little, I'm conflicted personally with my ideology.
4048300	4053260	I agree that I think schools should be public institutions.
4053260	4057580	I think that as a society, we should value education
4057580	4059940	and we should put people in our government
4059940	4062300	that value education and again,
4062300	4065380	the tendrils of capitalism have infected education,
4065380	4067740	healthcare, blah, blah, blah, all that shit.
4067740	4072740	But I am also very intrigued at you destroying Harvard.
4073420	4075100	Reforming, reforming, we want to reform.
4075100	4077180	I'm an accelerationist.
4077180	4079620	I think that Harvard is the ISIS of comedy.
4080500	4083420	And I think that they deserve to go down.
4083420	4084300	That is hilarious.
4084300	4085140	The best.
4085140	4085980	The ISIS of comedy.
4085980	4087460	Yes, I mean, just look at SNL.
4090940	4092780	For those who don't know, there's a huge rivalry
4092780	4095900	in the comedy community between Harvard and working guys.
4096060	4098780	They fucking actually tell jokes and love it.
4098780	4100300	Yeah, it's crazy.
4100300	4103140	But it's the exact thing where it's like,
4103140	4105380	you get into Harvard because you have the same last name
4105380	4107620	as someone who got into Harvard and then, oh my God,
4107620	4109020	look at you, you're writing on the show
4109020	4111300	that used to be good and is now bad.
4111300	4113620	It's so weird that there's more Harvard people.
4114580	4116780	The best Harvard alum is the Unabomber.
4116780	4117620	Anyway.
4119060	4121060	As a word for the other, I don't know,
4121060	4123260	as a showrunner who has therefore accidentally
4123260	4124660	hired Ivy League guys.
4126820	4127980	I'm looking back now.
4127980	4131260	Actually, since the election is in the room,
4131260	4133820	I used to mock all my Ivy League guys
4133820	4135020	because I have class issues.
4135020	4137980	Because I'm like, they teach you that at Harvard.
4137980	4138980	They teach you that.
4138980	4141340	But like, they don't teach them anything there.
4141340	4143620	There is some kind of co-relation.
4143620	4146020	It's probably not cause effect, but there's a co-relation.
4146020	4147700	Yeah, they keep the lights on.
4147700	4149420	I mean, you've got to have people who actually show up
4149420	4151980	to work, and that's the Harvard guys.
4152060	4154940	Comedy writing requires a support system.
4154940	4158140	So if you're from the streets and you
4158140	4163540	want to be a comedy writer, you're
4163540	4168340	at this huge disadvantage, which at the same time means that,
4168340	4171300	OK, so if you want the veal cutlets,
4171300	4173820	go with the people that had the support system.
4173820	4176980	Because if at 13, if you were Harvard bound
4176980	4179820	and you decided you wanted to be a Harvard writer,
4179820	4181500	you can then split that assembly line
4181500	4183140	into hacks and geniuses.
4183140	4186980	And so there are people that come out of the Ivy League
4186980	4189860	that knew that they wanted to quit there knowing,
4189860	4191780	I don't want to be a comedy writer,
4191780	4193780	and I've worked with these guys.
4193780	4197340	And yeah, it's like, it's whatever.
4197340	4200580	I didn't mean to piss on your fun parade and go like, well,
4200580	4201780	not everybody's everything.
4201780	4204540	Hashtag not all Harvards.
4204540	4205700	And it is a fun rivalry.
4205700	4206620	You're exactly right.
4206620	4207580	It's not a real rivalry.
4207580	4208100	No.
4208100	4210820	Because if it was, they would destroy us.
4210820	4213260	They're so rich.
4213260	4216340	If you could get a drone, it'd be over.
4216340	4217140	But yeah.
4217140	4218780	Shots rang out.
4218780	4221700	Why isn't education, so if we tomorrow,
4221700	4227580	if we created a utopian base on the moon and we said, OK,
4227580	4230740	nobody up here would privatize any aspect of education,
4230740	4231980	would we ever?
4231980	4233580	Well, what do you mean by privatize?
4233580	4235280	Well, I mean, charge money for it.
4235280	4236180	But I think I know how.
4236180	4237020	Absolutely.
4237060	4238060	Specialization.
4238060	4239260	I'll tell you why.
4239260	4243340	Nonprofit private universities are still private.
4243340	4244780	I mean, Berkeley is public.
4244780	4245860	Harvard is private.
4245860	4247700	Stanford is private.
4247700	4249060	SUNY is public.
4249060	4253540	Now, I'm actually opposed to the idea of free college.
4253540	4254820	And I'll tell you why.
4254820	4258620	Because it's a regressive policy.
4258620	4260740	Think about it.
4260740	4263980	So if you think about college, like, let's just say,
4263980	4266300	not higher education, but just college.
4266380	4268260	Like, Louis Louis is playing, and people
4268260	4269580	are chugging beers college.
4269580	4271380	Yes, that college, right?
4271380	4273420	Who goes to college?
4273420	4275180	Rich people.
4275180	4278620	So rich people and people who are eventually
4278620	4281940	going to be relatively wealthy.
4281940	4284180	Who is the tax base of this country?
4284180	4285660	100% of Americans.
4285660	4289380	One way, shape, or form, you pay in taxes
4289380	4290740	into this government.
4290740	4295660	And so if you say, I'm going to take 100% of people's money
4295660	4300380	and effectively give it to rich people who don't need it,
4300380	4303700	and people who will be rich, maybe some of them
4303700	4304620	do need a leg up.
4304620	4306460	But eventually, we'll be able to actually make that.
4306460	4308460	I think you're just starting the numbers crazy.
4308460	4311740	Like, there's way less rich people than poor people.
4311740	4313620	Or there's fewer rich people than there
4313620	4315780	are people that could use college for free.
4315780	4316620	Oh, yeah, for sure.
4316620	4320100	But the problem is that rich people are overwhelmingly
4320100	4322460	going to college, whereas poor people from abortion do not.
4322460	4323700	Because they can't afford it.
4323700	4326140	And if they could, then they would overwhelmingly go to college.
4326140	4328540	Even if they can't afford it, the problem goes much earlier.
4328540	4330500	Well, I think that's why I want to dis-
4330500	4335700	I simplified it by saying, if we were on the moon, if all we had
4335700	4342140	was some disaster, all we have is a couple cans of air
4342140	4343980	and some tents and some shit.
4343980	4345540	We got 100 people.
4345540	4349060	And we're designing a society now.
4349060	4353100	So we want to pick which parts of our society
4353100	4359220	are driven by the moon dollar, if anything is going to be,
4359220	4363300	if there is going to be a moon dollar, I should say.
4363300	4364580	That's what I meant.
4364580	4367540	If we're starting from scratch, because it sounds like more like,
4367540	4368700	you're being more pragmatic.
4368700	4369980	I'm going to burn from pragmatic.
4369980	4371820	You're saying, oh, if you change this light bulb
4371820	4375300	and plug in this Christmas ornament, I'm still going to burn.
4375300	4379180	I think ideologically, it's like, why would education ever
4379180	4380980	be purchasable?
4380980	4388460	Why would any child, whether they're
4388460	4391620	1 years old, 25 years old, 48 years old,
4391620	4398580	why would any student that wants to learn anything,
4398580	4402260	why does it benefit your society if the moon is
4402260	4404500	going to go to war with Mars and the moon
4404500	4408540	has decided to charge money for education and Mars hasn't?
4408540	4410620	I feel like Mars is going to win.
4411220	4412660	Now, we have a different problem here,
4412660	4414980	because we can also say, oh, legalize everything.
4414980	4418420	But if we legalize all drugs tomorrow here in our situation,
4418420	4420420	we're going to have blood on our hands.
4420420	4421820	Except what's illegal?
4421820	4424020	What drugs are illegal?
4424020	4426020	Well, I'm just saying there's a difference
4426020	4427520	between having these conversations
4427520	4430180	when there's an existing infrastructure.
4430180	4431420	How do we move?
4431420	4433220	There are no silver bullets.
4433220	4434660	Within the existing infrastructure,
4434660	4438820	I still think that you're being a little tricky with numbers
4438820	4440380	and with statistics, because you
4440380	4445780	say that poor people, regardless of how affordable college is,
4445780	4447980	wouldn't go.
4447980	4450740	No, no, I'm all for the why is it regressive?
4450740	4456060	It's regressive, because if you can afford $70,000 a year,
4456060	4459660	and somebody says, let that person go for free on the
4459660	4461620	taxpayer's dollar, that's insane.
4461620	4463220	I'm totally fine.
4463220	4464460	I think that's insane.
4464460	4467300	Giving the six rich people the money
4467300	4470780	if the 94 out of the 100 also hit it.
4470780	4472300	We don't know what social class is
4472300	4474860	going to yield the doctor that produces the cure for cancer.
4474860	4476780	But they're going to college anyway.
4476780	4478980	No, they don't need.
4478980	4480500	A bunch of them are going to jail.
4480500	4485900	No, the kids that can afford it, mommy and daddy
4485900	4487220	are writing that check.
4487220	4488820	Right, but the kids who can't afford it
4488820	4491500	might be the ones to cure the disease that we don't even
4491500	4492660	know we're going to get yet.
4492660	4494700	So we need to focus on them.
4494700	4498020	But why would you not means test access to college?
4498020	4498980	It doesn't make any sense.
4498980	4500460	If you have the means test.
4500460	4504020	Means test is interesting, but denying access
4504020	4505500	will never yield the result.
4505500	4506020	No, no, no.
4506020	4506740	That's all I'm saying.
4506740	4509300	The opposite is what got us into this problem
4509300	4511140	in the first place, where if you look
4511140	4514340	throughout the history of America, sweeping programs.
4514340	4517940	For example, you look at the golden age of comedy, right?
4517940	4521180	The golden age of comedy, you had all these public works,
4521180	4523700	theaters, and places where people could do music.
4523740	4526940	And all of these things were funded by a class
4526940	4528580	traitor in the White House, right?
4528580	4531820	And so without that, these broke Jew immigrants
4531820	4535620	that I come from wouldn't be able to go learn
4535620	4538140	to play the trombone and then become Sid Caesar.
4538140	4541420	And so if it was means tested, it would be like,
4541420	4545300	if you make $14,999, you get to go to college.
4545300	4548300	If you make $15,001, you don't get to go to college.
4548300	4550180	Well, it's just a badly designed program, right?
4550180	4553580	I mean, but I think it goes beyond that, where the idea.
4554100	4555220	And for those that don't understand,
4555220	4558860	the idea of means testing is to put a sort of line
4558860	4561620	in the sand, where you go, if you're more poor than this,
4561620	4563900	you get this, if you're not, you don't.
4563900	4568220	And certainly, there will be absolutely people
4568220	4570820	that are rich or who don't need the program
4570820	4572820	who will benefit from it.
4572820	4576660	But if you look, I mean, realistically, at the numbers,
4576660	4579020	there's far more people who deserve something
4579020	4579860	that will be getting it.
4579860	4581620	That's why I believe that healthcare
4581620	4586460	should be totally free and public and public universities.
4586460	4588660	And I actually do think that there is a place
4588660	4591460	for private universities, for-profit private universities
4591460	4593660	within the system, optionally.
4593660	4596580	Because I don't believe in like a Stalin thing.
4596580	4599860	To me, educational, I guess, privatization
4599860	4603540	would be analogous with elective surgery.
4603540	4606340	I want to look like Mel Brooks.
4606340	4607540	But then don't you keep forgetting the advantage?
4607540	4609060	Then, okay, then you have to pay for that.
4609060	4609900	The government doesn't pay for that.
