start	end	text
0	7520	Ladies and gentlemen, put your digital hands together.
7520	8520	So awful.
8520	12120	Ladies and gentlemen, the Humid Town is now in session.
12120	14880	Please welcome to the stage Spencer Crittenden.
14880	17600	Oh, you can make more noise than that.
17600	18600	Yeah.
18600	19600	Thank you so much.
19600	21680	He's worked so hard for you.
21680	22680	How are you, man?
22680	23680	Welcome back.
23680	24680	Good to see you always.
24680	25680	Always good, comfortable to see.
25880	29080	Always good, comfortable to see.
29080	31640	Puts me at ease, we're ready to have a good show.
31640	33600	I know, full show, good show tonight.
33600	37280	With Jeff, it's like, what is he about to pull, you know?
37280	38680	I'm too dumb to be evil.
38680	43040	No, no, you just are, you're on the side of good.
43040	45800	I'm coming out as saying Jeff is not.
45800	48400	It's about time somebody really fucking pulled Jeff's strings.
48400	48900	Yeah.
48900	50920	Because not a good dude.
50920	53000	I do know a really good dude, though.
53000	56640	And he is the mayor of Harmon Town.
56640	59160	Put your hands together, make some noise, slap your dog.
59160	61040	Ladies and gentlemen, Dan Harmon.
61040	63680	Don't slap your dog.
63680	71040	Yo, yo, yo, me, rap, beat, rap, rapping, rap to the beat.
71040	73080	My name is MC Rap Beat.
73080	75560	I like to rap to the beat when I rap in the street.
75560	78040	I like to rap with my hands and also my feet.
78040	81280	I like to rap with a Tweety Bird, tweet, tweet, tweet.
81360	83760	I like the snow and the sleet.
83760	87080	Don't let it stop me, because I'm mailing this sheet to you.
87080	90760	Through a rap shoe that I put on my foot when I bring it to you.
90760	93400	I'm a Mr. MC rapping a lot.
93400	94800	I changed my name.
94800	96160	My name's MC Snot.
96160	99000	My name's MC Glaps a lot.
99000	101000	My name is Polka Dot.
101000	103640	I'm a rapping, rapping, rapping, roo.
103640	106600	I'm getting my energy up before the shoe starts.
106600	107440	OK, all right, good.
107440	107940	Here we go.
107940	109640	Yeah.
109640	112320	Oh, boy.
112320	114760	It's important to have me off guard, flat footed.
114760	116040	Yeah.
116040	116560	Hi, Brandon.
116560	118440	Thanks for guest-controlling, Brandon Johnson.
118440	119440	I'm so happy to be here.
119440	120960	I'm so sorry, Jeff Davis is gone.
120960	122240	Where is he?
122240	122840	I don't know.
122840	124680	He's going to India.
124680	125200	Never mind.
125200	126080	I don't know if he's there yet.
126080	127360	Yeah, I don't think he's there yet.
127360	127880	Too bowler.
127880	129560	Too bowler, man.
129560	130480	Here's the never mind.
130480	132160	He's flying Emirates.
132160	133320	Yeah, never mind.
133320	134720	That dude.
134720	138920	He said he has a petting zoo in his section of the plane.
138920	140480	But I bet it's like two turtles.
140480	142800	Yeah, his life is like what my life would be like
142800	143880	if my parents had loved me.
146520	148120	I don't know if that's how he got there.
150920	153280	Maybe like the indirect result of Drew Carey's parents
153280	156080	really not loving him a lot, and it trickled down.
156080	156600	Who knows?
156600	159560	We have no idea who to thank.
159560	163800	Let's just thank the god of privilege, privilege.
163800	164480	That's the name.
164480	165000	Yeah.
170000	171920	Whatever.
171920	173040	How have you been?
173040	174000	I never ask about you.
174000	174720	I've been good.
174720	175320	I've been good.
175320	176320	There's not much to tell.
176320	177720	You know, seven dry cleaners.
177720	179320	I keep everything legit.
179320	181760	You know, my maid won't seem to do her work.
181760	185040	But other than that, life is good.
185040	187200	If those are the only jigsaw pieces you have of Brandon's
187200	190120	life, you now, like, that could be anything.
190120	192480	Seven dry cleaners, a maid that won't.
192480	194720	We don't know if he's in a giant mansion
194720	198040	or a tiny, like, William Gibson techno coffin.
198040	200080	Pretty sure it's a deluxe apartment in the sky.
200080	201880	Yeah.
201880	202920	Moving on up.
202920	205440	What was the thing in the Jefferson's theme?
205440	208240	It was that beans don't burn in the kitchen.
208240	208840	That's right.
208840	211640	And what doesn't burn on a grill?
211640	214720	I think it's something else doesn't burn on a grill.
214720	216680	Something else doesn't burn on a grill.
216680	217560	I have to get the whole thing in my bag.
217560	218920	Are you offended that I'm coming to you
218920	220000	for the answer to this?
220000	221320	No, it's a mystery to all people.
221320	222120	Right.
223080	225960	I'm asking Brandon as a representative of the 70s,
225960	227640	not anything else.
227640	230040	This is going to be, I feel so bad because so many people
230040	233800	on Reddit are going to be like, oh, what's this?
233800	234880	I need that, though.
234880	236320	They need that more than we do.
236320	239120	I think they might be calming down now, though.
239120	239840	I don't know.
239840	241240	Nah.
241240	242960	It's funny how we have moods, and our moods
242960	244280	affect our perception of the world.
244280	246800	Like, right now, I feel like the world is more
246800	247840	comfortable with racism.
247840	249400	Where did I get that?
249400	250520	Why did I decide that?
250520	251240	What did I?
252200	254240	The answer is it's something I ate.
254240	255240	It's not something I saw.
255240	257040	I didn't see somebody come out with a report on Reddit
257040	258960	that said, we're going to be less sensitive now.
258960	260800	I think it was because of an epiphany I had.
260800	263680	I was eating breakfast with my girlfriend and her dad.
263680	267480	And I don't know what got my mind onto it,
267480	269520	but then I just started realizing this.
269520	272680	The thing about epiphanies about how you really,
272680	275280	I don't know, the good ones are just like, duh-duh-ys.
275280	275800	They're not.
275800	277720	When you explain them, they're like, yeah,
277720	280680	I had that epiphany when I was 13.
281120	283160	And I've had this one, I feel, several times.
283160	285880	But there's a difference between that and feeling it.
285880	288840	I really started to feel at breakfast,
288840	291360	because I pulled out my phone, and I wrote it down.
291360	294920	I was like, hashtag epiphany in my Bear Notes app.
294920	298920	I got to remember this epiphany, which was just that.
298920	301160	Wait, what's Bear Notes app?
301160	303440	It's my latest app I'm trying.
303440	304280	Sorry, continue.
304280	308240	Bear, if you look it up in the app store, it's based on tags.
308560	311400	Tag clouds instead of, it's weird.
311400	313520	It's weird at first, but if you get used to it,
313520	315080	it could be good, I don't know.
315080	316400	Why did I key on that?
316400	317240	I don't know.
318800	320040	Here's my epiphany.
320040	324920	So if you're a machine, or let's say an organism,
324920	325760	it really doesn't matter.
325760	327120	Organisms are machines.
330880	333760	You're a structure, you have internal mechanisms.
333760	337680	You are capable, you take things in, and you put things out.
338680	342680	And so flowers do that, whales do that, the Earth does that,
342680	344680	every system does that, every device does that.
344680	348480	So we're all just systems, each of us individually.
348480	352960	So we take in good shit, we take in bad shit.
352960	356680	And we're all different, so there's different shit
356680	358960	that's bad to every person.
358960	362920	If somebody says the N word on the freeway at me,
362920	365160	it makes me confused.
365160	367080	It means something different to you.
367400	369880	It's both bad things coming out of that person.
369880	374880	But I go, there's a lot of weird confusion
375640	377240	at the top of that, my process,
377240	379400	because I'm like, is there lighting weird in my car?
379400	382480	What's with this person, are they blind?
382480	386880	I don't know, are they on my side, and are they black?
386880	390640	And they're like high-fiving me for my awesome driving.
390640	395640	So the definition of what a bad thing is, is subjective.
399160	403440	It's not about like, oh, some people are in such a good mood
403440	405960	that like, I don't know, I listen to podcasts
405960	408120	where there's people that, they have problems
408120	410240	and there's people that wanna help them with their problems.
410240	413960	So for those people, you and I would consider toxic,
413960	417080	that person considers an episode of a podcast.
417080	419760	So not to get too derailed with that,
420080	423640	the larger point being, you have all this shit
423640	428200	that comes at you, and it's all good and bad mixed up shit.
428200	431200	And then we all have the ability as systems
431200	433920	to first of all, we're constantly growing
433920	437280	and reprogramming ourselves, restructuring ourselves,
437280	441120	just as cells and plants and factories and us.
441120	444520	And this stuff comes in.
444520	447160	So we first of all, the miracles that we do have
447200	451400	the ability to take in like diarrhea, like not literally,
451400	455680	but like verbal diarrhea, such as I'm spouting right now,
455680	458320	or really horrible toxic, like horrible shit,
458320	461560	like what you see on Facebook or Twitter or toxicity
461560	463360	or someone attacking you in a comment section
463360	468360	because you said something wrong or bad shit.
468600	473600	We have the ability to turn it into good shit.
473600	476600	The classic example being that if I have a terrible life,
476600	480600	if everybody picks on me, if I feel awful,
480600	483200	if I have feelings of anxiety and depression and things
483200	485240	because of the shit that's happening to me in my life,
485240	487000	but then I write a play about it,
487000	489040	and then everyone goes and sees the play
489040	491880	and walks out feeling really good,
491880	493640	not because it's a feel good play,
493640	495560	but because they saw a good play,
495560	498160	like there's catharsis, like you can see a depressing play
498160	500000	and be like, wow, he fucking nailed it.
500000	501440	He knows exactly how depressed I am.
502440	504240	And then some of your question comes up,
504240	506960	the bottom line being like, as we all know,
506960	509240	you can take in bad stuff and you can put out good stuff.
509240	512800	And in fact, that's kind of what we try to do all the time.
512800	517800	So like, now that times have gotten for most of us
518120	522080	very challenging, there's a lot of shit in the air.
522080	524120	There's a lot of bad stuff coming at us.
524120	526560	It's just sort of sitting at breakfast
526560	529080	and just thinking about all these podcasts
529080	530640	I've been listening to where people do,
531520	532960	I don't know, there's shit that rolls off their back
532960	534320	that I find amazing.
534320	535640	It's like, how come you don't just tell that person
535640	536640	to go fuck themselves?
537840	540480	Why are you trying to still understand this person
540480	543040	and help them with their in-laws for your little podcast?
543040	546080	It's not just greed, it's like you're Canadian or something.
546080	547640	I don't know what it is.
547640	550880	I guess I should promote the podcast I'm describing.
550880	555880	It's on the Gimlet network, it's called Heavyweight.
556920	559800	It's this guy, John, something.
559880	563520	And he just makes his friends and family's business
563520	565600	all his business and he's like a really friendly guy
565600	570600	and he tries to resolve long unresolved issues,
571280	572880	family members that aren't speaking to each other
572880	573920	for decades.
573920	575160	Are they on the show?
575160	577960	Yeah, the person, a friend or a relative
577960	580000	or someone that he knows will come to him
580000	582080	with something that's been weighing on them.
582080	583360	I think that's why it's called Heavyweight
583360	586040	and then he'll just get up all in their shit
586040	588520	and make phone calls and arrange meetings.
589320	591720	I was just kind of marveling at the guys.
591720	593840	Because there's people that attack him,
593840	595440	there's people that criticize him,
595440	598200	there's people that are engaged in
598200	601280	vampiric toxicity towards him or shit.
601280	603880	His famous episode is the one where a friend of his
603880	608880	who is a guy who gave Moby all of those black people LPs
611000	615680	that Moby used to launch us to become a billionaire.
615680	620080	Like, oh, I don't know, I got a fish bone on my plate.
620080	625080	And then Moby, the guy that gave that disc set to him
627480	631960	or whatever is also a musician, but he's not Moby
631960	633840	and he's not active.
633840	636040	So there's a whole episode about him wanting to
636040	640160	just basically talk to Moby again and kind of like,
640160	641840	it was weird and it was awkward and
642680	647680	like, this guy that gets involved in this shit,
648280	652960	he actively gallops into shit that I would be like,
652960	654800	no, fuck that, nope, nope, nope, yeah.
656560	658720	And so I was sitting at breakfast kind of digesting,
658720	660760	having binge listened to this guy's podcast
660760	662840	and I'm just like, I am a bad person,
662840	667640	like I should be after all I have gotten after all.
667640	670480	It's like, why am I so sensitive?
670480	672280	If this guy isn't.
672280	676240	And I was like, wait, well, sensitivity, he's sensitive too.
676240	679600	And I was like, ah, sensitivity is different
679600	682120	from fucking systemic shutdown.
682120	687120	Like, you can be sensitive to garbage.
687480	689800	Like, you can be like, that guy's lying,
689800	692080	that guy's racist, that guy's full of shit,
692080	693400	that guy's kind of full of shit,
693400	695600	but trying to convince himself he's not full of shit.
695600	699320	So like, you can have a really laser resolution
699320	700960	of bullshit detection,
700960	702920	and that person wants something from me,
702920	705600	that person's a drag, that person's an energy drain.
707200	708960	But you don't need to,
708960	711880	it's not a superior machine that recognizes that shit
711880	715240	and then in response to anything less than perfect goes,
715240	719520	pew, and that's kind of what we're doing
719520	722280	probably a little too much of is going like,
722280	727280	oh no, no, no, you just said that and nope, pew, pew,
728240	730760	that either like makes me blow a whistle
730760	734600	that like shrieks at the top, a thousand decibels.
734600	739600	Is that, if that's your function, that's good.
740160	742200	Like, you should stay that sensitive
742200	744400	and you should then be the alarm person.
744400	749200	It's like, but if you're not that person,
749200	750500	if that's not your full function,
750500	753640	if you're not like helping things by blowing that alarm,
753640	755680	or if it's not making you personally happy too,
755680	757080	like there's other shit you could do
757080	759040	with all that stuff coming into you too.
759040	759880	I don't know.
759880	762160	There's this thing, the Jerusalem,
762160	764120	the Trump announcement that he's gonna.
764120	768120	See, he took a bad thing and he made a wonderful, go on.
769240	771280	Where he announced that he's gonna move the US Embassy
771280	773940	to Jerusalem and make a big hubbub
773940	777320	and the world has freaked out about it,
777320	779040	this is to your point,
779040	781520	but the truth is it takes years for that to occur.
781520	783680	He has to get funding, architects have to drop plans,
783680	785340	but people are acting like he's gonna do this
785340	788700	within the next week and that's sort of how we've gotten.
788700	790900	We've gotten to this place where he says something,
790900	792500	somebody says something, we hear something
792500	794500	and we automatically freak out,
794500	796760	not really looking back and being like,
796760	800540	well, no Girl Scout is gonna join the Boy Scouts.
800540	802740	The Boy Scouts just said girls could join.
802740	803580	Right.
803580	807500	And it's because we started off the year so hypersensitive,
807500	809880	which is a reaction to any trauma,
809880	812060	that now when we hear it's raining,
812060	813340	we legitimately are like,
813340	814740	well, it's probably gonna be one of those rains.
815420	816380	So you're exactly right.
816380	818620	I think to our credit, if we are the left,
818620	821700	like I think, I don't think we're actually,
821700	823340	I think a lot of that is like,
823340	828340	we're just so like frustrated waiting for a referee
829020	832080	to blow a whistle that we're just like our boos
832080	836580	are getting louder and we're just incredulous
836580	839260	and we just want at any moment,
839260	840940	we're like, well, maybe this is the thing
840940	843020	because this is like Holy Land,
843020	844940	this is none of his business.
844940	847020	Like I remember in the beginning,
847020	848460	there was a whole buffet set out there.
848460	850660	I would like sit there on Twitter and write these threads
850660	854540	because I was trying to like make my religious relatives
854540	856420	or people that were Christian,
856420	858420	I was trying to go like he would do,
858420	860500	when he missed that prayer breakfast or whatever.
860500	862060	Remember when that was a big deal?
862060	864420	And I was like, aha, so he missed a prayer breakfast.
864420	866820	Now I ask you this, is this man a Christian?
869020	871580	I was really, it was just like all we've been doing
871580	874740	ever since is like, we're just trying to find his off switch.
874740	877020	Now, our trying to find his off switch
877020	878980	is like really making us flail a lot
878980	882220	and I think we should continue to try to find his off switch
882220	884340	but I think we should explore more sides of him
884340	886540	than obviously the front facing side
886540	888540	because I don't think Donald Trump puts his front off switch
888540	889860	on his front facing side.
892220	894860	But more importantly, I mean,
894860	896660	going back to my mechanism metaphor,
896660	900160	clearly this is a man running on our tears.
900160	905160	I mean like we are putting out like terror and sadness
905320	910320	and outrage and it is fueling him.
911400	915280	And that's fine, that doesn't mean stop being outraged,
915280	917040	stop crying, that doesn't mean go numb.
917040	919800	It just means we know that he's already playing
919800	920920	the game I'm describing.
920920	925280	He's a long time ago either by virtue of sociopathology
925280	927560	or some epiphany of his own he had.
927560	930280	He was like, well, why should I keep on,
930280	933720	what am I supposed to shut down every time my mom
933720	935320	yells at me, am I supposed to shut down
935320	937600	every time my dad punches my mom in front of me
937600	939280	and looks at me and says, if you cry
939280	940600	then you're a woman like her.
940600	942200	You know, I'm just speculating what kind of childhood
942200	944200	he probably had given his current pathology.
944200	946200	I took a little bit of psych in high school.
947640	948800	I think something-
948800	950600	College prep?
950600	951440	What's that?
951440	953000	College prep psychology?
953000	955480	Yeah, I think it was worth a college credit possibly.
955480	956320	Yeah.
956640	959880	I mean, this is Milwaukee public schools, I don't think that,
959880	961520	or no, it's Brown Deer.
961520	963280	All right, look, don't write letters.
964280	966120	I'm not a fraud, look into my transcript.
966120	968080	No, you had a class in high school.
968080	969080	I took a psych class.
969080	970880	Yeah, in high school.
970880	972400	I believe it was probably worth a college credit.
972400	973240	I was just-
973240	974080	No.
974080	974920	Okay, it probably wasn't.
974920	977440	Okay, they showed us many, many slideshows
977440	980040	about things like Gestalt.
980040	980880	Right.
984000	986120	I took that class too.
987000	990520	Anyways, this guy, either because he's a monster
990520	992640	or because he's not even gonna say the words,
992640	997640	I guess I am, that he's like more evolved.
999640	1001080	In that respect that he's like,
1001080	1002880	well, what are you supposed to do?
1002880	1004920	Are you supposed to like shut down
1004920	1007080	when someone says you're a racist douchebag?
1007080	1008880	Are you supposed to take that information in
1008880	1010480	and through an elaborate system of mirror,
1010480	1013640	turn it into fucking Trump food and eat it?
1013640	1014640	And that's what he's done.
1014640	1017520	He's like, yes, I'm hearing I'm racist again.
1017520	1020040	I call that a victory.
1020040	1022000	He's generating victory for himself.
1022000	1023240	I don't wanna comment.
1023240	1024920	I don't wanna be his life coach.
1024920	1028880	But we are, most of us aren't dealing with him personally
1028880	1029760	on a day-to-day basis.
1029760	1031720	And what we are dealing with is like mostly for better
1031720	1034160	or for worse, we're dealing with people digitally.
1034160	1037520	And so I just have this epiphany in my head
1037520	1039440	where I'm like, I have been too defensive,
1039440	1042760	too fucking like, it's like,
1042760	1044840	if someone is like feeding into you,
1044840	1046600	they're going like, hey, you're fat,
1046600	1048040	season six of Community Suck,
1048040	1050240	season three of Rick and Morty Suck,
1050240	1054880	you're a cuck, you're, again, with the fat,
1054880	1057480	I can't, you know, people aren't really that,
1057480	1060640	I don't know, they give you,
1060640	1064120	they give you chemicals and a little line
1064120	1066680	that they've stuck into you, you're receiving it.
1066680	1069120	And then you just take it in, you process it.
1069120	1072240	There is like, if somebody says,
1073960	1077200	you know, we should make America great again
1077200	1079320	by getting rid of all the brown people,
1080520	1082720	like, you could process that and go,
1083840	1085680	I think it's great that you think America's great,
1085680	1086760	I love America too.
1088760	1089600	Oh.
1091280	1092120	Now.
1092120	1093560	I'm pretty sure you're talking to a person
1093560	1095200	with a mental disability.
1096440	1098960	At which point to continue to take what they're saying
1099760	1100600	seriously?
1100600	1101920	Well, no, we're not, we're not, we're not,
1101920	1104160	we're not trying, we're not wasting time on this person.
1104160	1105960	You're correct to correct me on that.
1105960	1108760	Once someone calls people brown people,
1108760	1109600	I'm pretty much like, oh, no.
1109600	1110800	Apparently those were my words,
1110800	1112280	I don't know if this person,
1112280	1114760	this motherfucker hates math.
1114760	1116080	First and foremost, you're correct about that,
1116080	1117640	we're not gonna get into arguments with these people,
1117640	1119480	we're not gonna try to change them.
1119480	1120320	Certainly not.
1120320	1122040	But, you know, what we're finding, I think,
1122040	1125440	is that these people, when we do the other thing
1125440	1128000	besides try to change them, which is like,
1128480	1130840	just kind of like fucking, I don't know,
1130840	1134200	whatever you call it, a lot of times I just block them.
1134200	1136360	I don't know, they might be getting energy from that.
1136360	1137320	They are.
1137320	1139000	Yeah, you should mute them instead.
1139000	1139840	They don't know.
1139840	1142520	Yeah, but if you mute them and they directly tweet you,
1142520	1144080	the mute is not function.
1144080	1145800	Not anymore.
1145800	1146840	They upgraded the mute button?
1146840	1149040	As far as I understand, I've never seen anything
1149040	1151520	from a muted person unless I saw it out.
1151520	1152840	But it used to be like that.
1152840	1153680	That's what I do now.
1153680	1155840	Now I have like a thousand muted people.
1156720	1158920	At one point I had 9-11 muted people.
1158920	1163920	I would just mute, I would go through and mute everyone
1164720	1169680	and then unmute you, Elon Musk.
1169680	1170520	People do that.
1170520	1173680	And, yeah, like my girlfriend or whatever,
1173680	1175920	you know, and that would be called, I guess, Facebook?
1175920	1177720	Or like, yeah, pretty much.
1178960	1179800	All right, well.
1179800	1180640	Yeah, there is a little bit,
1180640	1182240	you're correct about the overload.
1183240	1184200	There's a bit of an overload
1184200	1186840	and we are reacting now instinctually
1186840	1188200	without really, you know.
1188200	1189840	I think we're getting more signals.
1189840	1192840	And if, in general, and if more signals are bad
1192840	1194360	and we're used to less signals
1194360	1196200	and now we're getting more bad signals,
1196200	1197920	we're gonna kind of frazzle to some extent.
1197920	1200080	Yeah, it's tough because you start,
1200080	1202480	you wanna, the accurate language you use
1202480	1204400	now all has all these horrible connotations.
1204400	1205800	Because I wanna use a word like trigger.
1205800	1208200	And I wanna say like, in other words, kids,
1208200	1212760	if a stranger has the ability to trigger you
1212760	1217760	into negative behavior,
1218440	1222040	are you a superior machine to the triggering machine?
1222040	1225200	Or are you losing a fucking AI battle?
1225200	1229600	You know, if someone has the ability to shut you down,
1229600	1234600	to make you numb, to make you simply scream
1234760	1237080	at the top of your lungs and point at the thing
