start	end	text
2371400	2376400	He's blue blood Mayflower fucking parasitic DNA.
2377200	2380000	And he needs his Harvard UV ray
2380000	2381880	that is tanning booth to pass through,
2381880	2384560	so he can be a baked in Harvard fucking moron
2384600	2388640	and go get his oil wells and his fucking shit back.
2388640	2390040	So I got good news for you.
2390040	2391760	I got good news for you, that's a myth.
2391760	2393480	Okay, all right.
2393480	2395400	So actually somebody did that study.
2395400	2398720	They looked at people accepted by Harvard,
2398720	2399920	all the people accepted by Harvard,
2399920	2402240	and they looked at the people who chose not to go
2402240	2403880	and compared them to the people who went.
2403880	2407760	Turns out that if you are from the top four
2407760	2410280	of the five socioeconomic strata,
2410280	2412600	so basically the top 80%,
2412640	2415360	it makes zero difference whether or not
2415360	2417400	you chose to go to Harvard or to state school.
2417400	2419080	Where it does help, and it does help,
2419080	2421320	is if you come from the 20% poorest households
2421320	2422160	in the country,
2422160	2425080	which make up a tiny, tiny, tiny fraction
2425080	2427320	of Harvard students,
2427320	2429200	those students actually do have
2429200	2432680	some better future earnings, et cetera,
2432680	2433920	if they went to Harvard Path versus not,
2433920	2435240	but it's not that much.
2435240	2437760	And it's usually because they started out at zero.
2437760	2440280	Correct, because they started out with a huge, huge,
2440480	2442560	huge amount of downside,
2442560	2444160	and they do meet some people that will help them out.
2444160	2445480	So that does help.
2445480	2447520	But guess what?
2447520	2450080	What makes you successful in life?
2450080	2452360	And this is actually a damnation of universities,
2452360	2454200	because I don't think it should be this way.
2454200	2455400	But what makes you successful in life
2455400	2457480	is just how good you are, right?
2457480	2459600	But what universities should be doing
2459600	2461320	is they should actually be adding value.
2461320	2463160	They should actually be teaching to do those things.
2463160	2464000	It should be places where you go,
2464000	2466240	and you go, I don't know, I play a little bit of piano,
2466240	2468680	but I've always liked English class.
2468680	2470120	I came here to be a journalist major.
2470840	2472480	And they go, wrong, you're Billy Joel.
2472480	2474280	And they funnel, and they make you into Billy Joel.
2474280	2476320	That's what any school should be.
2476320	2478200	That's what any household should be.
2478200	2480040	Your kid should be born with proclivities
2480040	2482280	that are natural, interests that are natural.
2482280	2483880	Sometimes those are contrasting.
2483880	2485520	You put a piano in front of your kid.
2485520	2487840	You put a football in front of your kid.
2487840	2492360	You put a lock pick in front of your kid.
2492360	2494080	It's just in D&D terms.
2494080	2495520	Maybe they're gonna be an expert thief.
2495520	2496360	Yes.
2497240	2499720	And they respond to stuff and they don't respond to stuff.
2500680	2502320	And you break all, by the way, as a subset of that.
2502320	2504520	You break all gender norms and all that stuff
2504520	2507000	because regardless of what we think about this stuff.
2507000	2508800	Anyways, but who cares?
2508800	2510080	I'm patting myself on the back for,
2510080	2512240	what am I barfing you at?
2512240	2513880	I'm very curious about one thing
2513880	2515560	because I just want to make sure I got the picture here.
2515560	2517560	Because that girl in that example,
2517560	2520240	when that professor says that F is actually a C plus,
2520240	2522240	is he saying that because of that girl's background,
2522240	2524080	or is he, or is it just because there's a rule?
2524080	2525480	So the rule is in order.
2525480	2527640	Poor kids are benefiting from the no F process.
2527680	2528520	Yeah, yeah, yeah, yeah.
2528520	2529360	Everybody goes to C schools.
2529360	2530200	Because they're customers.
2530200	2531040	Benefit, they're customers, right?
2531040	2532280	So nobody wants to get out cold happy mail.
2532280	2534160	Well, the teachers, they get rated
2534160	2535560	on how good their students do.
2535560	2536960	Bingo, bingo.
2536960	2538640	And so in order to give the girl an F,
2538640	2540040	there is a way to give her an F.
2540040	2541440	After she missed the first midterm,
2541440	2544400	they had to call her into a teacher student conference
2544400	2548280	and have a written down corrective action plan.
2548280	2551080	Even though in the rules, she could have missed the midterm.
2551080	2553360	Then after she missed the second midterm,
2553360	2555040	they had to bring her back in
2555040	2557520	and have her sign on a different corrective action plan
2558280	2559120	because the first one clearly didn't work.
2559120	2563440	And then, and only then, if she then misses the final,
2563440	2566080	just doesn't show up, then they can give her an F.
2566080	2568360	People don't bother doing it, right?
2568360	2570400	And so, but there's one other thing
2570400	2571600	that universities should be doing,
2571600	2572680	which is what you were talking about
2572680	2574080	at the beginning of the show,
2574080	2576440	which is those filters, right?
2576440	2579180	The ways they train your mind
2579180	2581500	to deal with what comes at you,
2581500	2583440	that is the job of universities.
2583440	2586320	That is the definition of higher education.
2586320	2587600	Universities don't do that.
2587600	2591120	And instead, we're giving C pluses to absolute morons
2591120	2592560	that can go on to become legislators,
2592560	2596280	and we're giving also, look, I'll say it.
2596280	2597520	I'm gonna sound like one of the bad guys.
2597520	2599800	We're giving safe spaces to kids that complain
2599800	2601320	that catcher and the rhyme made them uncomfortable
2601320	2602560	because it has the word fag in it.
2602560	2603400	Absolutely.
2603400	2605360	Well, this seems all pretty terrible.
2605360	2606400	Yeah.
2606400	2610080	I wish there was someone here that had a plan
2610080	2611640	because we were good at complaining,
2611640	2614560	but if only there was someone, help me.
2614560	2617000	There's gotta be a better way.
2617000	2620160	I wanna know how we got here and where we're going.
2622160	2623600	Where are we going?
2623600	2627040	So we believe that we've sketched out something that works.
2627040	2628520	You and your improv troupe.
2628520	2630000	Exactly, right.
2630000	2631840	We have a whole group of people now.
2631840	2633560	So we actually started a new university.
2633560	2635400	We started a new university program
2635400	2637440	that's actually part of the KGI,
2637440	2638560	which is one of the Claremont Colleges
2638560	2640120	here in Southern California.
2641040	2646040	And our students go through a completely reimagined
2647160	2648680	four-year undergraduate curriculum.
2648680	2651720	It's accredited, it's very, very selective,
2651720	2652800	very hard to get in,
2652800	2657200	but unlike the traditional profile of other universities,
2657200	2659240	we just choose not to discriminate.
2659240	2661040	It was an odd choice.
2661040	2663520	And so we charge for-
2663520	2665240	Even if they're black?
2665240	2666520	Across the board, right?
2666520	2667880	You mean you don't discriminate
2667880	2669960	among the different kinds of black people
2670960	2671800	for the black people program?
2671800	2673520	There's no black person program.
2673520	2674360	What about the-
2674360	2675600	Well, how do you tell the black students from the-
2675600	2676440	We don't.
2676440	2678800	So here's the crazy thing about what we do.
2678800	2680160	Here's the crazy thing about what we do.
2680160	2681640	We have no quotas.
2681640	2682960	We have no buckets.
2682960	2684040	We have no slots.
2684040	2687480	We don't say, oh, you have to compete for this position.
2687480	2689160	If you qualify for a program,
2689160	2690240	it's very hard to qualify to,
2690240	2693200	but if you qualify, you get in, okay?
2693200	2695680	And we charge for tuition fees room and board,
2695680	2698000	the whole thing, less than $30,000 a year.
2698000	2700520	So less than half of what the Ivy League charge, right?
2700520	2702120	Which is 60 to 70,000 now.
2703000	2705240	And despite the fact that we charged less than half,
2705240	2707440	80% of our students can't afford it.
2707440	2709160	What's a state school cost?
2709160	2710320	About the same.
2710320	2712600	And that's subsidized by the government, we're not.
2712600	2714280	Sorry, I've got to pick my nose right on camera
2714280	2715720	because it's just, there's a trap door booger.
2715720	2717480	And look, I can either live with it
2717480	2718320	or I can fucking confront it.
2718320	2719280	You have to do something about it.
2719280	2720560	Now it's gone.
2720560	2722960	I'll let Reddit show that in replay.
2722960	2724880	I picked my nose.
2724880	2725840	I do it with my thumb.
2725840	2728280	That's why my nose looks like Harrison Ford's at 44.
2728280	2732960	Now, would a guy like me make it into your program?
2735720	2739800	So I want to try to, I'm going to try to recap
2739800	2741760	what you said so that we can try,
2741760	2743160	because I'm dumb and drunk.
2743160	2748160	And you're saying that you, because first of all,
2748960	2752000	you haven't built a brick and mortar building yet,
2752000	2754360	where you're saying you're using existing universities,
2754360	2755960	but you started a program.
2755960	2757120	We started an undergraduate program.
2757120	2758880	Yeah, and what we do is rather than using
2758880	2760320	kind of a campus-based philosophy,
2760320	2761600	we use a city-based philosophy.
2761600	2763760	So our students, they actually spend their first year,
2763760	2765960	not in Southern California, but in San Francisco.
2765960	2768520	And they live in a residence hall in the middle of the city.
2768520	2771400	And then the next three years, they travel as a group.
2771400	2773640	They live in six different countries all over the world.
2773640	2774480	What?
2774480	2776440	So they go from San Francisco, they go to Seoul,
2776440	2779280	Hyderabad, Berlin, Buenos Aires, London, Taipei,
2779280	2780880	and they come back to San Francisco to graduate.
2780880	2782600	Are you a Bond villain?
2782640	2786120	Well, I'm not, but perhaps our students will be Bond heroes.
2786120	2787480	Finally, they're placed in a pit,
2787480	2790200	in a broken pool queue between them.
2790200	2793480	The one super student that emerges from that pit
2793480	2794560	goes to the moon.
2796560	2798680	Actually, he gets to go to Harvard.
2798680	2801720	No, but I just want to, because please forgive me.
2801720	2805400	I'm saying, so you're saying it's a program,
2805400	2806240	it's not a school.
2806240	2808080	It's not a geographically located thing.
2808080	2808920	It's a program.
2808920	2809760	It's geographically located.
2809760	2811280	It's just not located in a campus.
2811400	2812960	It's located in the cities.
2812960	2815720	Okay, but everywhere these people are going,
2815720	2820720	the faculty, you're not invading existing schools
2821480	2823960	and saying, let us piggyback on your infrastructure.
2823960	2826120	You have your own teachers, your own curriculum.
2826120	2827520	We have our own professors, our own curriculum,
2827520	2829480	and the curriculum, the way it's structured is,
2829480	2832680	in the first year, they spend the entire first year
2832680	2834200	training their minds.
2834200	2836600	They learn four systems of thought.
2836600	2838560	We're talking about complex systems, basically.
2838560	2839860	We're talking about, at the beginning,
2840180	2842460	how we are all complex systems, right?
2842460	2845820	Anywhere from people to animals to...
2845820	2847500	The first year is how to think.
2847500	2849820	The first year is systems of thinking, right?
2849820	2852260	So, how to use logic and reasoning and statistics.
2852260	2854580	How to look at the world around you
2854580	2857500	and understand how things work when data isn't clear.
2857500	2860020	How to think about unintended consequences
2860020	2861020	and effective interactions.
2861020	2863300	How to think about how to communicate effectively.
2863300	2865340	So, one of the things that you were talking about
2865340	2866500	is one of the things we actually teach.
2866500	2868340	It's called audience, right?
2868340	2871300	Hashtag audience, which is a habit of mind
2871300	2874740	to understand who it is that you're talking to
2874740	2876540	before you start talking, right?
2876540	2879040	To actually understand, how are they going to receive
2879040	2880500	what I'm saying?
2880500	2883300	And, by the way, there's the corollary to that,
2883300	2886540	which is, why are they saying those things to me?
2886540	2887420	What are they actually...
2887420	2889820	What is the question behind the question
2889820	2891540	or the statement behind the statement?
2891540	2893020	So, that's like communication theory and stuff.
2893020	2894900	So, that's part of effective communication.
2894900	2896300	Well, that seems like that's compatible
2896300	2899300	with modern problematization.
2899300	2904300	Yes, to pronounce it in the original French.
2905980	2910380	Problematization, which I heard a student
2910380	2911820	telling me, explaining to me about
2911820	2913900	that you're picking apart things and then I looked it up.
2913900	2914740	Like, what is this?
2914740	2917100	It's like a sort of digestive process
2917100	2918420	of any piece of information.
2918420	2919820	You can just look around your world
2919820	2920860	and start corroding it.
2920860	2921700	Correct.
2921700	2922540	Which...
2922540	2924420	And you don't like the word filter, which is right.
2924420	2926100	I think about it as lenses.
2926300	2928540	We give you a hundred different lenses
2928540	2930260	to sharpen your view of the world.
2930260	2931660	Don't lenses filter light?
2931660	2933060	Okay.
2933060	2933900	That's true.
2933900	2935940	They focus, they focus, they focus light, right?
2935940	2937540	Okay, I'm just saying, don't...
2937540	2939420	But it is fantastic to...
2939420	2941980	Yeah, because I feel like if there's one thing,
2941980	2943820	often with this, I'm Generation X,
2943820	2945740	I'm the David Cross, Jeanine Garofalo,
2946820	2948340	Brandon Johnson generation.
2952020	2954820	I floated my boat for the longest time.
2954820	2955980	Brandon and I have talked about this,
2956620	2958420	how our generation kind of...
2958420	2961820	We weren't like millennials,
2961820	2965020	however we were, you know, lazy is lazy.
2965020	2968380	Like we learned how to be anti-corporate when we were 25.
2968380	2971860	We learned how Jamba Juice is just fucking bullshit.
2971860	2972700	It's all sugar.
2972700	2974860	Everything with a little C in a circle
2974860	2976460	or a TM on it is bullshit
2976460	2977580	and everything corporate is bullshit.
2977580	2979060	Money is bullshit and all this stuff.
2979060	2980740	We didn't...
2980740	2982740	And then the millennials started rubbing us the wrong way
2982740	2984460	because they're like, I don't know, I love recycling.
2984460	2985540	I mean, if the president tells me to do it,
2985980	2986820	my mom's my best friend,
2986820	2988460	and they're like, these people are gonna be fascists
2988460	2990500	if they intersect with the right president.
2990500	2992020	And I am on record in this podcast
2992020	2993300	as saying that if you can bear it,
2993300	2995660	scroll back through this horrible fucking podcast.
2995660	2996940	However, I also went and bought a gun
2996940	2998260	and some things didn't go my way.
2998260	3000220	I've also said horrible things and made rape jokes.
3000220	3002260	All right, so don't go back, don't go back.
3003780	3007820	But like the place where we intersect is,
3007820	3011900	I think like our generation, my generation is like,
3012740	3015980	that's like a little bit of paprika, a little pepper.
3015980	3018420	It's like, could we please just change lenses constantly
3018420	3020500	and always look at everything and see who's gaining
3020500	3022340	and who's losing and question everything
3022340	3024660	and kind of like be jaded about it a little bit?
3024660	3026300	Absolutely.
3026300	3027300	But you don't need to be jaded.
3027300	3029660	You have to actually just look at it.
3029660	3031860	You actually have to get down to the core
3031860	3033100	of what the issues are, right?
3033100	3035660	And I think that's actually where our generation,
3035660	3036660	we were primed.
3036660	3039820	I think probably this is why I came up with this concept,
3039820	3041340	which is when I went to college,
3041340	3042620	that's what I was primed for.
3042620	3044060	I was primed for exactly that.
3044060	3045180	I wanted to go to college.
3045180	3047300	Well, in movies and TV, that's what it always is.
3047300	3049900	It's always like these crazy thematic John Hausman's
3049900	3052660	at the front going, I expect you to work
3052660	3054340	so much harder than you ever.
3054340	3056140	And then like the people turn their papers in
3056140	3058780	and it's like, look, sorry, professor,
3058780	3060180	I just didn't agree with you on this one.
3060180	3062260	And that is why you got an A.
3062260	3064860	You know, like everything, like colleges
3064860	3068100	as depicted in our culture are these places
3068100	3071980	where you're fucking, the bullshit starts off campus.
3071980	3075740	That's why Kent State, that's why Kent State tipped off.
3075740	3080540	It's like they fucking invaded the goddamn Pentagon
3080540	3083580	of culture, our children, our youth.
3083580	3085700	Like you're allowed to protest, you're allowed
3085700	3088260	and then they sent the National Guard onto a campus
3088260	3091260	and someone got shot and it was like, this is over now.
3091260	3092300	You fucked up.
3092300	3095220	Just as when a journalist getting shot in the roaring 20s,
3095220	3097380	this is the reason organized crime got shut the fuck down.
3097380	3098660	You shot a journalist.
3098660	3100740	It was like always there was this respect
3100740	3103820	for these things that should have kept me safe.
3106500	3108260	This is a heavy podcast.
3108260	3109660	No, it's a selfish one.
3109660	3111780	It's where I come to like, like I just plea
3111780	3112620	with the cameras.
3112620	3114020	I go, can you hear the shelling?
3114020	3115900	Someone send me blood.
3115900	3117300	But I just.
3117300	3119300	Someone sent us blood.
3119300	3120140	What are you Dan?
3120140	3121700	I'm an O positive.
3121700	3122540	You know what?
3122540	3125100	I think you should be a little more O negative sometimes.
3125100	3126900	That's the problem with your generation.
3127380	3133020	The so so so how OK.
3133020	3134900	I want to I want to continue to talk to you.
3134900	3135820	We have a full show tonight.
3135820	3137020	We've also got I think somebody that's
3137020	3138100	going to blend very well with you.
3138100	3140300	I think either that or we're going to get the tanks are
3140300	3142460	going to roll through the building once once the two of
3142460	3143420	you are together.
3143420	3148340	But I just want to like like just a little personal
3148340	3148940	background.
3148940	3149500	Come on.
3149500	3150380	Come on, Ben Nelson.
3150380	3152020	Stop avoiding intimacy.
3152020	3153780	Who are you?
3153780	3156260	How'd you end up on this war path?
3156260	3157420	How'd I end up on the war path?
3157420	3158780	It was it was pretty simple.
3158780	3163820	I mean I was so went to college idealistic 18 year old assuming
3163820	3166100	John Houseman will be teaching me all of my classes.
3166100	3169540	But also that you'd be allowed to be John Kuzak in a sure
3169540	3170620	thing.
3170620	3172740	That was the other half of the college dream was that you
3172740	3177740	could go you know what I'm a fucking whiz English major.
3177740	3181180	I'm going to I'm going to skip the midterm but I'm going to
3181180	3184820	make it up on the you know it's like you cut classes and that
3184820	3186300	was part of your grown up now.
3186300	3187700	You're not a high school student anymore.
3187700	3188300	You're an adult.
3188300	3190780	You make your choices and they're like a lot of college
3190780	3193380	dramas would feature that moment where the kid would have
3193380	3194020	to come to terms.
3194020	3196100	It's like yeah but you're scheduling your time and you're
3196100	3197020	picking your priorities.
3197020	3197220	Yeah.
3197220	3200060	And in fact I found that I could schedule my time completely
3200060	3202540	because I never needed to go to class because the classes were
3202540	3204460	I mean they just read books out loud to you and I could read
3204460	3205100	them on my own.
3205100	3205980	Yeah.
3205980	3208060	That's what my college experience was like.
3208060	3208340	Yeah.
3208340	3209580	And I didn't like that.
3209580	3209940	No.
3209940	3211060	I wanted to learn something.
3211060	3212660	I could just buy a textbook.
3212660	3213340	Exactly.
3213340	3213620	Right.
3213620	3217580	And so I thought that you know choice and in college should be
3217580	3220500	made when I was ready for it.
3220500	3220740	Right.
3220740	3223540	I'm actually not a big fan of choice right at the beginning
3223540	3224900	because I'm still a kid.
3224900	3225100	Yeah.
3225100	3225500	Right.
3225500	3227940	Freshman year I have no idea what I'm doing at that point.
3227940	3230740	High schools over you piece of shit and part of that
3230740	3236460	should be like the mom a cat like drops a crippled mouse
3236460	3238100	like not a dead one.
3238100	3238780	Yeah.
3238780	3243100	Meaning you can you're going to you can go do stand up Wednesday
3243100	3244060	nights.
3244060	3244540	Right.
3244540	3244900	Right.
3244900	3247660	And then your grades going to lower down just a little bit.
3247660	3250220	You're going to get enough you can make those choices.
3250220	3251060	Exactly.
3251060	3254180	But I'm just saying I should have I should have I should have
3254180	3256740	better grades at Marquette if there's one thing we can
3256740	3257740	establish.
3257740	3260420	I should not have gotten an F in English for the record it is.
3260420	3264060	I've been walking around that I need to go to gimlet media
3264060	3267580	with my heavy weight episode about how I need to confront my
3267580	3268620	college TA.
3268620	3268900	All right.
3268900	3269980	Why did you well real quick.
3269980	3270740	Why did you get enough.
3270740	3272980	It was a systemic thing was like were you not
3273100	3277180	literally they tell you your grade drops a grade level if you
3277180	3278740	if you skip a class.
3278740	3279020	OK.
3279020	3280620	So right there I'm dead.
3280620	3281180	Yeah.
3281180	3282380	Because that's amazing.
3282380	3283980	I never had that skill.
3283980	3287260	They were also starting a new thing on cooperative education
3287260	3289340	which is where the class shows up.
3289340	3290300	There's a TA.
3290300	3293980	The TA breaks everybody into groups and the group gets a
3293980	3295300	grade shares a grade.
3295300	3295700	Oh yeah.
3295700	3295980	Right.
3295980	3296420	Sure.
3296420	3301500	So that was very offensive to my young like if if you had
3301500	3305820	transplanted me into today like I was you know like yeah I
3305820	3308580	was like I wasn't at risk of all right.
3308580	3311220	You know like indoctrination but see here's here's what I would
3311220	3311900	make the argument.
3311900	3315860	I would recommend that if if your university did its job you
3315860	3317580	wouldn't have missed any classes.
3317580	3320140	You would have gone to class because it would have actually
3320140	3321940	you would have seen your mind develop.
3321940	3325940	You'd say oh my God I am smarter this week than I was last week
3325940	3327860	and I'm not going to miss out on that opportunity.
3327860	3330380	And sometimes you do have to put in some structure.
3330380	3333180	The problem is when you put in structure and then the university
3333180	3335700	doesn't deliver you got to show up and then you show up and you're
3335700	3340500	like you show up and then your TA is reading Ray Bradbury and like
3340500	3344420	texting while you sit in a circle of desks with all your fellow
3344420	3346340	freshmen going I don't know what you want to do.
3346340	3349620	Oh you want to do exactly exactly what if we wrote a paper about
3349620	3350100	licorice.
3350100	3353980	Oh OK.
3353980	3355980	So not to avoid intimacy.
3355980	3359260	I I came up with this idea when I was a freshman.
3359260	3361780	Basically how to fix the curriculum of my university.
3361780	3365380	And I spent four years trying to argue for people to listen.
3365380	3366220	Nobody cared.
3366220	3369740	Oh they must have loved you care care care.
3369740	3372340	And now that I'm here I'd like to put up some wallpaper.
3375900	3379620	So you know I tried for four years and I gave up.
3379620	3381700	And I said what can I do.
3381700	3382580	I couldn't do anything.
3382580	3384940	I was all these committees and all the rest.
3384940	3386220	Nothing could happen.
3386220	3389700	So I gave up and I said you know I think education is kind of
3389700	3390780	important.
3390780	3393020	I think it's kind of important for universities to actually
3393020	3394260	educate students.
3394260	3396980	And my guess is this is going to have some bad effects in the
3396980	3398060	real world.
3398060	3400020	But who knows.
3400020	3400620	Right.
