start	end	text
4609900	4611100	But that's not good.
4611100	4613660	That's not good, because then, all of the rich people,
4613660	4615060	this is what you have today.
4615060	4618500	You have the poor people going to the poor university.
4618500	4620420	And you have the rich people going to the rich university.
4620420	4622340	Where's Goldman Sachs going to go higher?
4622340	4624860	I mean, hopefully, nowhere near my friends.
4624860	4626420	Okay, well, the point is, is that.
4626420	4627860	When it comes to sciences, though,
4627860	4630140	it doesn't matter which university you go to.
4630140	4631620	It's the results that you yield.
4631620	4633100	It's the skills that you learn.
4633100	4633980	Correct, right?
4633980	4634820	So, again.
4634820	4636300	But then you have to resource those universities
4636300	4637980	to provide those results, right?
4637980	4638900	But that's what happens.
4638940	4641180	Rich companies come in and they buy half of University
4641180	4644340	of Wisconsin to develop something for their company.
4644340	4647700	But when you limit access, you guarantee
4647700	4648900	that you are not going to get the best part of it.
4648900	4649780	Oh, no, exactly.
4649780	4651860	So, what you have to do is you have to change.
4651860	4653100	So, again, this is a good way.
4653100	4655820	So, I'll give you a solution that I would implement
4655820	4657700	if I were like Magic Wand, right?
4657700	4661380	So, Magic Wand would be the government's declaration,
4661380	4663980	which is, if you want to be a nonprofit,
4663980	4667980	if you want to have any federal dollars, any kind,
4667980	4671100	access to all grants, not pay taxes, and all the rest,
4671100	4675500	very simply, your student body needs to roughly align
4675500	4677860	to the socioeconomic spectrum in the United States.
4677860	4678700	Right?
4678700	4679860	Pay deciles, right?
4679860	4682060	You get 10% of your students from the top 10%,
4682060	4683820	10% of the bottom 10%, and throughout.
4683820	4688220	If you do not do that, all of your federal funding, gone.
4688220	4689060	Deal.
4689060	4689900	Right?
4689900	4692420	At that point, you have solved the access problem overnight.
4692420	4693260	Yeah.
4693260	4695100	I mean, or you don't have to do anything for free, right?
4695100	4696780	You just have to actually get those units.
4696780	4698900	So, Harvard won't be 10, 10, 10, 10, 10.
4698900	4701300	It would be 10% and 90% from the bottom.
4701300	4703540	It would take no chances.
4703540	4704380	Right?
4704380	4706340	So, this to me is something that you could do.
4706340	4709140	I feel like that system sounds better for Congress,
4709140	4712860	if Congress had to have a representative
4712860	4715300	spectrum of wealth as America.
4715300	4718260	But for like, if we talk about how you need a college
4718260	4721260	education for a job, if we talk about how,
4721260	4722980	for me personally, and for a lot of people,
4722980	4725100	I think education is a human right,
4725100	4730100	then anything that you do to get rid of access,
4730500	4735100	to limit access to all people is bad.
4735100	4737660	And that's not to say that like,
4737660	4740700	if you go to the poor school or whatever,
4740700	4743020	it would be in a situation where,
4743020	4745380	because of the taxes, because of the money coming in,
4745380	4747380	there would be all this new money coming into
4747380	4748980	public universities.
4748980	4751180	So, those schools would become better, right?
4751180	4753540	If there's more people, if there's more perspectives,
4753620	4755100	if there's more money coming in,
4755100	4757260	then people who go to those schools,
4757260	4760740	who luck out and become people who can hire people,
4760740	4763340	they will go, I'm not gonna hire from Harvard.
4763340	4764980	This hypothetical is just as realistic as your hypothetical.
4764980	4765980	Correct, it's correct.
4765980	4770940	If you actually create a much, much more well-resourced,
4770940	4772940	education-focused public university
4772940	4775060	that actually teaches people how to think,
4775060	4776300	and you have the privacy keeping doing
4776300	4779100	whatever they're doing, then you're definitely right.
4779100	4779940	Yeah, I think-
4779940	4781940	Then the tide will shift.
4781940	4783060	I think with my drunken brain,
4783060	4785660	I think I'm just dumb enough to perceive
4785660	4787300	the two smart people are agreeing,
4787300	4791180	but that you guys are different distances from the problem.
4791180	4792020	Yeah.
4792020	4794100	Not distances from the problem being a-
4794100	4794940	Approaching.
4794940	4799660	Like, you were born from it and have a fuckin',
4799660	4803820	like, you wanna dig in and plug this wire into that wire
4803820	4807060	and hotwire this car, and Josh is going,
4807060	4808420	why fuckin' cars, man?
4808420	4810260	Like, that's why.
4810380	4813180	And I think both of you are agreeing,
4813180	4816780	but or I'm dumb and drunk, and that's at least half true.
4816780	4820100	I think absolutely that your system has a place
4820100	4822180	within the system that I'm imagining.
4822180	4827180	I think that there absolutely, it's absurd that
4827980	4831740	the IVs run the way they do with legacy bullshit
4831740	4834820	and all of that, and that absolutely needs to be reformed,
4834820	4837780	and that there absolutely is a place in the world
4837780	4840460	for those who choose, electively,
4840460	4845460	to join a for-profit, specialized, private institution.
4845940	4848780	Like DeVryne, or ITT.
4848780	4849620	Yeah.
4849620	4850980	Or several places you could go to.
4850980	4852780	We will leave links.
4852780	4854820	Yeah, if you use the promo code, whoops,
4854820	4857060	you can join University of Phoenix right now.
4857060	4860500	Well, if I don't play the bad guy and cut people off,
4860500	4864940	then no one is, and that's my role,
4865180	4868340	because as you know, if you're new to this podcast,
4868340	4869940	it's time to play BaldrDash.
4869940	4874940	Uh, so Spencer, are you prepared to,
4877940	4881140	you're not DMing BaldrDash because the part of the game
4881140	4884540	is that we're gonna rotate through dealers, I think.
4884540	4885940	Yeah, I think that's part of the game.
4885940	4888100	The game of BaldrDash is simple.
4888100	4889620	You guys played BaldrDash?
4889620	4890940	No.
4890940	4894500	Each participant will make up an answer
4895980	4897580	to the question, right?
4897580	4899060	Well, you explain it, you're better.
4899060	4900340	I'm bad at explaining games.
4900340	4903900	Well, let me, why don't I dash for the first round?
4903900	4904740	All right.
4904740	4906820	And then, and then I think that, I think it'll,
4906820	4909740	I think by playing a round, it'll become.
4909740	4910660	Learn by doing.
4910660	4912740	Yeah, it's pretty simple.
4912740	4915700	It's basically like, I'm gonna give you guys
4915700	4917620	a piece of paper, I'm gonna give you,
4917660	4918860	I'm gonna give you a.
4920780	4921620	A box.
4922820	4924340	I'm gonna give you a box.
4924340	4926660	I'm gonna give you, depending on the category,
4926660	4930300	I'm gonna give you an acronym, a movie title,
4930300	4933060	a human name, something like that.
4933060	4937100	That thing has a sort of explanation.
4937100	4939140	If it's a movie, the movie has a synopsis.
4939140	4943780	If it's an acronym, then the letters I'm gonna give you
4943780	4946580	stand for something in real life somewhere.
4946620	4948300	I'm gonna know the answer to that.
4948300	4950100	You guys are gonna take two minutes.
4950100	4951380	I've got a special surprise for you
4951380	4952580	during that two minutes.
4954100	4959100	To write an attempt at a convincing answer
4959180	4960680	to what that thing is.
4962100	4964220	And then I'm gonna read them all aloud,
4964220	4967420	including the real answer.
4967420	4968260	And.
4970260	4971100	Cards?
4971100	4972580	Yes.
4972580	4974060	And then here's your answer card.
4974060	4976080	I'll explain more in a second.
4977500	4979700	Spencer, you're gonna do one too, right?
4979700	4980540	Yeah.
4980540	4985140	Okay, so players, so these are for far away.
4985140	4987620	So he's gonna read the name,
4987620	4990180	and then we're gonna invent.
4990180	4991020	Yeah.
4991020	4992500	Fake answers.
4992500	4995040	All right, so I'm going to,
4996100	4998380	I'm gonna start with a really simple example
4998380	5002720	because I think one of my least favorite categories
5002720	5005060	will actually make the best practice round.
5005060	5006740	It's called laughable laws.
5007740	5008580	Okay.
5008580	5009900	Laffable laws.
5009900	5011900	All right, so if I say to you guys,
5011900	5014580	in Garfield County, Montana,
5014580	5018460	it is illegal to draw dot, dot, dot.
5018460	5022000	And then you just have two minutes
5022000	5023560	to write an answer to that.
5023560	5028560	Please remember to write your name down in the lower right.
5028820	5031740	And your, yeah, and just write your answer
5031740	5032920	in the other spot.
5032920	5034460	And then for this two minutes,
5034460	5035920	Andy Dick is just gonna,
5037260	5039020	we're gonna have two minutes of Andy Dick.
5039020	5039860	While you,
5039860	5040700	Andy Dick, we have a microphone for you.
5040700	5041540	If you need it.
5041540	5043280	Yes, it's over there, sorry.
5043280	5045060	Okay, is anyone keeping time though?
5045060	5046460	I forgot that part.
5046460	5048460	It's on, but talk into it together.
5048460	5049880	You can't, hello?
5049880	5050780	Oh yeah, okay.
5050780	5051620	Okay.
5051620	5053340	Can I get my new intern up to hold this?
5053340	5055660	They don't have a stand.
5055660	5056500	Do a genie.
5056500	5058260	We must be 35 seconds into it.
5058260	5059100	Well, that's okay.
5059100	5059920	They're already writing the hand.
5059920	5060760	If they have longer, it's just,
5060760	5061580	you come up.
5066380	5067220	You're done already?
5067220	5069300	I didn't even do my thing.
5069300	5070140	You keep going.
5070140	5070980	You keep going.
5070980	5071800	I'll do it on the next one.
5071800	5073060	We got two whole minutes.
5074460	5075300	Just have to.
5075300	5076140	What minute are we on?
5076140	5078460	We're on like 30 minutes, 30 seconds.
5078460	5080100	Are you doing whippets?
5080100	5080940	No.
5080940	5081780	Oh, I wish.
5081780	5083180	Yeah, me too.
5083180	5085020	Maybe if you blow in this and I suck.
5085020	5086820	We have some Andy Dick music, just,
5086820	5087660	is that where we're at?
5087660	5089100	Do the D and D music.
5089100	5089940	I got you.
5092940	5095280	Just, well, why don't you hold on to him and the,
5095280	5096120	or no, no, I'm just sorry.
5096120	5097120	I'm not talking to you, Andy.
5097120	5097960	Sorry.
5097960	5100440	I thought you were saying hold on to him, meaning me.
5100440	5102640	Cause I got to write the, you keep going.
5103720	5104540	Ow!
5104540	5105380	Damn you.
5107720	5108720	Thank you, Zach.
5112240	5115680	Oh, for the podcast, Andy's blowing up a glove.
5115680	5116520	I couldn't find the Michael Williams.
5116520	5117360	Oh, that's right.
5117360	5118200	Okay, Andy is blowing up a glove.
5118280	5119300	Yeah, thank you, Spencer.
5119300	5122140	No, I mean, that about covers it.
5122140	5123260	You guys done?
5123260	5124660	No, keep it, keep going.
5124660	5126020	We got about a minute.
5127740	5129700	Okay, you can hand me your cards.
5129700	5131100	I'm getting my head in.
5132540	5134340	I think I haven't made this work out.
5139620	5141580	You can put your name, you gotta.
5141580	5142420	Oh, okay.
5144060	5146020	Somebody else is making that.
5149180	5152580	We have a live ADR team here that is amazing.
5152580	5154140	I don't know which one is yours.
5154140	5155500	We could do it after, right?
5155500	5157820	Well, no, I don't know cause I don't.
5157820	5158660	Okay.
5158660	5160940	Oh, I got, I got, yeah, you, okay.
5160940	5161780	I know which one is yours
5161780	5163260	cause it's the one without the name on it.
5163260	5164100	Okay.
5165540	5167500	It was me doing it, wasn't it?
5167500	5168460	I don't think, I don't,
5168460	5171460	it sounded like it was coming from over there, didn't it?
5171460	5172300	I do.
5172300	5173300	Let me look at your answer.
5175040	5176660	Okay, all right.
5176660	5178140	This is going, this is going pretty good.
5178960	5180080	I think, all right.
5180080	5181160	No, wait, wait.
5183000	5184880	Okay, that's the two minute.
5184880	5185720	All right, thank you, Andy.
5185720	5187360	Dick, he'll be back in a moment.
5188560	5190200	All right, it'll be good.
5190200	5191680	We're all learning.
5191680	5194000	That's, that's, thank you, thank you.
5194000	5195960	Okay, I get it, I'm, okay.
5195960	5197360	Okay.
5197360	5199000	Those nitrile gloves are harder.
5199000	5200560	Let's strike that, can we strike that?
5200560	5201560	Can we strike that?
5201560	5202400	All right, good.
5202400	5203240	Let's strike that.
5203240	5204680	Can you point it right into the monitor?
5204680	5206040	Longest strike ever.
5206040	5207360	That was still on camera.
5207420	5209180	Human timer, Andy Dick.
5209180	5210020	Strike him.
5211700	5213220	As we go, okay.
5213220	5214820	This is a growth opportunity.
5214820	5216740	I'm worried about, I had a lot,
5216740	5217800	I had so much trouble with that
5217800	5219460	and I'm like the Balderdash expert.
5219460	5221180	I'm worried about sticking that on other people.
5221180	5223020	Like I'm, I think maybe I should just be
5223020	5223860	the permanent Balderdash dealer.
5223860	5225980	Yeah, I was kind of thinking about just having one dealer
5225980	5227300	when we were, yeah.
5227300	5228900	I'm pretty sure we all learned that tonight
5228900	5231020	no one can get an F.
5231020	5232180	Right.
5232180	5237020	All right, so, now, you at home and you guys,
5237040	5241780	it's your job to try to guess which one is the real one.
5241780	5246180	And then each person that guests the real one, if any,
5246180	5249240	those people get a certain number of points.
5249240	5251440	It's either one or two, I think it's one.
5252720	5257720	Anybody whose answer accrues guesses,
5258440	5260360	I think that guy gets two points.
5260360	5262160	See, this is means testing in action.
5265000	5266360	I got the points here.
5267260	5269540	If you get a vote, if you get your answer voted for,
5269540	5270380	you get a point.
5270380	5272340	If you get the right, if you guessed the right answer,
5272340	5273180	you get two points.
5273180	5274020	Okay, you get two points.
5274020	5276820	And if I, I get three points if none of you
5276820	5278800	guessed the real one, just as a.
5278800	5281740	Right, and if someone accidentally gets a right,
5281740	5282580	you also get three points.
5282580	5286420	All right, so, in Garfield County, Montana,
5286420	5288280	it is illegal to draw,
5292380	5293220	shuffling these up.
5293220	5294900	I wrote the real answer in one of these pieces of paper
5294900	5296020	so you're not getting any clues.
5296020	5298120	Are we allowed to use Google?
5298120	5298960	No.
5300800	5303160	It's not called bolder cheat.
5303160	5305560	Well, it wouldn't be cheating if you were allowed to use it.
5305560	5307000	In Garfield County, Montana,
5307000	5310160	it is illegal to draw funny faces
5310160	5313000	on the outside of your window shades.
5313000	5314240	Interesting.
5316000	5317140	This isn't Montana?
5318320	5319160	Yep.
5321160	5324280	A male phallus on an overpass.
5324280	5325860	Also, interesting.
5327020	5330820	A man enjoying himself to the Isley Brothers Live album
5330820	5332540	moments after his divorce.
5337060	5337980	Sharon.
5337980	5339680	Is final Sharon?
5342700	5345500	You're not supposed to tip your hat if you didn't answer.
5345500	5346420	To those listening.
5346420	5347860	I mean, you can, it's fun.
5347860	5348900	He is nodding.
5349780	5351300	Yeah, that didn't work out.
5351300	5352140	I wasn't gonna vote for that one.
5352140	5353620	I didn't know how this was gonna pay off.
5353620	5355120	No, it's cool.
5355120	5356720	You made the right choice.
5358120	5363120	A commissioned mural on a Monday, bitch.
5365760	5368320	Okay, so those answers again.
5368320	5369800	In Garfield County, Montana,
5369800	5372160	it is illegal to draw funny faces
5372160	5374400	on the outside of your window shades.
5374400	5376920	A male phallus on an overpass.
5376920	5379480	A man enjoying himself to the Isley Brothers Live album
5379480	5382440	moments after his divorce is final Sharon.
5383020	5383860	Okay.
5385040	5386440	Sorry.
5386440	5388680	That's a crime in a lot of states, Sharon.
5390060	5394420	A commissioned mural on a Monday, bitch.
5395720	5398420	All right, whose guesses are whom's?
5398420	5399920	Wait, are we supposed to guess?
5399920	5402360	Yes, that's why I said whose guesses are whom's.
5402360	5403820	The funny faces is my guess.
5403820	5405560	Funny faces is your guess.
5405560	5409480	So let's see, I'll put a little S there.
5409480	5411840	And then Ben, what's your guess?
5411860	5413460	I'm gonna go with the overpass.
5413460	5418460	Overpass phallus, so I'll put a BN there.
5418940	5420500	And then Josh.
5420500	5421940	I'm gonna go funny faces.
5421940	5423460	It's Montana, it's weird.
5423460	5427820	Funny faces, okay, so in the game of Balderdash,
5427820	5428900	what would happen here?
5428900	5430540	Wait, oh, wait, I'm sorry, Brandon, wait.
5430540	5431740	You didn't have to ask me.
5431740	5432940	Well, yeah, I mean.
5432940	5436460	No, no, what's your guess?
5436460	5439020	Josh, Josh, Josh, you're picking funny faces, right?
5439020	5440220	Josh, okay.
5440220	5441700	What do you think the real answer is?
5441960	5443640	Brandon, what do you think is the real one?
5443640	5445120	I was gonna say penises.
5446000	5451000	On the overpass, okay, so that's, okay.
5451000	5453000	So I don't get any points
5453000	5454920	because some of you guessed the real one.
5454920	5456560	The real one is funny faces
5456560	5458880	on the outside of the window sheds.
5458880	5460920	Spencer, therefore, gets a point.
5460920	5462920	I get two points for getting the right answer,
5462920	5466160	and I get two points because two people voted for my answer.
5466160	5469160	Wait, oh, no, you get one point for guessing
5469160	5470000	the right answer.
5470020	5472580	I get two points who guessed the real answer.
5472580	5475180	Two points to players who guessed the real answer.
5477980	5479620	I'm reading it right off the thing.
5479620	5480780	Two points to players who guessed the right answer.
5480780	5482540	So you get a point for everyone who guesses yours.
5482540	5484060	So two people guessed yours.
5484060	5485660	So you're getting a total of three points.
5485660	5488440	Because I did the fallacies on the overpass.
5488440	5489280	Oh, oh.
5495140	5498140	Spencer just left, ran off stage.
5498140	5498980	He's lost his mind.
5499040	5501520	He's back on stage, rolled on stage.
5501520	5504000	Fire rolled on stage, and he's back to the chair,
5504000	5506000	which did not roll away.
5506000	5506840	He stuck the landing.
5506840	5508160	I hope I win now.
5508160	5512360	So that's a total of, yeah, I can't remember.
5512360	5513200	Four points.
5513200	5514360	Okay.
5514360	5516120	Did anyone else win points?
5516120	5518720	Yeah, some other people won some points because...
5518720	5522120	Yeah, you got two points for getting the right answer.
5522120	5523200	Right?
5523200	5524680	God damn it.
5524680	5525520	It's too hard.
5525520	5526340	Points are fun.
5526360	5529240	You could just do the rounds without keeping score.
5529240	5531400	Well, yeah, but that's not fun, right?
5531400	5532600	I mean, it's all relative.
5532600	5534000	Well, it's funner than this.
5537000	5538920	We could eat bowls of shit and be funny.
5538920	5540160	That's not, wait a minute.
5540160	5541880	I'm a fun stickler.
5545880	5547400	Wait, wake up, Harmon.
5547400	5549880	I don't know how Doug Benson does on his show.
5549880	5551040	Yeah, I guess I was just thinking
5551040	5552760	if we did enough rounds.
5552760	5554280	But then I was, it's just like,
5554340	5557260	I wouldn't wish this job on anyone.
5557260	5558300	This is awful.
5558300	5559500	It's really hard to do.
5559500	5561900	Yeah, this job is Balderdash.
5561900	5564060	Oh, that's why it's the dasher.
5564060	5565220	I just got that.
5565220	5568820	All right, so Spencer won and somebody else got points.
5568820	5572340	So I should have ran around my answer.
5572340	5574820	We could do another round.
5574820	5577100	I mean, you don't seem to want to, so that's fine.
5577100	5580260	I'm just worried about, I have two hats on.
5580260	5582340	One is a terrible Balderdash dealer,
5582400	5584440	and then the other is a terrible podcast host.
5584440	5586440	Yeah.
5586440	5589600	I feel like I'm making my, the two of them
5589600	5592560	are losing to each other.
5592560	5595800	And yeah, and we're all losing to Doug Benson.
5595800	5598560	It feels like choosing a holiday game that ends in arguments
5598560	5601280	might not have been the best.
5601280	5603320	But talking about politics was going so well.
5603320	5608440	I think you bet you could fix it all.
5608440	5611020	Can we give you, we stall just a little bit,
5611040	5614800	maybe ask Ben where we're going in terms of education.
5614800	5619120	You mean while Andy Dick does two minutes, or do you mean?
5619120	5620760	While you get your cards together,
5620760	5622660	because we don't know what that, what's
5622660	5625440	the uptick on the way of getting out of this conversation
5625440	5627940	that we had with you earlier that's sort of like,
5627940	5628680	what should we expect?
5632440	5636640	Yeah, that ain't nearly as good, Andy Dick.
5636640	5637480	Is there a camera?
5637480	5638800	I thought I heard my name.
5638800	5640680	No, you did.
5641140	5642460	I mean, am I early or late?
5642460	5644540	You're just a little early, you're just a little early.
5644540	5645800	But you had all the instruments.
5645800	5647340	You did have the right instruments.
5650580	5652860	I could have sworn we said two hangers, Andy Dick.
5652860	5656300	One hanger, Andy Dick is who we're working with right now.
5656300	5657540	Jesus.
5657540	5660060	OK, yeah, tell us, tell us, tell us, tell us.
5660060	5661780	Give us a little future.
5661780	5664260	So give you an example.
5664260	5666860	So whenever it was now on our third class of undergrads,
5666860	5668460	so it started this past September.
5668460	5671320	And where are the first one and two classes?
5671320	5672880	This semester, they're in Seoul.
5672880	5674480	Next semester, they're going to Hyderabad.
5674480	5676080	Awesome.
5676080	5681320	And for this third class, we received more applications,
5681320	5684040	third class ever, than Dartmouth or MIT did.
5684040	5685680	So give me, what's the ballpark on that?
5685680	5688600	20,400 applications from 179 countries.
5688600	5690680	And how many people are you going to take?
5690680	5695240	We took last year just under 2%, which actually shows
5695240	5697640	that you can be the most selective university
5697700	5700460	in the country and the most economically diverse
5700460	5703100	without trying.
5703100	5703980	That wasn't the goal.
5703980	5705860	It was just we stopped discriminating.
5705860	5707460	Do you have scholarships?
5707460	5709940	Yeah, 80% of our students are in some form or financial.
5709940	5711340	That's pretty amazing.
5711340	5712500	It's pretty amazing.
5712500	5713820	So what do you hope?
5713820	5716260	What is your biggest dream with all of this?
5716260	5718220	Would you want a brick and mortar one day?
5718220	5719420	No, no.
5719420	5722660	My biggest dream is that other universities
5722660	5724260	are forced to follow.
5724260	5727020	Because what we've shown, third party
5727120	5729640	assessed our students and showed that what our students
5729640	5732200	have been able to accomplish in eight months,
5732200	5734000	no university has been able to demonstrate
5734000	5736640	that they can get their students to accomplish in four years.
5736640	5740000	And that's on critical thinking, problem solving, reasoning,
5740000	5741200	and communication skills.
5741200	5744040	Do you have any sort of endowment program?
5744040	5751040	We have endowment, but it will take a long time to realize.
5751120	5753440	So right now, we're doing a lot of fundraising
5753440	5756360	to enable all those scholarships.
5756360	5759140	And it's hard work.
5759140	5760620	Yeah, thanks for doing that.
5760620	5763740	Well, that sounds like Andy Dick.
5763740	5764860	Where are you?
5764860	5766180	No, no, no, no, no.
5766180	5767300	Wait, hold on to Andy Dick.
5767300	5768940	Hold on, Andy Dick.
5768940	5769820	Hold your Andy Dick.
5769820	5772380	Stroke it, but hold it.
5772380	5773020	Love it.
5773020	5774060	It's our fault.
5774060	5777140	It sounds a lot to me like the narrative is subjective,
5777140	5783620	as it is in the category of picking marvelous movies
5783620	5784860	in Balderdash.
5784880	5789680	I'd like you to each take one of these empty Balderdash cards.
5789680	5795560	And I'd like you to try to convince each other what
5795560	5801160	the plot synopsis would be for a marvelous movie entitled
5801160	5805240	San Diego, I Love You.
5805240	5808800	Two minutes of Andy Dick will happen during your writing.
5808800	5809300	Yeah.
5814920	5816660	Yeah, I saw this in Germany once.
5816660	5817320	It was amazing.
5828120	5829320	Yeah.
5829320	5830560	Oh, don't hurt yourself.
5830560	5832720	Well, we'll get somebody to help you next time.
5832720	5833220	Sorry.
5839560	5840840	When does the time start?
5840840	5842120	It started, yeah.
5842120	5843520	Tell me when we're at 30.
