start	end	text
2588800	2591800	and prove that it's hard to Shrob things right.
2591800	2593800	Why don't you just read one of my...
2593800	2594800	Just tweet a tweet.
2594800	2597800	Hey, everybody, come and watch Harmon Town.
2597800	2599800	Sounds perfect.
2600800	2604800	Oh, are you going to be at Harmon Town?
2604800	2605800	Yes.
2605800	2607800	Now, is that him doing it wrong, or is it you?
2607800	2608800	I was trying to.
2608800	2609800	Yeah, that's doing it wrong.
2609800	2610800	That's not a...
2610800	2611800	That was bad, right?
2611800	2612800	Not to put you under too much pressure,
2612800	2614800	but can you now Spencer tweet something
2614800	2616800	and you do it right just to show it?
2616800	2618800	Spencer, fight on the Spencer tweet
2618800	2620800	and then Shrobs and then Shrob it.
2620800	2621800	I'm very...
2621800	2622800	It depends.
2622800	2623800	Sure, I'll try it.
2623800	2624800	Spencer.
2624800	2628800	Hey, look, I just got this new stack of Betamax tapes.
2630800	2632800	Did you get any Beta Minis?
2633800	2635800	There you go.
2635800	2636800	Do you see the difference?
2636800	2638800	Yeah, that's pretty good.
2638800	2640800	Yeah, but somebody might extrapolate from that
2640800	2645800	and go, oh, I get it, so you need to blah, blah, blah.
2645800	2651800	I think all you're saying is people try to be...
2651800	2655800	They try to reduce nuance to formula and it doesn't work.
2655800	2656800	I don't know.
2656800	2657800	They just don't know how to do it, right?
2657800	2659800	It's about timing and it's about...
2659800	2662800	It's picking the right tweet.
2662800	2665800	I'm a watch and wait predator.
2667800	2669800	You're like a jaguar on a limb.
2669800	2670800	Correct.
2670800	2671800	You pounce.
2671800	2672800	Can we get a T-shirt?
2672800	2673800	Yeah, you stalk and pray.
2673800	2675800	You can't just do anything.
2675800	2678800	Rob Shrob, watch and wait predator.
2678800	2680800	Well, I can't control my fans, Shrob.
2680800	2683800	However, I can control myself.
2683800	2684800	So I will say to you,
2684800	2686800	thank you for bringing the iPad back.
2687800	2694800	You established that you weren't using it anyway, so it is...
2694800	2695800	Which is kind of cheap.
2695800	2697800	I appreciate you bringing it back.
2697800	2700800	Otherwise, I would feel a little back because I just want you to be happy
2700800	2705800	and I would do anything to ensure that you keep coming back to the show
2705800	2710800	because it's been very helpful to me going through a transitional phase of my own.
2710800	2711800	I like having you here.
2711800	2714800	I've been a good friend of mine for a very long time.
2715800	2721800	If anything were to happen to either of us without me having expressed that,
2721800	2722800	it would be...
2722800	2725800	I don't know why I have to do this cadence where I'm like Richard Lewis
2725800	2726800	when I'm expressing affection.
2726800	2727800	Ira Glass.
2727800	2729800	But, you know...
2729800	2731800	He does that?
2731800	2737800	So for me, I riffed the phrase cheapy peepy.
2737800	2738800	It was insensitive.
2738800	2745800	And it's reductivist.
2745800	2747800	It's sexist.
2747800	2753800	And it's been now co-opted by some of the worst kinds of people,
2753800	2756800	people who like to see others feel pain.
2756800	2758800	A basket of deplorables.
2758800	2763800	I can't think of a worse word to apply to another human being, period.
2763800	2766800	Because it's so false.
2767800	2772800	I think of you as a very magnanimous, tranamus.
2772800	2774800	So you like that? You like that?
2774800	2775800	Thank you David.
2775800	2777800	Let's make that the new meme.
2777800	2779800	Remember when Harris Whittles...
2779800	2781800	Harris Whittles did...
2781800	2783800	There was a row...
2783800	2784800	It wasn't really a row...
2784800	2789800	You had a birthday and you had people that you like perform on your birthday
2789800	2792800	and you showed some stuff that you're proud of, like old shit.
2793800	2795800	It was kind of like the beginning of Harmontown.
2795800	2797800	Because you went up and you...
2797800	2799800	Did I go up even? I don't think I went up.
2799800	2801800	Yeah, you did.
2801800	2802800	Did I?
2802800	2803800	Yeah.
2803800	2804800	What did I do?
2804800	2808800	Well, you commented that Sarah Silverman was there, back...
2808800	2812800	It was Camille, Harris, Sarah, and you.
2812800	2813800	You closed it.
2813800	2814800	Was I a dick to Sarah?
2814800	2815800	No, no, no, no, no.
2815800	2816800	We hung up backstage, right?
2816800	2817800	Yeah, yeah, yeah.
2817800	2820800	You just said, I didn't know Sarah was gonna...
2820800	2822800	I would be following Sarah Silverman here.
2822800	2824800	It was like that, you know? I don't know.
2824800	2826800	Well, anyway, Harris did...
2826800	2830800	Harris's set was really funny because he went up and said,
2830800	2834800	I'm not gonna roast Rob because Rob's very sensitive.
2834800	2836800	You know, joke writers go to negative plays,
2836800	2839800	so like roast jokes are the funniest jokes.
2839800	2843800	But Rob's a very sensitive person, so I'm just gonna do...
2843800	2847800	I'm gonna try to roast Rob, but in a positive way.
2847800	2850800	And then he did a whole set of just jokes about,
2850800	2854800	Rob is such a good person and blah, blah, blah.
2854800	2859800	It was really funny because it was actually even, to me,
2859800	2863800	even more abusive because he was calling you a pussy
2863800	2868800	in a gigantic general sense and making a big show
2868800	2871800	of a kid gloving you, which is actually a great way
2871800	2874800	to hurt someone very deeply.
2875800	2877800	Yeah, he wasn't...
2877800	2880800	He didn't say anything untrue.
2882800	2884800	Does anybody own the tape of the roast for your birthday,
2884800	2885800	Dan, that we did?
2885800	2886800	I don't know.
2886800	2888800	At that Armenian restaurant in the valley?
2888800	2889800	I don't know.
2889800	2891800	My memory of that was that it was the funniest thing
2891800	2894800	that's ever happened, but I'm sure it's not.
2894800	2895800	Yeah, I'm sure it's not.
2895800	2898800	Comedy doesn't age well, but what was funny about it,
2898800	2900800	which is the thing that we do remember is that I turned 30,
2900800	2903800	we had a roast, and we specifically were like,
2903800	2905800	well, what if no one shows up?
2905800	2907800	We're like, well, why do we want anyone to show up?
2907800	2911800	All we want to do is have a dais.
2911800	2912800	We don't care.
2912800	2918800	So it was like three plus ones, like wives, husbands,
2918800	2922800	girlfriends, who had to sit there next to a salad bar
2922800	2927800	in the back of the Serbian restaurant and watch 10 guys
2927800	2930800	just piss themselves laughing while they,
2930800	2932800	for no reason at all, into a microphone
2932800	2935800	because there was no one to address except each other.
2935800	2943800	And facing an empty room just did roast jokes about Dan.
2943800	2946800	It was a roast of Dan Harmon, but as is the tradition,
2946800	2951800	everyone just did one Dan Harmon joke and then ripped everybody else.
2951800	2954800	Yeah, it's really fun.
2954800	2955800	Does that tape exist?
2955800	2957800	Do we know if anybody has that?
2957800	2958800	I don't know.
2958800	2960800	I have to imagine that if it exists,
2960800	2965800	it's filled with homophobia and racism and things that don't age well
2965800	2970800	because not only is it a roast, but it's a roast from 15 years ago,
2970800	2972800	and it wasn't made for television.
2972800	2975800	So I'm sure if we found it for our own purposes.
2975800	2978800	I'm not saying we released this to the general public.
2978800	2982800	I'm saying, do we have the courage to watch this together?
2982800	2984800	That was a symptom of my disease that you're like,
2984800	2986800	I wonder if that tape exists that I'm immediately leaping to.
2986800	2987800	The world would hate it.
2987800	2989800	They're like, well, that's not about the world.
2989800	2990800	It's about our friendship.
2990800	2992800	We could watch it and then burn it in a trash can afterwards.
2992800	2996800	Yeah, or just keep it and wait until it's funny again in 50 years
2996800	2999800	when people are so equal and free that everyone's like,
2999800	3001800	that is hysterical.
3001800	3004800	So that's what you called a gay joke.
3004800	3006800	So the joke was just that everyone was gay,
3006800	3008800	and then it turned out to be true.
3008800	3010800	I get it.
3010800	3011800	You're joking about Chris Tomlin.
3011800	3013800	He's like, yeah, Chris Tomlin, Dan had a joke.
3013800	3016800	Chris Tomlin's bad with the ladies.
3016800	3018800	Chris, we have all of our friends.
3018800	3020800	We have a bedding pool going on.
3020800	3023800	What's going to last longer, your virginity or Saturn?
3029800	3030800	I saw A Quiet Place.
3030800	3032800	You hear about this Quiet Place movie?
3032800	3035800	I heard about it, but then I forgot about what it's about.
3035800	3036800	What is it?
3036800	3038800	It's about A Quiet Place.
3038800	3039800	Thank you, Spencer.
3039800	3041800	There's like, I'm right there.
3041800	3042800	It's in like, like, I don't know.
3042800	3043800	I think it's like 20.
3043800	3045800	It's like, it's like in five years.
3045800	3047800	Oh, this is just quiet.
3047800	3049800	This is Dunder Mifflin guy.
3049800	3052800	If you make a sound, you get eaten by the ladies.
3052800	3055800	So the first, like, half hour of it is...
3055800	3056800	Sign language.
3056800	3057800	...silented sign language and whispering.
3057800	3058800	And it's really effective.
3058800	3059800	It's really...
3059800	3062800	I really enjoyed it quite a bit.
3062800	3066800	So I want to ask a question about it as a sci-fi horror fan.
3066800	3068800	And as a big rules guy.
3068800	3071800	You know, we talked a lot about zombie movies with Kirkman.
3072800	3077800	And I'm not going to say if the answer is yes.
3077800	3079800	Oh, the movie sucks or whatever.
3079800	3083800	But I just like, what I will do is throw a parade if the answer is no.
3083800	3087800	Are there inconsistencies in the rules of these things?
3087800	3091800	Like a lot of times in movies like that where there's rules that are so clear cut.
3091800	3096800	It's like, is there a scene where the person is like in the corner and it's like...
3096800	3102800	You know, the Foley person is like making their breath dramatic.
3102800	3103800	But it's like, well, come on.
3103800	3108800	You did a whole scene earlier about how literally a pin dropping could have brought them.
3108800	3110800	I thought it would...
3110800	3115800	You might watch it and go, hey, Shrob, I can hear her breathing.
3115800	3118800	You know, I thought it was very consistent.
3118800	3125800	I thought it was a very simple rule to this creature that you make any noise.
3125800	3131800	I mean, they spend a long time setting up the world before they ever introduce the other thing.
3131800	3134800	It's like they're walking around barefoot.
3134800	3139800	They have like these pre-made sand paths.
3139800	3144800	So they're not like stepping on twigs and going through the forest and stuff.
3144800	3150800	And it's just, it is a great monster that's new, which I really like.
3150800	3153800	Do you get to see him before the...
3153800	3154800	Yeah, you get to see...
3154800	3156800	Yeah, spoiler probably.
3156800	3158800	A decent look at him, you know.
3158800	3162800	Is it true, Rob, that you've been asked to make a sequel to it called Don't Make a Peepy?
3166800	3167800	Is there...
3167800	3169800	If I started crying right now, would you feel bad?
3169800	3170800	That would be awesome.
3170800	3171800	Would you laugh?
3171800	3172800	I'd laugh.
3172800	3173800	I'm just curious.
3173800	3174800	It's more...
3174800	3175800	It says more about you.
3175800	3176800	Well, I can't wait to see it.
3176800	3177800	I mean, I love...
3177800	3178800	It's really good.
3178800	3180800	I saw Isle of Dogs.
3180800	3181800	Stop.
3182800	3184800	Oh, that's Wes Anderson.
3184800	3185800	Yeah.
3185800	3186800	Yeah.
3186800	3187800	I kind of agree with...
3187800	3192800	I can't remember if it was Lauren Duka or like tweeted like, well, I want to see a Wes Anderson
3192800	3193800	movie about animals, but...
3193800	3196800	And then a list of like, are you...
3196800	3197800	Is there going to be...
3197800	3201800	I mean, it just seems like a setup for a fucking heartbreak.
3201800	3204800	No, there's...
3204800	3205800	It's a really good...
3205800	3207800	I really liked it a lot.
3207800	3213520	I think you as a Starburnt co-owner might want to check it out because it's...
3213520	3217800	I thought it was just beautifully designed and it...
3217800	3221240	There's some off-putting stuff, you know, with Dog.
3221240	3222920	I just am very sensitive to that.
3222920	3223920	So...
3223920	3224920	But I think it's done...
3224920	3225920	Is it animation?
3225920	3226920	Yeah.
3226920	3227920	It's stop motion animation.
3227920	3228920	Yeah.
3228920	3236680	And they do a bunch of stuff up front that I kind of was like, ugh, god, oof.
3236680	3238440	And I think they're saying like, this...
3238440	3242200	If you brought kids to this, you should probably take them out, you know, because it's...
3242200	3245120	But the voice talent is great.
3245120	3247560	I just think it's a beautiful, well-designed film.
3247560	3250320	I love the Wes Anderson loves stop motion.
3250320	3251920	Is it literally stop motion or is it...
3251920	3252920	Yeah.
3252920	3253920	Yeah.
3253920	3254920	That's great.
3254920	3255920	It...
3255920	3256920	I mean, like the fur is all moving.
3256920	3257920	It looks clunky.
3257920	3258920	I mean, like, it's like...
3258920	3262600	I don't know if you saw the Mr. Fox movie that he did.
3263600	3268720	I can now admit that I haven't seen it yet because the guy I would have offended that
3268720	3273120	I would have been working with, I think, now has to...
3273120	3279320	The movie Tike is doing for us, the Bubbles movie.
3279320	3280320	It's co-director.
3280320	3282600	It was the co-director of Mr. Fox.
3282600	3285600	I haven't seen Mr. Fantastic Fox, man.
3285600	3287840	I've never seen it.
3287840	3288840	That one's fun, too.
3289600	3292960	I love stop motion animation.
3292960	3294200	I just love the model building.
3294200	3296520	I think it's just really great.
3296520	3297520	It's amazing.
3297520	3306440	Speaking of segues, the reason why Tike Waititi, world's most sought after director, of course
3306440	3308600	his next movie is for me.
3308600	3315040	Well, after a quick hop over to Prague where he's going to make his amazing Hitler movie,
3315040	3317040	but he's going to...
3317040	3318800	It's called The Amazing Hitler Movie?
3319760	3322480	I think it's going to be truly...
3322480	3326360	It's going to be pretty...
3326360	3333160	His description of the movie, to me, made me really jealous for the first time in a
3333160	3337120	long time of another guy my age.
3337120	3341000	I was just like, God, you're just fucking doing what you want.
3341000	3347040	It really made me spiritually jealous as opposed to, oh, he has a Tesla.
3347800	3351320	I was like, ah, fuck, I'm creatively jealous of someone.
3351320	3355440	You just finished your Thor movie and now you're going to go make this fucking thing.
3355440	3357480	I think people are going to be blown away by it.
3357480	3362080	Then he's going to do our Michael Jackson monkey movie over here.
3362080	3364720	I know that chimpanzees are apes, not monkeys.
3364720	3367040	Put your fucking life up your ass.
3367040	3369160	Oh, man.
3369160	3370160	Write us in...
3370160	3373880	Until a shitty veterinarian has to cut it out and see how you feel.
3373880	3376920	Write us in if chimpanzees aren't monkeys.
3377800	3379680	Write us in on the election.
3379680	3382480	The problem is that they look exactly like monkeys.
3382480	3385080	Yeah, let's just call them all monkeys for Christ's sake.
3385080	3386480	Like you didn't know what I meant.
3386480	3388680	Yeah, like you didn't know what I meant.
3388680	3391400	Why is language so living?
3391400	3392560	Exactly.
3392560	3399720	But we're getting evicted by this piece of shit studio, Starburns.
3399720	3402880	I don't know who's running this fucking place, but...
3402880	3407320	We're leaving Starburns Castle and we mentioned it last week.
3407320	3411840	Yeah, and if you can't hear the silent cries of the audience we're not allowed to have
3411840	3417600	in here, believe me, they're happening in the ether with that ghost bee from our second
3417600	3418600	sketch.
3418600	3419600	What's the next step for us?
3419600	3420840	I'm kind of excited about it.
3420840	3426600	We toured a place, I don't know, I don't want to speak out of school, so we went over there
3426600	3427600	and looked at it.
3427600	3429200	Is this the one kind of downtown-ish-ish?
3429200	3430200	Yeah.
3430200	3431200	It's kind of downtown-ish-ish.
3431200	3434200	I met with an agent and he's like, if you guys need a new space, there's this place
3434200	3435200	and it's the same place.
3435200	3436200	Okay, yeah.
3436200	3437200	I mean...
3437200	3438200	Oh, it's popping off.
3438200	3440080	I don't know why it would be secret, but just in case, I don't want to...
3440080	3441080	It's called...
3441080	3442080	It rhymes with...
3442080	3443080	No, it doesn't.
3443080	3444080	It rhymes with Maples Mentor.
3444080	3445080	It doesn't.
3445080	3446080	He's lying.
3446080	3447080	It's the Staples Center.
3447080	3448080	We're going to the Staples Center.
3448080	3449080	He's lying.
3449080	3450080	It's not that...
3450080	3451280	We haven't locked it down yet and don't say Staples Center yet.
3451280	3456160	I think that our LA fans will be excited, would be excited to be able to come see us
3456160	3458360	even if it was in a shit hole.
3458360	3460960	This place is not a shit hole.
3460960	3467000	It's really nice and it seems like it's run by good people.
3467000	3477280	I think our next home very likely will be a rebirth of this show as not what it was
3477280	3478280	at Meltdown.
3478280	3479280	I knew...
3479280	3483480	It's like we were something at Meltdown, then we came here and we're kind of building to
3483480	3487960	God knows what and then collapsed into this cocoon phase where we found out we don't care
3487960	3493660	if anyone is in the audience, which is a cool thing to find out, but the reason it's
3493660	3498360	cool is because it allows you to miss the audience and then maybe we can now go in front
3498360	3500720	of an audience again and not be...
3500720	3503820	I won't be as fucking...
3503820	3510000	Maybe I can be a little more Spalding Grey, a little less...
3510000	3514480	Speaking of audiences, Dan, while I remember this, we have to talk about...
3514480	3515920	We're doing a show in Boston.
3515920	3516920	Oh shit.
3516920	3520440	Friday, June 22nd will be the awesome Wilbur Theater.
3520440	3524240	We're going to be at the Wicked Retarded Fium.
3524240	3530280	The show's going to be a Wicked Pisser.
3530280	3533040	It's probably going to be...
3533040	3538080	The Boston Herald is calling it the most retarded show coming to...
3538080	3541640	And that publication, they used that phrase and they mean good.
3541640	3545480	Yeah, they rated it on one to five Retarded people.
3546480	3549000	This has five Retarded people on it.
3549000	3550640	It's a five Retarded show.
3550640	3551640	It's going to be Wicked.
3551640	3552640	It'll probably be some Pisser.
3552640	3557320	There's going to be lobster rolls and it's going to be good.
3557320	3560120	I played the Wilbur Theater before.
3560120	3561120	It's an awesome theater.
3561120	3563200	It's a really, really fun venue.
3563200	3565520	Have we been at the Wilbur with this show?
3565520	3566520	No.
3566520	3568040	Where were we when we went to Boston last?
3568040	3572240	That was on our tour and Adam Goldberg's brother came up.
3572240	3574600	We were in Somerville.
3574720	3576720	We were at Jay's Laughs station.
3576720	3578720	So we've never been in Boston proper?
3578720	3579720	Prappa.
3579720	3580720	Prappa?
3580720	3582120	We've never been in Boston Retarded?
3582120	3586160	No, we were not Wicked or a Pisser.
3586160	3589760	So we could get beaten up or achieve independence?
3589760	3590760	Or both.
3590760	3593160	Or, yeah, probably both.
3593160	3595400	Or asked to share in casual racism.
3597800	3602360	So come see us and kill us at the Boston Wilbur Theater on Friday, June 22nd.
3602360	3603960	You've got to eat that mic, you fucking...
3603960	3604960	So Long Island...
3604960	3605960	Wicked retards.
3606960	3607960	Don't.
3607960	3608960	Don't.
3608960	3612960	My sister's retarded with a hard R, so...
3612960	3617840	Also, we're going to be in Long Island somewhere at the Aviation Museum.
3617840	3618840	What the fuck is it?
3618840	3620800	We're going to be in the air.
3620800	3624400	The 23rd, we're going to be in Long Island and it's...
3624400	3626600	Google Harmentown, Long Island, Ticketmaster.
3626600	3630960	Go online and do it like a regular person, you pieces of garbage.
3630960	3632960	Yeah, that'll be wrong.
3633960	3635960	Yeah, they're not pieces of garbage.
3635960	3636960	And that's because...
3636960	3638960	Wait, what is it?
3638960	3639960	Why are we...
3639960	3640960	I don't mean to say, why are we doing that?
3640960	3641960	Like, we shouldn't be.
3641960	3642960	I just mean like...
3642960	3643960	We're at an aviation...
3643960	3644960	Oh, we're doing...
3644960	3645960	I think it's a charity thing.
3645960	3646960	We're going to do that...
3646960	3647960	Is that a charity thing?
3647960	3648960	That planetarium thing.
3648960	3650960	Oh, the planetarium thing at the Aviation Flim Flam.
3650960	3652960	It's a charity event for what?
3653960	3654960	Stem cell research.
3654960	3655960	No.
3657960	3660960	Science, technology, education, and medicine.
3661960	3665960	We're doing a benefit show.
3665960	3668960	It's all the stem cells you can eat.
3668960	3671960	Better find out before the show.
3671960	3674960	We're pretty sure it's about science, education, and women.
3674960	3676960	Those are ingredients we like.
3676960	3677960	It's like a casserole.
3677960	3678960	Like, you can't go too wrong.
3678960	3682960	And it's aviation themed, so we can actually talk about going to the moon finally.
3682960	3684960	Also, we get to do a show in a planetarium.
3684960	3685960	Yeah.
3685960	3689960	Are we going to turn the lights down and play Pink Floyd and shit and look at the ceiling?
3689960	3690960	We will, yeah.
3690960	3694960	And we're going to bring pot brownies.
3695960	3699960	Let's get there early and work with the lighting crew and see what we can do.
3699960	3703960	We're going to get there early and work with the lighting crew and see what we can do.
3703960	3707960	And also, if you're naked, Rob Shrob has some t-shirts.
3708960	3709960	Oh, yeah.
3710960	3714960	Tea Public, Rob Shrob, Shrob Home Video.
3715960	3718960	New t-shirt design came out last week.
3718960	3719960	Yeah, what does that say?
3719960	3721960	Chinese murder van.
3722960	3724960	Really burning up the charts.
3724960	3727960	All the proceeds go to purchase a Chinese murder van.
3727960	3728960	Right.
3728960	3729960	We want to support that.
3729960	3731960	We're going to get rid of the mean streets of Burbank.
3731960	3736960	All proceeds go to benefiting the people in Boston who are truly wicked retarded.
3736960	3737960	Right.
3737960	3746960	It's kind of like that charity where they rescue dogs from countries where they eat them.
3746960	3748960	But we're going to China.
3748960	3751960	We want to buy a van, one of these Chinese murder vans.
3751960	3752960	Right.
3752960	3754960	We just want to take it off the streets of China.
3754960	3758960	We're going to fucking pimp it out and roll it up and down the streets of Burbank.
3758960	3762960	It's going to be a new show on The Learning Channel called Pimp My Chinese Murder Van.
3762960	3763960	Right.
3763960	3767960	Everybody knows there's a constitutional right to own a Chinese murder van.
3767960	3769960	Because in America, it's called an ambulance.
3769960	3770960	Right.
3771960	3773960	It's called a veterinarian van.
3773960	3774960	Yeah.
3774960	3775960	Rick.
3775960	3776960	Rick Ashley.
3776960	3777960	Rick Ashley.
3777960	3778960	Who's that?
3778960	3780960	Who's Rick Ashley?
3780960	3782960	A symptom of your stroke.
3785960	3786960	Never get asked.
3786960	3787960	Never get asked.
3787960	3788960	Ask Ashley.
3788960	3789960	Yeah.
3789960	3790960	I mean, I know.
3790960	3791960	He's having a stroke.
3791960	3792960	Oh, no.
3792960	3795960	I always wondered when we were living in Milwaukee, I always wondered like, like, Shropp and I
3795960	3796960	would joke.
3796960	3797960	We were in our 20s.
3797960	3798960	Oh, we do.
3798960	3803960	Every once in a while, we'd allude to, as friends do, the image of us on a porch and rocking
3803960	3805960	chairs, drinking lemonade.
3805960	3806960	This is it.
3806960	3807960	Yeah.
3807960	3808960	But this is it.
3808960	3809960	This is it.
3809960	3812960	I mean, I'm looking at her image.
3812960	3815960	I think we could create beers and glasses.
3815960	3818960	I mean, this is what we would dress up as.
3818960	3819960	I like this, though.
3819960	3820960	This is good.
3820960	3821960	I like this porch.
3821960	3823960	I'm fine with living this long.
3823960	3824960	Yeah.
3824960	3825960	What's the future of this beard, Robbie?
3825960	3827960	Are you going to just do its own thing?
3827960	3832960	I got my first, I don't know, from Kate.
3832960	3835960	Oh, which is probably the death of it.
