start	end	text
1356800	1361800	Like, you're being lazy, and you're being condescending,
1361800	1363800	like, yeah, x-rays don't pick up inflammation.
1363800	1365800	I didn't ask if they did.
1365800	1367800	I asked if his stomach could be enlarged
1367800	1371800	because of inflammation, as opposed to a foreign object.
1371800	1374800	Do we think he ate a bowling ball?
1374800	1379800	I just think, just save my dog, save my dog.
1379800	1383800	So at the earliest absolute possibility,
1383800	1385800	a doctor called me on the phone then
1385800	1387800	after he stays there all night, and she goes,
1387800	1389800	yeah, the x-ray is stomach,
1389800	1391800	he's getting a little worse.
1391800	1393800	Stomach's getting, I don't know,
1394800	1397800	if there's something in there, it's not moving.
1397800	1400800	So like, maybe there's nothing in there.
1400800	1403800	Maybe it's inflammation.
1403800	1406800	And I'm like, but I'm talking to doctors now,
1406800	1408800	and I'm like, okay, so if there's something in there,
1408800	1410800	like last time it was a clump of grass,
1410800	1412800	and it was moving real slow.
1412800	1414800	And he's like, yeah, if this is a foreign object,
1414800	1416800	and you said he eats a lot of foreign objects,
1416800	1418800	I said, yeah, he ate a clump of grass at one point.
1418800	1420800	But it's not movement.
1420800	1422800	The x-ray would show if he ate a baseball.
1423800	1428800	It wouldn't, I mean, so they give me three choices.
1430800	1432800	Endoscopy, and then there's another choice
1432800	1434800	that was like an endoscopy,
1434800	1436800	but it's like they put something down his nose or something.
1436800	1439800	And like, both of those choices involved
1439800	1443800	keeping him the way he was and getting more information,
1443800	1445800	which now that I know,
1445800	1448800	I made the horribleest, most fucking awful choice.
1448800	1450800	Like, I just, I wanna cry.
1451800	1454800	But they don't recommend anything.
1454800	1456800	You ask them, what do you recommend?
1456800	1458800	And they might as well say out loud,
1458800	1460800	well, I don't wanna get sued.
1460800	1461800	It's your dog.
1462800	1465800	Yeah, so this whole system is based on two things,
1465800	1467800	total disrespect for the layman
1467800	1470800	and total burden on the layman with any kind of fucking risk.
1472800	1474800	We think you're an idiot
1474800	1478800	because we went to two years of dog school or something.
1479800	1482800	But so there's that, which is true.
1482800	1484800	I'm two years dumber than you
1484800	1487800	or whatever the fucking associate's degree you have
1487800	1490800	that has you working at midnight at a veterinary hospital.
1490800	1493800	And anybody who's watching who's going like,
1493800	1495800	my cousin works at a veterinary hospital,
1495800	1497800	I'm a veterinarian, I'm in school,
1497800	1499800	take your personal story
1499800	1502800	and just shove it all the way up your fucking dumb ass.
1502800	1505800	Because the fact that something is connected to your life
1505800	1507800	doesn't mean that you're outraged
1507800	1508800	doesn't mean that you have anything
1508800	1510800	to contribute to the conversation.
1510800	1512800	Otherwise, every time people were stupid
1512800	1514800	or had to deal with stupid people,
1514800	1516800	I'd lose my fucking mind
1516800	1518800	because I'm a fucking expert in that, okay?
1518800	1519800	So shut the fuck up.
1519800	1521800	I don't care if you're a veterinarian
1521800	1522800	and you're a fan of the show
1522800	1524800	and you're disappointed in my fucking closed-minded shit.
1524800	1527800	It's closed-minded because I'm fucking upset.
1527800	1528800	Shut the fuck up.
1528800	1531800	Stick your whole life up your ass.
1531800	1532800	Stick it all the way up.
1532800	1534800	And I hope it hurts going in
1534800	1536800	and then don't thread it through your mouth
1536800	1539800	so that you have a cosmic experience.
1539800	1543800	I want you to stumble around your front yard
1543800	1545800	with bandages on your arms
1545800	1548800	where their IVs were staring drug-addled
1548800	1550800	into the fucking cosmos,
1550800	1553800	wondering if the sound of the lawnmower is a threat or not
1553800	1555800	because you're on so many painkillers
1555800	1557800	and you can't speak English.
1557800	1559800	I want you to just walk around for two weeks
1559800	1563800	wanting to lick a bandage on your stomach
1563800	1565800	that everyone keeps telling you not to
1565800	1568800	and then finally just like finally have to take
1568800	1572800	a big diamond-plated fucking serrated shit
1572800	1575800	out of your own head and your own life,
1575800	1577800	out of your stupid ass.
1577800	1580800	I'm in fucking pain and so is my dog, so shut up.
1580800	1581800	I fucking hate veterinarians.
1581800	1583800	I hate myself.
1583800	1584800	I hate...
1584800	1586800	I'm filled with hate.
1586800	1588800	And I went to my therapist and I'm like,
1588800	1590800	I'm filled with hate, okay?
1590800	1594800	I'm filled with rage and shame.
1594800	1597800	And she's like, well, do this.
1597800	1600800	And I'm like, okay.
1600800	1602800	And I cried a little.
1602800	1605800	She's like, oh, she says, yell at the chair
1605800	1607800	like Clint Eastwood.
1607800	1609800	I'll come sit next to you.
1609800	1611800	She's like, okay, the veterinarian's in the chair.
1611800	1612800	Go ahead and yell.
1612800	1614800	And I go, I'm not gonna yell.
1614800	1616800	I'm in therapy to stop yelling.
1616800	1618800	You fucking nuts.
1618800	1620800	And she's like, what?
1620800	1622800	No, you're not in therapy to stop yelling.
1622800	1625800	You're in therapy to handle your emotions.
1625800	1627800	Like, well, I'm not gonna...
1627800	1630800	You may think it's cute or therapeutic to yell,
1630800	1636800	but I'm not gonna yell.
1636800	1640800	Your office is in a fucking apartment building in Los Feliz.
1640800	1642800	There's a yoga class next door.
1642800	1644800	And she's like, well, let me check about that.
1644800	1647800	She goes, nope, no yoga class.
1647800	1648800	Did you just fart?
1648800	1649800	Was that the chair?
1649800	1653800	Yeah, I just farted, and it sounded really loud.
1653800	1655800	Was it really a fart?
1655800	1660800	Yeah, it was, and it was stinky, too.
1660800	1662800	Dan, what I want you to do right now,
1662800	1665800	is I want you to yell at Spencer's fart.
1665800	1666800	Well, I don't know where it is.
1666800	1667800	Oh, God, it's in my...
1667800	1670800	No.
1670800	1672800	And then she goes, you know who will really like it
1672800	1674800	is the psychiatrist upstairs.
1674800	1677800	Oh, the guy that used to be in your bigger office,
1677800	1679800	or is it now in your bigger office?
1679800	1681800	So she doesn't mind me yelling.
1681800	1684800	I talk to the chair, and I vent a lot of the stuff
1684800	1685800	that I just vented.
1685800	1688800	And then at a certain point, yeah, I guess if I want to,
1688800	1691800	I can go...
1691800	1693800	And I do that, and she's like, okay,
1693800	1697800	now talk about what's right underneath that.
1697800	1698800	She said, how do you feel?
1698800	1701800	I said, 1 32nd better.
1701800	1705800	Like, 1 32th.
1706800	1707800	And it's already filled back up.
1707800	1709800	But she's like, well, wait, what's underneath that?
1709800	1710800	Is there something else?
1710800	1714800	Because if it's not all rage, if doing that doesn't help,
1714800	1716800	that means that you got rid of the rage layer.
1716800	1717800	What's underneath there?
1717800	1719800	And she was right about that.
1719800	1722800	I don't think my therapist is a bad therapist.
1722800	1724800	Like, there was shame underneath there.
1724800	1730800	I feel shame because I have to take care of this animal.
1730800	1731800	That's my job.
1731800	1733800	The animal can't express itself.
1733800	1735800	I have one fucking job.
1735800	1739800	And I started explaining why I was ashamed of myself.
1739800	1741800	And I started weeping.
1741800	1743800	And then she's like, now how do you feel?
1743800	1745800	And I'm like, 2 30...
1745800	1748800	Now a total of 1 16th better.
1748800	1749800	All right.
1749800	1750800	And now it's filled back up.
1750800	1753800	And she's like, okay, let's go outside.
1753800	1754800	Uh-oh.
1754800	1756800	She kicked your ass?
1756800	1758800	She fucking beat the shit out of me.
1758800	1760800	She hit me with it.
1760800	1764800	And it was a they live John Carpenter style fight.
1764800	1766800	So it ended up...
1766800	1768800	I had to pay extra because it was long.
1768800	1771800	Yeah, I actually paid her extra to do that.
1771800	1773800	Put the sunglasses on.
1773800	1774800	No, she makes me.
1774800	1775800	I don't want to say makes me.
1775800	1776800	I did it.
1776800	1778800	Partly because I was like, you really think...
1778800	1779800	I bet you think...
1779800	1780800	I felt like...
1780800	1782800	I was like, game theory.
1782800	1785800	She thinks this is like Good Will Hunting.
1785800	1788800	Oh, Dan Harmon's afraid to walk up and down the sidewalk
1788800	1790800	in his neighborhood in front of Matt Bronger
1790800	1794800	and Amy Mann and Patton Oswalt and Edgar Wright
1794800	1796800	like getting their coffee.
1796800	1799800	And yeah, he's not...
1799800	1801800	John Hamm is getting a ham sandwich.
1801800	1803800	He's not going to do this in front of John Hamm.
1803800	1806800	And I'm like, fuck, I did whatever she did twice as much.
1806800	1808800	She's like wiggling her arms like noodle man
1808800	1813800	and like walking like the keep on trucking drawing by a crumb.
1813800	1815800	And I'm like, yeah, it's like silly walks.
1815800	1818800	Like I was just like, okay, so you walk silly.
1818800	1819800	She's like, you feel that?
1819800	1820800	You feel that?
1820800	1823800	I'm like, yeah, I don't know, man.
1823800	1824800	What was she trying to get you to feel in this moment?
1824800	1825800	I don't know.
1825800	1826800	Like it was like the energy.
1826800	1827800	There's energy in your body.
1827800	1828800	And there's like...
1828800	1829800	The idea was like...
1829800	1832800	Because I kept saying, I don't know where to put this rage.
1832800	1835800	Because I have a couple holes in my wallet home
1835800	1837800	from when Fiv was sick, the cat.
1837800	1840800	And because it's like there comes a point
1840800	1841800	where you don't know how to express.
1841800	1844800	Like you have rage and shame that you don't know
1844800	1845800	where to put it.
1845800	1847800	It seems like there is no...
1847800	1849800	Like I'm a very sheltered person.
1849800	1851800	Like I don't have a lot of feelings that I don't know
1851800	1854800	how to get rid of in a proper way.
1854800	1858800	But like intense levels of rage and shame above a certain voltage.
1858800	1859800	There's no...
1859800	1860800	It's just like...
1860800	1864800	And I was just like, yeah, I still don't...
1864800	1865800	You can feel it.
1865800	1869800	You feel it in your heart, behind your eyeballs, in your fists.
1869800	1874800	Like you feel like you want to beat something.
1874800	1875800	You want to kill.
1875800	1879800	What is your shame about that you let Nigel down?
1879800	1880800	Yeah.
1880800	1881800	By...
1881800	1883800	By hiring people to stab him?
1883800	1886800	Or before...
1886800	1890800	Do you feel responsible for why he got whatever he got?
1890800	1891800	No.
1891800	1892800	Because you found out it was what?
1892800	1893800	It wasn't...
1893800	1894800	He didn't eat something.
1894800	1895800	It was like an allergy or something.
1895800	1897800	He has a condition called IBD.
1897800	1901800	But you know, at this point, whatever.
1901800	1902800	Like he's...
1902800	1905800	The thing that he is sick at home with right now
1905800	1907800	is a fucking stab wound in his stomach.
1907800	1909800	It's not what he went in with.
1909800	1915800	What he went in with is apparently a condition called IBD.
1915800	1916800	I don't know why...
1916800	1917800	Irritable bowel disorder?
1917800	1919800	I don't know if that's what it stands for.
1919800	1922800	It's basically like allergies, food allergies.
1922800	1924800	Like they say he ate something
1924800	1927800	and I think it could build up for a year.
1927800	1930800	Like so it's just got to fuck around with his diet and stuff.
1930800	1932800	Like it's doubtful that he ate.
1932800	1934800	No, that's not true.
1934800	1938800	It's possible that he ate some grass that he ate last time
1938800	1941800	or that era is also milk thistle
1941800	1944800	or some species of fucking California kumquat
1944800	1947800	that he fucking like found in a backyard.
1947800	1950800	And like it's possible that he ate one thing
1950800	1952800	that like shocked his system immediately.
1952800	1957800	It's also possible that over a year of having a little bit of chicken
1957800	1962800	or snail corpse or whatever, you know,
1962800	1964800	it's like oh this food's got TBDs
1964800	1968800	and this food's got IBKs and like IBKs.
1968800	1971800	TBDs is good.
1971800	1973800	What should we call this disease?
1973800	1976800	Of course by the way, everyone's so full of advice too.
1976800	1979800	And it's just like I don't want to say
1979800	1981800	take your advice and shove it up your ass.
1981800	1984800	Like I just want you to observe things from my perspective.
1984800	1986800	When your dog eats a bunch of grass
1986800	1989800	and has to have it surgically removed from his intestines,
1989800	1993800	I think I've already heard by now
1993800	1997800	that dogs eat grass when they're sick to induce vomiting.
1997800	2001800	I've also heard that that's fucking horse shit
2001800	2005800	and that dogs that eat grass end up sick from it.
2005800	2007800	Please shut up now.
2007800	2010800	It doesn't change anything being told this stuff.
2010800	2015800	You're not really helping anybody because you had a sick dog once.
2015800	2018800	I don't mean you should be ashamed of yourself.
2018800	2022800	I just shut up.
2022800	2025800	It's a fucking dog that starts shaking and vomiting.
2025800	2028800	You take him into idiots who are smarter than you
2028800	2031800	and you're given a choice between three doors
2031800	2032800	and one has a scalpel on it.
2032800	2035800	You choose the scalpel and they cut him open and they go,
2035800	2036800	oh nothing, sorry.
2036800	2038800	Yeah, he's got food allergies.
2038800	2040800	Zip, zip, so, so, so.
2040800	2044800	And now the dog's on doggy painkillers
2044800	2048800	and you can't touch him without him crying
2048800	2051800	and you just have to spoon feed him
2051800	2056800	little pieces of dog food that he'll barely eat.
2056800	2059800	You give him little spoonfuls of grass.
2059800	2062800	And you have nothing to think about that entire time
2062800	2064800	except what you did wrong.
2064800	2066800	You can run from your mistakes, everything else,
2066800	2068800	and you can fix by playing Minecraft.
2068800	2070800	I had a dog that kept eating grass
2070800	2072800	and would not stop eating grass, loved grass.
2072800	2075800	Favorite thing in the world ate grass all day, all night
2075800	2078800	and was constantly bummed out and constantly puking.
2078800	2081800	It's like, hey, we'll let you sort this out.
2081800	2083800	You're an idiot.
2083800	2087800	Also, when that dog was little, because we got this dog in New York,
2087800	2091800	we would be in Central Park and favorite food?
2091800	2092800	Horse shit.
2092800	2096800	The fucking handsome cabs that would go to take married couples down the lane.
2096800	2099800	Yeah, Nigel and the giant horse apples.
2099800	2103800	And this dog just loved eating, just couldn't get enough horse shit.
2103800	2104800	Nigel and Harvey.
2104800	2106800	The dog seemed so happy
2106800	2109800	and we didn't, like, want to stop the dog from being happy
2109800	2111800	but it was really embarrassing.
2111800	2114800	It's like, what's your dog problem?
2114800	2116800	Nigel and Harvey, every morning,
2117800	2121800	they bark at the neighbor's cat, Dash,
2124800	2127800	the cute little black and white cat
2127800	2129800	that I never told my neighbors.
2129800	2131800	I accidentally caught in a humane trap
2131800	2134800	when I was trying to catch a raccoon that was eating all my dog food.
2134800	2135800	Wait, wait, sorry.
2135800	2136800	Go back.
2136800	2139800	I went over to my neighbor's house once and I was like,
2139800	2140800	oh, that's your cat.
2140800	2141800	And I was like, the thought balloon.
2141800	2144800	I was like, I caught your cat in the trap once and let it go.
2144800	2145800	There's a raccoon once.
2145800	2147800	Yeah, there was a raccoon coming to the doggy.
2147800	2148800	It still is.
2148800	2150800	You almost murdered the cat back.
2150800	2151800	It almost murdered it.
2151800	2152800	Definitely.
2152800	2156800	I certainly gave it the most miserable night of its life
2156800	2162800	depending on when it took the bait that was for a raccoon,
2162800	2164800	which is a bunch of dog food.
2164800	2166800	It got caught in a cage and it was a humane trap.
2166800	2167800	It wasn't going to hurt.
2167800	2170800	It just came out to the backyard like, I got my prey.
2170800	2172800	And it was, yeah, anyways,
2172800	2174800	a very adorable outdoor cat named Dash.
2174800	2177800	Also, a bad name for a cat, Dash,
2177800	2179800	if you can't get out of a fucking trap.
2179800	2180800	No, come on.
2180800	2182800	You think trap sense would be a part of...
2182800	2185800	Anyways, the dogs, the dogs, when I'm working out in the morning,
2185800	2187800	they bark at Dash.
2187800	2188800	Dash comes up and they're like,
2188800	2190800	I'm always making fun of it because I'm like,
2190800	2191800	at this point, what do you think?
2191800	2195800	Remember we were talking about, what are the dogs saying to the cat?
2195800	2197800	Well, I just realized what they're saying to the cat
2197800	2200800	because I'm talking to Allison, the dog sitter,
2201800	2204800	she's like, you know, they fucking,
2204800	2205800	they love going out in the front yard
2205800	2207800	because they know the cat shit's out there
2207800	2210800	and they race each other to the cat shit.
2210800	2213800	It turns out when the dogs are barking at the cat through the front window,
2213800	2216800	they're like, you only got the Wells Fargo wagon.
2218800	2220800	I hope I got the reasons from Fresno.
2225800	2227800	Is my how to draw bug here yet?
2227800	2229800	Make a nice juicy one for me.
2229800	2232800	Cynthia, they're all up in that cat shit.
2232800	2234800	Yeah, they run out to the spot where he shits
2234800	2237800	and they fight over it like raptors.
2237800	2239800	What's in that cat poo that's so delicious?
2239800	2242800	I think that dogs, because they smell so intensely,
2242800	2244800	you have to think, you do the backwards math and go,
2244800	2247800	that means that if they could smell shit,
2247800	2250800	which they surely can because we can.
2250800	2252800	But they smell the ingredients in there.
2252800	2253800	They have to...
2253800	2254800	They're super tasters.
2254800	2258800	God gave them noses that could smell
2260800	2265800	the concern of a poodle an hour away
2265800	2269800	or that can smell their way home to...
2269800	2273800	If they get trapped in a U-Haul or whatever the stories are,
2273800	2277800	they can smell a forest fire in Utah.
2277800	2280800	And so we can smell a turd.
2280800	2283800	So then God's like, well, they're going to go nuts about the turds.
2283800	2284800	They're going to just kill themselves.
2284800	2285800	Like their nose will explode.
2285800	2288800	So then he's like, well, I can't make their nose less sensitive.
2288800	2291800	I mean, I really want these things to live by their nose.
2291800	2295800	All right, well, I'll just make them love it.
2295800	2297800	So that's why when they meet each other, they're like,
2297800	2299800	let me check out that asshole.
2299800	2301800	Wow, you got one coming, don't you?
2301800	2303800	It's cresting. I can see it.
2303800	2305800	Barbara, Cody's dog came over.
2305800	2308800	By the way, Nigel's dog, he's got...
2308800	2311800	Dogs come home from surgery. They're constipated.
2311800	2314800	He constipated in air quotes because he just doesn't want to squat
2314800	2315800	to take the shit.
2315800	2317800	He's got a fucking knife wound in his stomach.
2317800	2323800	But long story short, he's got a fucking little diamond tip turd.
2323800	2326800	You can see it if you look.
2326800	2329800	And then Barbara, Cody's dog, comes over
2329800	2331800	and she's just like right up in that ass.
2331800	2333800	I'm like, well, there's a turd coming out.
2333800	2335800	Do dogs like other dog shit?
2335800	2337800	Yes, they do. They like shit.
2337800	2340800	I don't think I've ever seen a dog eat another dog's shit.
2340800	2342800	Oh, no, I don't...
2342800	2344800	Do dogs eat their own shit?
2344800	2347800	Dogs that were raised in puppy mills...
2347800	2349800	Dogs eat their own shit if they've...
2349800	2352800	That's a heavy sign of abuse because they...
2352800	2353800	They're hungry.
2353800	2356800	Well, because dogs don't like the shit where they eat.
2356800	2358800	So dogs that are forced to shit where they eat,
2358800	2361800	eat their shit, especially mother dogs,
2361800	2364800	to keep the puppy mill cage sanitary.
2364800	2365800	It's really sad.
2365800	2368800	If you get a dog that's eating its own shit
2368800	2371800	and that's a red flag,
2371800	2375800	it's learned that behavior or it's personally experienced trauma.
2375800	2378800	Let's get away from this animal shit and bring up Rob Schraub.
2378800	2380800	Rob Schraub, everybody.
2380800	2384800	You know what dogs like eating shit the most?
2384800	2386800	German Shepherds.
2386800	2388800	Rob Schraub to the stage, everybody.
2393800	2397800	Oh, my God.
2398800	2400800	Holy shit.
2400800	2403800	He's been un-cheapy peeping.
2403800	2405800	Can we end this now?
2405800	2408800	Can I be your friend now?
2408800	2410800	Can we be friends?
2410800	2412800	Can we be friends again?
2412800	2415800	What does that iPad say? Is there an inscription?
2418800	2421800	I love you. Love, Steve.
2424800	2425800	Wait, what?
2425800	2427800	Worth it.
2427800	2430800	When you order an iPad, you can fill out an inscription thing.
2430800	2432800	And it's free.
2432800	2435800	Why did it become I love you, love, Steve?
2435800	2437800	That smacks of...
2437800	2440800	There was a little redundancy thing there.
2440800	2444800	I filled out a joke and then Steve also did.
2444800	2445800	Right.
2445800	2448800	It's like if you put by Dan and then it's by Dan again
2448800	2450800	because it automatically puts that.
2450800	2452800	Yeah, I don't know why Steve did that.
2452800	2454800	Couldn't Steve have just written I love you?
2454800	2456800	He could have done a lot of different things.
2457800	2460800	Let's run through some other things Steve could have done.
2460800	2462800	He could have got a B8.
2462800	2464800	I have a question.
2464800	2466800	Have a B8.
2466800	2472800	Am I released from this fucking weight?
2472800	2474800	Can I have my life back?
2474800	2476800	That's something only you can answer.
2476800	2478800	Can you call off your dogs, your Twitter dogs
2478800	2480800	and your Instagram commenters?
2480800	2482800	Can you call them off, please,
2482800	2484800	now that I've given your property back?
2484800	2490800	Thank you for allowing me to try it out.
2490800	2491800	It says Dan sucks on it.
2491800	2492800	No, it doesn't.
2492800	2493800	Yeah, it does.
2493800	2494800	Don't even start.
2494800	2499800	I'm trying to end this cruel...
2499800	2503800	It says I actually am a cheapy peepy.
2503800	2504800	See, you know...
2504800	2505800	That's crazy.
2505800	2506800	Why would you even do that?
2506800	2507800	I didn't do that.
2507800	2510800	Well, we know you were the last person to own it.
2510800	2512800	Spencer, you know I don't like that word.
2512800	2513800	Stop it.
2514800	2517800	It is one word, and I want to...
2517800	2518800	It's two words.
2518800	2522800	It's one word, and I want this to be over with.
2522800	2526800	Will you please set me free?
2526800	2529800	Can you unshackle me with it?
2529800	2531800	Can you do that?
2531800	2533800	Is there some sort of ritual or some cleansing
2533800	2534800	that we can go through?
2534800	2535800	Can you unshackle me?
2535800	2537800	Can I get unshackled?
2537800	2541800	Because I'm famous for my control over my fans.
2541800	2543800	And my fans are famous for loving me.
2543800	2545800	And they do what you tell them to.
2545800	2547800	They're famous for listening to what you say
2547800	2548800	and agreeing with it.
2548800	2550800	But you're in kind of a quicksand, Shrob,
2550800	2554800	because people Shrob you all the time.
2554800	2555800	I don't mind that.
2555800	2558800	I actually like that because they always do it wrong,
2558800	2560800	and I find it entertaining.
2560800	2562800	It's hard to Shrob right.
2562800	2564800	It's hard to do Shrobing funny.
2564800	2566800	How do you Shrob wrong again?
2566800	2568800	Because I see it happening all the time.
2568800	2569800	Let's try it.
2569800	2570800	Shrob, tweet something.
2570800	2572800	No, I can't.
2572800	2574800	You got me too stoned before.
2574800	2575800	Just tweet something out.
2575800	2576800	No.
2576800	2578800	You don't have the right glasses to type.
2578800	2579800	Improvise it.
2579800	2581800	You don't have to actually type it.
2581800	2586800	Just like fire off a mental, like a vocal tweet right now.
2586800	2588800	And then we're going to try to Shrob it
