start	end	text
2627460	2629820	and it's all very argued about
2629820	2633340	and people are always amorphous and blurry about it.
2633340	2638020	While regimes change hands and cabinets switch around
2638020	2639340	and everybody has these arguments
2639340	2640780	and it's like, the things that don't change
2640860	2643780	are just these brick on brick buildings
2643780	2646340	and policies and things where people are separated
2646340	2648740	and people are alienated and people are fucked.
2650220	2653620	Yeah, and there's like a long track record
2653620	2657700	of other bad fascist dictators in other countries
2657700	2660340	but it's not always like explicitly,
2660340	2663260	we disagree with Hitler on five things.
2663260	2665380	There's other guys, there's Pinochet.
2665380	2668300	I would love to, I like to, this is my style.
2668300	2671140	I love to jump the gun on my Hitler comparisons.
2671140	2672260	That's just me.
2672260	2675060	I'm a gun jumper on the Hitler comparison.
2675060	2679660	I like to not wait until it's actually Hitler.
2679660	2681780	The early bird gets the Hitler.
2681780	2685860	I'd like to be wrong a couple times.
2685860	2687420	Oops, that guy wasn't Hitler.
2687420	2690740	He just hated Jews and wanted to be Senator.
2690740	2694380	Oh well, down the drain you go.
2694380	2696900	Anti-Semitic Senator that would have done great things
2696900	2697740	for health care.
2697740	2700820	Fuck you, you reminded me of Hitler, too early.
2700820	2703820	That's the worst thing anybody's said about me this hour.
2703820	2704660	Yeah.
2706340	2708460	All right, let's move into the fun things.
2708460	2710340	Rob, take it away.
2710340	2711500	Entertain us.
2714340	2716540	Or I'll rip you from the arms of your mother
2716540	2718700	and stick you in a fucking cage.
2718700	2721340	Why, what, what, what did I ever do?
2721340	2723820	Fucking entertain me, you're part of the show.
2724060	2726940	Ask me some questions.
2726940	2728660	Oh, what about Transformers?
2728660	2729860	What about soda?
2732460	2735100	I like soda.
2735100	2737980	I'm okay with Transformers.
2737980	2740380	Hey, have you seen this with the toys
2740380	2742260	that made us on Netflix?
2742260	2744220	They did a whole Transformers, right?
2744220	2747300	A couple of them did a whole Transformers one.
2747300	2750940	And you're all great about, you love Transformers, right?
2750940	2752540	It's pretty cool, it's pretty cool.
2752540	2754100	You should check it out.
2754100	2755700	Check it out.
2755700	2758020	Can you name all five Dinobots?
2758020	2759300	All five Dinobots.
2759300	2760460	Okay, Grimlock.
2761900	2762740	So excited.
2762740	2763580	Scabies.
2763580	2765100	Grimlock smash.
2765100	2766060	Scabies.
2766060	2768500	Landing strip, two, what?
2768500	2771340	First it's Grimlock and then right to Scabies.
2771340	2772180	James.
2772180	2775020	Scabies was, when they formed the big thing together,
2775020	2778180	he would like layer over the skin of the big guy.
2779220	2780540	Oh man, how amazing was that?
2780540	2781380	Slag.
2782180	2785340	Uh, scarodactyl.
2785340	2786180	That's not funny.
2786180	2787020	I think you're thinking of a swoop.
2787020	2787860	Swoop.
2787860	2789380	Swoop would be the pterodactyl.
2789380	2790860	Swoop.
2790860	2791900	Snarl.
2791900	2793140	Snarl, thank you.
2793140	2793980	Snarl.
2795420	2798020	Snarf and Snarl used to hang out at craft services.
2798020	2799500	Trans-badginal mesh.
2799500	2800740	Did we do slag?
2800740	2801580	The slag came in again.
2801580	2803500	Slag is the triceratops.
2803500	2806020	Stomp, is that the Stomp?
2806020	2806860	Was that the Brontosaurus?
2806860	2809260	Was he in the Broadway show, Inspiration?
2810260	2811740	It was Rent.
2811740	2813060	It was Grimlock and Four Esses.
2813060	2815300	And Rent was the last one.
2815300	2818020	Grimlock and Four Essen.
2818020	2821660	Grimlock was the breakout star of the Dinobots.
2821660	2822780	He was the Joan Jett.
2824780	2826300	He was kind of an interesting transformer
2826300	2831260	because his head, his robot head was the size of a caper
2831260	2836260	and it was nestled deep within the chest of a T-Rex
2836900	2839220	with a much larger, more majestic head.
2840060	2843300	Well, a T-Rex would have a brain the size of a P, Daniel.
2843300	2845460	All right, so there it is.
2845460	2846940	Ipsofacto.
2848980	2851500	Rob, which-
2851500	2852740	Yes.
2852740	2853580	QED.
2853580	2858540	Which three transformers
2858540	2860980	do you think you could do a passable impression of?
2862140	2863740	Well, Starscream, probably.
2865060	2868460	James, can you do any transformers that aren't Starscream?
2868700	2870180	Oh, you're doing Starscream?
2870180	2871500	Oh yeah, I'll do Megatron.
2871500	2872340	Okay.
2872340	2874340	Okay, and then, Dan, you beat Grimlock.
2874340	2875180	Okay.
2875180	2876940	Okay, so let's do a little improv.
2876940	2880020	Can I get a place where three transformers might meet?
2880020	2881100	At a barbecue.
2882860	2886540	Do you have any gluten-free options?
2887460	2892180	Star-Scream, you're embarrassing me.
2892180	2897180	If I have a wheat bun, I'm going to get brain fog.
2897340	2899180	I am the leader of the Decepticons.
2899180	2902460	I will order for you, and there will be gluten.
2902460	2903300	Why?
2904500	2907580	I'm getting a rash on my knee.
2908580	2910620	Barista will take three inner-
2910620	2914620	Ooh, look who's here, Grimlock.
2914620	2916820	Ooh, fucky sucky.
2916820	2919780	Wow, why didn't you come over here?
2921820	2925500	Hey, hey, have you checked out
2925500	2928140	this slime-wave pornography?
2930580	2935420	Does that involve the false dicks, Starscream?
2935420	2940420	It involves fake penises that squirt Gs.
2943580	2944900	Fool!
2944900	2946460	Oh!
2946460	2949700	Grimlock likes slime-wave.
2951140	2954460	Grimlock have a nylon fetish.
2954460	2959140	Slime-wave, Grimlock not know that nomenclature,
2959140	2962220	but for a long time, Grimlock been consuming
2963180	2965460	lesbian strap-on porn,
2966780	2971780	in which women wear pantyhose and are shot in high definition.
2972740	2973580	Slime-wave.
2973580	2977060	And also have huge artificial tongs
2977060	2979700	that shoot a giant-
2979700	2983700	I transform it to a tiny slime-wave dick
2983780	2987580	that doesn't match the size I am as a robot.
2987580	2991140	I will hold you and shoot you.
2991140	2992900	That's sound wave, I'm sound wave.
2993900	2995140	Laser beak.
2997220	2999580	Transform.
2999580	3000620	Mission.
3000620	3001740	No way!
3001740	3003140	Two can play!
3006500	3007940	Blaster.
3009540	3012860	Oh man, we're really taking a beating over here, Optimal.
3014700	3018540	It's a tape deck versus tape deck.
3020180	3023860	It'll be the battle of the cassette, guys.
3023860	3027340	Hey, nobody calls Optimus uncharismatic.
3029380	3034380	First we crack the shell, then we crack the nuts inside.
3034700	3038500	Oh, Optimus Prime, well there's some crazy shit
3038500	3040260	going out out there.
3041260	3043700	I'm a scat man crawlers.
3044700	3047980	I play a robot named Jazz.
3051180	3055580	In one of history's more embarrassing chapters.
3059740	3061060	Second-
3061060	3065660	Well, I'm iron sides and I don't see a problem with it.
3065660	3068580	Oh, as long as we can get along,
3069260	3071780	I think that's fine.
3071780	3073700	I'm a red state minivan,
3073700	3077180	arguably the least fearsome of the Autobots.
3078780	3080900	I'm from Alabama.
3080900	3084580	I'd love to help you as a beneficiary of the coastal
3084580	3085420	and neat.
3092220	3095460	Can we get back to this slime-wave thing?
3095460	3100100	I mean, I'm not weird if I'm into it.
3100100	3103980	Grimlock already say love slime-wave,
3103980	3105660	not know it called that.
3105660	3109540	Your name for something more beautiful than that to Grimlock.
3109540	3114060	Empowered women fucking each other with giant fake dicks.
3114060	3117300	Grimlock like, look at their legs while they do it.
3118460	3122740	Star scream, pull me out of Grimlock's ass.
3125820	3127900	Oh, my foot.
3127900	3128740	You fool.
3130860	3131700	And seen.
3137980	3140940	I think the word fool is only ever said
3140940	3144140	by a villain to another villain.
3144140	3145780	It doesn't seem like that big of an insult,
3145780	3149420	but if you've added a vocal training, it really lands.
3149420	3150660	It sounds like-
3150660	3154780	Fool, you have failed to see the dangers of your hubris.
3154780	3157940	Why don't you eat all the shit?
3159260	3160100	Now you guys-
3160100	3162900	Because I'm going to fuck it when I'm large size.
3162900	3164180	Okay, all right.
3164180	3168140	Now you guys do, you do Cobra Commander
3168140	3169580	and you do Destro.
3169580	3170780	Oh, boy.
3170780	3173300	Isn't that the, that's the same two voices?
3173300	3174300	Yeah.
3174300	3176180	Yeah, but their status is flipped.
3178540	3180820	Cobra Commander.
3180820	3182140	Yes?
3183100	3185700	We're here in this empty void space
3185700	3188820	with no other suggestion or character.
3188820	3190020	You and me.
3190020	3192900	I've got a suitcase full of props.
3194420	3197700	Here is a salamander.
3198900	3201140	Here is a pair of scissors.
3201140	3202340	Okay, all right, all right.
3202340	3203180	Here's a-
3203180	3204020	Freeze, freeze.
3204020	3205940	I cannot get a style of movie.
3206860	3208860	Western, continue as a Western.
3208860	3211420	Here is a thick shooter.
3213060	3216580	That's not, that's all right.
3216580	3221580	If you reach for it, I'll have to obey you.
3223180	3225220	I'm reaching for it.
3225220	3227340	Very well, sir.
3228820	3231180	Hi, guys, it's me, Sir Pantor.
3233460	3235500	Why are you floating so high up there?
3235500	3236740	Come down here.
3236740	3239820	Yeah, why don't you come down here to our level?
3240820	3242180	I just want to let you guys know,
3242180	3244500	I really appreciate you making me out of the DNA
3244500	3246700	of six of the world's leaders.
3247900	3249620	Whatever that storyline was.
3249620	3250500	Yes.
3250500	3252900	Yes, it was Gorbachev.
3255780	3256620	Idi Amin.
3258180	3261260	I feel like it was like all of the world's conquerors
3261260	3263260	were the convenient sidestepping of the world.
3263260	3264100	Get off me!
3265580	3268020	Listen, I'm 14 now,
3268100	3271780	and I'm just living up in the attic room.
3271780	3275300	We always pushed you too hard at a young age.
3275300	3277340	I don't really think we need this guy here.
3277340	3278180	Excuse me, what?
3278180	3279020	Sorry.
3280100	3281820	I don't think, I just,
3281820	3284740	why would we have another big bad?
3284740	3288140	You know, we have, we are the position is taken.
3288140	3289500	Because you weren't good enough.
3289500	3292260	I didn't ask to be emulated.
3294340	3295500	Float, float.
3295500	3298740	Serpentor, Serpentor, Cooper, Commander.
3298740	3300500	The horizon, look.
3300500	3304060	The Joes, ground forces and air forces
3304060	3307060	are approaching at exactly the same speed.
3309140	3309980	Yee-haw!
3311380	3314260	From their nearby base.
3314260	3315980	Ski lift.
3315980	3317620	Blasso dick.
3317620	3318780	Megan's law.
3318780	3320020	Broken mirror.
3320020	3321020	Go forward.
3321020	3321860	Whoo!
3321860	3322700	Whoo!
3322700	3323540	Shiskabob.
3323540	3324380	Whoo!
3324380	3325380	Smorespan.
3325380	3326220	Whoo!
3326220	3327060	Whoo!
3327060	3327900	Robut-ro.
3327900	3330740	B-T-K.
3330740	3331980	Power bottom.
3331980	3333820	Ha ha ha ha.
3333820	3335660	Bernie bro.
3337660	3338500	Gaslight.
3338500	3339340	Actually.
3341340	3342180	What about?
3344180	3348220	I'm, I'm, I'm, I'm, I'm, I'm, I'm, I'm, I'm, I'm,
3348220	3350900	I'm, I'm, I'm, I'm, I'm, I'm, I'm, I'm, I'm, I'm,
3351820	3355020	I'm, I'm, I'm, I'm, I'm, I'm, I'm, I'm,
3355020	3356900	I'm, I'm, I'm, I'm, I'm, I'm, I'm,
3356900	3360380	I'm, I'm, I'm, I'm, I'm, I'm, I'm, I'm, I'm, I'm,
3360380	3364220	I'm, I'm, I'm, I'm, I'm, I'm, I'm, I'm, I'm, I'm,
3364220	3367820	I'm, I'm, I'm, I'm, I'm, I'm, I'm, I'm, I'm, I'm,
3367820	3371580	I, I'm, I, I'm, I'm, I'm, I'm, I'm, I'm, I'm,
3371580	3373900	I, I'm, I, I'm, I, I'm, I'm,
3375900	3377500	I'm, I, I'm, I, I'm, I'm,
3377500	3379500	What did barbecue sound like?
3379500	3381500	Same as iron sides.
3385500	3388500	Vinegar, ketchup, and a gun smoke.
3391500	3394500	All right, now I'll do the banana splits.
3395500	3397500	I'm kidding, and that's for Noah.
3399500	3400500	Spencer.
3400500	3401500	Hey, guys.
3402500	3409500	The G.I. Joe's base was always just a nice commute away from where Cobra was.
3409500	3411500	Yeah, I pitched it.
3411500	3414500	I want to do a show that's like...
3415500	3418500	I don't want to go all the way so ironic with it that it's like Robot Chicken,
3418500	3421500	but I want to do like a Mad Men level workplace comedy
3421500	3424500	that goes back and forth between G.I. Joe and Cobra.
3427500	3430500	Yes, it will be comedic, but on a grounded level, you know?
3430500	3435500	Like accepting the what if of what if these organizations existed.
3435500	3439500	Then just like all the instant fucking pressure that that puts everyone under.
3439500	3441500	What are the women in Cobra feel?
3441500	3442500	We're having problems with our funding.
3442500	3444500	The women in Cobra, they don't have HR.
3444500	3446500	You're not going to do bits of like, oh, Cobra has HR.
3446500	3448500	It's like you have women at work for Cobra,
3448500	3450500	and they're going to be like, I need to fucking assert myself.
3450500	3451500	It's like Orange is the New Black.
3451500	3455500	They have a fucking issue to deal with that is different from the women in G.I. Joe.
3455500	3458500	And then just everybody is just cracking all the time.
3458500	3463500	Just everybody like they just go like, so here's our here's our here's our here's our briefing
3463500	3467500	and then like go get on Yo Joe and then like just the camera just stays behind.
3467500	3469500	Just have people just like rub their eyes and just
3471500	3474500	and then just have somebody come in and just have that music going like.
3477500	3480500	Hey, can you can somebody pick up my laundry?
3481500	3483500	I'm so busy right now.
3484500	3489500	There was an episode I saw as an adult G.I. Joe and they obviously they
3489500	3491500	none of it's written as comedy.
3491500	3494500	So someone had to do this without making a joke out of it.
3494500	3496500	But the Joes like crashed.
3496500	3501500	They like crash landed into the Cobra base and it broke through the wall.
3501500	3506500	I swear to God into the Cobra cafeteria and there are all these Cobra guys with their lunch trays.
3506500	3507500	They were like.
3508500	3510500	And it was not played for laughs.
3510500	3513500	But they had to animate it and get it back from Korea.
3516500	3519500	Yeah. And I mean those guys there's like so much intermingling.
3519500	3521500	I mean like one guy's another guy's brother.
3521500	3525500	Like like if you're in Cobra or G.I. Joe you're you're in a fraternal organization.
3525500	3528500	You know like like oh snow steam.
3528500	3533500	My long lost twin from we were separated as children by a ninja.
3533500	3537500	Like because he's me but my action figures painted differently.
3537500	3542500	Maybe the Baroness has like a valid grievance against G.I. Joe's.
3542500	3545500	They scooped my eyeball out.
3545500	3547500	I was tortured by them.
3547500	3552500	Yeah. Yeah. Like they're always like oh so much for the compassionate left.
3555500	3557500	We never said we were left.
3557500	3559500	And I assume we were right wing.
3560500	3562500	Everyone's left of us.
3562500	3563500	Cobra.
3566500	3568500	Or are they do they consider themselves left.
3568500	3570500	That's that's amazing.
3570500	3571500	That's what we need right now.
3571500	3579500	We need Cobra and G.I. Joe engaged in adult dialogue so that the children that we are can start to understand how fucked the world is.
3580500	3584500	Because Cobra commander wouldn't be like you know I'm I'm kind of conservative.
3584500	3586500	Like he wouldn't consider himself conservative.
3586500	3589500	Perhaps horseshoe theory is valid.
3589500	3591500	The extreme right to the extreme left.
3591500	3593500	Come back to join.
3598500	3601500	Another another idea lost to the ages.
3601500	3602500	Lost to the age.
3602500	3609500	What do I got to do write a crazy script and put it on Twitter and you know be like look at that.
3609500	3610500	Yeah.
3611500	3614500	That's the most promising development process.
3615500	3619500	Write a fake thing put it on Twitter and then see if that works.
3630500	3632500	Let me see if I got I got one more thing.
3633500	3634500	Can you hold this James.
3634500	3637500	You want to stick around and listen to add James.
3637500	3640500	Do you want to stick around and play a little D&D with us to close the show.
3640500	3641500	Yes. Yes.
3641500	3642500	I am.
3642500	3643500	Oh is that time.
3643500	3645500	I only know how to play Axis and allies.
3645500	3647500	I'm out of my depth here.
3647500	3650500	Spencer can we can we dovetail some domes in here.
3651500	3652500	What.
3653500	3655500	Can we bring James into the game.
3655500	3656500	Yeah.
3656500	3657500	No. Yeah.
3657500	3658500	Which one.
3658500	3660500	Did I talk about that button.
3660500	3661500	Yeah.
3662500	3665500	Cody sent me this link to this article.
3665500	3674500	It says the headline says Ohio man sentenced after attempting to seduce undercover officer with chicken Alfredo.
3675500	3684500	And it's just an article about a guy who got basically you know he's like is an undercover officer in a chat room and this guy thought he was talking to a 15 year old boy.
3684500	3685500	Oh shit I lost it.
3685500	3686500	Slime wave.
3687500	3693500	And he and he and he was like I'll be there with slime wave is the perfect name for a transformer.
3693500	3694500	Yes.
3694500	3696500	There's shockwave sound wave.
3696500	3697500	Why not.
3697500	3698500	How come no ended slime.
3699500	3701500	He transforms into the day.
3701500	3702500	He.
3702500	3703500	He.
3703500	3704500	Just listen this is good.
3704500	3705500	We're going to button this up.
3705500	3706500	This is great.
3706500	3707500	Oh God.
3707500	3708500	Oh God.
3708500	3711500	He thought he was talking to a 15 year old boy online but it was actually an undercover Austin town police officer.
3712500	3714500	He arranged to meet the officer in Austin town.
3714500	3719500	He planned to bring lubricant sprite and chicken Alfredo to the date.
3721500	3722500	I'm telling.
3722500	3729500	Seven up just lost another customer 7 up if you're listening to this podcast.
3729500	3731500	Get in the game.
3731500	3732500	You are losing.
3732500	3733500	You are losing.
3734500	3737500	You've been losing for a while 7 up 7 up.
3737500	3739500	You've been losing.
3739500	3744500	I'm kind of fascinated when you did the Pac-Man commercial back in the 90s.
3744500	3745500	They're failing.
3745500	3748500	They're a failing lime and soda.
3748500	3751500	They're lemon and lime and they're failing at both.
3753500	3756500	We need to put thirst first.
3758500	3760500	That's the liberal alternative.
3760500	3762500	A thirst first.
3762500	3765500	I was trying to do Trump and talking sprite talk.
3765500	3766500	America.
3766500	3769500	When our calories go low their calories go high.
3770500	3773500	Oh you don't want high calories.
3774500	3778500	What I love about these local news articles because they're usually like this is California
3778500	3784500	news or Los Angeles news or like the desert region outside LA news and then there will
3784500	3789500	be like one comment and it's just like somebody was like it'll say like 18 hours ago so you
3789500	3795500	know like this is footprints in the snow like this person is not like this is not a hot spot
3795500	3800500	for this person but like there was a guy underneath this article that was like seven days.
3801500	3804500	Jeez no wonder we got a pedophile problem.
3804500	3806500	And it was like I kept looking at that.
3806500	3807500	Where do you get seven days.
3807500	3809500	I don't even know what he's talking about.
3809500	3811500	It's like it's like the ring.
3813500	3817500	Seven days by the way probably would be a good if he means seven days in prison I think
3817500	3824500	that would be pretty good for somebody who whose crime was like like meeting a meeting
3824500	3829500	a cop in a chat room that like got them to say I'll fuck you with some chicken.
3830500	3831500	I'm not.
3831500	3833500	That's all the FBI does.
3834500	3835500	Yeah.
3835500	3837500	They go in chat rooms and go hey you want to do a crime.
3837500	3841500	Yeah my heart goes out to law enforcement agencies.
3841500	3843500	Do you like heavy creams and sauces.
3845500	3851500	I feel like oh you're not going to make a headline by going FBI realizes that cycles
3851500	3857500	of abuse are the key and spends a bunch of money that will only pay off in 25 years when
3857500	3861500	this generation of abused children stops abusing the next generation.
3865500	3869500	J. Edgar Hoover left the time capsule that's going to make up for everything.
3869500	3872500	So there's like how do you get a pedophile.
3872500	3873500	How do you bust them.
3873500	3874500	We had a big bust.
3874500	3877500	We had a big pile of pedophilia on a table.
3877500	3880500	So they and that is something they go into like on the local news.
3881500	3886500	And then they're like we recovered five compact computers.
3887500	3889500	I'm 15.
3889500	3891500	I sure would like some chicken alfredo.
3891500	3893500	I don't know what I'd do for it.
3893500	3898500	44 kilos of chicken alfredo sauce in powdered form.
3899500	3901500	It's fucking cold here.
3901500	3902500	Is it.
3902500	3903500	It's fucking freezing.
3903500	3904500	Are you cold.
3904500	3905500	It's not.
3905500	3906500	Yeah.
3906500	3907500	It's good for last right.
3907500	3908500	Yeah.
3909500	3916500	Look in my view I feel that for far too long the top one percent of seven up has gotten
3916500	3920500	a far larger percentage of the bubbles than they deserve.
3922500	3929500	Over over over 60 percent of the bubbles available that are carbon dioxide the can of seven up
3929500	3935500	are going to the top point zero seven of the soda at the top of the can.
3936500	3940500	In my view we should flatten the soda remove all the bubbles
3940500	3943500	and we all get sweet light lime flavored syrup.
3947500	3949500	Lemon and lime should not be.
3949500	3952500	These are these are public resources.
3953500	3959500	I believe that the government there should be a government allotted amount of lemon and lime
3960500	3964500	and carbon dioxide and individual communities can do it at what they will.
3971500	3972500	I miss.
3972500	3975500	I didn't have any dinner me neither.
3975500	3976500	What.
3976500	3977500	Now I'm responsible for.
3978500	3980500	I had an aposta lunch.
3981500	3982500	Did you have chicken Alfredo.
3982500	3984500	I had a chicken Alfredo.
3984500	3985500	Was that you.
3986500	3987500	No.
3988500	3989500	I remember.
3990500	3993500	I had an impossible burger with Joel.
3995500	3996500	Nice.
3998500	3999500	Go on.
4000500	4003500	I don't feel like I was supposed to feel bad about not feeding you a minute ago.
4003500	4007500	Now you just tried to like no brag that you ate food with our friend.
4008500	4010500	You want to go for a baguette.
4011500	4012500	No way.
4012500	4013500	Okay.
4014500	4018500	I'm like a hold up in a bedroom eating protein bars like just waiting.
4018500	4021500	Like like whether I die or.
4032500	4033500	Shrops dropping on.
4033500	4035500	Maybe it's the power trying to come back on.
4036500	4040500	Shrops coming to Boston and he just told me backstage that he's fine coach.
4041500	4043500	Yeah something like that.
4043500	4044500	That's cool.
4044500	4046500	It took me a while before I got bumped up.
4049500	4053500	Oh you got to put it in the hours.
4055500	4057500	Going to go on to cradle con.
4057500	4061500	I'm going to be doing a panel and I'm hoping Spencer moderates it.
4061500	4062500	Yeah he was hoping.
4062500	4063500	Yep.
4065500	4068500	I would have got you a first class ticket to Boston.
4069500	4070500	I know.
4072500	4074500	Why don't we try to upgrade him.
4074500	4076500	I got to I got to go to DC in July.
4077500	4078500	Will you help me out.
4081500	4082500	Okay.
4082500	4083500	Here we go.
4083500	4084500	Steve Levy everybody.
4086500	4087500	He's on the show.
4088500	4089500	Fuck your buns.
4089500	4091500	Somebody take care of me.
4092500	4093500	God damn.
4093500	4094500	I've been drinking nothing but vodka.
4094500	4097500	I already booked Rob first class to Boston and back.
4097500	4098500	Wait a second.
4098500	4100500	Well that would make shrub a fucking liar.
4101500	4102500	Wait.
4102500	4104500	So I did it backstage when I found out.
4104500	4105500	He ate dinner.
4105500	4108500	He's flying first class.
4109500	4112500	This guy doesn't even know what slime wave is.
4113500	4114500	Jack Hughes.
4115500	4116500	Oh no.
4117500	4118500	Yeah.
4119500	4120500	Jack Hughes.
4120500	4121500	Why are you shaking your head at me?
4121500	4122500	I don't know.
4122500	4123500	Just you know.
4127500	4128500	Thank you sir.
4129500	4130500	All right.
4130500	4131500	Get out of here.
4134500	4135500	I'm sorry.
4135500	4136500	I mean why was it.
4136500	4138500	Why were you flying coach in the first place.
4138500	4139500	I don't know.
4139500	4140500	Why.
4140500	4141500	I don't want to shame anybody.
4142500	4143500	Well you'd be shaming him.
4143500	4144500	You didn't.
4144500	4145500	No no no.
4145500	4146500	No no no.
4146500	4147500	It's not.
4147500	4148500	Who is it.
