start	end	text
1447360	1449000	Like I'm sure I click on shit that says
1449000	1451560	like I'm an asshole or something, but it's just like,
1452000	1452840	anyways, but.
1452840	1455480	That's like the Emperor in Star Wars
1455480	1457600	like jolting himself with his powers.
1457600	1458840	But it's actually a really nice thing
1458840	1460800	because it's been almost 300 episodes
1460800	1463720	and there is, you're self loathing, you tend to just go,
1463720	1464960	oh, everything's always been shit
1464960	1466080	and then there's like people out there
1466080	1468320	that'll pull like little clips and they'll go,
1468320	1470760	this is an amazing moment and they'll give it a nice title
1470760	1473000	and you go, yes, I will click on the first time
1473000	1475960	James and Domian did Bernie Sanders coming out of the show.
1475960	1476800	And it was here.
1476800	1479760	You debuted, you debuted your Sanders impression.
1479760	1484760	Bernie Sanders debuted on Harmontown at the meltdown.
1485080	1486080	And he was.
1486080	1487520	I like just that as a pull quote.
1487520	1490160	Bernie Sanders debuted on Harmontown.
1491840	1494760	And the political scene, the mess that at the stage
1494760	1498400	that became coated in blood was so clean back then
1498400	1500240	that you could see me not knowing.
1500240	1502920	I had asked Demorge Brown, who's Bernie Sanders?
1502920	1507040	And he said, oh, it's that black guy that is Ben Carson.
1507040	1508280	I was like, oh, it's Ben Carson.
1508280	1510240	So I'm introducing who I think is Ben Carson.
1510240	1511560	I don't know either of their names.
1511560	1514080	And then you come out and these wigs and.
1514080	1516600	Yes, there were two wigs on the side of my head.
1516600	1519840	These two really awful wigs like Bobby pin together
1519840	1521880	and on both on backwards.
1521880	1522720	It was very good.
1522720	1525760	Yeah, yeah, that's how you, that's DIY.
1525760	1530240	What was the ride like you had a homespun version of like,
1530240	1533080	I know always like, oh, there'll always be that feature
1533080	1535400	in variety or something about like,
1535400	1537520	oh, this guy got cast on SNL
1537600	1540120	and who little did he know that Gary Hart
1540120	1541520	would become such a thing
1541520	1543680	because that was one of his impressions.
1543680	1545680	But you just did it like.
1548040	1548880	Yeah, there's no danger.
1548880	1551160	The weekend style, like mixtape style
1551160	1552680	like turned platinum artists.
1552680	1555640	Like you're Bernie Sanders became like a cottage industry
1555640	1558120	that you controlled and.
1558120	1561440	Yes, and look, as all industries,
1561440	1564040	I believe that the Bernie Sanders industry
1564040	1565920	should be strictly regulated.
1565920	1570920	There should be no monopolies
1571240	1573560	and the workers should take control
1573560	1575000	of the impression itself.
1579360	1580200	We're there.
1581120	1582320	Are there any little tidbits
1582320	1583640	or are you tired of talking about it?
1583640	1587040	Like, like, like the ride of like, holy shit,
1587040	1589720	you started, you got it in the ground floor
1589720	1591680	of this impression of this guy
1591680	1595120	that has become like the Tony Stark
1595120	1597760	of this Marvel movie that's lasting four years.
1597760	1599520	It changed rapidly week to week.
1599520	1600520	When I started doing it,
1600520	1602640	I knew and loved Bernie Sanders,
1602640	1604880	but I thought I was doing an impression
1604880	1606360	of someone who was doomed,
1606360	1608840	like Dennis Kucinich.
1608840	1612200	So my angle was, well, I don't have a chance.
1612200	1615360	Within a week, there were these 30,000 people crowds
1615360	1618200	and I was like, that's not the angle anymore.
1619920	1621080	When I first started doing it,
1621080	1623160	it was like, this is the biggest crowd I've seen.
1623160	1624360	Ha, ha, ha, big laugh.
1624360	1625680	But after a while, it was like,
1625680	1627920	I can't believe I'm playing a room this small.
1627920	1631360	Which must parallel his journey, I assume,
1631360	1632360	if he were up here.
1632360	1635680	Yeah, I think he definitely started in a Volvo somewhere.
1638240	1640120	Whenever I see a good Volvo
1640120	1642520	or an old Studebaker on the road,
1642520	1644240	I'm like, that's Bernie Sanders' car.
1644240	1647120	But was there any moment that really like,
1648880	1651680	just the absurdity reached a height for you where,
1651680	1654520	because the political fervor of all of this
1654520	1656360	and the fact that you're out there doing a guy,
1656360	1657840	was there anybody like,
1657840	1659280	I don't know what I'm expecting to hear,
1659280	1661840	like someone yelling, hey, James,
1661840	1663840	and then like throwing paint on you
1663840	1665560	and going like, stop making fun of him.
1665560	1667560	You're part of the problem or the opposite.
1667560	1672400	Like there was a couple of broken brains
1672400	1675560	that thought that making fun of Bernie Sanders
1675560	1677760	is like not allowed, because he's perfect.
1677760	1679000	And I'm like, no, I like him.
1679680	1682520	I'm echo, I am a second Bernie Sanders.
1683440	1685400	I'm trying to say the same things
1685400	1686800	and get the message amplified
1686800	1688840	and also work in some more radical things.
1688840	1690480	Like I got to call for the legalization
1690480	1692720	of psilocybin mushrooms, which he wouldn't do,
1692720	1694280	but I was like, I'm gonna do it.
1695480	1697360	Because I write a piece in New Yorker
1697360	1698760	that said that your impression of him
1698760	1701160	might've cost him two and a half points in the primary.
1701160	1702480	Thank you.
1702480	1704800	Was that an article or was that like
1704800	1706840	a two person New Yorker cartoon
1707840	1711280	where there was like an ill shaping therapist
1711280	1714160	talking to a desk with George Bush.
1714160	1716360	And it was actually, it was my winning caption.
1716360	1717800	That wasn't even one that had.
1717800	1718640	It's a contest.
1720360	1725160	But sometimes people thought from our advertising
1725160	1727520	that it was really gonna be a Trump versus Bernie debate
1727520	1729880	when we were on the road, me and Anthony and Taminik.
1729880	1733360	And in Boston, there was a big sign on the front door
1733360	1736200	that was like, Donald Trump and Bernie Sanders
1736200	1737840	will not be at the show tonight.
1737840	1739040	These are comedians.
1739040	1740080	Jesus.
1740080	1742600	Because they had been getting calls, apparently.
1743440	1747200	Speaking of, yeah, Anthony's Trump impression fantastic
1747200	1750080	and was like, but everybody's like,
1750080	1751640	I mean, that's a guy that's like,
1751640	1754120	everybody's got a Trump impression.
1754120	1755640	Who is a Trump impression?
1755640	1756480	Have you dabbled?
1756480	1761160	Like you're, you know, on the road I do a Trump impression
1761160	1762880	because I feel like I have to.
1762880	1765000	Cause I went to, I was in Europe
1765000	1767360	and I'm like the American who does impressions.
1767360	1769520	And if like, if you don't do a Trump impression,
1769520	1771080	there's like, you failed, mate.
1772760	1774320	It seems like kind of a hard impression.
1774320	1776400	Like there's a surface that's just like Bay's,
1776400	1777840	like George Bush, Nat Gandy.
1777840	1778760	Like you just got like that.
1778760	1780360	Like the Trump version of that would be like,
1780360	1782120	I'm Donald Trump.
1782120	1782960	I don't know.
1782960	1783800	I tried it.
1784840	1786160	There's a stuntedness to the book.
1786160	1787080	But he has like a tool.
1787080	1790960	He has like a weird jagged toolbox of like.
1790960	1792760	Anthony Taminik is my favorite.
1793360	1795760	He does the breathy thing, you know,
1795760	1797240	where it's just, I mean, come on.
1797240	1801760	And I mostly just ape his impression
1801760	1804000	and give him credit one fourth of the time.
1804000	1809000	But there's something, I love that Donald Trump speaks.
1809160	1811800	Like he hates people from other cultures
1811800	1815800	and places and races, but he speaks English
1815800	1819320	in a way that would be useful if you were learning English
1819320	1820360	for the first time.
1821360	1823800	Or if you're teaching it to someone.
1823800	1827120	Cause he uses very simple sentences and easy words.
1827120	1828560	He's like, we used to be bad.
1828560	1830600	We were so bad in the past.
1830600	1832800	We used to be bad.
1832800	1835760	Now here in the present, we're getting better.
1835760	1837960	We're so much getting better.
1837960	1840360	And in the future, we're going to be great.
1840360	1841760	We're going to be great.
1841760	1843760	That's all three possibilities.
1846160	1847240	He's conjugating.
1847240	1850920	George Carlin's set too, like Rick Moran's impression
1850920	1851760	of George Carlin.
1851760	1855160	It's like, beets, beets, you want beets?
1855160	1856320	Am I on the plane?
1856320	1858400	Why are you on the plane?
1858400	1860600	I'm not on the plane, the plane is grounded.
1860600	1862280	It's a low energy plane.
1863720	1865920	You got more, you want more stuff.
1865920	1868280	You got to have stuff to put your stuff in.
1868280	1869640	Well, now you got to have stuff and put,
1869640	1873200	I'm trying to do George Carlin's material as Donald Trump
1873200	1874040	in case that's not clear.
1874040	1874880	That's what I was trying to do too,
1874880	1875840	with you on the plane.
1876080	1878800	You did it, and then I tried to come in and join the party
1878800	1879760	and I killed it.
1882160	1883200	You have owners.
1883200	1885200	You think you're free, you have owners.
1885200	1887400	I mean, come on, I'm your owner.
1888520	1891040	All right, that was a George Carlin pin, thank you.
1891040	1892520	We're going to make a cage.
1892520	1894480	It's going to hold so many babies.
1894480	1897080	So many children are going to fit in so many cages.
1899080	1901360	I like to think of them as hard cradles.
1901360	1902480	They're hard cradles.
1902480	1906400	Think of them as big boy pins.
1908200	1909360	Big boy cribs.
1909360	1910200	What was that?
1910200	1913280	I want to check in with Spencer for some Spencer.
1913280	1916440	It's a new segment called Spencer Spleenies.
1916440	1917280	Yeah.
1917280	1920800	Spencer Spleenies, oh, sorry.
1920800	1922560	I was just so excited, sorry.
1922560	1923400	Oh, okay.
1924680	1925520	Okay.
1926680	1927520	It's a weird theme.
1927520	1929560	A lot happened at once.
1929560	1930400	Well, I wanted to check,
1930440	1931560	because I clicked on the thing
1931560	1934320	where the White House lady was going,
1934320	1936720	where it was like, hey, this is misinformation.
1936720	1939640	And then she's like, I watched like four minutes of it,
1939640	1942280	where she's like, this is the reality of it
1942280	1943120	and all this stuff.
1943120	1945760	For these people, as we're all tweeting
1945760	1948240	and being alarmed and going like,
1948240	1951920	boy, does this feel a lot like something
1951920	1953920	from history books and things and all this stuff.
1953920	1957400	And then there's one chorus of counter argument,
1957400	1960840	which is this, it happened under Obama too.
1960840	1964800	And it's like such a scattering of like signals.
1964800	1966720	And I just don't know if you've parsed any of it.
1966720	1968280	Well, a good rule of thumb
1968280	1971080	is everything Republicans say is a lie.
1971080	1973600	So if you start from there.
1973600	1977400	No, but specifically, I understand that.
1977400	1979400	Well, my understanding is that policy
1979400	1982600	that everyone's pointing to in bad faith to lie to people
1982600	1986860	is that unaccompanied minors found at the border
1986860	1990540	without parents were detained.
1990540	1992340	So that's not good.
1992340	1995460	But I mean, you either leave a kid in the desert
1995460	1996940	or you don't leave a kid.
1996940	1998900	So I mean, it's not a comparison.
1998900	2000620	Also, Obama wasn't great.
2000620	2002920	He was the before Trump, a real deporter guy,
2002920	2004900	but he got him out of the country.
2004900	2008060	He didn't keep them in concentration camps.
2008060	2011140	So it's hard to really compare the two.
2011140	2013540	The thing is, politicians are bad
2013540	2015060	even when they're not as bad.
2015060	2018580	So Obama is bad even when he's the best president I know.
2019580	2020620	But he was, yeah.
2020620	2022940	So does that answer your question or am I okay?
2022940	2023780	Dan, hang on.
2023780	2024860	If you're going to ask him another question,
2024860	2027620	I want to take another pass at a thing.
2027620	2028460	Thank God.
2028460	2029780	Well, yeah.
2029780	2031900	I think you owe us another first.
2031900	2032740	Yeah.
2032740	2034180	Okay, so go ahead.
2034180	2035540	First tee up the segments
2035540	2037220	and then we cut to the graphic, you know,
2037220	2038060	and the whole thing.
2038060	2039420	All right.
2039420	2040860	I haven't played this song in a long time,
2040860	2042580	so I'm not sure it's perfect, but we'll.
2042580	2044420	Well, there's a lot of stuff going on in the news
2044420	2047220	and I can't tell my ass from a hole in the ground
2047220	2051300	and I'm too selfish and rich to really care that much.
2051300	2052900	That's when I turned to my friend, Spencer,
2052900	2054660	for Spencer Spleenies.
2061100	2063540	Last time on Spencer Spleenies.
2065220	2066060	I don't know.
2067860	2069620	Do you have the code, Senator?
2070940	2072020	This isn't ketchup.
2074420	2075980	People are dying.
2077060	2078580	No, actually, that is ketchup.
2080620	2081820	You bread raptors.
2085860	2088380	Wow, it seems like we missed an episode.
2092740	2097020	Yeah, I think most programs that are evil
2097020	2100380	originated in some version that people didn't realize
2100380	2102020	were going to be so evil at first.
2102900	2107900	But Obama did not have a clean immigration policy.
2107900	2108980	It was bad.
2108980	2110260	And there were people at the time saying,
2110260	2112900	hey, eventually someone's gonna get a hold of this power
2112900	2114340	and abuse it.
2114340	2117020	Conversely, Obama got blamed completely
2117020	2119780	for the drone killings, which were very bad,
2119780	2122660	but Bush started it.
2122660	2123580	It started under Bush.
2123580	2124980	So it's like, if it's really bad,
2124980	2127140	it's often rooted in the last guy too.
2127140	2129860	Yeah, I guess we're just paying the price
2129860	2133580	for a fucking 100 years of just going,
2133580	2135900	eh, politicians, be in the price.
2138540	2140380	But do we really have to, man, I was born.
2140380	2143220	We never should have got those guys off those soap boxes.
2144540	2145940	Things would have been a lot better.
2145940	2147540	We could just throw a tomato at them
2147540	2148780	if they hit his leg and they were like,
2148780	2152020	hey, have you seen my baby?
2152020	2153460	Have you seen my baby?
2153460	2154300	Stop, step.
2154300	2156020	Get off the rocker.
2156020	2158340	And also, the politicians can't be picking our pockets
2158340	2159980	when they get their thumbs up on their suspenders,
2159980	2162300	like this, where we can see their hands.
2162300	2163500	That was why they did that.
2163500	2168500	Whatever happened to a good old whistle stock tour?
2169780	2171100	Nothing right here.
2173180	2174020	But the fact is-
2174020	2177020	Teddy Roosevelt was the most attractive fat man.
2178500	2179940	I can imagine.
2179940	2181700	He was like, robust.
2183540	2188100	But that memo that people are tweeting,
2188340	2190380	where it's like signed by Sessions
2190380	2195140	and it's like zero tolerance, like, here we go.
2195140	2196060	That's a real thing.
2196060	2199500	That's not like the libs going,
2199500	2201060	we're connecting these dots.
2201060	2204020	It's like, that's the key, right?
2204020	2206780	Is that they were like, oh, let's jack it up.
2206780	2207620	Like, where-
2207620	2209260	Yeah, no, that's a policy change.
2209260	2211300	Yeah, no, a very explicit policy change.
2211300	2214460	And as a result, whether they intended it or not,
2214460	2216540	there's like this wake of that motorboat
2216540	2218020	that's like a bunch of babies
2218020	2219260	being ripped from mother's arms.
2219260	2222020	And they're like either, what I can't tell is if,
2222020	2224740	because as if they were like, yeah,
2224740	2227140	there's going to be babies ripped from mother's arms,
2227140	2229460	but they're going to be a certain shade of brown baby
2229460	2231700	and brown arm, and there's going to be a certain number
2231700	2233100	and we're going to keep ratcheting it up.
2233100	2235260	Or like, the motorboat in the no wake zone
2235260	2238820	just going like, and pretty soon,
2238820	2241620	and it's all about that wall negotiation, right?
2242340	2247340	It's like, I think that they intend to cause misery
2248500	2252500	for non-white families, mostly at the border
2252500	2256180	and at other places where they detain immigrants.
2256180	2258140	And I think there's people that want there
2258140	2262260	to be family misery, to deter people from coming in,
2262260	2263460	which is a nightmare.
2263460	2265260	They say that out loud, they've said that.
2265260	2267180	I mean, before it became controversial
2267180	2268980	because we didn't have pictures, they were like,
2268980	2269900	yeah, it's going to be great.
2269900	2271180	We'll be separating families
2271180	2272940	and they'll be like, I don't want to separate my family.
2272940	2274100	I'm not going to come to America.
2274100	2275660	Like, that was what they were saying.
2275660	2276820	This is the plan.
2276820	2278420	But now that it's actually happening,
2278420	2279700	they're like, this isn't happening.
2279700	2283740	But, you know, before it was like a political issue,
2283740	2285580	you know, they were like, no, it'd be great.
2285580	2287260	We're going to separate families.
2287260	2288620	Like, and that was just, you know,
2288620	2289900	what they were openly saying.
2289900	2291620	You know how you compromised?
2291620	2292860	Wall of babies.
2296460	2297780	They're already there.
2298500	2300220	Two birds with one stone.
2300220	2301060	Yeah.
2302060	2303460	It's called compromised people.
2303460	2305300	Was it a wall of white babies?
2305300	2306100	Huh?
2306100	2307500	Like, that are facing out wearing it.
2307500	2309300	No, no, hey, Jan, take it easy.
2309300	2310140	I know, I want it.
2310140	2310980	Take it easy.
2311980	2314660	I think you wildly misread my points.
2315860	2319300	Now, this wall's going to be brown, brown, brown.
2319300	2321380	But is that, so that's like a very grizzly,
2321380	2323460	you're talking about like a Thunderdome thing
2323460	2326380	where the babies are like, like an example.
2326620	2329060	The picture of the cage that all these kids are in,
2329060	2331660	you're making a Thunderdome of people.
2331660	2335220	I thought maybe like healthy, white, well-fed,
2335220	2338940	fat white babies that are like facing Mexico.
2338940	2342940	And the sign says, look, we already have so many babies.
2343940	2347820	And then the babies are like, we love America.
2347820	2350340	Don't come in here with your baby.
2350340	2355820	I mean, I hear people say, oh, it's not helpful.
2355820	2357780	It's not helpful to say that they're Nazis.
2357780	2360420	And I hear that, I'm not sure where I stand on it,
2360420	2363100	but definitely if, okay, okay, fine, fine, fine.
2363100	2365500	For sake of argument, if they're not literally Nazis,
2365500	2368460	they're at least like the bad guys from children of men.
2370460	2373780	And I think like, we're our own bad thing.
2373780	2375620	We're our own bad thing and we've got to stop it.
2375620	2376460	Yeah, I know.
2377700	2380620	Here's the thing, I like to think,
2380620	2384540	like I think in my listenership, if that's a word,
2384540	2386220	there's probably everything but Nazis.
2386220	2387700	Maybe there's a couple, like there's probably a little
2387700	2390860	churn coming through, like, like, ooh, I thought I saw.
2390860	2393060	Gorka could be a secret Nazi.
2393060	2394900	I saw enough Rick and Morty to tune in.
2394900	2396260	What was this cuck talking about?
2396260	2398460	But like, I know, you could be a libertarian
2398460	2399300	and listen to the show.
2399300	2402300	You could be a fiscal log cabin Republican.
2402300	2403900	Like you're probably not gonna, you're gonna go,
2403900	2406020	oh, he's a big fat blowhard.
2406020	2407260	Like I resonate with him.
2407260	2410060	Like, you're welcome here.
2410060	2411020	I'm not gonna shame you.
2411020	2413420	Oh, the free markets.
2413420	2417620	As you probably know, like I was the most apolitical,
2417620	2419300	like kind of like guy.
2419300	2422100	Like I was like, oh, I don't believe in politics.
2422100	2423260	I don't believe in the election.
2423260	2424780	And then it was like, the election happened.
2424780	2426220	And then it became fucking shrub.
2426220	2427220	I fucking hate shrub.
2427220	2428420	I hate him so much.
2429420	2430660	Fucking hate him.
2431740	2433580	You know, sort of one, I just like,
2433580	2434500	what do you want to talk about?
2434500	2436380	Farts for an hour?
2436380	2438620	It's just you, it's all, it's just you.
2438620	2441900	I was trying to connect with you with the seven up thing.
2441900	2445700	Yeah, you're not giving shrub enough credit
2445700	2448060	for trying to connect with you earlier.
2448060	2449460	I don't suffer the illusion.
2449460	2450700	I never see you anymore.
2450700	2451540	I never see you anymore.
2451540	2453540	I just want to have a conversation with my friends
2453540	2455940	about what's going on in my world,
2455940	2458300	which includes what's going on in other people's world.
2458300	2460180	Yeah, no one's stopping you.
2460180	2461460	Yeah, you're not stopping me.
2461460	2464020	You look like a fucking like dead scarecrow over there.
2464020	2466820	He's swiveling around in your chairs, rolling his eyes.
2466820	2468700	And he's like, he's like mounting a thing.
2468700	2470300	It's like, you think I don't know what's going on?
2470300	2472140	You got, you got shrub loyalists,
2472140	2474220	like, like, like building in my crowd.
2475380	2476220	I know what's going on.
2476220	2477740	Perhaps the most dangerous faction of all.
2477740	2479580	He's splintering my people.
2479580	2481820	Like, people are coming here to see you.
2481820	2483980	I see your t-shirt shop.
2483980	2485380	I saw your t-shirt shop.
2485380	2486860	I see you selling shit.
2490940	2492020	Why are you so mean?
2492020	2494460	You're so angry.
2494460	2497500	Anyways, Nazis, all I'm saying.
2498500	2501340	Look, Nazis, all you got to do, like,
2501340	2503580	because it's like, it's this, it's this faction of people
2503580	2506420	that are like, it's like, if you were to just be like,
2506420	2508580	oh, I'm going to get a swastika tattoo
2508580	2512580	and I hate everybody that's not me and like, I'm a Nazi.
2512580	2513620	How would you do that?
2513620	2515260	That's terrible.
2515260	2517420	Like the problem is that people that are like,
2517420	2519980	they're like, whoa, whoa, whoa, what's this Nazi talk?
2519980	2520900	I don't like that.
2520900	2522060	You know what I am?
2522060	2524380	I'm a totally intellectual, logical guy
2524380	2525940	who hates overreaction.
2525940	2528420	I'd like to exterminate overreaction
2528420	2530180	with some logical discourse.
2530180	2532020	Why are you saying Nazi all the time?
2532020	2533540	That seems really hysterical.
2533540	2536660	I'm such a logical person that definitely not a Nazi.
2536660	2540340	I just happen to be arguing for calmness and discourse
2540340	2541700	and both sides of the thing.
2541700	2543340	And I'm like, you're a fucking closet Nazi.
2543340	2545100	You're just biding your time.
2545100	2547980	Like, and I just say to those people.
2547980	2550220	Why are you afraid of honest debate?
2550220	2552220	Yeah, like, why don't you keep talking to me
2552220	2553740	about whether or not we're Nazis?
2554380	2556340	Because I'm fucking exhausted already.
2556340	2558020	I'm a spoiled baby.
2558020	2559460	Can I start punching you yet?
2559460	2561980	Like, I've only got so much time left.
2561980	2563060	Jesus Christ.
2563060	2565700	I like to imagine the current day.
2565700	2568700	If Hitler was here now, there would be like some bunker
2568700	2572260	where he was like, we have 40,000 trolls.
2572260	2573380	We can send it Harmon.
2573380	2574220	Yes, yes.
2575660	2577300	I just say to those people, hey,
2577300	2579460	if you're really honestly for real,
2579460	2581260	you're like honest about this fact.
2581260	2582700	You're going like, you know what?
2582700	2584340	We're never going to turn Nazi.
2584340	2585940	This isn't anything.
2585940	2587540	Just, will you please,
2587540	2589460	you know what we help you so much?
2589460	2593020	Would you just Google 1933 Germany?
2593020	2595460	Because you think you're going to see a description
2595460	2600460	that's going to, like, just do an hour of fucking research.
2600460	2604460	And if I'm wrong, you will be so much more armed
2604460	2607180	and your next argument, you'll be able to go,
2607180	2609580	there's a lot of differences here.
2609580	2611740	But I'm afraid you're going to see,
2612740	2614900	that everything has a ramp
2614900	2617380	and that everything starts a certain way.
2617380	2622380	And that marginalization and institutionalization of it
2624100	2627460	is like, it all takes the same form in the beginning
