start	end	text
4148500	4149500	Well who would it be on.
4149500	4152500	Look at this character that's on the the popcorn bag.
4152500	4153500	You look at him.
4153500	4154500	You love him.
4154500	4155500	Look at him.
4155500	4156500	He sees.
4156500	4158500	That's Bart Simpson's cousin.
4158500	4160500	He's saying awesome popcorn.
4161500	4162500	Look at that.
4162500	4163500	That's pretty fun.
4163500	4165500	I don't expect the venue to fly him out.
4167500	4168500	I know he's my burden.
4168500	4169500	No no no no.
4170500	4172500	They invited me out.
4172500	4173500	Beside.
4174500	4175500	Separate of you.
4179500	4182500	And so you went over my head and.
4182500	4183500	No.
4183500	4185500	And it turned out they'll only get you coach.
4185500	4186500	No.
4186500	4188500	I didn't go over anybody's head.
4188500	4189500	OK.
4189500	4190500	What airline is it.
4191500	4192500	Jet Blue.
4192500	4193500	They listen to the podcast.
4193500	4194500	No longer.
4196500	4197500	It's true. Yeah.
4198500	4199500	All right.
4199500	4200500	James you understand.
4200500	4201500	I had your droids.
4201500	4203500	You understand the basic idea here right.
4203500	4204500	No.
4204500	4205500	You're going to listen.
4205500	4206500	Do I have to pretend I get it.
4206500	4210500	You're going to listen to Spencer lay down the rules and watch the four of us make no
4210500	4211500	sense out of what's going on.
4211500	4214500	I did it once years ago and it was widely panned.
4214500	4216500	On this very podcast.
4216500	4217500	Did you.
4217500	4218500	Did you.
4218500	4219500	Did you.
4219500	4222500	Think of following up looking at some Reddit thread or something.
4222500	4223500	Oh no no no.
4223500	4226500	It was they sent they sent reviews to my house.
4228500	4229500	OK.
4229500	4232500	All right Spencer let me know when you're ready to go and we'll do a little recap.
4232500	4233500	Give me the pot.
4233500	4234500	Give me give it to me.
4234500	4235500	He's not going to eat that on top of it.
4235500	4236500	Give me.
4236500	4237500	I'm starving.
4238500	4239500	Fucking.
4239500	4240500	I fucked up.
4240500	4241500	I didn't think about it.
4241500	4243500	There's probably butter on it.
4243500	4244500	Yeah.
4244500	4246500	And there's probably butter on it.
4246500	4247500	You want some.
4247500	4248500	No.
4248500	4249500	Butter on it.
4249500	4251500	No popcorn is good for you.
4251500	4256500	But it's got whole grains they say which seems like a cheap.
4256500	4260500	It's got whole grains like corn like whole fucking kernels.
4260500	4261500	It's a whole grain.
4261500	4263500	That's as whole as a grain can get.
4263500	4265500	A whole kernel is a grain.
4265500	4266500	Corn doesn't seem like a grain.
4266500	4268500	Corn seems like a like a bunch of fruits on a stick.
4268500	4269500	It's a whole grain.
4269500	4271500	It's a whole bunch of grains.
4271500	4272500	Right.
4272500	4274500	I'm not going to write tonight.
4275500	4277500	Don't get to be one of your popcorn hazes.
4278500	4279500	Blackout popcorn.
4279500	4280500	Yeah.
4280500	4282500	Soapy's Choice fucking Kevin Kline.
4282500	4283500	I know you.
4283500	4285500	You'll have to fund poppy corns aren't you.
4289500	4290500	Thanks the facts.
4290500	4291500	All right.
4291500	4293500	Are we all ready to pay attention to Spencer now.
4293500	4294500	Yeah.
4294500	4295500	That sounded accusatory.
4296500	4297500	It's all good.
4297500	4298500	To them.
4298500	4299500	Right.
4299500	4300500	No I know.
4300500	4304500	I think you're accusing me of not being ready to be listened to.
4306500	4307500	All right.
4307500	4308500	Here we go.
4309500	4314500	Last time on Harmon Time our heroes were still in that fight.
4314500	4319500	They had gotten in that fight to find Patchens who had gotten in way over his head.
4319500	4322500	And they did get in way over their heads but they fought.
4322500	4328500	It was a good fight and they basically won because what happened.
4328500	4333500	A dwarf came out with a wiffle ball bat and teleported Jeff who is currently a tree into
4333500	4334500	a shed.
4334500	4336500	And then a bear showed up.
4336500	4338500	His name was Bernie Mac.
4340500	4346500	The fight finished when one of the guys dropped his gun and then someone I think it was Steve
4346500	4350500	like cut him real bad with the sword and he started screaming and crying.
4350500	4355500	And then like a dude came back to life and was a vampire and ran away.
4355500	4361500	Anyway find out whether or not they'll solve the mystery.
4364500	4365500	Thank you Spencer.
4365500	4373500	So let's look around the room and see what has the dust settled and we can look around
4373500	4374500	and see.
4374500	4376500	So Jeff you've made it back to the guys.
4376500	4379500	You're back in the underground of this theater house.
4379500	4381500	You're in the storage room.
4381500	4385500	And James you're playing Bernie Mac who's a bear that literally just showed up and can
4385500	4386500	talk.
4386500	4389500	So you could do what a bear can do.
4389500	4393500	Imagine being a bear that can talk pretty much there.
4393500	4396500	Like country bear jamboree.
4396500	4400500	Except more dangerous or the same amount of dangerous.
4400500	4406500	Didn't somebody die a long time ago the country bear jamboree at Disneyland?
4406500	4408500	Why are you looking at me?
4408500	4409500	It's not the D&D.
4409500	4411500	They got mauled by an animatronic bear.
4411500	4412500	It's called eyelines.
4412500	4415500	I don't want to upstage everybody by looking at this guy over here.
4415500	4422500	He came swinging down on a porch swing and then just mauled them.
4422500	4425500	So right in this theater we got Bernie Mac the bear.
4425500	4426500	Yep.
4426500	4428500	You got this guy who's screaming and bleeding.
4428500	4430500	Kind of like a hostage.
4430500	4434500	Everyone else is dead.
4434500	4435500	But I can talk.
4435500	4436500	Hey Carlos.
4436500	4440500	Carlos interrogate this guy before he bleeds out.
4440500	4442500	I interrogate this guy.
4442500	4443500	Okay.
4443500	4444500	How do you want to do it?
4444500	4447500	I put my foot on him.
4447500	4449500	No I can't do that.
4449500	4450500	I can't do that.
4450500	4453500	Classic criminology.
4453500	4459500	Well can I use a form of this spell?
4459500	4463500	You know I have like cure light wounds and I can use those to inflict wounds.
4463500	4469500	Would that be to say that I could like could I use my wound affecting energy to kind of
4469500	4478500	like basically magically open and shut his wounds?
4478500	4482500	You can do that but would take like basically the last of your magic because you've been
4482500	4484500	casting a lot of spells today so you're pretty low.
4484500	4485500	Well it should be worth it.
4485500	4487500	I'm sure it's going to be a jackpot of information.
4487500	4492500	I have the spell stabilize which can cause a dying creature to stabilize their condition.
4492500	4493500	So you can kill him.
4493500	4495500	I don't think we want him stabilized.
4495500	4503500	I think we're going to milk the fruit that is a man on the cusp of both worlds.
4503500	4508500	Wow.
4508500	4514500	You exist on the threshold of what the church of silver light regards is worthy.
4514500	4516500	You can make a choice.
4516500	4522500	Provide us with information that will guide the light to cleanse the world and slip back
4522500	4530500	into mortality or lose your grip forever and plummet in the margins of the forgotten.
4530500	4536500	Damn.
4536500	4538500	Not bad.
4538500	4541500	He goes oh yeah no okay.
4541500	4543500	What do you want?
4543500	4544500	That's crazy.
4544500	4549500	I just got into this because I love acting.
4549500	4553500	Yeah it seems like someone's acting like they don't have the information that we want.
4553500	4554500	I'm not.
4554500	4556500	Where is the gem.
4556500	4558500	I don't know what you're talking about.
4558500	4559500	Patrons gem.
4559500	4560500	No I'm kidding.
4560500	4562500	I don't say Patrons gem.
4562500	4563500	God damn it.
4563500	4564500	This is the part where I fail.
4564500	4565500	You can ask me questions.
4565500	4566500	I have a question.
4566500	4567500	Okay.
4567500	4568500	Am I the bear that mauled the guy?
4568500	4570500	Is that why he's been hurt?
4570500	4571500	Not that guy.
4571500	4572500	Oh okay.
4572500	4573500	You killed the other guy.
4573500	4575500	The guy you killed is dead.
4575500	4578500	Okay so I was worried you were undoing my work.
4578500	4579500	Sorry.
4579500	4584500	I look through the body of the dead man.
4584500	4586500	Okay he's already been looted by Jeff.
4586500	4594500	Okay I look through his body.
4594500	4596500	What does that mean?
4596500	4599500	I don't look through his clothes.
4600500	4604500	I look through his body because I'm like Swamp Thing.
4604500	4605500	All right.
4605500	4607500	So I'm gonna look inside.
4607500	4608500	Uh-huh.
4608500	4609500	Right?
4609500	4610500	Right.
4610500	4611500	What do I see?
4611500	4612500	What do you mean by look inside?
4612500	4614500	Like using extra sensory perception?
4614500	4619500	I look inside his body.
4619500	4621500	Okay.
4621500	4624500	You mean like looking inside his open wounds?
4624500	4626500	Like do you open him up?
4626500	4627500	Yeah.
4627500	4628500	His butthole?
4628500	4629500	Okay.
4629500	4630500	All right.
4630500	4636500	So I open up his mouth and I look inside his body.
4636500	4637500	Yeah.
4637500	4639500	Swamp Thing style.
4639500	4640500	Right.
4640500	4644500	He looks like a like a person.
4644500	4646500	You learn interesting things.
4646500	4647500	And?
4647500	4649500	About humans.
4649500	4650500	And?
4650500	4651500	That's all.
4651500	4654500	I didn't read Swamp Thing.
4654500	4655500	Or listen to it.
4655500	4657500	Was it a sound?
4657500	4661500	It was a sound.
4661500	4662500	Okay.
4662500	4667500	The environment gets mad at people and sends Alan Moore to write something.
4667500	4668500	No.
4668500	4674500	A snakey vine like down his throat and look around, you know?
4674500	4675500	Yeah.
4675500	4676500	Okay.
4676500	4677500	So the dead guy.
4677500	4678500	Yeah.
4678500	4679500	No.
4679500	4680500	He's normal but dead.
4680500	4681500	Okay.
4681500	4682500	All right.
4682500	4683500	Normally dead.
4683500	4684500	Yeah.
4684500	4685500	He's entirely president today.
4685500	4686500	Hey guys.
4687500	4689500	You guys see all that unfold?
4689500	4690500	All right.
4690500	4691500	Spencer.
4691500	4692500	Spencer.
4692500	4693500	You said I could ask you questions.
4693500	4694500	Yeah.
4694500	4695500	Yeah.
4695500	4698500	I would take a fucking like a lifeline there and go okay.
4698500	4699500	I'm drunk when we're playing this.
4699500	4700500	Yeah.
4700500	4702500	I don't remember over the spans of the ages.
4702500	4703500	Right.
4703500	4704500	Who could?
4704500	4706500	Like we were we were we were on this case.
4706500	4708500	We we traced these guys down.
4708500	4714500	It's like they like we're looking for the these like dragon born kind of dragon marked
4714500	4715500	guys.
4715500	4716500	Right.
4716500	4717500	A little bit.
4717500	4718500	So okay.
4718500	4720100	You came here looking for the gym.
4720100	4722260	You found that Shrove might know where the gym is.
4722260	4724700	You took Shrove hostage and he wasn't talking.
4724700	4728060	You found a tiny bit of information about a drop point but you didn't know where the
4728060	4729060	drop point is.
4729060	4730060	Right.
4730060	4731060	Okay.
4731060	4732740	He thought Shrove could help you out but he didn't and he fucked off.
4732740	4736180	So then you went looking essentially for more clues and that's where you are now.
4736180	4737180	Okay.
4737180	4738180	Still trying to find that drop point.
4738180	4739180	All right.
4739180	4740180	So here we go.
4740180	4741180	Where's Shrove?
4741180	4742180	Yeah.
4742180	4743180	There we go.
4743180	4744180	I don't know man.
4744180	4745180	I think he was fighting the fire.
4745180	4746540	That's what's happening right now.
4746540	4749260	You piece of shit.
4749260	4750580	I didn't do it.
4750580	4755140	By the power of the silver flame you shall know a fire.
4755140	4756140	I'm complying.
4756140	4757140	What?
4757140	4758140	I'm complying.
4758140	4760020	Well where's Shrove?
4760020	4761020	I don't.
4761020	4762020	I don't.
4762020	4763020	I think he might be fighting fires.
4763020	4764020	Okay.
4764020	4765020	One more thing though.
4765020	4768260	The silver flame is not helping with the fires that are raging.
4768260	4769260	Right.
4769260	4770620	Thank you.
4770620	4772140	I could connect those dots.
4772140	4773140	That would be fine.
4773140	4774140	What are you guys talking about?
4774140	4776380	I want to ask you one more thing.
4776380	4777380	Wait.
4777380	4783300	So this is where Shrove and where's the drop point?
4783300	4786260	Probably where the fire is.
4786260	4787260	Let me.
4787260	4793100	No, I don't think it is, but it seems like the fire might get close if you don't hurry.
4793100	4795260	I'll tell you where it is.
4795260	4796420	Where it is.
4796420	4799740	It's in Boykin's pig farm.
4799740	4801140	What's your name?
4801140	4808300	My name is Berf-Boro Binkus.
4808300	4812300	Do your friends call you something shorter?
4812300	4813300	Binkus.
4813300	4814300	Sorry?
4814300	4815300	Binkus.
4815300	4816300	Binkus.
4816300	4817300	Binkus.
4817300	4818300	Binkus.
4818300	4819300	Binkus.
4819300	4820300	Binkus.
4820300	4821300	Binkus.
4821300	4822300	Binkus.
4822300	4823300	Binkus.
4823300	4824300	Guys.
4824300	4825300	Guys.
4825300	4826300	Guys.
4826300	4827300	Guys.
4827300	4828300	Do you guys smell fire?
4828300	4829300	Binkus.
4829300	4830300	Binkus.
4831300	4833300	I can't understand.
4833300	4836300	Let's just all decide to call him Binkus.
4836300	4837300	Binkus.
4837300	4838940	Is Binkus close?
4838940	4839940	It's very close.
4839940	4845060	Alright Binkus, you lucked the fuck out by the power of the silver flame your wounds
4845060	4846060	are healed.
4846060	4847060	Oh.
4847060	4848060	Thanks man.
4848060	4849060	Move on.
4849060	4850060	Move on.
4850060	4851300	Tell us the name of the pig farm again.
4851300	4854700	Boykin Hodges Pig Farm and Stabley.
4854700	4855700	Let's go.
4855700	4859300	So help me Christ Binkus.
4859300	4861980	One's Christ is invented.
4861980	4865180	I'm scared of this fire.
4865180	4867780	It's alright Birney.
4867780	4873580	You can call me Orson Welles, the bear.
4873580	4878060	So help me Christ Binkus if we go to that fire and it doesn't pan out for us and yes
4878060	4882180	you have to allow for the fact that we're inept so it might not work out for us through
4882180	4883520	no fault of your own.
4883520	4886020	We will be back and we will fuck you up.
4886020	4887420	We'll fuck up your family.
4887420	4892360	We will rip the children from your mother's arms and we will put them in things that
4892360	4897500	we convince people aren't cages and if they still convince us they're cages we'll say
4897500	4900420	it was Obama's idea.
4900420	4905700	We can go round and round Binkus.
4905700	4907980	I'm trying to help.
4907980	4909100	How do we get to the pig farm?
4909100	4910100	Which direction is it?
4910100	4911100	North.
4911100	4912100	Wait.
4912100	4913100	Guys.
4913100	4916300	I have no direction so I can discern north.
4916300	4917300	Oh.
4917300	4918300	That way.
4918300	4919300	Alright.
4919300	4920300	Follow me motherfuckers.
4920300	4926020	Am I cool to join you guys?
4926020	4927020	Yes please.
4927020	4928020	Yes please.
4928020	4932380	I'm not sure if I'm loyal to your party but it seems fun for now.
4932380	4937100	A lot of people that have no direction you're not supposed to follow.
4937100	4941340	No one tells bear rules.
4941340	4944980	Okay so you head outside and there is indeed a fire.
4945660	4950980	It started by the tavern and it's grown wildly out of control on account of the town is protected
4950980	4956460	by a big flammable wall so it's starting to engulf the town as you head north to Boykin
4956460	4958700	Hodges pig farm which you do.
4958700	4961500	Did we start this fire?
4961500	4965380	We didn't start the fire.
4965380	4969100	It was always burning arguably.
4969100	4974540	It seems too big to have started it but you do remember starting a fire.
4975220	4980020	It wasn't my brand of cigarettes.
4980020	4986380	You go to the pig farm it's it's like a farmhouse with like a little with a little no sorry
4986380	4992220	it's a farmhouse with a barn so then the barn is next to the stablery which is like a customer
4992220	4997100	facing stablery where you put your own horses and stuff and then out the back behind the
4997100	5000500	barn that's where all the pigs is.
5001220	5003860	We got to save these pigs.
5003860	5004860	Pigs are in back.
5004860	5010260	No but we have to find so we should we should have asked specifically where the drop point.
5010260	5011260	Who?
5011260	5015020	Bingus we should have we should have asked him.
5015020	5016020	You can ask him.
5016020	5022660	Oh Bingus was specifically where at the pig farm like because a point sounds very specific.
5022660	5029180	Oh yeah I'll tell you it's in this corner of the third pig stable.
5029180	5030180	Thank you.
5030180	5035220	Oh so help me Christ Bingus if you're lying.
5035220	5041460	Do we have to throw birds at it though all the pigs to make them fall down.
5041460	5044820	I don't know nothing about no pig fighting.
5044820	5053140	Bingus if you're lying I'm going to wear your ass like a face mask.
5053140	5059300	I'm going to go for trick or treat as your ass and it's going to be one of those costumes
5059300	5064820	where it's just most of the attention is put into the plastic your ass face and then
5064820	5070980	the rest is just a plastic apron with a picture of you from head to toe on it which a lot
5070980	5074900	of people will point out it's not a costume.
5074900	5079620	With a singular hold before your mouth or your one eye.
5079620	5080700	For one eye probably.
5080700	5082740	I don't think Bingus wants to find out.
5082740	5083740	Okay.
5083740	5087540	Yeah man I don't know you should talk to Boykin Hodge.
5087540	5088540	We'll talk to him.
5088780	5094700	Hey guys I don't know I mean like what are we doing here.
5094700	5100780	I mean I'm starting to question a lot I mean you guys were cool for letting me come along
5100780	5103420	and we had some fun but what are we doing.
5103420	5109420	All right let's get can we get to the stick it out Gary go to his name is Gary Shambling
5109420	5110420	he's a Shambling Mound.
5110420	5111620	I'm a Shambling Mound.
5111620	5114180	I'm getting hungry can I eat a pig.
5114180	5115180	There we go.
5115180	5116180	Yeah.
5116180	5117180	We'll incentivize Barony Mac to come along.
5117300	5123860	Let's go to the pig farm third pigs pen from the left in the corner drop point.
5123860	5125620	No one should be eating the they're adorable.
5125620	5130460	We got to save the pigs from the fire is crazy.
5130460	5133020	Come on Gary back me up on this.
5133020	5139460	Let's just do one thing one thing right until we decide I'll just have this pig sitting
5139460	5146500	in front of me with an apple and I'll be deliciously sharpening my knife.
5146500	5150460	Let's go to the let's go to the cocksuckin pig farm.
5150460	5159620	Wait a minute what kind of pigs are these pigs are having a real blast.
5159620	5160620	These what.
5160620	5165620	This is a different kind of pig farm.
5165620	5172900	I start wandering off just like my muttering wait are these just sex pigs.
5172900	5173900	Yes.
5173900	5174900	Yes.
5174900	5179020	That you can do whatever you want to these pigs it's pretty it's pretty gross.
5179020	5180020	It's a little gross.
5180020	5181020	It's a little hot.
5181020	5184580	The customer is always right.
5184580	5190020	Is there like what's the cutest one.
5190020	5196180	Like what what what like Charlotte Charlotte OK.
5196180	5199220	Why is she the cutest.
5199220	5200220	Let's just go.
5200220	5202220	I go to the third pig pen.
5202220	5203220	All right.
5203220	5209780	So you go back to the pig area and you see appear almost as if supernaturally like this
5209780	5211980	crazy old bald guy.
5211980	5220260	He looks like a really angry farmer like a like an old hard worn farmer sir.
5220260	5223180	He goes.
5223180	5225580	Are you choking.
5225580	5227900	I think we got to do the Heimlich on this guy.
5227900	5228900	You all right.
5228900	5229900	He points to his voice.
5229900	5232260	He's about to have vocal surgery points.
5232980	5235660	He points to a big button on his chest.
5235660	5236660	He points.
5236660	5237660	What.
5239300	5240940	I think I think he does it.
5240940	5242260	I think he can't speak.
5242260	5245940	I think he's lost the ability to point to you while he points at me.
5245940	5246940	He points at you.
5246940	5250020	Well he's I can speak.
5250020	5252220	Oh he's pointing like Bingo like he can't speak.
5252220	5253300	Hey why can't you speak.
5253300	5254300	Are you dying.
5254300	5255300	No.
5256020	5257660	Does anybody know sign language.
5257660	5260660	Are you a good person.
5260660	5261660	He nods.
5261900	5262900	He's what.
5262900	5263900	He nods.
5263900	5264900	He nods.
5264900	5265900	Is this the drop point.
5265900	5266900	Yeah.
5266900	5267900	Darth Vader would nod.
5267900	5269580	He looks at you quizzically like he does.
5269580	5273940	Do you know who Darth Vader is.
5273940	5274940	Can anyone.
5274940	5275940	Does anyone.
5275940	5277860	Darth Vader would nod.
5277860	5278860	Wait.
5278860	5279860	Well listen.
5279860	5280860	We're here.
5280860	5281860	Wait.
5281860	5282860	I can.
5282860	5288540	I can do sign language but whenever I do I accidentally slash people with my claws.
5288540	5291860	You have bad depth perception.
5291860	5293300	We're bigger than I think.
5293300	5294940	We're here for the drop.
5294940	5295940	Yeah.
5295940	5299780	He just looks at you like he doesn't he doesn't know you're saying.
5299780	5302220	Have you heard of anyone named Patchens before.
5302220	5303220	He shakes his head.
5303220	5304220	No.
5304220	5305220	No.
5305220	5306220	You have a gym.
5306220	5307220	He.
5307220	5308220	Waiting for a gym.
5308220	5311660	He squints his head and he goes no.
5311660	5313980	You waiting for a delivery.
5313980	5319820	He thinks like he's remembering and then he goes out outside out around back of his
5319820	5320820	house.
5320820	5321820	He goes.
5321820	5322820	Hey.
5322820	5323820	Hey.
5323820	5324820	Where are you going.
5324820	5325820	Oh.
5325820	5326820	I guess we follow him.
5326820	5329100	When you said this guy appears you don't mean like ethereally.
5329100	5330100	No.
5330100	5331100	But like.
5331100	5332100	He's a normal guy.
5332100	5334980	Like in those scenes where it's like a creepy guy and it's like oh he wasn't there.
5334980	5335980	You know.
5335980	5336980	Out of the shadows.
5336980	5337980	Yeah.
5337980	5338980	Okay.
5338980	5339980	Blood Archer.
5339980	5340980	Right exactly.
5340980	5341980	Okay.
5341980	5342980	That's exactly the trope I was trying to hit.
5343980	5344980	Well.
5344980	5346980	I can't take this guy.
5346980	5347980	But look.
5347980	5351940	Did he walk out beckoning us to follow or he just walked out.
5351940	5353300	He was being creepy about it.
5353300	5354300	So you couldn't tell.
5354300	5355300	Okay.
5355300	5356300	I.
5356300	5357300	Like.
5357300	5361100	What's my like seeing where I conjure up like a light so we can see in the darkness
5361100	5362100	of the pen.
5362100	5363100	Dancing lights?
5363100	5364100	Sure.
5364100	5365100	Yeah.
5365100	5366100	Sure.
5366100	5367100	I just have light.
5367100	5368100	I can make things a torch.
5368100	5369100	Oh yeah.
5369100	5370100	Okay.
5370100	5371100	So I reached out and picked up a stick.
5371100	5372100	Poof it's a torch.
5372100	5373100	I don't know that he was in.
5373100	5374100	The corner he was in?
5374100	5375100	Boy.
5375100	5376100	Just the whole pen.
5376100	5377100	Wait.
5377100	5378100	Say that again.
5378100	5380300	I examined the pig pen that we discovered.
5380300	5383060	So you are following him then.
5383060	5384060	Okay.
5384060	5385060	I.
5385060	5386060	You.
5386060	5387060	Did he get up and leave the pig pen or he still?
5387060	5388860	You didn't get quite to the pig pen.
5388860	5389860	Oh okay.
5389860	5390860	Oh.
5390860	5393220	We thought that we were arriving at the pig pen and meeting him.
5393220	5394220	Right.
5394220	5395220	Right now he was just like.
5395220	5396220	Okay yeah.
5396220	5397220	Sorry.
5397220	5398220	Sorry if I was wrong.
5398220	5399220	Let's follow him.
5399220	5400220	Let's see where this leads.
5400220	5401220	Okay.
5401220	5405980	So he comes back to the pig pen and he goes and stands in front of the third one and he's
5405980	5407900	just kind of like looking at it.
5407900	5408900	Looking in the corner.
5408900	5409900	And he goes.
5409900	5410900	All right.
5410900	5414900	Will somebody give this guy the Heimlich?
5414900	5415900	Heimlich?
5415900	5416900	You don't.
5416900	5417900	I get it.
5417900	5418900	I.
5418900	5419900	I.
5419900	5420900	I.
5420900	5421900	I.
5421900	5422900	I.
5422900	5423900	I.
5423900	5424900	I.
5424900	5425900	I.
5425900	5426900	I.
5426900	5427900	I.
5427900	5428900	I.
5428900	5429900	I.
5429900	5430900	I.
5431280	5432240	I.
5432240	5433240	Well.
5433240	5435100	We had you had.
5435100	5437280	You have those muddy sacks.
5437280	5438280	I.
5438280	5439300	I leap on that sack and I.
5439300	5440300	And I.
5440300	5441300	And I open it up.
5441300	5442300	Oh,.
5442300	5443300	What do we do it?
5443300	5444300	What is...
5444300	5445300	I look inside.
5445300	5446300	There's a gem.
5446300	5447300	Oh.
5447300	5448300	God dammit, we did it.
