start	end	text
0	16820	Hello, everybody. Happy Mother's Day. Welcome to Harman Town. Happy Sunday. Once again,
16820	21100	Harman Town is in session. I'm back. Jeff Davis, your Comptroller. Won't you please
21100	32140	welcome to the stage the Mayor of Harman Town, Mr. Dan Harman. Thank you. Happy Mother's
32140	40180	Day. No more wire hangers, you guys. We watched Mommy Dearest today and in bed, Erin and I
40180	47900	did. We weren't doing it thematically. We'd been on this Joan Crawford kick and we just happened
47900	52380	to be else and she turned to me. We're watching Mommy Dearest on Mother's Day, but that's a good
52380	57460	one to watch at any day. I think about that movie a lot, mostly because I want her bathroom from
57460	61540	that first scene with all the shower nozzles. I want a lot of that house, yeah. That house is
61540	68940	really good. Watching it made me remember, because that was like when I was a kid and I
68940	73820	remember, you know, America was fascinated with that movie. My mom really liked that movie. She
73820	78420	was into it. She'd quote it a lot. She'd joke like no more wire hangers like when she would
78420	84780	find herself getting hysterical. She'd self-efface by saying stuff like that, but also she would do
84780	91540	so much from the movie and I was like, did she get the idea from the movie or was she, or did the
91540	97180	movie make her feel better by, you know, it's like, oh, I didn't use a whole can of comic cleanser. I
98140	104980	just wanted to clean the bathroom a little bit. I don't know. Happy Mother's Day. My mom, I called
104980	113180	my mom today, as you all did. Yeah, we did. Or did you? Yeah. Anybody not called their mom? See,
113180	117260	you weren't making the joke that Goldberg was making. He called out, yeah, we did. Called my
117260	124340	mom. Get it? He fucked my mom. Oh, okay. Well, payback is fair, right? Yeah, sure. No, you've
124340	130340	been fucking everyone's mommas for a long time now. Yeah. I called her and I got great news. She
130340	140540	loves season four of community. She's very happy with it. She was quoting episodes. She's got it.
140540	144700	And then I said, yeah, we should come up. We should get together sometime. And she went, yeah,
144700	150940	cool, cool, cool, cool. Oh, sorry. Sorry. And I just laughed about it. I was like, you're sorry
150940	158860	about that? I don't understand. So it registers in your brain that that's an issue socially,
158860	165460	but you just cool, cool, cooled for 10 minutes about the thing. And then I was on speaker phone
165460	171980	because my dad was in the room. So then she did a classic Harmon move. She was like, what? Huh?
171980	178260	What? I don't understand what you're saying. And I was like, never mind. What was your question?
178260	182100	She's like, question. It's not an inquisition. I was like, I'm sorry. What the fuck's going on?
182100	189740	God damn it. Every year. Have you watched season four? Do you watch it? No, no, I haven't. I just,
189740	196220	for selfish reasons and for altruistic reasons and just philosophical reasons, I still haven't
196220	201980	watched it. It's on my TiVo. I kept the season pass. So every time we Game of Thrones night,
201980	207020	like tonight, we go there and I see a little folder that says community. And I go, it's like
207020	215980	looking at Instagram, you know, your ex-girlfriend out there. I picked that restaurant. I introduced
215980	229540	her to that restaurant. I, I, I, I sewed that dress. Weird relationship. Uh, uh, so, uh, I was good.
229540	232820	That was going to be part of my segment called things. Dan Harmon's not allowed to complain
232820	238940	about cause they make them sound like a rich douche. Uh, my mom loved season four community. Um,
238940	246140	uh, the other items are, uh, there's a, I have a black widow infestation in my backyard. You're
246140	253460	allowed to complain about that. Not to people who don't have backyards. No, you've let, you've
253460	257580	let them off the hook. Now they don't feel bad about not having a back yard. Guys stay in your
257580	264860	apartments. Backyards have black widows. Erin was in the backyard. She moved a ceramic pot or
264860	271340	rabbit or something. And, uh, uh, and a, a black widow spider, like from the movies crawled across
271340	279020	her hand and she, she killed it and then found like it's egg sack inside the ceramic rabbit. And, uh,
279020	284460	yeah, they're all over our garage too. They're all like all up in our garage. She keeps telling me
284460	288060	these stories about black widows crawling on her. I'm like, what is it? It's like, it's like
288060	293980	Christopher walking in deer hunter. It's like, stop whatever you're doing. Knock it off. Stop
293980	300700	putting your hands under ceramic items. This is building a tree stuff like in flash Gordon, uh,
300700	305100	in our front yard so she could just put scorpions in and reach into it every day. If I have a golf
305100	310780	ball that goes slightly into a bush, I get the longest club in the bag. Unless you live anywhere
310780	319580	with snow on the trees. Yeah. Don't touch a bush. I, I, I, I came to California with that knowledge
319580	324780	just from time life books about spiders. I was, I was a big spider guy when I was a kid. I loved
324780	328540	spiders. I would, I would, I would go out behind the garage in Wisconsin and I would, I would, I
328540	333660	would play with bugs. I loved bugs. I was fascinated with them. I, I probably would have been an
333660	341660	entomologist or something or an arachnidopia. And I would just, I would just play with spiders
341660	347420	and bugs and stuff. So much so that my, my, one of my aunts, uh, for Christmas gave me this big
347420	353580	colorful book, uh, for adults about spiders because there was something I was really into.
353580	359660	And I read the book. There was, it was just a scientific book about the world's most poisonous
359660	365420	spiders. Uh, and, uh, and I remember reading like descriptions of like, I, I think the black
365420	371580	widow, I think it was the black widow. It said something like, uh, uh, yeah, it's a, it's a,
371580	379500	it remains relatively still, but it also has a lot of, but, but it's reflexes are so fast that it
379500	387020	could, it can traverse, uh, the length of a broomstick and a human arm faster than the human, uh,
387020	393020	ability to drop the stick or something like that. Like, like purposely like using, uh, measurements
393020	399260	to terrify you. It will, it will be in your ear eating your brain before you can say there's a
399260	403100	spider in my ear eating my brain. I have, I have a pretty live and let live policy with ant, like
403100	406380	with bugs and stuff like that. I don't like ants. You know, it was a bunch of ants in their place.
406380	411420	So if I see one ant, that's the scout ant. So I do that. I whack that ant. So I make sure that
411420	414700	he doesn't go back and tell the tale about it. You put his head on a microscopic pike,
415660	417420	a little tiny curb and I kick his teeth.
420460	425580	I always leave, I always kill one when there's another one watching. And then I look at the
425580	429500	other one and I say, it doesn't work. Tell your friends. I've tried to tell your friends there.
429500	433340	It doesn't work. They do tell their friends and they go, oh, the breadcrumb is still there.
434140	438060	So now Kevin's dead. So if nothing else, we can eat Kevin
439660	443980	because they're insects or, or we can go, we can go team up on that asshole that killed Kevin.
444540	451020	In their dreams. Spiders know. I told you the story about me falling asleep one time,
451020	456220	when I was 24, I had a girlfriend. I was staying at her place and we were asleep naked. And I woke
456220	460620	up and there was a sound of what I thought was like a moth had gone into my ear. I was laying
460620	468540	on my left side and something that sounded like a one man band was in my brain. And it was, and I
468540	472300	jump up naked. I'm running around the room screaming. She's laughing because it looks
472300	481020	hilarious. But I hear it's that loud and it's freaking out. And I'm trying to like hit my head
481020	485580	and get it out and I'm punching myself in the ear. And she's like, what are you doing? I'm like,
485580	492300	it's a moth. It's a fly or bugs in my ear. And it was so loud and it was nonstop beating on my
492300	497980	like flapping on my eardrum. And I start, I punch myself in the head as hard as I can,
498860	505260	dazing myself and the bug. And then I hear, which I think was his heart.
507500	511580	I just, I just like dazed it and stunned it for a while. And then it starts going again. And every
511580	516540	time I try to, she goes like, she turns a light on, but I have to turn my head up to the light,
516540	521420	which makes the feeling of gravity is going to bring it farther into my brain. And I don't want
521420	525020	to do that. So I'm trying to like, like you try to get water out of your ear. That's not working.
525820	529660	So I've been told later on that way, if that happens, if a bug goes in your ear,
529660	533660	pour alcohol in there, like knock it out, get it drunk, fuck it up. And then at least
533660	537900	the insanity will stop. But I'm just losing my mind and punching myself. And she takes
537900	542060	me tweeters out and tries to get it. And at long last, and it takes a long time. We're both nude
542060	545580	in the, in the bathroom in the middle of the night. And she's like, we'll get you to the hospital.
545580	549900	Like I'll be insane by the time we get to the hospital. I seriously will lose my mind. It was
549900	554620	freaking me out. And the noise was so loud. And now it's, it's, it's scrambling. And I feel
554620	559900	the sensation of it burrowing in. It's going the wrong way. It's not going to go the way though,
559900	567500	the punching. It's like there's a crazy descended from hundreds of generations of spiders that
567500	573260	survived humanity. It's just a crazy giant outside. It's not going to go that way.
573260	577580	Knows exactly when to stay put. So she, she gets my head up this way into the light. So the air
577580	584220	is pointing up and she puts a tweezers down my ear and manages to get halfway into my brain and
584220	595500	pulls out a spider the size of a nickel and worth every penny. It's been our show. Good night,
595500	602860	everybody. And, and it flies out and we both scream because it's quite alive and it's pretty,
602860	608140	it's pretty scary looking and it hits the ground running. And so I barefoot just go wham and stamp
608140	615260	on it with a size 13 and a half barefoot foot. And I lift up my foot and it goes, it just shrugs
615260	625980	it off. There are days and there are days. I can't get a break around here. Like I want,
625980	633500	like I wanted to be in your ear. It looked like a barn. So it just fell down my ear. And you know,
633500	637820	they say that we eat, we eat lots of bugs in our sleep and don't know it. But I finally managed to
637820	641660	kill it. And then for the rest of the time we did it, which wasn't long, she kept putting fake
641660	650620	spiders in the bed. What? Yeah, just to be, I believe the word is asshole. And it's the worst.
650620	654860	So now like I used to sleep with like a pillow on my head and stuff. It's terrible.
656140	663660	All right. So now sleep tight, everybody. All right. My mom loves season four.
666060	669180	We're infested with black widows. We're going to have a guy come take care of it. That's why I
669180	673980	sound like an asshole because you guys couldn't have a guy come take care of it. I'm going to
673980	677660	call the black widow guy. I don't know who he is. Harvey Keitel is going to pull up in a Ferrari.
681020	685020	And you know, my animated show is going to take till December for you guys to get to see. I'm
685020	691260	very excited. That's another thing I'm complaining about. People keep spreading rumors about me
691260	698300	going back to season five of community. I'm complaining about that. And that navigation
698300	703820	system in my Prius, I keep dropping blue flags everywhere. That's the worst. You know what I'm
703820	709900	talking about. Yeah. Five percent of the audience going, who's got this goddamn navigation system?
709900	714060	Fucking blue flags and keep dropping blue flags. Anybody with a Toyota or Alexis, I think.
715180	720540	Every intersection, you can fucking drop a blue flag at random, random spots. I got blue flags
720540	725500	all over the city. There's a menu you can delete. I know, but you're never going to do that, are you?
725500	730620	I do. You're always on your way somewhere and you're dropping these blue turds all over. Precisely
730620	734460	when you're trying to do the opposite, which is figure out where you're going and you're putting
734460	739580	flags all over the thing and then you come out. Okay, I'm going to go home from work now.
740700	744700	Are you sure you don't want to go to one of these blue flags? You like so much? Go to Ivar. You
744700	753900	loved it. You put a blue flag there. No, Nicole. I call my car Nicole. I'm not going, I probably,
753900	759020	I'm just saying, Nicole Kidman thing? Is that my? Yeah, probably. I don't know. I don't name my car.
759100	767180	I have better things to do. I can't even name characters I create. The community has all my
767180	774780	friend's names. So that rumor on a deadline, I think the reason for it is because weeks ago,
774780	782060	Sony reached out through private channels, not that they would have ever reached out through
782060	789980	honest public ones. They were the way that big studios work is that they're in the business of
789980	794860	getting their shows syndicated. And I think that in the days before they were sure that
795820	801100	community would get that very important next 13 episodes, which to them, that's all it represents
801100	807500	is just the number 13. They don't care if any of those 13 are good or bad. They just needed those
807500	813660	13 so that they could not get fired by the machines that make the money from the 97 episodes.
815500	820060	It'll be very lucrative for me as well. We're all very happy. Everyone except the people that never
820060	826380	made any money and who got tattoos of Abbott on their thigh. We're all thrilled to pieces about
826380	832380	this episode. But back before it happened, when they were in the position of going, what can we
832380	837740	do to make sure this happens? They in their misguided bottom line minds were thinking,
837740	842460	well, let's sweeten the kitty. Like maybe we could tell NBC, Dan will come back and that way there
842460	846780	will be all kinds of press. And that's how little they care. That's how little shame they have. They
846780	854860	don't care. Like to them, that wouldn't be winning or losing. They don't care. And I think that in
854860	859020	the ensuing weeks during which time NBC finally made a decision to pick up the show, so it doesn't
859020	865580	matter. Someone's assistant probably told someone's assistant to someone's friend over drinks
865580	871980	that that conversation happened for a second and resulted in maybe a deadline article,
871980	875580	which resulted in a bunch of other press about it. So you're going back?
877260	883500	Tuesday. No, my point is I don't think it's a question that I would even have a yes or no
883500	888620	answer to. I don't think that that is a choice that I have. I haven't read this article for
888620	893180	all. I know you're perpetuating this myth right now. I probably am. I'm trying to make
893180	897740	Harmontown a thing you should come to and listen to, I guess. I don't know. I'm participating.
897740	904460	Where's my clicks? Wait, but Chevy's not in the show anymore. We got to get him here. Well,
905980	914060	why? Because it'll be insane. Why not bring Chevy Chase once to Harmontown? Did you see
914060	919340	him on SNL? No. Do you understand what happens when he walks into a room? Everything gets
919340	924860	complicated. I'm not saying it's going to be fun. I'm saying that we all muscle up. It's like
926380	933900	going to play paintball. It hurts. It's sweaty. You get bruised. I just don't see it the way you
933900	941500	see it. I call him. He calls me sometimes. The concept is funny on paper.
945020	949100	Can we skype him? Can we get a screen up and do a little via satellite thing?
950380	951660	Yeah, he seems pretty tech savvy.
955340	962140	He's probably skyping me right now. I can't figure out how to filter it right. He can.
962140	971180	He does a lot of PHP programming in his spare time. I just wanted to address that because
971180	976300	people tweet me and I thought maybe that would be fun. Worth your $10 alone to come out and hear
976300	982620	me say out loud. All right, so I think that ends the I had stuff to talk about segment.
982620	987020	I saw an Arrested Development poster outside Meltdown. I got really excited. It was cool.
992700	996700	Might be a little cameo in one of those episodes by a certain fat alcoholic.
997100	1003820	Close to your hearts. May or may not have gone out and visited that set.
1005340	1011660	I also had to edit out the whole for anyone that was here when I when I described me being on the
1011660	1020220	set of a Terrence Malick movie with with what's his name Batman in it. Christian Bale. Did you
1020220	1024860	know John Landis is the new Batman? Did you know that? I was I was very surprised. It's weird,
1024860	1030780	but they're guys are going back to a kind of like classic feel. I was I was I was I told the story
1030780	1034140	about going and being on the set of a Terrence Malick movie with Christian Bale and then I had
1034140	1038380	to edit the whole thing out for the very specific reason that as Aaron pointed out to me on the way
1038380	1044860	home. I got to there's it's okay for me to say that I got to do that and how cool it was. It's
1044860	1052380	not okay for me to reveal absolutely anything about the film itself, which I did in the process of
1052380	1057980	talking about the movie. So I lifted the whole thing out. But that and the only thing that that
1057980	1062220	I the only thing that's left is that I get to say I did this thing. Who cares? It's like hearing
1062220	1067180	someone talk about a slot machine in Vegas. It's amazing. I was up and then it was down. Who the
1067180	1074380	fuck yourself? Who cares? Or like when people tell you about their Dungeons and Dragons characters.
1075020	1079020	But he was a level five mage and he had an eye patch and a hawk on his dick.
1079740	1089260	It's make believe. While you were gone, Bill poisoned us. Hello, Bill. I just heard that hilarious.
1089260	1094700	Bill, were you also the guy we were talking about? Where are my cookies? Did those get
1094700	1098940	destroyed in the bonfire you had afterwards? I don't know. Maybe they're back. Maybe they're
1098940	1103980	backstage. I would have been the only one that lived had everybody died from the beef jerky.
1103980	1112380	Yeah. Bill, settle a bet. Spencer said you were the benign deviance guy.
1112380	1123900	Yes. Okay. So Bill wasn't a stranger. Wasn't a stranger bearing meat. He was our old friend.
1123900	1127740	Did you call up the supplier? Was that neglect on your part? Did you just leave it out too long?
1128540	1131100	I waited too long because I had to miss a show.
1132860	1140620	He's blaming us now. Oh, you had to miss a show. Okay. Well, we all made it. It was very funny.
1141900	1146140	What was your emotional takeaway from all that? There was kind of a roller coaster of whether
1146140	1152620	or not you were a good person or a bad person. In the moment, I sort of shut down.
1152620	1163100	In the moment, I sort of shut down, but then when I heard everybody applauding in the podcast,
1163100	1167420	when I listened to it later, I finally felt like I could forgive myself because I heard everybody
1167420	1173420	like going, yeah, but I could not hear that. Oh, really? That's interesting. That happens.
1173420	1178460	I think that's a, that's some kind of weird, uh, uh, yeah, when I, when I'm on stage,
1178460	1183420	like I all often are actually less now than another, but it's like, I, I've already, yeah,
1185900	1189980	worrying about other, what other people think like causes a kind of like weird,
1189980	1195020	the same thing as when you're running a marathon and, uh, those drugs fled your body that let you,
1195020	1199100	don't let you know that your muscles are shredded and that you're in pain and stuff. Like, uh,
1199100	1202700	it makes you kind of deaf and insensitive to things. And so you're kind of in your own little
1202700	1208380	bottle in your head, I think that's what happened to him or, or it was the fungus.
1209500	1213580	You may have poisoned yourself. Yeah.
1216220	1220700	After the show, I crawl up on the fire escape to get as close as possible to the sun. And then
1220700	1229180	just as a leaf comes out of my head, uh, that is the worst and yet the coolest fungus of all,
1229180	1233420	the one that makes ants brains go crazy and makes them climb a tree. Yeah. That's nuts.
1233420	1237340	That's the way you got to think about it. The thing that's terrifying about that is,
1237340	1242940	is this that there was a day before that fungus existed. And then there was a day,
1242940	1248940	it was Wednesday of maybe 6,000 BC. We don't know. I mean, but, but, but, but, but that fungus,
1248940	1254460	like, like from the aunt's perspective, like Wednesday was fine. And then Thursday, like,
1255180	1262300	you know, Nathaniel was going like, and then, and then like, because it was, I don't know. I mean,
1262300	1265420	I'm sure there was lots of trial and error in the fungus's part. There was lots of fungus
1265420	1269740	and lots of answers brains, but just get in the brain and fuck them up. And then that fungus
1269740	1275580	didn't survive, but the fungus that specifically got in there and learned that a Voltron, the
1275580	1281020	ant's brain drive him up the tree, like, like, like, like make his legs move. It's really crazy.
1281660	1286220	I don't know, Jeff. I don't, I, I, I think that's too complicated for random mutation. I'm, I'm,
1286220	1291500	I'm converting to intelligent design. Me and Ben Stein are going to go on a retreat.
1292940	1296460	Uh, I've had it. Have you seen the human eyeball? It is complex.
1299100	1309260	I give up. No more science. That human eye. Who would do that? Who, I mean, who wouldn't?
1310220	1314700	What, what random system would do that? That's, that's the intelligent design main argument.
1314700	1320060	Look at the human eye. Ben Stein's into that now? I think he is. I saw a trailer for, yeah.
1321180	1326780	Yeah. I saw a trailer for a documentary that played a lot of like punk rock music or something
1326780	1332220	while he walked around. And I think the implication was that, yeah, he was, he was doing the, uh,
1333100	1343340	uh, religious thing, but, but saying God existed. Who cares? On either, on either side, who cares?
1343340	1346140	How softball was it? The only thing more obnoxious than somebody like beating
1346140	1350060	down doors and insisting God exists. Does somebody do it? Is somebody insisting he doesn't? Like,
1350060	1355980	it's so dumb. Such a dumb argument. Who cares? Yeah. I saw Bill Maher. It's like, believe what
1355980	1359500	you want, but he's just being a dick about it. Like he's saying, like, almost you would say
1359500	1364540	evangelical. Yeah. I just can't stand. And dogmatic and, and being a fundamentalist and
1364540	1372300	being just a tool. Like he's, he's knocking on my door and thumping a book called Not the Bible. And
1373980	1377740	also he just seems like a terrible guy anyway. Yeah. I mean, and if you're gonna, yeah, if you,
1377740	1382620	if you've nailed a way of life, advertise for it with a big smile on your face and hanging out,
1382620	1387020	and then let me go, God damn it. I love that guy. How can I be more like him? Let me sneak
1387020	1392540	into your underwear drawer and find your Bible. And because I need to know how to be as happy as
1392540	1397260	you and walk around scowling. I don't want to know what you, what you put in your drink at night.
1398940	1407660	I got my own problems. The key, the problem is that everybody thinks that everyone's codependent.
1407660	1413900	Everyone insists that only if and when everyone in the world does exactly the same thing while
1413980	1420140	all our problems be solved that. And so people justify simultaneously being completely unhappy
1420140	1425180	and being totally passionate about some point of view, which if everyone just would, you know,
1425180	1431180	you got to attend your own garden. So that way you're not that people could just counter your
1431180	1435420	argument by going, well, then why are you such a miserable sack? And I think that's why people are
1435420	1439180	into politics. It's not, it's not, it's not really because they care that much. It's because it
1439180	1444620	justifies being a miserable and evangelical piece of shit simultaneously without being a hypocrite.
1444620	1450300	I think the appeal of politics is that you can pretend that your point of view is important even
1450300	1455420	though it clearly isn't to you. It's like in the electrical and acid test and Ken Kesey is asked to
1455420	1458940	speak at like, is it Berkeley or whatever? And all the kids are like, you know, like, like, you know,
1458940	1464620	let's change everything, let's change everything. And he's the voice of that, you know, that, that
