start	end	text
1464620	1467900	time and that movement they think. And he gets up and he's like, yeah, it just kind of seems like
1467900	1472460	you're all just yelling me, me, me. Like, it's all about just I, it's like, it's all just you
1472460	1476780	just saying your name out loud. And everybody's like, Abby Hoffman gave a big speech in the,
1476780	1481420	at some point in the 60s, you know, when everybody was goofing around, Abby Hoffman did a thing where
1481420	1485420	he got up and like, he just said, he said this whole speech and everybody was cheering for it.
1485420	1489580	And he's like, I can tell you guys love this speech, but I gotta, I feel bad taking credit
1489580	1497020	for it was actually written by Adolf Hitler in 1935. I just gave you a speech from Hitler.
1498620	1502220	Did he change, did he change some words? I'm sure he translated it into English.
1503500	1508620	But I'm sure it was, I mean, but I bet he didn't have to change that much because it was probably
1508620	1514220	just general. I mean, every time Hitler spoke, he didn't say let's kill 6 million Jews. Otherwise,
1514220	1517740	that would, that would be, you know, that, that roulette wheel would have come up double zero at
1517740	1523100	a certain point. So it would be like six minutes. Come on. I'm, I got, I got work tomorrow.
1523180	1530060	Um, most of the time he was saying very similar stuff to every politician you've ever heard in
1530060	1534460	your life, which is we're so fucking amazing. We're going to be amazing from now on. We haven't been
1534460	1537580	amazing in the past, but now we're going to be really amazing tomorrow. And it's going to be
1537580	1543020	because we're strong and we're together and words that mean absolutely nothing in a world where we
1543020	1548860	then team up on specific words, like retarded and the N word and go, okay, let's get rid of these
1548940	1553580	words. Cause these things are like abracadabra. If I say retarded enough in the wrong way,
1553580	1558540	the retarded people are going to, they're going to be even more retarded. Uh, if we eliminate the
1558540	1563740	word retardation will go away. Uh, not that it should because they're amazing people and,
1563740	1571580	and it's language that's this, that's the real handicap. Uh, meanwhile, people who say words that
1571580	1577900	have no meaning at all are actually actively oppressing people and causing things that result
1577900	1583740	in people being physically hurt. Uh, uh, and, and they get away with it because their words are
1583740	1587740	porridge instead of having any flavor. Porridge can be good. That's I'm not saying
1589020	1593260	porridge shouldn't be synonymous with lack of flavor. It gets a bum rap because the famous
1593260	1601420	porridge is from Oliver twist and the classic teddy bear story. Bad porridge is yeah. Bad porridge
1601420	1608060	is a higher profile than good porridge. There's not enough. Uh, so we need to start a, a, a, a,
1608060	1613180	a, an anti-porridge defamation league of some kind that can like, like, like, like, like,
1613180	1617340	what, where, where are the stories where like Jack climbs a bean stock and he finds golden
1617340	1624300	porridge. What qualifies something as porridge? Uh, I think it has to, uh, I don't know. Can
1624300	1628140	someone look that up over here and tell me what, tell me what makes porridge porridge and not just
1628140	1637340	like a nice bowl of cream of wheat or, uh, or grits or something like that. Like the way
1637340	1642140	pudding is just dessert in, in, in, in England, like like putting just means dessert, basically.
1642140	1646460	Well, no, putting is lots of things. It's also like savory things. You can get a pudding in any
1646460	1652620	meal of the day there. So maybe porridge is just like a bowl of hot boiling ground crushed or
1652620	1658780	chopped cereal in water, milk, or both. That's a lot of ores. We have optional flavor.
1659820	1668780	Yeah. So it's great. It's bad cereal. Boiled or, or, or poached, uh, cereal, wheat, grain, or human
1668780	1676300	head, uh, served or not served in a bowl or on a platform for breakfast or to send a message to the
1676300	1685180	enemy or anything in between. Now then what makes gruel gruel? Is gruel just like the world's worst
1685180	1695820	porridge? Yeah. Yeah. So gruel's worse than bad porridge on the, uh, on the Homeland Security
1695820	1701420	porridge color-coded scale. We can formulate the world's most culturally biased SAT question out
1701420	1707980	of this. Porridge is to gruel as gruel is to. Uh, all right. Uh, well, let's, let's, let's, I,
1707980	1713340	I don't have shit to talk about. Uh, let's, let's get the stars on stage. Yeah. Season five in your
1713340	1718380	dreams with me. Uh, uh, they, they, they haven't asked. They won't ask. If you, if you, if they
1718380	1723340	asked you, and let's say they gave you the keys to the kingdom. I am a professional storyteller
1723340	1728780	and that's an amazing third act. So I, yeah, I would definitely, I'm not, I would not be closed
1728780	1732380	to that amazing story. I used to, uh, you bummed out they haven't, I mean, obviously they're not
1732380	1737740	going to ask you, but I, you know, see this is, this is the thing. This is the reason I, I refuse
1737740	1747020	to be bummed out they haven't asked. That's not fair. I, I, I, I get to be happy they haven't asked.
1747020	1751500	That is, that is my luxury. Have you fantasized? That is why when Sony reached out to my agency
1751500	1757100	and said, what down is that? I, my response to my agent was like, when you guys figure out a yes or
1757100	1763660	no question to ask me all together as one collection of suits, I will then have a question
1763660	1768780	to answer. I'll be God damned if I'm going to, I was a nerd in high school. I know how this shit works.
1770540	1775260	I was supposed to go like, yeah, I'd go back and then, and then get an email from Bob Greenback
1775260	1781820	like, I heard you'd said you'd come back, uh, uh, bitch. I don't know who you think you are,
1781820	1788620	but the voice is doing real good. We don't need your ass. And I went, what the fuck did I do?
1788620	1795820	I just got dumped twice. I don't even like you people. I'm happy and forensics. You can take
1795820	1801100	your cafeteria table and stick it up your ass. All you guys do is sit there and talk about how
1801100	1807740	thin you are. I have friends in the drama club, but we're, we're close. We're going to Rocky Horror
1807740	1817100	together. I have a meaningful relationships. I don't care how popular you are. I do a little bit.
1817100	1825660	It was fun. Do you, I mean, obviously you still retain popularity because you are still attached
1825660	1831260	to that, to that show, but do you miss the kind of day to day popularity of like? No, no, no. I miss
1831260	1837500	the day to day, like actual substance instead of the kind of day to day, like talking about,
1837500	1845740	you know, I miss the actual like short term. Let's put on a show every week. How did you feel about
1845740	1851340	that? Here's your reaction. You know, the, the, the, the, the building and building and building
1851340	1857900	of that drum circle of fans. That, that, that beast getting fed and then responding to it with
1857900	1862780	creations of their own. I'm not blowing smoke. Like I, what I miss is the actual content
1862780	1868460	and the creation of it and the response to it and the, and that fire burning. I don't miss
1868460	1874220	the byproduct of it, which was like people talking about me, which inevitably would always result in
1874220	1880700	people saying I was fat or psycho or something like that. So you get ash with that ember. It
1880700	1885020	doesn't matter. But what, what I miss is the fire. What a metaphor. Go fuck yourself.
1885020	1892220	I have another drink, you black widow covered fucking Joan Crawford, eyebrow painting,
1892940	1902300	cream faced, no wire hanger loving. No wire hanger loving. You no wire hanger loving bitch.
1903820	1907100	There was just one black guy in that movie to stand up and really give it to her. You don't
1907100	1912860	hate wire hangers. You love the absence of wire hangers. There's a, there's a, there's so many
1912860	1916540	times in that movie where the daughter pauses outside the house before going back in one more
1916540	1921340	time from one more, you know, convent academy or whatever. And I actually just realized they
1921340	1927020	needed like one black guy in the front row to go, don't go in there. Stop it. She keeps hitting you.
1927020	1932060	I'm almost certain no black person ever saw mommy. Yeah. And if they did, they'd probably be so
1932060	1939980	confused. Yeah. I don't know. Because everyone knows black people are synonymous with an experience
1939980	1945420	in life and set of perceptions. They're completely objectified subset of humanity. We all know that.
1945420	1952060	All right. I'm, I'm being sarcastic. Your silence disturbs me sometimes.
1954700	1960220	I got the message from the survey last week. Half of you think I'm racist and a majority of you are
1960220	1966700	the juries out. So I want to talk a little bit about what I listened to when I was away. So we
1966780	1970460	should probably get Spencer Kumail up here. All right. Can we get Spencer Crittenden
1971500	1973420	and Kumail Nanjiani to the stage?
1977580	1982140	By the way, you know, the headline on deadline tomorrow is going to be Dan Harman expresses
1982140	1991420	strong desire to return. I don't feel sorry for myself for a second at all. Obviously I'm, I'm,
1992220	1998940	I have lots of money and I'm an amazing person. And I'm going to live till 90 and I'm going to
1998940	2005660	die on a bed of money with six dogs licking my nipples. And you know, the whole American dream
2006380	2013180	and a huge tapestry made out of dead black widows. Just little tiny black widow heads,
2013180	2021820	like a big game hunter and little, little mahogany crests with an Australian assistant
2021820	2026300	who really kind of bagged them all for me. I like Roosevelt. Like I go out with a monocle and an
2026300	2031100	elephant gun. See that one there. He could run across a broomstick and cross your arm faster
2031100	2038140	than your career. Not anymore he can. He was about cheater speed. He's like, he's obviously
2038140	2042140	the guy that's really behind all the kills, but I'm like, Oh, that one there. That was an eight
2042140	2048620	legger. I think there were mostly eight leggers. You, you, you'd be the kind of guy who would never
2048620	2054620	be invited back to the, you would, you would end up in a mysterious shooting accident on my yacht.
2054620	2061820	It's going to be all the black widow heads in my head also. Are they super, to bring together two
2061820	2067980	things that you spiders and religion in Islam, at least my sect of Islam, at some point in history,
2067980	2073020	there was a spider and the good guy was hiding from the bad guys and the spider made a web to
2073020	2080060	hide the bad guy. So in my sect of Islam, spiders, you can't kill them. Like, so they're all over
2080060	2084780	the place. Well, we, I mean, I mean, it's not religious in Western society, but it's bad luck
2084780	2089820	to kill a spider. Oh, is that right? Because they eat bugs. It's interesting that it gets like all
2089820	2093420	like turned around like that. So we had like spider webs. You couldn't, you couldn't do anything.
2093420	2097900	I don't think it's bad luck to step on a brown recluse or something like that. I mean,
2097980	2103340	California, I've noticed there's a lot less mention of how much bad luck it is to kill spiders in
2103340	2107420	Wisconsin. Everybody likes the little daddy long legs that chill out and, you know,
2107420	2115740	they're arthropods. Sometimes I don't know how I can get up in the morning.
2117660	2120300	It's not how you get up. It's how can you go to sleep at night?
2122940	2125100	Who do you think is putting all those black widows in your garage?
2125500	2130300	I go to bed at night amongst a nest of very well respected arthropods
2131820	2137100	who like porridge do not deserve the rap they got from spiders. What daddy long legs? Do you know
2137100	2141260	this? They're that urban legend. Everyone thinks that daddy long legs, they say it's the most
2141260	2150300	poisonous beast on earth, but it can't pierce the human skin with. Oh, yes. So you let a daddy
2150300	2154380	long leg crawl in your hand and nothing's ever going to happen. Because it's like the brontosaurus
2154380	2160460	of spider looking things. It's never gonna it's like a ridiculous it maybe would eat like an ant
2160460	2165980	leg if it found one in the mail. Well, you know, if it had the right address on it, if it's if it
2165980	2170780	just said to resident, it would be like, this isn't mine. I can't. Very polite. It's gonna be so
2170780	2176700	frustrating. You know, brontosauruses don't exist. That was that was a hoax. Wait, what worst? Oh,
2176700	2182300	wait, brontosaurus. They have been taken out. They're not real dinosaurs. Same as Pluto. Yeah.
2182380	2189100	Jesus. They got Pluto. Wait, so well, here's the story. It's like Bobby and John Kennedy. Yeah.
2189980	2194860	Because you got the brachiosaurus, right, which is when it looks like it. And then famously sneezes
2194860	2201100	a lot, a lot of snot on kids. Only when it's hilarious. Wait, so tell me. Apparently, there
2201100	2205900	were two paleontologists, I forget the exact this is like the 60s or something who were like fighting
2205900	2210220	each other. They had like, they were all like traveling all over the world to discover new
2210220	2215260	dinosaurs. And it was a big like, it was called the bone wars. It's really fascinating. It really
2215260	2220780	is called the bone wars. So they were like hurrying up to like discover more. So the one guy started
2220780	2226540	putting together different heads and bodies and calling them new species just just for the just
2226540	2231260	for the just to get and he totally won. And the other guy got totally discredited. And then after
2231260	2237260	this, the winner died to find out that he made up all these dinosaurs, including the brontosaurus.
2237260	2241980	But as far as the winner knows, he died with the belt. He died champion. Oh, he died. He died with
2241980	2247660	six puppies licking his nipples. But the winner knew he was cheating. He died knowing he was a
2247660	2252940	fraud. But yeah, but he had hoaxed the world and probably, you know, a person that does that
2252940	2258700	probably died happy, probably slept like a baby. What a cock. I know. Like, like, like, like, like,
2258700	2265420	use Christ to resurrect him just to slap him in the face for the damage that does in the science
2265420	2270140	versus religion wars. They're like, you fucking idiots. Do you know, do you know what a fucking
2270140	2277340	meal? Yeah, look at this. Oh, man. Like, like, like, there are people out there publishing
2277340	2282860	coloring books teaching children that dinosaurs didn't exist, that bones were buried by the devil
2282860	2288380	and the people that made space lab in the 70s so that we could dig them up in the 80s and pretend
2288380	2293820	there were the dinosaurs like, like, like warping children's brains. Did you see that fourth grade
2293820	2299580	test from some Christian school that was like, when was the earth created? It says 6,000 years.
2299580	2305580	Did humans and dinosaurs live together? Yes. Like, it's all, it's all like super creationist. It
2305580	2312060	came out like three, four days ago. It's on tumbler. It's on tumbler. I gotta, I gotta, I gotta, I gotta,
2312060	2316780	I gotta, I gotta draw the line there. That's where, that's where I would care about politics.
2316780	2321180	Oh, you've got to be kidding me. Yeah, kid doesn't even have a chance. That's not politics. That's
2321180	2326220	just ignorance. That's just, well, everyone that's passionate about something political,
2326220	2329580	like, that's their big thing. This isn't even politics. This is a fucking holy war. I'm going
2329580	2335420	to blow up this clinic. Sorry, what? That's like, for people who are anti-religion,
2336060	2341580	we are anti-religion because of people like... Yeah, well, that's what he's saying. The, the,
2341580	2346940	the town hall is crying out. Yes, that, that's why exactly, yes, the, the, the people who are
2346940	2352060	anti-religion, who let's call it the Bill Maher end of the spectrum, like, that is, that's, that
2352060	2358140	is the kick in the shins to which they're reacting. I, I absolutely understand that. And I, I, you know,
2358140	2364220	like, like, like, like, you know, obviously if there was a big rumble, I'm not going to, you know,
2364220	2369180	I'm not going to bring a bike chain to the Christian side of it. Like, like, like I, but,
2369260	2377100	but my, my only point is that I, like, if, if we know that people are kind of dumb,
2378620	2386940	then, and, and we, and we know that what kind of motivates them is like, anger at smart people,
2386940	2393180	like, like, you know, what good is like a bunch of smart people stepping on their face going to do?
2393900	2398460	I don't know. I have no, I don't know. This was going to lose everybody. I'm sure this is not the
2398460	2403660	audience for this. I, I watched the player's championship, the golf thing that Tiger won today.
2403660	2408300	And, and the commentators are very good. They know a lot about golf. They look at everybody's
2408300	2412380	swing and they know exactly what's going on. They're very, they know everything about grass,
2412380	2415900	you know, what kind of grass does what, and they can read the grain. It's kind of fascinating,
2415900	2419740	the amount of knowledge it goes into. I'm not a great golfer. I'm not an avid golfer. I like,
2419740	2424700	I do, and I suck, but there's a thing now because of TV and because somebody heard
2425340	2430140	the first time was, I don't know if it was because of Billy Madison or what's, what's the golf one?
2430140	2436380	Happy Madison. Happy Gilmore. Happy Gilmore. Sorry. I was, I always do that. I always do that,
2436380	2441580	too. And he named his production company like a mixture of the two, just to fuck with old people.
2443420	2448060	Every single time Tiger and a lot of other like popular golfers strike the ball.
2448060	2453900	There's, there's, there's eight douche bags with the same khaki pants on the same shirt and the
2453900	2458700	same tailor made ball cap and they all yell get in the hole, but it'll be the tee shot and a par
2458700	2464860	fucking five. It's six. The hole is 550 yards away. That ball's not going in the hole. Oh yeah. And so
2464860	2469820	everybody else get in the hole, but now it's because it's because they've heard these famous
2469820	2474380	calls of a great putt that somebody made and like, I'm the guy that that was my get in the hole when
2474380	2478540	Tiger did that thing. So now everybody's trying to beat each other to get in the hole, but they have
2478540	2485180	to wait. Like also like with camera clicks. So you've got all these 75 IQ fuckers that are
2485180	2492060	addressing the exact same outfit. The homogeneity of golf fans attire is troubling to me. It should
2492060	2497500	not be that much fucking khaki on that many pale white people. And it's just, it's really disturbing.
2497500	2504860	It's really Nurembergy and gross. Too much brown fabric. Yeah. Wow. Yeah. I had a great time at the
2504860	2514060	tournament. Little Nurembergy, but so today as crystal not dish out here, little joint division ish.
2514060	2519580	The commentators are all very clearly intelligent people and they, they, they, they crack wise.
2519580	2523660	They can be quite poetic sometimes in their call of the, you know, the boringness of golf that can
2523660	2529100	be in that. And, uh, there were these guys all had like spelled out Sergio for Sergio Garcia. And
2529100	2533340	they all lined up and the guy and they all yelled like people Las Vegas or like whatever it might
2533420	2537340	like some shit like it, uh, whenever they would never hit the ball. And the commentators don't
2537340	2541340	say anything. They don't, they don't justify it. They don't get angry at it. They like, I think
2541340	2546140	that's very classy of them, but it has to stop because today in the final, uh, one of the final
2546140	2551100	holes, big, important putt, millions of dollars in the line. So it goes, copy Mother's Day Bob.
2556380	2562300	So you're saying that's like organized religion. I'm saying, I think the average IQ is dumb. The
2562380	2568300	average and you get any giant group of strangers. The average IQ are the people that are, are,
2568300	2573420	work for earth link or for AT&T and you're like, that's why customer service is so infuriating
2573420	2578220	because they're not the smartest people in society doing that. And you have to remember that the
2578220	2582380	people that run around and want to stand too close to tiger's ball and be an asshole and be in the
2582380	2587340	way and yell that those are regular people and they have smooth parts of their brain where they
2587340	2596380	should be cursed. That should be some nooks and crannies in there. And so we end up being elitist
2596380	2604780	anyway. We could be elitist and compassionate. I don't think people are dumb. I think in some
2604780	2610540	ways truth is public opinion. And so if you're surrounded by people who are all saying the same
2610540	2614140	thing, it's something you don't really question. So if you're wearing khakis and you run by all
2614140	2618460	these guys and this is just what we do on their own, they might be smart when they're all together
2618460	2622780	and they're like, yeah, get in the ball, get in the hole or whatever they fucking yell. It becomes
2622780	2627580	the thing to do. And that's how like, you know, an array and religion and all of that. The problem
2627580	2631340	with getting the hole is and I thought about it, I was like, say something else. But the thing is,
2631340	2639820	what else would you say? I have a dream. That is the fastest way to say it. Yeah, they should have
2639820	2643980	Martin Luther King quotes. One percent of the population has 99% of its wealth.
2645580	2647020	Ask them what your country can do for you.
2650300	2653420	I was thinking there was another. If voting was powerful, it'd be illegal.
2655820	2659980	A few years ago, there was a school, this is going back a little bit to that. They had a creation
2659980	2665500	science fair where all the projects had to support creationism or disprove evolution. The girl who
2665500	2670700	came in first place, she took a frog in a tank and she said, it's not a lizard yet.
2673260	2679340	Not so different. She took a glass jar, put sand and rocks inside it, put it in the cupboard,
2679340	2685740	pull it out a week later, nothing had evolved. So evolution disproved. But I would have been so
2685740	2692220	awesome if she pulled it out and there was like a tiny giraffe in there. And one day science will
2692300	2698380	put that tiny giraffe there. There goes first place. I've had time to stew about this very valid
2698380	2705820	thing because I heard myself saying, I mean, look, God damn it. We've burnt women at the
2705820	2712940	stake. We've drilled holes in people's heads. So much has been done wrong by powerful people
2712940	2723660	in the name of religion. It's not religion's fault. It is powerful people's fault. They will
2723660	2730220	abuse anything you give them. If you replace religion with science or money, rich old white
2730220	2734540	people are going to burn women at the stake. They're going to do it for whatever reason.
2734540	2738140	They're going to do it because they hate women and they want to set something on fire.
2738140	2743900	And the women are all around. Because how the fuck can you twist a guy
2743900	2750060	walking around saying everyone love each other the wrong way? They figured out how. It ended with a
2750060	2759180	McDonald's in Rome with a guy in a funny hat surrounded by gold bowls with different colors,
2759180	2764620	smoke coming out of a chimney. How do you twist Thomas Jefferson around and end with two parties
2764620	2769500	arguing and having conventions that never existed where they're agreeing on what they're
2769500	2773420	going to debate about with the League of Women Voters going, you know what? We can't moderate
2773420	2778540	this anymore. Fuck this. You guys are insane. This is a conspiracy against everyone poor.
2780300	2788380	How do you twist that shit around? The answer is because you want to. So science is, of course,
2788380	2794060	it's the best religion we've come up with so far because it's a pursuit to replace the unknown with
2794060	2802300	the known. It is just as much as religion should be. It's like let's join hands and scour the
2802300	2807660	landscape for this lost child in this amber alert called the search for the meaning of life.
2811500	2816540	I don't care if we find a shoe or a blade of grass with a little extra blood on it.
2816540	2818140	You got one set of footprints.
2821980	2824140	Yeah, that was when I was raping you.
2827740	2834620	How? You're raping her on foot? Yeah, he's up. He works in mysterious ways.
2835820	2840940	I don't know what we're even talking about anymore. But that was a metaphor. You are a
2840940	2846700	rail pass. That was when science carried you, but you went with rape.
2848940	2860860	And God bless me, I always will. But the fight of whether or not we're going to be religious
