start	end	text
2577000	2580000	It's not like you look debilitated.
2580000	2583000	You say inwardly you're in pain and stuff like that.
2583000	2584000	Yeah.
2584000	2586000	Sometimes you'll notice I hunch.
2586000	2593000	It's hard sometimes to make eye contact because there's someone try to explain to me like a low level of autism because sometimes they have that.
2593000	2596000	But I feel when I'm comfortable around people, it's not a big deal.
2596000	2600000	But crowds, I can kind of just feel all the attention.
2600000	2601000	You're at Zertmelt.
2601000	2604000	There's no eye contact going on here.
2604000	2606000	You found the right place.
2606000	2608000	If you want to be looked at, dress like shoelaces.
2608000	2609000	Yeah.
2614000	2618000	If you want to be looked at, dress like shoelaces.
2618000	2630000	Is there, I mean, I want to ask you, I hope you're not offended by my characterization of you as somebody who is tethered to us but somewhere else.
2630000	2636000	Somewhere beyond the place that we have the luxury of just not thinking about in line at the bank.
2636000	2639000	I was like, oh shit, I had a bad day today.
2639000	2641000	Should I propose to my girlfriend?
2641000	2642000	I don't know.
2642000	2643000	Maybe I will.
2643000	2644000	Maybe I won't.
2644000	2646000	Oh, my car's out of gas.
2646000	2661000	Like there's always this like independence day flying saucer hovering in the sky that is blacking out the sun but completely ignorable day to day for all of us,
2661000	2671000	which is that we live minute to minute, second to second by the grace of some completely unforgiving, absolutely inhuman thing.
2671000	2683000	And I just, like, we just don't, like, it's uncomfortable to ask people who are further in the clutches of this thing, further at its mercy in a demonstrable way.
2683000	2687000	But it seems important to ask, like, what do we do?
2687000	2689000	How do we feel?
2689000	2690000	How do you feel?
2690000	2698000	What message can you give to us that in any way, like, lets us stop fucking around?
2698000	2699000	I don't know.
2700000	2701000	I don't know.
2701000	2707000	I, you know, oh, by the way, Soul Star has his powers on page one.
2707000	2709000	None of that page ten.
2709000	2711000	So get your powers before page twenty.
2711000	2712000	Yeah.
2712000	2715000	Speed it up, Hollywood.
2715000	2717000	Yeah.
2717000	2719000	You know, I don't know.
2719000	2725000	There's a message in the book that I think resonates, which I tell people all the time.
2725000	2728000	It's just give more to the world than what you take.
2728000	2729000	Yeah.
2729000	2730000	You know, it's I don't know.
2730000	2731000	There's no right answer.
2731000	2732000	There's no wrong answer.
2732000	2736000	I just, you know, just do what you love and don't hurt anyone.
2736000	2743000	It sounds generic, but it's like I mean, I'm not I'm at the point now where I don't I'm not afraid of if I don't wake up tomorrow.
2743000	2748000	I still try to do everything I want to do in a day that I physically can.
2748000	2754000	And and then I just hope it's enough, you know, and I think that's all any of us can do.
2755000	2760000	There's no, you know, there's no cosmic right answer here.
2760000	2762000	I think that was it. I think that does it.
2762000	2765000	Give more than you than you take.
2765000	2768000	That absolutely has to be the answer.
2768000	2776000	And I know it's under all our noses, but like we don't believe it when our mom says it because she's in the kitchen making cookies.
2776000	2783000	And we need we need heroes to take the trek and call back over their shoulder.
2783000	2788000	This is this is the truth. It was interesting when you told me that last week because I never heard.
2788000	2792000	I've heard people try to describe me and normally I don't like it.
2792000	2799000	Well, you look like you and McGregor just so you know.
2799000	2800000	I would love to see some of your art.
2800000	2806000	Is there a way that we can commission some for like for for us or for something that we can like get to see something you draw?
2806000	2812000	Can we can we see like I want to see the blue like test lines that are inked in later on.
2812000	2814000	That sounds fascinating to me. Yeah.
2814000	2816000	My dad's a really good artist, but he's really sketchy.
2816000	2820000	I watch him draw and he would draw a million lines really light, really light, really light.
2820000	2823000	And then he would see he would honing a woman and draw a line.
2823000	2827000	It was covered in lines and then he would find it.
2827000	2828000	That sounds exactly like that.
2828000	2831000	That's kind of in a way like mentally how I approach a lot of things.
2831000	2835000	So I love to see visually that that art approach.
2835000	2836000	It's just trial by error.
2836000	2841000	I mean, the way I look at it is if I have to physically see something to draw it, then I'll just keep drawing it until makes sense.
2841000	2847000	You know, like I tried looking at things and there seems to be a slight translation disconnect.
2847000	2849000	But I I'm getting better at it.
2849000	2856000	Like if someone sat in front of me and I could draw their face, it would take a while because I'm actually trying to use a part of the brain that isn't there anymore for me.
2856000	2861000	So it's like you can feel it like when I draw, I feel it like big time.
2861000	2870000	But if you want to feel if you feel the gap that I feel like the strain that it's taking to to transfer this to this with nothing up here, you know.
2870000	2880000	So if you wanted to draw something from memory, like say you wanted to draw like a car or draw a banana or anything, there's nothing you're conjuring up in your head.
2880000	2883000	Is it you're waiting until you see it and that reminds you of.
2883000	2884000	Yeah.
2884000	2886000	Like I cheated recently.
2886000	2887000	I had I have an art show downtown.
2887000	2889000	It's going to end this week.
2889000	2891000	And and I cheated.
2891000	2894000	Someone was standing near me and there was a draw.
2894000	2896000	You know, go over and draw on the wall kind of thing.
2896000	2899000	And I was looking at him and drawing and I just made him a zombie.
2899000	2904000	You know, so I was like, as I'm like doing the circles and stuff, I'm like, a hole was in his cheek, you know.
2904000	2905000	And so I drew a couple teeth there.
2905000	2907000	But I'm looking at him and doing it.
2907000	2909000	And someone was like, oh, my God, you did it for memory.
2909000	2911000	And I just like, I don't know.
2911000	2916000	I felt so nice to hear that that I just I think I I kind of lied and was just like, yeah, cool.
2916000	2920000	And then just to feel like like my old self again, I guess.
2920000	2925000	But now what you're drawing is completely you have to be you're forced to be totally in the moment.
2925000	2928000	You're drawing something for the first time every time.
2928000	2934000	So that to me is like something that can be really like valuable and like like visceral to like look at.
2934000	2938000	Yeah. So what are you complaining about?
2938000	2940000	You've been given this gift.
2940000	2943000	You know, white people with areas of problems.
2943000	2945000	Yeah. Well, that's what I try to do.
2945000	2952000	I mean, I've met people, you know, who who have it much, much worse, you know, who can't didn't get out of that.
2952000	2953000	Is there a community out there?
2953000	2957000	Oh, yeah. There's a great group at UCLA that meets like twice a month.
2957000	2962000	And then there's a group on Facebook that I'm part of that we share our stories on there.
2962000	2968000	And I and I go to, you know, I see us and I meet people who have this, you know, who are going through it.
2968000	2974000	And I, you know, I took some of their stories and I put it in Soul Star just to make the book a little bit more special.
2974000	2980000	And then obviously I give all the proceeds to the aneurysm foundation because that's another way I just want to get back.
2980000	2985000	And, you know, I again, just me trying to give more.
2985000	2990000	I think before I had my aneurysm, I was probably the kind of guy that took enough.
2990000	2993000	And so I kind of look at this as a second chance.
2993000	3002000	Yeah. Yeah. And people can Google the aneurysm foundation if they want to, you know, put, you know, be inspired by this podcast to put something into it.
3002000	3006000	OK, well, thank you so much, Seek, for coming up.
3006000	3009000	We'll have you back.
3015000	3020000	I'm not I'm not a hugger.
3020000	3023000	I'm not going to I don't I don't hug people enough.
3023000	3024000	We've hugged a couple of times.
3024000	3027000	If anybody should be hugged, they should hug Seek.
3027000	3029000	I don't know. It's coming back up. All right.
3029000	3031000	It's coming back up.
3036000	3039000	I want to hug.
3045000	3049000	I want to hug everybody in this room.
3049000	3054000	All right. Well, we're not going to that you see why I flip those segments.
3054000	3060000	I didn't follow that with the complaining about the valet's dollar.
3060000	3064000	Our next segment is called My Favorite Cereals.
3064000	3068000	I think Lucky Charms is underrated.
3068000	3071000	But I I'm I'm I'm I'm I don't know.
3071000	3075000	I'm I'm what am I what am I going to patent our podcast on the back?
3075000	3084000	Like I I I I I I I I feel the fidgeting like it's fucking it's fucking hard to I don't know.
3084000	3089000	I just like I watched you while you were talking to Seek.
3089000	3097000	And also when you talk to anybody about any kind of ailments or anything, you get like really physically like you start like like pulling your hair out on the top of your head.
3097000	3102000	And then you get a huge erection and it's it's it's not it's not appropriate.
3102000	3105000	He's not the word I would have used.
3105000	3108000	I mean, I'm saying it's relative to that.
3108000	3110000	It's intense.
3110000	3114000	Like my penis becomes flushed and gorged.
3114000	3118000	What if you only got an actually huge erection when somebody else was in pain?
3118000	3122000	I think those people exist.
3122000	3124000	There's books about them.
3124000	3130000	And I was saying, like, well, we were talking earlier about the superpower of being deaf or blind.
3130000	3131000	We're talking about deafness.
3131000	3134000	And you were talking about like that.
3134000	3136000	You were describing what would be like for you to be deaf.
3136000	3139000	I had this weird empathetic or sympathetic.
3139000	3140000	I'm not sure what the word is.
3140000	3142000	Pain thing where someone says they have a knee injury.
3142000	3143000	My knee hurts.
3143000	3147000	And if someone says they stub their toe, I'll wince because my I'll actually feel it in my.
3147000	3153000	Well, I mean, I mean, I think, you know, not not to undercut your, you know, I think that that's a natural.
3153000	3155000	Like sympathy.
3155000	3158000	It's an invitation to us.
3158000	3161000	And yet it can be repellent.
3161000	3171000	I think that, you know, I've talked to people who are wheelchair bound for whatever reason at like WGA panels and stuff like that.
3171000	3178000	Someone came up to me once and was like, hey, where's the physically I don't even know the politically correct phrases anymore.
3178000	3179000	Can I please just communicate?
3179000	3182000	Where's the physically disabled person in community?
3182000	3184000	And I and I was like, you're right.
3184000	3188000	Jesus Christ like like like it's so hard to do comedy about this stuff, though.
3188000	3191000	But it would be but but therefore it's so relieving when you do do it.
3191000	3193000	And I started I started talking a little bit.
3193000	3211000	You know, it was like people people come into come into the room in a wheelchair and you're you're the flood of of I don't want that to be happening to you that you feel when you see someone in any kind of condition.
3212000	3217000	Can shut off like a like a surge of electricity.
3217000	3222000	It just could throw all these circuits and result in people treating you like a living ghost.
3222000	3226000	And seek is saying he's talking about migraines and I have friends that have migraines.
3226000	3230000	But you're talking about your inability to even make eye contact when that's happening.
3230000	3232000	It's like like I start wincing.
3232000	3233000	Now we're both wincing.
3233000	3235000	Now it looks like I don't like care.
3235000	3246000	And I get that then it just becomes like the thing is like it's like it's I think we all have our own incredibly like like intense physical or emotional response to that stuff.
3246000	3247000	Yeah. Well sympathy.
3247000	3248000	That's what it is.
3248000	3249000	I like you.
3249000	3251000	It's so many so many.
3251000	3253000	And it's so it's weird because it's like you can go on the Internet.
3253000	3258000	You can look at little animated gifts of babies getting run over by minivans in China.
3258000	3260000	And you and you you can.
3260000	3261000	You can't.
3261000	3270000	And like we look at gore videos like we see we see skateboarders crack up and you go.
3270000	3272000	You experience what they're experiencing.
3272000	3281000	But like we we have this potential with our forebrain to turn that into toxic apathy.
3281000	3290000	Like well that I'm going to be punk rock like this is nothing new at all like like like people like like ever since we became sentient apes.
3290000	3295000	We have been afraid of the thing we realized was going to happen to us which is that we were going to die.
3295000	3300000	And the first thing we immediately started doing is we started worshiping death.
3300000	3308000	You worship things that you fear like you know they look like like the tribal mentality is to like take like a big scary monster.
3308000	3319000	Put it put it on your head and dance around the campfire and go like you know this guy's not going to fuck with me or I'm harnessing its power because I'm wearing it.
3319000	3322000	And it's the thing that ate the universe and it's going to eat it again.
3322000	3327000	And you try as hard as you can to atone with these things that scare you the most.
3327000	3341000	But you also like like in so doing you can like it's like you know that jaded gothy fucking like you know I'm going to pierce my face and put a finger on my forehead and I don't fucking care about life.
3341000	3343000	I'm gonna fucking die.
3343000	3354000	You know like it's not it's sort of like you know are you really handling it like like jadedness is also not it's not dealing with death.
3354000	3361000	It's not dealing with with pain like like feeling it is like we have we have we have tear ducts in our eyes.
3361000	3364000	They squirt water when we get upset.
3364000	3366000	But you're not you're not really a crier or a hugger.
3366000	3367000	You're not an emotional guy.
3367000	3368000	No I'm a huge crier.
3368000	3370000	I cried at the end of Doc Hollywood.
3370000	3374000	I just I'll cry and I'll cry at the top of a hat.
3374000	3377000	I just if I let myself feel stuff I'll cry.
3377000	3378000	Why aren't you a hugger.
3378000	3380000	What's because I know because I'll start crying.
3380000	3382000	I fucking hugged me and I started crying.
3382000	3383000	What are you retarded.
3383000	3384000	Oh sorry.
3384000	3385000	Sorry.
3385000	3386000	All right.
3386000	3389000	Learn nothing.
3389000	3393000	My sisters retarded and if I think about that I'll cry.
3393000	3394000	All right.
3394000	3402000	Is that why you do all this stuff Dan to keep everything in arms length that you won't just be a big heap like a big you know weeping mess in the corner.
3402000	3404000	Well I mean yes.
3404000	3405000	Let's let's play judges.
3405000	3408000	We're going to talk about it.
3408000	3410000	I mean that's why we all do everything.
3410000	3415000	We all we all love each other and we all feel connected to each other and it hurts all the time.
3415000	3422000	And we all feel we all feel that fear that if we let it if we let ourselves feel it for a second that we would we would die.
3422000	3428000	Yeah that's my thing is I like I people say like I mean I'm either really close to you or I'm really aloof.
3428000	3431000	I'm really like I keep like I'm the Heisman trophy.
3431000	3442000	I keep everybody at our arms length and I hold a couple of things close and like and like I am very aloof because if I let people in that I just will cry all the time.
3442000	3446000	I'm a huge antenna for people's pain and there's anything hurt in the room.
3446000	3448000	It's like I like it.
3448000	3455000	I have to like push everything away in the suit is it is armor and my voice and my gestures.
3455000	3463000	Everything is a way to deflect and keep everything at some sort of distance because if they get close it's it's close and that's it's incredibly well it gets messy.
3463000	3476000	I mean like like seek said like he's experiencing like symptoms of autism because of his aneurysm like and one of those symptoms is that when he feels he's standing in a room full of people like he can feel everything and like it's overwhelming.
3476000	3484000	It's a common misconception misconception that that autistic people people on the spectrum like they don't have empathy.
3484000	3494000	They don't have feelings like like like like a lot of them will complain that when they walk into a party they they are flooded with bullshit like just feedback.
3494000	3506000	It's like holding a microphone up to a speaker because and that is what results in the appearance of lack of empathy because you have to you have to put up a brick wall to to keep it out.
3506000	3513000	But I'm just just like and I can't even look out because like my vantage point for the podcast listeners is I'm I'm kind of facing the stage.
3513000	3516000	I'm kind of facing the audience and peripherally on both sides.
3516000	3520000	I just see people having bodily reactions throughout the entire thing is I can't even look.
3520000	3530000	I see people like like there's just certain physical reactions people have and it's like it's so and also like there's no need to make any any jokes out of it.
3530000	3532000	I think it's like it's as interesting as anything else.
3532000	3536000	I'll make one and it's going to be amazing.
3536000	3537000	Is it going to be racist?
3537000	3549000	A pollock and a Jew have an aneurysm together and the pollocks like whoa that's great because he's an idiot.
3549000	3557000	He loves aneurysms and the Jews like oh I wish it were off the rack or rebate discount.
3557000	3566000	All right let's bring Spencer up.
3566000	3570000	For those of you in the Hollywood Reporter read the transcript of my.
3570000	3573000	Hey guys what happened.
3573000	3580000	It is a gauntlet that is not up to fire code.
3580000	3583000	How's it how's it going living with your roommate.
3583000	3588000	It's you know it's kind of like autism.
3588000	3592000	Don't play that card.
3592000	3594000	How's it going at your new job.
3594000	3599000	It's so easy but my boss is a dick.
3599000	3604000	For those of you who don't know Spencer is a newly employed under Dan Harmon's tutelage.
3604000	3606000	He's Dan's assistant.
3606000	3607000	Yeah he's doing.
3607000	3609000	Yeah he's really easy.
3609000	3614000	What does your day consist of like like if you can give us bullet points throughout your throughout your workday.
3614000	3615000	Well what goes on.
3615000	3618000	I roll in around nine thirty nine forty five.
3618000	3622000	I'm extremely early sometimes I'll grab some breakfast in the commissary.
3622000	3625000	There's a commissary.
3625000	3636000	But I know I get to the office and is it an old time me like Hollywood commissary where there's a guy dressed up like a centurion and there's a guy.
3636000	3642000	Always constantly two guys with a giant sheet of plate glass just in case there's a car chase.
3642000	3645000	Back and forth back and forth.
3645000	3647000	It's exactly like that.
3647000	3648000	It's weird.
3648000	3651000	I don't know what's I don't know what those are like.
3651000	3654000	And actually I put that on the list of my things I'm not allowed to complain about.
3654000	3659000	Paramount's commissary which is called the dining room closes at 3 p.m.
3659000	3662000	Call it the lunching room.
3662000	3663000	It closes at 3 p.m.
3663000	3670000	You can't get a drink there when you really need it which is 315.
3670000	3671000	Thank you.
3671000	3672000	Is there booze there too?
3672000	3673000	There is.
3673000	3674000	There's a little bar.
3674000	3675000	It's not what I would call you know.
3675000	3676000	Really.
3676000	3677000	Yeah.
3677000	3678000	It's not like the bar in the love boat.
3678000	3681000	It's not like a cool place to retire.
3681000	3684000	It's funny because like I have a bottle of kettle in my office.
3684000	3688000	And the guy who's paid to pour it for you.
3688000	3691000	That's most of my job you guys.
3691000	3697000	Wait so speaking of love boat are you dressed in a white tux like Isaac?
3697000	3699000	Are you joking?
3699000	3701000	I'm dressed like this.
3701000	3702000	A white tux?
3702000	3705000	Get this guy a tux for fuck sake.
3705000	3709000	I could dress him over where I wanted I guess right?
3709000	3711000	That would be funny.
3711000	3716000	Didn't Zeke's message of give more to the world than what you take land at all to you?
3716000	3717000	Put him in a tuxedo.
3717000	3723000	Well that's why I want to create a situation somehow where I want to get Spencer on camera
3723000	3724000	in community.
3724000	3726000	Like I want him to be like in the show.
3726000	3727000	Why?
3727000	3733000	Like to keep pushing this like I want to see because Spencer so far has proven unflappable.
3733000	3734000	He's grunting in agony.
3734000	3735000	I'm flapping.
3735000	3739000	Well I want to find your flapping point.
3739000	3741000	I want to find your flaps Spencer.
3741000	3743000	I'm not an actor dude.
3743000	3745000	You're not a podcast celebrity.
3745000	3747000	We went on tour and shot that documentary.
3747000	3751000	You didn't blanch from cameras any more than you do from a live audience here.
3751000	3755000	You were yeah I mean that was part of it though.
3755000	3758000	Like you kind of knew going into it that would be an aspect of it right?
3758000	3763000	What if you do it and like you make it through like you're like let's say you do like a little guest star thing on community.
3763000	3771000	Like a little walk on like I'll write a little part where it's like oh and here's my dungeon master and like he'll be like hey how's it going?
3771000	3774000	And then and then like you're off like and we'll see how it goes.
3774000	3778000	We'll see if you go home that night and cut yourself with it.
3778000	3779000	Or is that your plan?
3779000	3784000	I was saying what if that's the point where he starts getting fake tan that goes to the gym a lot.
3784000	3786000	And he comes in and he changes his name.
3786000	3790000	Well then I'll hand him off as a mentee to Joel McHale.
3790000	3795000	Like Joel, Joel will take you from there and like welcome you into the world of being an Adonis.
3795000	3800000	You know like he'll show you crunches and do the one almond for breakfast diet.
3800000	3802000	Oh man.
3802000	3807000	What if you're only like like eight months away from like dating Mila Kunis or something like that?
3807000	3809000	That's weird.
3809000	3811000	Everything's weird.
3811000	3815000	I'm just gonna be passed around by famous people.
3815000	3816000	Yes.
3816000	3821000	Just just just hauled up to this Mayan pyramid where eventually you'll get your head cut off, right?
3821000	3824000	Everyone's squished.
3824000	3828000	Because the moon and the sun are...
3828000	3830000	You'll find out the joke has breaded you the whole time.
3830000	3835000	It's just simply an elaborate suicide murder thing.
3835000	3837000	Oh man.
3837000	3840000	So speaking of weird things, Aaron can't be here tonight.
3840000	3841000	Right.
3841000	3842000	She's in a show.
3842000	3846000	Kumail is, well to quote his wife Emily,
3846000	3851000	Hot Tub Time Machine 2 isn't gonna shoot itself.
3851000	3852000	He's on set.
3852000	3854000	He's at work.
3854000	3857000	Hot Tub Time Machine 2.
3857000	3860000	That's gonna answer so many questions from that first one.
3860000	3862000	The title was ironic when they came up with it.
3862000	3865000	But then they made a sequel and now it's like okay it doesn't get to be ironic.
3865000	3868000	Now you're actually making Hot Tub Time Machine 2.
3868000	3870000	By the way, this is the end is awesome.
3870000	3871000	I can't wait till it comes out of video.
3871000	3873000	Alright.
3873000	3874000	Oh boy.
3874000	3876000	I've never been so excited about a movie.
3876000	3877000	What is?
3877000	3878000	Oh this is the end.
3878000	3879000	This is the end.
3879000	3880000	I can't stop blowing that movie.
3880000	3881000	Anyways.
3881000	3882000	That was a good movie.
3882000	3884000	It was so funny.
3884000	3887000	Okay.
3887000	3889000	But what I decided is we're not doing...
3889000	3891000	We're going back to the basics.
3891000	3894000	I hope you can manage it narratively.
3894000	3896000	It's just me and Jeff this time.
3896000	3903000	The other characters can either be come in tow as NPCs or they wink out of existence
3903000	3906000	but I just want to get back to the roots man.
3906000	3907000	Man.
3907000	3908000	It's time we did.
3908000	3909000	Yeah.
3909000	3910000	What do you think about that Spencer?
3910000	3913000	I think that's a great plan.
3913000	3917000	Oh when he goes into that voice ladies and gentlemen it can only mean one thing.
3917000	3920000	Oh can it?
