start	end	text
1303000	1306000	You always do that. You love them.
1306000	1308000	We got Mohawk guys raising his hand again.
1308000	1312000	What about the opposite? If you could see why you're flying, but you were blind all the rest of the time.
1312000	1314000	Ooh!
1314000	1321000	He's saying, what if you're just an operational blind man or woman walking down the road, but if you wanted to, you could fly and see.
1321000	1323000	I think we'd all take that, right?
1323000	1333000	But then to counterbalance that, you'd have to be time traveling only when you were not farting.
1333000	1336000	I want to go to Mexico, but...
1336000	1339000	You're like Billy Pilgrim in Catch-22.
1339000	1348000	Slenderhouse 5. You have no control over when you're coming and going, unless you're farting, and then you can love a woman.
1348000	1355000	That's enough. We've got a lot to do tonight. Ask yourself that conundrum at home. Send us your picture pages about it.
1355000	1360000	And we'll talk to other guests tonight about whether or not they would fart or blind fly.
1360000	1362000	Connor, will you come back next week with one more?
1362000	1363000	Absolutely.
1363000	1365000	Connor's Conundrums, everybody!
1365000	1380000	It brings to mind the conundrum. Would you like to have Connor's Conundrums every week, or eat a bag of jelly beans?
1380000	1389000	I would say, and I support what he's doing here, I like the idea that this time was a choice between two not-so-attractive ideas.
1389000	1390000	They both had a price.
1390000	1394000	A real conundrum is which is the lesser of two crappy superpowers.
1394000	1398000	Let me ask you a very basic thing. Would you rather be blind or deaf?
1398000	1400000	Deaf.
1400000	1403000	Because of the internet.
1403000	1404000	For real.
1404000	1410000	No, because in case I learn how to fly.
1410000	1415000	I'd rather see it than hear it. I get more irritated by things I hear than things I see.
1415000	1421000	I'm constantly wishing I could just choose what I could hear over...
1421000	1425000	I never wish I could see something different. You can always avert your eyes.
1425000	1429000	It's a really tough choice for me. Even though we're 90% visually oriented,
1429000	1435000	but it's that connection that we have between people. It's really packed into the hearing.
1435000	1438000	But the internet changes that. You can connect to people with...
1438000	1440000	And you're a writer. You can still tell stories.
1440000	1445000	You can sit. I can just not hear shit, get a good night's sleep, and just type on the...
1445000	1447000	Just go on Reddit and connect with people.
1447000	1451000	If I'm in a bar or restaurant, sometimes it's not the noise. It's the bar tappers.
1451000	1457000	The guys that drum on bars. You can't just hear it. It also has a physical vibration to it.
1457000	1461000	Now I'm nervous like you, you fucking piece of shit. Stop drumming.
1461000	1469000	It's a very isolating condition. Deafness, though. In ways that we can't understand.
1469000	1476000	I remember reading that thing that more deaf people commit suicide than blind people.
1476000	1480000	Because they're cut off from that...
1480000	1483000	You don't...
1483000	1494000	Deaf communities, they have communities where they're against cochlear implants and stuff.
1494000	1497000	Because we're effectively a different...
1497000	1500000	I don't know if they'd say species, but they're going,
1501000	1508000	We're so different from other people that we actually need to stay together because other people don't treat us right.
1508000	1511000	No one understands what it's like to be us.
1511000	1521000	They stick together and they actually look at people who go in and get those cochlear implants or whatever they're called.
1521000	1524000	Like, oh, you're not one of us then.
1525000	1531000	And I'm not saying if you're deaf and you're reading a transcript of this, that's not funny.
1531000	1539000	If you're deaf and you're reading a transcript of this, I apologize for the bracketed laughter that just happened.
1539000	1543000	But I'm not saying there's a million kinds of deaf people.
1543000	1547000	I think you actually... I'm not joking. You might have changed my mind. I might go back to...
1547000	1553000	It's an intense thing to be cut off from people on that fundamental level.
1553000	1559000	It's easy for us to imagine what it would be like to cut off from vision in that it would be catastrophic for us.
1559000	1562000	And yet it would be so much more fundamental.
1562000	1565000	Vision is just like, oh, God, I'd trip over my ottoman.
1565000	1571000	But hearing is like, oh, my God, I will never hear another person again. I will never...
1571000	1573000	Something to think about.
1573000	1577000	Connor, I had an easier conundrum than you.
1577000	1583000	Before I answer your question, there's something like Aaron was saying that you guys want to travel again,
1583000	1586000	but you don't like traveling to places that don't speak English.
1586000	1592000	You'd prefer to be somewhere that was English speaking because you're a verbal communicator.
1592000	1595000	So deafness would be harder on you.
1595000	1600000	I'd be more nervous about it. I mean, I would definitely be a shut-in if I was deaf.
1600000	1604000	First of all, I think if I was blind, I would be a shut-in.
1604000	1607000	Maybe that's an unhealthy phrase for it.
1607000	1616000	But I would just close myself in, because I would just be communicating purely through the internet with other people.
1616000	1620000	And I would just kind of want to build on that, I think.
1620000	1621000	What were you going to say?
1621000	1626000	Would you rather be deaf at birth or lose your hearing as a teenager and know what you're missing?
1626000	1631000	Deaf at birth or lose your hearing as a teenager is the conundrum of those.
1631000	1632000	And know what you're missing.
1632000	1635000	You see, Connor, that's how it's done.
1635000	1636000	No, come on.
1636000	1637000	I'm kidding.
1637000	1639000	Connor, we bullied him.
1639000	1641000	Connor's deaf. He can't hear us.
1641000	1645000	That was my point. I wanted to reveal it to you guys that Connor was deaf.
1645000	1650000	All right. Well, I don't know. I mean, good question, buddy. Good job.
1650000	1653000	Your medal's in the mail. We're done with the segment.
1654000	1656000	We got a lot of stuff to do.
1656000	1657000	What would you pick?
1657000	1659000	Who asked you to pick? Viking?
1662000	1663000	I guess at birth.
1663000	1664000	Yeah.
1664000	1666000	I feel like it'd be lonelier to know what you're missing.
1666000	1668000	I think that's probably true, yeah.
1668000	1669000	At birth, he said.
1669000	1671000	At birth. I think I'd go for that as well.
1671000	1672000	I assume so.
1672000	1676000	I mean, what's the, yeah, what is the value of having something and having it taken away?
1676000	1678000	What about, okay, I'm making one up here.
1678000	1682000	What if you could, you have the choice between, between being deaf at birth,
1682000	1687000	but you could fly when you turn 40.
1689000	1690000	But you're an alcoholic.
1691000	1692000	Made of iron.
1694000	1696000	Or, what's the opposite of that one?
1696000	1697000	But you are.
1697000	1700000	Everyone you talk to turns blind.
1701000	1705000	But you can tunnel to the center of the earth and not get burnt by the magma.
1706000	1707000	Until you're 40.
1707000	1711000	At which point, you have to drink magma in order to do a show.
1712000	1714000	All right. Think about it.
1716000	1718000	We have a special guest tonight.
1718000	1722000	He was actually briefly up here, like a meteor flashing before you,
1722000	1724000	like a superhero flying through the sky.
1726000	1729000	We want to bring him up again because we barely grazed the surface,
1729000	1733000	and we're not doing it because we, I don't know.
1733000	1734000	I'm not Tony Danza.
1734000	1736000	I'm not bringing up people with recipes.
1736000	1743000	I figure the podcast technology is, it's for doing stuff you can't do on TV.
1743000	1747000	And one of those things is like kind of laying humanity bare.
1747000	1749000	And one of the craziest things about humanity,
1749000	1754000	one of the biggest elephants in the room is sickness, mortality, conditions,
1754000	1758000	you know, like the stuff that we fear the most.
1758000	1763000	And there are people among us who are tethered to us with a rope
1763000	1768000	and are hanging out on the precipice of these things that we kind of like,
1768000	1773000	we fear so much that we don't even, it's just more convenient to think about them.
1773000	1776000	And you would think that would not make for good podcast material.
1776000	1780000	But I have a feeling like it's really important to talk to this guy.
1780000	1782000	You saw him last week.
1782000	1784000	Let's bring a Sikh Donnelly up here.
1794000	1795000	How are you doing?
1795000	1799000	You said, you said you had a rough night, but you were, you were cool to come in today.
1799000	1800000	Yeah. Can I stand?
1800000	1801000	Yeah. Yeah. Yeah. Yeah.
1801000	1803000	What happens when you sit?
1803000	1806000	Honestly, I was in a wheelchair for a long time.
1806000	1808000	So when I was learning to walk again.
1808000	1811000	So I have this, when I sit for too long, I freak out.
1811000	1812000	Oh my God.
1812000	1815000	So you had to relearn how to walk after that.
1815000	1817000	Okay. So let's explain from the top.
1817000	1825000	So a Sikh you, you one day you had an aneurysm, which is an explosion in the, in the brain.
1825000	1830000	Yeah. I was, I was wiping my butt at LAX with the door open and a good one.
1830000	1831000	You could still do.
1831000	1833000	It didn't wipe out the callback part.
1836000	1839000	No, we were just walking.
1839000	1842000	I went to dinner with some friends was complaining about a migraine.
1842000	1844000	I've had migraines since I was eight years old.
1844000	1847000	So, uh, we didn't think that anything was different about it.
1847000	1851000	And then we were going out for the night and then I just dropped to the ground.
1851000	1853000	You just fell down at LAX or somewhere else?
1853000	1857000	No, no, no, no, just at your house.
1857000	1860000	Was it, was it, did you feel pain when you fell down?
1860000	1861000	I don't remember any of it.
1861000	1868000	I barely remember waking up in the hospital and then the doctor apparently talked to me and said, you know,
1868000	1870000	there's, there's some complications with what's going on to you.
1870000	1873000	We need to put you in a medically induced coma.
1873000	1878000	Uh, we don't know for how long, which means they give you drugs that just make you unconscious for a while.
1878000	1879000	I'm just gone. Yeah.
1879000	1881000	For 11 days I was out.
1881000	1884000	I was only supposed to be out for six or seven days, but then there was another complication.
1884000	1890000	I flatlined and then they saved me and then I was in for another five days.
1890000	1896000	And so during this medically induced coma, they studied your brain a little bit enough to tell you what had happened.
1896000	1897000	Well, yeah.
1897000	1901000	Well, and while I was under, they also did a couple of procedures to save my life.
1901000	1907000	So they did a process called coiling, which is, um, they actually don't go through your brain to do this.
1907000	1908000	It's going to sound weird.
1908000	1914000	They make an incision in your leg and they go straight up to your brain and they put these coils
1914000	1920000	and these coils are like little copper tubes that, you know, when an aneurysm happens, blood is pouring all over your brain.
1920000	1924000	And so everything that the blood touches, it's destroying.
1924000	1928000	And so these coils go in and they reroute the blood so that it's not.
1928000	1932000	How do they get a coil from your leg to your brain?
1932000	1935000	Like, like, like, like, how does it follow any path?
1935000	1936000	I'm not.
1936000	1937000	Okay, good.
1937000	1938000	You're not the guy to ask.
1938000	1941000	I'll bring my doctor one night.
1941000	1949000	But I mean, to interject at this point, like, uh, like this is, I'm sure I speak for most people in the audience,
1949000	1959000	like even beyond, I think getting certain types of cancer or something, this represents like, like a worst nightmare
1959000	1963000	because it's so uncontrollable.
1963000	1966000	It's just, it just, you're just suddenly told you're walking along.
1966000	1967000	Everything's going fine.
1967000	1972000	You, you black out, you wake up in a hospital and they're telling you, yeah, a thing just is happening.
1972000	1978000	And then, and then it gets worse because now you've been told that, like, you,
1978000	1982000	they don't know why, but you're having them repeatedly.
1982000	1983000	Right.
1983000	1984000	They keep happening.
1984000	1987000	Yeah, I keep having new aneurysms grow.
1987000	1991000	Um, and they can't figure out why because mostly it's a genetic thing.
1991000	1995000	Uh, for a guy my age, like I was 28 when I had mine.
1995000	2001000	And, um, and they were like, we can't even figure out why this happened to you because they're like, you know, it's a lot.
2002000	2009000	The percentage is higher in African-American men that age or in women that age or everybody but me, I guess.
2009000	2010000	And so they couldn't figure out why.
2010000	2012000	And then they looked at my family history.
2012000	2015000	No one on my father's side, no one on my mother's side.
2015000	2017000	And so they're like, we, we don't know what this is.
2017000	2021000	We don't know if this is an evolution of what, what happens to aneurysms.
2021000	2026000	We don't know what it is, but that's why they kind of poke and probe and study.
2027000	2028000	Yeah.
2028000	2042000	The only silver lining of that booth, giant, giant six foot quotes are on silver lining is that because they don't know what's going on, they're actually giving you like free treatment because you're kind of guinea pigging you, figuring out what's going on.
2042000	2044000	So you had one aneurysm but actually exploded.
2044000	2045000	Yeah, ruptured.
2045000	2053000	And then I, then they found at Christmas time, last time I think I spoke to you and I was pretty heartbroken, they found three more.
2053000	2057000	That are a weak spot in a blood vessel, right?
2057000	2058000	Exactly.
2058000	2059000	Yeah.
2059000	2060000	It's almost like a clot in a way.
2060000	2064000	It's like a, but yeah, it's weak tissue that's, that might explode.
2064000	2068000	When they, when they find them, then are they able to do something?
2068000	2069000	Yeah.
2069000	2070000	Yeah.
2070000	2071000	There's like, you can do lasers.
2071000	2072000	There's, there's another coiling type process.
2072000	2075000	There's, there's a couple of different options, but it's always good to catch them.
2075000	2077000	You know, it's, it's treatable when you catch them.
2077000	2091000	So, and I think the most tragic thing, the thing that made Aaron burst into tears, appearing about it for five seconds, last week, is this concept that your temporal lobe was flooded.
2091000	2092000	Yeah.
2092000	2097000	And that, that one thing that got wiped out was your visual memory and you're an artist.
2097000	2106000	And so like, like everything that you draw is affected by the concept of visual memory that you can't like, like, like use the example of an apple in private content.
2106000	2111000	Well, like, like when I close my eyes, I actually don't know what you look like anymore.
2111000	2114000	So I don't, when I wake up, I don't remember dreams.
2114000	2117000	I don't have, I have knowledge of stuff.
2117000	2118000	Well, close your eyes for a second.
2118000	2120000	I look like you and McGregor.
2120000	2122000	Just roughly.
2122000	2123000	I mean, I do.
2123000	2125000	I'm just, I'm just letting you know.
2125000	2126000	Don't exploit him, Dan.
2126000	2128000	I'm not capitalizing on anything.
2128000	2130000	I'm just clarifying for the audience.
2130000	2134000	I don't know what he looks like.
2134000	2143000	But, but also like if you were, you assume that he remember you and McGregor and not you.
2143000	2150000	But, but, but even worse than that, like fundamentally, you might not know what an apple looks like, right?
2150000	2151000	Oh yeah.
2151000	2153000	I mean, listen, I'm holding it or looking at it.
2153000	2154000	Right.
2154000	2155000	So you're seeing these things for a first time.
2155000	2156000	It's total.
2156000	2157000	It's 100%.
2157000	2158000	There's no visual memory at all.
2158000	2159000	No.
2159000	2160000	Yeah.
2160000	2163000	It's weird because like, I'll see somebody and I'll say hey to them and they'll go, how the hell does he remember me?
2163000	2165000	But it's, it's, I don't know.
2165000	2166000	It's, it's hard to explain.
2166000	2167000	I don't remember.
2167000	2173000	Like I ran into Anthony today and I actually, it's, and Spencer and I knew who they were, but I can't explain why.
2173000	2174000	Through mannerism, maybe.
2174000	2179000	Maybe that, or someone was saying about energies, like, because I'm new to that concept.
2179000	2181000	It's nothing about face blindness.
2181000	2185000	That people have that, that lack of, there's a thing in a part of your brain that uses visual recognition.
2185000	2186000	Yeah.
2186000	2191000	And there are people that they've known for their entire lives and they have to reintroduce themselves every day to them.
2191000	2195000	But, but if they hear a cough that you had the other day or just certain little signals.
2195000	2196000	Yeah.
2196000	2197000	Talking helps.
2197000	2199000	Like if I hear someone talk enough, I'm like, I'm in another room.
2199000	2201000	I'm like, Oh, I know that's so-and-so.
2201000	2205000	And you know, it's Dan and I because there's a post on your brain going, that's my uncle.
2205000	2207000	That person that's talking in the other room.
2207000	2208000	No.
2208000	2216000	The family thing is the hardest because most of my actual memories and knowledge of memories are, they go only back like five, six years.
2216000	2217000	Right.
2217000	2219000	So like childhood, a lot of stuff was wiped out.
2219000	2221000	And you talked about sitting down with your mom.
2221000	2223000	I'm just going all the way, by the way.
2223000	2225000	This is like, I'll make a joke.
2225000	2226000	No, no, no, no.
2226000	2227000	Don't worry about that.
2227000	2237000	I was talking to you after the show last week and I just thought like, what the fuck are we doing with this podcast technology for not like, like, and it's not, it's not of any heroism on my part of nobility.
2237000	2241000	I was just thinking like, like, like, like, what are we, what are we doing?
2241000	2246000	Like, like, like, like, this is something that's not televisable because it's not like, like, who's going to tune in?
2247000	2256000	I'd like to hear about this, but it, and yet it is mythologically like, like, like, like, like, like, this is, this is what we all are afraid of.
2256000	2266000	You were in a certain sense, like more so than somebody who's diagnosed with, oh, there's a, there's a microorganism that's eating away at your, at this certain organ or something like that.
2266000	2268000	This is happening in your brain.
2268000	2270000	It's happening in your plumbing of your brain.
2270000	2281000	And, and so you were talking about you're, you're sitting with a scrapbook with your mom, like a photo, photo scrapbook and going through it with her.
2281000	2285000	And you, I mean, do you want to finish this?
2285000	2295000	Yeah, I mean, well, well, basically, well, I'm the errand, I mean, on Aaron's thing, I, it's sucks because I actually don't like when people cry.
2295000	2296000	Right.
2296000	2301000	And it's a response I don't actually have a lot because there's some emotional damage to.
2301000	2302000	Well, that was going to be my next question.
2302000	2304000	But first of all, don't worry about us.
2304000	2305000	That's why you're up here.
2305000	2307000	Actually, I just, I don't want laughs.
2307000	2308000	I just want a cathartic experience.
2308000	2309000	Sure.
2309000	2315000	Well, with Aaron, though, what I told her last week was I've been trying to find a cheap way around the drawing.
2315000	2322000	So what I'll do is I'll take a blue pencil and I'll just keep drawing shapes, you know, like circles or whatever.
2322000	2331000	And once it's in a position to where I think there's something there, I take a regular pencil, go over it and then I've made like the side of the face and then I'll do more circles in blue.
2331000	2332000	And then I'll trace that again.
2332000	2334000	And it's, it's weird.
2334000	2341000	It's not foolproof yet, but it's like I'm, I hate being told I can't like my first doctors were like, you can't, you're not going to walk.
2341000	2342000	You're not going to talk.
2342000	2343000	And I'm like, bullshit.
2343000	2347000	Like my life isn't going to be in a wheelchair for the rest of my life.
2347000	2352000	Like I'm not going to just sit and be someone that my mom puts on the porch to watch cars go by while she's at work.
2352000	2356000	You know, like I'm not just that I'm going to be something else.
2356000	2371000	Like if I'm not going to be the old me, I'm going to be a new me, you know, for that reason.
2371000	2380000	But you talked about like going, going through the photo album and, and I mean, the thing that like made my heart like leap up into my throat or down into my groin or whatever.
2380000	2385000	It was the, was the, you said, the way I remember you saying it is having no visual memory.
2385000	2395000	You're going through a photo scrapbook with your mom and you're, and she's saying, this is, this is when we did this and you're, and you're, and you're basically having to take her word for it.
2395000	2399000	Like, you know intellectually that she's your mom, but you don't actually.
2399000	2401000	She wasn't lying when she said I'm your mom.
2401000	2406000	Right. There's no reason to be the lowest stakes con game in the world.
2406000	2410000	They're not getting away with a lot in their Swiss bank account.
2410000	2415000	But even with your mother, you're, you're seeing her for the first time every time you see her and it's simply memories.
2415000	2418000	Every time you're not forming new visual memories of her.
2418000	2425000	It's a, it's a lot of that. And so as you said, so then you said like your life here in LA has span the last five, six years.
2425000	2427000	So I remember them knowledge wise.
2427000	2435000	Like I know that I used to P out here and I, but I couldn't tell you visually what the person I paid for looks like, but I have the knowledge of it.
2435000	2444000	But ironically, this horrible empty desert, you know, where we all come to like put our emotional lives on hold while we try to get ahead in the world.
2444000	2446000	This is actually your cradle of memory.
2446000	2451000	This is the, this is, this is as close as you have to home because this is the place you've been for six years.
2451000	2453000	This is, this is your family.
2453000	2457000	I mean, I mean, this is where I, I got back up on my feet.
2457000	2461000	And, you know, I recently, like a year ago, got how to get my driver's license back.
2461000	2464000	So yeah, this is where I rebuilt, you know.
2464000	2473000	So I mean, we have to go to the deepest place of all, like, like what, what have they told you in terms of prognosis?
2473000	2478000	Have they given you, have they told you what to expect in terms of mortality?
2478000	2480000	I, at first I didn't want to know.
2480000	2482000	So I kept telling them not to tell me.
2482000	2489000	And then it got to a point at Christmas time this past year where I think it was the first time because they couldn't figure out what happened.
2489000	2492000	Like right after the aneurysm, they were normal.
2492000	2497000	Normally you'll go through a state of depression and like, you know, some of the outcomes of it are fatigued.
2497000	2498000	You get tired.
2498000	2500000	You know, there's a lot of like things like that.
2500000	2501000	I'm always in pain.
2501000	2503000	I've had a headache every single day.
2503000	2511000	So trying to deal with people and with a smile is like probably, I think I found a way to do it with ease for once.
2511000	2513000	But at first it was really hard.
2513000	2519000	And then I think, I'm sorry, I actually forgot the original question.
2519000	2521000	Well, I mean, did they tell you?
2521000	2522000	Oh, yeah.
2522000	2524000	So then I said, well, I don't want to know.
2524000	2527000	And then in Christmas time they were like, well, we found three more in your head.
2527000	2530000	And to me, I don't know the actual comparison.
2530000	2531000	It is a comparison.
2531000	2535000	I was like, well, one of these things almost killed me.
2535000	2538000	So I was like, well, this is like my Vietnam.
2538000	2540000	And now I have three of them.
2540000	2549000	And I'm like, so I may have proved that I'm tough on one level, but I'm not going to survive three if this happens again.
2549000	2551000	And then luckily they've died down.
2551000	2556000	We did a couple procedures, you know, and I'm back to, you know, doing okay.
2557000	2561000	So for all anyone knows, because you're such a weird mystery to these people.
2561000	2562000	Yeah.
2562000	2563000	I mean, I could still go.
2563000	2565000	I could not wake up tomorrow morning.
2565000	2573000	Or you could be the four aneurysm guy whose last three they caught because you're such an oddball.
2573000	2577000	Also, it's so mysterious is that you're standing up here and you look like you could be anybody in the room.
