start	end	text
0	21000	Hello, welcome to Meltdown Comics in Hollywood, California!
21000	29000	It is my duty and my privilege to announce that Harmentown is now in session.
29000	37000	Won't you please welcome to the stage the mayor of Harmentown, Dan Harmon!
37000	41000	Hello!
42000	49000	Hello!
49000	56000	I was watching a G.I. Joe cartoon over the weekend, Jeff, a classic from the 80s.
56000	71000	And there's an episode of G.I. Joe in which the Joes are transported to a terrible new dimension in a cosmic mix-up.
71000	75000	They are transported to a world where Cobra is in charge.
75000	79000	They have taken over the government of the world.
79000	81000	It's Cobra World.
81000	90000	And for instance, when you buy something...
90000	96000	They figure this out very slowly because the differences are very subtle, which I found profound.
96000	104000	For instance, they go and buy a pack of gum and there's like a Cobra scanner that comes down and scans your retina to make sure you can buy the gum right.
104000	106000	And that you're loyal to Cobra.
106000	115000	And there's a lot of posters on the wall that are a picture of Cobra Commander that says loyalty to Cobra or else!
115000	120000	Which is sort of like totally on the Woody Allen approach to despotism.
120000	123000	It's hard on the sleeve kind of.
123000	128000	But the most interesting thing I thought about Cobra World is they're flying around.
128000	132000	They're going, my God, will you look at the White House? It has a little Cobra on top of it.
132000	137000	Oh no, look at the Washington Monument. It's got a little Cobra on top of it.
137000	148000	And then they go past Mount Rushmore and, my God, Jeff, Mount Rushmore had some of its faces replaced.
148000	150000	Some!
150000	153000	Not Teddy Roosevelt. Not Teddy.
153000	158000	Yes, Teddy Roosevelt's face replaced with Destro.
158000	162000	And then I guess Jefferson replaced with Cobra Commander.
162000	166000	By the way, not famous for his face.
166000	170000	I don't know if the sculptor came to him.
170000	172000	Famous for no face.
172000	178000	My face isn't really the thing that's for sale.
178000	183000	That kind of famous more for my lack of face than anything.
183000	185000	But probably easier to sculpt.
185000	189000	Yeah, yeah, I'm not sure the sculptor was like slam dunk.
189000	193000	But I just thought that George Washington and Abe Lincoln's still up there.
193000	196000	It's not like I'm racist or something.
196000	202000	I mean, I'm still American. I think, I don't know. I still value America.
202000	204000	I think, I think every...
204000	207000	I'm a capitalist for God's sake. I don't want to socialize medicine.
207000	211000	If you get sick, you should have to pay for your medical care.
211000	215000	And slaves should be free.
215000	219000	I think the only reason Teddy Roosevelt's on the monument is because
219000	222000	he was a friend of the sculptor, right?
222000	224000	That was kind of an inside joke.
224000	227000	That's probably what Cobra's big problem with it.
227000	230000	Get this fucking Teddy Roosevelt off of here.
230000	232000	He didn't earn this.
232000	233000	I did.
233000	239000	By having a smooth face.
240000	242000	But yeah, the world seemed...
242000	244000	That was the elephant in the room.
244000	247000	G.I. Joe were terrorists because they were in a world
247000	249000	where Cobra was the establishment.
249000	252000	But pretty much the same behavior occurring.
252000	255000	Just people shooting at each other with lasers.
255000	260000	All right, so there's a new thing for the moon colony.
260000	263000	All right.
263000	267000	I love that we've returned to our premise after all these years.
267000	269000	Okay, we don't...
269000	274000	The jury's still out on whether or not there will be restaurants on the moon.
274000	276000	There has to be restaurants.
276000	279000	One for Jeff. VIP moon.
279000	282000	VIP moon's going to have great restaurants.
282000	285000	Actually, I was thinking about making the moon a shock and a friend,
285000	291000	and my little VIP moon is just going to be a taco truck.
291000	292000	Here is...
292000	294000	Because I cannot enact this legislation on the earth,
294000	296000	that's the only reason I'm bringing up the moon.
296000	300000	Because I have no control over what goes down here.
300000	305000	But I would like to make this suggestion to the wait staff of America.
305000	308000	I think that when you come up to the table,
308000	311000	and it's time to clear the plates away,
311000	317000	and when you see that a plate has been cleared by the diner,
317000	319000	like, lift clean, you know,
319000	321000	I know that the overwhelming temptation,
321000	323000	that you've learned this from other waiters
323000	326000	and then learned it from your behavior at the table,
326000	329000	I know that you want to do the hilarious,
329000	332000	looks like you didn't like it bit.
332000	334000	Looks like you hated it.
334000	336000	Looks like you hated it.
336000	339000	I think we have to stop. Stop it.
339000	341000	It doesn't...
341000	345000	It's a cancerous joke.
345000	351000	It takes in joy and it creates discomfort.
351000	353000	There's no...
353000	359000	You think you're misperceiving people's nervous chuckles as joy.
359000	362000	You might as well just go up to people and go like,
362000	364000	whoa, whoa, what do you hate me or something?
364000	367000	And make them go, no!
367000	369000	That sound...
369000	371000	That's not happiness, that sound.
371000	374000	That's like, oh God, Jesus Christ, this person's making me uncomfortable.
374000	376000	Like, it's just sort of like...
376000	379000	What do you want? Just go away.
379000	381000	It looks like you didn't like your food.
381000	383000	No, I did. That's why I ate all...
383000	387000	I ate all the food.
387000	389000	I did like it. I liked it so much.
389000	391000	I opposite hated it.
391000	393000	That's why you said that.
393000	395000	Here's your money.
395000	397000	It's just...
397000	400000	The worst case scenario is it makes you feel fat,
400000	402000	like the person you're talking to.
402000	407000	And the best case scenario is just kind of just nervousness.
407000	410000	Just confusion and anxiety.
410000	413000	So stop it if you can down here,
413000	416000	but on Earth, on the moon, that will not be allowed.
416000	418000	And that may be the reason why there cannot be restaurants.
418000	421000	That and close-up magic.
421000	424000	No fucking close-up magic.
424000	428000	Well, restaurants bring a lot of society's pains on...
428000	431000	If you eliminate restaurants, there's not going to be close-up magicians.
431000	434000	I don't like magic. We've talked about this a number of times.
434000	436000	Fuck magicians.
437000	439000	Magic is lies.
439000	441000	It's just somebody lying to you.
441000	443000	It's not a trick.
443000	445000	A magic trick is just a lie.
445000	448000	And magicians, I'm sure I'm repeating myself,
448000	450000	but when a magician goes...
450000	452000	If someone does a card trick, I go,
452000	454000	wow, how'd you do that?
454000	456000	I can't tell you, man.
456000	458000	I can't tell you because that's part of the magician's code.
458000	461000	But the reason why they can't tell you is because if they told you,
461000	463000	you're a magician.
463000	467000	Magicians, if you knew the fucking stupid fucking trick,
467000	471000	you'd have to wear a vest and stink and be named Dave.
471000	473000	I don't know.
473000	475000	I'm thinking of one guy.
478000	481000	However, I went to the fucking Magic Castle against my will
481000	483000	and against all fucking better judgment
483000	486000	because the Magic Castle, as I said before, is a bummer
486000	488000	and it smells like poo.
488000	491000	But I went there and I was brought up on stage by the...
491000	494000	I wasn't the close-up stage, it was like the medium-sized stage.
494000	496000	And the guy saw me in my suit and goes,
496000	498000	you, did I talk about this on the show already?
498000	499000	Yeah.
499000	500000	I did?
500000	502000	All right, go fuck yourselves.
502000	505000	He brought me up on stage because he thought I would be skeptical
505000	507000	and he proceeded to blow my mind.
507000	510000	He needed me up on stage to prove to the audience that, like, fucking...
510000	512000	It was really magical.
512000	514000	You mean you had to, like, cut a rope or...?
514000	515000	No, he dropped coins.
515000	517000	He kept dropping metal coins into my hand
517000	519000	and then when he would close my hand and I would see it,
519000	522000	three, four coins go into my hand, big, loud metal coins,
522000	524000	he would close my fist
524000	527000	and he would say, how many coins are in your hand?
527000	529000	In front of 45 people.
529000	531000	And I would say, well, four.
531000	534000	And he'd open my hand and there would be a rubber ball in my hand.
534000	536000	And it was fucking magic.
536000	537000	Right.
537000	539000	So I'd take everything back.
539000	541000	So you like, all right, all right.
541000	544000	It has to be real magic, otherwise.
544000	546000	It had to be.
546000	547000	It had to be real.
547000	548000	Still, fuck him.
548000	550000	And also, he smelled like mildew.
550000	553000	It smells like a grandpa's sleeping bag there.
553000	555000	The one that died in his sleeping bag.
555000	559000	How about the magic trick of make the smell disappear?
559000	561000	Yeah, that would be quite a trick.
561000	563000	Fuck the ghost at the piano.
563000	566000	Take a magic bath, people.
568000	571000	I stop myself halfway through there because I'm, what have I become?
571000	574000	Yeah, you're the guy that hates being told to take a bath.
574000	576000	A magic castle should be my people.
577000	580000	If I knew how to lie better, I would, I should just be there instead of the moon.
580000	586000	I should be just saying abracadabra and hanging out in my dumb hat.
589000	593000	You ever get scared bagging on magicians that, you know, you'll come home
593000	596000	and your bed will be just about half.
598000	600000	I live in mortal fear of that.
601000	603000	That would just be like...
603000	606000	Does anybody really like magic?
606000	610000	I mean, you just said yourself, you described an experience that was well done.
610000	612000	But I didn't have fun.
612000	614000	I was like, oh, you're faking me out.
614000	616000	You're doing it like it's just lies.
616000	617000	I get very nervous.
617000	621000	In regular conversations, let alone conversations where I'm being asked questions,
621000	625000	told what to do, afraid I'm going to do it wrong.
626000	632000	The few times that I've been engaged by a magician have caused me such anxiety
632000	638000	that I think I exude a force field that magicians don't pick me and stuff
638000	642000	because I just get so nervous in those things when people go like,
642000	644000	I don't want to put this in your hand.
644000	646000	Nope, nope, nope, to the other left hand.
649000	652000	I'm surprised that somebody actually, a recent waiter, a waitress,
652000	656000	gave you the, looks like you didn't like it, bit.
656000	658000	That was this weekend that happened.
658000	661000	The guy at Umami Burger, a hipster burger place in Hollywood.
661000	667000	Still, his mustache was waxed, he was wearing, you know,
667000	671000	half a strap of an overall, whatever the fuck the kids are doing these days.
671000	675000	A henna tattoo of Pokemon on his face, I don't know.
675000	678000	Whatever, he was a hologram.
679000	683000	But still, saw the crumbs and just like the 45-year-old
683000	686000	Midwestern diner waitress in him just jumped out.
686000	688000	Guess you didn't like it very much.
693000	697000	No, I did. I swear. Why are we fighting?
699000	704000	What is the instinct to be sarcastic in a moment that should just be celebrated?
704000	709000	Oh wow, you loved the mac and cheese, it's gone, it's in your, it's in your poo poos.
709000	714000	Good, good boy. Clean plate club.
714000	716000	Just, just be nice in that moment.
716000	721000	You don't have to be Willy Wonka, you don't have to fucking stretch my boundaries.
721000	724000	Teach me that truth is relative.
724000	731000	You're not a fucking like, you're not, you're not, you're not, you're not Mad Bartigan.
732000	734000	Are you comparing him to Willow?
734000	737000	I don't know why that name leapt into my head.
737000	740000	Oh, because I miss Erin, that's why. She's in Chicago.
740000	744000	Thanks guys, that was, that was heartfelt.
744000	750000	She's in Chicago doing like these shows and stuff and it's like two days without her and I'm just a wreck.
750000	751000	Why is that?
751000	757000	I just, I guess, either the healthiest answer, because I love her,
757000	762000	I'm unhealthy, I'm an emotional vampire and I was feeding off of her, I don't know.
762000	767000	In either case, she was, she was integral to my, to my happiness.
767000	769000	Are you guys going to get married?
769000	777000	Well, you know, I don't know if you understand how marriage works, but typically you're not supposed to give that much of a heads up.
777000	787000	If I said yes, then, and then when I, when I, when I proposed to her, she's going to say finally, instead of yes.
787000	790000	You're being extra weird about it for no reason.
790000	794000	You guys haven't discussed this, it's not, it's not a discussion that you guys have had?
794000	802000	I think there's a, I think she knows that I want to be with her forever and stuff, but you know, you know that there's a, there's a, there's a,
802000	809000	it's, it's, it's, it's, it's, it's, it's, it's, it's, there's a tackiness to, you know, pointing at the bleachers.
809000	817000	Why don't you, why don't you be the first person to propose to her a podcast that will come out two days from now?
817000	824000	And you can like, like, put a ring on her iPhone and like, I don't know, because that, that will be her moment.
824000	835000	I don't want to, I don't want to be one of those guys that embarrasses the, the, the, the proposal, you know, I want to, I want to do it regular style.
835000	836000	You're going to do it.
836000	852000	Well, I, I, I have no plans to, uh, to, yeah, I, I, I, I, I, I'm not breaking up with her and I'm not dying.
852000	855000	Ergo, marriage is imminent.
855000	857000	Ergo, will you marry me?
857000	861000	I mean, it's, it's, it's, it's just, isn't there some magic?
861000	864000	Hey, hey, sorry I brought it up.
864000	868000	You don't have to marry her. No, no one's making you marry her.
868000	874000	If I, if I asked you if you were going to marry your girlfriend, you know that the, you know what that would, the spot that you would be put on.
874000	879000	You'd have to, that's a yes or no question to something that you're not supposed to talk about that stuff.
879000	880000	Why not?
881000	884000	Okay, uh, Jeff, are you going to marry the girlfriend that you're with right now?
884000	885000	No.
896000	897000	Are you?
899000	900000	Yes.
900000	901000	Yes.
908000	912000	Although this, I made that decision before I found out yours was going to be available.
919000	920000	She's a delight.
921000	923000	Uh, all right. Yes, yes.
923000	924000	I miss Erin.
924000	925000	And yes, one day.
925000	926000	Yes.
926000	928000	I'll make an honest woman out of her.
929000	932000	She's a, where's that, where's that expression come from?
932000	946000	I guess I, I guess I, I guess that's like the idea that you're making a woman dishonest by just like, uh, I guess that hails back to a time when, uh, when sex was, uh, a criminal act like out of wedlock.
946000	952000	Like you had to, if you were having sex with somebody and they weren't married to them, then they had to lie to the, uh, gas station attendant.
953000	961000	Where would you, uh, I'm sure Erin's, I know Erin enough to know she's the kind of person that probably has ideas about what her ideal wedding would be.
961000	964000	But if you like, like, where would you like to be married?
964000	967000	Like in like the best of all possible worlds?
967000	979000	I, I, I would start that conversation by acknowledging that I think the ceremonies are more for the, for the people, you know, like, cause you could take somebody and stand under a waterfall and, or go to city hall.
979000	981000	I think Kumail and Emily went to city hall, didn't they?
981000	983000	Maybe they had a ceremony later for friends.
983000	995000	But, but, but like the, the couple, you know, there's a, marrying somebody would make a warehouse full of dead rats a romantic, uh, for those two people.
995000	1000000	But for the people that you're inviting, you want to make sure that they're having a good time.
1000000	1018000	And to that effect, I would like to do a Raiders in the Lost art, uh, themed wedding where, where the audience was, was not only, uh, allowed to, but really required to help, uh, save our marriage from, uh, Destro, I don't know.
1018000	1020000	Are you two going to be tied to a stake?
1020000	1021000	Yeah.
1021000	1023000	And when they, when the ring comes out, you're going to say, don't look at it.
1023000	1025000	Yeah, yeah.
1025000	1026000	Yeah.
1026000	1034000	She will be a melting Nazi ceremonial garb and he'll, he'll, he'll open.
1034000	1037000	We'll get married by Bellac.
1037000	1040000	Well, all of the attendees have to dress like Nazis too.
1040000	1045000	I think that was a Nazi heavy ceremony in Raiders in the Lost art.
1045000	1046000	What are you doing?
1046000	1049000	Aaron's texting me.
1049000	1053000	It's like she knows the show is going on.
1053000	1056000	Why did she, why did she text me?
1056000	1063000	No, cause it, she said yes.
1063000	1069000	That means Adam Goldberg is texting her and she's saying I do right now.
1069000	1071000	No, no, she doesn't.
1071000	1073000	She's just, uh, wait, she said, I don't know.
1073000	1078000	She said, I think she's at, she's at some hip hop show and then she said, she sent me all texts, all caps.
1078000	1081000	Ah, an MC just dropped your name.
1081000	1088000	Ah, ah, and then the, and then a follow up text in reference to community.
1088000	1093000	Like it would be a reference to my world famous carrot cake recipe.
1093000	1097000	Yo, yo, yo, yo, yo, before we get started, I want to give a big shout out to Dan.
1097000	1102000	He puts the right amount of cinnamon in that carrot cake.
1102000	1104000	He's out there keeping it real.
1104000	1107000	Not too much carrot.
1107000	1109000	I assume is the secret.
1109000	1114000	It's a cake, not a salad.
1114000	1118000	Did you know that, uh, uh, Harman town is a feral audio podcast, Jeff.
1118000	1120000	I was unfamiliar with that concept.
1120000	1127000	Uh, you can go to feral audio.com and hear what some of the most amazing people in the world, like for instance,
1127000	1131000	Duncan trestle or, uh, Aaron McGathey or Chelsea Perretti.
1131000	1132000	Why is it called feral audio?
1132000	1134000	Was it, was it raised in the wilderness?
1134000	1138000	Uh, was it, was it real audio, but they didn't have parents and was raised in the streets?
1138000	1139000	Yeah.
1139000	1144000	I think it's like, uh, like you look at Dustin, you know, Dustin sort of is feral audio and he's,
1144000	1151000	he's like a live, uh, kind of stringy, uh, street cat.
1151000	1155000	I always assumed it was sort of his totem that he was like a, he's like an alley cat.
1155000	1166000	He's a little, he's a little, little, little scrapper.
1166000	1167000	He's easy.
1167000	1168000	He's easy.
1168000	1169000	He's easy.
1169000	1171000	And if he scratches you, you get sick.
1171000	1172000	Is that true?
1172000	1173000	Dustin?
1173000	1174000	Oh yeah.
1174000	1175000	You ever get scratched by him?
1175000	1176000	Yeah.
1176000	1177000	Just last night.
1177000	1178000	I don't feel so well.
1178000	1179000	Yeah.
1179000	1180000	Yeah.
1180000	1181000	It's bad news.
1181000	1183000	Uh, yeah, no, but that's, that's, that's the plug for this week is just go.
1183000	1184000	It's a network.
1184000	1188000	Go to feralaudio.com and I'm, I'm, I'm not kidding.
1188000	1192000	I mean, if we were, if I wouldn't see this about Pringles, even if they were giving us
1192000	1196000	money, which is why they won't, uh, I mean, cause I would be like, well, I would say Pringles
1196000	1198000	are delicious, but they're probably bad for you.
1198000	1201000	I wrote them the best jingle of all time and nothing.
1201000	1202000	Yeah.
1202000	1203000	Yeah.
1203000	1204000	Yeah.
1204000	1205000	Uh, what'd you say?
1205000	1206000	Nike.
1206000	1207000	Nike.
1207000	1208000	Yeah.
1208000	1210000	Somebody just brought me some Adam Goldberg.
1211000	1215000	Brought me a weird laser stacks.
1216000	1217000	Kiss canister.
1217000	1219000	Speaking of food at the show.
1219000	1220000	Thank you.
1220000	1221000	Where's Bill?
1221000	1222000	I don't see Bill.
1222000	1223000	Bill's not here.
1223000	1224000	Beef fungus.
1224000	1225000	Bill got a taste of his own beef fungus.
1225000	1231000	And Adam, why did you give me alternative Pringles?
1231000	1233000	Seems right in the moment.
1233000	1235000	Seemed right in the moment.
1235000	1236000	He's a dot connector.
1236000	1237000	Adam connects dots.
1237000	1238000	He said Pringles.
1238000	1239000	He had a cylinder in his hands.
1240000	1241000	Wait, they're half eaten.
1244000	1245000	Kind of bullshit.
1246000	1248000	Should we just get a Goldberg update?
1248000	1249000	Just bring Adam up here with him.
1249000	1251000	Goldberg update.
1258000	1259000	No, no, no.
1259000	1260000	You like a laser stack, Dan?
1260000	1262000	Are they baked or what is the...
1262000	1263000	Probably.
1263000	1264000	I am.
1264000	1265000	Ah, drugs.
1265000	1266000	Okay.
1267000	1269000	So that's great about Aaron.
1269000	1272000	It's really cool that MC dropped your name.
1272000	1273000	Ah.
1274000	1275000	Ah, that's...
1275000	1276000	No back brace?
1276000	1278000	No, I'm doing pretty well on that, actually.
1278000	1279000	What's going on with your back?
1283000	1286000	I'm only going to answer questions while eating delicious
1286000	1288000	laser stacks available in cheddar.
1288000	1290000	From the dollar store of Pasadena.
1290000	1291000	These better be good for you.
1291000	1292000	These suck.
1297000	1300000	My back brace is awesome.
1300000	1303000	Most important thing to know about my back brace.
1304000	1306000	Yeah, these are delicious.
1306000	1307000	Are you on something?
1307000	1308000	No.
1308000	1309000	You said drugs.
1309000	1310000	Yeah, I did, didn't I?
1310000	1313000	No, it's just a delicious flavor of laser...
1313000	1314000	You're right.
1314000	1315000	These just don't...
1315000	1316000	You're high as fuck right now.
1317000	1323000	Adam, your family listens to this podcast.
1324000	1328000	My brother asked if there are any extra XL t-shirts.
1328000	1332000	You don't have to say yes, but this does count as me asking on the record.
1332000	1333000	Fuck that guy.
1333000	1334000	Yeah, fair enough.
1335000	1338000	And my back has been slowly recovering due to physical therapy,
1338000	1340000	but now that I'm back to lifting...
1340000	1341000	Thank you.
1341000	1343000	One person applauded and they're the best person.
1344000	1345000	It's your physical therapist.
1347000	1348000	It's work, yeah.
1348000	1349000	Woo, dying art!
1351000	1352000	No, I'm doing pretty much better.
1352000	1356000	I was lifting a bunch of boxes for a Christian film this weekend.
1356000	1357000	Yeah, and I met...
1357000	1360000	Actually, I met a fan of the podcast on the film,
1360000	1362000	and he's much more interesting than I am.
1362000	1365000	And I'd like to invite Jay to the stage because I'm doing terrible.
1365000	1371000	It is not your fucking privilege to invite people to the stage.
1372000	1374000	That's not how that works.
1377000	1381000	What if I sweeten the deal with some delicious Lay's Stacks available in check?
1381000	1384000	From the Pasadena 99 Center?
1384000	1385000	This time you've gone too far.
1385000	1386000	Okay.
1388000	1392000	Damn, why don't we just sit out in the audience and let Adam do the rest of the show?
1392000	1395000	That would be a bad idea, and let's do it.
1395000	1398000	Give us the headline on what makes him so interesting.
1398000	1401000	Well, Lay's Stacks are the ultimate way to recharge.
1401000	1404000	And it says Lay's Stacks and there's not enough room,
1404000	1407000	there's a copyright symbol, and it says brand underneath it.
1407000	1411000	So please do not use Lay's Stacks, all capitals,
1411000	1415000	in a way that the Frito-Lay Corporation would dislike
1415000	1418000	because they are a registered brand.
1418000	1421000	Cheddar Flavored Potato Crisps give you the full flavor.
1421000	1422000	What is going on?
1422000	1424000	Are you Crispin Glover now?
1424000	1426000	Are you going to start karate kicking?
1426000	1429000	You're reading a potato chip label.
1429000	1431000	I really want to punt these into the audience,
1431000	1434000	but the first three words will suffer more than they are now.
1435000	1437000	You've gone mad with...
1437000	1441000	I've gone mad with delicious cheddar flavor.
1441000	1444000	In 9% of my daily sodium, I'm done.
1444000	1445000	That's about it.
1445000	1447000	Adam Goldberg, everybody.
1455000	1457000	What just happened?
1457000	1459000	Maybe he's on Painkillers or something.
1459000	1461000	That's why his back brace is on?
1461000	1463000	That's PCP. He's on PCP.
1464000	1466000	Is that dust? Is that angel dust?
1466000	1467000	Angel dust.
1467000	1468000	Is that what angel dust is?
1468000	1469000	Yeah.
1469000	1470000	PCP? What is PCP?
1470000	1471000	It's like...
1471000	1472000	It's angel dust.
1473000	1474000	Well, this is...
