start	end	text
1474000	1476000	I mean, this is conversations going in circles.
1476000	1478000	Is it like a...
1478000	1479000	PCP is...
1479000	1480000	The only time...
1480000	1486000	I've seen people on PCP, and it is a intense, like...
1486000	1487000	I'm not sure what the original purpose was.
1487000	1490000	I think it was like a horse tranquilizer or some crazy shit.
1490000	1492000	And friends of mine accidentally have done it,
1492000	1495000	and I've seen them, and they thought they could do anything.
1495000	1497000	And they really just go berserk.
1497000	1501000	And, like, you really do think you could punch your fist through a wall,
1501000	1502000	so you try it.
1502000	1504000	And then there was that bath salts thing
1504000	1507000	that made you think that you would like to eat a face.
1508000	1509000	What?
1509000	1511000	Yeah, you don't even know.
1511000	1512000	Bath salts?
1512000	1518000	For a little while there, there was a spate of human-on-human murder...
1518000	1521000	cannibalism happening on this drug...
1521000	1527000	I thought it was actually people snorting the product called bath salts,
1527000	1530000	like the actual bath salts that someone had figured out
1530000	1533000	that you could snort that and get high,
1533000	1535000	but it was also making you eat faces.
1535000	1536000	But I think it's...
1536000	1538000	Isn't it just a drug you kids are taking?
1539000	1541000	What is the active ingredient in the bath salts?
1541000	1543000	It's basically...
1543000	1547000	It's chemically equal to something like a illegal substance,
1547000	1550000	but they basically use different ingredients and methods to get around it,
1550000	1553000	so they were selling basically what equivalent to, like,
1553000	1558000	something like a PCB in, like, legal form in packets of stores.
1558000	1559000	It's basically meth.
1559000	1560000	Yeah, it's meth.
1560000	1561000	It's meth.
1561000	1563000	And you take a bath in it?
1564000	1565000	Bath salts?
1565000	1566000	Oh, okay.
1566000	1569000	But there's a special ingredient, human face,
1569000	1572000	and once you get a taste for it, you...
1572000	1575000	Is somebody else talking out there?
1576000	1578000	Did somebody just take a phone call,
1578000	1581000	or was somebody, like, loaded with information about bath salts?
1581000	1584000	Because if you are, you could tell us.
1584000	1586000	All right, well, enough about...
1586000	1587000	We talked about drugs.
1587000	1589000	We talked about Cobra Commander.
1590000	1592000	We talked about rock and roll.
1592000	1594000	Why don't we bring Spencer up?
1594000	1595000	Fuck yeah, why not?
1605000	1606000	Hello, Spencer.
1607000	1608000	Hey, hey, hey.
1608000	1611000	Spencer, is it just me or is your beard becoming more and more majestic
1611000	1612000	as time goes by?
1613000	1617000	Long time fans may know that my beard increases in length
1617000	1619000	every time I get more Twitter followers.
1623000	1624000	Having a beard's weird.
1624000	1626000	Do you like having a beard, Dan?
1626000	1629000	Only if I'm able to keep it clean.
1629000	1630000	Yeah.
1630000	1632000	Yeah, otherwise it gets very itchy.
1632000	1635000	I find that people, people take...
1635000	1638000	I mean, having a beard is...
1638000	1641000	It's a lot like having, like, a comment section on your face.
1643000	1645000	People just feel free to say anything.
1645000	1647000	They're like, oh, man, how long have you been growing that?
1647000	1648000	I mean, that's fine.
1648000	1650000	Or like, oh, when are you planning on cutting that?
1650000	1654000	Or this old guy's like, I'll give you $50 to cut that right now,
1654000	1656000	or someone's like, fuck you.
1658000	1659000	Yeah, yeah.
1659000	1661000	Yeah, and it is kind of unwarranted
1661000	1663000	because it's not like you did anything special.
1663000	1664000	You really just let it grow.
1664000	1665000	It's like...
1665000	1667000	I did less than everybody else.
1668000	1671000	My question is, but there's no answer to this except biology.
1671000	1673000	Like, how do you get it to be so long?
1673000	1675000	I don't think I'm capable of doing that.
1675000	1677000	Yeah, well, what was that movie?
1677000	1681000	In the movie Knocked Up, were they making fun of a guy for growing a beard?
1681000	1682000	Can't remember.
1682000	1683000	Yeah, it's like that.
1683000	1686000	Like, there's this phase that's terrible.
1686000	1690000	I think it's just long enough so it curls back and is stabbing into your face
1690000	1692000	and that's what makes it all itchy.
1692000	1696000	Once you get past that, it kind of just bursts forth in majesty.
1697000	1699000	Do you really think that if I just never trimmed my beard
1699000	1702000	that it would ever acquire length like that?
1702000	1705000	Yeah, when I was in like middle school and high school and stuff,
1705000	1708000	people would tell me that I missed some spots shaving
1708000	1713000	when I just didn't shave because it only came in like two spots on my face.
1713000	1717000	But eventually, if you don't shave it, it'll start filling out and stuff.
1717000	1720000	I think it's just that everything grows at a different rate.
1720000	1723000	So if you're shaving your whole face, it'll only be patchy.
1723000	1725000	But if you let it grow long enough, you know.
1725000	1728000	Dan, do you not trim your beard? You don't curtail that?
1728000	1730000	It stops at that length?
1730000	1734000	I usually end up trimming it, but I feel like if I don't trim it,
1734000	1737000	all that happens is it just sort of like, as I've said,
1737000	1739000	it just kind of Galifianacuses.
1739000	1745000	It just kind of gets bushier, but it doesn't really take on this cascading,
1745000	1748000	beautiful waterfall of manhood.
1748000	1750000	I don't know. I think the bushy look is a lot better.
1750000	1752000	This just looks really weird.
1752000	1754000	Well, I'm just saying.
1754000	1758000	I don't know if everyone automatically has the ability to zeezy top it.
1758000	1762000	I think some of us, I would just look more and more like
1762000	1766000	there was a donut of hair around my head.
1766000	1770000	I would just end up being like this weird Dick Tracy character.
1770000	1773000	Donut head.
1773000	1775000	I'm taking Dick Tracy out of the headlines.
1775000	1777000	I'm rubbing them out. Easy donut head.
1777000	1780000	Just keep playing poker.
1780000	1783000	Hey, little face. Yeah, donut head?
1783000	1787000	What's the difference between us?
1787000	1790000	I have a tiny face surrounded by a head.
1790000	1793000	You have a regular head surrounded by a bunch of hair.
1793000	1797000	Why am I explaining this to you?
1797000	1801000	Because I'm donut head. I'm not too bright.
1801000	1804000	I got involved in organized crime not because it was my passion.
1804000	1806000	It was because I had no other options.
1806000	1809000	I lacked the aptitude for other occupations.
1809000	1813000	Come on, donut head. Don't be so hard on yourself.
1813000	1815000	You get the tiny little face.
1815000	1817000	It's like you're born to be a gangster.
1817000	1821000	You being sarcastic? No.
1821000	1824000	I pick up on that shit, you see.
1824000	1826000	Let's get Dick Tracy.
1826000	1828000	All right, little face.
1828000	1834000	Later.
1834000	1836000	Why do you keep your bread in the freezer?
1836000	1839000	What are you doing in my apartment?
1839000	1841000	Who keeps bread in the freezer?
1841000	1844000	You want a sandwich and now you go to the freezer and the bread's fucking frozen.
1844000	1845000	What are you going to...
1845000	1847000	You know you need a sandwich a half hour before?
1847000	1849000	Meanwhile...
1849000	1854000	I want my face to be brought to the left.
1854000	1855000	Oh, but the Cobra Commander.
1855000	1859000	That would have replaced Mr. Roosevelt.
1859000	1860000	I don't care.
1860000	1863000	I heard he didn't even do anything to be on this mountain.
1863000	1866000	Also, gee, I chose. Terrible. I hate them.
1866000	1870000	Later.
1870000	1876000	Stacy, move those shoes.
1876000	1883000	You found the bottom of my improv hopper.
1883000	1888000	I wanted that to go on for the rest of my life.
1888000	1893000	I wanted to just keep saying meanwhile and later and that would go on forever.
1893000	1894000	Yeah.
1894000	1896000	That got bad pretty quick, didn't it?
1896000	1899000	Didn't even start that good.
1899000	1905000	Just looking at my Evernote, back to Evernote.
1905000	1906000	All right.
1906000	1908000	I let the waiters have it, right?
1908000	1911000	Just don't do that.
1911000	1912000	What do you mean why not?
1912000	1914000	Who said that?
1914000	1916000	Are you a waitress?
1916000	1918000	Come up on stage and get a microphone.
1918000	1921000	If you want, if you want.
1921000	1922000	What's your name?
1922000	1923000	Lissette.
1923000	1924000	Hello, Lissette.
1924000	1925000	All right.
1925000	1927000	Can we re-pipe some of that now that you're...
1927000	1928000	Maybe we'll edit out the...
1928000	1929000	So you are a wait person.
1929000	1930000	I was.
1930000	1931000	Who has taken the stage.
1931000	1935000	You were a wait person for seven years, which you said?
1935000	1941000	Six years from numerous restaurants around the L.A. county that have no need for me.
1941000	1942000	So there you go.
1942000	1943000	Okay.
1943000	1949000	And what you were saying is that you learned from wait people.
1949000	1950000	Yeah.
1950000	1951000	Well, it's like, okay.
1951000	1952000	You finish your pie.
1952000	1953000	I'm like, oh.
1953000	1954000	Okay.
1954000	1955000	Finish your pie.
1955000	1956000	You look like you really like it there, right?
1956000	1957000	That's what they say, you know.
1957000	1958000	Well, no.
1958000	1959000	They say it looks like you hated it.
1959000	1960000	Right.
1960000	1961000	Whatever.
1961000	1962000	Well, what you say...
1962000	1963000	You know what I mean.
1963000	1964000	I'm sorry.
1964000	1965000	I'm sorry.
1965000	1967000	Well, I mean, but what you said I want to point out is actually kind of a...
1967000	1968000	I mean, that wouldn't be half as bad.
1968000	1969000	Yeah.
1969000	1970000	I would say...
1970000	1971000	You said, oh, you really liked it.
1971000	1972000	Thank you.
1972000	1975720	But I'm saying I've worked with people that have said that, and I, as a waitress, when
1975720	1979800	I've gone out to eat, they've told me that, oh, it looks like you hated it.
1979800	1980800	And you don't like that, do you?
1980800	1985280	And I didn't like it, but I've had friends that have been with me while it's been said
1985280	1988000	to me that, and here's what you do.
1988000	1991840	The next time they tell you that, you say, yeah, it sucked.
1991840	1992840	You say that.
1992840	1993840	You say that.
1993840	1994840	And then they're kind of confused.
1994840	1995840	They're like, but if you...
1995840	1996840	Like, for example, if you...
1996840	1997840	Why'd you eat it?
1998680	2000560	If it sucked, why'd you eat it all?
2000560	2004320	And you're like, you could say, well, because I couldn't order anything else because you
2004320	2007600	were too lazy to come back for me to change my order.
2007600	2012360	And I swear to God, that will make them feel worse because the way your servers don't...
2012360	2016720	So in telling them you murdered their parents, I mean, like, when it comes to a certain point
2016720	2018760	where it's just like, what is our goal here as a society?
2018760	2022840	Is it just to poison each other's brains and souls?
2022840	2023840	Yes.
2023840	2024840	No.
2024840	2028320	I'm just saying, if you want to make them feel bad, because they've been...
2028320	2029320	They've told me that before.
2029320	2030320	Well, okay.
2030320	2031320	Here's the thing.
2031320	2033280	I used to work at Johnny Rockets, and Johnny Rockets has apple pie.
2033280	2035200	They have apple pie with cheddar cheese on it.
2035200	2036480	I don't recommend it.
2036480	2037480	You should go to...
2037480	2038480	Pans is better.
2038480	2044040	Anyway, you order that, and some people would be like, well, yeah, the pie was too burnt.
2044040	2046040	And I'm like, well, why'd you finish it?
2046040	2047400	And they're like, well, because I was hungry.
2047400	2048400	And then they still...
2048400	2053080	What's even tackier is when they ask for a refund on something that they ate in completion.
2053080	2056080	But if you want to make them feel bad, ask for a refund.
2056080	2058880	You don't necessarily have to get it, but you'll definitely put the server in their place.
2058880	2059880	All right.
2059880	2060880	Well, all right.
2060880	2061880	I'm just saying.
2061880	2063360	Lizette, did you work at one of the Johnny Rockets where you had to get up on the counter
2063360	2064640	and sing and dance and stuff?
2064640	2065640	That's ed to business.
2065640	2066640	Yes, it was the...
2066640	2067640	Oh, oh.
2067640	2068640	Yeah.
2068640	2069640	There are Johnny Rockets.
2069640	2070640	If they play YMCA, you have to get up and do the...
2070640	2071640	Or Respect by Aretha Franklin.
2071640	2072640	Yeah, by Aretha Franklin.
2072640	2073640	Did you have to do that?
2073640	2074640	Oh, it was very...
2074640	2075640	Yeah.
2075640	2076640	It wasn't my better day.
2076640	2078640	Can we see a little diversion of it?
2078640	2079640	No, thank you.
2079640	2081640	She just said it was horrible.
2082520	2086360	I mean, she's comfortable making people feel worse about things.
2086360	2091200	No, I'm just saying, I've been a server and I've, you know...
2091200	2092200	Whatchu want?
2092200	2093200	Anything.
2093200	2094200	I got it.
2094200	2098280	Is that like the sound of an alarm clock at a movie or are you going like, ahh?
2098280	2100840	I still like that song regardless that I had to dance to it.
2100840	2101840	Really?
2101840	2102840	Wow.
2102840	2103840	But I'm just saying, yeah.
2103840	2104840	It's not that I'm trying to make a server feel bad.
2104840	2105840	I'm just saying.
2105840	2106840	There's two kinds of servers.
2106840	2108800	They're dicks and then they're nice people.
2108800	2109800	They're nice people.
2109800	2110800	Yeah, basically.
2110960	2111960	Nice people.
2111960	2112960	Dicks and nice people.
2112960	2113960	I was like, holy shit.
2113960	2114960	This is going to a...
2114960	2115960	I said nice.
2115960	2116960	I know.
2116960	2117960	I know.
2117960	2119960	Originally, when you said that though, I thought, wow.
2119960	2124520	Look, as everyone has gone out to eat in the city, I'm pretty sure we all come across the
2124520	2129040	narcissistic waiter and then there's, you know, the overtly nice people.
2129040	2131240	I was one of the waitresses that was super nice.
2131240	2133080	That's why I never got fired right away.
2133080	2134080	But...
2134080	2137400	You got fired for embezzling later on down the road?
2137520	2141520	No, I once got fired for telling someone that they were inadvertently fat.
2141520	2142520	I didn't mean to.
2142520	2144520	Wait, you said they were inadvertently fat?
2144520	2145520	No.
2145520	2146520	I didn't say that.
2146520	2147520	Well, it's like, okay.
2147520	2152160	So this lady comes in and she orders a chicken pot pie, right?
2152160	2155240	But prior to ordering it, her friends are like, oh, she just got wisdom teeth.
2155240	2157400	What do you think about the chicken pot pie?
2157400	2159400	I said, it's too heavy for you.
2159400	2160400	I said that.
2160400	2164520	I was referencing texture, but I wasn't smart enough to say, oh, the texture for that is
2164520	2166760	too heavy for your teeth.
2166760	2168520	I just said, oh yeah, that's too heavy.
2168520	2171160	So she equates that with, oh, you're calling me fat.
2171160	2172560	She told my manager, I got fired.
2172560	2173560	Wow.
2173560	2174560	There you go.
2174560	2175560	Holy crap.
2175560	2176560	Yeah.
2176560	2177560	Was she fat?
2177560	2178560	No.
2178560	2179560	She was okay.
2179560	2180560	You know, she wasn't...
2180560	2181560	She was fat.
2181560	2182560	No.
2182560	2187560	She was a little stocky, but I'm not going to say that.
2187560	2192000	She was a little stocky, but I'm not going to say that.
2192000	2195660	But I'm curious though, because you said it's too heavy for you.
2195660	2200100	It's the for you that made her go, oh, what did you mean by for you?
2200100	2202900	Well, I should have said, no, the texture of chicken pot pie.
2202900	2203900	We've all had it.
2203900	2208740	It's basically mashed potatoes in a pie, come on, and peas and chicken or a shepherd's
2208740	2209740	pie or whatever.
2209740	2210740	But you were saying for her.
2210740	2211740	Yeah.
2211740	2212740	Why?
2212740	2213740	Well, because she just got wisdom teeth surgery.
2213740	2214740	Oh.
2214740	2215740	Would you want to eat?
2215740	2216740	That's...
2216740	2217740	Why did you know that?
2217740	2218740	She said that?
2218740	2219740	Yeah.
2219740	2220740	Did I not say that earlier?
2220740	2221740	Yeah.
2221740	2222740	Oh, okay.
2222740	2223740	Sorry.
2223740	2224740	Hey, I'm a terrible interviewer.
2224820	2227860	You're probably only a terrible interviewer because you keep telling yourself that you're
2227860	2228860	a terrible interviewer.
2228860	2229860	During the interviews, yeah.
2229860	2230860	Instead of listening.
2230860	2231860	Oh, yeah.
2231860	2233860	Do you ever not interview yourself in the bathtub?
2233860	2234860	You can get better that way.
2234860	2235860	I have...
2235860	2236860	No.
2236860	2241380	You're talking about jerking off, right?
2241380	2243620	You interview yourself in your bathtub?
2243620	2246820	I interview myself all the time with a bathtub.
2246820	2250820	You never fantasize about being on David Letterman or like that kind of thing or Barbara Walters
2250820	2252780	and having them tell you specific questions.
2252820	2256820	I think maybe when I was a lot younger, yeah, I would have fantasies about being on a panel.
2256820	2260540	Let's say that you were on Letterman Tonight or Conan.
2260540	2262340	Do you have a Conan or Letterman Story?
2262340	2265740	What would be your go-to anecdote that you would say?
2265740	2267580	I don't know.
2267580	2268580	It depends on...
2268580	2269580	I don't know.
2269580	2270580	I have plenty of things, but...
2270580	2273100	You're the one that practices all this shit.
2273100	2274100	You don't have a go-to?
2274100	2275100	Well, what's your...
2275100	2277900	Do you have a fantasy reason why you would be that noteworthy?
2277900	2278900	Well, yeah.
2278900	2281740	I don't want to work at Starbucks for the rest of my life.
2281740	2282740	I know.
2282740	2287900	But, I mean, in your fantasy when you're on Letterman, like, why is Letterman having you
2287900	2288900	on in the fantasy?
2288900	2292100	Is it because of a book you wrote or is it because of a dance you do or...
2292100	2293100	Yeah.
2293100	2294100	I invented the...
2294100	2295100	No.
2295100	2296100	I just...
2296100	2297100	Yeah, I don't know.
2297100	2298100	For whatever reason.
2298100	2299100	For whatever reason.
2299100	2301100	I take over your job.
2301100	2302100	Okay.
2302100	2303100	Well...
2303100	2304100	No, I'm kidding.
2304100	2305100	That I'm just saying.
2305100	2308180	It's going to be the toughest shoes you'll ever fill.
2308180	2311180	You'll have to learn how to not listen to people while you're interviewing them.
2311180	2318900	But, oh, well, I mean, that's interesting to me, though, because so you're fantasizing
2318900	2325220	about being on David Letterman, and he's just going, our next guest is Lisette, and let's
2325220	2326220	bring her out.
2326220	2328620	And you're like, hey!
2328620	2329620	And he's like, so...
2329620	2333700	That is an amazing dress you're wearing, and, like, you talk about the dress and you tell
2333700	2334700	some...
2334700	2337100	Well, the interesting thing about it to me is it makes me realize the people that are
2337100	2339220	on Letterman aren't really...
2339220	2342500	They're just plugging a movie, but it's not like they come out and do a scene from it.
2342500	2345220	Like, they just come out and they talk about parking tickets.
2345220	2348580	Well, have you noticed that every interviewer has their different thing?
2348580	2351940	Conan O'Brien lets pretty girls touch his hair.
2351940	2352940	You want to touch his hair?
2352940	2353940	He's like, ugh.
2353940	2356580	Like, you know, he pretends that his hair is, like, you know, alive or whatever.
2356580	2360340	David Letterman tends to hit on really pretty girls, and he makes, like, awkward people
2360340	2361740	feel even more awkward.
2361740	2363700	He's kind of mean, but he's kind of nice at the same time.
2363700	2364700	I don't know.
2364700	2366540	Maybe he just plays favorites, but I don't know.
2366540	2368860	You could talk to him about that on the panel, right?
2368860	2372420	You could come out, you'd turn the tables on him, and he'd be like, wow, what's happening?
2372420	2375060	And he'd be like, I'm Lisette, motherfucker.
2375060	2376660	All right.
2376660	2378780	Well, thank you, Lisette, for sharing your information.
2378780	2379780	Lisette.
2379780	2380780	Thank you.
2380780	2394300	That was experienced weight person, Lisette, on how to make a weight person feel bad.
2394300	2396460	I worked as a busboy once, and it was the worst.
2396460	2402220	I was so bad at it, because I hate people.
2402220	2403220	Busboys hate people?
2403220	2404220	No, I hate people.
2404220	2405220	Right.
2405220	2411300	I worked at our country club, and so it was just rich white douchebags, and I was broke,
2411300	2413220	and it was a terrible job.
2413220	2418260	And one time, I came out, and we had to build everything, so you had to put a dance floor
2418260	2421980	together and put sectional walls up and carry these giant tables out.
2421980	2426060	So by the time the guests were there, you were exhausted, and you were cut.
2426060	2430140	We always had the band-aids on, and we're serving food, it's totally gross.
2430140	2436980	And I was carrying a tray out, and I had 15 or so little silver coffee creamer, like creamer
2436980	2438620	tins in it.
2438620	2446180	And I had to put one on each table, and I was so tired and fatigued, I dropped it all
2446180	2451300	over the back of a lady in a black velvet dress.
2451300	2452820	And everybody loses.
2452820	2458220	I felt bad, she felt bad, the husband felt bad, everyone in the world died a little bit.
2458220	2462060	And the husband got up, and he just started screaming at me.
2462060	2466380	And I wanted to disappear and die, and I'd do anything to make that not happen.
2466380	2468620	I'm so like, I'm just blushing.
2468620	2473620	And this guy, he's about a head shorter than me, but he's a big, stocky little fucker.
2473620	2477700	He just turns purple, and he's like, God damn it, and he starts screaming at me.
2478700	2482300	And the wife was covered in creamer.
2482300	2486500	I'm covered in shame, and I just looked at the guy and I go, enough.
2486500	2492620	And I put my finger in his face, and he kept yelling, and I go, shut up.
2492620	2498940	Like you're yelling is not making her happier, like I'm going to murder you, because you're
2498940	2499940	making this worse.
2499940	2504820	And then I called my manager a cunt, and I left.
2508500	2510500	For those listening, Jeff just applauded himself.
2514100	2516100	As soon as you get listening, I frequently am underneath the podium.
2516100	2518300	I'm frequently applauding myself.
2518300	2520500	I think every time I've ever quit a job, I've called somebody a cunt.
2520500	2522500	That's not good.
2522500	2523500	It's better in England, right?
2523500	2525900	It's more of a terrible word here.
2525900	2527700	Yeah, I meant it to hurt.
2530100	2533700	I worked at a Trader Joe's, and she just stole everything.
2534700	2539700	There's nothing worse you can call another man than the C word, because it's a horrible
2539700	2541100	word to call a woman.
2541100	2544100	And then you're calling a man.
2544100	2551100	When I've been really angry, I can't even think of examples, but when it's sort of like
2551100	2558600	that primal man-on-man rage, when I really want a guy to feel really terrible about himself,
2558600	2563100	I call him the worst word you can call a woman, which is interesting.
2564500	2566500	It's kind of the opposite of interesting.
2566500	2569500	It's like the most obvious thing in the world.
2569500	2575600	What was the last job you had before a writer, like the actual 9-5, or like an actual job
2575600	2576600	job?
2576600	2582100	The last time, I think it was as a data entry clerk.
2582100	2584100	I think that was my last real job.
2584100	2591600	I think after I quit that, I was like, I can't, because I was, I'm going to run down my curriculum
2591600	2592600	vitae.
2592600	2594600	Is that how you say that?
2594600	2595600	Yeah.
2595600	2601600	A lot of resume writers here that have that on their CV.
2601600	2607600	I worked as a caddy at a country club.
2607600	2609600	It was awful.
2609600	2611600	You're working for like way subminimum wage.
2611600	2617100	You have to get this permit that allows you to be working for not really any money at
2617100	2618100	all.
2618100	2619100	So you're just reliant on these tips.
2620100	2622100	It's a Milwaukee country club.
2622100	2625100	It wasn't like they were just throwing 50s around.
2625100	2627100	They would just give you a dollar.
2627100	2629100	I've had caddies before, like in nice courses.
2629100	2630100	I have friends who are good golfers.
2630100	2631100	I get to go play with them.
2631100	2634100	And the caddies are actually like, they help you read your putts.
2634100	2636100	They tell you what club selection they give you.
2636100	2638100	Do you have any golf knowledge?
