start	end	text
2638100	2640100	I would just fake it.
2640100	2647100	I would go, because the guy would go, like, I remember one triumph was the guy going,
2648100	2651100	so what do you think, like, five wood?
2651100	2654100	And I was like, eh.
2654100	2657100	I was like, eh, three, three, huh?
2657100	2659100	And I was like, yeah, yeah.
2659100	2664100	And then he, I remember, and then he hit it, and he got on the,
2664100	2667100	across this body of water.
2667100	2670100	It was like a river between, I don't think he got on the green.
2670100	2672100	But he was like, it landed.
2672100	2676100	And then he was like, huh, no, you were right.
2677100	2680100	And he said, if I used a five, I would have been swimming.
2680100	2683100	And I was like, yeah, yeah.
2683100	2684100	Oh, yeah.
2684100	2687100	You'd have been wet, Jack.
2687100	2690100	Then you'd need to get a snorkel porker out.
2690100	2691100	Snorkel porker.
2691100	2696100	But you had to clean their clubs with a toothbrush at the end of everything.
2696100	2698100	It was like, you haul their clubs.
2698100	2702100	That's some heavy shit, dude, like a bag of golf clubs.
2703100	2706100	And then sometimes 18 holes.
2706100	2710100	And then get it back to the so-called caddyshack,
2710100	2713100	which is not as fun as it sounds.
2713100	2721100	And wash the fucking grass stains out of the ridges in their clubs
2721100	2724100	for 40 minutes with a toothbrush.
2724100	2727100	And then eventually they'll come over and they'll give you a dollar.
2727100	2728100	A dollar?
2728100	2730100	Well, this was back in the 40s, right?
2730100	2733100	This was Carter dollars.
2733100	2737100	They weren't worth as much, but there was also no oil.
2737100	2740100	I don't know.
2740100	2746100	My longest job was a dishwasher at the rehab center in Milwaukee.
2746100	2747100	I would wash dishes.
2747100	2749100	Spencer, do you miss your job at Apple?
2749100	2750100	I miss the people.
2750100	2753100	I think that a lot of the people I worked with were really awesome.
2753100	2756100	But I don't miss anything else about the job.
2756100	2758100	Do you miss Steve Jobs?
2758100	2759100	No.
2759100	2762100	Did he ever come in and go like, teamwork?
2762100	2763100	Yeah.
2763100	2767100	No, we hung out a few times.
2767100	2768100	You lying?
2768100	2771100	Yeah.
2771100	2773100	I just I answered the phones all the time.
2773100	2776100	Like, like it is really stupid, like terrible stuff.
2776100	2780100	So I mean, I when I when I applied for the job, I was like,
2780100	2781100	how much phones are involved?
2781100	2782100	And they're like, none.
2782100	2786100	And then I got hired and they're like, we're adjusting our positions.
2786100	2787100	So you answer the phone now.
2787100	2792100	So it was like it was the worst possible situation for me
2792100	2798100	because I hate dealing with idiots I can't see.
2798100	2800100	So I mean, no, but it was really terrible.
2800100	2804100	People would be all like, hey, I got an iPad.
2804100	2805100	OK.
2805100	2806100	Yeah.
2806100	2808100	It takes pictures.
2808100	2809100	Yeah.
2809100	2810100	Yeah.
2810100	2814100	It's just like they don't even have anything to say.
2814100	2817100	It's just lonely people.
2817100	2819100	It's just called the talk.
2823100	2825100	I'm taking a picture of my phone.
2825100	2826100	Yeah.
2826100	2828100	So can you see me doing that?
2832100	2836100	Well, let me let me let me be let me be an Apple phone
2836100	2841100	answer and you be the worst amalgam of all the Apple people
2841100	2844100	or just or just an example of Apple Apple experience.
2844100	2845100	You hate it.
2845100	2846100	All right.
2846100	2847100	Ring ring.
2847100	2849100	Hello, Apple.
2849100	2850100	Yeah.
2850100	2853100	I got an iPad three G's or something.
2853100	2856100	I think it's it's got a touch pad on the top.
2861100	2862100	Is this based on reality?
2862100	2865100	Normally when there's icons, you see icons.
2865100	2868100	But I'm just seeing a black Apple on a gray background.
2868100	2871100	Oh, it sounds like your product is starting up.
2871100	2872100	I know that.
2872100	2874100	No, it's been like this since I got it.
2877100	2879100	So is it is it an iPad or?
2879100	2881100	Yeah, it's on my table.
2888100	2889100	Hold on.
2889100	2890100	The kettle's going.
2891100	2892100	I have a follow up.
2892100	2893100	I have a phone.
2893100	2895100	Dan, can you be the Apple employee?
2895100	2897100	But be also be Cobra commander at the same time.
2898100	2899100	All right.
2899100	2900100	New phone call now.
2900100	2902100	Cobra Cobra.
2902100	2905100	Cobra Command has done such a good job of running the country
2905100	2906100	that now it's yeah.
2906100	2908100	Cobra Command is just working on an Apple store.
2909100	2910100	Bring bring.
2910100	2913100	I have been on 15 different lines.
2913100	2915100	I have been on 15 different lines.
2915100	2918100	I have been on 15 different lines.
2918100	2920100	I have been on 15 different lines.
2920100	2922100	I have been transferred seven times.
2922100	2924100	I don't know how Apple products work.
2924100	2926100	Your company is garbage.
2926100	2928100	Can you give me all the free stuff?
2930100	2933100	I appreciate your situation.
2933100	2936100	Could you please just relax for a moment?
2936100	2938100	This is the first time I'm speaking to you.
2938100	2941100	Your company has charged me four times in the last month
2941100	2943100	for bills I haven't seen.
2943100	2946100	I've never seen any certificates or receipts.
2946100	2949100	I didn't even know I'd be charged for stuff like HBO.
2952100	2956100	It sounds like you're describing something other than Apple, sir.
2956100	2958100	This is the AT&T store.
2958100	2959100	This is Apple.
2959100	2961100	The AT&T store.
2962100	2965100	I called AT&T corporate and they transferred me here.
2972100	2973100	Later.
2976100	2979100	Hello, AT&T. This is Destro.
2981100	2984100	He transfers all the AT&T calls to Cobra Commander.
2985100	2986100	Because he hates him.
2988100	2990100	There was some crazy shit going on in G.I. Joe, man.
2990100	2996100	Right when they ended, that was when Destro and Professor Mindbender
2996100	2998100	went off on the side and they were like,
2998100	3000100	I don't think Cobra Commander is doing a good job.
3000100	3009100	And they made Sir Pentor out of the DNA of like 85 different dictators,
3009100	3010100	except Hitler.
3011100	3013100	It's like the elephant in the room.
3013100	3016100	They're like, we're going to get Attila the Hun and Genghis Khan.
3016100	3018100	And you're like a kid going, what about Hitler?
3019100	3020100	Come on.
3022100	3023100	We're not douchebags.
3023100	3024100	We're not douchebags.
3026100	3030100	Napoleon and Alexander the Great.
3031100	3033100	Vlad the Impaler was in there.
3034100	3036100	Somebody went, yeah.
3040100	3042100	And they activated Sir Pentor.
3044100	3047100	Of course, they put some frog DNA in there or something
3047100	3050100	that made Sir Pentor really unruly.
3051100	3055100	So then toward the end of G.I. Joe,
3055100	3058100	Destro was going back to Cobra Commander and going,
3058100	3059100	I'm sorry.
3059100	3060100	I've kind of fucked up.
3061100	3064100	And they were forming a new, there were like three organizations
3064100	3065100	that were all fighting each other.
3065100	3069100	That's the thing about G.I. Joe is G.I. Joe had its shit together,
3069100	3072100	ran the government, and there was no infighting.
3072100	3076100	And then Cobra was just like, you couldn't get through a day over there.
3076100	3080100	It was just like, why are you always implying that I'm not good?
3080100	3081100	I didn't say that.
3081100	3085100	I just think we should send the microchips to the rockets.
3085100	3089100	Oh, your insolence will be d-d-d-d-d-d-d.
3090100	3092100	It's just like, they were their own worst enemy.
3092100	3094100	Your insolence will be what?
3094100	3096100	Demanded, I don't know.
3096100	3097100	They're self-destructive, I'm telling you.
3097100	3099100	They demanded insolence.
3100100	3101100	All right.
3101100	3102100	Should we...
3102100	3104100	Sir Pentor, do you think you're ever going to get married?
3104100	3106100	I mean, God willing.
3106100	3107100	You want to be married?
3107100	3108100	Sure.
3108100	3110100	And religiously, of course.
3110100	3114100	Yeah, I was going to say only religiously, but that's not very funny.
3114100	3116100	Where would your ideal wedding take place?
3116100	3117100	I don't care.
3118100	3119100	Why does that matter?
3119100	3121100	It's supposed to be for the bride, right?
3121100	3123100	Well, for both.
3123100	3126100	I say for the people that have to sit there.
3126100	3127100	Well, fuck them.
3127100	3130100	No, the whole inviting them to the wedding is fuck them.
3130100	3131100	Well, they could say no.
3131100	3133100	When they get there, they want to get drunk and they want to...
3133100	3136100	That would be pretty good, though, to have a Raiders of the Lost Ark wedding,
3136100	3139100	but you have to make everyone that comes, including Grandma and Grandpa,
3139100	3141100	and everybody comes as Nazis.
3143100	3145100	And then they all get melted.
3147100	3149100	There's all these pyrotechnics and stuff,
3149100	3151100	and then these light beams go through their torsos.
3151100	3152100	Yeah.
3154100	3155100	Yeah, I just think...
3155100	3157100	I mean, I wouldn't mind...
3157100	3161100	I kind of want there to be a character at my wedding.
3162100	3164100	Not even just at the reception.
3166100	3170100	At the actual idea of you're getting married
3170100	3173100	and then someone comes in from the back and says,
3173100	3175100	like, I don't think they should get married,
3175100	3177100	and then you sword fight them.
3178100	3180100	And then you get married.
3180100	3183100	It just said that the audience has something.
3183100	3187100	I bet a guy at the drawing room, his wife is Scottish,
3187100	3189100	and they got married in Scotland,
3189100	3193100	and the ring bearer was the owl from...
3193100	3195100	What's the owl from Harry Potter?
3195100	3198100	Yeah, he fucking flew in and brought the ring.
3198100	3203100	And there's a picture of the owl flying in with the ring,
3203100	3206100	and the crowd's like, what the fuck?
3206100	3207100	Is that Hedwig?
3207100	3208100	It's Hedwig.
3208100	3209100	Hedwig?
3209100	3210100	Hedwig, yeah.
3211100	3214100	So you've got to do that. You've got to budget.
3215100	3217100	Yeah, but I want a nest egg.
3217100	3220100	I'm going to become very miserly, because I want to retire,
3220100	3224100	and I don't want to have to worry about running out of money.
3224100	3227100	So I'm going to become very thrifty.
3227100	3228100	Yeah?
3228100	3231100	I'm just going to get married,
3231100	3234100	stack a bunch of milk crates,
3234100	3238100	and knock them down and then say, I do.
3241100	3244100	The ring will be in one of the crates, I don't know.
3244100	3246100	You guys going to have kids?
3246100	3249100	That, to me, is the larger point of getting married.
3249100	3251100	Although Rob, Shrav, and Kate Throyne,
3251100	3253100	they don't seem to have any plans to have kids,
3253100	3255100	but they were together for so long,
3255100	3257100	as Rob said very touchingly,
3257100	3261100	like he had run out of ways to make her understand how much he loved her,
3261100	3263100	and so they decided to get married,
3263100	3265100	which was one of the most romantic weddings in the world,
3265100	3266100	because they didn't have to.
3266100	3270100	There wasn't like a precursor to having kids that were divorced,
3270100	3272100	as usually is the case.
3274100	3275100	You knew that they were going to be together forever,
3275100	3277100	because they didn't have to get married.
3277100	3279100	They already lived together for like eight years,
3279100	3280100	and then they were just getting married,
3280100	3281100	because they wanted to be married,
3281100	3282100	so you kind of had that.
3282100	3283100	That was the first wedding I was at,
3283100	3285100	that I was like, holy shit, this is the real deal.
3285100	3287100	You guys should get married to Hermentown.
3287100	3290100	It just seems kind of, seems a little tacky.
3290100	3292100	Not that you applauded something tacky,
3292100	3294100	for those of you who started applauding.
3294100	3298100	It's like Tiny Tim getting married on Carson or something.
3301100	3304100	He's referencing some old shit.
3305100	3308100	Yeah, I was just like...
3310100	3311100	Adam, are you going to get married?
3311100	3312100	No.
3312100	3314100	Sure, why not?
3314100	3315100	Okay.
3315100	3316100	Your girlfriend's free, right?
3316100	3317100	Jeez.
3318100	3319100	She's not.
3323100	3325100	What would be the most romantic wedding?
3325100	3327100	How would you get married?
3327100	3331100	I was in Barcelona once, when I was really broke,
3331100	3332100	and I performed on a cruise ship,
3333100	3335100	and we made a bunch of money on the ship,
3335100	3337100	and I just took the money I made
3337100	3340100	and stayed in Barcelona for a few days,
3340100	3342100	and I was walking around the Gothic Quarter,
3342100	3344100	and there's very narrow streets,
3344100	3347100	and there's Salvador Dali exhibits and stuff,
3347100	3349100	and there's really cool little fruit stands,
3349100	3351100	and then it opened up into this big square,
3351100	3353100	and the street was just so narrow,
3353100	3354100	you can't really see the top of buildings,
3354100	3357100	and I walked in, and it was the biggest cathedral in the world.
3357100	3361100	It was just this enormous, huge cathedral,
3361100	3363100	and there was a choir singing from somewhere.
3363100	3365100	You couldn't even see where the choir was,
3365100	3367100	and on the far side, there was a wedding going on,
3367100	3369100	and there was like 12 people there.
3369100	3371100	In the back, there were old ladies lighting candles,
3371100	3373100	and it was very Catholic and doing that,
3373100	3376100	but in the distance, it was just like falsetto choir singing,
3376100	3377100	and there was a wedding going on,
3377100	3380100	and there was doves flying around through the rafters,
3380100	3382100	and it was really lonely and like somber,
3382100	3384100	and I thought that's how I would do it,
3384100	3386100	and I would invite like a few people,
3386100	3388100	and I would come back to LA,
3388100	3391100	and I would have a big party for everybody else,
3391100	3394100	but whoever wanted to come out to like whatever part of Europe
3394100	3396100	or wherever we found the cool castle, we would do it there.
3396100	3398100	Hmm, all right.
3405100	3407100	He applauded himself.
3407100	3409100	I'll see if I can make it.
3409100	3411100	I don't know.
3413100	3416100	Sounds a little snobby.
3419100	3422100	You're invited.
3422100	3425100	I don't know if I'd fit in.
3425100	3427100	Seems a little fancy.
3427100	3430100	It's like a coffee commercial.
3432100	3434100	It's a VIP moon wedding.
3434100	3435100	Exactly, it is a VIP.
3435100	3437100	You'd love it, because nothing would be required of you.
3437100	3439100	You would just come, and then it would be over,
3439100	3441100	and then we'd all go out and have a drink.
3441100	3442100	All right.
3442100	3445100	You got me at the close.
3446100	3449100	All right, well, why don't we roll into our role-playing adventure?
3449100	3450100	Let's do it.
3450100	3452100	Nice and early.
3452100	3455100	Are we bringing up guests to play Camille or Aaron,
3455100	3458100	or should we just go Alfresco?
3458100	3460100	Whatever you guys want.
3460100	3463100	Come on, have an opinion.
3464100	3466100	I'm dying.
3468100	3469100	You're dying?
3469100	3472100	It's more of like an observation, really.
3473100	3475100	Not really an opinion.
3477100	3478100	Are you really dying, Spencer?
3478100	3480100	No, I'm cool.
3481100	3483100	Were you bummed when Steve Jobs died?
3483100	3485100	No, no.
3487100	3488100	Quite the opposite.
3488100	3491100	I'm actually more bothered by it now,
3491100	3494100	retroactively than I was when it happened.
3494100	3496100	Because it affected the health plan?
3496100	3498100	No, I mean, that didn't happen.
3498100	3501100	I don't even think I got a job until after he died or whatever.
3501100	3502100	I mean, I don't know.
3502100	3507100	But it's just, I mean, he was like a genius.
3507100	3508100	Yeah, he's a visionary.
3508100	3510100	Yeah, there's not too many people like that.
3510100	3513100	And it's like, you know, the world can kind of spin its wheels
3513100	3515100	and like march inexorably forward,
3515100	3519100	but all the good leaps are by some crazy cool guy that like leads people.
3519100	3520100	Yeah, yeah.
3520100	3522100	You kind of pointed at me when you said that.
3522100	3523100	Yeah.
3523100	3528100	What I'm trying to say is it takes a special kind of person
3528100	3530100	with a special kind of charisma.
3530100	3531100	He didn't point that.
3531100	3533100	His hand moved toward his backpack.
3533100	3535100	No, he just kind of flicked his wrist a little bit.
3535100	3536100	I felt like it was pointing at me.
3536100	3538100	A perceived point.
3538100	3541100	Well, you know, Jeff, the world can move inexorably forward,
3541100	3549100	but the kinds of people who decide they want to be pointed at get pointed at.
3549100	3556100	I'm the Steve Jobs of thinking people are pointing at me.
3556100	3559100	I don't know how I went down this rabbit hole,
3559100	3566100	but I was looking at quotes from him and stuff.
3566100	3568100	This is like a very interesting guy.
3568100	3570100	Isn't there a biopic coming out about him?
3570100	3571100	Is Ashton Kutcher playing him?
3571100	3572100	Yeah, Ashton Kutcher.
3572100	3574100	That was a train wreck.
3574100	3575100	I don't know why that's a bummer.
3575100	3578100	Ashton Kutcher won the Teen Choice Award.
3578100	3581100	There's a video that went kind of viral of Ashton Kutcher
3581100	3582100	winning his Teen Choice Award.
3582100	3586100	And he went up and he broke it down.
3586100	3589100	He said that his first name is not Ashton.
3589100	3591100	It's Chris or something.
3591100	3594100	Chris Kutcher.
3594100	3596100	It occurs to me, Anatoly, that that is what...
3596100	3599100	Okay, this is a fucking deep cut Harman Town reference,
3599100	3602100	but when Anatoly was at the Rick and Morty panel at Comic-Con
3602100	3606100	and you were pointing at your shirt, you had an Archer t-shirt on,
3606100	3607100	that's what I thought you were saying.
3607100	3609100	Ashton Kutcher.
3609100	3611100	Ashton Kutcher.
3612100	3617100	Anyways, but Ashton Kutcher went up and he...
3617100	3620100	There's just 16-year-old girls screaming the whole time he's talking,
3620100	3629100	but he decided to profess the virtues of hard labor and creativity.
3629100	3633100	He said, I never had a job that I felt above.
3633100	3636100	I've swept floors, I've done this, I've done that,
3636100	3638100	and I never felt like I was above my job.
3638100	3640100	I just worked hard and tried to get a better job.
3640100	3648100	It's not very subversive, but I guess it's better than everyone dreams
3648100	3651100	so you can have a limo too.
3651100	3655100	But then the nicer thing was that he really espoused the virtues
3655100	3658100	of being a proactive, creative thinker.
3658100	3663100	He said, don't live within the world that you're going into.
3663100	3666100	Look at it as a thing that needs to be expanded and built upon.
3666100	3669100	Go to the moon, Dan Harmon, he said.
3670100	3677100	So when you're at home and your jammy's watching the Teen Choice Awards...
3677100	3680100	I'm like, wait a minute, there's no teens on here.
3682100	3685100	Back to 4chan.
3685100	3688100	I misinterpreted the title of this thing entirely.
3688100	3691100	This is a bunch of old guys accepting awards.
3695100	3697100	Choice Teen.
3698100	3700100	But anyways, Ashton Kutcher.
3700100	3701100	Yeah, his name's not Ashton.
3701100	3703100	And he's going to be playing Steve Jobs,
3703100	3708100	who I just found out years after he died was an interesting guy.
3708100	3710100	It was right under my nose that he was.
3710100	3712100	I've been using all his products.
3712100	3715100	Calling Spencer at work.
3715100	3719100	Just to tell him that there's a camera in it.
3719100	3721100	All right, let's do this.
3721100	3724100	No, so no people then.
3724100	3726100	So you want people up there?
3726100	3728100	No, I'm just clarifying.
3728100	3730100	Seems like he wants people.
3730100	3733100	Which should we base our Who We Bring Up on?
3733100	3735100	I know the subreddit, the Harmontown subreddit,
3735100	3740100	was very enthralled with young Tyler last week.
3740100	3742100	Is it a meritocracy?
3742100	3745100	Does he just earn another chance at the wheel?
3745100	3747100	I think he earned it.
3747100	3749100	Maybe we bring Spencer up.
3749100	3750100	Sorry, sorry, not Spencer.
3750100	3753100	We bring Tyler up and we bring maybe someone new up.
3754100	3756100	How about Lisette?
3756100	3757100	Tyler and Lisette.
3757100	3759100	Which Lisette would you like to play?
3759100	3760100	Sure.
3760100	3761100	Okay.
3767100	3769100	Hi, how are you?
3769100	3771100	Spencer, just to make things different,
3771100	3775100	when you read the description that catches up to date,
3775100	3777100	can we do it to the song?
3777100	3778100	Can we?
3778100	3780100	Yeah, sure, why not?
3780100	3783100	I'm going to start it from the top.
3783100	3785100	I should hope so.
3785100	3789100	The character shoots are being dispensered.
3789100	3792100	Ha, ha, ha.
3792100	3794100	Thank you, Tyler.
3794100	3796100	There's like three name puns that exist for me
3796100	3798100	and I've heard them all.
3798100	3799100	What are the other two?
3799100	3801100	Yeah, that's a great idea.
3806100	3807100	I'm not going to abuse that power,
3807100	3809100	I just want to know what the other two are.
3809100	3811100	No one that will ever hear this interacts with me
3811100	3813100	on any level or medium.
3813100	3817100	Would you rather simply arm us and be done with it
3817100	3820100	or sit through the next ten minute brainstorming session?
3821100	3824100	Because the dispenser is killing me.
3826100	3827100	Two out of three.
3827100	3828100	Two out of three?
3828100	3830100	Sounds like dispensership.
3830100	3832100	That's the third.
3832100	3835100	No, that's the dispensership?
3835100	3837100	Well, you already did dispenser.
3837100	3839100	He was doing censorship.
3839100	3842100	Yeah, no, that's not.
3842100	3844100	I'm done.
3844100	3847100	Yeah, it sounds like you had it really bad.
3847100	3852100	My last name rhymed with the lead selling toilet paper.
3854100	3856100	There was commercials all over the...
3856100	3857100	Did anyone literally call you?
3857100	3858100	What's up, Sherman Harmon?
3858100	3859100	Don't squeeze the Harmon?
3859100	3862100	Are you fucking kidding me?
3862100	3863100	Every day.
3863100	3865100	You guys are too young to remember.
3865100	3867100	There was this guy, Mr. Whipple.
3867100	3870100	Apparently, people loved wiping their ass in the 70s.
3870100	3871100	You don't see a lot of...
3871100	3874100	There's that cartoon bear now, which I think is interesting
3874100	3876100	because they're like, oh shit, our toilet paper is so good,
3876100	3877100	a bear could wipe his ass.
3877100	3879100	Is that weird that people latch onto pop culture references
3879100	3880100	just to make fun of you?
3880100	3883100	I'm Tyler, and then on the late end of high school
3883100	3884100	when Fight Club was going to be like,
3884100	3885100	oh, what's up, Tyler Durden?
3885100	3888100	I'm like, I'm not insulted?
3888100	3891100	Yeah, that's just future Verizon employees
3891100	3894100	just exercising their muscles.
3894100	3897100	Little muscle in the back of their spine.
3897100	3898100	Lizette, did you get teased?
3898100	3899100	Did your name rhyme with anything funny?
3899100	3902100	Or is there a Lizette tease?
3902100	3903100	I got teased in high school
3903100	3905100	because I was really tall and skinny
3905100	3908100	and I had perfect skin and really nice hair.
3908100	3911100	She is very beautiful, for the record.
3911100	3913100	But the reason I would...
3913100	3915100	I was about to tease you for the same reasons.
3915100	3916100	I looked...
3916100	3918100	What's up, flawless skin.
3918100	3919100	She's so pretty.
3919100	3920100	I looked relatively normal,
3920100	3922100	but the second I opened my mouth,
3922100	3923100	it was like, oh, she's a dork.
3923100	3924100	Never mind.
3924100	3926100	She looks okay, but she's pretty nerdy.
3926100	3929100	So, yeah, I got made fun of numerous times.
3929100	3930100	Numerous.
3930100	3931100	Yeah.
3931100	3934100	The worst one I ever heard was by this girl, Leah.
3934100	3937100	I don't know if it was JD's wife or...
3937100	3941100	I was having this conversation with a woman named Leah,
3941100	3944100	and we were talking about,
3944100	3946100	well, what was the horrible thing
3946100	3947100	that they said about you on the playground?
3947100	3949100	And she was like, man, I had the worst.
3949100	3950100	And I thought of her name, and I was like,
3950100	3951100	what, Princess Leah?
3951100	3952100	Or what?
3952100	3955100	She was like, leotard.
3956100	3958100	They called her leotard.
3958100	3959100	The first thing that came to mind was like,
3959100	3960100	diarrhea.
3960100	3961100	Diarrhea.
3961100	3962100	Oh, God.
3962100	3963100	That's why I know.
3963100	3964100	Diarrhea.
3964100	3968100	Such a pretty name, and then so maligned.
3968100	3970100	Yeah, if you want to name a kid a name
3970100	3972100	that cannot be teased, Jeff Davis.
3972100	3975100	Nothing funny rhymes with it.
