start	end	text
1497520	1502640	uh, the landscape that is the harm and ton audience. So we are going to play a game called
1502640	1512560	the Beef Fungus Bill Game. I, I, I, I, when you brought him up, I was reminded that he made,
1513600	1519600	you know, that he made, and we never, he made a, uh, iPad stand. Bill, obviously also he makes
1519600	1526160	this wood stuff. He made, he made quotes on little wood, uh, slats for us. Harmontown quotes,
1526160	1530800	by the way, Bill remember the quote that we thought was erroneous or whatever that said,
1530800	1536480	it wasn't somebody, I said whatever was on there that, that season two, I mean,
1536480	1540960	it was written on anus or something. Yeah. For some reason I said that, uh, probably
1540960	1545360	because I was on something else and then the Pittsburgh, but, and then also he made a dungeon
1545360	1555920	master iPad stand for, for, uh, Spencer to Dan, Dan Goldberg. What? All right. So, so Bill,
1555920	1562560	Bill is, we are, we are aware. There's more than one prototype. Uh, we are aware of Bill and Bill
1562560	1567440	is part of, uh, Harmontown, but what do we really know about Bill, you guys? I just said it all.
1568640	1574320	Right. Exactly. That's all we know. So, uh, so earlier today, Bill sent me some true facts about
1574320	1578560	himself. Oh, nice. All right. So, uh, thank you, Bill. You can go ahead and sit down. I don't
1578560	1583040	know what your face delay affects the judging, but thank you. Let's give him a really big hand.
1583760	1590560	Now, sweetie, can I ask you when Bill sent you, uh, this email with all these true facts about
1590560	1600000	himself, was that solicited or is this another situation? Oh, that's so flattering. I would be
1600000	1605280	flattered. Uh, no, it was not a situation. That was a really weird way for me to react to that.
1605280	1607600	Some guy sending you an email with a bunch of facts about himself.
1608160	1616000	I solicited. You just happened before to you. Uh, well, look at her, bro. That's very nice.
1616000	1622240	That's very nice. Happens all the time. Avoiding the question. All right. She does a podcast where
1622240	1626560	she says, Hey, I care about you. I'm Aaron McGathey. I'm your best friend. I care about
1626560	1631840	your relationships. Here's all about mine. And you know, it invites its fair share of
1631920	1639360	intimacy from strangers. I wish that it came in the, in the, in the form of just facts about
1642640	1647360	that would be, that would be fun. Um, all right. So we're going to go ahead and play this game.
1647920	1652720	There are, we have 10 questions. I'm sorry, sweetie. Can we get Rob a cup? I don't want a
1652720	1657840	cup. No, we can get you a cup. Hold on. No, no, no, no, no. I don't want to keep going with your
1657840	1662240	game thing. They're getting there. I saw the scramble in the back. No, no, I'm sorry. I'm not
1662240	1667200	going to interrupt anymore. I'm, I'm terribly. So have a drink Rob, but we're going to get you
1667200	1670880	a cup and you can say you can have a drink. Okay. The explanation of this game is very,
1670880	1677360	very brief. So I'm going to explain it very briefly. I have 10 questions. Uh, one in every,
1677360	1682320	every question is a, includes a true fact about bill. The other things are not true.
1683120	1687920	The three of you are going to individually, you're on your own team. You were going to decide,
1688560	1695280	what is the true bill fact? And you are allowed to discuss it with each other,
1695280	1700400	discuss it with yourself. Explain why you, uh, discuss it with yourself. Um,
1701440	1705680	decide, explain why you feel that way. So let's go, let's go ahead and, uh, let's get started.
1705680	1706880	All right. One of these is true.
1706880	1712480	We're picking the one that's true. You're picking the one that's true.
1712480	1719120	Who goes first? Uh, we'll go, we'll start. We'll do it, uh, counterclockwise and we'll start with
1719120	1727920	Spencer. I know. I just threw it out there. We'll start, we'll start with Spencer and we'll go
1727920	1733360	Spencer, Dan, Rob, as far as like who gets to, uh, give their final answer first. All right.
1733360	1741280	Question number one. Uh, one of these is real. The other two are fake. Bill spells his name
1741280	1750240	with one L because, and these are, these are quotes. A, it's my own little pretentious contrivance.
1750240	1757440	In honor of Sesame Street, two L's seems like a waste. B, it's my own little pretentious contrivance.
1757440	1761920	My father was a two L'd bill who earned both. I leave it to you to decide what that means.
1763520	1767440	C, it's my own little pretentious contrivance. I enjoy correcting people.
1770480	1775600	When I, so it's me, right? Yeah, but you guys can discuss, uh, what you. Can we have some,
1775600	1782720	can we have some thought music? Um, you can, uh, keep going. I'm not the best, uh,
1782720	1787360	DJ, but no, you can. I mean, it might be a cow farting, but I'll find something. Okay. I thought
1787360	1792800	it'd be like, I don't know. Okay. I mean, when you hear the first one, you're like,
1792800	1796880	this sounds like the real one. It sounds like it's trying to be clever, but all of them sounded
1796880	1803200	like that. I know which one it is. Oh, do you know? I mean, I, I mean, I think I know.
1803200	1807600	Tell me which one you think it is. Well, I should, is the point to, for, to, for him to.
1807600	1814160	Well, I want to win. Well, you guys have a minute of discussing it out loud and making your points
1814160	1819440	and then you'll give your final answers. Okay. What's your thing? But if I share my reasoning,
1819440	1823200	then they get to piggyback on my intuition. You're right. You're right. You're right. Okay.
1823200	1827760	So we'll go down the line. Spencer. I want a final answer from this guy before I swoop in
1827760	1833440	and snatch it up. You're totally right. I want to hear what Dan has to say. Okay. But Spencer,
1833440	1838720	in this round, you go first. So you decide. Okay. That makes sense. Um, I'd like to pick a,
1838720	1845840	because I mean, that sounds right. The Sesame street. It's my honor. They value letter economy,
1845840	1851280	right? Okay. I don't understand the Sesame street reference. They value letter economy.
1852000	1856800	They do. Well, letters are very important. Well, letters are their sponsor. They can't just have
1856800	1866480	two. I still don't get the connection to Sesame street though. I understand letters are on the
1866480	1877440	show. I don't understand why I don't remember. I mean, I've seen them all and I don't remember
1877440	1882080	somebody coming out to never put a two rows next to each other. I don't think they did. I think
1882080	1889040	they just imparted the value of an L to you to the extent that, uh, that, that don't buy it. Yeah.
1889040	1891840	Anyways, I'm going to go, I'm going to go with B and I'll tell you why.
1892800	1899120	To the dad one, two L bills. That's the dad one. My dad, two Ls, whatever. I've met a lot of
1899120	1904400	fellas who use their middle name as their first name because, uh, uh, people who spell their first
1904400	1908000	name differently, et cetera, it always has to do with a fucked up relationship with their dad.
1909600	1916240	And we'll go with that. All right, Rob, I'm going to take a C, um, because that's the only one I
1916240	1926000	remembered. I enjoy correcting people. Yes. Yes. That's exactly the one. The correct answer is A,
1926000	1935280	the Sesame Street answer. That's not fair. He went first. Well, some would argue he's in the world.
1935280	1939440	Everyone would argue he's in the worst position in this round. Dan will guess first and then Rob
1939440	1948240	and then Spencer. Question number two. Question number two. A, I won a Philo T Farnsworth award
1948240	1954720	for video art. B, I won a Philo teen Farnsworth award for my work with children's hospitals.
1955520	1961360	C, I won a Philo teen Farnsworth award for urban planning. Why do you keep saying teen?
1961360	1968000	Huh? T. T. Sorry. Philo teen Farnsworth. It's like a new Nickelodeon cartoon.
1968880	1973360	Uh, I will go with A because Philo T Farnsworth invented television.
1973360	1977200	Okay. I think we're learning about how much I know about Philo T Farnsworth.
1979040	1986400	Sorry. Okay. Uh, go ahead, Rob. Uh, I don't know who this Philo guy is, but, uh, Bill,
1987200	1994480	it seems like a kind of a video person. I'm also going to go with A, but I thought of that before
1994480	1999840	Harmon said anything. And I would have got that first one if I had some music to think.
2002800	2010800	Kind of, are you running here? I'm sorry. I'm going to go with, uh, I'm going to go with, uh,
2010800	2017120	A because I had a good reason for it. All right. That is correct.
2018960	2021680	We all win. We're all tied up.
2021680	2025920	Philo T Farnsworth was reportedly, I don't know if it's urban legend, supposedly was
2025920	2031680	thought of the idea for television while mowing his lawn, noticed that the, the rows and columns
2031680	2036560	of, uh, the different squares, like, uh, looked at them and kind of came up with the idea of what
2036640	2043760	we would one day call pixels. Right. And the T is where we get TV from.
2044400	2048320	That's correct. That is correct. The T was taken from his name.
2048880	2050560	Philo TV Farnsworth.
2054720	2059840	The weird thing is the T stands for toilet. His dad always wanted him to, to invent the toilet.
2059840	2065280	Fuck that. Philo, I didn't know you could name your kid after something you used to make
2065280	2069520	necklaces with. All right. Number three, you can name your kid after everything.
2072800	2077600	Or anything, but you can't name him a number. If somebody tried to name their kid a number
2077600	2082480	in like Europe somewhere and then another cyborg, someone else tried to name their kid
2082480	2089280	Adolf Hitler or something, which somebody tried to name their kid, uh, God. And they
2089280	2094320	didn't let that happen. No, no. The judge said, no, that's just for that's that name is for the
2094320	2101520	creator. It was totally that's fucked up. The Hitler thing. I mean, come on, you can't
2101520	2108960	fight city hall, but, uh, I mean the God thing, whatever. Question number three, and this, uh,
2108960	2113200	Rob, you will answer this first. I promise there will be thinking music. Good question. Number
2113200	2119280	three. When I was in grade school, I won two gold and several silver medals. Sorry. When I was in
2119280	2127840	grade school, I won two gold and several silver medals for a science B singing C shot put. What
2127840	2137120	was the second one? Singing, singing. Oh, a science B singing C shot put.
2140720	2144400	Waiting. Who's giving medals to grade schoolers?
2144640	2153360	I just love, love that he specified several silver medals. Several. They kind of, that kind of means
2153360	2161200	a gold. Yep. That kind of specificity only comes from somebody who is interested in science only.
2161200	2168240	All right. Science. However, the music helped. I'd like to, uh, point out that the score was
2168240	2174000	erroneously reported as tied earlier. No, no, I typed. I took it back right away. I said, no,
2174000	2180400	no, it's not. You have two and the other. And, uh, just settle down. The game's not over yet,
2180400	2185840	man. You're totally right. I said it. I took it back. Just settle down. Just clarifying for
2185840	2193360	the podcast. Don't worry. It is not tied. Spencer is two. Dan has one. Rob has one. Now, now Bill
2193360	2202240	seems like the type who can, uh, put a shot. All right. That's the whole shot putting. Okay.
2202880	2208240	All right. Spencer's answer is shot put. Dan. I, I'm, I'm, I, my instinct is to go away from
2208240	2213840	science because it feels obvious because he's, he's a harm in town, uh, attendee and he makes
2213840	2220480	things. And, uh, and so it would be weirder for him to be a good singer or a shot putter.
2220480	2224560	If you're in grade school, I mean, that doesn't have any bearing on what you become just because
2224560	2230560	he doesn't look like Jesse Ventura. Now doesn't mean he wasn't the, the ace shot putter of his
2230560	2235680	grade school. I mean, what did it take back then? You have to shoot a heavy ball further than a bunch
2235680	2243760	of fourth graders, you know, and you could have been good at anything. The question is what you
2243760	2255280	think of the word shot put as a comedic third. And I feel like the answer is yes. There wasn't a,
2255280	2259680	there wasn't a comedy one in there and there wasn't, there wasn't one with a zing. That's the,
2259680	2265840	that's the zingy one. I think that was written by a singer. So I'm going to go with singing.
2265840	2267200	That is correct. Yeah.
2272080	2274560	Well done. The score is now. This game sucks.
2276400	2280400	The score is Spencer two, Dan two, Rob one. Fuck off.
2282240	2288000	All right. Uh, Spencer will start, uh, the, the answering in this round. I hate games.
2288000	2292560	I can't believe you brought me up for the game, man. After this, we're gonna play D&D. So get
2292560	2299120	ready. That's a different kind. You can't lose at that. Oh, you can. We've been doing it for months.
2302880	2310960	Question number four. I always lose. All right, go ahead. Bill was in marching band. Really?
2310960	2319440	He played one of these three instruments hurt strings.
2319440	2336080	A drum, B oboe, C alto sacks. A drum, B oboe, C alto sacks.
2340720	2344000	Who's first? Spencer is first. I just, yeah, oboe.
2344000	2350160	What's your reasoning? Because this is a bad question. I'm really arbitrary.
2350160	2355600	I just really wanted to say oboe. All right. Oboe. It's fun.
2355600	2360080	I don't think it's arbitrary at all. I think that Bill is clearly a sax man because he
2360720	2366240	looked at the marching band as an opportunity to, yeah, it's, it's a sexy instrument. It's a Bill
2366240	2372560	Clinton instrument. He wanted to, he saw himself sitting in the, in the window. He's like, man,
2372560	2379840	I have all this aptitude for science and music, but I'm never going to be, uh, like, uh, Motley
2379840	2389840	Crew. Cause I just, I also value the rule of law. All right. So, so what instrument, what instrument
2389840	2394800	gets pussy without breaking the law? The answer is sex. I know, I know, I know. I know what you're
2394800	2400320	going to say. I know. Let them, let them all answer and I'll throw out a fact and then they can
2400400	2405760	revise their answer. Oh shit. Please. I love you. This is why I didn't want you out of shape.
2409680	2412800	We'll bring you up for a follow-up. So, so if you would like a notepad or something,
2412800	2416640	so you can remember these. Okay. That sounded me or no, it doesn't. I'm in my head.
2420960	2427200	Sorry. Okay. Uh, so, so, uh, you were going with, uh, sacks, sexy sacks, which is like
2427200	2432320	making out with somebody. Yeah. Yeah. Especially when you're silhouetted in a window on an 80s
2432320	2452400	set. Yes. Dan, would you, would you do that as, as Rob's thinking music?
2452400	2461600	He just did, he just did. Okay. He just did. Bill with 1L, uh, you seem to me as somebody who
2461600	2475600	when you were younger had longer hair. Drummer. That is correct.
2476640	2480080	You know what? I didn't, it didn't occur to me. Drums are pretty sexy too. I was just picturing
2480080	2485120	the marching band drum, the one that's just tethered to your torso and you like an energizer
2485120	2491920	bunny. Uh, all right. But it's marching band. You played a drum. Never, nevermind. No, you were,
2492960	2499920	you were pretty good, right? Yeah. Come on. All right. He was specifically fifth bass drum.
2500800	2505280	So I don't know. Does that mean fifth chair or is that a specific? Oh, the biggest bass drum.
2505280	2514000	The biggest one, Aaron. All right. Question. Question number five. I was last chair trumpet
2518400	2520000	in a three way with Vince Vaughn.
2522400	2527600	It's not even a musical term. It's just before I came here. All right. This,
2527760	2536240	this question includes four quotes. This is a four option answer. And we're going to start
2536240	2544160	with Dan in the answering. A I've had migraines since I was 16. B I've had parakeets since I was
2544160	2551360	16. C I've had arthritis since I was 16. D I've had lizards since I was 16.
2557600	2562960	Oh, you're so proud of yourself for creating perfectly equidistant possibilities.
2566800	2571360	Only one of those is true. Yeah. Lizards, parakeets, arthritis, or migraines. Yep.
2572080	2577680	God, did you say this was a lightning round? No, no, no, no. Okay. We have four
2577680	2581840	choices as opposed to the molasses round.
2581840	2589200	Oh, God damn it. Okay. Parakeets, too, too, too contained. He would look at them.
2591120	2597360	The throbbing heart of a freeman beats in Bill's chest. That's why he works with wood and beef.
2601440	2603840	Lizards, there's the science angle. Oh, it's,
2603840	2607920	lizards are supposed to be gross, but I'm a scientist. I value them because I'm scientific.
2608480	2616160	Migrants and arthritis. Arthritis, he wouldn't do all that handiwork. Migrants.
2617280	2623760	All right. Rob? Lizards. For the same reasons that Dan said.
2626080	2630880	Spencer? I don't want to live in a world where Bill had parakeets.
2638640	2644240	He goes home at night, tells him about how, how did, how did Harbontown go tonight? Professor
2644800	2652720	Feathers? Professor Feathers! Because he's an expert. Yeah. What happened to you in that line, man?
2654720	2659760	What? Oh, man, after that line, I went to Roscoe's Chicken and Waffles,
2660480	2666080	and I was texting on my cell phone. And the way I was texting, I don't know, but like,
2666080	2670880	it was like, it lined up some pathways in my brain. And I felt like I was a living God for
2670880	2677200	that moment. Like, like high on all the drugs that your brain makes itself. Like, I was just like,
2678320	2683920	like, I could just like pass through the walls. So are you saying lizards? Shoot laser beams.
2686240	2692320	Just because of sleep deformation? A combination of that and success. And I'm sure, you know,
2692320	2698240	probably, who knows? I'm just, what I'm trying to say is that if Bill actually did have parakeets,
2698240	2706240	then our relationship will fundamentally change from here on out. I'm gonna, I'm gonna pick migraines
2706240	2711280	because I feel like I got migraines around that age. And that seems like something that crops up
2711280	2718480	at 16. Around Bill's age? Oh, at 16, he said. Well, Spencer is correct. And Dan. It is. And Dan,
2718560	2723760	sorry, Spencer. I didn't know correct. It was migraines migraines. The score is Spencer three,
2723760	2728320	Dan three. We know, we know, we know, we know what the score is.
2731840	2732800	What's Rob's score?
2736000	2741040	Rob Rob is in last place with two. Shut up. I was just trying to play. Yeah. Number six.
2742400	2747280	Three, three quotes. I have been bungee jumping. I've been skydiving. I've been out. I have not
2747280	2754960	been on an airplane. A, I have been bungee jumping. B, I have been skydiving. C, I have not
2754960	2760000	been on an airplane. We were going to start with this Rob. We were going to start with Rob.
2762720	2763200	Music.
2763200	2775040	Okay. I don't know how to do this. Okay. The music's fucking with me. Okay, get rid of it.
2779040	2781920	Bungee jumping, skydiving. Never been on a plane.
2781920	2788000	Skydiving. All right, Spencer. I'm gonna, I'm gonna pick skydiving. Okay, Dan.
2788000	2793600	Am I the only one? If C is correct, then B can't be. If he was never on a plane, he could,
2796880	2800480	unless you pulled a bungee cord really tight and flew him into the air,
2801360	2804320	I don't think he could ever skydive without having been on a plane.
2804320	2807680	Yeah, if B was right, then C couldn't be. I mean.
2807680	2810960	And since B and C have a relationship with each other, then I'm going to go with A,
2810960	2815360	he's been bungee jumping. Okay. The correct answer is B, skydiving.
2818000	2826480	Spencer and Lee, Dan and Rob are tied. Question number, question number seven.
2827520	2830800	This is the ice cream question. We get ice cream.
2832560	2838480	All the ice cream you want. I once won a year supply of ice cream and I always chose bubblegum
2838480	2850640	because A, it's a dessert and an activity. B, I actually thought it was cotton candy flavored.
2851680	2859360	C, I knew my dad wouldn't eat it. A, it's a dessert and an activity. B, I actually thought
2859360	2863040	it was cotton candy flavored. C, I knew my dad wouldn't eat it.
2863920	2865920	D, I make poor life decisions.
2874400	2875440	Who's going first?
2875440	2879600	Who's going this round? Who starts this round? Spencer. Spencer, it's you.
2879600	2881680	I'm going to go with B for whatever reason.
2882720	2885040	You thought it, he actually thought it was cotton candy flavored.
2885040	2885440	Sure.
2885440	2886400	Okay, Dan.
2886400	2889760	I'll go with C because of my continuing fixation on fathers.
2889760	2891520	All right.
2891520	2893680	I'm going to go with A because it is true.
2897200	2904240	It's a dessert and an activity. The correct answer is C, I knew my dad wouldn't eat it.
2904240	2909840	That brings Rob back to last place. Spencer and Dan tied for first.
2911680	2916400	All right, here we go. A, I have a, sorry?
2916400	2918480	No, I was cursing this game.
2919920	2924880	A, I have a bunch of magnets on my fridge. B, I have two sewing kits.
2926080	2933760	C, I have 455 Pez dispensers. A, I have a bunch of magnets on my fridge.
2933760	2941120	B, I have two sewing kits. C, I have 455 Pez dispensers. We're going to start with Dan.
2941120	2947840	Fuck. Okay. I keep going to, you asked him to email a bunch of facts about himself.
2947840	2951440	So he might have, during a falter, might have gone, I don't know,
2951440	2955760	I have a bunch of magnets on my fridge. What else? Like maybe.
2956960	2961760	Because that 455 Pez dispensers thing, that seems like a make them up.
2962960	2964480	And the, what's the other one?
2965680	2966480	Two sewing kits.
2966480	2969520	Two sewing kits. That's pretty specific.
2971360	2973040	I'm going to go with sewing kits.
2973760	2974880	Okay. Rob?
2974880	2978240	I'm also going to go with sewing kits, but I thought of it before Dan said anything.
2979280	2982480	Because he works with his hands and stuff.
2982480	2984400	Yeah. You did a really good job.
2986880	2987680	Spencer?
2987680	2989600	Thank you. That's all I wanted tonight.
2991360	2994720	I'm going to go with sewing kits because that's the lowest stakes for me.
2996480	3000320	So it doesn't matter what the answer is. This is not important to you.
3000320	3000720	It is.
3000720	3003440	It's just so important to me. You don't care.
3003440	3004800	I'm playing it like a game.
3004800	3005760	And you're winning.
3005760	3006320	Yeah. That's why.
3006320	3010640	The correct answer is I have a bunch of magnets on my fridge is the correct answer.
3010640	3012000	All right. Moving on. We're almost done.
3012000	3012480	Stupid.
3015280	3016240	Second to last question.
3016240	3017440	I love this game, Erin.
3019520	3020400	Thanks, Spencer.
3020400	3021920	Yeah. Balanced viewpoints.
3021920	3024640	Are you starting to rethink your position on Dungeons and Dragons?
3024640	3025840	Do you think this is a better game?
3028000	3032480	I'm definitely considering how to work audience member trivia into my encounters.
3034000	3037440	I'm wondering if there could be a whole convention for this.
3039280	3039840	I'm sure.
3040720	3042320	All right. Question number nine.
3042320	3044080	I was in the talent show in the fifth grade.
3044640	3045360	And I sang.
3046240	3048720	A. Don't rain on my parade.
3050080	3050240	B.
3051120	3051920	Dad, don't hit me.
3054560	3055840	An original piece by.
3058240	3060000	B. Fiddler on the roof.
3060960	3062880	C. Luck be a lady.
3063200	3063920	That's a good one.
3064640	3066240	A. Don't rain on my parade.
3066240	3067680	B. Fiddler on the roof.
3067680	3069680	C. Luck be a lady.
3069680	3071520	What's don't rain on my parade?
3071520	3072160	I don't know what that is.
3073360	3074960	Don't tell me not to fight.
3075680	3076880	It's from Funny Girl.
3076880	3077600	It's from what?
3077600	3078640	It's from Funny Girl.
3078640	3079120	Okay.
3079120	3080560	It's a Barbara Streisand song.
3080560	3082000	Okay. So you put that one in there.
3082000	3082000	
3088400	3091760	But all of these songs are very popular songs.
3092880	3098160	I'm going to live out.
3099600	3100400	I'm not going to do it.
3100400	3101680	But I would like to hear.
3101680	3104240	I would like to hear two bars of Fiddler on the roof.
3104240	3106720	Like a Fiddler on the roof.
3106720	3107920	I mean, it's not actually a song.
3111920	3116320	May the God bless and protect us.
3116320	3117360	So that's another made up one.
3121360	3121840	Who's going?
3122720	3124640	Oh, sorry. Rob is starting, correct?
3125440	3126160	Yes. Thank you.
3126160	3126720	Sorry.
3126720	3127280	Your game.
3130000	3132240	Let me say Fiddler on the roof is a classic.
3132240	3135200	But luck be a lady is a crowd pleaser.
3135200	3137040	So I'm going to say luck be a lady.
3137040	3137280	Okay.
3137280	3138480	That's a drummer's song.
3142560	3144000	They just did that at the Emmys tonight.
3145040	3146000	Luck be a lady?
3146000	3147040	They sure did.
3147040	3147440	Whoa.
3149520	3150560	How did you know that?
3150640	3152800	I was on while I was sleeping.
