start	end	text
2561780	2564780	But today, I was in Starbucks, and I was sitting there,
2564780	2568780	and I saw a girl with a nice butt,
2568780	2571780	and I just wanted to put my face in it.
2571780	2573780	And I confirmed to me right there, I'm not...
2573780	2577780	What gay guy wants to put his face in a girl's butt?
2577780	2578780	I did.
2578780	2579780	That just confirmed...
2579780	2580780	There's my 90%.
2580780	2582780	We didn't say that you were gay.
2582780	2583780	I am 10%.
2583780	2584780	I will stick with that figure.
2584780	2585780	I'm gonna put it at 48.
2585780	2586780	Are you?
2586780	2587780	I mean, 48.
2587780	2588780	48.
2588780	2589780	Is this a new segment?
2589780	2591780	It's like guessing someone's weight.
2591780	2594780	Are you gonna work at a carnival and just...
2594780	2597780	Dan's only at 22.
2597780	2599780	Okay.
2600780	2603780	The percentage thing raises interesting questions,
2603780	2604780	because how do you go...
2604780	2608780	Because it all has to do with the amount of repression
2608780	2610780	in the society that you're in the context of,
2610780	2614780	because if you're in a society that, for instance,
2614780	2618780	views sexual preference as a binary dichotomy,
2618780	2624780	then that puts a lot of significance on the difference between 49% and 50%,
2624780	2628780	because I'm assuming, just being sort of a computer programmer of old,
2629780	2632780	but if you're living in a genuinely...
2632780	2635780	If you're living in an open field after some kind of nuclear holocaust
2635780	2638780	and everyone's just running around in deerskin togas
2638780	2640780	and using bottle caps for money,
2640780	2644780	and there's no more magazine covers or search billboards
2644780	2646780	to kind of drive home anything,
2646780	2649780	then the difference between 20% and 30% is what?
2649780	2650780	I mean, we don't even...
2650780	2651780	Yeah.
2651780	2652780	I will definitely agree.
2652780	2656780	What in the world would be the meaning of 100% heterosexual?
2656780	2659780	I think whatever that would manifest itself as
2659780	2661780	would certainly appear, I would imagine,
2661780	2664780	to be less straight than what we consider straight.
2664780	2665780	We don't want...
2665780	2669780	Nobody likes anybody that's overtly masculine,
2669780	2671780	or we don't like people that are overtly feminine.
2671780	2672780	We don't like...
2672780	2674780	She's being such a girl right now,
2674780	2676780	or a guy who's being such a guy.
2676780	2679780	I'm a die-fucking-dude, chicken wings for the...
2679780	2680780	Yeah!
2680780	2681780	We don't like that, and we don't like,
2681780	2683780	Oh, my God, go to the mall shopping.
2683780	2684780	We don't like that either.
2684780	2685780	And so we also...
2685780	2686780	We don't like...
2686780	2687780	I mean...
2687780	2688780	I won't say we.
2688780	2689780	I'll say I.
2689780	2692780	When you meet a gay guy, let's say,
2692780	2695780	and he's really queeny, that wears you out pretty quickly.
2695780	2698780	It's like enough with the femininity thing.
2698780	2700780	Like temper that a little bit.
2700780	2702780	The more towards the middle you get,
2702780	2704780	the more complete of a person you become.
2704780	2705780	Sure.
2705780	2707780	We don't want to see a really butch lesbian...
2707780	2710780	Oh, I don't want to walk my dog about that.
2710780	2713780	How about be a woman, too, while you're being a man?
2713780	2715780	Like lean towards the middle.
2715780	2717780	And I would say towards all things.
2717780	2719780	Like see both sides of everything,
2719780	2723780	and kind of combine the beauty that is masculinity
2723780	2725780	and the beauty that is femininity.
2725780	2726780	Well, that's what I'm saying.
2726780	2727780	Look at the...
2727780	2730780	So I think nature goes in bell curves.
2730780	2731780	I think that's a...
2731780	2734780	I mean, that's probably pinning things in too much, too,
2734780	2736780	but that's an easier way to understand things.
2736780	2740780	That if a frog lays a thousand eggs,
2741780	2743780	then you're going to look at...
2743780	2748780	There's a bulge in the center of the survival eggs, you know?
2748780	2751780	And then there's fringe eggs that don't survive for one reason
2751780	2754780	and fringe eggs that don't survive for another reason.
2754780	2756780	Everything goes in a bell curve.
2756780	2758780	So IQs.
2758780	2762780	There's not a lot of incredibly stupid people.
2762780	2764780	There's a bunch of people in the middle
2764780	2766780	that are running everything.
2766780	2769780	And then there's not a lot of incredibly smart people
2769780	2772780	who are all here tonight.
2772780	2775780	But sexually, so sexually...
2775780	2777780	Give yourselves a round of applause.
2777780	2779780	If you think of sexuality as a bell curve,
2779780	2780780	then I would assume...
2780780	2785780	I think what you're saying, that 100% straight means
2785780	2787780	actually some kind of weird inside out,
2787780	2789780	weird thing where you're so straight, you're not even human.
2789780	2790780	Yeah.
2790780	2792780	Because the bell curve would probably be,
2792780	2794780	well, if I put my penis through a hole
2794780	2796780	and I don't know what's sucking it,
2796780	2798780	and then later I find out it was my friend Kevin,
2799780	2801780	in other words...
2801780	2802780	Like 2%.
2802780	2804780	That's an ass.
2804780	2806780	I imagine that those of us in the middle
2806780	2808780	are people whose sexuality doesn't define us
2808780	2812780	so much that it prevents us from doing other things.
2812780	2815780	The same way that an incredibly sober person
2815780	2818780	whose sobriety defines every conversation they have
2818780	2820780	is just as annoying as a fall-down drunk
2820780	2822780	who you can't trust to...
2822780	2824780	And there's nothing more fascist than a hippie.
2824780	2827780	Like a really hardcore hippie can be the most fascistic,
2827780	2830780	most dogmatic asshole you'll ever talk to.
2830780	2831780	Yeah.
2831780	2833780	Like temper it a little bit, like see both sides of it.
2833780	2835780	It's hilarious, like in NASCAR,
2835780	2837780	once in a while for breast cancer awareness,
2837780	2839780	they'll paint one car pink,
2839780	2841780	and there's people that are really bummed out about it.
2841780	2843780	It's like, I'm a pink car, goddamn!
2843780	2846780	Like, I'm not a man anymore.
2846780	2848780	I can't look at a pink car go in a circle.
2848780	2850780	Like, it's like, hey.
2850780	2853780	Hey, if you could like the color pink a little more,
2853780	2855780	you'd fuck your wife a little better
2855780	2856780	and fucking take it easy.
2857780	2858780	Yeah.
2858780	2861780	I wear polarized gray pants.
2861780	2863780	Every white car is pink.
2867780	2869780	You're back down to 10% again.
2869780	2871780	There you go, back down.
2871780	2873780	Are you sure you didn't wash your white car
2873780	2875780	with a pink bicycle?
2875780	2876780	Oh, shit, a red bicycle.
2876780	2877780	God damn it.
2877780	2878780	I fucked up.
2880780	2882780	You guys are talking about...
2882780	2883780	Feet?
2883780	2885780	No, the language is...
2887780	2889780	I'm with you on that, on language.
2889780	2891780	I want to go on a whole thing on that.
2891780	2893780	I mean, Jeff goes on these tears.
2893780	2896780	Like, he's a real H.L. Menken,
2896780	2898780	like, really thinks that everyone should be, you know,
2898780	2900780	going about talking like a steampunk person,
2900780	2902780	otherwise that means that we're regressing.
2902780	2904780	We should use our...
2904780	2907780	The English language is one of the most expansive vocabularies
2907780	2908780	of all time.
2908780	2910780	It's one of the biggest vocabularies I've ever made.
2910780	2911780	And we don't fucking use it.
2911780	2913780	I like to use it more.
2913780	2915780	I like to use it more.
2915780	2917780	Yeah, absolutely.
2917780	2919780	But I will...
2919780	2922780	So I think where I agree with Jeff
2922780	2926780	is that there's a danger in getting trained
2926780	2929780	by media and each other
2929780	2933780	that everything is either awesome or lame.
2933780	2936780	If there's no more words for different kinds of awesome,
2936780	2938780	like, yeah, you're getting trained
2938780	2940780	to choose between Pepsi and Coke.
2940780	2942780	They're fooling you into not realizing
2942780	2944780	that there's a difference between corn syrup and water.
2944780	2947780	So linguistically, we need to think outside the box.
2947780	2951780	But that is exactly why I bristle and freak out,
2951780	2954780	get very uncomfortable when people campaign
2954780	2956780	and parade and things in celebration
2956780	2959780	of just scrubbing out those couple little words.
2959780	2960780	Yeah.
2960780	2962780	Because it's like it doesn't...
2962780	2964780	You don't even see where that stops.
2964780	2965780	You just...
2965780	2966780	You think that...
2966780	2969780	When you don't make up words for a living,
2969780	2971780	like, maybe it's harder to see
2971780	2973780	how you can't just point at something
2973780	2974780	on the other side of the room and go,
2974780	2976780	I want that potted plant out of here.
2976780	2978780	Now the apartment's gonna be perfect.
2978780	2981780	You know, that's not how it works.
2981780	2983780	Like, you're free or you're not.
2983780	2987780	You come out of the womb with the freedom of speech.
2987780	2990780	The Constitution gets drafted up by some lawyers
2990780	2992780	and says you have freedom of speech.
2992780	2994780	Next thing that happens is,
2994780	2996780	unless you say fire in a crowded theater,
2996780	2997780	next thing that happens is,
2997780	2999780	unless you say this thing and that thing,
2999780	3002780	we can all agree that this would be a terrible thing to say.
3002780	3003780	Yes, okay.
3003780	3005780	All in favor of eliminating it?
3005780	3006780	Aye, aye, aye.
3006780	3007780	This...
3007780	3008780	Whatever, man.
3008780	3009780	This is why...
3009780	3010780	What a boring conversation.
3010780	3011780	It's not boring.
3011780	3012780	I'm right there with you, Dan.
3012780	3013780	It's the same thing.
3013780	3015780	We're talking about a binary idea
3015780	3016780	that there's good and there's bad.
3016780	3017780	There's Pepsi, there's Coke,
3017780	3018780	there's straight or there's gay.
3018780	3020780	I don't like non-lateral thinking.
3020780	3021780	But here's the thing.
3021780	3023780	Yeah, I also don't like people
3023780	3025780	that aren't verbal thinkers necessarily
3025780	3027780	who think that they shouldn't speak
3027780	3031780	because they don't have the same kind of word power.
3031780	3033780	You know, I don't like those people
3033780	3035780	feeling censored by smart people.
3035780	3037780	I don't like people being bullied
3037780	3039780	because they don't know how to use an apostrophe.
3039780	3044780	I don't think that someone who speaks great truths
3044780	3045780	is necessarily going to be
3045780	3047780	the most articulate person in the world.
3047780	3050780	I think that the use of seven words,
3050780	3051780	if there's only seven,
3051780	3054780	we can still create a revolution
3054780	3057780	and someone can use those seven words
3057780	3060780	in an order that's going to make everybody flip over.
3060780	3062780	There's a way to speak wrong so well
3062780	3064780	that you're amazing, like Yogi Berra.
3064780	3068780	If you go online and look up Yogi Berra quotes,
3068780	3070780	he malapropped all the time.
3070780	3073780	Malapropism is a Shakespeare character, malaprop.
3073780	3075780	He constantly said things wrong
3075780	3078780	and it was using the language perfectly.
3078780	3079780	And you can't tell at some point.
3079780	3082780	Did he say it wrong on purpose or by accident?
3082780	3084780	Because he said something really, really funny,
3084780	3086780	really, really, really good.
3086780	3088780	I was going to tie this in.
3088780	3091780	I played baseball at Arizona State, number one.
3091780	3092780	Played there, started.
3092780	3093780	What position?
3093780	3094780	I was a pitcher.
3094780	3095780	I could see you as a pitcher.
3095780	3096780	Thank you.
3096780	3097780	Thank you.
3097780	3099780	I think you're 10% catcher.
3099780	3101780	Okay, all right, all right.
3101780	3102780	Thanks a lot.
3102780	3103780	Good night, everybody.
3103780	3104780	No, come on, come on.
3104780	3114780	We might have the name of our episode, though.
3114780	3117780	Aren't we all 10% catcher in some way?
3117780	3125780	So I think some of that comes from being in that jock world,
3125780	3128780	not being in the artist world.
3128780	3134780	I definitely have those jock energy and experiences
3134780	3139780	and also my pre-comedy experiences to, you know,
3139780	3142780	that really kind of like I carry with me
3142780	3144780	and not necessarily in a good way.
3144780	3147780	And then sometimes I'll see myself on,
3147780	3149780	like I'm working on a project also
3149780	3152780	and I can go into like how we argue over words
3152780	3154780	and argue over comedy.
3154780	3155780	And then I think like who are you?
3155780	3157780	Where's your, you know,
3157780	3160780	I don't want to go into like specifics here,
3160780	3161780	but yeah, there's kind of debates
3161780	3164780	and I feel like I don't get that freedom.
3164780	3166780	That's one reason why I do podcasts,
3166780	3168780	because I get that freedom to talk
3168780	3171780	and maybe it's because I'm Jewish or I'm neurotic
3171780	3173780	or there's heart disease in my family.
3173780	3174780	I got to get it out.
3174780	3177780	And when I don't, and it really is hard
3177780	3180780	when it's your living or your own production
3180780	3184780	and it's your own, you know, introduction to America
3184780	3188780	and it's truly not you getting to do that.
3188780	3191780	So I'm dealing with that and I think it's all a combination
3191780	3193780	and a hybrid of everything.
3193780	3195780	You know, hopefully when I come out on either side,
3195780	3197780	I'll grow from it, but.
3197780	3198780	Yeah, I don't know you very well,
3198780	3199780	but like from what little I know,
3199780	3201780	like I'm just from hearing you tonight,
3201780	3203780	like you're revealing stuff about yourself,
3203780	3205780	but also you're hard on yourself about it.
3205780	3206780	Yeah, a little toward.
3206780	3208780	Like it's almost like you're, like not to overstate it,
3208780	3210780	like it's almost like you're kind of gay bashing yourself
3210780	3212780	about a gay experience.
3212780	3215780	Like you're saying, hey, I did this thing
3215780	3218780	and I'm not proud of it, but you're.
3218780	3221780	Well, I mean, growing up, I was called, oh, gay boy.
3221780	3224780	You're, I was a nice guy, a nice kid.
3224780	3227780	You know, now being nice, I think in Hollywood
3227780	3229780	or whatever we call this has helped me
3229780	3232780	because people want nice people around, you know,
3232780	3234780	and hustling and hard work, which I got, you know,
3234780	3236780	helped me in baseball.
3236780	3238780	But I think growing up, maybe in the Valley at the time,
3238780	3241780	going to public, going to public schools,
3241780	3243780	getting bust out to South Central,
3243780	3245780	maybe it made me tougher, I don't know,
3245780	3247780	and then playing baseball with like,
3247780	3250780	not necessarily a little bit of hazing and bowling.
3250780	3252780	It was kind of, yeah, like stuck with me.
3252780	3254780	And then when I started doing comedy, like,
3254780	3257780	ah, opened up a lot, but now when I see myself on TV,
3257780	3261780	sometimes I kind of see like, I would pick on myself.
3261780	3263780	Yeah, and I don't know what that is.
3263780	3264780	I don't know where that comes from.
3264780	3266780	Well, that's just your own self-loathing problem.
3266780	3267780	Yeah, well.
3267780	3269780	It's probably something that we don't all see,
3269780	3272780	that it's something that you trained yourself to.
3272780	3274780	But I've learned, I've learned, you know,
3274780	3277780	especially lately, like turn it into comedy,
3277780	3279780	turn it into something, use it as a positive.
3279780	3281780	And I get a lot of support from people.
3281780	3284780	Again, I'm older and, you know, Twitter and the internet
3284780	3286780	and all that stuff, like, it has helped me
3286780	3288780	and doing the podcast.
3288780	3290780	There's things like, you seem like a very soft,
3290780	3292780	like emotionally very soft guy,
3292780	3294780	but you exude a very, like your voice,
3294780	3297780	your posture is very like loud and like,
3297780	3301780	you seem very sportsy and very like macho and gruff,
3301780	3304780	but like you can still like, you can't totally hide the fact
3304780	3308780	that there's a softness to you, which is not gay.
3308780	3310780	It's just being soft.
3310780	3312780	And, you know, but that's a negative,
3312780	3314780	that's kind of a negative term in sports,
3314780	3315780	if you're labeled as soft.
3315780	3317780	Yeah, but we're not playing sports.
3317780	3318780	We're not playing sports.
3318780	3319780	So I'm okay with that.
3319780	3324780	And I am getting used to that.
3324780	3327780	And it's just, maybe it's some of those jock sensibilities in me
3327780	3330780	and the fact that I'm still around that world a little bit.
3330780	3332780	I'm around Major League Baseball.
3332780	3334780	You certainly take a major step by talking about
3334780	3336780	your lady boy experience in Thailand.
3336780	3337780	Well, you know, it is.
3337780	3339780	I'm getting it out there and it's also just other things.
3339780	3342780	Talking about it, owning it and, you know, again,
3342780	3345780	not being hard on myself and then, you know,
3345780	3347780	I don't want to, you just keep doing it.
3347780	3350780	And I think you just work through it and the fans and the,
3350780	3353780	it's like, I don't need therapy, to be honest with you.
3353780	3355780	And I do speak loud.
3355780	3357780	I mean, I am, and that's one thing I do kind of like,
3357780	3361780	I do the sensitivity because I am a nice guy and I'll put it out
3361780	3363780	and it's like, well, you're being loud, you're this.
3363780	3367780	And it's like, professionally, I have learned like how to do warmup
3367780	3371780	and I start off nice.
3371780	3372780	Okay, we're going to do this.
3372780	3373780	And then I crank it.
3373780	3375780	You know, I work at the midnight show with Chris Hardwick kind of thing.
3375780	3377780	It go in nice, nice, nice.
3377780	3378780	We don't want you to be quiet.
3378780	3379780	We want you to be loud.
3379780	3380780	You want it.
3380780	3382780	Yeah, because there's a little audience and that's the,
3382780	3384780	what I think about is like, all right, I'm doing a podcast.
3384780	3387780	I've had some experiences when I've done video podcasts
3387780	3390780	and like I've played completely to the camera
3390780	3393780	and then people in the podcast feel like, oh, it's too much.
3393780	3394780	And now I'm doing a live show.
3394780	3397780	I can play to the audience and I feel like maybe the podcast,
3397780	3398780	a lot of things going on.
3398780	3399780	But you know what?
3399780	3403780	I'm comfortable here with Dan, Jeff, Dustin and the.
3403780	3404780	What's the fear?
3404780	3405780	Okay.
3405780	3407780	What's the fear, Brody, that like, like, I'm sorry to cut you off.
3407780	3408780	That's okay.
3408780	3412780	I like what would be the big, we talked about this.
3412780	3416780	I think last time about the way we're perceived or a couple of shows ago
3416780	3420780	about we all exude something that we're not in control of that.
3420780	3425780	Like Dan wants to be perceived as a smart and also people come to him
3425780	3428780	and want, they want Dan to say that, that he's smart.
3428780	3431780	Like what's, what's, what do you want people to see you as?
3431780	3434780	Or what are you afraid that people see in you that you wish they didn't see?
3435780	3439780	Um, weird.
3439780	3440780	Weird how?
3440780	3443780	Just weird thinking about stuff that doesn't matter.
3443780	3445780	You know, like, I mean, that's a whole nother thing.
3445780	3446780	I was asking.
3446780	3448780	What's the fear of being perceived as weird?
3448780	3449780	I don't want to be.
3449780	3451780	It's like, so it's like a Pandora's box.
3451780	3452780	It's like you talk about it.
3452780	3454780	You bring attention to it.
3454780	3456780	It's like, you know, things that we notice.
3456780	3457780	I'm sure, you know, you're an actor.
3457780	3458780	You see yourself on TV.
3458780	3460780	Like some people can't watch themselves.
3460780	3462780	Johnny Depp doesn't watch his movies.
3462780	3464780	Jared Leto freaked out.
3464780	3466780	You know, I know that's there.
3466780	3468780	You know, that's normal, but it feels like it's a,
3468780	3470780	it affects me a little bit more.
3470780	3473780	Um, but you're, you're doing a comedy central show now, right?
3473780	3474780	Are you?
3474780	3475780	Yeah, I'm doing that.
3475780	3477780	And some of that has seen myself on that.
3477780	3479780	My fear, like that's all I was thinking about.
3479780	3483780	Like my fear regarding that would be one weird.
3483780	3486780	So that's kind of, I don't want people to think you're weird.
3486780	3490780	I don't mind it, but I don't want it to be a Pandora's box of weirdness.
3490780	3493780	If we could turn into a joke, you mean they're going to find out you're weird.
3493780	3494780	In what way?
3494780	3498780	Like what's what's like obsessive about my eyebrows weird about my hairline.
3498780	3499780	My mannerisms.
3499780	3501780	Do I think I'm gay?
3501780	3503780	Why do you even think you're, you know, that kind of stuff.
3503780	3504780	Okay.
3504780	3507780	And if you revealed all that, if you took off your hat and showed us your hair on your eyebrows,
3507780	3508780	I'll do that.
3508780	3509780	I'm bold.
3509780	3510780	I'm bold.
3510780	3512780	It doesn't bother me, but I just felt cooler doing this today.
3512780	3513780	Yeah.
3513780	3514780	And I was in Toronto.
3514780	3515780	Yeah.
3515780	3516780	It's off.
3516780	3517780	It's off.
3518780	3520780	Hiding behind some stuff.
3520780	3521780	The glasses kind of.
3521780	3522780	Believe me.
3522780	3523780	I hide behind a suit.
3523780	3525780	I hide behind a weird hairdo all the time.
3525780	3526780	Great hair.
3526780	3527780	Well, thank you.
3527780	3528780	But it's all an act.
3528780	3529780	It's all affectation.
3529780	3532780	I hide behind my aunt Rachel's beautiful pantyhose clad legs.
3537780	3539780	I just play with my matchbox cars.
3539780	3542780	Rolling them gently up and down her calves.
3542780	3544780	Is that where it comes from?
3544780	3546780	I feel like researching that stuff.
3546780	3547780	Did she have red hair?
3547780	3548780	Oh, I don't know.
3548780	3551780	I had an aunt that had red hair that married into the family.
3551780	3555780	No, I was into redheads since Nicole McHugh and kindergarten.
3555780	3557780	Who's Nicole McHugh?
3557780	3558780	Who wasn't she?
3559780	3566780	Nicole McHugh was the first girl that I ever felt hormones generated in my body about.
3566780	3570780	It was kindergarten and the teachers would call your name.
3570780	3574780	And then every time the teacher would call my name, she'd say,
3574780	3577780	Daniel Harmon, Nicole McHugh would go...
3579780	3582780	And then every time she'd say, Nicole McHugh, I'd go...
3583780	3585780	And we never spoke.
3586780	3587780	We never spoke to each other.
3587780	3589780	But she was my first lover.
3589780	3592780	Well, that's one of the most beautiful relationships I've ever heard of.
3592780	3595780	And she had copper, red, curly hair.
3597780	3600780	But so did Batgirl, so I don't know where it came from.
3601780	3605780	Because Batgirl was a huge... A cork got popped there sexually.
3606780	3607780	I would get so excited.
3607780	3609780	The opening credits of Batman.
3609780	3611780	My brother would be like...
3611780	3614780	My brother loved Batman and we would play Batman together.
3614780	3621780	We'd put ski caps and stuff on the banister to the basement and pretend it was the Bat-pole.
3621780	3623780	And get dressed up as Bat...
3623780	3625780	Get to the bottom of the stairs and go, I heard the Joker's broken out.
3625780	3626780	Let's go get him.
3627780	3629780	And we'd watch Batman together.
3629780	3632780	And then there was a title card in the Batman title sequence.
3633780	3636780	Because now being a producer, I guess I know that...
3636780	3639780	It must have meant that Von Craig was probably 6 of 13 or something.
3639780	3642780	Like she was recurring but not regular.
3642780	3646780	And so there was an opening title card that was either there or not there.
3646780	3651780	And it wasn't a picture of Batgirl, but it was always there when she was going to be in the episode, I would say.
3651780	3653780	And so and so was Batgirl.
3653780	3656780	And my body would just twitch.
3656780	3663780	Even though I was absolutely years and years away from generating any kind of fluid that would have anything to do with that.
3663780	3668780	I was just transfixed and I was so excited that Batgirl was going to be involved.
3668780	3673780	And that she would be flying around whipping her red wig around and kicking people.
3673780	3677780	And very often getting Batman...
3677780	3680780	There was a lot of nylon or spandex or whatever.
3680780	3682780	And a lot of bondage.
3682780	3683780	A lot of like...
3683780	3685780	Which I'm not a bondage guy.
3685780	3690780	But a lot of when I was a kid, it was a lot of like...
