start	end	text
0	22160	Hello one and all, welcome once again to those of you, the lucky few digging in live
22160	26780	here at Meltdown Comics in Hollywood and those listening around the world, the beautiful
26780	31780	planet Earth, Harman Town is now in session.
31780	44780	Please welcome to the stage, the mayor of Harman Town, Dan Harman.
44780	51780	Thank you, thank you.
52780	60780	This is buttoning my sweatshirt in front of my gut, it's pretty, it's fooling everybody,
60780	61780	right?
61780	62780	It's slimming.
62780	66780	If you cover something, you don't know it's there.
66780	69780	Are you saying you've put on a couple?
69780	71780	Yeah, definitely, definitely.
71780	75780	A lot of stress at work and a lot of seeking comfort.
75780	80780	You're on a diet and it's just like, that's its own thing, it's discipline and then any
80780	84780	excuse at work, you just go, well, if I'm staying here all night, then I'm going to
84780	88780	eat chicken and waffles because I deserve that and all that stuff.
88780	93780	I talked to Dino and he said that, Dino Stamatopoulos friend and writer on your show, he said that
93780	96780	you guys are ordering lots of gourmet food like every day.
96780	103780	We try, you know, Sony doesn't pay for coffee, they still pay for meals, so we really try
103780	105780	to shiv them.
106780	108780	What's the average?
108780	111780	Puffer fish again or whatever.
111780	113780	You having fugu?
113780	115780	Yeah.
115780	119780	Anyways, and every Friday is Wings Friday, I get hot wings for everybody.
119780	124780	That's actually out of pocket, I don't know why.
124780	130780	What a great opening to the show, just talking about being fat and eating.
130780	133780	There's some corrections in order.
133780	138780	Somebody tweeted me to let us know that the internet was developed for scientific purposes,
138780	140780	not military.
140780	144780	So I guess that's the one thing we got wrong last week.
144780	147780	The only thing we've ever gotten wrong.
147780	153780	For all of you history buffs using our show as some kind of archive or you aliens digging
153780	158780	this up and putting it into your factoids about earth, yeah, we don't know what we're
158780	159780	doing here.
159780	163780	We just drop into a pool and we reach for a laugh.
163780	167780	What's the difference between scientific pursuits and military?
167780	171780	Don't military people constantly think that they're being scientific?
171780	175780	I feel like any time anything beautiful is developed or invented, the military finds
175780	178780	an awesome way to turn out in the way to kill people.
178780	180780	And yet not the internet.
180780	182780	They couldn't figure it out.
182780	184780	Isn't that great?
184780	186780	They can kill you with the internet.
186780	189780	Well, now they can use it to enslave you.
189780	190780	Yeah.
190780	194780	But it's kind of beautiful that they didn't see it coming and figure out a way to roll
194780	199780	it out in a way that we enslaved ourselves with the internet.
199780	204780	Nobody pulled a sheet off of it and said, here's how it works and this is the only way
204780	205780	you can use it.
205780	208780	You have to have a six on your forehead in order to log into this level and you have
208780	209780	the orange clearance here.
209780	211780	It just kind of evolved organically.
211780	216780	And we found out something from the internet, which is that we all want to be idiots.
216780	221780	We don't want to topple the power structures.
221780	223780	We like Twinkies.
223780	225780	We like YouTube.
225780	229780	Yeah, it's willful surrender to control.
229780	234780	The book We by Sami Anton, people have read that before?
234780	235780	Yeah.
236780	238780	It's proto-sci-fi.
238780	243780	It's the only book written in the future and people very willfully submit to control.
243780	248780	When you have a society that's high on the hog, it's that whole bread and circuses thing,
248780	249780	right?
249780	252780	That's where the Coliseum comes from.
252780	256780	Just give us entertainment in exchange for all this power and wealth that we all have.
256780	262780	Like America, we're very self-loathing lately about our economy, but we still are not eating
262780	263780	our own feet.
264780	267780	There's still more food in the garbage than there is available.
267780	271780	And we need a lot of entertainment and stuff, a lot of distraction.
271780	275780	This show's kicked off on a very cheery note.
275780	277780	I think it bodes well.
277780	282780	Well, further from the corrections department, when we brought up Glenn, who brought the
282780	286780	Earthshine, he wrote us a very nice letter, gave us some more Earthshine.
286780	287780	I'm going to stay off of it.
287780	291780	And by Earthshine, for those of you who don't know, it's high-quality moonshine.
291780	295780	I'm certain that we're all going to jail for some kind of federal crime.
295780	300780	He typically uses it for his absinthe, but it's like an ingredient of his absinthe.
300780	303780	But her absinthe, that's what the correction is.
303780	304780	Wait, wait, wait.
304780	305780	What?
305780	306780	Yeah.
306780	308780	We have a lot of transgender Harmontown fans.
308780	309780	How many?
309780	311780	Three is a lot.
312780	315780	It's a very peculiar state to be transgender.
315780	316780	Three is a crowd.
316780	317780	Is Glenn here?
317780	321780	No, Glenn is not here, Glenn slash Jane, who he wanted to...
321780	325780	He said, she said, that when she came up...
325780	328780	I know what it's like to be dead.
333780	335780	I asked, what's your name?
335780	342780	And she blurted out, Glenn, force of habit, wanted to send a letter of, among other things,
342780	345780	saying, like, by the way, so that people don't get confused on the internet, where he is very
345780	354780	much out of the transgen closet and things, as Jane, spelled G-A-N-N-E, rhymes with plain.
354780	357780	That's the thing that kills me, Jane.
357780	362780	You're transgender, but not enough complexity for you.
362780	370780	Your name is Jane, spelled G-A-N-N-E, just in case, like, anybody got through the transgender gauntlet
370780	373780	without being alarmed or confused.
373780	375780	Did she or he...
375780	377780	How do I address he or her, he or she?
377780	383780	I think the whole idea is that they identify as a female, and so the pronoun you use is she.
383780	386780	Because Glenn could be a female name as well.
386780	393780	I suppose anything could be, but she has assumed a new angle of identity.
393780	394780	I don't know.
394780	395780	You can't even...
395780	397780	It's a new emergent thing.
397780	398780	It's exciting.
398780	399780	I'm actually very fired.
399780	402780	Why do our transgender fans come here in male attire?
402780	406780	Because they're not transvestites.
406780	408780	They are not necessarily...
408780	410780	I don't know anything about this.
410780	411780	I don't either.
411780	415780	What's funny is that half of the people, you brought Levi up, and he started talking about his thing,
415780	418780	and you could hear people in our LA audience going,
418780	426780	like, he's being close-minded about describing himself as transgender because he said he wanted to...
426780	430780	He is okay having a mustache because he doesn't have a uterus, and you could hear people go,
431780	434780	glass ceiling, or whatever.
434780	440780	He said something that wasn't the exact way that other people understand transgender to be.
440780	442780	Transgenderism, I don't even know what to call it.
442780	444780	But I am very flattered that...
444780	448780	Because I don't think you could get more fringe psychologically.
448780	450780	Is that politically incorrect to say?
450780	458780	I don't think you could be more complex on the inside of a human head compared to what's going on outside your body, in other words.
459780	468780	As far as somebody that you would look at in line at the bank and not be immediately presented with something that registered with you,
468780	474780	you couldn't have more noodles going on up there, more twists and turns,
474780	479780	more reasons to be distrustful of the people around you,
479780	487780	more suspicion, more fear that somebody might bully you for answering questions about yourself or expressing yourself.
487780	488780	And so I'm very, very flattered.
488780	494780	I take that as a barometer of our good work here and my good philosophy in religion,
494780	500780	and that any person in that situation would come...
500780	507780	Would listen to our podcast and feel comforted and feel comfortable, like, you know, expressing that.
507780	509780	I think that's...
509780	512780	Is anybody else here a transgender that we don't know about?
512780	515780	Have we met all of them, or are there more lurking about?
516780	518780	All right, well...
518780	520780	I mean, I think they all are. They're just more afraid to say it.
520780	521780	Yeah.
521780	524780	There's a couple of trans-scientologists, people who...
524780	527780	They identify as Scientologists, but they don't actually...
527780	529780	They're not Scientologists.
529780	534780	They want to be called Scientologists because they feel like a Scientologist,
534780	538780	but they're not going to pay for that crap.
538780	543780	So, I'm not being, like, flippant.
544780	546780	You can identify as a woman.
546780	548780	Look like a man. Not want to dress like a woman.
548780	549780	Right.
549780	550780	Just inside you're a woman.
550780	551780	Right.
551780	553780	But dress like a guy.
553780	554780	Right.
554780	556780	And that's...
556780	558780	Right.
558780	559780	Yeah.
559780	563780	Is that someone not following through with it, or is that somebody saying,
563780	566780	No, I just am a woman and I'll still dress like a guy named Tony?
566780	568780	I think it's just breaking it up into different strata.
568780	571780	Like, you can stop there if you want.
571780	572780	That's a thing.
572780	574780	And then there's people of that...
574780	579780	That are in that situation that therefore want to...
579780	580780	I don't know, there's a different language for it.
580780	582780	They take steps medically, hormones and stuff.
582780	583780	Transition.
583780	585780	Yeah, they transition.
585780	586780	Our friend...
586780	589780	I heard it said a long time ago that nobody...
589780	592780	I mean, very few people would be completely heterosexual
592780	597780	if it was a sliding scale from zero to 100 or from left to right
597780	602780	that people's sexuality tends to be somewhere along a sliding scale
602780	605780	that nobody is completely masculine or completely feminine.
605780	609780	Where do you feel you fall on the scale, Dan?
609780	616780	How close to totally masculine or toward the middle into the nether region?
616780	623780	You know, I think Mark Ruffalo is a real charming piece of...
624780	626780	I wouldn't mind if he pulled up on his motorbike
626780	628780	and showed me at a garden.
632780	635780	I could surrender to...
635780	638780	Sexually speaking, sexually...
638780	643780	I've never even had the time or energy to examine
643780	647780	where in the spectrum between hetero and homo I would fall
647780	651780	because there's too much going on in the hetero side
651780	654780	with me and my various kinks and things.
654780	661780	I'm sort of caught between hetero and asexual.
661780	664780	I feel like some weird shit happened to me
664780	667780	when I was a kid involving maybe hanging out under the table
667780	671780	while 70s pantyhose clad women hung out.
671780	675780	There's some kind of leg fetish thing that I almost feel is like...
675780	678780	I really like fully clothed women.
678780	681780	It's very, very strange.
681780	684780	There are things that I consume as pornography
684780	687780	that you would not consider pornography.
687780	691780	Let's just say for Thanksgiving I invited Mark Ruffalo over
691780	696780	and he was wearing nice trousers.
696780	698780	Oh, nice trousers.
698780	701780	And let's say that you dropped your napkin under the table
701780	704780	and you saw that Mark Ruffalo was wearing kind of a high heel
704780	706780	and he was...
706780	710780	No, I like the feminine leg.
710780	713780	Have you seen Mark Ruffalo's leg?
713780	717780	Well, if he could pass, there's guys on YouTube that do that.
717780	719780	You're clicking around and you're like,
719780	722780	here's what peels my banana.
722780	724780	Legs and tights.
724780	727780	They do a little shoe play across the leg.
727780	729780	You find something and it's like,
729780	731780	oh, wow, that's pretty good.
731780	734780	It's like, dude, guy, guy, dude.
734780	736780	And you're like, what?
736780	738780	God damn it.
738780	742780	You got me, Michael.
742780	744780	Yeah.
744780	746780	You know, you have to look closely for that Adam's apple
746780	751780	right on the back of the calf.
751780	752780	I didn't know that.
752780	754780	What is shoe play?
754780	759780	Shoe play is dangling, dipping, heel popping.
760780	762780	Those are the three subtypes of shoe play.
762780	764780	I'm glad you asked.
764780	767780	Dan, would you please elucidate
767780	770780	what is the difference between dangling and dipping?
770780	771780	Dangling and dipping.
771780	776780	Dangling is leg crossed shoe hanging off the toe, you know.
776780	779780	Sexy secretary, librarian or something like, you know.
779780	782780	And is the whole woman in frame or just a leg?
782780	786780	Just a leg is fine with this old timer.
787780	791780	We have a colloquy here.
791780	794780	How many other people are into dangling and dippins?
794780	796780	I dated a shoe fetishist.
796780	797780	You dated a shoe fetishist?
797780	798780	Yeah.
798780	799780	Wow.
799780	801780	And so did you dangle and dip and pop in the whole
801780	803780	sweep swab and the flip flap?
803780	807780	I don't know about the vernacular with it.
807780	809780	Dangling, dipping, heel popping.
809780	810780	Okay, so what's dipping?
810780	811780	What is dipping?
811780	815780	Dipping is like shoe on the floor as far as I understand it.
815780	817780	Do you have my heels on right now?
817780	818780	Yeah.
818780	819780	Can you dangle and dip for us up there?
819780	821780	Let's walk over to the stage.
821780	824780	Well, it's an audio podcast.
824780	826780	Yeah, but...
826780	829780	I don't think she's going to be able to dip with those shoes.
829780	830780	Yeah, yeah.
830780	833780	If you're like dipping into the shoe.
833780	837780	Just imagine like a looser, like a high heel shoe
837780	840780	or like a flat or something that had like easy,
840780	842780	like you can get your foot in and out of it.
842780	845780	So dipping is like the woman is like in and out,
845780	846780	you know, like kind of...
846780	847780	Do you want the shoe?
847780	848780	I don't.
848780	849780	I don't.
849780	853780	It's an audio podcast and also I'm getting weirdly like a...
853780	856780	It's making me nervous.
856780	857780	Lauren, right?
857780	858780	Yeah.
858780	860780	Lauren from the front row came up and offered to dip
860780	862780	and dangle and dingle and scrape scrub.
862780	864780	The second round I just offered up a shoe.
864780	866780	I just produced a high heel.
866780	869780	Yeah, we're getting to the city limits of where Aaron's
869780	870780	not going to be very happy listening to you.
870780	871780	Get the shoe up here.
871780	872780	Fuck it.
872780	874780	Let's do this.
874780	878780	I want to know about dangles and dips and scoops
878780	879780	and squeeze and the whole thing.
879780	881780	What's your name, madam?
881780	882780	Annie.
882780	884780	Well, this is a weird choice for a podcast to make.
884780	885780	I'm just...
885780	886780	I'm worried as a producer.
886780	887780	Like what are we...
887780	888780	What are people listening to?
888780	890780	We're bringing women up on stage and we're...
890780	891780	And also just so Aaron knows,
891780	893780	I'm not like Howard Sturning or anything.
893780	896780	I'm not even going to look or anything.
896780	898780	Like Aaron, if you're listening, like I'm not...
898780	899780	This is not like...
900780	904780	Aaron, if you're listening, Dan has his pants down already.
908780	909780	That's very important to me.
909780	912780	I wouldn't tolerate the equivalent with Aaron, you know?
912780	914780	I was a little upset when she was fucking around
914780	915780	with that cat shirt guy.
915780	916780	Wait a minute.
916780	917780	The cat shirt guy.
917780	918780	Okay, fuck it.
918780	919780	He was hot.
919780	920780	No, no, no.
922780	923780	Anyways, okay.
923780	924780	What's your name, ma'am?
924780	925780	Annie.
925780	927780	Annie's dangling right now.
928780	930780	She was dangling from her toe.
930780	931780	That's a dangle.
931780	932780	This is very difficult to do, actually.
932780	933780	All right, yeah.
933780	934780	Okay, now give us some dipping, Annie.
934780	935780	Okay, so what's dipping?
935780	936780	Dipping is...
936780	938780	You have to stand up and then you're...
938780	941780	Pretend you're checking somebody into a hotel
941780	942780	and you're working on the computer
942780	945780	and you're kind of absentmindedly like...
947780	948780	That's dipping.
950780	951780	All right.
951780	953780	Although now I'm wondering what heel popping actually is
953780	954780	because that involves...
954780	956780	I thought this was heel popping
956780	958780	where it's like where you've got the...
958780	960780	No, that's Nancy Drew...
960780	962780	If your heel pops out of it,
962780	963780	I can't do it in these shoes.
963780	965780	Then how is that different going?
965780	966780	I'm so confused.
966780	968780	That's where your heel sort of pops out.
968780	969780	Okay.
970780	972780	Somehow I'm still not turned on.
972780	973780	I don't understand.
976780	978780	Not because you're not beautiful in sexy women.
978780	980780	No, I don't know why this isn't doing anything for you.
980780	982780	Yeah, I've never got the feet thing.
982780	983780	I mean, I like feet.
983780	985780	I'm not averse to feet.
985780	987780	I've never seen the allure of...
987780	988780	Oh, I know what heel popping is.
988780	989780	I just realized.
991780	993780	Heel popping is the precursor to a dangle
993780	996780	because you can't dangle unless you pop the heel.
996780	999780	So heel popping enthusiasts just want to see that
999780	1001780	popping of the heel over and over again.
1001780	1002780	I just want to see this moment.
1002780	1003780	Yeah, that moment.
1003780	1004780	Yeah, yeah.
1004780	1005780	And then back on and off.
1005780	1007780	But as far as I've been told, once you pop,
1007780	1008780	you can't stop.
1009780	1010780	All right, come on.
1010780	1011780	Let's thank these ladies.
1011780	1012780	All right, sit the fuck down.
1012780	1013780	Thank you very much.
1016780	1018780	Our poor listeners, they're like,
1018780	1020780	do you want to welcome us into this world?
1020780	1021780	What are you doing?
1021780	1024780	You got people up on stage showing us shoe things?
1024780	1025780	Our job is not to care about the listeners.
1025780	1028780	It's our job to reward the live audience then.
1028780	1030780	All right, start the laser show.
1031780	1034780	Whoa, too soon.
1034780	1038780	Oh, interesting take on the Jimmy Kimmel situation visually.
1038780	1039780	I'm not sure.
1039780	1040780	I'm not sure.
1040780	1041780	I'm not sure.
1041780	1042780	I'm not sure.
1042780	1043780	I'm not sure.
1043780	1047780	I was just talking to the Jimmy Kimmel situation visually.
1047780	1051780	Huh, I never thought about that, laid out in that diagram.
1051780	1053780	Oh, that brings it all together.
1053780	1055780	Good night, folks.
1056780	1060780	Dan, for the listener, describe the Jimmy Kimmel situation.
1061780	1064780	Well, you're asking as a joke because you think I improvised
1064780	1066780	the words Jimmy Kimmel situation, but there is one.
1066780	1067780	There was one.
1067780	1068780	I don't know.
1068780	1069780	I said, I don't.
1069780	1072780	I feel like I'm part of the problem saying there was one.
1072780	1074780	You know, the tabloid streak.
1074780	1077780	Jimmy Kimmel did a segment that was sort of like Kids Say the Darnedest Things.
1077780	1082780	He was having kids talk about how to handle the various world crises,
1082780	1086780	one of them being America's trillion-dollar debt to Japan,
1086780	1088780	or to China.
1088780	1092780	And one of the kids kind of half through a chuckle
1092780	1095780	and like a little kid flustery thing said, like,
1095780	1097780	I don't know, maybe we should kill all the people in China.
1097780	1100780	And Jimmy was like, yeah, that's an interesting answer.
1100780	1101780	I don't know.
1101780	1102780	Moving on.
1102780	1107780	Flash cut two headlines saying, like, you know,
1107780	1111780	White House apologizes to China for the, you know,
1111780	1114780	genocide jokes on the thing.
1114780	1116780	Asian Americans in comment section saying,
1116780	1117780	oh, that's a funny joke.
1117780	1118780	How about this one?
1118780	1120780	Let's kill all the Jews.
1120780	1123780	No comment on any of this.
1123780	1125780	I'm out.
1126780	1130780	All I can say is I don't care what you find funny.
1130780	1132780	I don't care what any of us think are funny.
1132780	1134780	I don't care about the empirical definitions of humor.
1134780	1136780	But I just got one question.
1136780	1138780	Are we going to be fucking cone heads?
1138780	1140780	What are we going to do?
1140780	1143780	What is this world going to look like in 2070?
1143780	1145780	Do we really think we're going to achieve some world
1145780	1148780	where everyone just kind of quietly glides around
1148780	1152780	and someone like emits a proton and it's the equivalent of a fart
1152780	1155780	and everyone like titters and you...
1155780	1158780	Do you really think that once a noose starts tightening
1158780	1162780	it ever gets loose, linguistically, verbally, socially?
1162780	1163780	Do you really...
1163780	1165780	Have you ever experienced anything that indicated to you
1165780	1169780	that once people started introducing the concept of limitation
1169780	1171780	anything ever got more liberated?
1171780	1173780	I know we all think that we are advanced
1173780	1176780	because they didn't have the Seinfeld masturbation episode
1176780	1177780	in Victorian England.
1177780	1181780	But there's another way of looking at this
1181780	1184780	is that we are becoming insects.
1184780	1186780	We are envying everything that ants have
1186780	1189780	and not embracing anything that primates have.
1189780	1191780	And we are just looking so forward
1191780	1193780	to the day when we have a hive mind
1193780	1196780	and we just barf trophallaxis into each other's mouths
1196780	1198780	and that you can tell from the chemical where you've been
1198780	1199780	and where you're going.
1199780	1201780	And we just love it. We can't wait.
1201780	1204780	We're just sanding down the little bumps and edges.
1204780	1206780	We're just taking so much glee in it, too.
1206780	1207780	That's the weird thing.
1207780	1210780	There's a primatological glee taking a gazelle femur
1210780	1213780	and smashing a racist joke's head.
1213780	1215780	That's a racist joke. I'm a racist.
1215780	1220780	And it's like you're emitting a pheromone.
1220780	1223780	You're getting flushed and excited.
1223780	1226780	And it's like by bashing the world around you,
1226780	1230780	trying to round up all the little anomalies
1230780	1233780	and get all the air bubbles out of the waterbed mattress.
1233780	1236780	This finish line that you think you're headed towards,
1236780	1239780	I feel like I can see it at 40.
1239780	1242780	I feel like I know it's not going to be that fun.
1242780	1246780	Yeah, we're very willfully and kind of gleefully sacrificing
1246780	1248780	liberty for security.
1248780	1250780	We're not getting any smarter. That's the thing.
1250780	1253780	None of these people that are learning how to be offended
1253780	1255780	know where Guatemala is on a map.
1255780	1259780	But the thing is, someone's going to go online after the show
1259780	1262780	when they hear this and go on a forum and say,
1262780	1264780	we are getting smarter, man.
1264780	1267780	Life is evolution. Jack and everything is getting better.
1267780	1270780	I was saying that the English language,
1270780	1273780	and I would say all languages are probably degrading
1273780	1275780	because we're all truncating language.
1275780	1278780	And people say, no, it's not. Language is always evolving.
1278780	1280780	I fucking disagree with that.
1280780	1282780	The English language is a huge language,
1282780	1285780	and we don't use any of the words.
1285780	1288780	Instead of having five words that mean one thing,
1288780	1291780	we now use one word to mean 11 things.
1291780	1293780	That's not the growth of the language.
1293780	1295780	That is the shrinking of the language.
1295780	1297780	And if anyone wants to go online with me
1297780	1299780	and have a conversation about that, I'd love to.
1299780	1304780	I don't think that we're evolving at all with technology.
1304780	1306780	It's not just me being grumpy old man.
1306780	1310780	I really do think that the language dies every time.
1310780	1314780	People say, oh, what's the fucking word that people use?
1314780	1315780	Awesome sauce?
1315780	1316780	Awesome sauce.
1316780	1317780	Amaze balls.
1317780	1318780	Amaze balls.
1318780	1320780	No, I will stand by amaze balls because that's amaze balls.
1320780	1321780	Amaze balls.
1321780	1323780	Is it a new way to say it?
1323780	1326780	There's something like 180 synonyms for the word nice,
1326780	1329780	and we use nice for 180 of them
