start	end	text
1329780	1332780	because we don't know all the fucking words anymore.
1332780	1334780	Oh, what's that?
1334780	1336780	He was a...
1336780	1338780	What's that? Not taciturn. What's the fucking word?
1338780	1339780	Reticent.
1339780	1340780	Reticent.
1340780	1342780	I was reticent to do that.
1342780	1343780	No, you were reluctant to do that.
1343780	1345780	Reticent doesn't mean reluctant.
1345780	1346780	Now it does.
1346780	1347780	We've made reticent mean reluctant
1347780	1349780	because we've misused it for so long
1349780	1351780	that the dictionaries have just said, fuck it.
1351780	1353780	Now it means reluctant.
1353780	1355780	And that's not the growth of a language.
1355780	1357780	That's a language dying a little bit
1357780	1360780	because reticent is a better word than...
1360780	1363780	We don't need two words to say reluctant.
1363780	1364780	I love this great show.
1364780	1366780	We went from Uncle Creepy's foot fetish corner
1366780	1371780	to Grandpa Grumpy's vocabulary police.
1371780	1373780	Fucking...
1373780	1376780	Also, the dictionary in your iPhone sucks.
1376780	1377780	Don't use that dictionary.
1377780	1381780	Have a fucking real Merriam-Webster giant OED.
1381780	1383780	Have a big motherfucking dictionary with you
1383780	1387780	at all times and use it.
1387780	1390780	The iPhone dictionary is as good as fucking Google Weather.
1390780	1393780	Google Weather says it's 73 and it's fucking 45 now.
1393780	1394780	They don't know.
1394780	1396780	Don't trust your iPhone for fuck...
1396780	1398780	Although today I was experimenting with Siri
1398780	1400780	and she's quite funny if you say dirty things to me.
1400780	1401780	Oh, yeah.
1401780	1404780	You can have a good time in bed just hanging out.
1405780	1406780	Aaron and I...
1406780	1407780	Aaron and I...
1407780	1411780	We talk to Siri and get Siri to talk to the other Siri.
1411780	1413780	You know, like, I'll say to Siri,
1413780	1414780	like, why don't you go fuck yourself?
1414780	1416780	And then she'll turn on her Siri
1416780	1419780	and then Siri's response, which will be like something like,
1419780	1420780	oh, I think you should watch your language.
1420780	1422780	And then Siri will say to Siri,
1422780	1425780	I'm sorry, would you like me to look that up on the internet?
1425780	1429780	How do you like it, bitch?
1429780	1432780	I'd blush if I could.
1432780	1433780	I turned mine on in Italian.
1433780	1434780	Have you tried the Italian lady?
1434780	1435780	No.
1435780	1436780	Talk to her.
1438780	1440780	There's my fetish.
1440780	1443780	Siri, do they...
1443780	1444780	Il Ristorante?
1448780	1449780	It's fucking good.
1450780	1451780	It's very sexy.
1451780	1454780	This episode of Harmontown is brought to you by Fulton and Roark.
1454780	1458780	Jeff, you're sick of spilling all your colognes all over the place.
1458780	1459780	You hate liquid colognes.
1459780	1460780	Is that correct?
1460780	1461780	It's my nemesis.
1461780	1464780	It's the thing that gives me nightmare dreams all night long.
1464780	1466780	I can't remember how many times I've walked in on you
1466780	1469780	just covered in sticky wet cologne.
1469780	1473780	I have traveled and broken a bottle of the cologne that I wear,
1473780	1478780	and then my luggage smells like a French whorehouse for the rest of time.
1478780	1479780	Yeah.
1479780	1481780	But Fulton and Roark is a men's fragrance and grooming company
1481780	1484780	that specializes in solid colognes, shave and shower products,
1484780	1487780	all designed to make getting ready easier and more enjoyable.
1487780	1490780	Now, when you say solid colognes, do you mean like solid in the jazz sense?
1490780	1493780	Like, wow, that jazz solo was solid.
1493780	1497780	You know, I do mean that, but I also mean physically solid as well.
1497780	1499780	Oh, like a little, like you're talking about a wax-based cologne
1499780	1503780	that travels in a little small package that I can't spill all over my luggage
1503780	1507780	and smell like a Mexican tit house.
1507780	1510780	So these are travel-friendly wax-based colognes that can go anywhere?
1510780	1514780	Plus, there's nothing to break or spill, and of course, they all smell fantastic.
1514780	1515780	Fantastic.
1515780	1517780	Like a Mexican tit house.
1518780	1522780	I mean, there's different levels of Mexican tit house.
1522780	1524780	I mean, there's the high-quality ones.
1524780	1526780	There's the ones that you wish you didn't go to.
1526780	1527780	Right, yeah.
1527780	1529780	Titas Fantástico.
1529780	1532780	Is one of their fragrances called Mexican tit house?
1532780	1533780	Yeah.
1533780	1535780	Que Fantástico.
1536780	1539780	Fulton and Roark's bar soap is designed to exfoliate the skin
1539780	1541780	with or without a washcloth.
1541780	1542780	Also, you don't even have to touch it.
1542780	1544780	It comes in desert in the night.
1544780	1546780	Well, that's amazing.
1546780	1549780	That's literally unbelievable.
1549780	1552780	Did you know, Spencer, that GQ magazine just named their shave cream
1552780	1554780	the very best on the market today?
1554780	1556780	Well, yeah, of course I knew that.
1556780	1557780	Why would you ask?
1557780	1558780	I mean, who am I asking?
1558780	1559780	I mean, this guy.
1559780	1561780	You go to this house, it's like an episode of Hoarders.
1561780	1564780	So many back issues of GQ magazine there.
1564780	1567780	Right, and I got to tell you, my house is made out of bricks of cologne.
1567780	1569780	Wax-based cologne, I hope.
1569780	1570780	Yeah, yeah.
1570780	1573780	Try it yourself at FultonandRoark.com and save 15% off your purchase
1573780	1576780	by using the code FAIRAL, F-E-R-A-L, at checkout.
1576780	1577780	That's FAIRAL at checkout.
1577780	1580780	Smell good for once, you fucking bums.
1580780	1584780	Fulton and Roark, get your smellin' good.
1586780	1589780	Fulton and Roark, time to get your stink on.
1589780	1591780	Off.
1591780	1595780	Get your bad stink off and get your good stink on.
1595780	1598780	Fulton and Roark, not by men.
1599780	1600780	Different corporation.
1600780	1603780	By Fulton and Roark.
1603780	1609780	When it comes to your health, brushing your teeth is one of the most important parts of your day.
1609780	1610780	Quip knows that.
1610780	1614780	They've combined dentistry and design to make a better electric toothbrush.
1615780	1626780	Quip is the new electric toothbrush that packs just the right amount of vibrations into a slimmer design at a fraction of the cost of bulkier, traditional electric brushes.
1626780	1634780	One nice thing about quip toothbrushes is that they vibrate you with cues to switch tooth sides.
1634780	1636780	Like which side you're brushing?
1636780	1637780	Yes.
1637780	1640780	It also comes with a mount that suctions to your mirror.
1640780	1650780	Yeah, and I've been using my quip for a little bit so I can testify to the fact that even though it doesn't sound like a suction sticky holder on your mirror would actually stay on your mirror, it does.
1650780	1655780	Millennials have descended on your least likable activity.
1655780	1657780	The kids are calling it quip.
1658780	1661780	Millennials are calling it brush toothing.
1661780	1662780	And Time Magazine.
1662780	1664780	I'm sure the Xers think it's anything but.
1664780	1670780	And Time Magazine is calling it one of the best inventions of the year. Just think about that.
1670780	1676780	Quip is backed by a network of over 10,000 dental professionals including dentists, hygienists, and dental students.
1676780	1680780	Here's a thing that you're getting with quip that I noticed when I got my kit.
1681780	1683780	You got a little easy to read booklet there.
1683780	1687780	It's kind of indoctrinating you into a toothbrushing regimen.
1687780	1707780	So it's like if you're into self-care this year, and you should be because the world's dying, it's kind of cool to be in the hands of a bunch of people that have studied toothbrushing to the point where, okay, they're going to send you a new toothbrush head the minute yours is going to be worn out.
1707780	1710780	A new battery the minute this thing stops vibrating.
1710780	1716780	It's a subscription to dental security.
1716780	1718780	Quip starts at just $25.
1718780	1727780	And if you go to getquip.com slash harmontown right now, you'll get your first refill pack for free with a quip electric toothbrush.
1727780	1732780	That's your first refill pack free at getquip.com slash harmontown.
1732780	1733780	Spell it, spell it you guys.
1733780	1739780	G-E-T-Q-U-I-P dot com slash harmontown.
1739780	1740780	All right.
1740780	1741780	We have a guest here.
1741780	1744780	Did you know that Feral Audio is a whole network, Jeff?
1744780	1746780	You got to be shitting me.
1746780	1748780	I thought we were the only thing on Feral Audio.
1748780	1749780	No, no.
1749780	1753780	We're part of a fucking union of brothers and sisters.
1753780	1754780	Well, that sounds like bullshit.
1754780	1761780	Represent the cutting edge of unpaid comedy types.
1762780	1766780	And here's another member of our family, Mr. Brody Stevens.
1766780	1767780	Yeah.
1785780	1790780	You know, thank you for having me here, Dan and Jeffrey.
1790780	1791780	I am wearing a hat.
1791780	1798780	I just flew in from Toronto, and I was able to wear kind of a knit cap thing.
1798780	1799780	It was cold there.
1799780	1800780	Yeah.
1800780	1805780	So I was bringing the energy of Toronto with me here to meltdown.
1805780	1806780	What's the Toronto scene like?
1806780	1809780	Is it like a Seattle in the north?
1809780	1811780	You know, you would think so.
1811780	1812780	From the hat.
1812780	1813780	I mean, well, there you go.
1813780	1814780	Well, it was cold.
1814780	1817780	I mean, I would say it's like more.
1817780	1819780	I mean, it's like Buffalo, obviously.
1819780	1820780	It's near.
1820780	1821780	It's near.
1821780	1822780	They share the Niagara Falls.
1822780	1823780	I learned about that.
1823780	1827780	I've been to Vancouver, but I've been to Toronto a couple times.
1827780	1829780	It's like America, you know?
1829780	1834780	I was doing shows last night, and I think they are.
1834780	1838780	It's just a little different up there.
1838780	1845780	You know, it's like it is America, but it's not right there.
1845780	1848780	I like Canadian comedy audiences.
1848780	1850780	I think Canadians have an awesome sense of humor.
1850780	1852780	I think they're quite game, especially.
1852780	1853780	Yeah.
1853780	1854780	I'm not ripping Canada.
1854780	1857780	No, you know, Brody, you were fucking shitting all over Canada.
1857780	1858780	Let's be honest about it.
1858780	1859780	No, I'll give you it.
1859780	1864780	Like last night, I was doing a show in a club, an underground pot club.
1864780	1865780	What?
1865780	1866780	It's a comedy club.
1866780	1869780	There's like six clubs up there where they smoke pot.
1869780	1871780	They do shows.
1871780	1874780	Underground meaning not legitimate, like secret, speakeasy.
1874780	1877780	Kind of, yeah, but the cops like let it go.
1877780	1880780	But they have a big comedy scene up there for that in Toronto.
1880780	1883780	So I was doing a show last night, and they're smoking pot in there.
1883780	1886780	And I've done shows where they smoke pot at the ice house.
1886780	1889780	I've been there in order to pot.
1889780	1891780	I know we're a podcast live audience.
1891780	1892780	I'm going to focus more on the podcast.
1892780	1893780	Oh, good.
1893780	1894780	That's my thing.
1894780	1896780	Well, I think they were left out of their foot fetish stuff.
1896780	1897780	Oh, okay.
1897780	1899780	I don't really have a foot fetish.
1899780	1904780	I mean, I have one time I have, I did something with a sock, I think,
1904780	1906780	one time, a girl's sock.
1906780	1907780	I don't know.
1907780	1914780	On the tree of foot fetishes, because I'm a heavy duty leg man,
1914780	1919780	and like a nylon guy, and because the leg terminates at this beautiful part
1919780	1922780	of the equally feminine part of the feminine leg.
1922780	1926780	You love legs and you love terminus.
1926780	1931780	But then there's a branch of the whole, when you say foot fetish,
1931780	1936780	it gets into like, I want someone to walk in chocolate and then walk on my face
1936780	1941780	and masturbate me with their toes, and I want to eat the toes
1941780	1943780	when you put the other toe in the butt and stuff.
1943780	1947780	I'm not that focused on the foot.
1947780	1950780	It's just like the foot is a beautiful little period on the sentence
1950780	1952780	that is a woman's leg.
1952780	1956780	I got called out for looking at a girl's foot in ninth grade.
1956780	1960780	I remember at Vivoli, I grew up here in the valley, San Fernando Valley,
1960780	1964780	and she was like, you know, in the 80s, I'm not going to say like a stoner's chick,
1964780	1968780	but she smokes cigarettes, and I remember I was like looking at her feet.
1968780	1969780	She was, why are you looking at my feet?
1969780	1972780	And I was just like, just into it.
1972780	1976780	I was really, I don't think I need the dipped in chocolate.
1976780	1977780	I like looking at them.
1977780	1980780	I would do what you said with the feet on the penis.
1980780	1981780	I'm okay with that.
1981780	1984780	When I was in high school, like late high school and early college,
1984780	1989780	my friend Chris, he would have these parties, and his father was a sheriff,
1989780	1994780	and they were awesome because we went into the parents' room one time
1994780	1999780	and there was tons of bondage gear, like lots of fucking chains and whips
1999780	2003780	and strap-ons and all kinds of good like get it on kind of shit.
2003780	2007780	Between, you know, like late 40s husband and wife,
2007780	2009780	they didn't care that we would have these parties,
2009780	2011780	and everybody would get naked in their jacuzzi,
2011780	2013780	and everybody would suck each other's toes.
2013780	2016780	Shrimp jobs? Shrimpin?
2016780	2018780	Shrimp, shrimp, shrimp job.
2018780	2020780	We called it shrimp jobs.
2020780	2024780	Which made the unsexy even less sexy.
2024780	2027780	But we would all suck each other's toes, and it was good fun.
2027780	2032780	Because in the jacuzzi, you're all boiled up, you know, you're all, you know.
2032780	2035780	Like all the pathogens have been cooked up.
2035780	2038780	If you're going to suck a toe, you should...
2038780	2040780	Yeah, that would be the spot to do it.
2040780	2044780	Yeah, a pool of hot water would be a good place to get started, I think.
2044780	2049780	When you're looking at feet on the internet, like what is the...
2049780	2051780	What's going on through your mind?
2051780	2053780	What's the fantasy that's happening?
2053780	2058780	You know, I'm looking, and I just like, it doesn't go beyond that.
2058780	2062780	A fetish is like, it's like the object itself is like this thing
2062780	2065780	that's more important than anything, and it's a really interesting question
2065780	2069780	because I think, and I think that's part of what makes me, you know,
2069780	2073780	potentially asexual sometimes, my behavior.
2073780	2077780	Like if I'm working, and I'm too busy, and then I'm so, I'm like,
2077780	2083780	okay, I'm going to gratify myself because, you know, well, a nice excuse is,
2083780	2086780	hey, who wants to get prostate cancer?
2086780	2088780	You got to come constantly, right?
2088780	2090780	That's true.
2090780	2091780	So like...
2091780	2092780	Is that true?
2092780	2094780	Yeah, they got Ernest Borgnine.
2094780	2097780	I think he recently passed, maybe, but he was like 95.
2097780	2098780	He was on Conan.
2098780	2102780	He said he masturbated like all the time, every day,
2102780	2105780	and that's what led him to be happy and live that long.
2105780	2107780	You guys remember that a couple years ago?
2107780	2108780	Thank you. Thank you.
2108780	2109780	Thank you. Thank you. Thank you.
2109780	2110780	Thank you. Thank you.
2110780	2111780	We're all going to live forever then.
2111780	2113780	Last night in Toronto, they wouldn't have agreed.
2113780	2115780	They would have just left me out there hanging.
2115780	2117780	The Canadian audience are a little more laid back.
2117780	2118780	Yeah.
2118780	2119780	They're not responsive.
2119780	2120780	Well, they were also super high.
2120780	2122780	That's true.
2123780	2125780	Also, Toronto, they have the street meat.
2125780	2127780	They have those fucking carts with the hot dogs and stuff,
2127780	2128780	and it's quite good.
2128780	2129780	Oh, yeah.
2129780	2132780	I had shawarma last night, and I love Zancou.
2132780	2133780	It's right up the street.
2133780	2134780	I go there all the time.
2134780	2137780	I'm a proud member of the Zancou Army,
2137780	2139780	but I went to a place...
2139780	2143780	I mean, it said it was falafel king.
2143780	2145780	It looked like a chain thing, but it wasn't,
2145780	2147780	and I went in there, and they're just very nice,
2147780	2153780	and I had a chicken tiki marsala or something like that.
2153780	2156780	It was good.
2156780	2160780	It was better than Zancou, and I hate to say that.
2160780	2161780	You're welcome.
2161780	2163780	So Toronto is multicultural.
2163780	2164780	It's great.
2164780	2165780	People get along.
2165780	2167780	I grew up here in Los Angeles.
2167780	2169780	People don't get along.
2169780	2170780	I lived in New York.
2170780	2172780	People actually get along in New York.
2172780	2173780	You have to.
2173780	2174780	You're together.
2174780	2177780	I grew up here, valley, busing.
2177780	2178780	I've been all around.
2178780	2182780	And you were talking about, you know, asexuality
2182780	2185780	and things of that, and if you do listen to my podcast,
2185780	2193780	maybe nine months ago, I did come out on my podcast.
2193780	2198780	I am 10% gay.
2198780	2199780	Thank you.
2199780	2200780	Thank you.
2200780	2203780	I mean, I went to Bangkok, and I pushed it to the limit.
2204780	2207780	You were talking about strap-ons and Adam's apples.
2207780	2212780	I got pulled into the night of Bangkok, and I went there.
2212780	2214780	Well, let's be more specific, Brody.
2214780	2215780	I can't be too...
2215780	2216780	Well, you know what?
2216780	2220780	I think the more I talk about it, the more comfortable I'll get with it,
2220780	2226780	and I can really chisel down that story for my one-man show.
2226780	2230780	Wait, you had a ladyboy encounter in Bangkok?
2230780	2231780	You know what?
2231780	2232780	Yeah.
2232780	2233780	You were up to it.
2233780	2234780	Yes.
2234780	2235780	Good for you.
2235780	2236780	Three people applauding me.
2236780	2238780	Everyone else, gay bash.
2238780	2240780	10% gay bashing.
2240780	2245780	But I only call the Bangkok experience because we all go there.
2245780	2249780	If you ask, that is almost accepted over there.
2249780	2250780	So I count that.
2250780	2252780	It's like a 4%.
2252780	2255780	Now, did you go out in search of a ladyboy experience,
2255780	2258780	or did the ladyboy find you by accident?
2258780	2259780	Oh, you go.
2259780	2260780	You hang out.
2260780	2264780	I was over there working on a project, and you hang out, and you go.
2264780	2265780	It's very...
2265780	2268780	You know, it's a nice culture.
2268780	2273780	They're very outgoing, massage, and haircut late at night.
2273780	2274780	All that stuff.
2274780	2276780	Like, it's a good vibe.
2276780	2278780	So you go to these club...
2278780	2282780	I could go for a late-night haircut.
2282780	2286780	And then a hand job from a guy named Kim.
2286780	2287780	Oh, it's funny.
2287780	2288780	You know, funny, you should...
2288780	2291780	I'll tell you about that off camera.
2291780	2293780	Funny, you should say Kim.
2293780	2294780	But I'll get back to that.
2294780	2295780	Why is that?
2295780	2299780	Well, it's a code word for something that I...
2299780	2300780	No, it's...
2300780	2302780	I'll tell you off camera.
2302780	2303780	Off mic.
2303780	2306780	Look, if you're coming on to me, just fucking get it out.
2306780	2307780	No, I'm not...
2307780	2308780	No, I'm not gay like that.
2308780	2309780	See?
2309780	2310780	See?
2310780	2311780	It's not that way.
2311780	2313780	They're talking about, do I see a guy, like, whoever you're talking about,
2313780	2317780	like, oh, he's got great legs and great chest,
2317780	2322780	and I want to kiss his thick beard.
2322780	2323780	No, I'm not into that.
2323780	2324780	All right?
2324780	2326780	So that's not what a lady boy is.
2326780	2327780	Thank you.
2327780	2329780	Because they take hormones.
2329780	2330780	Now...
2330780	2335780	So I went over there to see, all right?
2335780	2337780	And I walk around.
2337780	2338780	I see my mannerisms.
2338780	2341780	You know, I got picked on a lot because I was a nice guy,
2341780	2344780	like, I'm a happy guy, and kids are cruel.
2344780	2346780	And I grew up here in the Valley, a Jewish kid.
2346780	2348780	I should have been sheltered by Libra's school.
2348780	2350780	You sound like you're from Chicago.
2350780	2351780	How'd you get that?
2351780	2352780	Well, I was in Toronto over the weekend.
2352780	2354780	I think that's Chicago.
2354780	2356780	I think the Chicago jet stream.
2356780	2358780	You don't sound like you were raised in California.
2358780	2359780	I know.
2359780	2360780	I've heard that a lot.
2360780	2362780	I grew up in the Valley, I think because I'm kind of nasally.
2362780	2364780	I always would get New York.
2364780	2365780	New York City.
2365780	2367780	I lived in Brooklyn for three years.
2367780	2369780	Williamsburg, L-Train, before it got hip.
2369780	2371780	I was there.
2371780	2373780	Three years in Seattle.
2373780	2374780	Okay, sorry, Jeff.
2374780	2375780	So you're fucking this lady boy?
2375780	2378780	I'm the one, you know what?
2378780	2379780	I'll tell you what.
2379780	2382780	If I did that, that ain't so bad.
2382780	2384780	That ain't so bad.
2384780	2385780	I watch Locked Up Rock.
2385780	2387780	It ain't that bad.
2387780	2389780	Nobody in Hermitown is going to judge you.
2389780	2390780	Yeah.
2390780	2392780	Well, I feel like first three...
2392780	2393780	No, no, no.
2393780	2395780	But you know how hard that is?
2395780	2396780	I mean, it's...
2396780	2399780	I'm okay with it, and then I'll tell you what.
2399780	2402780	I came back to the mainland,
2402780	2406780	and I went a little further just to see.
2406780	2409780	Just to see that line and maybe go over it.
2409780	2412780	What did that entail?
2412780	2415780	There was a hotel in Hollywood, and...
2415780	2417780	Freaked out, doesn't it, people?
2417780	2418780	No, freaked out.
2418780	2419780	Brody, nobody...
2419780	2421780	This is why people stay in the closet.
2421780	2422780	Brody.
2422780	2424780	I'm 10% gay, and it's scary.
2424780	2427780	Brody, you're 50% gay.
2427780	2428780	No, I'm not Jeff!
2428780	2429780	How dare you!
2429780	2430780	Brody.
2431780	2435780	This audience is so accustomed to hearing so much worse
2435780	2436780	and so much more bizarre.
2436780	2437780	Oh, thank you.
2437780	2438780	Thank you.
2438780	2439780	Well, you know, I play baseball.
2439780	2441780	I just feel like it's going to come back on me.
2441780	2443780	It's okay to be gay, Brody.
2443780	2444780	I'm saying it's okay.
2444780	2447780	But I told you I'm not into hand-holding.
2452780	2454780	I am into human love.
2454780	2455780	That's good.
2455780	2456780	So...
2456780	2458780	What happened to the hotel?
2458780	2460780	You know, well, Kim...
2460780	2461780	Excuse me.
2461780	2462780	Kim!
2462780	2463780	Kim.
2463780	2465780	AKA, I can't give the name away, but...
2465780	2466780	You know what?
2466780	2467780	I'll tell you what.
2467780	2468780	The TS community...
2468780	2470780	I'm very active in the TS community.
2470780	2471780	What's TS?
2471780	2472780	Transsexual.
2472780	2473780	Oh, okay.
2473780	2474780	And...
2474780	2477780	When you say active in the community, what do you mean?
2477780	2479780	I just like saying that.
2481780	2482780	Because you know what?
2482780	2483780	It's very popular.
2483780	2485780	If you were to go...
2485780	2489780	Back in the day, my friends ran Taboo Video up in Seattle,
2489780	2493780	which was the number one grossing adult video store in Seattle.
2493780	2496780	This was right before DVDs started coming out.
2496780	2497780	And the number one...
2497780	2501780	And probably to this day, if you ask the guys who still make it,
2501780	2502780	the number one...
2502780	2503780	It's TS stuff.
2503780	2505780	That's the number one thing for whatever reason.
2505780	2508780	Does that mean, like, chicks with dicks?
2508780	2509780	Yeah, that's what it is.
2509780	2513780	Because you see a breast, and you're into that,
2513780	2516780	and you're into this face, and the hair, they look good.
2516780	2519780	They're like, there's no problems.
2519780	2521780	And then you go, is it a girl?
2521780	2522780	I don't know.
2522780	2523780	I'm in Bangkok.
2523780	2526780	Something got shaved down.
2526780	2527780	Is this...
2527780	2528780	You gotta like...
2528780	2530780	It's the 60s all over again.
2530780	2532780	It's rock and roll.
2532780	2533780	I'm a comedian.
2533780	2537780	I felt like I had to kind of do that to share that story with you
2537780	2540780	as a guy who wants to move on and...
2540780	2542780	Don't bring us into it.
2542780	2543780	Yeah.
2543780	2544780	Oh, no.
2544780	2545780	I mean...
2545780	2549780	You're following some sort of trail.
2549780	2551780	You're certainly going down some sort of...
2551780	2554780	I think that as you age and as you progress,
2554780	2558780	your fetishes do kind of start meandering towards more specific things.
2558780	2560780	Wouldn't you say?
2560780	2561780	Yeah.
